Country_Region,Last_Update,Confirmed,Deaths,Recovered,Active,Delta_Confirmed,Delta_Recovered,Incident_Rate,People_Tested,People_Hospitalized,Province_State,FIPS,UID,iso3,Report_Date_String,Delta_Deaths,Doses_Admin,Delta_Doses_Admin
Afghanistan,6/4/21,76628,3068,,,1509,,196.84373397777213,,,,,4,AFG,2021/06/04,34,626290,0
Afghanistan,6/5/21,77963,3104,,,1335,,200.27311207533864,,,,,4,AFG,2021/06/05,36,626290,0
Afghanistan,6/6/21,79224,3145,,,1261,,203.51239730457561,,,,,4,AFG,2021/06/06,41,630305,4015
Afghanistan,6/7/21,80841,3187,,,1617,,207.6661833598303,,,,,4,AFG,2021/06/07,42,630305,0
Afghanistan,6/8/21,82326,3251,,,1485,,211.48088483914586,,,,,4,AFG,2021/06/08,64,641295,10990
Afghanistan,6/9/21,84050,3305,,,1724,,215.90953490671487,,,,,4,AFG,2021/06/09,54,641295,0
Afghanistan,6/10/21,85892,3356,,,1842,,220.64130603459316,,,,,4,AFG,2021/06/10,51,641295,0
Afghanistan,6/11/21,87716,3412,,,1824,,225.32683835666154,,,,,4,AFG,2021/06/11,56,641295,0
Afghanistan,6/12/21,88740,3449,,,1024,,227.95731264273502,,,,,4,AFG,2021/06/12,37,641295,0
Afghanistan,6/13/21,89861,3527,,,1121,,230.83696271567288,,,,,4,AFG,2021/06/13,78,641295,0
Afghanistan,6/14/21,91458,3612,,,1597,,234.9393723200277,,,,,4,AFG,2021/06/14,85,662003,20708
Afghanistan,6/15/21,93272,3683,,,1814,,239.59921641664616,,,,,4,AFG,2021/06/15,71,662003,0
Afghanistan,6/16/21,93288,3683,,,16,,239.64031757736606,,,,,4,AFG,2021/06/16,0,662003,0
Afghanistan,6/17/21,96531,3842,,,3243,,247.97100909078043,,,,,4,AFG,2021/06/17,159,662003,0
Afghanistan,6/18/21,98734,3934,,,2203,,253.63012515740138,,,,,4,AFG,2021/06/18,92,662003,0
Afghanistan,6/21/21,103902,4215,,,5168,,266.9058000699285,,,,,4,AFG,2021/06/21,281,662003,0
Afghanistan,6/22/21,105749,4293,,,1847,,271.65041531053174,,,,,4,AFG,2021/06/22,78,765890,103887
Afghanistan,6/23/21,107957,4366,,,2208,,277.3223754898777,,,,,4,AFG,2021/06/23,73,765890,0
Afghanistan,6/24/21,109532,4452,,,1575,,281.3682709982426,,,,,4,AFG,2021/06/24,86,765890,0
Afghanistan,6/25/21,111592,4519,,,2060,,286.66004544092954,,,,,4,AFG,2021/06/25,67,765890,0
Afghanistan,6/28/21,115751,4730,,,4159,,297.34377840555806,,,,,4,AFG,2021/06/28,211,835694,69804
Afghanistan,6/29/21,117158,4794,,,1407,,300.9581117263641,,,,,4,AFG,2021/06/29,64,835694,0
Afghanistan,6/30/21,118659,4871,,,1501,,304.81391436639956,,,,,4,AFG,2021/06/30,77,886854,51160
Afghanistan,7/1/21,120216,4962,,,1557,,308.8135710689546,,,,,4,AFG,2021/07/01,91,886854,0
Afghanistan,7/2/21,120216,4962,,,0,,308.8135710689546,,,,,4,AFG,2021/07/02,0,886854,0
Albania,6/4/21,132372,2451,,,12,,4599.763708388352,,,,,8,ALB,2021/06/04,0,787321,0
Albania,6/5/21,132374,2451,,,2,,4599.83320592119,,,,,8,ALB,2021/06/05,0,787321,0
Albania,6/6/21,132379,2451,,,5,,4600.006949753284,,,,,8,ALB,2021/06/06,0,798624,11303
Albania,6/7/21,132384,2452,,,5,,4600.180693585377,,,,,8,ALB,2021/06/07,1,803682,5058
Albania,6/8/21,132397,2452,,,13,,4600.632427548822,,,,,8,ALB,2021/06/08,0,803682,0
Albania,6/9/21,132415,2452,,,18,,4601.257905344361,,,,,8,ALB,2021/06/09,0,816556,12874
Albania,6/10/21,132426,2452,,,11,,4601.640141774967,,,,,8,ALB,2021/06/10,0,816556,0
Albania,6/11/21,132437,2453,,,11,,4602.022378205574,,,,,8,ALB,2021/06/11,1,823053,6497
Albania,6/12/21,132449,2453,,,12,,4602.439363402599,,,,,8,ALB,2021/06/12,0,830281,7228
Albania,6/13/21,132459,2453,,,10,,4602.786851066787,,,,,8,ALB,2021/06/13,0,834868,4587
Albania,6/14/21,132461,2453,,,2,,4602.856348599625,,,,,8,ALB,2021/06/14,0,836430,1562
Albania,6/15/21,132469,2454,,,8,,4603.134338730975,,,,,8,ALB,2021/06/15,1,842535,6105
Albania,6/16/21,132476,2454,,,7,,4603.3775800959065,,,,,8,ALB,2021/06/16,0,842535,0
Albania,6/17/21,132481,2454,,,5,,4603.551323928001,,,,,8,ALB,2021/06/17,0,862628,20093
Albania,6/18/21,132484,2454,,,3,,4603.655570227257,,,,,8,ALB,2021/06/18,0,862628,0
Albania,6/19/21,132488,2454,,,4,,4603.794565292932,,,,,8,ALB,2021/06/19,0,862628,0
Albania,6/20/21,132490,2454,,,2,,4603.86406282577,,,,,8,ALB,2021/06/20,0,862628,0
Albania,6/22/21,132496,2455,,,6,,4604.072555424283,,,,,8,ALB,2021/06/22,1,890052,0
Albania,6/23/21,132497,2455,,,1,,4604.107304190701,,,,,8,ALB,2021/06/23,0,901429,11377
Albania,6/24/21,132499,2455,,,2,,4604.176801723539,,,,,8,ALB,2021/06/24,0,901429,0
Albania,6/25/21,132506,2455,,,7,,4604.42004308847,,,,,8,ALB,2021/06/25,0,922886,21457
Albania,6/26/21,132509,2456,,,3,,4604.524289387727,,,,,8,ALB,2021/06/26,1,922886,0
Albania,6/27/21,132512,2456,,,3,,4604.628535686983,,,,,8,ALB,2021/06/27,0,922886,0
Albania,6/28/21,132513,2456,,,1,,4604.6632844534015,,,,,8,ALB,2021/06/28,0,943439,20553
Albania,6/29/21,132514,2456,,,1,,4604.698033219821,,,,,8,ALB,2021/06/29,0,943439,0
Albania,6/30/21,132521,2456,,,7,,4604.941274584752,,,,,8,ALB,2021/06/30,0,955498,12059
Albania,7/1/21,132523,2456,,,2,,4605.01077211759,,,,,8,ALB,2021/07/01,0,974486,18988
Albania,7/2/21,132526,2456,,,3,,4605.115018416846,,,,,8,ALB,2021/07/02,0,974486,0
Algeria,6/4/21,130361,3504,,,385,,297.2814124398364,,,,,12,DZA,2021/06/04,7,75000,0
Algeria,6/5/21,130681,3510,,,320,,298.0111556297532,,,,,12,DZA,2021/06/05,6,75000,0
Algeria,6/6/21,130958,3518,,,277,,298.64283957852496,,,,,12,DZA,2021/06/06,8,75000,0
Algeria,6/7/21,131283,3527,,,325,,299.38398500578427,,,,,12,DZA,2021/06/07,9,2500000,2425000
Algeria,6/8/21,131647,3537,,,364,,300.21406788431466,,,,,12,DZA,2021/06/08,10,2500000,0
Algeria,6/9/21,132034,3544,,,387,,301.0966010546203,,,,,12,DZA,2021/06/09,7,2500000,0
Algeria,6/10/21,132355,3552,,,321,,301.82862469200563,,,,,12,DZA,2021/06/10,8,2500000,0
Algeria,6/11/21,132727,3560,,,372,,302.6769511502839,,,,,12,DZA,2021/06/11,8,2500000,0
Algeria,6/12/21,133070,3565,,,343,,303.459144631976,,,,,12,DZA,2021/06/12,5,2500000,0
Algeria,6/13/21,133388,3571,,,318,,304.18432692695586,,,,,12,DZA,2021/06/13,6,2500000,0
Algeria,6/14/21,133742,3579,,,354,,304.99160533080135,,,,,12,DZA,2021/06/14,8,2500000,0
Algeria,6/15/21,134115,3588,,,373,,305.84221223654816,,,,,12,DZA,2021/06/15,9,2500000,0
Algeria,6/16/21,134458,3598,,,343,,306.62440571824027,,,,,12,DZA,2021/06/16,10,2500000,0
Algeria,6/17/21,134840,3605,,,382,,307.4955366512035,,,,,12,DZA,2021/06/17,7,2500000,0
Algeria,6/18/21,135219,3615,,,379,,308.35982624176125,,,,,12,DZA,2021/06/18,10,2500000,0
Algeria,6/19/21,135586,3624,,,367,,309.1967504626971,,,,,12,DZA,2021/06/19,9,2500000,0
Algeria,6/20/21,135821,3631,,,235,,309.73265561779226,,,,,12,DZA,2021/06/20,7,2500000,0
Algeria,6/21/21,136294,3641,,,473,,310.81130727038806,,,,,12,DZA,2021/06/21,10,2500000,0
Algeria,6/22/21,136679,3650,,,385,,311.68927954575673,,,,,12,DZA,2021/06/22,9,2500000,0
Algeria,6/23/21,137049,3660,,,370,,312.5330451090981,,,,,12,DZA,2021/06/23,10,2500000,0
Algeria,6/24/21,137403,3669,,,354,,313.3403235129436,,,,,12,DZA,2021/06/24,9,2500000,0
Algeria,6/25/21,137772,3678,,,369,,314.18180862881644,,,,,12,DZA,2021/06/25,9,2500000,0
Algeria,6/26/21,138113,3685,,,341,,314.95944121557153,,,,,12,DZA,2021/06/26,7,2500000,0
Algeria,6/27/21,138465,3693,,,352,,315.76215872448006,,,,,12,DZA,2021/06/27,8,2500000,0
Algeria,6/28/21,138840,3699,,,375,,316.61732652516383,,,,,12,DZA,2021/06/28,6,2500000,0
Algeria,6/29/21,139229,3708,,,389,,317.5044205904065,,,,,12,DZA,2021/06/29,9,2500000,0
Algeria,6/30/21,139626,3716,,,397,,318.409758235397,,,,,12,DZA,2021/06/30,8,2500000,0
Algeria,7/1/21,140075,3726,,,449,,319.4336791487491,,,,,12,DZA,2021/07/01,10,2500000,0
Algeria,7/2/21,140550,3735,,,475,,320.5168916962819,,,,,12,DZA,2021/07/02,9,2500000,0
Andorra,6/4/21,13758,127,,,6,,17806.25121335663,,,,,20,AND,2021/06/04,0,35926,10
Andorra,6/7/21,13777,127,,,19,,17830.841907720183,,,,,20,AND,2021/06/07,0,35926,0
Andorra,6/8/21,13781,127,,,4,,17836.01889600725,,,,,20,AND,2021/06/08,0,35926,0
Andorra,6/9/21,13791,127,,,10,,17848.961366724907,,,,,20,AND,2021/06/09,0,41473,5547
Andorra,6/10/21,13805,127,,,14,,17867.08082572963,,,,,20,AND,2021/06/10,0,41481,8
Andorra,6/11/21,13813,127,,,8,,17877.43480230376,,,,,20,AND,2021/06/11,0,41481,0
Andorra,6/14/21,13826,127,,,13,,17894.26001423672,,,,,20,AND,2021/06/14,0,41481,0
Andorra,6/15/21,13828,127,,,2,,17896.84850838025,,,,,20,AND,2021/06/15,0,41481,0
Andorra,6/16/21,13836,127,,,8,,17907.202484954378,,,,,20,AND,2021/06/16,0,41481,0
Andorra,6/17/21,13839,127,,,3,,17911.085226169675,,,,,20,AND,2021/06/17,0,51114,9633
Andorra,6/18/21,13842,127,,,3,,17914.967967384975,,,,,20,AND,2021/06/18,0,51114,0
Andorra,6/21/21,13864,127,,,22,,17943.441402963825,,,,,20,AND,2021/06/21,0,51114,0
Andorra,6/23/21,13873,127,,,9,,17955.08962660972,,,,,20,AND,2021/06/23,0,63265,12151
Andorra,6/24/21,13877,127,,,4,,17960.266614896784,,,,,20,AND,2021/06/24,0,63272,7
Andorra,6/25/21,13882,127,,,5,,17966.737850255613,,,,,20,AND,2021/06/25,0,63272,0
Andorra,6/29/21,13900,127,,,18,,17990.0342975474,,,,,20,AND,2021/06/29,0,63272,0
Andorra,6/30/21,13911,127,,,11,,18004.271015336828,,,,,20,AND,2021/06/30,0,68329,5057
Andorra,7/1/21,13918,127,,,7,,18013.33074483919,,,,,20,AND,2021/07/01,0,68336,7
Andorra,7/2/21,13918,127,,,0,,18013.33074483919,,,,,20,AND,2021/07/02,0,68336,0
Angola,6/4/21,35307,788,,,167,,107.42625235089058,,,,,24,AGO,2021/06/04,4,909215,0
Angola,6/5/21,35594,794,,,287,,108.29948809521056,,,,,24,AGO,2021/06/05,6,909215,0
Angola,6/6/21,35772,797,,,178,,108.84107681468429,,,,,24,AGO,2021/06/06,3,909215,0
Angola,6/7/21,35854,800,,,82,,109.09057274163285,,,,,24,AGO,2021/06/07,3,909215,0
Angola,6/8/21,36004,803,,,150,,109.5469677299534,,,,,24,AGO,2021/06/08,3,1115919,206704
Angola,6/9/21,36115,811,,,111,,109.8847000213106,,,,,24,AGO,2021/06/09,8,1115919,0
Angola,6/10/21,36325,815,,,210,,110.52365300495937,,,,,24,AGO,2021/06/10,4,1222630,106711
Angola,6/11/21,36455,819,,,130,,110.91919532817052,,,,,24,AGO,2021/06/11,4,1222630,0
Angola,6/12/21,36600,825,,,145,,111.36037715021371,,,,,24,AGO,2021/06/12,6,1222630,0
Angola,6/13/21,36705,831,,,105,,111.6798536420381,,,,,24,AGO,2021/06/13,6,1222630,0
Angola,6/14/21,36790,836,,,85,,111.93847746875306,,,,,24,AGO,2021/06/14,5,1222630,0
Angola,6/15/21,36921,842,,,131,,112.33706242521968,,,,,24,AGO,2021/06/15,6,1314375,91745
Angola,6/16/21,37094,847,,,173,,112.86343797841604,,,,,24,AGO,2021/06/16,5,1314375,0
Angola,6/17/21,37289,851,,,195,,113.45675146323276,,,,,24,AGO,2021/06/17,4,1314375,0
Angola,6/18/21,37467,853,,,178,,113.99834018270647,,,,,24,AGO,2021/06/18,2,1314375,0
Angola,6/19/21,37604,856,,,137,,114.41518093870592,,,,,24,AGO,2021/06/19,3,1314375,0
Angola,6/20/21,37678,859,,,74,,114.64033579961071,,,,,24,AGO,2021/06/20,3,1380174,65799
Angola,6/21/21,37748,868,,,70,,114.85332012749363,,,,,24,AGO,2021/06/21,9,1380174,0
Angola,6/22/21,37874,875,,,126,,115.23669191768289,,,,,24,AGO,2021/06/22,7,1380174,0
Angola,6/23/21,38002,878,,,128,,115.6261489743831,,,,,24,AGO,2021/06/23,3,1380174,0
Angola,6/24/21,38091,881,,,89,,115.89694333411995,,,,,24,AGO,2021/06/24,3,1432699,52525
Angola,6/25/21,38371,883,,,280,,116.74888064565164,,,,,24,AGO,2021/06/25,2,1432699,0
Angola,6/26/21,38528,887,,,157,,117.22657406676049,,,,,24,AGO,2021/06/26,4,1432699,0
Angola,6/27/21,38556,889,,,28,,117.31176779791366,,,,,24,AGO,2021/06/27,2,1432699,0
Angola,6/28/21,38613,891,,,57,,117.48519789347546,,,,,24,AGO,2021/06/28,2,1488292,55593
Angola,6/29/21,38682,894,,,69,,117.69513958810292,,,,,24,AGO,2021/06/29,3,1488292,0
Angola,6/30/21,38849,900,,,167,,118.20325934176645,,,,,24,AGO,2021/06/30,6,1488292,0
Angola,7/1/21,38965,903,,,116,,118.55620479940102,,,,,24,AGO,2021/07/01,3,1488292,0
Angola,7/2/21,39089,906,,,124,,118.93349132307934,,,,,24,AGO,2021/07/02,3,1488292,0
Antigua and Barbuda,6/4/21,1263,42,,,1,,1289.7230618413528,,,,,28,ATG,2021/06/04,0,51811,1482
Antigua and Barbuda,7/1/21,1264,42,,,1,,1290.7442202434443,,,,,28,ATG,2021/07/01,0,63995,64
Antigua and Barbuda,7/2/21,1264,42,,,0,,1290.7442202434443,,,,,28,ATG,2021/07/02,0,63995,0
Argentina,6/4/21,3915397,80411,,,30950,,8663.192138504444,,,,,32,ARG,2021/06/04,538,13374067,294872
Argentina,6/5/21,3939024,80867,,,23627,,8715.46914659748,,,,,32,ARG,2021/06/05,456,13374067,0
Argentina,6/6/21,3955439,81214,,,16415,,8751.788911605612,,,,,32,ARG,2021/06/06,347,14092493,718426
Argentina,6/7/21,3977634,81946,,,22195,,8800.897482081125,,,,,32,ARG,2021/06/07,732,14336164,243671
Argentina,6/8/21,4008771,82667,,,31137,,8869.791086897345,,,,,32,ARG,2021/06/08,721,14663805,327641
Argentina,6/9/21,4038528,83272,,,29757,,8935.631309093325,,,,,32,ARG,2021/06/09,605,15012734,348929
Argentina,6/10/21,4066156,83941,,,27628,,8996.760914188952,,,,,32,ARG,2021/06/10,669,0,-15012734
Argentina,6/11/21,4093090,84628,,,26934,,9056.354977590052,,,,,32,ARG,2021/06/11,687,15730223,15730223
Argentina,6/12/21,4111147,85075,,,18057,,9096.30782539705,,,,,32,ARG,2021/06/12,447,16102741,372518
Argentina,6/13/21,4124190,85343,,,13043,,9125.166716350512,,,,,32,ARG,2021/06/13,268,16286902,184161
Argentina,6/14/21,4145482,86029,,,21292,,9172.277312546259,,,,,32,ARG,2021/06/14,686,16382043,95141
Argentina,6/15/21,4172742,86615,,,27260,,9232.592682276489,,,,,32,ARG,2021/06/15,586,16643769,261726
Argentina,6/16/21,4198620,87261,,,25878,,9289.850244194275,,,,,32,ARG,2021/06/16,646,16876619,232850
Argentina,6/17/21,4222400,87789,,,23780,,9342.465779490858,,,,,32,ARG,2021/06/17,528,17172628,296009
Argentina,6/18/21,4242763,88247,,,20363,,9387.520873908197,,,,,32,ARG,2021/06/18,458,17475935,303307
Argentina,6/19/21,4258394,88742,,,15631,,9422.105963572658,,,,,32,ARG,2021/06/19,495,17837121,361186
Argentina,6/20/21,4268789,89043,,,10395,,9445.105900049024,,,,,32,ARG,2021/06/20,301,18085389,248268
Argentina,6/21/21,4277395,89490,,,8606,,9464.147502099588,,,,,32,ARG,2021/06/21,447,18198899,113510
Argentina,6/22/21,4298782,90281,,,21387,,9511.46829492499,,,,,32,ARG,2021/06/22,791,18380675,181776
Argentina,6/23/21,4326101,90986,,,27319,,9571.914207825213,,,,,32,ARG,2021/06/23,705,18646784,266109
Argentina,6/24/21,4350564,91438,,,24463,,9626.040946259205,,,,,32,ARG,2021/06/24,452,18921680,274896
Argentina,6/25/21,4374587,91979,,,24023,,9679.194142408482,,,,,32,ARG,2021/06/25,541,19205808,284128
Argentina,6/26/21,4393142,92317,,,18555,,9720.248863074088,,,,,32,ARG,2021/06/26,338,19499231,293423
Argentina,6/27/21,4405247,92568,,,12105,,9747.032338884228,,,,,32,ARG,2021/06/27,251,19749468,250237
Argentina,6/28/21,4423636,93142,,,18389,,9787.719768596964,,,,,32,ARG,2021/06/28,574,19951580,202112
Argentina,6/29/21,4447701,93668,,,24065,,9840.96589378251,,,,,32,ARG,2021/06/29,526,20221697,270117
Argentina,6/30/21,4470374,94304,,,22673,,9891.132085194597,,,,,32,ARG,2021/06/30,636,20543325,321628
Argentina,7/1/21,4491551,94772,,,21177,,9937.988232838656,,,,,32,ARG,2021/07/01,468,20907721,364396
Argentina,7/2/21,4512439,95382,,,20888,,9984.204940209347,,,,,32,ARG,2021/07/02,610,21310026,402305
Armenia,6/4/21,223050,4452,,,72,,7527.248944902765,,,,,51,ARM,2021/06/04,4,33529,0
Armenia,6/5/21,223143,4454,,,93,,7530.387407811871,,,,,51,ARM,2021/06/05,2,33529,0
Armenia,6/6/21,223180,4458,,,37,,7531.636043592913,,,,,51,ARM,2021/06/06,4,33529,0
Armenia,6/7/21,223212,4463,,,32,,7532.715944808949,,,,,51,ARM,2021/06/07,5,33529,0
Armenia,6/8/21,223285,4463,,,73,,7535.179469458031,,,,,51,ARM,2021/06/08,0,33529,0
Armenia,6/9/21,223384,4474,,,99,,7538.520413845144,,,,,51,ARM,2021/06/09,11,33529,0
Armenia,6/10/21,223460,4478,,,76,,7541.08517923323,,,,,51,ARM,2021/06/10,4,33529,0
Armenia,6/11/21,223555,4482,,,95,,7544.291135968338,,,,,51,ARM,2021/06/11,4,46503,0
Armenia,6/12/21,223643,4482,,,88,,7547.260864312437,,,,,51,ARM,2021/06/12,0,46503,0
Armenia,6/13/21,223682,4484,,,39,,7548.5769939194815,,,,,51,ARM,2021/06/13,2,46503,0
Armenia,6/14/21,223723,4488,,,41,,7549.960617352528,,,,,51,ARM,2021/06/14,4,46503,0
Armenia,6/15/21,223805,4489,,,82,,7552.72786421862,,,,,51,ARM,2021/06/15,1,46503,0
Armenia,6/16/21,223904,4490,,,99,,7556.068808605733,,,,,51,ARM,2021/06/16,1,46503,0
Armenia,6/17/21,224000,4491,,,96,,7559.308512253841,,,,,51,ARM,2021/06/17,1,55557,0
Armenia,6/18/21,224086,4492,,,86,,7562.210746771939,,,,,51,ARM,2021/06/18,1,55557,0
Armenia,6/19/21,224167,4496,,,81,,7564.944246725031,,,,,51,ARM,2021/06/19,4,55557,0
Armenia,6/20/21,224227,4498,,,60,,7566.969061505099,,,,,51,ARM,2021/06/20,2,55557,0
Armenia,6/21/21,224253,4499,,,26,,7567.846481243128,,,,,51,ARM,2021/06/21,1,55557,0
Armenia,6/22/21,224330,4502,,,77,,7570.444993544215,,,,,51,ARM,2021/06/22,3,55557,0
Armenia,6/23/21,224430,4503,,,100,,7573.819684844329,,,,,51,ARM,2021/06/23,1,55557,0
Armenia,6/24/21,224533,4505,,,103,,7577.295616883445,,,,,51,ARM,2021/06/24,2,64293,0
Armenia,6/25/21,224635,4505,,,102,,7580.737802009561,,,,,51,ARM,2021/06/25,0,64293,0
Armenia,6/26/21,224728,4506,,,93,,7583.8762649186665,,,,,51,ARM,2021/06/26,1,64293,0
Armenia,6/27/21,224797,4508,,,69,,7586.204801915745,,,,,51,ARM,2021/06/27,2,64293,0
Armenia,6/28/21,224851,4510,,,54,,7588.027135217806,,,,,51,ARM,2021/06/28,2,64293,0
Armenia,6/29/21,224967,4514,,,116,,7591.941777125938,,,,,51,ARM,2021/06/29,4,64293,0
Armenia,6/30/21,225095,4514,,,128,,7596.261381990083,,,,,51,ARM,2021/06/30,0,64293,0
Armenia,7/1/21,225221,4517,,,126,,7600.513493028226,,,,,51,ARM,2021/07/01,3,74714,0
Armenia,7/2/21,225339,4518,,,118,,7604.495628762359,,,,,51,ARM,2021/07/02,1,74714,0
Australia,6/4/21,30157,910,,,16,,118.44994245808081,,,,,36,AUS,2021/06/04,0,4786362,143659
Australia,6/5/21,30173,910,,,16,,118.51278687494354,,,,,36,AUS,2021/06/05,0,4786362,0
Australia,6/6/21,30191,910,,,18,,118.5834868439141,,,,,36,AUS,2021/06/06,0,5016352,229990
Australia,6/7/21,30205,910,,,14,,118.63847570866899,,,,,36,AUS,2021/06/07,0,5076413,60061
Australia,6/8/21,30210,910,,,5,,118.6581145889386,,,,,36,AUS,2021/06/08,0,5203977,127564
Australia,6/9/21,30225,910,,,15,,118.7170312297474,,,,,36,AUS,2021/06/09,0,5344862,140885
Australia,6/10/21,30228,910,,,3,,118.72881455790916,,,,,36,AUS,2021/06/10,0,5344862,0
Australia,6/11/21,30234,910,,,6,,118.75238121423268,,,,,36,AUS,2021/06/11,0,5641008,296146
Australia,6/12/21,30248,910,,,14,,118.80737007898757,,,,,36,AUS,2021/06/12,0,5773924,132916
Australia,6/13/21,30262,910,,,14,,118.86235894374246,,,,,36,AUS,2021/06/13,0,5834746,60822
Australia,6/14/21,30273,910,,,11,,118.90556448033558,,,,,36,AUS,2021/06/14,0,5867299,32553
Australia,6/15/21,30286,910,,,13,,118.95662556903656,,,,,36,AUS,2021/06/15,0,5931245,63946
Australia,6/16/21,30301,910,,,15,,119.01554220984536,,,,,36,AUS,2021/06/16,0,5931245,0
Australia,6/17/21,30309,910,,,8,,119.04696441827673,,,,,36,AUS,2021/06/17,0,6219330,288085
Australia,6/18/21,30322,910,,,13,,119.09802550697769,,,,,36,AUS,2021/06/18,0,6219330,0
Australia,6/19/21,30331,910,,,9,,119.13337549146298,,,,,36,AUS,2021/06/19,0,6360666,141336
Australia,6/20/21,30355,910,,,24,,119.22764211675707,,,,,36,AUS,2021/06/20,0,6491476,130810
Australia,6/21/21,30366,910,,,11,,119.2708476533502,,,,,36,AUS,2021/06/21,0,6590741,99265
Australia,6/22/21,30380,910,,,14,,119.32583651810508,,,,,36,AUS,2021/06/22,0,6719384,128643
Australia,6/23/21,30404,910,,,24,,119.42010314339917,,,,,36,AUS,2021/06/23,0,6860276,140892
Australia,6/24/21,30424,910,,,20,,119.49865866447759,,,,,36,AUS,2021/06/24,0,6860276,0
Australia,6/25/21,30457,910,,,33,,119.62827527425696,,,,,36,AUS,2021/06/25,0,6999198,138922
Australia,6/26/21,30499,910,,,42,,119.79324186852162,,,,,36,AUS,2021/06/26,0,7137632,138434
Australia,6/27/21,30528,910,,,29,,119.90714737408531,,,,,36,AUS,2021/06/27,0,7326320,188688
Australia,6/28/21,30560,910,,,32,,120.03283620781077,,,,,36,AUS,2021/06/28,0,7374666,48346
Australia,6/29/21,30602,910,,,42,,120.19780280207544,,,,,36,AUS,2021/06/29,0,7500700,126034
Australia,6/30/21,30643,910,,,41,,120.35884162028617,,,,,36,AUS,2021/06/30,0,7645585,144885
Australia,7/1/21,30684,910,,,41,,120.51988043849691,,,,,36,AUS,2021/07/01,0,7806975,161390
Australia,7/2/21,30734,910,,,50,,120.71626924119295,,,,,36,AUS,2021/07/02,0,7806975,0
Austria,6/4/21,646167,10631,,,333,,7174.531444306271,,,,,40,AUT,2021/06/04,4,5530539,111111
Austria,6/5/21,646438,10636,,,271,,7177.540415704388,,,,,40,AUT,2021/06/05,5,5590013,59474
Austria,6/6/21,646800,10639,,,362,,7181.5597797122045,,,,,40,AUT,2021/06/06,3,5633751,43738
Austria,6/7/21,647079,10640,,,279,,7184.657576834251,,,,,40,AUT,2021/06/07,1,5714006,80255
Austria,6/8/21,647322,10647,,,243,,7187.355658198614,,,,,40,AUT,2021/06/08,7,5807966,93960
Austria,6/9/21,647688,10650,,,366,,7191.419435068396,,,,,40,AUT,2021/06/09,3,5921721,113755
Austria,6/10/21,647971,10650,,,283,,7194.561645052408,,,,,40,AUT,2021/06/10,0,6043642,121921
Austria,6/11/21,648187,10652,,,216,,7196.959939598508,,,,,40,AUT,2021/06/11,2,6171867,128225
Austria,6/12/21,648387,10652,,,200,,7199.180582696749,,,,,40,AUT,2021/06/12,0,6243115,71248
Austria,6/13/21,648620,10661,,,233,,7201.7676319062,,,,,40,AUT,2021/06/13,9,6284084,40969
Austria,6/14/21,648732,10662,,,112,,7203.0111920412155,,,,,40,AUT,2021/06/14,1,6335560,51476
Austria,6/15/21,648849,10668,,,117,,7204.310268253686,,,,,40,AUT,2021/06/15,6,6426470,90910
Austria,6/16/21,649002,10671,,,153,,7206.009060223841,,,,,40,AUT,2021/06/16,3,6546683,120213
Austria,6/17/21,649181,10674,,,179,,7207.996535796767,,,,,40,AUT,2021/06/17,3,6660729,114046
Austria,6/18/21,649309,10677,,,128,,7209.417747379641,,,,,40,AUT,2021/06/18,3,6767175,106446
Austria,6/19/21,649445,10679,,,136,,7210.927784686445,,,,,40,AUT,2021/06/19,2,6835256,68081
Austria,6/20/21,649576,10680,,,131,,7212.382305915793,,,,,40,AUT,2021/06/20,1,6874440,39184
Austria,6/21/21,649670,10680,,,94,,7213.426008171967,,,,,40,AUT,2021/06/21,0,6910539,36099
Austria,6/22/21,649728,10684,,,58,,7214.069994670456,,,,,40,AUT,2021/06/22,4,7008166,97627
Austria,6/23/21,649845,10686,,,117,,7215.369070882928,,,,,40,AUT,2021/06/23,2,7125249,117083
Austria,6/24/21,649922,10697,,,77,,7216.22401847575,,,,,40,AUT,2021/06/24,11,7235847,110598
Austria,6/25/21,650016,10700,,,94,,7217.267720731924,,,,,40,AUT,2021/06/25,3,7359382,123535
Austria,6/26/21,650192,10699,,,176,,7219.221886658376,,,,,40,AUT,2021/06/26,,7434857,75475
Austria,6/27/21,650261,10700,,,69,,7219.98800852727,,,,,40,AUT,2021/06/27,1,7479255,44398
Austria,6/28/21,650324,10701,,,63,,7220.687511103216,,,,,40,AUT,2021/06/28,1,7537771,58516
Austria,6/29/21,650353,10700,,,29,,7221.009504352461,,,,,40,AUT,2021/06/29,,7631324,93553
Austria,6/30/21,650412,10702,,,59,,7221.664594066442,,,,,40,AUT,2021/06/30,2,7747028,115704
Austria,7/1/21,650474,10706,,,62,,7222.352993426896,,,,,40,AUT,2021/07/01,4,7862419,115391
Austria,7/2/21,650569,10709,,,95,,7223.407798898561,,,,,40,AUT,2021/07/02,3,7862419,0
Azerbaijan,6/4/21,334539,4933,,,123,,3299.469631404922,,,,,31,AZE,2021/06/04,4,2465719,47637
Azerbaijan,6/5/21,334647,4936,,,108,,3300.534806825999,,,,,31,AZE,2021/06/05,3,2465719,0
Azerbaijan,6/6/21,334715,4941,,,68,,3301.2054728318626,,,,,31,AZE,2021/06/06,5,2546169,80450
Azerbaijan,6/7/21,334747,4945,,,32,,3301.5210803640334,,,,,31,AZE,2021/06/07,4,2546770,601
Azerbaijan,6/8/21,334849,4947,,,102,,3302.5270793728287,,,,,31,AZE,2021/06/08,2,2586410,39640
Azerbaijan,6/9/21,334917,4948,,,68,,3303.197745378692,,,,,31,AZE,2021/06/09,1,2624876,38466
Azerbaijan,6/10/21,334992,4951,,,75,,3303.937450532218,,,,,31,AZE,2021/06/10,3,2624876,0
Azerbaijan,6/11/21,335065,4951,,,73,,3304.657430214983,,,,,31,AZE,2021/06/11,0,2702023,77147
Azerbaijan,6/12/21,335126,4953,,,61,,3305.259057073184,,,,,31,AZE,2021/06/12,2,2742867,40844
Azerbaijan,6/13/21,335171,4953,,,45,,3305.7028801652996,,,,,31,AZE,2021/06/13,0,2775319,32452
Azerbaijan,6/14/21,335196,4955,,,25,,3305.949448549808,,,,,31,AZE,2021/06/14,2,2775641,322
Azerbaijan,6/15/21,335264,4958,,,68,,3306.6201145556715,,,,,31,AZE,2021/06/15,3,2816346,40705
Azerbaijan,6/16/21,335291,4959,,,27,,3306.886408410941,,,,,31,AZE,2021/06/16,1,2816346,0
Azerbaijan,6/17/21,335339,4959,,,48,,3307.3598197091974,,,,,31,AZE,2021/06/17,0,2877878,61532
Azerbaijan,6/18/21,335399,4961,,,60,,3307.951583832018,,,,,31,AZE,2021/06/18,2,2877878,0
Azerbaijan,6/19/21,335437,4961,,,38,,3308.3263677764708,,,,,31,AZE,2021/06/19,0,2915954,38076
Azerbaijan,6/20/21,335493,4962,,,56,,3308.87868095777,,,,,31,AZE,2021/06/20,1,2915954,0
Azerbaijan,6/21/21,335521,4963,,,28,,3309.15483754842,,,,,31,AZE,2021/06/21,1,2989673,73719
Azerbaijan,6/22/21,335568,4963,,,47,,3309.618386111296,,,,,31,AZE,2021/06/22,0,3032516,42843
Azerbaijan,6/23/21,335625,4965,,,57,,3310.1805620279756,,,,,31,AZE,2021/06/23,2,3080340,47824
Azerbaijan,6/24/21,335676,4965,,,51,,3310.683561532373,,,,,31,AZE,2021/06/24,0,3080340,0
Azerbaijan,6/25/21,335741,4967,,,65,,3311.3246393320956,,,,,31,AZE,2021/06/25,2,3146350,66010
Azerbaijan,6/26/21,335796,4967,,,55,,3311.8670897780144,,,,,31,AZE,2021/06/26,0,3218651,72301
Azerbaijan,6/27/21,335836,4968,,,40,,3312.2615991932284,,,,,31,AZE,2021/06/27,1,3348427,129776
Azerbaijan,6/28/21,335874,4970,,,38,,3312.636383137681,,,,,31,AZE,2021/06/28,2,3349035,608
Azerbaijan,6/29/21,335961,4973,,,87,,3313.494441115771,,,,,31,AZE,2021/06/29,3,3422241,73206
Azerbaijan,6/30/21,336047,4974,,,86,,3314.342636358481,,,,,31,AZE,2021/06/30,1,3511219,88978
Azerbaijan,7/1/21,336122,4975,,,75,,3315.0823415120067,,,,,31,AZE,2021/07/01,1,3597108,85889
Azerbaijan,7/2/21,336223,4977,,,101,,3316.0784777854215,,,,,31,AZE,2021/07/02,2,3597108,0
Bahamas,6/4/21,11930,232,,,0,,3033.709008055985,,,,,44,BHS,2021/06/04,0,55037,0
Bahamas,6/7/21,12024,232,,,94,,3057.61249898283,,,,,44,BHS,2021/06/07,0,55037,0
Bahamas,6/9/21,12027,232,,,3,,3058.3753763528357,,,,,44,BHS,2021/06/09,0,62183,7146
Bahamas,6/10/21,12052,234,,,25,,3064.73268776955,,,,,44,BHS,2021/06/10,2,62183,0
Bahamas,6/11/21,12092,236,,,40,,3074.9043860362926,,,,,44,BHS,2021/06/11,2,62183,0
Bahamas,6/14/21,12199,237,,,107,,3102.113678899829,,,,,44,BHS,2021/06/14,1,68119,0
Bahamas,6/15/21,12225,239,,,26,,3108.725282773212,,,,,44,BHS,2021/06/15,2,68119,0
Bahamas,6/16/21,12242,240,,,17,,3113.0482545365776,,,,,44,BHS,2021/06/16,1,68119,0
Bahamas,6/19/21,12295,241,,,53,,3126.5257547400115,,,,,44,BHS,2021/06/19,1,68119,0
Bahamas,6/21/21,12364,243,,,69,,3144.0719342501425,,,,,44,BHS,2021/06/21,2,79246,11127
Bahamas,6/22/21,12379,244,,,15,,3147.886321100171,,,,,44,BHS,2021/06/22,1,79246,0
Bahamas,6/23/21,12407,244,,,28,,3155.006509886891,,,,,44,BHS,2021/06/23,0,79246,0
Bahamas,6/25/21,12467,245,,,60,,3170.2640572870046,,,,,44,BHS,2021/06/25,1,79246,0
Bahamas,6/29/21,12586,246,,,119,,3200.5248596305637,,,,,44,BHS,2021/06/29,1,79246,0
Bahamas,7/1/21,12735,246,,,149,,3238.4144356741804,,,,,44,BHS,2021/07/01,0,91067,0
Bahamas,7/2/21,12735,246,,,0,,3238.4144356741804,,,,,44,BHS,2021/07/02,0,91067,0
Bahrain,6/4/21,248150,1069,,,1492,,14583.47903099643,,,,,48,BHR,2021/06/04,19,1804659,15672
Bahrain,6/5/21,249582,1091,,,1432,,14667.635960161802,,,,,48,BHR,2021/06/05,22,1804659,0
Bahrain,6/6/21,251078,1119,,,1496,,14755.55409286529,,,,,48,BHR,2021/06/06,28,1826466,21807
Bahrain,6/7/21,252600,1143,,,1522,,14845.000214506139,,,,,48,BHR,2021/06/07,24,1838561,12095
Bahrain,6/8/21,253879,1161,,,1279,,14920.1655164632,,,,,48,BHR,2021/06/08,18,1849847,11286
Bahrain,6/9/21,254920,1171,,,1041,,14981.343842762886,,,,,48,BHR,2021/06/09,10,1859585,9738
Bahrain,6/10/21,255954,1188,,,1034,,15042.110787425592,,,,,48,BHR,2021/06/10,17,1859585,0
Bahrain,6/11/21,256921,1196,,,967,,15098.94022213433,,,,,48,BHR,2021/06/11,8,1876554,16969
Bahrain,6/12/21,257852,1206,,,931,,15153.653979852877,,,,,48,BHR,2021/06/12,10,1883641,7087
Bahrain,6/13/21,258731,1221,,,879,,15205.311759696706,,,,,48,BHR,2021/06/13,15,1891596,7955
Bahrain,6/14/21,259523,1236,,,792,,15251.856653480905,,,,,48,BHR,2021/06/14,15,1899552,7956
Bahrain,6/15/21,260334,1246,,,811,,15299.518154565483,,,,,48,BHR,2021/06/15,10,1905340,5788
Bahrain,6/16/21,260954,1259,,,620,,15335.954813840994,,,,,48,BHR,2021/06/16,13,1905340,0
Bahrain,6/17/21,261501,1271,,,547,,15368.101350330839,,,,,48,BHR,2021/06/17,12,1917308,11968
Bahrain,6/18/21,261988,1286,,,487,,15396.7217585037,,,,,48,BHR,2021/06/18,15,1917308,0
Bahrain,6/19/21,262427,1297,,,439,,15422.521264022971,,,,,48,BHR,2021/06/19,11,1925432,8124
Bahrain,6/20/21,262892,1306,,,465,,15449.848758479604,,,,,48,BHR,2021/06/20,9,1932506,7074
Bahrain,6/21/21,263295,1311,,,403,,15473.532587008685,,,,,48,BHR,2021/06/21,5,1955753,23247
Bahrain,6/22/21,263689,1326,,,394,,15496.687496290218,,,,,48,BHR,2021/06/22,15,1968183,12430
Bahrain,6/23/21,264107,1330,,,418,,15521.252856898547,,,,,48,BHR,2021/06/23,4,1978826,10643
Bahrain,6/24/21,264405,1334,,,298,,15538.765960872905,,,,,48,BHR,2021/06/24,4,1978826,0
Bahrain,6/25/21,264693,1335,,,288,,15555.691376794432,,,,,48,BHR,2021/06/25,1,1993321,14495
Bahrain,6/26/21,264995,1341,,,302,,15573.439555989922,,,,,48,BHR,2021/06/26,6,2009717,16396
Bahrain,6/27/21,265247,1345,,,252,,15588.24929492126,,,,,48,BHR,2021/06/27,4,2027964,18247
Bahrain,6/28/21,265477,1348,,,230,,15601.766120136368,,,,,48,BHR,2021/06/28,3,2109775,81811
Bahrain,6/29/21,265643,1351,,,166,,15611.521741813358,,,,,48,BHR,2021/06/29,3,2116497,6722
Bahrain,6/30/21,265827,1352,,,184,,15622.335201985445,,,,,48,BHR,2021/06/30,1,2122296,5799
Bahrain,7/1/21,265975,1353,,,148,,15631.032985167341,,,,,48,BHR,2021/07/01,1,2128340,6044
Bahrain,7/2/21,266140,1356,,,165,,15640.72983803905,,,,,48,BHR,2021/07/02,3,2128340,0
Bangladesh,6/4/21,807867,12758,,,1887,,490.5398182225262,,,,,50,BGD,2021/06/04,34,10020942,0
Bangladesh,6/5/21,809314,12801,,,1447,,491.4184419526303,,,,,50,BGD,2021/06/05,43,10021634,692
Bangladesh,6/6/21,810990,12839,,,1676,,492.43611532626846,,,,,50,BGD,2021/06/06,38,10027760,6126
Bangladesh,6/7/21,812960,12869,,,1970,,493.6323065828718,,,,,50,BGD,2021/06/07,30,10034502,6742
Bangladesh,6/8/21,815282,12913,,,2322,,495.04223353608654,,,,,50,BGD,2021/06/08,44,10040964,6462
Bangladesh,6/9/21,817819,12949,,,2537,,496.5827092812656,,,,,50,BGD,2021/06/09,36,10046528,5564
Bangladesh,6/10/21,820395,12989,,,2576,,498.14686597010325,,,,,50,BGD,2021/06/10,40,10046528,0
Bangladesh,6/11/21,822849,13032,,,2454,,499.63694380954723,,,,,50,BGD,2021/06/11,43,10058643,12115
Bangladesh,6/12/21,824486,13071,,,1637,,500.63093623952676,,,,,50,BGD,2021/06/12,39,10058643,0
Bangladesh,6/13/21,826922,13118,,,2436,,502.1100844126667,,,,,50,BGD,2021/06/13,47,10062784,4141
Bangladesh,6/14/21,829972,13172,,,3050,,503.9620556475095,,,,,50,BGD,2021/06/14,54,10071313,8529
Bangladesh,6/15/21,833291,13222,,,3319,,505.9773646732285,,,,,50,BGD,2021/06/15,50,10071313,0
Bangladesh,6/16/21,837247,13282,,,3956,,508.3794624453721,,,,,50,BGD,2021/06/16,60,10078366,7053
Bangladesh,6/17/21,841087,13345,,,3840,,510.7111245902233,,,,,50,BGD,2021/06/17,63,10079471,1105
Bangladesh,6/18/21,844970,13399,,,3883,,513.0688964934674,,,,,50,BGD,2021/06/18,54,10079471,0
Bangladesh,6/19/21,848027,13466,,,3057,,514.925118154095,,,,,50,BGD,2021/06/19,67,10082705,3234
Bangladesh,6/20/21,851668,13548,,,3641,,517.1359467659187,,,,,50,BGD,2021/06/20,82,10083608,903
Bangladesh,6/21/21,856304,13626,,,4636,,519.9509430428797,,,,,50,BGD,2021/06/21,78,10086979,3371
Bangladesh,6/22/21,861150,13702,,,4846,,522.8934520933872,,,,,50,BGD,2021/06/22,76,10089982,3003
Bangladesh,6/23/21,866877,13787,,,5727,,526.3709075891067,,,,,50,BGD,2021/06/23,85,10090206,224
Bangladesh,6/24/21,872935,13868,,,6058,,530.0493475040829,,,,,50,BGD,2021/06/24,81,10090433,227
Bangladesh,6/25/21,878804,13976,,,5869,,533.6130259228672,,,,,50,BGD,2021/06/25,108,10095479,5046
Bangladesh,6/26/21,883138,14053,,,4334,,536.2446466873945,,,,,50,BGD,2021/06/26,77,10095579,100
Bangladesh,6/27/21,888406,14172,,,5268,,539.4433956923623,,,,,50,BGD,2021/06/27,119,10097645,2066
Bangladesh,6/28/21,896770,14276,,,8364,,544.5220473016162,,,,,50,BGD,2021/06/28,104,10099562,1917
Bangladesh,6/29/21,904436,14388,,,7666,,549.1768707397489,,,,,50,BGD,2021/06/29,112,10101143,1581
Bangladesh,6/30/21,913258,14503,,,8822,,554.5336216360711,,,,,50,BGD,2021/06/30,115,10102139,996
Bangladesh,7/1/21,921559,14646,,,8301,,559.5740194132611,,,,,50,BGD,2021/07/01,143,10103015,876
Bangladesh,7/2/21,930042,14778,,,8483,,564.7249282608582,,,,,50,BGD,2021/07/02,132,10103015,0
Barbados,6/4/21,4029,47,,,3,,1402.0203847987445,,,,,52,BRB,2021/06/04,0,141282,0
Barbados,6/5/21,4030,47,,,1,,1402.3683670238124,,,,,52,BRB,2021/06/05,0,141282,0
Barbados,6/6/21,4031,47,,,1,,1402.7163492488803,,,,,52,BRB,2021/06/06,0,143488,2206
Barbados,6/7/21,4032,47,,,1,,1403.0643314739484,,,,,52,BRB,2021/06/07,0,143488,0
Barbados,6/10/21,4033,47,,,1,,1403.4123136990163,,,,,52,BRB,2021/06/10,0,145964,0
Barbados,6/12/21,4036,47,,,3,,1404.4562603742202,,,,,52,BRB,2021/06/12,0,147036,0
Barbados,6/14/21,4037,47,,,1,,1404.804242599288,,,,,52,BRB,2021/06/14,0,150300,787
Barbados,6/15/21,4038,47,,,1,,1405.152224824356,,,,,52,BRB,2021/06/15,0,151004,704
Barbados,6/17/21,4039,47,,,1,,1405.5002070494238,,,,,52,BRB,2021/06/17,0,153350,2346
Barbados,6/18/21,4040,47,,,1,,1405.848189274492,,,,,52,BRB,2021/06/18,0,153350,0
Barbados,6/19/21,4041,47,,,1,,1406.1961714995598,,,,,52,BRB,2021/06/19,0,153350,0
Barbados,6/20/21,4043,47,,,2,,1406.8921359496958,,,,,52,BRB,2021/06/20,0,155423,2073
Barbados,6/21/21,4045,47,,,2,,1407.5881003998315,,,,,52,BRB,2021/06/21,0,157283,1860
Barbados,6/23/21,4052,47,,,7,,1410.0239759753072,,,,,52,BRB,2021/06/23,0,158980,0
Barbados,6/24/21,4057,47,,,5,,1411.7638871006468,,,,,52,BRB,2021/06/24,0,160266,1286
Barbados,6/25/21,4066,47,,,9,,1414.8957271262584,,,,,52,BRB,2021/06/25,0,160266,0
Barbados,6/26/21,4074,47,,,8,,1417.679584926802,,,,,52,BRB,2021/06/26,0,162357,2091
Barbados,6/27/21,4075,47,,,1,,1418.0275671518698,,,,,52,BRB,2021/06/27,0,162357,0
Barbados,6/28/21,4077,47,,,2,,1418.7235316020058,,,,,52,BRB,2021/06/28,0,164709,2352
Barbados,6/29/21,4079,47,,,2,,1419.4194960521418,,,,,52,BRB,2021/06/29,0,165339,630
Barbados,6/30/21,4081,47,,,2,,1420.1154605022775,,,,,52,BRB,2021/06/30,0,166212,873
Barbados,7/1/21,4082,47,,,1,,1420.4634427273454,,,,,52,BRB,2021/07/01,0,166567,355
Barbados,7/2/21,4082,47,,,0,,1420.4634427273454,,,,,52,BRB,2021/07/02,0,166567,0
Belarus,6/4/21,398052,2892,,,1183,,4212.493151624333,,,,,112,BLR,2021/06/04,10,796834,85912
Belarus,6/5/21,398909,2900,,,857,,4221.562586348797,,,,,112,BLR,2021/06/05,8,796834,0
Belarus,6/6/21,399852,2910,,,943,,4231.542139376998,,,,,112,BLR,2021/06/06,10,796834,0
Belarus,6/7/21,400422,2919,,,570,,4237.574318832009,,,,,112,BLR,2021/06/07,9,796834,0
Belarus,6/8/21,401019,2929,,,597,,4243.89223310331,,,,,112,BLR,2021/06/08,10,796834,0
Belarus,6/9/21,401853,2939,,,834,,4252.718264095378,,,,,112,BLR,2021/06/09,10,796834,0
Belarus,6/10/21,402819,2949,,,966,,4262.941220855974,,,,,112,BLR,2021/06/10,10,924926,128092
Belarus,6/11/21,403845,2958,,,1026,,4273.799143874994,,,,,112,BLR,2021/06/11,9,924926,0
Belarus,6/12/21,404740,2969,,,895,,4283.270723896458,,,,,112,BLR,2021/06/12,11,924926,0
Belarus,6/13/21,405663,2978,,,923,,4293.038621505186,,,,,112,BLR,2021/06/13,9,924926,0
Belarus,6/14/21,406360,2987,,,697,,4300.414812873856,,,,,112,BLR,2021/06/14,9,924926,0
Belarus,6/15/21,406861,2995,,,501,,4305.716781131681,,,,,112,BLR,2021/06/15,8,924926,0
Belarus,6/16/21,407748,3006,,,887,,4315.103698985356,,,,,112,BLR,2021/06/16,11,924926,0
Belarus,6/17/21,408621,3015,,,873,,4324.342458045398,,,,,112,BLR,2021/06/17,9,1068413,143487
Belarus,6/18/21,409385,3025,,,764,,4332.427695069307,,,,,112,BLR,2021/06/18,10,1068413,0
Belarus,6/19/21,410096,3035,,,711,,4339.95204523161,,,,,112,BLR,2021/06/19,10,1068413,0
Belarus,6/20/21,410678,3044,,,582,,4346.111217938304,,,,,112,BLR,2021/06/20,9,1068413,0
Belarus,6/21/21,411153,3053,,,475,,4351.138034150814,,,,,112,BLR,2021/06/21,9,1068413,0
Belarus,6/22/21,411551,3063,,,398,,4355.349976998347,,,,,112,BLR,2021/06/22,10,1068413,0
Belarus,6/23/21,412353,3072,,,802,,4363.837359319257,,,,,112,BLR,2021/06/23,9,1068413,0
Belarus,6/24/21,413139,3082,,,786,,4372.155417304587,,,,,112,BLR,2021/06/24,10,1068413,0
Belarus,6/25/21,413952,3093,,,813,,4380.759210106207,,,,,112,BLR,2021/06/25,11,1068413,0
Belarus,6/26/21,414730,3103,,,778,,4388.992605923749,,,,,112,BLR,2021/06/26,10,1068413,0
Belarus,6/27/21,415339,3113,,,609,,4395.437513446734,,,,,112,BLR,2021/06/27,10,1068413,0
Belarus,6/28/21,415780,3122,,,441,,4400.104515446136,,,,,112,BLR,2021/06/28,9,1068413,0
Belarus,6/29/21,416275,3132,,,495,,4405.342987078119,,,,,112,BLR,2021/06/29,10,1068413,0
Belarus,6/30/21,417189,3143,,,914,,4415.015639748083,,,,,112,BLR,2021/06/30,11,1068413,0
Belarus,7/1/21,418212,3153,,,1023,,4425.841814454181,,,,,112,BLR,2021/07/01,10,1068413,0
Belarus,7/2/21,419330,3164,,,1118,,4437.673352402781,,,,,112,BLR,2021/07/02,11,1068413,0
Belgium,6/4/21,1068406,25014,,,1449,,9218.648831850856,,,,,56,BEL,2021/06/04,19,7313872,168846
Belgium,6/5/21,1069874,25019,,,1468,,9231.315342975988,,,,,56,BEL,2021/06/05,5,7313872,0
Belgium,6/6/21,1070802,25033,,,928,,9239.322510771712,,,,,56,BEL,2021/06/06,14,7525665,211793
Belgium,6/7/21,1071271,25041,,,469,,9243.369236737439,,,,,56,BEL,2021/06/07,8,7673969,148304
Belgium,6/8/21,1072175,25051,,,904,,9251.16932260741,,,,,56,BEL,2021/06/08,10,7830216,156247
Belgium,6/9/21,1073358,25061,,,1183,,9261.376735864242,,,,,56,BEL,2021/06/09,10,8000922,170706
Belgium,6/10/21,1074204,25068,,,846,,9268.676373746981,,,,,56,BEL,2021/06/10,7,8000922,0
Belgium,6/11/21,1074988,25075,,,784,,9275.441049988196,,,,,56,BEL,2021/06/11,7,8367977,367055
Belgium,6/12/21,1075765,25081,,,777,,9282.1453273344,,,,,56,BEL,2021/06/12,6,8367977,0
Belgium,6/13/21,1076338,25088,,,573,,9287.089408311716,,,,,56,BEL,2021/06/13,7,8582694,214717
Belgium,6/14/21,1076579,25093,,,241,,9289.168855982804,,,,,56,BEL,2021/06/14,5,8582694,0
Belgium,6/15/21,1077087,25099,,,508,,9293.552090077877,,,,,56,BEL,2021/06/15,6,8868241,285547
Belgium,6/16/21,1077758,25110,,,671,,9299.341755585345,,,,,56,BEL,2021/06/16,11,9037478,169237
Belgium,6/17/21,1078251,25117,,,493,,9303.595563476823,,,,,56,BEL,2021/06/17,7,9037478,0
Belgium,6/19/21,1079084,25132,,,833,,9310.783031983114,,,,,56,BEL,2021/06/19,15,9435894,0
Belgium,6/20/21,1079415,25136,,,331,,9313.63903687577,,,,,56,BEL,2021/06/20,4,9642996,207102
Belgium,6/21/21,1079640,25141,,,225,,9315.580429929689,,,,,56,BEL,2021/06/21,5,9748714,105718
Belgium,6/22/21,1080035,25144,,,395,,9318.988653291015,,,,,56,BEL,2021/06/22,3,9873185,124471
Belgium,6/23/21,1081061,25149,,,1026,,9327.84140561689,,,,,56,BEL,2021/06/23,5,9873185,0
Belgium,6/24/21,1081908,25152,,,847,,9335.149671913203,,,,,56,BEL,2021/06/24,3,10205537,332352
Belgium,6/25/21,1082476,25160,,,568,,9340.050610822655,,,,,56,BEL,2021/06/25,8,10205537,0
Belgium,6/28/21,1083478,25168,,,1002,,9348.696281222778,,,,,56,BEL,2021/06/28,8,10666126,104728
Belgium,6/29/21,1084550,25170,,,1072,,9357.94594057301,,,,,56,BEL,2021/06/29,2,10666126,0
Belgium,6/30/21,1085131,25173,,,581,,9362.95904885891,,,,,56,BEL,2021/06/30,3,10796060,129934
Belgium,7/1/21,1085885,25180,,,754,,9369.464872692935,,,,,56,BEL,2021/07/01,7,11060661,264601
Belgium,7/2/21,1086508,25185,,,623,,9374.8403743489,,,,,56,BEL,2021/07/02,5,11060661,0
Belize,6/4/21,12861,325,,,21,,3234.48711209921,,,,,84,BLZ,2021/06/04,0,78530,1743
Belize,6/7/21,12899,325,,,38,,3244.043951400957,,,,,84,BLZ,2021/06/07,0,80121,0
Belize,6/8/21,12909,325,,,10,,3246.558909111943,,,,,84,BLZ,2021/06/08,0,80121,0
Belize,6/9/21,12916,325,,,7,,3248.3193795096336,,,,,84,BLZ,2021/06/09,0,80121,0
Belize,6/10/21,12924,325,,,8,,3250.3313456784226,,,,,84,BLZ,2021/06/10,0,80121,0
Belize,6/11/21,12938,325,,,14,,3253.852286473803,,,,,84,BLZ,2021/06/11,0,80121,0
Belize,6/14/21,12971,326,,,33,,3262.151646920057,,,,,84,BLZ,2021/06/14,1,88569,0
Belize,6/15/21,12989,326,,,18,,3266.678570799832,,,,,84,BLZ,2021/06/15,0,88569,0
Belize,6/16/21,12994,327,,,5,,3267.936049655325,,,,,84,BLZ,2021/06/16,1,88569,0
Belize,6/18/21,13004,328,,,10,,3270.451007366311,,,,,84,BLZ,2021/06/18,1,95452,0
Belize,6/21/21,13039,329,,,35,,3279.2533593547623,,,,,84,BLZ,2021/06/21,1,97404,0
Belize,6/22/21,13059,329,,,20,,3284.2832747767347,,,,,84,BLZ,2021/06/22,0,97404,0
Belize,6/23/21,13083,329,,,24,,3290.3191732831015,,,,,84,BLZ,2021/06/23,0,97404,0
Belize,6/24/21,13104,329,,,21,,3295.600584476172,,,,,84,BLZ,2021/06/24,0,106010,8606
Belize,6/25/21,13137,329,,,33,,3303.899944922426,,,,,84,BLZ,2021/06/25,0,106010,0
Belize,6/28/21,13189,329,,,52,,3316.977725019554,,,,,84,BLZ,2021/06/28,0,106010,0
Belize,6/29/21,13227,329,,,38,,3326.534564321301,,,,,84,BLZ,2021/06/29,0,106010,0
Belize,6/30/21,13251,329,,,24,,3332.5704628276676,,,,,84,BLZ,2021/06/30,0,106010,0
Belize,7/1/21,13300,329,,,49,,3344.8937556114993,,,,,84,BLZ,2021/07/01,0,106010,0
Belize,7/2/21,13343,330,,,43,,3355.7080737687397,,,,,84,BLZ,2021/07/02,1,106010,0
Benin,6/4/21,8082,102,,,0,,66.66557784505376,,,,,204,BEN,2021/06/04,0,,
Benin,6/9/21,8109,102,,,27,,66.88829135678556,,,,,204,BEN,2021/06/09,0,,
Benin,6/15/21,8140,103,,,31,,67.143999462848,,,,,204,BEN,2021/06/15,1,,
Benin,6/22/21,8170,104,,,30,,67.39145892032779,,,,,204,BEN,2021/06/22,1,,
Benin,6/29/21,8199,104,,,29,,67.6306697292249,,,,,204,BEN,2021/06/29,0,,
Benin,7/2/21,8199,104,,,0,,67.6306697292249,,,,,204,BEN,2021/07/02,0,,
Bhutan,6/4/21,1669,1,,,15,,216.30042041855233,,,,,64,BTN,2021/06/04,0,483092,0
Bhutan,6/5/21,1682,1,,,13,,217.98520499940383,,,,,64,BTN,2021/06/05,0,483092,0
Bhutan,6/6/21,1687,1,,,5,,218.6331990689621,,,,,64,BTN,2021/06/06,0,483092,0
Bhutan,6/7/21,1703,1,,,16,,220.7067800915486,,,,,64,BTN,2021/06/07,0,483092,0
Bhutan,6/8/21,1724,1,,,21,,223.42835518369336,,,,,64,BTN,2021/06/08,0,483092,0
Bhutan,6/9/21,1739,1,,,15,,225.3723373923682,,,,,64,BTN,2021/06/09,0,483092,0
Bhutan,6/10/21,1769,1,,,30,,229.26030180971784,,,,,64,BTN,2021/06/10,0,483699,0
Bhutan,6/11/21,1789,1,,,20,,231.85227808795094,,,,,64,BTN,2021/06/11,0,483699,0
Bhutan,6/12/21,1808,1,,,19,,234.3146555522724,,,,,64,BTN,2021/06/12,0,483699,0
Bhutan,6/13/21,1813,1,,,5,,234.96264962183065,,,,,64,BTN,2021/06/13,0,483699,0
Bhutan,6/14/21,1826,1,,,13,,236.64743420268218,,,,,64,BTN,2021/06/14,0,483699,0
Bhutan,6/15/21,1842,1,,,16,,238.72101522526864,,,,,64,BTN,2021/06/15,0,483699,0
Bhutan,6/16/21,1854,1,,,12,,240.27620099220852,,,,,64,BTN,2021/06/16,0,483699,0
Bhutan,6/17/21,1882,1,,,28,,243.90496778173485,,,,,64,BTN,2021/06/17,0,484189,0
Bhutan,6/18/21,1889,1,,,7,,244.81215947911645,,,,,64,BTN,2021/06/18,0,484189,0
Bhutan,6/19/21,1903,1,,,14,,246.62654287387963,,,,,64,BTN,2021/06/19,0,484189,0
Bhutan,6/20/21,1924,1,,,21,,249.34811796602438,,,,,64,BTN,2021/06/20,0,484189,0
Bhutan,6/21/21,1939,1,,,15,,251.29210017469921,,,,,64,BTN,2021/06/21,0,484189,0
Bhutan,6/22/21,1963,1,,,24,,254.40247170857893,,,,,64,BTN,2021/06/22,0,484189,0
Bhutan,6/23/21,1970,1,,,7,,255.30966340596052,,,,,64,BTN,2021/06/23,0,484189,0
Bhutan,6/24/21,2006,1,,,36,,259.9752207067801,,,,,64,BTN,2021/06/24,0,484751,0
Bhutan,6/25/21,2013,1,,,7,,260.8824124041617,,,,,64,BTN,2021/06/25,0,484751,0
Bhutan,6/26/21,2027,1,,,14,,262.6967957989248,,,,,64,BTN,2021/06/26,0,484751,0
Bhutan,6/27/21,2052,1,,,25,,265.93676614671625,,,,,64,BTN,2021/06/27,0,484751,0
Bhutan,6/28/21,2062,1,,,10,,267.23275428583275,,,,,64,BTN,2021/06/28,0,484751,0
Bhutan,6/29/21,2076,1,,,14,,269.04713768059594,,,,,64,BTN,2021/06/29,0,484751,0
Bhutan,6/30/21,2100,1,,,24,,272.1575092144757,,,,,64,BTN,2021/06/30,0,485315,0
Bhutan,7/1/21,2104,1,,,4,,272.6759044701223,,,,,64,BTN,2021/07/01,0,485315,0
Bhutan,7/2/21,2122,1,,,18,,275.00868312053205,,,,,64,BTN,2021/07/02,0,485315,0
Bolivia,6/4/21,383457,14900,,,3000,,3284.982843784591,,,,,68,BOL,2021/06/04,68,1814885,38208
Bolivia,6/5/21,385734,14981,,,2277,,3304.4893489084966,,,,,68,BOL,2021/06/05,81,1814885,0
Bolivia,6/6/21,387162,15024,,,1428,,3316.722677550103,,,,,68,BOL,2021/06/06,43,1829560,14675
Bolivia,6/8/21,392975,15177,,,5813,,3366.521234548462,,,,,68,BOL,2021/06/08,153,1878702,0
Bolivia,6/10/21,400047,15321,,,7072,,3427.105338297369,,,,,68,BOL,2021/06/10,144,1940095,0
Bolivia,6/12/21,405347,15485,,,5300,,3472.509149082042,,,,,68,BOL,2021/06/12,164,2065191,125096
Bolivia,6/13/21,406954,15542,,,1607,,3486.275927182225,,,,,68,BOL,2021/06/13,57,2069629,4438
Bolivia,6/14/21,409106,15614,,,2152,,3504.7115877121523,,,,,68,BOL,2021/06/14,72,2069629,0
Bolivia,6/15/21,411677,15738,,,2571,,3526.736719321095,,,,,68,BOL,2021/06/15,124,2117222,47593
Bolivia,6/16/21,414513,15826,,,2836,,3551.0320414692706,,,,,68,BOL,2021/06/16,88,2117222,0
Bolivia,6/17/21,417195,15924,,,2682,,3574.0080830776656,,,,,68,BOL,2021/06/17,98,2151088,33866
Bolivia,6/19/21,420961,16088,,,3766,,3606.270489005039,,,,,68,BOL,2021/06/19,164,2181452,30364
Bolivia,6/20/21,422047,16132,,,1086,,3615.573986837521,,,,,68,BOL,2021/06/20,44,2205639,24187
Bolivia,6/21/21,422811,16174,,,764,,3622.118988995915,,,,,68,BOL,2021/06/21,42,2231841,26202
Bolivia,6/22/21,424478,16243,,,1667,,3636.3997725012077,,,,,68,BOL,2021/06/22,69,2231841,0
Bolivia,6/23/21,426748,16329,,,2270,,3655.8463103278505,,,,,68,BOL,2021/06/23,86,2231841,0
Bolivia,6/24/21,429178,16414,,,2430,,3676.6635292347855,,,,,68,BOL,2021/06/24,85,2231841,0
Bolivia,6/25/21,431360,16496,,,2182,,3695.356192467268,,,,,68,BOL,2021/06/25,82,2231841,0
Bolivia,6/26/21,433013,16551,,,1653,,3709.5170413780347,,,,,68,BOL,2021/06/26,55,2231841,0
Bolivia,6/27/21,433935,16581,,,922,,3717.4155911032176,,,,,68,BOL,2021/06/27,30,2231841,0
Bolivia,6/28/21,435568,16631,,,1633,,3731.405104878948,,,,,68,BOL,2021/06/28,50,2450510,218669
Bolivia,6/29/21,437623,16702,,,2055,,3749.0097900039486,,,,,68,BOL,2021/06/29,71,2450510,0
Bolivia,6/30/21,439624,16767,,,2001,,3766.1518702643502,,,,,68,BOL,2021/06/30,65,2549403,98893
Bolivia,7/1/21,441286,16822,,,1662,,3780.3898199858836,,,,,68,BOL,2021/07/01,55,2549403,0
Bolivia,7/2/21,442884,16879,,,1598,,3794.0794972753,,,,,68,BOL,2021/07/02,57,2549403,0
Bosnia and Herzegovina,6/4/21,204304,9374,,,52,,6227.233172245311,,,,,70,BIH,2021/06/04,42,232706,0
Bosnia and Herzegovina,6/7/21,204410,9411,,,106,,6230.464076761415,,,,,70,BIH,2021/06/07,37,232706,0
Bosnia and Herzegovina,6/8/21,204455,9460,,,45,,6231.835687169194,,,,,70,BIH,2021/06/08,49,232706,0
Bosnia and Herzegovina,6/9/21,204512,9467,,,57,,6233.573060352382,,,,,70,BIH,2021/06/09,7,232706,0
Bosnia and Herzegovina,6/10/21,204567,9473,,,55,,6235.249473073001,,,,,70,BIH,2021/06/10,6,232706,0
Bosnia and Herzegovina,6/11/21,204597,9479,,,30,,6236.1638800115215,,,,,70,BIH,2021/06/11,6,232706,0
Bosnia and Herzegovina,6/14/21,204668,9495,,,71,,6238.327976432685,,,,,70,BIH,2021/06/14,16,315780,0
Bosnia and Herzegovina,6/15/21,204697,9534,,,29,,6239.211903139921,,,,,70,BIH,2021/06/15,39,315780,0
Bosnia and Herzegovina,6/16/21,204730,9608,,,33,,6240.217750772293,,,,,70,BIH,2021/06/16,74,315780,0
Bosnia and Herzegovina,6/17/21,204791,9626,,,61,,6242.077044880617,,,,,70,BIH,2021/06/17,18,315780,0
Bosnia and Herzegovina,6/18/21,204814,9630,,,23,,6242.778090200149,,,,,70,BIH,2021/06/18,4,315780,0
Bosnia and Herzegovina,6/21/21,204860,9643,,,46,,6244.180180839212,,,,,70,BIH,2021/06/21,13,315780,0
Bosnia and Herzegovina,6/22/21,204886,9648,,,26,,6244.972666852596,,,,,70,BIH,2021/06/22,5,315780,0
Bosnia and Herzegovina,6/23/21,204910,9651,,,24,,6245.704192403412,,,,,70,BIH,2021/06/23,3,315780,0
Bosnia and Herzegovina,6/24/21,204936,9653,,,26,,6246.4966784167955,,,,,70,BIH,2021/06/24,2,315780,0
Bosnia and Herzegovina,6/25/21,204945,9655,,,9,,6246.771000498352,,,,,70,BIH,2021/06/25,2,315780,0
Bosnia and Herzegovina,6/28/21,204991,9658,,,46,,6248.173091137415,,,,,70,BIH,2021/06/28,3,456521,0
Bosnia and Herzegovina,6/29/21,205004,9663,,,13,,6248.569334144107,,,,,70,BIH,2021/06/29,5,456521,0
Bosnia and Herzegovina,6/30/21,205022,9665,,,18,,6249.117978307219,,,,,70,BIH,2021/06/30,2,456521,0
Bosnia and Herzegovina,7/1/21,205032,9667,,,10,,6249.42278062006,,,,,70,BIH,2021/07/01,2,456521,0
Bosnia and Herzegovina,7/2/21,205047,9667,,,15,,6249.879984089319,,,,,70,BIH,2021/07/02,0,456521,0
Botswana,6/4/21,56217,866,,,0,,2390.5597193430076,,,,,72,BWA,2021/06/04,0,142864,0
Botswana,6/7/21,58095,885,,,1878,,2470.419390846755,,,,,72,BWA,2021/06/07,19,146725,0
Botswana,6/10/21,59480,896,,,1385,,2529.3148354861,,,,,72,BWA,2021/06/10,11,146725,0
Botswana,6/14/21,61457,926,,,1977,,2613.3843618774254,,,,,72,BWA,2021/06/14,30,150019,0
Botswana,6/17/21,63247,940,,,1790,,2689.5019401477703,,,,,72,BWA,2021/06/17,14,153100,0
Botswana,6/21/21,65808,1069,,,2561,,2798.4053579971296,,,,,72,BWA,2021/06/21,129,153100,0
Botswana,6/24/21,67492,1095,,,1684,,2870.0154148726942,,,,,72,BWA,2021/06/24,26,200893,0
Botswana,6/28/21,69680,1125,,,2188,,2963.0574602668366,,,,,72,BWA,2021/06/28,30,219488,0
Botswana,7/1/21,71443,1158,,,1763,,3038.026896295115,,,,,72,BWA,2021/07/01,33,219488,0
Botswana,7/2/21,71443,1158,,,0,,3038.026896295115,,,,,72,BWA,2021/07/02,0,219488,0
Brazil,6/4/21,16841408,470842,,,37936,,7923.153380615581,,,,,76,BRA,2021/06/04,1454,66560478,738269
Brazil,6/5/21,16907425,472531,,,66017,,7954.211521165831,,,,,76,BRA,2021/06/05,1689,66976041,415563
Brazil,6/6/21,16947062,473404,,,39637,,7972.859013735779,,,,,76,BRA,2021/06/06,873,67142356,166315
Brazil,6/7/21,16984218,474414,,,37156,,7990.339303210991,,,,,76,BRA,2021/06/07,1010,68108379,966023
Brazil,6/8/21,17037129,476792,,,52911,,8015.231638134635,,,,,76,BRA,2021/06/08,2378,69142615,1034236
Brazil,6/9/21,17122877,479515,,,85748,,8055.572360007832,,,,,76,BRA,2021/06/09,2723,70232670,1090055
Brazil,6/10/21,17210969,482019,,,88092,,8097.015832406647,,,,,76,BRA,2021/06/10,2504,71276210,1043540
Brazil,6/11/21,17296118,484235,,,85149,,8137.074750711224,,,,,76,BRA,2021/06/11,2216,72500342,1224132
Brazil,6/12/21,17374818,486272,,,78700,,8174.099693700221,,,,,76,BRA,2021/06/12,2037,73055507,555165
Brazil,6/13/21,17412766,487401,,,37948,,8191.952584888867,,,,,76,BRA,2021/06/13,1129,73307186,251679
Brazil,6/14/21,17452612,488228,,,39846,,8210.698402910972,,,,,76,BRA,2021/06/14,827,74453932,1146746
Brazil,6/15/21,17533221,490696,,,80609,,8248.621447757225,,,,,76,BRA,2021/06/15,2468,75554111,1100179
Brazil,6/16/21,17628588,493693,,,95367,,8293.487492713155,,,,,76,BRA,2021/06/16,2997,77072203,1518092
Brazil,6/17/21,17702630,496004,,,74042,,8328.321048352182,,,,,76,BRA,2021/06/17,2311,78583564,1511361
Brazil,6/18/21,17801462,498499,,,98832,,8374.817225804387,,,,,76,BRA,2021/06/18,2495,80037782,1454218
Brazil,6/19/21,17883750,500800,,,82288,,8413.530167464853,,,,,76,BRA,2021/06/19,2301,80986713,948931
Brazil,6/20/21,17927928,501825,,,44178,,8434.314003949832,,,,,76,BRA,2021/06/20,1025,81272679,285966
Brazil,6/21/21,17966831,502586,,,38903,,8452.616181295462,,,,,76,BRA,2021/06/21,761,82651809,1379130
Brazil,6/22/21,18054653,504717,,,87822,,8493.932630382878,,,,,76,BRA,2021/06/22,2131,83985223,1333414
Brazil,6/23/21,18169881,507109,,,115228,,8548.14241603391,,,,,76,BRA,2021/06/23,2392,85390686,1405463
Brazil,6/24/21,18243483,509141,,,73602,,8582.768970721028,,,,,76,BRA,2021/06/24,2032,86334912,944226
Brazil,6/25/21,18322760,511142,,,79277,,8620.065367231051,,,,,76,BRA,2021/06/25,2001,88934516,2599604
Brazil,6/26/21,18386894,512735,,,64134,,8650.237637798475,,,,,76,BRA,2021/06/26,1593,88934516,0
Brazil,6/27/21,18420598,513474,,,33704,,8666.093910714628,,,,,76,BRA,2021/06/27,739,89957346,1022830
Brazil,6/28/21,18448402,514092,,,27804,,8679.174489048377,,,,,76,BRA,2021/06/28,618,90290049,332703
Brazil,6/29/21,18513305,515985,,,64903,,8709.708540824933,,,,,76,BRA,2021/06/29,1893,92258932,1968883
Brazil,6/30/21,18557141,518066,,,43836,,8730.331481115474,,,,,76,BRA,2021/06/30,2081,92258932,0
Brazil,7/1/21,18622304,520095,,,65163,,8760.987851636339,,,,,76,BRA,2021/07/01,2029,95647724,3388792
Brazil,7/2/21,18687469,521952,,,65165,,8791.645163070621,,,,,76,BRA,2021/07/02,1857,96840039,1192315
Brunei,6/4/21,244,3,,,0,,55.77359577400722,,,,,96,BRN,2021/06/04,0,55085,0
Brunei,6/8/21,246,3,,,2,,56.23075639510564,,,,,96,BRN,2021/06/08,0,56135,0
Brunei,6/10/21,248,3,,,2,,56.68791701620406,,,,,96,BRN,2021/06/10,0,58450,0
Brunei,6/15/21,250,3,,,2,,57.14507763730248,,,,,96,BRN,2021/06/15,0,63486,0
Brunei,6/18/21,251,3,,,1,,57.37365794785169,,,,,96,BRN,2021/06/18,0,63486,0
Brunei,6/20/21,255,3,,,4,,58.287979190048524,,,,,96,BRN,2021/06/20,0,65972,0
Brunei,6/22/21,256,3,,,1,,58.51655950059774,,,,,96,BRN,2021/06/22,0,66972,0
Brunei,6/26/21,259,3,,,3,,59.202300432245366,,,,,96,BRN,2021/06/26,0,69877,0
Brunei,6/30/21,260,3,,,1,,59.43088074279458,,,,,96,BRN,2021/06/30,0,79554,0
Brunei,7/1/21,261,3,,,1,,59.65946105334379,,,,,96,BRN,2021/07/01,0,79554,0
Brunei,7/2/21,261,3,,,0,,59.65946105334379,,,,,96,BRN,2021/07/02,0,79554,0
Bulgaria,6/4/21,419337,17810,,,157,,6034.976170927452,,,,,100,BGR,2021/06/04,18,1450850,21745
Bulgaria,6/5/21,419426,17813,,,89,,6036.257033048401,,,,,100,BGR,2021/06/05,3,1456841,5991
Bulgaria,6/6/21,419473,17820,,,47,,6036.933443381937,,,,,100,BGR,2021/06/06,7,1464251,7410
Bulgaria,6/7/21,419681,17854,,,208,,6039.92691890056,,,,,100,BGR,2021/06/07,34,1478774,14523
Bulgaria,6/8/21,419859,17860,,,178,,6042.488643142458,,,,,100,BGR,2021/06/08,6,1500534,21760
Bulgaria,6/9/21,419990,17872,,,131,,6044.373957050822,,,,,100,BGR,2021/06/09,12,1524541,24007
Bulgaria,6/10/21,420090,17887,,,100,,6045.813127973237,,,,,100,BGR,2021/06/10,15,1548304,23763
Bulgaria,6/11/21,420213,17893,,,123,,6047.583308207808,,,,,100,BGR,2021/06/11,6,1568793,20489
Bulgaria,6/12/21,420294,17898,,,81,,6048.749036654964,,,,,100,BGR,2021/06/12,5,1573761,4968
Bulgaria,6/13/21,420336,17900,,,42,,6049.353488442378,,,,,100,BGR,2021/06/13,2,1577024,3263
Bulgaria,6/14/21,420493,17915,,,157,,6051.612986790569,,,,,100,BGR,2021/06/14,15,1586678,9654
Bulgaria,6/15/21,420654,17932,,,161,,6053.930051975658,,,,,100,BGR,2021/06/15,17,1602136,15458
Bulgaria,6/16/21,420749,17957,,,95,,6055.297264351952,,,,,100,BGR,2021/06/16,25,1619744,17608
Bulgaria,6/17/21,420859,17980,,,110,,6056.880352366608,,,,,100,BGR,2021/06/17,23,1637956,18212
Bulgaria,6/18/21,420964,17987,,,105,,6058.391481835144,,,,,100,BGR,2021/06/18,7,1653186,15230
Bulgaria,6/19/21,421005,17989,,,41,,6058.981541913335,,,,,100,BGR,2021/06/19,2,1657042,3856
Bulgaria,6/20/21,421032,17990,,,27,,6059.370118062387,,,,,100,BGR,2021/06/20,1,1660175,3133
Bulgaria,6/21/21,421152,18000,,,120,,6061.097123169285,,,,,100,BGR,2021/06/21,10,1668677,8502
Bulgaria,6/22/21,421246,18008,,,94,,6062.449943836355,,,,,100,BGR,2021/06/22,8,1681399,12722
Bulgaria,6/23/21,421339,18013,,,93,,6063.788372794201,,,,,100,BGR,2021/06/23,5,1695298,13899
Bulgaria,6/24/21,421401,18022,,,62,,6064.680658766098,,,,,100,BGR,2021/06/24,9,1709510,14212
Bulgaria,6/25/21,421487,18026,,,86,,6065.918345759375,,,,,100,BGR,2021/06/25,4,1721790,12280
Bulgaria,6/26/21,421515,18027,,,28,,6066.321313617651,,,,,100,BGR,2021/06/26,1,1724896,3106
Bulgaria,6/27/21,421531,18027,,,16,,6066.551580965238,,,,,100,BGR,2021/06/27,0,1727616,2720
Bulgaria,6/28/21,421646,18040,,,115,,6068.206627526015,,,,,100,BGR,2021/06/28,13,1735675,8059
Bulgaria,6/29/21,421751,18049,,,105,,6069.717756994551,,,,,100,BGR,2021/06/29,9,1748265,12590
Bulgaria,6/30/21,421829,18061,,,78,,6070.8403103140345,,,,,100,BGR,2021/06/30,12,1761277,13012
Bulgaria,7/1/21,421902,18067,,,73,,6071.890905087397,,,,,100,BGR,2021/07/01,6,1773581,12304
Bulgaria,7/2/21,421983,18083,,,81,,6073.056633534554,,,,,100,BGR,2021/07/02,16,1785306,11725
Burkina Faso,6/4/21,13447,167,,,1,,64.32962332510719,,,,,854,BFA,2021/06/04,0,,
Burkina Faso,6/5/21,13452,167,,,5,,64.3535430184682,,,,,854,BFA,2021/06/05,0,,
Burkina Faso,6/6/21,13453,167,,,1,,64.3583269571404,,,,,854,BFA,2021/06/06,0,,
Burkina Faso,6/8/21,13454,167,,,1,,64.36311089581261,,,,,854,BFA,2021/06/08,0,,
Burkina Faso,6/10/21,13456,167,,,2,,64.37267877315702,,,,,854,BFA,2021/06/10,0,,
Burkina Faso,6/12/21,13459,167,,,3,,64.38703058917362,,,,,854,BFA,2021/06/12,0,,
Burkina Faso,6/16/21,13460,167,,,1,,64.39181452784582,,,,,854,BFA,2021/06/16,0,,
Burkina Faso,6/18/21,13462,167,,,2,,64.40138240519023,,,,,854,BFA,2021/06/18,0,,
Burkina Faso,6/19/21,13468,167,,,6,,64.43008603722345,,,,,854,BFA,2021/06/19,0,,
Burkina Faso,6/20/21,13469,167,,,1,,64.43486997589565,,,,,854,BFA,2021/06/20,0,,
Burkina Faso,6/22/21,13469,168,,,0,,64.43486997589565,,,,,854,BFA,2021/06/22,1,,
Burkina Faso,6/23/21,13473,168,,,4,,64.45400573058446,,,,,854,BFA,2021/06/23,0,,
Burkina Faso,6/24/21,13474,168,,,1,,64.45878966925666,,,,,854,BFA,2021/06/24,0,,
Burkina Faso,6/25/21,13477,168,,,3,,64.47314148527326,,,,,854,BFA,2021/06/25,0,,
Burkina Faso,6/26/21,13478,168,,,1,,64.47792542394546,,,,,854,BFA,2021/06/26,0,,
Burkina Faso,6/28/21,13479,168,,,1,,64.48270936261767,,,,,854,BFA,2021/06/28,0,,
Burkina Faso,7/1/21,13485,168,,,6,,64.51141299465088,,,,,854,BFA,2021/07/01,0,,
Burkina Faso,7/2/21,13488,168,,,3,,64.5257648106675,,,,,854,BFA,2021/07/02,0,,
Burma,6/4/21,144157,3221,,,212,,264.94678513210323,,,,,104,MMR,2021/06/04,0,2994900,0
Burma,6/5/21,144253,3223,,,96,,265.1232239548637,,,,,104,MMR,2021/06/05,2,2994900,0
Burma,6/6/21,144317,3225,,,64,,265.24084983670406,,,,,104,MMR,2021/06/06,2,2994900,0
Burma,6/7/21,144456,3227,,,139,,265.49631854882597,,,,,104,MMR,2021/06/07,2,2994900,0
Burma,6/8/21,144579,3228,,,123,,265.7223807904878,,,,,104,MMR,2021/06/08,1,2994900,0
Burma,6/9/21,144715,3233,,,136,,265.9723357893985,,,,,104,MMR,2021/06/09,5,2994900,0
Burma,6/10/21,144876,3237,,,161,,266.26823839840307,,,,,104,MMR,2021/06/10,4,2994900,0
Burma,6/11/21,145064,3239,,,188,,266.613764426309,,,,,104,MMR,2021/06/11,2,2994900,0
Burma,6/12/21,145230,3241,,,166,,266.91885655733233,,,,,104,MMR,2021/06/12,2,2994900,0
Burma,6/13/21,145603,3244,,,373,,267.6043948999329,,,,,104,MMR,2021/06/13,3,2994900,0
Burma,6/14/21,145826,3248,,,223,,268.01424758197027,,,,,104,MMR,2021/06/14,4,2994900,0
Burma,6/15/21,146051,3248,,,225,,268.4277760728151,,,,,104,MMR,2021/06/15,0,2994900,0
Burma,6/16/21,146406,3250,,,355,,269.08023213614814,,,,,104,MMR,2021/06/16,2,2994900,0
Burma,6/17/21,146768,3250,,,362,,269.7455535303074,,,,,104,MMR,2021/06/17,0,2994900,0
Burma,6/18/21,147069,3251,,,301,,270.2987627558377,,,,,104,MMR,2021/06/18,1,2994900,0
Burma,6/19/21,147615,3258,,,546,,271.3022585602879,,,,,104,MMR,2021/06/19,7,2994900,0
Burma,6/20/21,148022,3262,,,407,,272.05028565261614,,,,,104,MMR,2021/06/20,4,2994900,0
Burma,6/21/21,148617,3265,,,595,,273.14383877285036,,,,,104,MMR,2021/06/21,3,2994900,0
Burma,6/22/21,149247,3267,,,630,,274.30171854721596,,,,,104,MMR,2021/06/22,2,2994900,0
Burma,6/23/21,149927,3269,,,680,,275.55149354176933,,,,,104,MMR,2021/06/23,2,2994900,0
Burma,6/24/21,150714,3275,,,787,,276.9979243075245,,,,,104,MMR,2021/06/24,6,2994900,0
Burma,6/25/21,151573,3282,,,859,,278.57668419035,,,,,104,MMR,2021/06/25,7,2994900,0
Burma,6/26/21,152356,3290,,,783,,280.0157633384901,,,,,104,MMR,2021/06/26,8,2994900,0
Burma,6/27/21,153160,3297,,,804,,281.4934384791091,,,,,104,MMR,2021/06/27,7,2994900,0
Burma,6/28/21,154385,3309,,,1225,,283.7448713737089,,,,,104,MMR,2021/06/28,12,2994900,0
Burma,6/29/21,155697,3320,,,1312,,286.15620195143543,,,,,104,MMR,2021/06/29,11,2994900,0
Burma,6/30/21,157277,3334,,,1580,,289.0600909093683,,,,,104,MMR,2021/06/30,14,3368042,373142
Burma,7/1/21,159347,3347,,,2070,,292.86455302514105,,,,,104,MMR,2021/07/01,13,3368042,0
Burma,7/2/21,161210,3364,,,1863,,296.2885689293365,,,,,104,MMR,2021/07/02,17,3368042,0
Burundi,6/4/21,4861,6,,,17,,40.880409789735424,,,,,108,BDI,2021/06/04,0,,
Burundi,6/5/21,4881,6,,,20,,41.04860732024246,,,,,108,BDI,2021/06/05,0,,
Burundi,6/6/21,4905,8,,,24,,41.250444356850906,,,,,108,BDI,2021/06/06,2,,
Burundi,6/7/21,4925,8,,,20,,41.41864188735794,,,,,108,BDI,2021/06/07,0,,
Burundi,6/9/21,4942,8,,,17,,41.561609788288926,,,,,108,BDI,2021/06/09,0,,
Burundi,6/10/21,4960,8,,,18,,41.71298756574526,,,,,108,BDI,2021/06/10,0,,
Burundi,6/11/21,4975,8,,,15,,41.83913571362554,,,,,108,BDI,2021/06/11,0,,
Burundi,6/12/21,4995,8,,,20,,42.007333244132575,,,,,108,BDI,2021/06/12,0,,
Burundi,6/13/21,5013,8,,,18,,42.15871102158891,,,,,108,BDI,2021/06/13,0,,
Burundi,6/14/21,5026,8,,,13,,42.26803941641848,,,,,108,BDI,2021/06/14,0,,
Burundi,6/15/21,5037,8,,,11,,42.36054805819735,,,,,108,BDI,2021/06/15,0,,
Burundi,6/16/21,5082,8,,,45,,42.73899250183819,,,,,108,BDI,2021/06/16,0,,
Burundi,6/17/21,5098,8,,,16,,42.87355052624382,,,,,108,BDI,2021/06/17,0,,
Burundi,6/18/21,5121,8,,,23,,43.066977686326915,,,,,108,BDI,2021/06/18,0,,
Burundi,6/21/21,5242,8,,,121,,44.08457274589449,,,,,108,BDI,2021/06/21,0,,
Burundi,6/22/21,5273,8,,,31,,44.3452789181804,,,,,108,BDI,2021/06/22,0,,
Burundi,6/23/21,5300,8,,,27,,44.572345584364896,,,,,108,BDI,2021/06/23,0,,
Burundi,6/24/21,5334,8,,,34,,44.85828138622686,,,,,108,BDI,2021/06/24,0,,
Burundi,6/25/21,5348,8,,,14,,44.97601965758179,,,,,108,BDI,2021/06/25,0,,
Burundi,6/28/21,5423,8,,,75,,45.60676039698318,,,,,108,BDI,2021/06/28,0,,
Burundi,6/29/21,5428,8,,,5,,45.648809779609934,,,,,108,BDI,2021/06/29,0,,
Burundi,6/30/21,5452,8,,,24,,45.85064681621838,,,,,108,BDI,2021/06/30,0,,
Burundi,7/1/21,5482,8,,,30,,46.10294311197894,,,,,108,BDI,2021/07/01,0,,
Burundi,7/2/21,5494,8,,,12,,46.20386163028316,,,,,108,BDI,2021/07/02,0,,
Cabo Verde,6/4/21,30907,267,,,133,,5558.932926609927,,,,,132,CPV,2021/06/04,1,,
Cabo Verde,6/5/21,31003,267,,,96,,5576.199486319849,,,,,132,CPV,2021/06/05,0,,
Cabo Verde,6/6/21,31097,267,,,94,,5593.106326035814,,,,,132,CPV,2021/06/06,0,,
Cabo Verde,6/7/21,31147,267,,,50,,5602.099325884731,,,,,132,CPV,2021/06/07,0,,
Cabo Verde,6/8/21,31225,269,,,78,,5616.128405649043,,,,,132,CPV,2021/06/08,2,,
Cabo Verde,6/9/21,31339,270,,,114,,5636.6324453045745,,,,,132,CPV,2021/06/09,1,,
Cabo Verde,6/10/21,31433,271,,,94,,5653.53928502054,,,,,132,CPV,2021/06/10,1,,
Cabo Verde,6/11/21,31512,272,,,79,,5667.74822478183,,,,,132,CPV,2021/06/11,1,,
Cabo Verde,6/12/21,31571,273,,,59,,5678.359964603553,,,,,132,CPV,2021/06/12,1,,
Cabo Verde,6/14/21,31647,276,,,76,,5692.029324373907,,,,,132,CPV,2021/06/14,3,,
Cabo Verde,6/15/21,31704,276,,,57,,5702.281344201673,,,,,132,CPV,2021/06/15,0,,
Cabo Verde,6/16/21,31783,279,,,79,,5716.490283962963,,,,,132,CPV,2021/06/16,3,,
Cabo Verde,6/17/21,31858,280,,,75,,5729.979783736339,,,,,132,CPV,2021/06/17,1,,
Cabo Verde,6/18/21,31910,281,,,52,,5739.332503579214,,,,,132,CPV,2021/06/18,1,,
Cabo Verde,6/19/21,31964,281,,,54,,5749.044943416045,,,,,132,CPV,2021/06/19,0,,
Cabo Verde,6/20/21,32002,283,,,38,,5755.879623301223,,,,,132,CPV,2021/06/20,2,,
Cabo Verde,6/21/21,32039,283,,,37,,5762.534443189421,,,,,132,CPV,2021/06/21,0,,
Cabo Verde,6/22/21,32111,284,,,72,,5775.4843629718625,,,,,132,CPV,2021/06/22,1,,
Cabo Verde,6/23/21,32192,284,,,81,,5790.053022727109,,,,,132,CPV,2021/06/23,0,,
Cabo Verde,6/24/21,32257,285,,,65,,5801.743922530703,,,,,132,CPV,2021/06/24,1,,
Cabo Verde,6/25/21,32313,286,,,56,,5811.81608236149,,,,,132,CPV,2021/06/25,1,,
Cabo Verde,6/26/21,32344,286,,,31,,5817.391742267819,,,,,132,CPV,2021/06/26,0,,
Cabo Verde,6/27/21,32372,286,,,28,,5822.427822183213,,,,,132,CPV,2021/06/27,0,,
Cabo Verde,6/28/21,32399,286,,,27,,5827.284042101628,,,,,132,CPV,2021/06/28,0,,
Cabo Verde,6/29/21,32457,286,,,58,,5837.715921926372,,,,,132,CPV,2021/06/29,0,,
Cabo Verde,7/1/21,32594,287,,,137,,5862.356741512407,,,,,132,CPV,2021/07/01,1,,
Cabo Verde,7/2/21,32666,287,,,72,,5875.306661294848,,,,,132,CPV,2021/07/02,0,,
Cambodia,6/4/21,33075,242,,,886,,197.82916065827257,,,,,116,KHM,2021/06/04,6,4782587,0
Cambodia,6/5/21,33613,252,,,538,,201.0470620470602,,,,,116,KHM,2021/06/05,10,4782587,0
Cambodia,6/6/21,34244,263,,,631,,204.8212177651364,,,,,116,KHM,2021/06/06,11,4782587,0
Cambodia,6/7/21,34833,266,,,589,,208.34416185063063,,,,,116,KHM,2021/06/07,3,4969942,187355
Cambodia,6/8/21,35511,278,,,678,,212.3994353480247,,,,,116,KHM,2021/06/08,12,4969942,0
Cambodia,6/9/21,36240,289,,,729,,216.7597515421254,,,,,116,KHM,2021/06/09,11,5005581,35639
Cambodia,6/10/21,36666,300,,,426,,219.30775524402787,,,,,116,KHM,2021/06/10,11,5005581,0
Cambodia,6/11/21,37321,311,,,655,,223.2254604664366,,,,,116,KHM,2021/06/11,11,5128310,122729
Cambodia,6/12/21,37959,320,,,638,,227.04148478994313,,,,,116,KHM,2021/06/12,9,5223954,95644
Cambodia,6/13/21,38427,335,,,468,,229.8407001244275,,,,,116,KHM,2021/06/13,15,5428433,204479
Cambodia,6/14/21,38969,348,,,542,,233.0825264306039,,,,,116,KHM,2021/06/14,13,5537538,109105
Cambodia,6/15/21,39464,361,,,495,,236.0432349574624,,,,,116,KHM,2021/06/15,13,5667915,130377
Cambodia,6/16/21,40157,368,,,693,,240.1882268950643,,,,,116,KHM,2021/06/16,7,5667915,0
Cambodia,6/17/21,40782,380,,,625,,243.92649523705734,,,,,116,KHM,2021/06/17,12,5762050,94135
Cambodia,6/18/21,41581,394,,,799,,248.70549748546128,,,,,116,KHM,2021/06/18,14,5762050,0
Cambodia,6/19/21,42052,414,,,471,,251.52265650798725,,,,,116,KHM,2021/06/19,20,5762050,0
Cambodia,6/20/21,42711,431,,,659,,255.46428664778472,,,,,116,KHM,2021/06/20,17,5762050,0
Cambodia,6/21/21,43446,441,,,735,,259.86049021796856,,,,,116,KHM,2021/06/21,10,6171269,409219
Cambodia,6/22/21,44124,459,,,678,,263.91576371536263,,,,,116,KHM,2021/06/22,18,6275739,104470
Cambodia,6/23/21,44711,475,,,587,,267.4267453421625,,,,,116,KHM,2021/06/23,16,6378584,102845
Cambodia,6/24/21,45366,493,,,655,,271.3444505645712,,,,,116,KHM,2021/06/24,18,6378584,0
Cambodia,6/25/21,46065,509,,,699,,275.5253298782563,,,,,116,KHM,2021/06/25,16,6536561,157977
Cambodia,6/26/21,46810,523,,,745,,279.981345741912,,,,,116,KHM,2021/06/26,14,6616277,79716
Cambodia,6/27/21,47649,540,,,839,,284.99959716420346,,,,,116,KHM,2021/06/27,17,6836447,220170
Cambodia,6/28/21,48532,556,,,883,,290.28102267777126,,,,,116,KHM,2021/06/28,16,6957895,121448
Cambodia,6/29/21,49255,575,,,723,,294.6054514957888,,,,,116,KHM,2021/06/29,19,7093483,135588
Cambodia,6/30/21,50385,602,,,1130,,301.3642406581123,,,,,116,KHM,2021/06/30,27,7251656,158173
Cambodia,7/1/21,51384,628,,,999,,307.33948877595395,,,,,116,KHM,2021/07/01,26,7251656,0
Cambodia,7/2/21,52350,660,,,966,,313.11735632533845,,,,,116,KHM,2021/07/02,32,7251656,0
Cameroon,6/4/21,78929,1275,,,0,,297.3306877485698,,,,,120,CMR,2021/06/04,0,75215,0
Cameroon,6/8/21,79904,1302,,,975,,301.00357630100115,,,,,120,CMR,2021/06/08,27,80445,0
Cameroon,6/11/21,80090,1310,,,186,,301.7042504248496,,,,,120,CMR,2021/06/11,8,86451,0
Cameroon,6/16/21,80328,1313,,,238,,302.6008119381611,,,,,120,CMR,2021/06/16,3,89180,0
Cameroon,6/22/21,80487,1320,,,159,,303.19977530209604,,,,,120,CMR,2021/06/22,7,100991,0
Cameroon,6/29/21,80858,1324,,,371,,304.59735648461094,,,,,120,CMR,2021/06/29,4,110324,0
Cameroon,7/2/21,80858,1324,,,0,,304.59735648461094,,,,,120,CMR,2021/07/02,0,110324,0
Canada,6/4/21,1397370,25668,,,2034,,3691.3065302553364,,,,,124,CAN,2021/06/04,41,25397448,463924
Canada,6/5/21,1398719,25686,,,1349,,3694.870062111119,,,,,124,CAN,2021/06/05,18,25772487,375039
Canada,6/6/21,1400093,25694,,,1374,,3698.4996342162667,,,,,124,CAN,2021/06/06,8,26095464,322977
Canada,6/7/21,1401912,25741,,,1819,,3703.3047227601273,,,,,124,CAN,2021/06/07,47,26503428,407964
Canada,6/8/21,1402983,25774,,,1071,,3706.1338870429613,,,,,124,CAN,2021/06/08,33,26855647,352219
Canada,6/9/21,1404443,25816,,,1460,,3709.990637605928,,,,,124,CAN,2021/06/09,42,27257774,402127
Canada,6/10/21,1405906,25849,,,1463,,3713.8553129988186,,,,,124,CAN,2021/06/10,33,27729564,471790
Canada,6/11/21,1407304,25863,,,1398,,3717.548283743358,,,,,124,CAN,2021/06/11,14,28240474,510910
Canada,6/12/21,1408490,25883,,,1186,,3720.6812331732744,,,,,124,CAN,2021/06/12,20,28644442,403968
Canada,6/13/21,1409496,25895,,,1006,,3723.338692807757,,,,,124,CAN,2021/06/13,12,29023531,379089
Canada,6/14/21,1410828,25921,,,1332,,3726.8573172939705,,,,,124,CAN,2021/06/14,26,29470746,447215
Canada,6/15/21,1411652,25943,,,824,,3729.0340039130697,,,,,124,CAN,2021/06/15,22,29917852,447106
Canada,6/16/21,1412737,25992,,,1085,,3731.9001507355483,,,,,124,CAN,2021/06/16,49,30379626,461774
Canada,6/17/21,1413840,26004,,,1103,,3734.8138465375705,,,,,124,CAN,2021/06/17,12,30885092,505466
Canada,6/18/21,1414805,26016,,,965,,3737.363000163093,,,,,124,CAN,2021/06/18,12,31417347,532255
Canada,6/19/21,1415614,26042,,,809,,3739.5000626325723,,,,,124,CAN,2021/06/19,26,31836378,419031
Canada,6/20/21,1416203,26055,,,589,,3741.0559709076324,,,,,124,CAN,2021/06/20,13,32189274,352896
Canada,6/21/21,1417236,26103,,,1033,,3743.78475401143,,,,,124,CAN,2021/06/21,48,32586269,396995
Canada,6/22/21,1417702,26121,,,466,,3745.0157442596096,,,,,124,CAN,2021/06/22,18,33067395,481126
Canada,6/23/21,1418467,26144,,,765,,3747.0365758902053,,,,,124,CAN,2021/06/23,23,33585366,517971
Canada,6/24/21,1419198,26162,,,731,,3748.9675927816634,,,,,124,CAN,2021/06/24,18,34174571,589205
Canada,6/25/21,1419804,26174,,,606,,3750.568408426292,,,,,124,CAN,2021/06/25,12,34694975,520404
Canada,6/26/21,1420258,26184,,,454,,3751.767699354776,,,,,124,CAN,2021/06/26,10,35135821,440846
Canada,6/27/21,1420607,26187,,,349,,3752.689621235924,,,,,124,CAN,2021/06/27,3,35495821,360000
Canada,6/28/21,1421695,26215,,,1088,,3755.5636928883264,,,,,124,CAN,2021/06/28,28,36199547,703726
Canada,6/29/21,1422226,26246,,,531,,3756.9663877848575,,,,,124,CAN,2021/06/29,31,36775433,575886
Canada,6/30/21,1422830,26273,,,604,,3758.5619202095368,,,,,124,CAN,2021/06/30,27,37384820,609387
Canada,7/1/21,1422902,26273,,,72,,3758.7521161277105,,,,,124,CAN,2021/07/01,0,37423481,38661
Canada,7/2/21,1423837,26306,,,935,,3761.222021453994,,,,,124,CAN,2021/07/02,33,38417799,994318
Central African Republic,6/4/21,7091,98,,,0,,146.8187679563639,,,,,140,CAF,2021/06/04,0,,
Central African Republic,6/7/21,7101,98,,,10,,147.02581741054016,,,,,140,CAF,2021/06/07,0,,
Central African Republic,6/21/21,7129,98,,,28,,147.60555588223357,,,,,140,CAF,2021/06/21,0,,
Central African Republic,6/22/21,7137,98,,,8,,147.77119544557456,,,,,140,CAF,2021/06/22,0,,
Central African Republic,6/23/21,7139,98,,,2,,147.8126053364098,,,,,140,CAF,2021/06/23,0,,
Central African Republic,6/28/21,7141,98,,,2,,147.85401522724507,,,,,140,CAF,2021/06/28,0,,
Central African Republic,7/2/21,7141,98,,,0,,147.85401522724507,,,,,140,CAF,2021/07/02,0,,
Chad,6/4/21,4938,174,,,3,,30.06235472981961,,,,,148,TCD,2021/06/04,1,,
Chad,6/5/21,4939,174,,,1,,30.06844269149029,,,,,148,TCD,2021/06/05,0,,
Chad,6/7/21,4940,174,,,1,,30.07453065316097,,,,,148,TCD,2021/06/07,0,,
Chad,6/8/21,4942,174,,,2,,30.08670657650233,,,,,148,TCD,2021/06/08,0,,
Chad,6/14/21,4943,174,,,1,,30.09279453817301,,,,,148,TCD,2021/06/14,0,,
Chad,6/17/21,4944,174,,,1,,30.098882499843693,,,,,148,TCD,2021/06/17,0,,
Chad,6/18/21,4945,174,,,1,,30.104970461514373,,,,,148,TCD,2021/06/18,0,,
Chad,6/19/21,4946,174,,,1,,30.111058423185053,,,,,148,TCD,2021/06/19,0,,
Chad,6/21/21,4947,174,,,1,,30.117146384855733,,,,,148,TCD,2021/06/21,0,,
Chad,6/22/21,4948,174,,,1,,30.123234346526413,,,,,148,TCD,2021/06/22,0,,
Chad,6/23/21,4951,174,,,3,,30.141498231538453,,,,,148,TCD,2021/06/23,0,,
Chad,7/2/21,4951,174,,,0,,30.141498231538453,,,,,148,TCD,2021/07/02,0,,
Chile,6/4/21,1411346,29696,,,8245,,7382.980589927637,,,,,152,CHL,2021/06/04,98,19274563,165590
Chile,6/5/21,1420266,29816,,,8920,,7429.642561451384,,,,,152,CHL,2021/06/05,120,19421783,147220
Chile,6/6/21,1427956,29937,,,7690,,7469.870202821072,,,,,152,CHL,2021/06/06,121,19462408,40625
Chile,6/7/21,1434884,30058,,,6928,,7506.111698192879,,,,,152,CHL,2021/06/07,121,19467845,5437
Chile,6/8/21,1440417,30104,,,5533,,7535.055721560692,,,,,152,CHL,2021/06/08,46,19644506,176661
Chile,6/9/21,1445768,30141,,,5351,,7563.047673312214,,,,,152,CHL,2021/06/09,37,19829017,184511
Chile,6/10/21,1453477,30339,,,7709,,7603.374706773712,,,,,152,CHL,2021/06/10,198,20020810,191793
Chile,6/11/21,1461419,30472,,,7942,,7644.920601150573,,,,,152,CHL,2021/06/11,133,20223473,202663
Chile,6/12/21,1468992,30579,,,7573,,7684.536196481216,,,,,152,CHL,2021/06/12,107,20403835,180362
Chile,6/13/21,1476473,30707,,,7481,,7723.670524840987,,,,,152,CHL,2021/06/13,128,20403835,0
Chile,6/14/21,1482663,30804,,,6190,,7756.051422120358,,,,,152,CHL,2021/06/14,97,20443746,39911
Chile,6/15/21,1487239,30865,,,4576,,7779.98922275855,,,,,152,CHL,2021/06/15,61,20865931,422185
Chile,6/16/21,1491561,30922,,,4322,,7802.5983080641145,,,,,152,CHL,2021/06/16,57,20865931,0
Chile,6/17/21,1498231,31140,,,6670,,7837.490163452388,,,,,152,CHL,2021/06/17,218,20865931,0
Chile,6/18/21,1505001,31259,,,6770,,7872.9051351133485,,,,,152,CHL,2021/06/18,119,20865931,0
Chile,6/19/21,1511275,31392,,,6274,,7905.725450061777,,,,,152,CHL,2021/06/19,133,21385816,519885
Chile,6/20/21,1517018,31513,,,5743,,7935.768017602235,,,,,152,CHL,2021/06/20,121,21385816,0
Chile,6/21/21,1522223,31645,,,5205,,7962.996219595632,,,,,152,CHL,2021/06/21,132,21385816,0
Chile,6/22/21,1525933,31690,,,3710,,7982.403833312348,,,,,152,CHL,2021/06/22,45,21446822,61006
Chile,6/23/21,1528409,31746,,,2476,,7995.356192224096,,,,,152,CHL,2021/06/23,56,21731308,284486
Chile,6/24/21,1531872,31797,,,3463,,8013.471708747273,,,,,152,CHL,2021/06/24,51,21966892,235584
Chile,6/25/21,1537471,32012,,,5599,,8042.7609888550605,,,,,152,CHL,2021/06/25,215,22211686,244794
Chile,6/26/21,1542642,32163,,,5171,,8069.811331315744,,,,,152,CHL,2021/06/26,151,22409489,197803
Chile,6/27/21,1547103,32298,,,4461,,8093.147548240344,,,,,152,CHL,2021/06/27,135,22494947,85458
Chile,6/28/21,1551137,32454,,,4034,,8114.250058680568,,,,,152,CHL,2021/06/28,156,22494947,0
Chile,6/29/21,1553774,32489,,,2637,,8128.044634791344,,,,,152,CHL,2021/06/29,35,22501356,6409
Chile,6/30/21,1555902,32545,,,2128,,8139.176549074139,,,,,152,CHL,2021/06/30,56,22694682,193326
Chile,7/1/21,1558557,32588,,,2655,,8153.065286113999,,,,,152,CHL,2021/07/01,43,22883806,189124
Chile,7/2/21,1562613,32809,,,4056,,8174.282882134214,,,,,152,CHL,2021/07/02,221,22883806,0
China,6/4/21,103119,4846,,,25,,7.341121779990412,,,,,156,CHN,2021/06/04,0,744483000,20997000
China,6/5/21,103150,4846,,,31,,7.3433286940914,,,,,156,CHN,2021/06/05,0,744483000,0
China,6/6/21,103176,4846,,,26,,7.345179654305131,,,,,156,CHN,2021/06/06,0,777879000,33396000
China,6/7/21,103216,4846,,,40,,7.348027285403179,,,,,156,CHN,2021/06/07,0,794134000,16255000
China,6/8/21,103235,4846,,,19,,7.3493799101747515,,,,,156,CHN,2021/06/08,0,808962000,14828000
China,6/9/21,103261,4846,,,26,,7.351230870388483,,,,,156,CHN,2021/06/09,0,824856000,15894000
China,6/10/21,103285,4846,,,24,,7.3529394490473114,,,,,156,CHN,2021/06/10,0,824856000,0
China,6/11/21,103320,4846,,,35,,7.355431126258104,,,,,156,CHN,2021/06/11,0,863513000,38657000
China,6/12/21,103357,4846,,,37,,7.358065185023798,,,,,156,CHN,2021/06/12,0,878523000,15010000
China,6/13/21,103380,4846,,,23,,7.359702572905176,,,,,156,CHN,2021/06/13,0,892770000,14247000
China,6/14/21,103401,4846,,,21,,7.361197579231651,,,,,156,CHN,2021/06/14,0,904134000,11364000
China,6/15/21,103424,4846,,,23,,7.362834967113029,,,,,156,CHN,2021/06/15,0,923910000,19776000
China,6/16/21,103444,4846,,,20,,7.364258782662053,,,,,156,CHN,2021/06/16,0,923910000,0
China,6/17/21,103467,4846,,,23,,7.36589617054343,,,,,156,CHN,2021/06/17,0,966652000,42742000
China,6/18/21,103501,4846,,,34,,7.368316656976772,,,,,156,CHN,2021/06/18,0,966652000,0
China,6/19/21,103525,4846,,,24,,7.3700252356356,,,,,156,CHN,2021/06/19,0,990257000,23605000
China,6/20/21,103543,4846,,,18,,7.371306669629722,,,,,156,CHN,2021/06/20,0,1010489000,20232000
China,6/21/21,103571,4846,,,28,,7.373300011398356,,,,,156,CHN,2021/06/21,0,1049744000,39255000
China,6/22/21,103602,4846,,,31,,7.375506925499343,,,,,156,CHN,2021/06/22,0,1071783000,22039000
China,6/23/21,103620,4846,,,18,,7.376788359493465,,,,,156,CHN,2021/06/23,0,1095902000,24119000
China,6/24/21,103651,4846,,,31,,7.378995273594452,,,,,156,CHN,2021/06/24,0,1095902000,0
China,6/25/21,103680,4847,,,29,,7.381059806140536,,,,,156,CHN,2021/06/25,1,1120643000,24741000
China,6/26/21,103696,4846,,,16,,7.3821988585797556,,,,,156,CHN,2021/06/26,,1143805000,23162000
China,6/27/21,103724,4846,,,28,,7.384192200348389,,,,,156,CHN,2021/06/27,0,1185787000,41982000
China,6/28/21,103745,4846,,,21,,7.385687206674865,,,,,156,CHN,2021/06/28,0,1206714000,20927000
China,6/29/21,103755,4847,,,10,,7.386399114449376,,,,,156,CHN,2021/06/29,1,1225734000,19020000
China,6/30/21,103769,4847,,,14,,7.387395785333693,,,,,156,CHN,2021/06/30,0,1244675000,18941000
China,7/1/21,103791,4847,,,22,,7.388961982437619,,,,,156,CHN,2021/07/01,0,1264149000,19474000
China,7/2/21,103825,4847,,,34,,7.391382468870961,,,,,156,CHN,2021/07/02,0,1264149000,0
Colombia,6/4/21,3518046,90890,,,30000,,6914.006682482856,,,,,170,COL,2021/06/04,537,10979983,282300
Colombia,6/5/21,3547017,91422,,,28971,,6970.943313669091,,,,,170,COL,2021/06/05,532,11244592,264609
Colombia,6/6/21,3571067,91961,,,24050,,7018.208716314115,,,,,170,COL,2021/06/06,539,11485904,241312
Colombia,6/7/21,3593016,92496,,,21949,,7061.345029106447,,,,,170,COL,2021/06/07,535,11615265,129361
Colombia,6/8/21,3611602,92923,,,18586,,7097.8720467181065,,,,,170,COL,2021/06/08,427,11733523,118258
Colombia,6/9/21,3633481,93394,,,21879,,7140.87078869193,,,,,170,COL,2021/06/09,471,11977805,244282
Colombia,6/10/21,3665137,94046,,,31656,,7203.084243416706,,,,,170,COL,2021/06/10,652,12206104,228299
Colombia,6/11/21,3694707,94615,,,29570,,7261.1980877499,,,,,170,COL,2021/06/11,569,12462479,256375
Colombia,6/12/21,3724705,95192,,,29998,,7320.15307937341,,,,,170,COL,2021/06/12,577,12711342,248863
Colombia,6/13/21,3753224,95778,,,28519,,7376.201396131556,,,,,170,COL,2021/06/13,586,12917941,206599
Colombia,6/14/21,3777600,96366,,,24376,,7424.1074857313515,,,,,170,COL,2021/06/14,588,13024786,106845
Colombia,6/15/21,3802052,96965,,,24452,,7472.1629379341,,,,,170,COL,2021/06/15,599,13167044,142258
Colombia,6/16/21,3829879,97560,,,27827,,7526.85126888641,,,,,170,COL,2021/06/16,595,13390951,223907
Colombia,6/17/21,3859824,98156,,,29945,,7585.702099747334,,,,,170,COL,2021/06/17,596,13721838,330887
Colombia,6/18/21,3888614,98746,,,28790,,7642.283012102852,,,,,170,COL,2021/06/18,590,14062307,340469
Colombia,6/19/21,3917348,99335,,,28734,,7698.753867803563,,,,,170,COL,2021/06/19,589,14409994,347687
Colombia,6/20/21,3945166,99934,,,27818,,7753.424511079207,,,,,170,COL,2021/06/20,599,14727526,317532
Colombia,6/21/21,3968405,100582,,,23239,,7799.096057526928,,,,,170,COL,2021/06/21,648,14953869,226343
Colombia,6/22/21,3997021,101302,,,28616,,7855.33500813358,,,,,170,COL,2021/06/22,720,15298930,345061
Colombia,6/23/21,4027016,101947,,,29995,,7914.284103864868,,,,,170,COL,2021/06/23,645,15682435,383505
Colombia,6/24/21,4060013,102636,,,32997,,7979.133022412802,,,,,170,COL,2021/06/24,689,16038817,356382
Colombia,6/25/21,4092746,103321,,,32733,,8043.463102445216,,,,,170,COL,2021/06/25,685,16365857,327040
Colombia,6/26/21,4126340,104014,,,33594,,8109.485303545294,,,,,170,COL,2021/06/26,693,16693732,327875
Colombia,6/27/21,4158716,104678,,,32376,,8173.11377240331,,,,,170,COL,2021/06/27,664,17024426,330694
Colombia,6/28/21,4187194,105326,,,28478,,8229.081511967757,,,,,170,COL,2021/06/28,648,17227818,203392
Colombia,6/29/21,4213074,105934,,,25880,,8279.943408868097,,,,,170,COL,2021/06/29,608,17570929,343111
Colombia,6/30/21,4240982,106544,,,27908,,8334.790928910397,,,,,170,COL,2021/06/30,610,17941952,371023
Colombia,7/1/21,4269297,107137,,,28315,,8390.438324997458,,,,,170,COL,2021/07/01,593,18281743,339791
Colombia,7/2/21,4297302,107723,,,28005,,8445.476478888264,,,,,170,COL,2021/07/02,586,18582100,300357
Comoros,6/4/21,3886,146,,,4,,446.87469454171196,,,,,174,COM,2021/06/04,0,,
Comoros,6/6/21,3888,146,,,2,,447.10468666448173,,,,,174,COM,2021/06/06,0,,
Comoros,6/7/21,3890,146,,,2,,447.33467878725156,,,,,174,COM,2021/06/07,0,,
Comoros,6/10/21,3894,146,,,4,,447.7946630327911,,,,,174,COM,2021/06/10,0,,
Comoros,6/12/21,3899,146,,,5,,448.3696433397156,,,,,174,COM,2021/06/12,0,,
Comoros,6/14/21,3901,146,,,2,,448.5996354624854,,,,,174,COM,2021/06/14,0,,
Comoros,6/16/21,3905,146,,,4,,449.059619708025,,,,,174,COM,2021/06/16,0,,
Comoros,6/19/21,3908,146,,,3,,449.4046078921797,,,,,174,COM,2021/06/19,0,,
Comoros,6/21/21,3912,146,,,4,,449.8645921377193,,,,,174,COM,2021/06/21,0,,
Comoros,6/30/21,3936,146,,,24,,452.62449761095684,,,,,174,COM,2021/06/30,0,,
Comoros,7/1/21,3943,146,,,7,,453.4294700406511,,,,,174,COM,2021/07/01,0,,
Comoros,7/2/21,3957,146,,,14,,455.0394149000397,,,,,174,COM,2021/07/02,0,,
Congo (Brazzaville),6/4/21,11920,155,,,75,,216.01669562595188,,,,,178,COG,2021/06/04,1,,
Congo (Brazzaville),6/7/21,12026,157,,,106,,217.93764946289406,,,,,178,COG,2021/06/07,2,,
Congo (Brazzaville),6/12/21,12121,160,,,95,,219.65925903373846,,,,,178,COG,2021/06/12,3,,
Congo (Brazzaville),6/17/21,12298,161,,,177,,222.86688949731175,,,,,178,COG,2021/06/17,1,,
Congo (Brazzaville),6/22/21,12404,164,,,106,,224.78784333425395,,,,,178,COG,2021/06/22,3,,
Congo (Brazzaville),6/25/21,12485,165,,,81,,226.2557420209739,,,,,178,COG,2021/06/25,1,,
Congo (Brazzaville),6/29/21,12596,165,,,111,,228.26730688796056,,,,,178,COG,2021/06/29,0,,
Congo (Brazzaville),7/1/21,12695,166,,,99,,230.06140528284052,,,,,178,COG,2021/07/01,1,,
Congo (Brazzaville),7/2/21,12695,166,,,0,,230.06140528284052,,,,,178,COG,2021/07/02,0,,
Congo (Kinshasa),6/4/21,32545,789,,,368,,36.33819764594133,,,,,180,COD,2021/06/04,0,,
Congo (Kinshasa),6/5/21,32796,797,,,251,,36.61845229670585,,,,,180,COD,2021/06/05,8,,
Congo (Kinshasa),6/6/21,33202,804,,,406,,37.0717725684604,,,,,180,COD,2021/06/06,7,,
Congo (Kinshasa),6/7/21,33338,805,,,136,,37.22362369397425,,,,,180,COD,2021/06/07,1,,
Congo (Kinshasa),6/8/21,33577,817,,,239,,37.49047971601696,,,,,180,COD,2021/06/08,12,,
Congo (Kinshasa),6/9/21,33956,821,,,379,,37.913653073147444,,,,,180,COD,2021/06/09,4,,
Congo (Kinshasa),6/10/21,34266,825,,,310,,38.25978431512753,,,,,180,COD,2021/06/10,4,,
Congo (Kinshasa),6/11/21,34695,831,,,429,,38.738785291932224,,,,,180,COD,2021/06/11,6,,
Congo (Kinshasa),6/12/21,34949,834,,,254,,39.022389599877194,,,,,180,COD,2021/06/12,3,,
Congo (Kinshasa),6/13/21,35228,834,,,279,,39.33390771765927,,,,,180,COD,2021/06/13,0,,
Congo (Kinshasa),6/14/21,35668,846,,,440,,39.8251907707923,,,,,180,COD,2021/06/14,12,,
Congo (Kinshasa),6/15/21,35918,854,,,250,,40.104328869163325,,,,,180,COD,2021/06/15,8,,
Congo (Kinshasa),6/16/21,36222,857,,,304,,40.443760796782506,,,,,180,COD,2021/06/16,3,,
Congo (Kinshasa),6/17/21,36578,866,,,356,,40.84125344886286,,,,,180,COD,2021/06/17,9,,
Congo (Kinshasa),6/18/21,36957,866,,,379,,41.26442680599335,,,,,180,COD,2021/06/18,0,,
Congo (Kinshasa),6/19/21,37519,873,,,562,,41.89192925113144,,,,,180,COD,2021/06/19,7,,
Congo (Kinshasa),6/20/21,37809,879,,,290,,42.215729445241834,,,,,180,COD,2021/06/20,6,,
Congo (Kinshasa),6/21/21,37926,879,,,117,,42.346366075279484,,,,,180,COD,2021/06/21,0,,
Congo (Kinshasa),6/22/21,38330,888,,,404,,42.79745324224707,,,,,180,COD,2021/06/22,9,,
Congo (Kinshasa),6/23/21,38553,891,,,223,,43.04644442599404,,,,,180,COD,2021/06/23,3,,
Congo (Kinshasa),6/24/21,38936,896,,,383,,43.47408399269846,,,,,180,COD,2021/06/24,5,,
Congo (Kinshasa),6/25/21,39395,898,,,459,,43.98658154130768,,,,,180,COD,2021/06/25,2,,
Congo (Kinshasa),6/26/21,39758,912,,,363,,44.39189006014242,,,,,180,COD,2021/06/26,14,,
Congo (Kinshasa),6/27/21,40254,916,,,496,,44.94570004731056,,,,,180,COD,2021/06/27,4,,
Congo (Kinshasa),6/28/21,40439,916,,,185,,45.152262240105124,,,,,180,COD,2021/06/28,0,,
Congo (Kinshasa),6/29/21,40836,924,,,397,,45.59553354031833,,,,,180,COD,2021/06/29,8,,
Congo (Kinshasa),7/1/21,41353,933,,,517,,46.172791127749626,,,,,180,COD,2021/07/01,9,,
Congo (Kinshasa),7/2/21,41771,937,,,418,,46.639510028226,,,,,180,COD,2021/07/02,4,,
Costa Rica,6/4/21,327979,4153,,,2200,,6438.391445499649,,,,,188,CRI,2021/06/04,29,1658685,0
Costa Rica,6/7/21,331920,4228,,,3941,,6515.755242226617,,,,,188,CRI,2021/06/07,75,1658685,0
Costa Rica,6/8/21,333820,4251,,,1900,,6553.053190407596,,,,,188,CRI,2021/06/08,23,1906177,247492
Costa Rica,6/9/21,336007,4278,,,2187,,6595.985091813807,,,,,188,CRI,2021/06/09,27,1906177,0
Costa Rica,6/10/21,338048,4298,,,2041,,6636.050940359795,,,,,188,CRI,2021/06/10,20,1906177,0
Costa Rica,6/11/21,339900,4322,,,1852,,6672.406624586729,,,,,188,CRI,2021/06/11,24,1906177,0
Costa Rica,6/14/21,343604,4388,,,3704,,6745.117993040595,,,,,188,CRI,2021/06/14,66,1906177,0
Costa Rica,6/15/21,345312,4407,,,1708,,6778.646885405391,,,,,188,CRI,2021/06/15,19,2150520,244343
Costa Rica,6/16/21,347157,4437,,,1845,,6814.865156139026,,,,,188,CRI,2021/06/16,30,2150520,0
Costa Rica,6/17/21,349026,4459,,,1869,,6851.554558849684,,,,,188,CRI,2021/06/17,22,2150520,0
Costa Rica,6/18/21,350630,4473,,,1604,,6883.041879314048,,,,,188,CRI,2021/06/18,14,2150520,0
Costa Rica,6/21/21,354095,4530,,,3465,,6951.061558496728,,,,,188,CRI,2021/06/21,57,2150520,0
Costa Rica,6/22/21,355620,4546,,,1525,,6980.998069536724,,,,,188,CRI,2021/06/22,16,2331030,180510
Costa Rica,6/23/21,357523,4567,,,1903,,7018.354909214831,,,,,188,CRI,2021/06/23,21,2331030,0
Costa Rica,6/24/21,359266,4581,,,1743,,7052.570869046119,,,,,188,CRI,2021/06/24,14,2331030,0
Costa Rica,6/25/21,361005,4602,,,1739,,7086.708306881236,,,,,188,CRI,2021/06/25,21,2331030,0
Costa Rica,6/28/21,364304,4648,,,3299,,7151.469323222841,,,,,188,CRI,2021/06/28,46,2331030,0
Costa Rica,6/29/21,366161,4661,,,1857,,7187.923159944988,,,,,188,CRI,2021/06/29,13,2440385,109355
Costa Rica,6/30/21,367938,4667,,,1777,,7222.806556743724,,,,,188,CRI,2021/06/30,6,2440385,0
Costa Rica,7/1/21,369540,4674,,,1602,,7254.2546162100025,,,,,188,CRI,2021/07/01,7,2440385,0
Costa Rica,7/2/21,371206,4686,,,1666,,7286.959027615008,,,,,188,CRI,2021/07/02,12,2440385,0
Cote d'Ivoire,6/4/21,47435,306,,,46,,179.82601212550858,,,,,384,CIV,2021/06/04,0,567488,0
Cote d'Ivoire,6/5/21,47476,306,,,41,,179.98144306252019,,,,,384,CIV,2021/06/05,0,567488,0
Cote d'Ivoire,6/6/21,47490,306,,,14,,180.03451704101198,,,,,384,CIV,2021/06/06,0,593683,26195
Cote d'Ivoire,6/7/21,47493,306,,,3,,180.04589003640305,,,,,384,CIV,2021/06/07,0,593683,0
Cote d'Ivoire,6/8/21,47511,306,,,18,,180.11412800874962,,,,,384,CIV,2021/06/08,0,606907,13224
Cote d'Ivoire,6/9/21,47547,306,,,36,,180.25060395344275,,,,,384,CIV,2021/06/09,0,644253,37346
Cote d'Ivoire,6/10/21,47605,306,,,58,,180.47048186433722,,,,,384,CIV,2021/06/10,0,644253,0
Cote d'Ivoire,6/11/21,47638,306,,,33,,180.59558481363925,,,,,384,CIV,2021/06/11,0,662848,18595
Cote d'Ivoire,6/12/21,47662,306,,,24,,180.686568776768,,,,,384,CIV,2021/06/12,0,662848,0
Cote d'Ivoire,6/14/21,47760,306,,,98,,181.05808662621038,,,,,384,CIV,2021/06/14,0,694950,2427
Cote d'Ivoire,6/15/21,47909,306,,,149,,181.62294539730138,,,,,384,CIV,2021/06/15,0,708503,13553
Cote d'Ivoire,6/16/21,47933,306,,,24,,181.71392936043011,,,,,384,CIV,2021/06/16,0,708503,0
Cote d'Ivoire,6/17/21,47973,306,,,40,,181.86556929897804,,,,,384,CIV,2021/06/17,0,708503,0
Cote d'Ivoire,6/19/21,48031,307,,,58,,182.0854472098725,,,,,384,CIV,2021/06/19,1,708503,0
Cote d'Ivoire,6/20/21,48044,308,,,13,,182.13473018990058,,,,,384,CIV,2021/06/20,1,722073,13570
Cote d'Ivoire,6/21/21,48047,308,,,3,,182.14610318529168,,,,,384,CIV,2021/06/21,0,725916,3843
Cote d'Ivoire,6/22/21,48058,309,,,11,,182.18780416839235,,,,,384,CIV,2021/06/22,1,735677,9761
Cote d'Ivoire,6/26/21,48176,311,,,118,,182.6351419871087,,,,,384,CIV,2021/06/26,2,740391,3077
Cote d'Ivoire,6/27/21,48192,312,,,16,,182.69579796252788,,,,,384,CIV,2021/06/27,1,740391,0
Cote d'Ivoire,6/28/21,48203,313,,,11,,182.73749894562854,,,,,384,CIV,2021/06/28,1,745327,4936
Cote d'Ivoire,6/29/21,48242,313,,,39,,182.88534788571278,,,,,384,CIV,2021/06/29,0,749368,4041
Cote d'Ivoire,6/30/21,48305,313,,,63,,183.12418078892574,,,,,384,CIV,2021/06/30,0,757113,7745
Cote d'Ivoire,7/1/21,48378,315,,,73,,183.40092367677568,,,,,384,CIV,2021/07/01,2,768039,10926
Cote d'Ivoire,7/2/21,48378,315,,,0,,183.40092367677568,,,,,384,CIV,2021/07/02,0,768039,0
Croatia,6/4/21,357197,8067,,,88,,8700.94230145267,,,,,191,HRV,2021/06/04,11,1855003,0
Croatia,6/5/21,357408,8080,,,211,,8706.08203898016,,,,,191,HRV,2021/06/05,13,1855003,0
Croatia,6/6/21,357565,8086,,,157,,8709.906393443742,,,,,191,HRV,2021/06/06,6,1902092,47089
Croatia,6/7/21,357608,8091,,,43,,8710.953828105741,,,,,191,HRV,2021/06/07,5,1903673,1581
Croatia,6/8/21,357786,8096,,,178,,8715.289720427509,,,,,191,HRV,2021/06/08,5,1920656,16983
Croatia,6/9/21,358061,8103,,,275,,8721.988430475185,,,,,191,HRV,2021/06/09,7,1947784,27128
Croatia,6/10/21,358245,8110,,,184,,8726.47047647072,,,,,191,HRV,2021/06/10,7,1947784,0
Croatia,6/11/21,358379,8123,,,134,,8729.73457518486,,,,,191,HRV,2021/06/11,13,2042889,95105
Croatia,6/12/21,358504,8132,,,125,,8732.779443388348,,,,,191,HRV,2021/06/12,9,2087157,44268
Croatia,6/13/21,358563,8132,,,59,,8734.216621180396,,,,,191,HRV,2021/06/13,0,2087157,0
Croatia,6/14/21,358581,8152,,,18,,8734.655082201698,,,,,191,HRV,2021/06/14,20,2139816,52659
Croatia,6/15/21,358677,8160,,,96,,8736.993540981977,,,,,191,HRV,2021/06/15,8,2164874,25058
Croatia,6/16/21,358823,8162,,,146,,8740.549947043652,,,,,191,HRV,2021/06/16,2,2164874,0
Croatia,6/17/21,358918,8165,,,95,,8742.864046878303,,,,,191,HRV,2021/06/17,3,2219196,54322
Croatia,6/18/21,359031,8168,,,113,,8745.616607734257,,,,,191,HRV,2021/06/18,3,2219196,0
Croatia,6/19/21,359115,8169,,,84,,8747.662759167002,,,,,191,HRV,2021/06/19,1,2318428,99232
Croatia,6/20/21,359173,8174,,,58,,8749.07557801342,,,,,191,HRV,2021/06/20,5,2318428,0
Croatia,6/21/21,359184,8182,,,11,,8749.343526415329,,,,,191,HRV,2021/06/21,8,2359472,41044
Croatia,6/22/21,359259,8188,,,75,,8751.170447337421,,,,,191,HRV,2021/06/22,6,2379658,20186
Croatia,6/23/21,359302,8190,,,43,,8752.21788199942,,,,,191,HRV,2021/06/23,2,2389633,9975
Croatia,6/24/21,359403,8192,,,101,,8754.67813550784,,,,,191,HRV,2021/06/24,2,2389633,0
Croatia,6/25/21,359521,8196,,,118,,8757.552491091934,,,,,191,HRV,2021/06/25,4,2424695,35062
Croatia,6/26/21,359607,8197,,,86,,8759.647360415935,,,,,191,HRV,2021/06/26,1,2502912,78217
Croatia,6/27/21,359652,8200,,,45,,8760.74351296919,,,,,191,HRV,2021/06/27,3,2524626,21714
Croatia,6/28/21,359666,8202,,,14,,8761.08453820798,,,,,191,HRV,2021/06/28,2,2529612,4986
Croatia,6/29/21,359736,8205,,,70,,8762.789664401935,,,,,191,HRV,2021/06/29,3,2545040,15428
Croatia,6/30/21,359872,8206,,,136,,8766.10248100733,,,,,191,HRV,2021/06/30,1,2573481,28441
Croatia,7/1/21,359975,8209,,,103,,8768.611452407005,,,,,191,HRV,2021/07/01,3,2573481,0
Croatia,7/2/21,360067,8212,,,92,,8770.852475404772,,,,,191,HRV,2021/07/02,3,2573481,0
Cuba,6/4/21,146696,992,,,1129,,1295.1441101207986,,,,,192,CUB,2021/06/04,7,,
Cuba,6/5/21,147831,1003,,,1135,,1305.1647552984934,,,,,192,CUB,2021/06/05,11,,
Cuba,6/6/21,148918,1012,,,1087,,1314.7616198871756,,,,,192,CUB,2021/06/06,9,,
Cuba,6/7/21,150103,1025,,,1185,,1325.223703178425,,,,,192,CUB,2021/06/07,13,,
Cuba,6/8/21,151259,1033,,,1156,,1335.429752363813,,,,,192,CUB,2021/06/08,8,,
Cuba,6/9/21,152420,1045,,,1161,,1345.679945360556,,,,,192,CUB,2021/06/09,12,,
Cuba,6/10/21,153578,1057,,,1158,,1355.903652070486,,,,,192,CUB,2021/06/10,12,,
Cuba,6/11/21,154866,1065,,,1288,,1367.2750978756585,,,,,192,CUB,2021/06/11,8,,
Cuba,6/12/21,156238,1075,,,1372,,1379.3881597116033,,,,,192,CUB,2021/06/12,10,,
Cuba,6/13/21,157708,1087,,,1470,,1392.3664402501154,,,,,192,CUB,2021/06/13,12,,
Cuba,6/14/21,159057,1098,,,1349,,1404.2764405538246,,,,,192,CUB,2021/06/14,11,,
Cuba,6/15/21,160594,1106,,,1537,,1417.8462481645004,,,,,192,CUB,2021/06/15,8,,
Cuba,6/16/21,161997,1118,,,1403,,1430.233001630849,,,,,192,CUB,2021/06/16,12,,
Cuba,6/17/21,163415,1123,,,1418,,1442.752186531264,,,,,192,CUB,2021/06/17,5,,
Cuba,6/18/21,164896,1132,,,1481,,1455.8275834547583,,,,,192,CUB,2021/06/18,9,,
Cuba,6/19/21,166368,1148,,,1472,,1468.8235215178127,,,,,192,CUB,2021/06/19,16,,
Cuba,6/20/21,167804,1159,,,1436,,1481.5016241391074,,,,,192,CUB,2021/06/20,11,,
Cuba,6/21/21,169365,1170,,,1561,,1495.2833220442892,,,,,192,CUB,2021/06/21,11,,
Cuba,6/22/21,170854,1180,,,1489,,1508.4293490659522,,,,,192,CUB,2021/06/22,10,,
Cuba,6/23/21,172909,1193,,,2055,,1526.572455533056,,,,,192,CUB,2021/06/23,13,,
Cuba,6/24/21,174789,1209,,,1880,,1543.1705286027177,,,,,192,CUB,2021/06/24,16,,
Cuba,6/25/21,177253,1219,,,2464,,1564.9245988387,,,,,192,CUB,2021/06/25,10,,
Cuba,6/26/21,179656,1231,,,2403,,1586.1401145761452,,,,,192,CUB,2021/06/26,12,,
Cuba,6/27/21,182354,1241,,,2698,,1609.960115183564,,,,,192,CUB,2021/06/27,10,,
Cuba,6/28/21,184943,1253,,,2589,,1632.8177807034333,,,,,192,CUB,2021/06/28,12,,
Cuba,6/29/21,188023,1270,,,3080,,1660.0103684984113,,,,,192,CUB,2021/06/29,17,,
Cuba,6/30/21,190993,1284,,,2970,,1686.2317924435683,,,,,192,CUB,2021/06/30,14,,
Cuba,7/1/21,193945,1302,,,2952,,1712.2942986678456,,,,,192,CUB,2021/07/01,18,,
Cuba,7/2/21,197253,1322,,,3308,,1741.4998442606336,,,,,192,CUB,2021/07/02,20,,
Cyprus,6/4/21,72709,363,,,83,,6022.142507501899,,,,,196,CYP,2021/06/04,1,632437,0
Cyprus,6/5/21,72750,363,,,41,,6025.538343544308,,,,,196,CYP,2021/06/05,0,632437,0
Cyprus,6/6/21,72779,363,,,29,,6027.940276354793,,,,,196,CYP,2021/06/06,0,649005,16568
Cyprus,6/7/21,72859,364,,,80,,6034.566297900959,,,,,196,CYP,2021/06/07,1,654896,5891
Cyprus,6/8/21,72919,365,,,60,,6039.535814060583,,,,,196,CYP,2021/06/08,1,662063,7167
Cyprus,6/9/21,72996,367,,,77,,6045.9133597987675,,,,,196,CYP,2021/06/09,2,673101,11038
Cyprus,6/10/21,73055,371,,,59,,6050.800050689065,,,,,196,CYP,2021/06/10,4,673101,0
Cyprus,6/11/21,73115,372,,,60,,6055.769566848689,,,,,196,CYP,2021/06/11,1,681219,8118
Cyprus,6/13/21,73190,373,,,75,,6061.981462048219,,,,,196,CYP,2021/06/13,1,689776,0
Cyprus,6/14/21,73247,374,,,57,,6066.702502399862,,,,,196,CYP,2021/06/14,1,701370,11594
Cyprus,6/15/21,73311,374,,,64,,6072.003319636795,,,,,196,CYP,2021/06/15,0,718775,17405
Cyprus,6/16/21,73379,374,,,68,,6077.635437951036,,,,,196,CYP,2021/06/16,0,718775,0
Cyprus,6/17/21,73444,374,,,65,,6083.019080457295,,,,,196,CYP,2021/06/17,0,728458,9683
Cyprus,6/18/21,73520,374,,,76,,6089.313800926152,,,,,196,CYP,2021/06/18,0,728458,0
Cyprus,6/19/21,73582,374,,,62,,6094.44896762443,,,,,196,CYP,2021/06/19,0,739365,10907
Cyprus,6/20/21,73643,374,,,61,,6099.501309053382,,,,,196,CYP,2021/06/20,0,739365,0
Cyprus,6/21/21,73710,374,,,67,,6105.050602098296,,,,,196,CYP,2021/06/21,0,753106,13741
Cyprus,6/22/21,73832,374,,,122,,6115.155284956198,,,,,196,CYP,2021/06/22,0,753106,0
Cyprus,6/23/21,73999,374,,,167,,6128.987104933818,,,,,196,CYP,2021/06/23,0,753106,0
Cyprus,6/24/21,74174,374,,,175,,6143.481527066056,,,,,196,CYP,2021/06/24,0,758288,5182
Cyprus,6/25/21,74343,374,,,169,,6157.4789975823305,,,,,196,CYP,2021/06/25,0,768273,9985
Cyprus,6/26/21,74569,374,,,226,,6176.197508450248,,,,,196,CYP,2021/06/26,0,777935,9662
Cyprus,6/27/21,74785,374,,,216,,6194.087766624895,,,,,196,CYP,2021/06/27,0,777935,0
Cyprus,6/28/21,75099,374,,,314,,6220.0949011935945,,,,,196,CYP,2021/06/28,0,777935,0
Cyprus,6/29/21,75431,374,,,332,,6247.592890610182,,,,,196,CYP,2021/06/29,0,777935,0
Cyprus,6/30/21,75860,374,,,429,,6283.124931151495,,,,,196,CYP,2021/06/30,0,777935,0
Cyprus,7/1/21,76333,374,,,473,,6322.301283543199,,,,,196,CYP,2021/07/01,0,809234,31299
Cyprus,7/2/21,76862,374,,,529,,6366.115851017218,,,,,196,CYP,2021/07/02,0,809234,0
Czechia,6/4/21,1663040,30142,,,432,,15529.393923717493,,,,,203,CZE,2021/06/04,6,5772983,116570
Czechia,6/5/21,1663363,30157,,,323,,15532.410083423429,,,,,203,CZE,2021/06/05,15,5772983,0
Czechia,6/6/21,1663517,30159,,,154,,15533.848128608302,,,,,203,CZE,2021/06/06,2,5868484,95501
Czechia,6/7/21,1663607,30164,,,90,,15534.688544625436,,,,,203,CZE,2021/06/07,5,5983341,114857
Czechia,6/8/21,1663998,30193,,,391,,15538.339685322097,,,,,203,CZE,2021/06/08,29,6099710,116369
Czechia,6/9/21,1664382,30202,,,384,,15541.925460328535,,,,,203,CZE,2021/06/09,9,6198532,98822
Czechia,6/10/21,1664649,30211,,,267,,15544.4186945127,,,,,203,CZE,2021/06/10,9,6198532,0
Czechia,6/11/21,1664839,30219,,,190,,15546.192906104427,,,,,203,CZE,2021/06/11,8,6436606,238074
Czechia,6/12/21,1665022,30224,,,183,,15547.901752005933,,,,,203,CZE,2021/06/12,5,6499005,62399
Czechia,6/13/21,1665097,30225,,,75,,15548.602098686879,,,,,203,CZE,2021/06/13,1,6543437,44432
Czechia,6/14/21,1665138,30229,,,41,,15548.984954872461,,,,,203,CZE,2021/06/14,4,6661039,117602
Czechia,6/15/21,1665327,30229,,,189,,15550.749828508442,,,,,203,CZE,2021/06/15,0,6778381,117342
Czechia,6/16/21,1665526,30254,,,199,,15552.608081701883,,,,,203,CZE,2021/06/16,25,6778381,0
Czechia,6/17/21,1665660,30257,,,134,,15553.859367771838,,,,,203,CZE,2021/06/17,3,6897135,118754
Czechia,6/18/21,1665818,30275,,,158,,15555.334764779696,,,,,203,CZE,2021/06/18,18,6897135,0
Czechia,6/19/21,1665961,30278,,,143,,15556.670092451364,,,,,203,CZE,2021/06/19,3,6897135,0
Czechia,6/20/21,1666025,30280,,,64,,15557.267721619104,,,,,203,CZE,2021/06/20,2,6897135,0
Czechia,6/21/21,1666082,30280,,,57,,15557.799985096623,,,,,203,CZE,2021/06/21,0,6897135,0
Czechia,6/22/21,1666192,30283,,,110,,15558.827160228675,,,,,203,CZE,2021/06/22,3,6897135,0
Czechia,6/23/21,1666325,30289,,,133,,15560.069108342885,,,,,203,CZE,2021/06/23,6,6897135,0
Czechia,6/24/21,1666521,30291,,,196,,15561.899347669087,,,,,203,CZE,2021/06/24,2,0,-6897135
Czechia,6/25/21,1666686,30292,,,165,,15563.440110367166,,,,,203,CZE,2021/06/25,1,0,0
Czechia,6/26/21,1666821,30296,,,135,,15564.700734392867,,,,,203,CZE,2021/06/26,4,0,0
Czechia,6/27/21,1666890,30298,,,69,,15565.345053339337,,,,,203,CZE,2021/06/27,2,0,0
Czechia,6/28/21,1666947,30298,,,57,,15565.877316816855,,,,,203,CZE,2021/06/28,0,8008278,8008278
Czechia,6/29/21,1667115,30298,,,168,,15567.446093382172,,,,,203,CZE,2021/06/29,0,8119241,110963
Czechia,6/30/21,1667287,30303,,,172,,15569.052221770473,,,,,203,CZE,2021/06/30,5,8237527,118286
Czechia,7/1/21,1667435,30304,,,148,,15570.434239220871,,,,,203,CZE,2021/07/01,1,8350097,112570
Czechia,7/2/21,1667608,30308,,,173,,15572.049705564918,,,,,203,CZE,2021/07/02,4,8350097,0
Denmark,6/4/21,285823,2518,,,935,,4934.616414514478,,,,,208,DNK,2021/06/04,0,3617240,59815
Denmark,6/5/21,286420,2519,,,597,,4944.92337371463,,,,,208,DNK,2021/06/05,1,3617240,0
Denmark,6/6/21,287275,2519,,,855,,4959.684596689723,,,,,208,DNK,2021/06/06,0,3715218,97978
Denmark,6/7/21,287735,2521,,,460,,4967.626307296205,,,,,208,DNK,2021/06/07,2,3760386,45168
Denmark,6/8/21,288115,2521,,,380,,4974.186850840691,,,,,208,DNK,2021/06/08,0,3835010,74624
Denmark,6/9/21,289024,2521,,,909,,4989.880361582631,,,,,208,DNK,2021/06/09,0,3912896,77886
Denmark,6/10/21,289501,2523,,,477,,4998.115570189788,,,,,208,DNK,2021/06/10,2,3912896,0
Denmark,6/11/21,289919,2524,,,418,,5005.332168088722,,,,,208,DNK,2021/06/11,1,4066856,153960
Denmark,6/12/21,290358,2526,,,439,,5012.911322341431,,,,,208,DNK,2021/06/12,2,4133640,66784
Denmark,6/13/21,290674,2526,,,316,,5018.3669322363185,,,,,208,DNK,2021/06/13,0,4180186,46546
Denmark,6/14/21,290912,2527,,,238,,5022.475904245759,,,,,208,DNK,2021/06/14,1,4227347,47161
Denmark,6/15/21,291139,2528,,,227,,5026.394965784176,,,,,208,DNK,2021/06/15,1,4301414,74067
Denmark,6/16/21,291492,2528,,,353,,5032.489365445237,,,,,208,DNK,2021/06/16,0,4301414,0
Denmark,6/17/21,291824,2529,,,332,,5038.221208752525,,,,,208,DNK,2021/06/17,1,4238541,-62873
Denmark,6/18/21,292029,2529,,,205,,5041.760449348892,,,,,208,DNK,2021/06/18,0,4303085,64544
Denmark,6/19/21,292273,2531,,,244,,5045.973008887982,,,,,208,DNK,2021/06/19,2,4363025,59940
Denmark,6/20/21,292467,2531,,,194,,5049.322339013325,,,,,208,DNK,2021/06/20,0,4403132,40107
Denmark,6/21/21,292618,2532,,,151,,5051.929291842845,,,,,208,DNK,2021/06/21,1,4419519,16387
Denmark,6/22/21,292775,2532,,,157,,5054.639832202014,,,,,208,DNK,2021/06/22,0,4510128,90609
Denmark,6/23/21,292999,2532,,,224,,5058.507099975605,,,,,208,DNK,2021/06/23,0,4582181,72053
Denmark,6/24/21,293172,2532,,,173,,5061.493873747174,,,,,208,DNK,2021/06/24,0,4651890,69709
Denmark,6/25/21,293394,2532,,,222,,5065.326612344215,,,,,208,DNK,2021/06/25,0,4718544,66654
Denmark,6/26/21,293590,2532,,,196,,5068.710471646108,,,,,208,DNK,2021/06/26,0,4777469,58925
Denmark,6/27/21,293765,2533,,,175,,5071.731774594226,,,,,208,DNK,2021/06/27,1,4815457,37988
Denmark,6/28/21,293916,2534,,,151,,5074.338727423746,,,,,208,DNK,2021/06/28,1,4895672,80215
Denmark,6/29/21,294162,2535,,,246,,5078.585816139386,,,,,208,DNK,2021/06/29,1,4957046,61374
Denmark,6/30/21,294503,2535,,,341,,5084.473040741148,,,,,208,DNK,2021/06/30,0,5018119,61073
Denmark,7/1/21,294980,2536,,,477,,5092.708249348305,,,,,208,DNK,2021/07/01,1,5083710,65591
Denmark,7/2/21,295306,2537,,,326,,5098.3365051259425,,,,,208,DNK,2021/07/02,1,5183196,99486
Diamond Princess,6/4/21,712,13,,,0,,,,,,,9999,,2021/06/04,0,,
Diamond Princess,7/2/21,712,13,,,0,,,,,,,9999,,2021/07/02,0,,
Djibouti,6/4/21,11554,154,,,10,,1169.430831111678,,,,,262,DJI,2021/06/04,0,,
Djibouti,6/5/21,11556,154,,,2,,1169.6332598517008,,,,,262,DJI,2021/06/05,0,,
Djibouti,6/6/21,11562,154,,,6,,1170.2405460717691,,,,,262,DJI,2021/06/06,0,,
Djibouti,6/7/21,11565,154,,,3,,1170.5441891818032,,,,,262,DJI,2021/06/07,0,,
Djibouti,6/8/21,11566,154,,,1,,1170.6454035518148,,,,,262,DJI,2021/06/08,0,,
Djibouti,6/9/21,11567,154,,,1,,1170.746617921826,,,,,262,DJI,2021/06/09,0,,
Djibouti,6/10/21,11570,154,,,3,,1171.0502610318604,,,,,262,DJI,2021/06/10,0,,
Djibouti,6/11/21,11571,154,,,1,,1171.1514754018717,,,,,262,DJI,2021/06/11,0,,
Djibouti,6/12/21,11572,154,,,1,,1171.252689771883,,,,,262,DJI,2021/06/12,0,,
Djibouti,6/14/21,11575,154,,,3,,1171.5563328819173,,,,,262,DJI,2021/06/14,0,,
Djibouti,6/16/21,11577,154,,,2,,1171.75876162194,,,,,262,DJI,2021/06/16,0,,
Djibouti,6/17/21,11585,154,,,8,,1172.5684765820313,,,,,262,DJI,2021/06/17,0,,
Djibouti,6/18/21,11586,154,,,1,,1172.6696909520426,,,,,262,DJI,2021/06/18,0,,
Djibouti,6/19/21,11587,155,,,1,,1172.770905322054,,,,,262,DJI,2021/06/19,1,,
Djibouti,6/21/21,11591,155,,,4,,1173.1757628020996,,,,,262,DJI,2021/06/21,0,,
Djibouti,6/22/21,11595,155,,,4,,1173.5806202821452,,,,,262,DJI,2021/06/22,0,,
Djibouti,6/23/21,11597,155,,,2,,1173.783049022168,,,,,262,DJI,2021/06/23,0,,
Djibouti,6/25/21,11600,155,,,3,,1174.0866921322022,,,,,262,DJI,2021/06/25,0,,
Djibouti,6/27/21,11601,155,,,1,,1174.1879065022135,,,,,262,DJI,2021/06/27,0,,
Djibouti,6/29/21,11602,155,,,1,,1174.2891208722249,,,,,262,DJI,2021/06/29,0,,
Djibouti,7/2/21,11602,155,,,0,,1174.2891208722249,,,,,262,DJI,2021/07/02,0,,
Dominica,6/4/21,188,0,,,0,,261.14375408037114,,,,,212,DMA,2021/06/04,0,37151,0
Dominica,6/11/21,189,0,,,1,,262.5328166020753,,,,,212,DMA,2021/06/11,0,37400,274
Dominica,6/17/21,191,0,,,2,,265.31094164548347,,,,,212,DMA,2021/06/17,0,38160,0
Dominica,6/24/21,192,0,,,1,,266.70000416718756,,,,,212,DMA,2021/06/24,0,38646,0
Dominica,6/27/21,193,0,,,1,,268.08906668889165,,,,,212,DMA,2021/06/27,0,39309,663
Dominica,7/2/21,194,0,,,1,,269.4781292105958,,,,,212,DMA,2021/07/02,0,39309,0
Dominican Republic,6/4/21,298414,3646,,,1295,,2750.8908633409737,,,,,214,DOM,2021/06/04,4,4989807,364420
Dominican Republic,6/5/21,299681,3652,,,1267,,2762.570538972321,,,,,214,DOM,2021/06/05,6,4989807,0
Dominican Republic,6/6/21,301078,3654,,,1397,,2775.448602789995,,,,,214,DOM,2021/06/06,2,5115370,125563
Dominican Republic,6/7/21,301984,3655,,,906,,2783.8004466116217,,,,,214,DOM,2021/06/07,1,5197199,81829
Dominican Republic,6/8/21,302988,3672,,,1004,,2793.0556907583255,,,,,214,DOM,2021/06/08,17,5652133,454934
Dominican Republic,6/9/21,304428,3686,,,1440,,2806.330144514553,,,,,214,DOM,2021/06/09,14,5656548,4415
Dominican Republic,6/10/21,305569,3695,,,1141,,2816.848305442231,,,,,214,DOM,2021/06/10,9,5656548,0
Dominican Republic,6/11/21,306698,3700,,,1129,,2827.2558459219404,,,,,214,DOM,2021/06/11,5,6050983,394435
Dominican Republic,6/12/21,307847,3705,,,1149,,2837.8477538149305,,,,,214,DOM,2021/06/12,5,6173811,122828
Dominican Republic,6/13/21,308650,3707,,,803,,2845.2501054581603,,,,,214,DOM,2021/06/13,2,6219867,46056
Dominican Republic,6/14/21,309477,3708,,,827,,2852.8736979973273,,,,,214,DOM,2021/06/14,1,6251341,31474
Dominican Republic,6/15/21,310391,3717,,,914,,2861.2992887842665,,,,,214,DOM,2021/06/15,9,6370569,119228
Dominican Republic,6/16/21,311833,3726,,,1442,,2874.5921792818226,,,,,214,DOM,2021/06/16,9,6370569,0
Dominican Republic,6/17/21,312815,3733,,,982,,2883.6446192739168,,,,,214,DOM,2021/06/17,7,6553710,183141
Dominican Republic,6/18/21,314031,3742,,,1216,,2894.8541580013984,,,,,214,DOM,2021/06/18,9,6553710,0
Dominican Republic,6/19/21,315815,3754,,,1784,,2911.299731266058,,,,,214,DOM,2021/06/19,12,6675351,121641
Dominican Republic,6/20/21,316787,3756,,,972,,2920.259987551512,,,,,214,DOM,2021/06/20,2,6835074,159723
Dominican Republic,6/21/21,317645,3758,,,858,,2928.1693495812647,,,,,214,DOM,2021/06/21,2,7012445,177371
Dominican Republic,6/22/21,318368,3769,,,723,,2934.8342315713708,,,,,214,DOM,2021/06/22,11,7172478,160033
Dominican Republic,6/23/21,319254,3773,,,886,,2943.0017079797167,,,,,214,DOM,2021/06/23,4,7301587,129109
Dominican Republic,6/24/21,320136,3781,,,882,,2951.132310905406,,,,,214,DOM,2021/06/24,8,7301587,0
Dominican Republic,6/25/21,321073,3789,,,937,,2959.7699242176186,,,,,214,DOM,2021/06/25,8,7402235,100648
Dominican Republic,6/26/21,322071,3796,,,998,,2968.9698581403377,,,,,214,DOM,2021/06/26,7,7482545,80310
Dominican Republic,6/27/21,322778,3797,,,707,,2975.487246199819,,,,,214,DOM,2021/06/27,1,7569805,87260
Dominican Republic,6/28/21,323650,3801,,,872,,2983.525665418868,,,,,214,DOM,2021/06/28,4,7583057,13252
Dominican Republic,6/29/21,324364,3815,,,714,,2990.1075820729975,,,,,214,DOM,2021/06/29,14,7653536,70479
Dominican Republic,6/30/21,325221,3822,,,857,,2998.0077257320863,,,,,214,DOM,2021/06/30,7,7746038,92502
Dominican Republic,7/1/21,326193,3840,,,972,,3006.96798201754,,,,,214,DOM,2021/07/01,18,7842179,96141
Dominican Republic,7/2/21,327561,3846,,,1368,,3019.5787130859567,,,,,214,DOM,2021/07/02,6,7842179,0
Ecuador,6/4/21,430739,20755,,,922,,2441.407556285588,,,,,218,ECU,2021/06/04,49,2529218,81329
Ecuador,6/5/21,431429,20773,,,690,,2445.318442492402,,,,,218,ECU,2021/06/05,18,2529218,0
Ecuador,6/6/21,432353,20809,,,924,,2450.5556292389188,,,,,218,ECU,2021/06/06,36,2597836,68618
Ecuador,6/7/21,432739,20814,,,386,,2452.743458334325,,,,,218,ECU,2021/06/07,5,2645983,48147
Ecuador,6/8/21,432985,20831,,,246,,2454.13777428632,,,,,218,ECU,2021/06/08,17,2717072,71089
Ecuador,6/9/21,433870,20903,,,885,,2459.1539109428863,,,,,218,ECU,2021/06/09,72,2717072,0
Ecuador,6/10/21,436023,20949,,,2153,,2471.3570094983525,,,,,218,ECU,2021/06/10,46,2717072,0
Ecuador,6/11/21,437121,20997,,,1098,,2477.580419723109,,,,,218,ECU,2021/06/11,48,2788245,71173
Ecuador,6/12/21,438108,21018,,,987,,2483.174687384161,,,,,218,ECU,2021/06/12,21,2788245,0
Ecuador,6/13/21,438934,21048,,,826,,2487.8564149302897,,,,,218,ECU,2021/06/13,30,2788245,0
Ecuador,6/14/21,439139,21051,,,205,,2489.0183448902853,,,,,218,ECU,2021/06/14,3,2788245,0
Ecuador,6/15/21,439374,21061,,,235,,2490.3503133810123,,,,,218,ECU,2021/06/15,10,3081172,292927
Ecuador,6/16/21,441180,21153,,,1806,,2500.586632931022,,,,,218,ECU,2021/06/16,92,3133387,52215
Ecuador,6/17/21,442341,21175,,,1161,,2507.1671240703145,,,,,218,ECU,2021/06/17,22,3133387,0
Ecuador,6/18/21,444395,21234,,,2054,,2518.809095474368,,,,,218,ECU,2021/06/18,59,3133387,0
Ecuador,6/19/21,445586,21284,,,1191,,2525.5596251443912,,,,,218,ECU,2021/06/19,50,3133387,0
Ecuador,6/20/21,446441,21293,,,855,,2530.405723270226,,,,,218,ECU,2021/06/20,9,3558254,424867
Ecuador,6/21/21,446633,21304,,,192,,2531.493969866905,,,,,218,ECU,2021/06/21,11,3580667,22413
Ecuador,6/22/21,447176,21315,,,543,,2534.5716672731373,,,,,218,ECU,2021/06/22,11,3658226,77559
Ecuador,6/23/21,449107,21367,,,1931,,2545.5164807011934,,,,,218,ECU,2021/06/23,52,3725385,67159
Ecuador,6/24/21,449483,21377,,,376,,2547.647630286356,,,,,218,ECU,2021/06/24,10,3797663,72278
Ecuador,6/25/21,452234,21433,,,2751,,2563.2401635543947,,,,,218,ECU,2021/06/25,56,3797663,0
Ecuador,6/26/21,453365,21485,,,1131,,2569.650616162956,,,,,218,ECU,2021/06/26,52,3944256,146593
Ecuador,6/27/21,454336,21523,,,971,,2575.154196607618,,,,,218,ECU,2021/06/27,38,3991635,47379
Ecuador,6/28/21,455743,21523,,,1407,,2583.129003698905,,,,,218,ECU,2021/06/28,0,4024007,32372
Ecuador,6/29/21,457489,21545,,,1746,,2593.025246187453,,,,,218,ECU,2021/06/29,22,4091026,67019
Ecuador,6/30/21,458504,21560,,,1015,,2598.778216477187,,,,,218,ECU,2021/06/30,15,4152557,61531
Ecuador,7/1/21,459538,21605,,,1034,,2604.6388778363844,,,,,218,ECU,2021/07/01,45,4152557,0
Ecuador,7/2/21,461157,21623,,,1619,,2613.8152905448374,,,,,218,ECU,2021/07/02,18,4301966,149409
Egypt,6/4/21,266350,15268,,,861,,260.27415237864824,,,,,818,EGY,2021/06/04,46,2698411,0
Egypt,6/5/21,267171,15309,,,821,,261.0764241229804,,,,,818,EGY,2021/06/05,41,2698411,0
Egypt,6/6/21,267972,15352,,,801,,261.8591520976577,,,,,818,EGY,2021/06/06,43,2822479,124068
Egypt,6/7/21,268754,15399,,,782,,262.6233134911629,,,,,818,EGY,2021/06/07,47,2822479,0
Egypt,6/8/21,269527,15437,,,773,,263.37868018832336,,,,,818,EGY,2021/06/08,38,2822479,0
Egypt,6/9/21,270292,15471,,,765,,264.12622937762194,,,,,818,EGY,2021/06/09,34,2822479,0
Egypt,6/10/21,271047,15510,,,755,,264.864006682093,,,,,818,EGY,2021/06/10,39,3340216,517737
Egypt,6/11/21,271780,15547,,,733,,265.58028583994377,,,,,818,EGY,2021/06/11,37,3340216,0
Egypt,6/12/21,272491,15582,,,711,,266.2750668511742,,,,,818,EGY,2021/06/12,35,3340216,0
Egypt,6/13/21,273182,15623,,,691,,266.9503040927497,,,,,818,EGY,2021/06/13,41,3340216,0
Egypt,6/14/21,273795,15654,,,613,,267.5493206326713,,,,,818,EGY,2021/06/14,31,3506760,166544
Egypt,6/15/21,274404,15691,,,609,,268.1444284186619,,,,,818,EGY,2021/06/15,37,3603805,97045
Egypt,6/16/21,275010,15723,,,606,,268.7366046392043,,,,,818,EGY,2021/06/16,32,3603805,0
Egypt,6/17/21,275601,15760,,,591,,269.3141230325055,,,,,818,EGY,2021/06/17,37,3746978,143173
Egypt,6/18/21,276190,15791,,,589,,269.8896870488412,,,,,818,EGY,2021/06/18,31,3794707,47729
Egypt,6/19/21,276756,15829,,,566,,270.4427757300739,,,,,818,EGY,2021/06/19,38,3794707,0
Egypt,6/20/21,277288,15859,,,532,,270.96264000289324,,,,,818,EGY,2021/06/20,30,4010467,215760
Egypt,6/21/21,277797,15898,,,509,,271.46002894060956,,,,,818,EGY,2021/06/21,39,4010467,0
Egypt,6/22/21,278295,15935,,,498,,271.94666880501563,,,,,818,EGY,2021/06/22,37,4010467,0
Egypt,6/23/21,278761,15967,,,466,,272.402038637974,,,,,818,EGY,2021/06/23,32,4010467,0
Egypt,6/24/21,279184,16002,,,423,,272.8153893661744,,,,,818,EGY,2021/06/24,35,4138935,128468
Egypt,6/25/21,279596,16031,,,412,,273.21799102106456,,,,,818,EGY,2021/06/25,29,4138935,0
Egypt,6/26/21,280005,16062,,,409,,273.6176611105065,,,,,818,EGY,2021/06/26,31,4138935,0
Egypt,6/27/21,280394,16092,,,389,,273.9977874302936,,,,,818,EGY,2021/06/27,30,4138935,0
Egypt,6/28/21,280770,16125,,,376,,274.365210299805,,,,,818,EGY,2021/06/28,33,4253397,114462
Egypt,6/29/21,281031,16148,,,261,,274.62025649380104,,,,,818,EGY,2021/06/29,23,4253397,0
Egypt,6/30/21,281282,16169,,,251,,274.86553080296954,,,,,818,EGY,2021/06/30,21,4282641,29244
Egypt,7/1/21,281524,16194,,,242,,275.1020104157934,,,,,818,EGY,2021/07/01,25,4282641,0
Egypt,7/2/21,281722,16215,,,198,,275.29549373537657,,,,,818,EGY,2021/07/02,21,4282641,0
El Salvador,6/4/21,74141,2260,,,0,,1143.0573921468051,,,,,222,SLV,2021/06/04,0,2015408,0
El Salvador,6/5/21,74141,2266,,,0,,1143.0573921468051,,,,,222,SLV,2021/06/05,6,2015408,0
El Salvador,6/6/21,74141,2270,,,0,,1143.0573921468051,,,,,222,SLV,2021/06/06,4,2015408,0
El Salvador,6/7/21,74141,2274,,,0,,1143.0573921468051,,,,,222,SLV,2021/06/07,4,2147224,131816
El Salvador,6/8/21,74983,2279,,,842,,1156.0387968242119,,,,,222,SLV,2021/06/08,5,2147224,0
El Salvador,6/10/21,75351,2284,,,368,,1161.712379866119,,,,,222,SLV,2021/06/10,5,2231365,0
El Salvador,6/11/21,75351,2288,,,0,,1161.712379866119,,,,,222,SLV,2021/06/11,4,2231365,0
El Salvador,6/12/21,75351,2292,,,0,,1161.712379866119,,,,,222,SLV,2021/06/12,4,2310924,79559
El Salvador,6/13/21,75351,2295,,,0,,1161.712379866119,,,,,222,SLV,2021/06/13,3,2310924,0
El Salvador,6/14/21,75351,2299,,,0,,1161.712379866119,,,,,222,SLV,2021/06/14,4,2310924,0
El Salvador,6/15/21,76297,2305,,,946,,1176.297188446673,,,,,222,SLV,2021/06/15,6,2388927,78003
El Salvador,6/16/21,76495,2310,,,198,,1179.3498228007427,,,,,222,SLV,2021/06/16,5,2388927,0
El Salvador,6/17/21,76495,2315,,,0,,1179.3498228007427,,,,,222,SLV,2021/06/17,5,2427457,38530
El Salvador,6/18/21,76697,2321,,,202,,1182.4641265357025,,,,,222,SLV,2021/06/18,6,2427457,0
El Salvador,6/19/21,76697,2327,,,0,,1182.4641265357025,,,,,222,SLV,2021/06/19,6,2427457,0
El Salvador,6/20/21,77100,2332,,,403,,1188.6773166603996,,,,,222,SLV,2021/06/20,5,2466561,39104
El Salvador,6/21/21,77484,2336,,,384,,1194.5975772258676,,,,,222,SLV,2021/06/21,4,2506257,39696
El Salvador,6/22/21,77484,2341,,,0,,1194.5975772258676,,,,,222,SLV,2021/06/22,5,2546316,40059
El Salvador,6/23/21,77484,2346,,,0,,1194.5975772258676,,,,,222,SLV,2021/06/23,5,2586522,40206
El Salvador,6/24/21,77484,2351,,,0,,1194.5975772258676,,,,,222,SLV,2021/06/24,5,2586522,0
El Salvador,6/25/21,77484,2356,,,0,,1194.5975772258676,,,,,222,SLV,2021/06/25,5,2586522,0
El Salvador,6/26/21,77484,2361,,,0,,1194.5975772258676,,,,,222,SLV,2021/06/26,5,2674605,88083
El Salvador,6/27/21,78572,2367,,,1088,,1211.3716488280274,,,,,222,SLV,2021/06/27,6,2674605,0
El Salvador,6/28/21,78766,2371,,,194,,1214.3626138012066,,,,,222,SLV,2021/06/28,4,2674605,0
El Salvador,6/29/21,78766,2376,,,0,,1214.3626138012066,,,,,222,SLV,2021/06/29,5,2674605,0
El Salvador,6/30/21,78766,2381,,,0,,1214.3626138012066,,,,,222,SLV,2021/06/30,5,2674605,0
El Salvador,7/1/21,78766,2387,,,0,,1214.3626138012066,,,,,222,SLV,2021/07/01,6,2846177,171572
El Salvador,7/2/21,78766,2393,,,0,,1214.3626138012066,,,,,222,SLV,2021/07/02,6,2890503,44326
Equatorial Guinea,6/4/21,8572,118,,,0,,610.9830112225006,,,,,226,GNQ,2021/06/04,0,224503,0
Equatorial Guinea,6/5/21,8626,118,,,54,,614.831947597444,,,,,226,GNQ,2021/06/05,0,224503,0
Equatorial Guinea,6/8/21,8640,118,,,14,,615.8298199909478,,,,,226,GNQ,2021/06/08,0,236189,0
Equatorial Guinea,6/12/21,8650,120,,,10,,616.5425859863078,,,,,226,GNQ,2021/06/12,2,247228,11039
Equatorial Guinea,6/14/21,8662,120,,,12,,617.3979051807396,,,,,226,GNQ,2021/06/14,0,248184,956
Equatorial Guinea,6/17/21,8680,120,,,18,,618.6808839723874,,,,,226,GNQ,2021/06/17,0,255030,6846
Equatorial Guinea,6/18/21,8698,120,,,18,,619.9638627640353,,,,,226,GNQ,2021/06/18,0,255030,0
Equatorial Guinea,6/21/21,8708,120,,,10,,620.6766287593952,,,,,226,GNQ,2021/06/21,0,257146,0
Equatorial Guinea,6/24/21,8712,120,,,4,,620.9617351575391,,,,,226,GNQ,2021/06/24,0,257146,0
Equatorial Guinea,6/26/21,8723,121,,,11,,621.745777752435,,,,,226,GNQ,2021/06/26,1,259480,0
Equatorial Guinea,6/29/21,8734,121,,,11,,622.5298203473309,,,,,226,GNQ,2021/06/29,0,264853,4325
Equatorial Guinea,7/1/21,8742,122,,,8,,623.1000331436188,,,,,226,GNQ,2021/07/01,1,265110,257
Equatorial Guinea,7/2/21,8742,122,,,0,,623.1000331436188,,,,,226,GNQ,2021/07/02,0,265110,0
Eritrea,6/4/21,4427,14,,,282,,124.8298639729508,,,,,232,ERI,2021/06/04,0,,
Eritrea,6/7/21,4499,14,,,72,,126.86007635290392,,,,,232,ERI,2021/06/07,0,,
Eritrea,6/8/21,4597,14,,,98,,129.62342098117344,,,,,232,ERI,2021/06/08,0,,
Eritrea,6/9/21,4690,14,,,93,,132.2457786386129,,,,,232,ERI,2021/06/09,0,,
Eritrea,6/10/21,4766,16,,,76,,134.38878059523006,,,,,232,ERI,2021/06/10,2,,
Eritrea,6/11/21,4848,16,,,82,,136.70096691684336,,,,,232,ERI,2021/06/11,0,,
Eritrea,6/14/21,4981,16,,,133,,140.4512203409234,,,,,232,ERI,2021/06/14,0,,
Eritrea,6/15/21,5012,17,,,31,,141.3253395600699,,,,,232,ERI,2021/06/15,1,,
Eritrea,6/16/21,5108,17,,,96,,144.0322894000074,,,,,232,ERI,2021/06/16,0,,
Eritrea,6/17/21,5194,19,,,86,,146.4572652982847,,,,,232,ERI,2021/06/17,2,,
Eritrea,6/18/21,5285,19,,,91,,149.02322816739215,,,,,232,ERI,2021/06/18,0,,
Eritrea,6/19/21,5336,19,,,51,,150.46129526985894,,,,,232,ERI,2021/06/19,0,,
Eritrea,6/20/21,5362,19,,,26,,151.19442751817533,,,,,232,ERI,2021/06/20,0,,
Eritrea,6/21/21,5421,19,,,59,,152.85807377397026,,,,,232,ERI,2021/06/21,0,,
Eritrea,6/22/21,5508,21,,,87,,155.3112470664136,,,,,232,ERI,2021/06/22,2,,
Eritrea,6/23/21,5603,21,,,95,,157.98999951218508,,,,,232,ERI,2021/06/23,0,,
Eritrea,6/24/21,5664,21,,,61,,159.71004055631204,,,,,232,ERI,2021/06/24,0,,
Eritrea,6/25/21,5720,21,,,56,,161.2890946296089,,,,,232,ERI,2021/06/25,0,,
Eritrea,6/26/21,5780,21,,,60,,162.98093827956984,,,,,232,ERI,2021/06/26,0,,
Eritrea,6/28/21,5884,22,,,104,,165.91346727283545,,,,,232,ERI,2021/06/28,1,,
Eritrea,6/29/21,5936,23,,,52,,167.37973176946826,,,,,232,ERI,2021/06/29,1,,
Eritrea,6/30/21,6009,23,,,73,,169.4381415435874,,,,,232,ERI,2021/06/30,0,,
Eritrea,7/1/21,6028,25,,,19,,169.97389203274167,,,,,232,ERI,2021/07/01,2,,
Eritrea,7/2/21,6051,25,,,23,,170.62243209856004,,,,,232,ERI,2021/07/02,0,,
Estonia,6/4/21,130005,1260,,,96,,9800.314954931593,,,,,233,EST,2021/06/04,0,751958,11627
Estonia,6/5/21,130068,1262,,,63,,9805.064155671262,,,,,233,EST,2021/06/05,2,751958,0
Estonia,6/6/21,130119,1263,,,51,,9808.908746746232,,,,,233,EST,2021/06/06,1,762382,10424
Estonia,6/7/21,130156,1264,,,37,,9811.697959879053,,,,,233,EST,2021/06/07,1,768684,6302
Estonia,6/8/21,130242,1264,,,86,,9818.180995809396,,,,,233,EST,2021/06/08,0,778233,9549
Estonia,6/9/21,130310,1265,,,68,,9823.30711724269,,,,,233,EST,2021/06/09,1,791698,13465
Estonia,6/10/21,130364,1266,,,54,,9827.377860733834,,,,,233,EST,2021/06/10,1,791698,0
Estonia,6/11/21,130418,1266,,,54,,9831.44860422498,,,,,233,EST,2021/06/11,0,806585,14887
Estonia,6/12/21,130473,1266,,,55,,9835.59473185485,,,,,233,EST,2021/06/12,0,825221,18636
Estonia,6/13/21,130510,1266,,,37,,9838.38394498767,,,,,233,EST,2021/06/13,0,829799,4578
Estonia,6/14/21,130538,1266,,,28,,9840.494700871968,,,,,233,EST,2021/06/14,0,829799,0
Estonia,6/15/21,130599,1266,,,61,,9845.093133334187,,,,,233,EST,2021/06/15,0,848218,18419
Estonia,6/16/21,130658,1266,,,59,,9849.540797518957,,,,,233,EST,2021/06/16,0,848218,0
Estonia,6/17/21,130695,1267,,,37,,9852.330010651778,,,,,233,EST,2021/06/17,1,875567,27349
Estonia,6/18/21,130751,1267,,,56,,9856.551522420374,,,,,233,EST,2021/06/18,0,875567,0
Estonia,6/19/21,130781,1267,,,30,,9858.813046582121,,,,,233,EST,2021/06/19,0,889597,14030
Estonia,6/20/21,130806,1268,,,25,,9860.697650050244,,,,,233,EST,2021/06/20,1,895870,6273
Estonia,6/21/21,130818,1268,,,12,,9861.602259714942,,,,,233,EST,2021/06/21,0,908498,12628
Estonia,6/22/21,130855,1269,,,37,,9864.391472847765,,,,,233,EST,2021/06/22,1,914383,5885
Estonia,6/23/21,130880,1269,,,25,,9866.276076315886,,,,,233,EST,2021/06/23,0,914509,126
Estonia,6/24/21,130898,1269,,,18,,9867.632990812936,,,,,233,EST,2021/06/24,0,914509,0
Estonia,6/25/21,130908,1269,,,10,,9868.386832200184,,,,,233,EST,2021/06/25,0,914685,176
Estonia,6/26/21,130941,1269,,,33,,9870.874508778106,,,,,233,EST,2021/06/26,0,922317,7632
Estonia,6/27/21,130968,1269,,,27,,9872.909880523679,,,,,233,EST,2021/06/27,0,931260,8943
Estonia,6/28/21,130983,1269,,,15,,9874.040642604552,,,,,233,EST,2021/06/28,0,938760,7500
Estonia,6/29/21,131028,1269,,,45,,9877.432928847173,,,,,233,EST,2021/06/29,0,947158,8398
Estonia,6/30/21,131064,1269,,,36,,9880.14675784127,,,,,233,EST,2021/06/30,0,947158,0
Estonia,7/1/21,131085,1269,,,21,,9881.729824754493,,,,,233,EST,2021/07/01,0,963401,16243
Estonia,7/2/21,131123,1269,,,38,,9884.594422026039,,,,,233,EST,2021/07/02,0,963401,0
Eswatini,6/4/21,18632,673,,,9,,1605.9798442289193,,,,,748,SWZ,2021/06/04,0,35227,0
Eswatini,6/5/21,18636,673,,,4,,1606.3246230705315,,,,,748,SWZ,2021/06/05,0,35227,0
Eswatini,6/6/21,18653,673,,,17,,1607.7899331473825,,,,,748,SWZ,2021/06/06,0,35227,0
Eswatini,6/7/21,18664,673,,,11,,1608.7380749618158,,,,,748,SWZ,2021/06/07,0,35227,0
Eswatini,6/8/21,18680,674,,,16,,1610.1171903282639,,,,,748,SWZ,2021/06/08,1,35227,0
Eswatini,6/9/21,18694,676,,,14,,1611.3239162739062,,,,,748,SWZ,2021/06/09,2,35227,0
Eswatini,6/10/21,18705,676,,,11,,1612.2720580883392,,,,,748,SWZ,2021/06/10,0,35227,0
Eswatini,6/11/21,18723,676,,,18,,1613.8235628755936,,,,,748,SWZ,2021/06/11,0,35227,0
Eswatini,6/12/21,18732,676,,,9,,1614.5993152692206,,,,,748,SWZ,2021/06/12,0,35227,0
Eswatini,6/13/21,18736,676,,,4,,1614.9440941108326,,,,,748,SWZ,2021/06/13,0,35227,0
Eswatini,6/14/21,18746,676,,,10,,1615.8060412148627,,,,,748,SWZ,2021/06/14,0,35227,0
Eswatini,6/15/21,18754,676,,,8,,1616.4955988980869,,,,,748,SWZ,2021/06/15,0,35227,0
Eswatini,6/16/21,18768,676,,,14,,1617.702324843729,,,,,748,SWZ,2021/06/16,0,35227,0
Eswatini,6/17/21,18784,676,,,16,,1619.081440210177,,,,,748,SWZ,2021/06/17,0,35227,0
Eswatini,6/18/21,18800,677,,,16,,1620.4605555766254,,,,,748,SWZ,2021/06/18,1,35227,0
Eswatini,6/19/21,18811,677,,,11,,1621.4086973910585,,,,,748,SWZ,2021/06/19,0,35227,0
Eswatini,6/20/21,18813,677,,,2,,1621.5810868118645,,,,,748,SWZ,2021/06/20,0,35227,0
Eswatini,6/21/21,18831,677,,,18,,1623.1325915991188,,,,,748,SWZ,2021/06/21,0,35227,0
Eswatini,6/22/21,18854,677,,,23,,1625.115069938388,,,,,748,SWZ,2021/06/22,0,35227,0
Eswatini,6/23/21,18898,677,,,44,,1628.9076371961205,,,,,748,SWZ,2021/06/23,0,44305,0
Eswatini,6/24/21,18947,678,,,49,,1633.1311780058682,,,,,748,SWZ,2021/06/24,1,44305,0
Eswatini,6/25/21,18989,678,,,42,,1636.7513558427947,,,,,748,SWZ,2021/06/25,0,44305,0
Eswatini,6/26/21,19018,678,,,29,,1639.251002444482,,,,,748,SWZ,2021/06/26,0,46796,0
Eswatini,6/27/21,19035,678,,,17,,1640.7163125213333,,,,,748,SWZ,2021/06/27,0,47623,0
Eswatini,6/28/21,19084,678,,,49,,1644.9398533310807,,,,,748,SWZ,2021/06/28,0,47623,0
Eswatini,7/2/21,19084,678,,,0,,1644.9398533310807,,,,,748,SWZ,2021/07/02,0,47623,0
Ethiopia,6/4/21,272632,4193,,,347,,237.14640139564892,,,,,231,ETH,2021/06/04,8,1865958,0
Ethiopia,6/5/21,272805,4201,,,173,,237.29688383146512,,,,,231,ETH,2021/06/05,8,1865958,0
Ethiopia,6/6/21,272914,4209,,,109,,237.39169646443605,,,,,231,ETH,2021/06/06,8,1865958,0
Ethiopia,6/7/21,273024,4213,,,110,,237.4873789380764,,,,,231,ETH,2021/06/07,4,1865958,0
Ethiopia,6/8/21,273175,4220,,,151,,237.61872487916457,,,,,231,ETH,2021/06/08,7,1894717,0
Ethiopia,6/9/21,273398,4226,,,223,,237.81269934845366,,,,,231,ETH,2021/06/09,6,1894717,0
Ethiopia,6/10/21,273678,4231,,,280,,238.0562547359019,,,,,231,ETH,2021/06/10,5,1901363,0
Ethiopia,6/11/21,273892,4235,,,214,,238.24240063916588,,,,,231,ETH,2021/06/11,4,1920676,0
Ethiopia,6/12/21,274028,4237,,,136,,238.36069897021216,,,,,231,ETH,2021/06/12,2,1920676,0
Ethiopia,6/13/21,274187,4242,,,159,,238.49900363665597,,,,,231,ETH,2021/06/13,5,1920676,0
Ethiopia,6/14/21,274346,4250,,,159,,238.6373083030998,,,,,231,ETH,2021/06/14,8,1948073,0
Ethiopia,6/15/21,274480,4257,,,134,,238.75386695280713,,,,,231,ETH,2021/06/15,7,1948073,0
Ethiopia,6/16/21,274601,4260,,,121,,238.85911767381154,,,,,231,ETH,2021/06/16,3,1948073,0
Ethiopia,6/17/21,274775,4262,,,174,,239.01046995029722,,,,,231,ETH,2021/06/17,2,1964005,0
Ethiopia,6/18/21,274899,4276,,,124,,239.11833019331,,,,,231,ETH,2021/06/18,14,1964005,0
Ethiopia,6/19/21,275036,4280,,,137,,239.23749836502574,,,,,231,ETH,2021/06/19,4,1974476,0
Ethiopia,6/20/21,275194,4283,,,158,,239.37493319080008,,,,,231,ETH,2021/06/20,3,1975957,0
Ethiopia,6/21/21,275318,4286,,,124,,239.48279343381287,,,,,231,ETH,2021/06/21,3,1975957,0
Ethiopia,6/22/21,275391,4290,,,73,,239.5462918026833,,,,,231,ETH,2021/06/22,4,1975957,0
Ethiopia,6/23/21,275502,4292,,,111,,239.64284411699313,,,,,231,ETH,2021/06/23,2,1982320,0
Ethiopia,6/24/21,275601,4296,,,99,,239.72895834326945,,,,,231,ETH,2021/06/24,4,1987301,0
Ethiopia,6/25/21,275769,4302,,,168,,239.87509157573837,,,,,231,ETH,2021/06/25,6,1987927,0
Ethiopia,6/26/21,275881,4309,,,112,,239.97251373071768,,,,,231,ETH,2021/06/26,7,1987927,0
Ethiopia,6/27/21,275935,4314,,,54,,240.0194851268684,,,,,231,ETH,2021/06/27,5,1989297,0
Ethiopia,6/28/21,275974,4315,,,39,,240.05340891297726,,,,,231,ETH,2021/06/28,1,1989597,0
Ethiopia,6/29/21,276037,4320,,,63,,240.1082088751531,,,,,231,ETH,2021/06/29,5,1989597,0
Ethiopia,6/30/21,276174,4320,,,137,,240.22737704686884,,,,,231,ETH,2021/06/30,0,1989597,0
Ethiopia,7/1/21,276250,4325,,,76,,240.29348493774762,,,,,231,ETH,2021/07/01,5,2022116,0
Ethiopia,7/2/21,276323,4327,,,73,,240.35698330661805,,,,,231,ETH,2021/07/02,2,2022116,0
Fiji,6/4/21,571,4,,,35,,63.696114871648426,,,,,242,FJI,2021/06/04,0,136247,0
Fiji,6/5/21,604,4,,,33,,67.37732641414298,,,,,242,FJI,2021/06/05,0,136247,0
Fiji,6/6/21,687,4,,,83,,76.63613120284145,,,,,242,FJI,2021/06/06,0,136247,0
Fiji,6/7/21,751,4,,,64,,83.77545055798242,,,,,242,FJI,2021/06/07,0,136247,0
Fiji,6/8/21,845,4,,,94,,94.26132586084574,,,,,242,FJI,2021/06/08,0,223429,0
Fiji,6/9/21,880,4,,,35,,98.16564113318846,,,,,242,FJI,2021/06/09,0,223429,0
Fiji,6/10/21,919,4,,,39,,102.5161638652275,,,,,242,FJI,2021/06/10,0,223429,0
Fiji,6/11/21,970,4,,,51,,108.20530897635547,,,,,242,FJI,2021/06/11,0,223429,0
Fiji,6/12/21,1014,4,,,44,,113.11359103301488,,,,,242,FJI,2021/06/12,0,223429,0
Fiji,6/13/21,1118,4,,,104,,124.71498498511897,,,,,242,FJI,2021/06/13,0,223429,0
Fiji,6/14/21,1206,4,,,88,,134.53154909843784,,,,,242,FJI,2021/06/14,0,223429,0
Fiji,6/15/21,1322,5,,,116,,147.47156542963086,,,,,242,FJI,2021/06/15,1,242539,0
Fiji,6/16/21,1443,5,,,121,,160.96934108544426,,,,,242,FJI,2021/06/16,0,242539,0
Fiji,6/17/21,1533,6,,,90,,171.00900892861128,,,,,242,FJI,2021/06/17,1,242539,0
Fiji,6/18/21,1648,6,,,115,,183.83747339488022,,,,,242,FJI,2021/06/18,0,242539,0
Fiji,6/19/21,1798,6,,,150,,200.5702531334919,,,,,242,FJI,2021/06/19,0,242539,0
Fiji,6/20/21,1964,7,,,166,,219.0878627108888,,,,,242,FJI,2021/06/20,1,242539,0
Fiji,6/21/21,2090,7,,,126,,233.1433976913226,,,,,242,FJI,2021/06/21,0,274008,0
Fiji,6/22/21,2270,9,,,180,,253.2227333776566,,,,,242,FJI,2021/06/22,2,274008,0
Fiji,6/23/21,2549,13,,,279,,284.34570369147434,,,,,242,FJI,2021/06/23,4,274008,0
Fiji,6/24/21,2848,13,,,299,,317.6997113037736,,,,,242,FJI,2021/06/24,0,274008,0
Fiji,6/25/21,3063,14,,,215,,341.6833622624503,,,,,242,FJI,2021/06/25,1,274008,0
Fiji,6/26/21,3329,15,,,266,,371.356158332255,,,,,242,FJI,2021/06/26,1,274008,0
Fiji,6/27/21,3591,15,,,262,,400.58274694236337,,,,,242,FJI,2021/06/27,0,274008,0
Fiji,6/28/21,3832,17,,,241,,427.46674638906615,,,,,242,FJI,2021/06/28,2,274008,0
Fiji,6/29/21,4144,21,,,312,,462.2709282453784,,,,,242,FJI,2021/06/29,4,322299,0
Fiji,6/30/21,4418,21,,,274,,492.83613923457574,,,,,242,FJI,2021/06/30,0,322299,0
Fiji,7/1/21,4849,24,,,431,,540.9149930168533,,,,,242,FJI,2021/07/01,3,322299,0
Fiji,7/2/21,5253,25,,,404,,585.9819464461807,,,,,242,FJI,2021/07/02,1,322299,0
Finland,6/4/21,93038,959,,,125,,1679.1686564809831,,,,,246,FIN,2021/06/04,0,3222023,127169
Finland,6/5/21,93158,959,,,120,,1681.3344407710335,,,,,246,FIN,2021/06/05,0,3222023,0
Finland,6/6/21,93226,959,,,68,,1682.5617185353956,,,,,246,FIN,2021/06/06,0,3240047,18024
Finland,6/7/21,93281,959,,,55,,1683.5543696683353,,,,,246,FIN,2021/06/07,0,3246294,6247
Finland,6/8/21,93394,959,,,113,,1685.5938165414664,,,,,246,FIN,2021/06/08,0,3292288,45994
Finland,6/9/21,93520,959,,,126,,1687.8678900460193,,,,,246,FIN,2021/06/09,0,3331391,39103
Finland,6/10/21,93613,964,,,93,,1689.5463728708085,,,,,246,FIN,2021/06/10,5,3331391,0
Finland,6/11/21,93660,964,,,47,,1690.3946383844116,,,,,246,FIN,2021/06/11,0,3421475,90084
Finland,6/12/21,93774,964,,,114,,1692.4521334599594,,,,,246,FIN,2021/06/12,0,3493579,72104
Finland,6/13/21,93821,964,,,47,,1693.3003989735626,,,,,246,FIN,2021/06/13,0,3556222,62643
Finland,6/14/21,93850,964,,,29,,1693.823796843658,,,,,246,FIN,2021/06/14,0,3574132,17910
Finland,6/15/21,93923,964,,,73,,1695.1413156201056,,,,,246,FIN,2021/06/15,0,3578059,3927
Finland,6/16/21,94026,967,,,103,,1697.0002804690655,,,,,246,FIN,2021/06/16,3,3578059,0
Finland,6/17/21,94081,967,,,55,,1697.9929316020055,,,,,246,FIN,2021/06/17,0,3707724,129665
Finland,6/18/21,94154,967,,,73,,1699.3104503784527,,,,,246,FIN,2021/06/18,0,3707724,0
Finland,6/19/21,94269,967,,,115,,1701.385993656418,,,,,246,FIN,2021/06/19,0,3867556,159832
Finland,6/20/21,94334,967,,,65,,1702.5591268135286,,,,,246,FIN,2021/06/20,0,3916915,49359
Finland,6/21/21,94379,967,,,45,,1703.3712959222973,,,,,246,FIN,2021/06/21,0,3929061,12146
Finland,6/22/21,94489,967,,,110,,1705.356598188177,,,,,246,FIN,2021/06/22,0,3950537,21476
Finland,6/23/21,94596,969,,,107,,1707.2877558468053,,,,,246,FIN,2021/06/23,2,4011742,61205
Finland,6/24/21,94719,969,,,123,,1709.507684744107,,,,,246,FIN,2021/06/24,0,4011742,0
Finland,6/26/21,94989,969,,,270,,1714.3806993967207,,,,,246,FIN,2021/06/26,0,4200693,188951
Finland,6/27/21,95084,969,,,95,,1716.095278626344,,,,,246,FIN,2021/06/27,0,4200712,19
Finland,6/28/21,95168,969,,,84,,1717.6113276293795,,,,,246,FIN,2021/06/28,0,4201393,681
Finland,6/29/21,95387,969,,,219,,1721.5638839587216,,,,,246,FIN,2021/06/29,0,4213157,11764
Finland,6/30/21,95742,969,,,355,,1727.9709958167875,,,,,246,FIN,2021/06/30,0,4248079,34922
Finland,7/1/21,95964,973,,,222,,1731.977696753381,,,,,246,FIN,2021/07/01,4,4322972,74893
Finland,7/2/21,96180,973,,,216,,1735.876108475472,,,,,246,FIN,2021/07/02,0,4322972,0
France,6/4/21,5762637,110078,,,6958,,8828.446368873181,,,,,250,FRA,2021/06/04,88,38808773,721545
France,6/5/21,5769291,110135,,,6654,,8838.640396735509,,,,,250,FRA,2021/06/05,57,38808773,0
France,6/6/21,5774361,110160,,,5070,,8846.40771282538,,,,,250,FRA,2021/06/06,25,40057082,1248309
France,6/7/21,5775535,110224,,,1174,,8848.206298444613,,,,,250,FRA,2021/06/07,64,40237289,180207
France,6/8/21,5781556,110299,,,6021,,8857.430560806963,,,,,250,FRA,2021/06/08,75,40841175,603886
France,6/9/21,5787125,110364,,,5569,,8865.962352385757,,,,,250,FRA,2021/06/09,65,40841175,0
France,6/10/21,5791608,110432,,,4483,,8872.830375666013,,,,,250,FRA,2021/06/10,68,40841175,0
France,6/11/21,5795487,110506,,,3879,,8878.773061881519,,,,,250,FRA,2021/06/11,74,43204513,2363338
France,6/12/21,5799459,110540,,,3972,,8884.858225492755,,,,,250,FRA,2021/06/12,34,43803521,599008
France,6/13/21,5802314,110553,,,2855,,8889.232128340207,,,,,250,FRA,2021/06/13,13,44127058,323537
France,6/14/21,5803012,110616,,,698,,8890.301474815695,,,,,250,FRA,2021/06/14,63,44304266,177208
France,6/15/21,5806255,110692,,,3243,,8895.2697994862,,,,,250,FRA,2021/06/15,76,44304266,0
France,6/16/21,5809319,110740,,,3064,,8899.963893470294,,,,,250,FRA,2021/06/16,48,44304266,0
France,6/17/21,5811461,110796,,,2142,,8903.245469617139,,,,,250,FRA,2021/06/17,56,46262624,1958358
France,6/18/21,5814648,110864,,,3187,,8908.128001447203,,,,,250,FRA,2021/06/18,68,46262624,0
France,6/19/21,5817272,110886,,,2624,,8912.148008827839,,,,,250,FRA,2021/06/19,22,46951192,688568
France,6/20/21,5819088,110900,,,1816,,8914.93014808212,,,,,250,FRA,2021/06/20,14,47714865,763673
France,6/21/21,5819584,110940,,,496,,8915.69002752602,,,,,250,FRA,2021/06/21,40,48390460,675595
France,6/22/21,5821797,110991,,,2213,,8919.080376738424,,,,,250,FRA,2021/06/22,51,48988343,597883
France,6/23/21,5824127,111024,,,2330,,8922.649971706747,,,,,250,FRA,2021/06/23,33,48988343,0
France,6/24/21,5826278,111068,,,2151,,8925.945335988663,,,,,250,FRA,2021/06/24,44,48988343,0
France,6/25/21,5828266,111101,,,1988,,8928.990981824296,,,,,250,FRA,2021/06/25,33,48988343,0
France,6/26/21,5830394,111113,,,2128,,8932.251109761031,,,,,250,FRA,2021/06/26,12,50988854,2000511
France,6/27/21,5831972,111130,,,1578,,8934.66862944344,,,,,250,FRA,2021/06/27,17,52261510,1272656
France,6/28/21,5832490,111174,,,518,,8935.462213217515,,,,,250,FRA,2021/06/28,44,52474306,212796
France,6/29/21,5835885,111230,,,3395,,8940.663404169214,,,,,250,FRA,2021/06/29,56,53083231,608925
France,6/30/21,5837265,111244,,,1380,,8942.777584880067,,,,,250,FRA,2021/06/30,14,53891304,808073
France,7/1/21,5839929,111273,,,2664,,8946.858872861016,,,,,250,FRA,2021/07/01,29,54588852,697548
France,7/2/21,5842616,111297,,,2687,,8950.975397187147,,,,,250,FRA,2021/07/02,24,54588852,0
Gabon,6/4/21,24591,154,,,162,,1104.8519855076631,,,,,266,GAB,2021/06/04,2,22524,0
Gabon,6/8/21,24651,154,,,60,,1107.5477326968974,,,,,266,GAB,2021/06/08,0,25313,0
Gabon,6/9/21,24696,156,,,45,,1109.5695430888231,,,,,266,GAB,2021/06/09,2,29728,0
Gabon,6/11/21,24736,156,,,40,,1111.3667078816459,,,,,266,GAB,2021/06/11,0,33591,0
Gabon,6/14/21,24755,157,,,19,,1112.2203611582368,,,,,266,GAB,2021/06/14,1,37888,0
Gabon,6/16/21,24832,157,,,77,,1115.6799033844206,,,,,266,GAB,2021/06/16,0,37888,0
Gabon,6/19/21,24864,158,,,32,,1117.117635218679,,,,,266,GAB,2021/06/19,1,41737,0
Gabon,6/22/21,24885,158,,,21,,1118.061146734911,,,,,266,GAB,2021/06/22,0,41737,0
Gabon,6/23/21,24958,159,,,73,,1121.3409724818127,,,,,266,GAB,2021/06/23,1,41737,0
Gabon,6/25/21,24984,159,,,26,,1122.5091295971476,,,,,266,GAB,2021/06/25,0,50496,0
Gabon,7/1/21,25054,159,,,70,,1125.6541679845875,,,,,266,GAB,2021/07/01,0,56768,0
Gabon,7/2/21,25076,159,,,22,,1126.64260862064,,,,,266,GAB,2021/07/02,0,56768,0
Gambia,6/4/21,5999,179,,,4,,248.23475667283495,,,,,270,GMB,2021/06/04,0,38490,0
Gambia,6/7/21,6002,179,,,3,,248.35889474084937,,,,,270,GMB,2021/06/07,0,29148,-9342
Gambia,6/11/21,6008,180,,,6,,248.6071708768782,,,,,270,GMB,2021/06/11,1,40810,0
Gambia,6/14/21,6016,180,,,8,,248.93820572491666,,,,,270,GMB,2021/06/14,0,40810,0
Gambia,6/16/21,6024,181,,,8,,249.2692405729551,,,,,270,GMB,2021/06/16,1,40810,0
Gambia,6/21/21,6045,181,,,21,,250.13820704905606,,,,,270,GMB,2021/06/21,0,40810,0
Gambia,6/24/21,6054,181,,,9,,250.51062125309932,,,,,270,GMB,2021/06/24,0,40810,0
Gambia,6/25/21,6065,181,,,11,,250.9657941691522,,,,,270,GMB,2021/06/25,0,40810,0
Gambia,6/26/21,6069,181,,,4,,251.1313115931714,,,,,270,GMB,2021/06/26,0,40810,0
Gambia,6/29/21,6079,181,,,10,,251.54510515321948,,,,,270,GMB,2021/06/29,0,41077,0
Gambia,7/2/21,6079,181,,,0,,251.54510515321948,,,,,270,GMB,2021/07/02,0,42975,0
Georgia,6/4/21,347762,4876,,,779,,8717.642118984502,,,,,268,GEO,2021/06/04,23,202758,0
Georgia,6/5/21,348594,4893,,,832,,8738.49856173269,,,,,268,GEO,2021/06/05,17,202758,0
Georgia,6/6/21,349098,4910,,,504,,8751.13275301284,,,,,268,GEO,2021/06/06,17,211728,0
Georgia,6/7/21,349405,4934,,,307,,8758.828579844203,,,,,268,GEO,2021/06/07,24,211728,0
Georgia,6/8/21,350428,4951,,,1023,,8784.47298000213,,,,,268,GEO,2021/06/08,17,229986,0
Georgia,6/9/21,351249,4982,,,821,,8805.053676512061,,,,,268,GEO,2021/06/09,31,239192,0
Georgia,6/10/21,351954,4996,,,705,,8822.726503600368,,,,,268,GEO,2021/06/10,14,239192,0
Georgia,6/11/21,352649,5012,,,695,,8840.14865229026,,,,,268,GEO,2021/06/11,16,249268,0
Georgia,6/12/21,353443,5034,,,794,,8860.052517124468,,,,,268,GEO,2021/06/12,22,249268,0
Georgia,6/13/21,353965,5048,,,522,,8873.137929521768,,,,,268,GEO,2021/06/13,14,266146,0
Georgia,6/14/21,354276,5060,,,311,,8880.934027712497,,,,,268,GEO,2021/06/14,12,273735,0
Georgia,6/15/21,355368,5083,,,1092,,8908.308108819492,,,,,268,GEO,2021/06/15,23,281360,0
Georgia,6/16/21,356179,5096,,,811,,8928.638126931008,,,,,268,GEO,2021/06/16,13,281360,0
Georgia,6/17/21,356920,5114,,,741,,8947.213396253612,,,,,268,GEO,2021/06/17,18,295651,0
Georgia,6/18/21,357591,5131,,,671,,8964.033916787306,,,,,268,GEO,2021/06/18,17,295651,0
Georgia,6/19/21,358360,5148,,,769,,8983.311085625473,,,,,268,GEO,2021/06/19,17,295651,0
Georgia,6/20/21,358881,5160,,,521,,8996.371430182933,,,,,268,GEO,2021/06/20,12,309128,0
Georgia,6/21/21,359141,5175,,,260,,9002.889068541741,,,,,268,GEO,2021/06/21,15,316599,0
Georgia,6/22/21,360055,5199,,,914,,9025.801074156938,,,,,268,GEO,2021/06/22,24,322976,0
Georgia,6/23/21,360828,5211,,,773,,9045.178514354471,,,,,268,GEO,2021/06/23,12,322976,0
Georgia,6/24/21,361484,5228,,,656,,9061.623017290543,,,,,268,GEO,2021/06/24,17,329582,0
Georgia,6/25/21,362183,5237,,,699,,9079.145437339801,,,,,268,GEO,2021/06/25,9,334134,0
Georgia,6/26/21,362937,5255,,,754,,9098.046588580346,,,,,268,GEO,2021/06/26,18,339415,0
Georgia,6/27/21,363522,5266,,,585,,9112.711274887664,,,,,268,GEO,2021/06/27,11,339415,0
Georgia,6/28/21,363874,5275,,,352,,9121.535154511897,,,,,268,GEO,2021/06/28,9,349477,0
Georgia,6/29/21,365068,5297,,,1194,,9151.466155282735,,,,,268,GEO,2021/06/29,22,354949,0
Georgia,6/30/21,366078,5316,,,1010,,9176.784673522721,,,,,268,GEO,2021/06/30,19,361724,0
Georgia,7/1/21,367058,5327,,,980,,9201.35115656746,,,,,268,GEO,2021/07/01,11,368460,0
Georgia,7/2/21,368022,5335,,,964,,9225.516554174736,,,,,268,GEO,2021/07/02,8,368460,0
Germany,6/4/21,3704685,89152,,,2993,,4421.712298221336,,,,,276,DEU,2021/06/04,121,54240350,835552
Germany,6/5/21,3706934,89228,,,2249,,4424.3965833788325,,,,,276,DEU,2021/06/05,76,54240350,0
Germany,6/6/21,3708898,89249,,,1964,,4426.740707900541,,,,,276,DEU,2021/06/06,21,54905132,664782
Germany,6/7/21,3710342,89390,,,1444,,4428.464188455198,,,,,276,DEU,2021/06/07,141,55546616,641484
Germany,6/8/21,3712595,89497,,,2253,,4431.153247797057,,,,,276,DEU,2021/06/08,107,56592971,1046355
Germany,6/9/21,3715870,89592,,,3275,,4435.062111243389,,,,,276,DEU,2021/06/09,95,57891852,1298881
Germany,6/10/21,3718617,89693,,,2747,,4438.340782353946,,,,,276,DEU,2021/06/10,101,59038531,1146679
Germany,6/11/21,3720811,89821,,,2194,,4440.959422476466,,,,,276,DEU,2021/06/11,128,60105411,1066880
Germany,6/12/21,3722295,89841,,,1484,,4442.730644874743,,,,,276,DEU,2021/06/12,20,60105411,0
Germany,6/13/21,3723295,89849,,,1000,,4443.924190965226,,,,,276,DEU,2021/06/13,8,60735326,629915
Germany,6/14/21,3724168,89944,,,873,,4444.966156702218,,,,,276,DEU,2021/06/14,95,61429675,694349
Germany,6/15/21,3725328,90079,,,1160,,4446.350670167179,,,,,276,DEU,2021/06/15,135,62264554,834879
Germany,6/16/21,3726767,90185,,,1439,,4448.068182991384,,,,,276,DEU,2021/06/16,106,63653046,1388492
Germany,6/17/21,3727668,90277,,,901,,4449.143568018909,,,,,276,DEU,2021/06/17,92,64763343,1110297
Germany,6/18/21,3728601,90374,,,933,,4450.25714652133,,,,,276,DEU,2021/06/18,97,65738489,975146
Germany,6/19/21,3729597,90390,,,996,,4451.44591842745,,,,,276,DEU,2021/06/19,16,65738489,0
Germany,6/20/21,3730126,90400,,,529,,4452.077304309316,,,,,276,DEU,2021/06/20,10,66454623,716134
Germany,6/21/21,3730619,90477,,,493,,4452.665722531924,,,,,276,DEU,2021/06/21,77,67116671,662048
Germany,6/22/21,3731304,90553,,,685,,4453.483301603905,,,,,276,DEU,2021/06/22,76,68167982,1051311
Germany,6/23/21,3732439,90620,,,1135,,4454.837976416604,,,,,276,DEU,2021/06/23,67,69516383,1348401
Germany,6/24/21,3732914,90685,,,475,,4455.404910809583,,,,,276,DEU,2021/06/24,65,70536404,1020021
Germany,6/25/21,3733665,90752,,,751,,4456.301263923536,,,,,276,DEU,2021/06/25,67,71437514,901110
Germany,6/26/21,3734153,90761,,,488,,4456.883714415691,,,,,276,DEU,2021/06/26,9,71437514,0
Germany,6/27/21,3734489,90768,,,336,,4457.284745902094,,,,,276,DEU,2021/06/27,7,72153878,716364
Germany,6/28/21,3734830,90826,,,341,,4457.691745118948,,,,,276,DEU,2021/06/28,58,72806699,652821
Germany,6/29/21,3735399,90883,,,569,,4458.3708728444335,,,,,276,DEU,2021/06/29,57,73754612,947913
Germany,6/30/21,3736205,90945,,,806,,4459.332870993363,,,,,276,DEU,2021/06/30,62,74871502,1116890
Germany,7/1/21,3736959,91014,,,754,,4460.232804745587,,,,,276,DEU,2021/07/01,69,74871502,0
Germany,7/2/21,3737630,91032,,,671,,4461.033674172301,,,,,276,DEU,2021/07/02,18,75781404,909902
Ghana,6/4/21,94188,786,,,177,,303.118999502622,,,,,288,GHA,2021/06/04,1,1228216,0
Ghana,6/6/21,94228,787,,,40,,303.24772885222177,,,,,288,GHA,2021/06/06,1,1228216,0
Ghana,6/9/21,94369,789,,,141,,303.701499809561,,,,,288,GHA,2021/06/09,2,1228216,0
Ghana,6/11/21,94444,789,,,75,,303.9428673400606,,,,,288,GHA,2021/06/11,0,1228216,0
Ghana,6/12/21,94493,789,,,49,,304.10056079332037,,,,,288,GHA,2021/06/12,0,1228216,0
Ghana,6/15/21,94699,790,,,206,,304.76351694375927,,,,,288,GHA,2021/06/15,1,1228216,0
Ghana,6/16/21,94824,790,,,125,,305.16579616125864,,,,,288,GHA,2021/06/16,0,1228216,0
Ghana,6/18/21,94913,793,,,89,,305.4522189641181,,,,,288,GHA,2021/06/18,3,1228216,0
Ghana,6/21/21,95059,794,,,146,,305.92208109015735,,,,,288,GHA,2021/06/21,1,1232876,0
Ghana,6/22/21,95236,794,,,177,,306.49170846213644,,,,,288,GHA,2021/06/22,0,1232876,0
Ghana,6/24/21,95259,794,,,23,,306.5657278381563,,,,,288,GHA,2021/06/24,0,1232876,0
Ghana,6/27/21,95369,795,,,110,,306.91973354955576,,,,,288,GHA,2021/06/27,1,1232876,0
Ghana,6/28/21,95476,795,,,107,,307.2640845597352,,,,,288,GHA,2021/06/28,0,1232876,0
Ghana,6/29/21,95642,795,,,166,,307.7983113605743,,,,,288,GHA,2021/06/29,0,1232876,0
Ghana,6/30/21,95914,796,,,272,,308.6736709378529,,,,,288,GHA,2021/06/30,1,1232876,0
Ghana,7/2/21,95914,796,,,0,,308.6736709378529,,,,,288,GHA,2021/07/02,0,1232876,0
Greece,6/4/21,407857,12218,,,1106,,3913.0270431243966,,,,,300,GRC,2021/06/04,34,5986480,98199
Greece,6/5/21,408789,12253,,,932,,3921.968758490792,,,,,300,GRC,2021/06/05,35,5986480,0
Greece,6/6/21,409368,12277,,,579,,3927.5237511915893,,,,,300,GRC,2021/06/06,24,6084963,98483
Greece,6/7/21,410166,12301,,,798,,3935.179855121185,,,,,300,GRC,2021/06/07,24,6258951,173988
Greece,6/8/21,411534,12331,,,1368,,3948.3046047147786,,,,,300,GRC,2021/06/08,30,6361417,102466
Greece,6/9/21,412420,12346,,,886,,3956.804990781974,,,,,300,GRC,2021/06/09,15,6463465,102048
Greece,6/10/21,413170,12370,,,750,,3964.0005771819706,,,,,300,GRC,2021/06/10,24,6463465,0
Greece,6/11/21,413954,12381,,,784,,3971.5223634987665,,,,,300,GRC,2021/06/11,11,6665626,202161
Greece,6/12/21,414636,12402,,,682,,3978.0655500651633,,,,,300,GRC,2021/06/12,21,6770033,104407
Greece,6/13/21,414933,12419,,,297,,3980.9150022795616,,,,,300,GRC,2021/06/13,17,6835783,65750
Greece,6/14/21,415401,12437,,,468,,3985.4050481931595,,,,,300,GRC,2021/06/14,18,6938959,103176
Greece,6/15/21,416195,12459,,,794,,3993.0227756619556,,,,,300,GRC,2021/06/15,22,7041432,102473
Greece,6/16/21,416741,12472,,,546,,3998.261162561153,,,,,300,GRC,2021/06/16,13,7041432,0
Greece,6/17/21,417253,12488,,,512,,4003.1733495435506,,,,,300,GRC,2021/06/17,16,7244517,203085
Greece,6/18/21,417706,12508,,,453,,4007.5194837291483,,,,,300,GRC,2021/06/18,20,7244517,0
Greece,6/19/21,418095,12528,,,389,,4011.2515945419464,,,,,300,GRC,2021/06/19,20,7345346,100829
Greece,6/20/21,418342,12542,,,247,,4013.621340996345,,,,,300,GRC,2021/06/20,14,7446861,101515
Greece,6/21/21,418548,12559,,,206,,4015.597728727544,,,,,300,GRC,2021/06/21,17,7510968,64107
Greece,6/22/21,418943,12575,,,395,,4019.387404231542,,,,,300,GRC,2021/06/22,16,7616421,105453
Greece,6/23/21,419455,12589,,,512,,4024.2995912139395,,,,,300,GRC,2021/06/23,14,7722093,105672
Greece,6/24/21,419909,12604,,,454,,4028.655319514737,,,,,300,GRC,2021/06/24,15,7722093,0
Greece,6/25/21,420295,12625,,,386,,4032.3586479819355,,,,,300,GRC,2021/06/25,21,7822697,100604
Greece,6/26/21,420670,12637,,,375,,4035.9564411819338,,,,,300,GRC,2021/06/26,12,7925253,102556
Greece,6/27/21,420905,12655,,,235,,4038.2110582539326,,,,,300,GRC,2021/06/27,18,8098959,173706
Greece,6/28/21,421266,12663,,,361,,4041.6745338411306,,,,,300,GRC,2021/06/28,8,8202338,103379
Greece,6/29/21,421829,12676,,,563,,4047.076020698728,,,,,300,GRC,2021/06/29,13,8299173,96835
Greece,6/30/21,422456,12687,,,627,,4053.091530929125,,,,,300,GRC,2021/06/30,11,8391535,92362
Greece,7/1/21,423185,12691,,,729,,4060.085640909921,,,,,300,GRC,2021/07/01,4,8475823,84288
Greece,7/2/21,424165,12701,,,980,,4069.4878738059165,,,,,300,GRC,2021/07/02,10,8559280,83457
Grenada,6/4/21,161,1,,,0,,143.0869453159022,,,,,308,GRD,2021/06/04,0,25544,0
Grenada,7/2/21,161,1,,,0,,143.0869453159022,,,,,308,GRD,2021/07/02,0,31494,0
Guatemala,6/4/21,259954,8258,,,1321,,1450.995103866933,,,,,320,GTM,2021/06/04,20,580186,18210
Guatemala,6/5/21,261392,8280,,,1438,,1459.0216430214014,,,,,320,GTM,2021/06/05,22,594780,14594
Guatemala,6/6/21,261958,8294,,,566,,1462.1809066941616,,,,,320,GTM,2021/06/06,14,595590,810
Guatemala,6/7/21,262255,8305,,,297,,1463.83868286167,,,,,320,GTM,2021/06/07,11,596858,1268
Guatemala,6/8/21,263836,8331,,,1581,,1472.663410541235,,,,,320,GTM,2021/06/08,26,607689,10831
Guatemala,6/9/21,265662,8361,,,1826,,1482.8556640155457,,,,,320,GTM,2021/06/09,30,620011,12322
Guatemala,6/10/21,267447,8388,,,1785,,1492.8190662344095,,,,,320,GTM,2021/06/10,27,632992,12981
Guatemala,6/11/21,269308,8416,,,1861,,1503.2066805365412,,,,,320,GTM,2021/06/11,28,647339,14347
Guatemala,6/12/21,271131,8439,,,1823,,1513.382188797039,,,,,320,GTM,2021/06/12,23,661648,14309
Guatemala,6/13/21,271703,8455,,,572,,1516.5749428974254,,,,,320,GTM,2021/06/13,16,664722,3074
Guatemala,6/14/21,271990,8465,,,287,,1518.1769016855565,,,,,320,GTM,2021/06/14,10,667044,2322
Guatemala,6/15/21,273730,8500,,,1740,,1527.889125697222,,,,,320,GTM,2021/06/15,35,683752,16708
Guatemala,6/16/21,275202,8527,,,1472,,1536.1054439415732,,,,,320,GTM,2021/06/16,27,712099,28347
Guatemala,6/17/21,276927,8549,,,1725,,1545.7339418841725,,,,,320,GTM,2021/06/17,22,745323,33224
Guatemala,6/18/21,278409,8595,,,1482,,1554.0060775079014,,,,,320,GTM,2021/06/18,46,775390,30067
Guatemala,6/19/21,279947,8645,,,1538,,1562.5907904561436,,,,,320,GTM,2021/06/19,50,805585,30195
Guatemala,6/20/21,280507,8694,,,560,,1565.7165637012772,,,,,320,GTM,2021/06/20,49,808754,3169
Guatemala,6/21/21,280854,8735,,,347,,1567.6534267656725,,,,,320,GTM,2021/06/21,41,813278,4524
Guatemala,6/22/21,282713,8785,,,1859,,1578.0298775919289,,,,,320,GTM,2021/06/22,50,836639,23361
Guatemala,6/23/21,284741,8845,,,2028,,1589.349642129663,,,,,320,GTM,2021/06/23,60,859739,23100
Guatemala,6/24/21,286708,8894,,,1967,,1600.3289206531952,,,,,320,GTM,2021/06/24,49,880570,20831
Guatemala,6/25/21,288987,8960,,,2279,,1613.0497014133016,,,,,320,GTM,2021/06/25,66,900370,19800
Guatemala,6/26/21,290852,9008,,,1865,,1623.4596426671844,,,,,320,GTM,2021/06/26,48,918047,17677
Guatemala,6/27/21,291595,9050,,,743,,1627.6068739549241,,,,,320,GTM,2021/06/27,42,920215,2168
Guatemala,6/28/21,291977,9089,,,382,,1629.7390978471403,,,,,320,GTM,2021/06/28,39,922560,2345
Guatemala,6/29/21,292674,9147,,,697,,1633.6295691897444,,,,,320,GTM,2021/06/29,58,925387,2827
Guatemala,6/30/21,293583,9215,,,909,,1638.7033689751488,,,,,320,GTM,2021/06/30,68,938005,12618
Guatemala,7/1/21,296438,9282,,,2855,,1654.639230787393,,,,,320,GTM,2021/07/01,67,948878,10873
Guatemala,7/2/21,298904,9350,,,2466,,1668.4037965418565,,,,,320,GTM,2021/07/02,68,957886,9008
Guinea,6/4/21,23255,162,,,10,,177.07582667874433,,,,,324,GIN,2021/06/04,0,369859,4598
Guinea,6/7/21,23307,162,,,52,,177.47178208563724,,,,,324,GIN,2021/06/07,0,369859,0
Guinea,6/8/21,23312,164,,,5,,177.5098547209154,,,,,324,GIN,2021/06/08,2,375664,5805
Guinea,6/9/21,23334,165,,,22,,177.67737431613932,,,,,324,GIN,2021/06/09,1,384974,9310
Guinea,6/10/21,23352,167,,,18,,177.81443580314073,,,,,324,GIN,2021/06/10,2,396675,11701
Guinea,6/11/21,23366,167,,,14,,177.92103918191958,,,,,324,GIN,2021/06/11,0,396675,0
Guinea,6/12/21,23389,167,,,23,,178.09617330419914,,,,,324,GIN,2021/06/12,0,396675,0
Guinea,6/13/21,23398,167,,,9,,178.16470404769984,,,,,324,GIN,2021/06/13,0,396675,0
Guinea,6/17/21,23431,167,,,33,,178.4159834405357,,,,,324,GIN,2021/06/17,0,441446,26578
Guinea,6/18/21,23450,167,,,19,,178.56065945459275,,,,,324,GIN,2021/06/18,0,441446,0
Guinea,6/19/21,23450,168,,,0,,178.56065945459275,,,,,324,GIN,2021/06/19,1,441446,0
Guinea,6/21/21,23535,168,,,85,,179.20789425432156,,,,,324,GIN,2021/06/21,0,467027,0
Guinea,6/22/21,23543,168,,,8,,179.26881047076662,,,,,324,GIN,2021/06/22,0,474743,7716
Guinea,6/23/21,23579,168,,,36,,179.5429334447694,,,,,324,GIN,2021/06/23,0,474743,0
Guinea,6/24/21,23615,168,,,36,,179.81705641877218,,,,,324,GIN,2021/06/24,0,524765,50022
Guinea,6/25/21,23653,168,,,38,,180.10640844688623,,,,,324,GIN,2021/06/25,0,524765,0
Guinea,6/26/21,23692,168,,,39,,180.40337500205592,,,,,324,GIN,2021/06/26,0,531142,6377
Guinea,6/28/21,23744,168,,,52,,180.79933040894883,,,,,324,GIN,2021/06/28,0,536262,5120
Guinea,6/29/21,23753,169,,,9,,180.86786115244954,,,,,324,GIN,2021/06/29,1,540698,4436
Guinea,6/30/21,23770,171,,,17,,180.9973081123953,,,,,324,GIN,2021/06/30,2,543078,2380
Guinea,7/1/21,23787,172,,,17,,181.12675507234104,,,,,324,GIN,2021/07/01,1,570658,27580
Guinea,7/2/21,23807,172,,,20,,181.27904561345372,,,,,324,GIN,2021/07/02,0,570658,0
Guinea-Bissau,6/4/21,3787,68,,,3,,192.429057346603,,,,,624,GNB,2021/06/04,0,,
Guinea-Bissau,6/8/21,3790,68,,,3,,192.5814965259111,,,,,624,GNB,2021/06/08,0,,
Guinea-Bissau,6/9/21,3794,68,,,4,,192.7847487649886,,,,,624,GNB,2021/06/09,0,,
Guinea-Bissau,6/10/21,3800,68,,,6,,193.0896271236048,,,,,624,GNB,2021/06/10,0,,
Guinea-Bissau,6/11/21,3802,69,,,2,,193.19125324314354,,,,,624,GNB,2021/06/11,1,,
Guinea-Bissau,6/13/21,3803,69,,,1,,193.24206630291292,,,,,624,GNB,2021/06/13,0,,
Guinea-Bissau,6/16/21,3810,69,,,7,,193.5977577212985,,,,,624,GNB,2021/06/16,0,,
Guinea-Bissau,6/17/21,3819,69,,,9,,194.05507525922283,,,,,624,GNB,2021/06/17,0,,
Guinea-Bissau,6/18/21,3824,69,,,5,,194.30914055806969,,,,,624,GNB,2021/06/18,0,,
Guinea-Bissau,6/19/21,3825,69,,,1,,194.35995361783904,,,,,624,GNB,2021/06/19,0,,
Guinea-Bissau,6/22/21,3834,69,,,9,,194.81727115576336,,,,,624,GNB,2021/06/22,0,,
Guinea-Bissau,6/23/21,3839,69,,,5,,195.07133645461022,,,,,624,GNB,2021/06/23,0,,
Guinea-Bissau,6/24/21,3844,69,,,5,,195.32540175345707,,,,,624,GNB,2021/06/24,0,,
Guinea-Bissau,6/25/21,3845,69,,,1,,195.37621481322643,,,,,624,GNB,2021/06/25,0,,
Guinea-Bissau,6/26/21,3846,69,,,1,,195.4270278729958,,,,,624,GNB,2021/06/26,0,,
Guinea-Bissau,6/29/21,3853,69,,,7,,195.7827192913814,,,,,624,GNB,2021/06/29,0,,
Guinea-Bissau,6/30/21,3859,69,,,6,,196.0875976499976,,,,,624,GNB,2021/06/30,0,,
Guinea-Bissau,7/1/21,3869,69,,,10,,196.5957282476913,,,,,624,GNB,2021/07/01,0,,
Guinea-Bissau,7/2/21,3880,69,,,11,,197.15467190515437,,,,,624,GNB,2021/07/02,0,,
Guyana,6/4/21,17459,403,,,83,,2219.6682003511496,,,,,328,GUY,2021/06/04,3,274625,0
Guyana,6/5/21,17617,405,,,158,,2239.755695376952,,,,,328,GUY,2021/06/05,2,274625,0
Guyana,6/6/21,17665,409,,,48,,2245.858225511373,,,,,328,GUY,2021/06/06,4,285247,10622
Guyana,6/7/21,17718,411,,,53,,2252.5964358681294,,,,,328,GUY,2021/06/07,2,285247,0
Guyana,6/8/21,17805,416,,,87,,2263.657271736767,,,,,328,GUY,2021/06/08,5,285247,0
Guyana,6/9/21,17939,417,,,134,,2280.6935016953594,,,,,328,GUY,2021/06/09,1,285247,0
Guyana,6/10/21,18088,419,,,149,,2299.6367723209573,,,,,328,GUY,2021/06/10,2,285247,0
Guyana,6/11/21,18196,422,,,108,,2313.3674651234046,,,,,328,GUY,2021/06/11,3,294053,8806
Guyana,6/12/21,18303,424,,,107,,2326.971021881385,,,,,328,GUY,2021/06/12,2,294053,0
Guyana,6/13/21,18386,426,,,83,,2337.523313572154,,,,,328,GUY,2021/06/13,2,300591,6538
Guyana,6/14/21,18446,430,,,60,,2345.1514762401803,,,,,328,GUY,2021/06/14,4,300591,0
Guyana,6/15/21,18530,437,,,84,,2355.830903975417,,,,,328,GUY,2021/06/15,7,300591,0
Guyana,6/16/21,18658,438,,,128,,2372.104317667206,,,,,328,GUY,2021/06/16,1,300591,0
Guyana,6/17/21,18733,441,,,75,,2381.639521002239,,,,,328,GUY,2021/06/17,3,315816,15225
Guyana,6/18/21,18837,442,,,104,,2394.8616696268177,,,,,328,GUY,2021/06/18,1,315816,0
Guyana,6/19/21,18973,444,,,136,,2412.1521716743437,,,,,328,GUY,2021/06/19,2,315816,0
Guyana,6/20/21,19096,447,,,123,,2427.789905143797,,,,,328,GUY,2021/06/20,3,319096,3280
Guyana,6/21/21,19144,449,,,48,,2433.8924352782183,,,,,328,GUY,2021/06/21,2,319096,0
Guyana,6/22/21,19234,452,,,90,,2445.334679280257,,,,,328,GUY,2021/06/22,3,319096,0
Guyana,6/24/21,19565,458,,,331,,2487.4167099988686,,,,,328,GUY,2021/06/24,6,326325,0
Guyana,6/25/21,19674,459,,,109,,2501.274538845783,,,,,328,GUY,2021/06/25,1,326325,0
Guyana,6/26/21,19774,462,,,100,,2513.988143292493,,,,,328,GUY,2021/06/26,3,326325,0
Guyana,6/27/21,19877,462,,,103,,2527.0831558726045,,,,,328,GUY,2021/06/27,0,335091,8766
Guyana,6/28/21,19891,466,,,14,,2528.863060495144,,,,,328,GUY,2021/06/28,4,335091,0
Guyana,6/29/21,19959,468,,,68,,2537.5083115189072,,,,,328,GUY,2021/06/29,2,335091,0
Guyana,6/30/21,20055,469,,,96,,2549.713371787749,,,,,328,GUY,2021/06/30,1,340020,4929
Guyana,7/1/21,20142,473,,,87,,2560.774207656387,,,,,328,GUY,2021/07/01,4,340020,0
Guyana,7/2/21,20231,477,,,89,,2572.089315613959,,,,,328,GUY,2021/07/02,4,340020,0
Haiti,6/4/21,15058,321,,,127,,132.0583768536342,,,,,332,HTI,2021/06/04,0,,
Haiti,6/5/21,15123,321,,,65,,132.62842563139262,,,,,332,HTI,2021/06/05,0,,
Haiti,6/6/21,15282,323,,,159,,134.02285264160165,,,,,332,HTI,2021/06/06,2,,
Haiti,6/7/21,15435,325,,,153,,135.364659764633,,,,,332,HTI,2021/06/07,2,,
Haiti,6/8/21,15895,333,,,460,,139.39885111492333,,,,,332,HTI,2021/06/08,8,,
Haiti,6/9/21,16001,342,,,106,,140.32846912172937,,,,,332,HTI,2021/06/09,9,,
Haiti,6/11/21,16079,346,,,78,,141.01252765503946,,,,,332,HTI,2021/06/11,4,,
Haiti,6/14/21,16561,355,,,482,,145.239658591648,,,,,332,HTI,2021/06/14,9,,
Haiti,6/15/21,16662,358,,,101,,146.12542669247262,,,,,332,HTI,2021/06/15,3,,
Haiti,6/17/21,16859,361,,,197,,147.85311298814045,,,,,332,HTI,2021/06/17,3,,
Haiti,6/21/21,17061,369,,,202,,149.62464918978966,,,,,332,HTI,2021/06/21,8,,
Haiti,6/23/21,17603,388,,,542,,154.37797899817522,,,,,332,HTI,2021/06/23,19,,
Haiti,6/25/21,17963,400,,,360,,157.5351722288372,,,,,332,HTI,2021/06/25,12,,
Haiti,6/28/21,18212,413,,,249,,159.71889754671176,,,,,332,HTI,2021/06/28,13,,
Haiti,6/29/21,18341,415,,,129,,160.8502251210323,,,,,332,HTI,2021/06/29,2,,
Haiti,6/30/21,18562,425,,,221,,162.78839096541094,,,,,332,HTI,2021/06/30,10,,
Haiti,7/1/21,18658,436,,,96,,163.63030916025414,,,,,332,HTI,2021/07/01,11,,
Haiti,7/2/21,18658,436,,,0,,163.63030916025414,,,,,332,HTI,2021/07/02,0,,
Holy See,6/4/21,27,0,,,0,,3337.453646477132,,,,,336,VAT,2021/06/04,0,,
Holy See,7/2/21,27,0,,,0,,3337.453646477132,,,,,336,VAT,2021/07/02,0,,
Honduras,6/4/21,241039,6454,,,657,,2433.604641395197,,,,,340,HND,2021/06/04,39,352252,34995
Honduras,6/5/21,241574,6460,,,535,,2439.006167634297,,,,,340,HND,2021/06/05,6,352252,0
Honduras,6/6/21,241826,6479,,,252,,2441.5504379375743,,,,,340,HND,2021/06/06,19,420531,68279
Honduras,6/7/21,242377,6493,,,551,,2447.1135051483107,,,,,340,HND,2021/06/07,14,420531,0
Honduras,6/8/21,242796,6532,,,419,,2451.343859343045,,,,,340,HND,2021/06/08,39,420531,0
Honduras,6/9/21,243467,6559,,,671,,2458.118483841057,,,,,340,HND,2021/06/09,27,420531,0
Honduras,6/10/21,244295,6567,,,828,,2466.4782291232527,,,,,340,HND,2021/06/10,8,420531,0
Honduras,6/11/21,245695,6599,,,1400,,2480.6130641414584,,,,,340,HND,2021/06/11,32,447023,26492
Honduras,6/12/21,247074,6606,,,1379,,2494.5358766343907,,,,,340,HND,2021/06/12,7,460245,13222
Honduras,6/13/21,247728,6631,,,654,,2501.1388638500384,,,,,340,HND,2021/06/13,25,460245,0
Honduras,6/14/21,248115,6653,,,387,,2505.0461361014995,,,,,340,HND,2021/06/14,22,479851,19606
Honduras,6/15/21,249118,6674,,,1003,,2515.172735760971,,,,,340,HND,2021/06/15,21,479851,0
Honduras,6/16/21,249931,6691,,,813,,2523.3810363822577,,,,,340,HND,2021/06/16,17,479851,0
Honduras,6/18/21,251149,6719,,,1218,,2535.6783428480967,,,,,340,HND,2021/06/18,28,488859,0
Honduras,6/19/21,253128,6759,,,1979,,2555.658941777403,,,,,340,HND,2021/06/19,40,497563,8704
Honduras,6/20/21,253875,6766,,,747,,2563.2008858906884,,,,,340,HND,2021/06/20,7,541792,44229
Honduras,6/21/21,254194,6772,,,319,,2566.421609012694,,,,,340,HND,2021/06/21,6,541792,0
Honduras,6/22/21,255117,6818,,,923,,2575.7405038139823,,,,,340,HND,2021/06/22,46,541792,0
Honduras,6/23/21,255663,6844,,,546,,2581.2530894710826,,,,,340,HND,2021/06/23,26,591888,50096
Honduras,6/24/21,256818,6879,,,1155,,2592.9143283611024,,,,,340,HND,2021/06/24,35,591888,0
Honduras,6/25/21,258349,6902,,,1531,,2608.371780084583,,,,,340,HND,2021/06/25,23,679496,87608
Honduras,6/26/21,259628,6916,,,1279,,2621.2849615047867,,,,,340,HND,2021/06/26,14,679496,0
Honduras,6/28/21,260331,6922,,,703,,2628.3826679460713,,,,,340,HND,2021/06/28,6,684035,0
Honduras,6/29/21,262069,6980,,,1738,,2645.9300559901008,,,,,340,HND,2021/06/29,58,684035,0
Honduras,6/30/21,262760,7005,,,691,,2652.906606702658,,,,,340,HND,2021/06/30,25,684035,0
Honduras,7/1/21,263376,7030,,,616,,2659.1259341106684,,,,,340,HND,2021/07/01,25,684035,0
Honduras,7/2/21,265174,7059,,,1798,,2677.2791007983355,,,,,340,HND,2021/07/02,29,684035,0
Hungary,6/4/21,805571,29818,,,269,,8338.942170832319,,,,,348,HUN,2021/06/04,26,9053097,93527
Hungary,6/5/21,805871,29842,,,300,,8342.047648377129,,,,,348,HUN,2021/06/05,24,9053097,0
Hungary,6/6/21,806008,29854,,,137,,8343.465816455926,,,,,348,HUN,2021/06/06,12,9249943,196846
Hungary,6/7/21,806089,29866,,,81,,8344.304295393023,,,,,348,HUN,2021/06/07,12,9249943,0
Hungary,6/8/21,806206,29883,,,117,,8345.5154316355,,,,,348,HUN,2021/06/08,17,9249943,0
Hungary,6/9/21,806385,29889,,,179,,8347.36836657057,,,,,348,HUN,2021/06/09,6,9249943,0
Hungary,6/10/21,806591,29896,,,206,,8349.500794484671,,,,,348,HUN,2021/06/10,7,9249943,0
Hungary,6/11/21,806790,29904,,,199,,8351.560761256062,,,,,348,HUN,2021/06/11,8,9424351,174408
Hungary,6/14/21,807045,29925,,,255,,8354.20041716915,,,,,348,HUN,2021/06/14,21,9424351,0
Hungary,6/15/21,807102,29935,,,57,,8354.790457902664,,,,,348,HUN,2021/06/15,10,9424351,0
Hungary,6/16/21,807209,29944,,,107,,8355.89807822698,,,,,348,HUN,2021/06/16,9,9249943,-174408
Hungary,6/17/21,807322,29948,,,113,,8357.06780810219,,,,,348,HUN,2021/06/17,4,9496972,247029
Hungary,6/18/21,807428,29950,,,106,,8358.16507683469,,,,,348,HUN,2021/06/18,2,9496972,0
Hungary,6/21/21,807630,29959,,,202,,8360.25609838153,,,,,348,HUN,2021/06/21,9,9496972,0
Hungary,6/22/21,807684,29963,,,54,,8360.815084339594,,,,,348,HUN,2021/06/22,4,9496972,0
Hungary,6/23/21,807775,29971,,,91,,8361.757079194853,,,,,348,HUN,2021/06/23,8,9496972,0
Hungary,6/24/21,807844,29972,,,69,,8362.471339030159,,,,,348,HUN,2021/06/24,1,9839749,342777
Hungary,6/25/21,807910,29980,,,66,,8363.154544090017,,,,,348,HUN,2021/06/25,8,9839749,0
Hungary,6/28/21,808042,29989,,,132,,8364.520954209733,,,,,348,HUN,2021/06/28,9,9839749,0
Hungary,6/29/21,808076,29991,,,34,,8364.87290833148,,,,,348,HUN,2021/06/29,2,9839749,0
Hungary,6/30/21,808128,29992,,,52,,8365.411191105912,,,,,348,HUN,2021/06/30,1,9839749,0
Hungary,7/1/21,808160,29992,,,32,,8365.742442044026,,,,,348,HUN,2021/07/01,0,10155466,315717
Hungary,7/2/21,808197,29992,,,37,,8366.12545094122,,,,,348,HUN,2021/07/02,0,10155466,0
Iceland,6/4/21,6555,29,,,0,,1920.8791208791208,,,,,352,ISL,2021/06/04,0,288688,0
Iceland,7/2/21,6555,29,,,0,,1920.8791208791208,,,,,352,ISL,2021/07/02,0,485770,0
India,6/4/21,28694879,344082,,,120529,,2079.332450816814,,,,,356,IND,2021/06/04,3380,227860317,3750869
India,6/5/21,28809339,346759,,,114460,,2087.6266273603183,,,,,356,IND,2021/06/05,2677,231322417,3462100
India,6/6/21,28909975,349186,,,100636,,2094.91906795644,,,,,356,IND,2021/06/06,2427,232786482,1464065
India,6/7/21,28996473,351309,,,86498,,2101.187019054291,,,,,356,IND,2021/06/07,2123,236198726,3412244
India,6/8/21,29089069,353528,,,92596,,2107.896852806015,,,,,356,IND,2021/06/08,2219,239058360,2859634
India,6/9/21,29182532,355705,,,93463,,2114.669512445064,,,,,356,IND,2021/06/09,2177,242726693,3668333
India,6/10/21,29274823,363079,,,92291,,2121.35724481774,,,,,356,IND,2021/06/10,7374,246085649,3358956
India,6/11/21,29359155,367081,,,84332,,2127.4682398925856,,,,,356,IND,2021/06/11,4002,249600304,3514655
India,6/12/21,29439989,370384,,,80834,,2133.325757511995,,,,,356,IND,2021/06/12,3303,253195048,3594744
India,6/13/21,29510410,374305,,,70421,,2138.428712311664,,,,,356,IND,2021/06/13,3921,253195048,0
India,6/14/21,29570881,377031,,,60471,,2142.810654909622,,,,,356,IND,2021/06/14,2726,259044072,5849024
India,6/15/21,29633105,379573,,,62224,,2147.319626089449,,,,,356,IND,2021/06/15,2542,261972014,2927942
India,6/16/21,29700313,381903,,,67208,,2152.1897555419723,,,,,356,IND,2021/06/16,2330,265519251,3547237
India,6/17/21,29762793,383490,,,62480,,2156.717277387492,,,,,356,IND,2021/06/17,1587,268960399,3441148
India,6/18/21,29823546,385137,,,60753,,2161.1196547031263,,,,,356,IND,2021/06/18,1647,272388783,3428384
India,6/19/21,29881772,386708,,,58226,,2165.338916658587,,,,,356,IND,2021/06/19,1571,276693572,4304789
India,6/20/21,29935221,388135,,,53449,,2169.212020293689,,,,,356,IND,2021/06/20,1427,280036898,3343326
India,6/21/21,29977861,389302,,,42640,,2172.301865548058,,,,,356,IND,2021/06/21,1167,288766201,8729303
India,6/22/21,30028709,390660,,,50848,,2175.9864915211847,,,,,356,IND,2021/06/22,1358,294639511,5873310
India,6/23/21,30082778,391981,,,54069,,2179.90452254976,,,,,356,IND,2021/06/23,1321,301626028,6986517
India,6/24/21,30134445,393310,,,51667,,2183.6484961603946,,,,,356,IND,2021/06/24,1329,307948744,6322716
India,6/25/21,30183143,394493,,,48698,,2187.1773255271214,,,,,356,IND,2021/06/25,1183,315045926,7097182
India,6/26/21,30233183,395751,,,50040,,2190.803400961657,,,,,356,IND,2021/06/26,1258,321760077,6714151
India,6/27/21,30279331,396730,,,46148,,2194.14744830684,,,,,356,IND,2021/06/27,979,323663297,1903220
India,6/28/21,30316897,397637,,,37566,,2196.869613570105,,,,,356,IND,2021/06/28,907,329029510,5366213
India,6/29/21,30362848,398454,,,45951,,2200.199385598329,,,,,356,IND,2021/06/29,817,332854527,3825017
India,6/30/21,30411634,399459,,,48786,,2203.734591756388,,,,,356,IND,2021/06/30,1005,335716019,2861492
India,7/1/21,30458251,400312,,,46617,,2207.112624500827,,,,,356,IND,2021/07/01,853,340076232,4360213
India,7/2/21,30458251,400312,,,0,,2207.112624500827,,,,,356,IND,2021/07/02,0,344611291,4535059
Indonesia,6/4/21,1843612,51296,,,6486,,674.0229576004333,,,,,360,IDN,2021/06/04,201,28486710,458960
Indonesia,6/5/21,1850206,51449,,,6594,,676.4337183149531,,,,,360,IDN,2021/06/05,153,28486710,0
Indonesia,6/6/21,1856038,51612,,,5832,,678.5658924864847,,,,,360,IDN,2021/06/06,163,28770360,283650
Indonesia,6/7/21,1863031,51803,,,6993,,681.1225272569786,,,,,360,IDN,2021/06/07,191,28972987,202627
Indonesia,6/8/21,1869325,51992,,,6294,,683.4236082301645,,,,,360,IDN,2021/06/08,189,29616507,643520
Indonesia,6/9/21,1877050,52162,,,7725,,686.2478615695132,,,,,360,IDN,2021/06/09,170,30155028,538521
Indonesia,6/10/21,1885942,52373,,,8892,,689.498769102651,,,,,360,IDN,2021/06/10,211,30155028,0
Indonesia,6/11/21,1894025,52566,,,8083,,692.4539069333248,,,,,360,IDN,2021/06/11,193,31195606,1040578
Indonesia,6/12/21,1901490,52730,,,7465,,695.1831044968508,,,,,360,IDN,2021/06/12,164,31603325,407719
Indonesia,6/13/21,1911358,52879,,,9868,,698.7908367884615,,,,,360,IDN,2021/06/13,149,31727380,124055
Indonesia,6/14/21,1919547,53116,,,8189,,701.78472812774,,,,,360,IDN,2021/06/14,237,32039910,312530
Indonesia,6/15/21,1927708,53280,,,8161,,704.7683826911607,,,,,360,IDN,2021/06/15,164,32603744,563834
Indonesia,6/16/21,1937652,53476,,,9944,,708.4039005172427,,,,,360,IDN,2021/06/16,196,32603744,0
Indonesia,6/17/21,1950276,53753,,,12624,,713.0192240325745,,,,,360,IDN,2021/06/17,277,33962386,1358642
Indonesia,6/18/21,1963266,54043,,,12990,,717.7683568323337,,,,,360,IDN,2021/06/18,290,33962386,0
Indonesia,6/19/21,1976172,54291,,,12906,,722.4867793045194,,,,,360,IDN,2021/06/19,248,34551233,588847
Indonesia,6/20/21,1989909,54662,,,13737,,727.5090146602,,,,,360,IDN,2021/06/20,371,35086248,535015
Indonesia,6/21/21,2004445,54956,,,14536,,732.8233637269667,,,,,360,IDN,2021/06/21,294,35928647,842399
Indonesia,6/22/21,2018113,55291,,,13668,,737.8203727421406,,,,,360,IDN,2021/06/22,335,36581555,652908
Indonesia,6/23/21,2033421,55594,,,15308,,743.4169643432733,,,,,360,IDN,2021/06/23,303,36998897,417342
Indonesia,6/24/21,2053995,55949,,,20574,,750.9388010039543,,,,,360,IDN,2021/06/24,355,36998897,0
Indonesia,6/25/21,2072867,56371,,,18872,,757.838387932134,,,,,360,IDN,2021/06/25,422,37699231,700334
Indonesia,6/26/21,2093962,56729,,,21095,,765.5507017435982,,,,,360,IDN,2021/06/26,358,38394659,695428
Indonesia,6/27/21,2115304,57138,,,21342,,773.353318542094,,,,,360,IDN,2021/06/27,409,40315983,1921324
Indonesia,6/28/21,2135998,57561,,,20694,,780.9190270993086,,,,,360,IDN,2021/06/28,423,40601932,285949
Indonesia,6/29/21,2156465,58024,,,20467,,788.4017446522471,,,,,360,IDN,2021/06/29,463,42040501,1438569
Indonesia,6/30/21,2178272,58491,,,21807,,796.3743650498104,,,,,360,IDN,2021/06/30,467,42744641,704140
Indonesia,7/1/21,2203108,58995,,,24836,,805.4543852357087,,,,,360,IDN,2021/07/01,504,44160960,1416319
Indonesia,7/2/21,2228938,59534,,,25830,,814.8978109645602,,,,,360,IDN,2021/07/02,539,44160960,0
Iran,6/4/21,2954309,80813,,,9209,,3517.3296026394023,,,,,364,IRN,2021/06/04,155,3141577,0
Iran,6/5/21,2960751,80941,,,6442,,3524.9992936907456,,,,,364,IRN,2021/06/05,128,3141577,0
Iran,6/6/21,2966363,81063,,,5612,,3531.680806602906,,,,,364,IRN,2021/06/06,122,3141577,0
Iran,6/7/21,2971270,81183,,,4907,,3537.522963384797,,,,,364,IRN,2021/06/07,120,3141577,0
Iran,6/8/21,2980116,81362,,,8846,,3548.0547993115565,,,,,364,IRN,2021/06/08,179,4553653,1412076
Iran,6/9/21,2990714,81519,,,10598,,3560.672524515241,,,,,364,IRN,2021/06/09,157,4553653,0
Iran,6/10/21,3003112,81672,,,12398,,3575.4332866472737,,,,,364,IRN,2021/06/10,153,4553653,0
Iran,6/11/21,3013078,81796,,,9966,,3587.298567773894,,,,,364,IRN,2021/06/11,124,4553653,0
Iran,6/12/21,3020522,81911,,,7444,,3596.1612160486843,,,,,364,IRN,2021/06/12,115,4553653,0
Iran,6/13/21,3028717,82098,,,8195,,3605.9179869530244,,,,,364,IRN,2021/06/13,187,4553653,0
Iran,6/14/21,3039432,82217,,,10715,,3618.675009557052,,,,,364,IRN,2021/06/14,119,4553653,0
Iran,6/15/21,3049648,82351,,,10216,,3630.837934701498,,,,,364,IRN,2021/06/15,134,4792881,239228
Iran,6/16/21,3060135,82480,,,10487,,3643.323505961268,,,,,364,IRN,2021/06/16,129,4792881,0
Iran,6/17/21,3070426,82619,,,10291,,3655.575724311062,,,,,364,IRN,2021/06/17,139,4792881,0
Iran,6/18/21,3080526,82746,,,10100,,3667.600542631237,,,,,364,IRN,2021/06/18,127,4792881,0
Iran,6/19/21,3086974,82854,,,6448,,3675.2773771390084,,,,,364,IRN,2021/06/19,108,4792881,0
Iran,6/20/21,3095135,82965,,,8161,,3684.993668456924,,,,,364,IRN,2021/06/20,111,4792881,0
Iran,6/21/21,3105620,83101,,,10485,,3697.476858564551,,,,,364,IRN,2021/06/21,136,4792881,0
Iran,6/22/21,3117336,83217,,,11716,,3711.425647815954,,,,,364,IRN,2021/06/22,116,4968642,175761
Iran,6/23/21,3128395,83329,,,11059,,3724.5922285885104,,,,,364,IRN,2021/06/23,112,4968642,0
Iran,6/24/21,3140129,83473,,,11734,,3738.5624482091966,,,,,364,IRN,2021/06/24,144,4968642,0
Iran,6/25/21,3150949,83588,,,10820,,3751.4444813007112,,,,,364,IRN,2021/06/25,115,4968642,0
Iran,6/26/21,3157983,83711,,,7034,,3759.8189933862664,,,,,364,IRN,2021/06/26,123,4968642,0
Iran,6/27/21,3167741,83845,,,9758,,3771.4366346900556,,,,,364,IRN,2021/06/27,134,4968642,0
Iran,6/28/21,3180092,83985,,,12351,,3786.141439746737,,,,,364,IRN,2021/06/28,140,4968642,0
Iran,6/29/21,3192809,84127,,,12717,,3801.2819956455155,,,,,364,IRN,2021/06/29,142,4968642,0
Iran,6/30/21,3204557,84264,,,11748,,3815.2688833312004,,,,,364,IRN,2021/06/30,137,5717914,749272
Iran,7/1/21,3218860,84389,,,14303,,3832.297692879068,,,,,364,IRN,2021/07/01,125,5717914,0
Iran,7/2/21,3232696,84516,,,13836,,3848.7705034016367,,,,,364,IRN,2021/07/02,127,5717914,0
Iraq,6/4/21,1218524,16488,,,4157,,3029.4584103828647,,,,,368,IRQ,2021/06/04,26,582537,0
Iraq,6/5/21,1221678,16518,,,3154,,3037.29979210891,,,,,368,IRQ,2021/06/05,30,582537,0
Iraq,6/6/21,1224992,16538,,,3314,,3045.5389611133846,,,,,368,IRQ,2021/06/06,20,582537,0
Iraq,6/7/21,1229121,16566,,,4129,,3055.804359067361,,,,,368,IRQ,2021/06/07,28,582537,0
Iraq,6/8/21,1233240,16589,,,4119,,3066.044895316435,,,,,368,IRQ,2021/06/08,23,613840,0
Iraq,6/9/21,1237856,16614,,,4616,,3077.5210582991317,,,,,368,IRQ,2021/06/09,25,613840,0
Iraq,6/10/21,1242540,16648,,,4684,,3089.1662808751607,,,,,368,IRQ,2021/06/10,34,613840,0
Iraq,6/11/21,1246860,16668,,,4320,,3099.9065373927624,,,,,368,IRQ,2021/06/11,20,613840,0
Iraq,6/12/21,1250691,16690,,,3831,,3109.431056540663,,,,,368,IRQ,2021/06/12,22,613840,0
Iraq,6/13/21,1254643,16705,,,3952,,3119.2564023178766,,,,,368,IRQ,2021/06/13,15,613840,0
Iraq,6/14/21,1259683,16736,,,5040,,3131.7867015884117,,,,,368,IRQ,2021/06/14,31,613840,0
Iraq,6/15/21,1264301,16762,,,4618,,3143.2678369120886,,,,,368,IRQ,2021/06/15,26,703820,0
Iraq,6/16/21,1269440,16781,,,5139,,3156.0442670611524,,,,,368,IRQ,2021/06/16,19,703820,0
Iraq,6/17/21,1274629,16811,,,5189,,3168.9450057347253,,,,,368,IRQ,2021/06/17,30,703820,0
Iraq,6/18/21,1279697,16834,,,5068,,3181.5449177789856,,,,,368,IRQ,2021/06/18,23,703820,0
Iraq,6/19/21,1283305,16860,,,3608,,3190.515020907575,,,,,368,IRQ,2021/06/19,26,703820,0
Iraq,6/20/21,1287465,16885,,,4160,,3200.857490146747,,,,,368,IRQ,2021/06/20,25,703820,0
Iraq,6/21/21,1292700,16910,,,5235,,3213.8725926628686,,,,,368,IRQ,2021/06/21,25,805363,0
Iraq,6/22/21,1298703,16935,,,6003,,3228.7970741154522,,,,,368,IRQ,2021/06/22,25,805363,0
Iraq,6/23/21,1305000,16968,,,6297,,3244.4524896921507,,,,,368,IRQ,2021/06/23,33,805363,0
Iraq,6/24/21,1311093,16999,,,6093,,3259.6007264888513,,,,,368,IRQ,2021/06/24,31,805363,0
Iraq,6/25/21,1316418,17033,,,5325,,3272.8395843490894,,,,,368,IRQ,2021/06/25,34,805363,0
Iraq,6/26/21,1321232,17061,,,4814,,3284.8080090888425,,,,,368,IRQ,2021/06/26,28,805363,0
Iraq,6/27/21,1325700,17091,,,4468,,3295.916218838992,,,,,368,IRQ,2021/06/27,30,805363,0
Iraq,6/28/21,1332046,17121,,,6346,,3311.6934567697094,,,,,368,IRQ,2021/06/28,30,805363,0
Iraq,6/29/21,1338604,17156,,,6558,,3327.997762844346,,,,,368,IRQ,2021/06/29,35,805363,0
Iraq,6/30/21,1345904,17186,,,7300,,3346.1468074227005,,,,,368,IRQ,2021/06/30,30,805363,0
Iraq,7/1/21,1353458,17216,,,7554,,3364.9273393055623,,,,,368,IRQ,2021/07/01,30,805363,0
Iraq,7/2/21,1359836,17256,,,6378,,3380.784134691966,,,,,368,IRQ,2021/07/02,40,805363,0
Ireland,6/4/21,263769,4941,,,517,,5341.8367222947245,,,,,372,IRL,2021/06/04,0,2387348,38141
Ireland,6/5/21,264185,4941,,,416,,5350.261533688309,,,,,372,IRL,2021/06/05,0,2387348,0
Ireland,6/6/21,264498,4941,,,313,,5356.6003941839635,,,,,372,IRL,2021/06/06,0,2387348,0
Ireland,6/7/21,264875,4941,,,377,,5364.2353795094,,,,,372,IRL,2021/06/07,0,2387348,0
Ireland,6/8/21,265114,4941,,,239,,5369.075595670619,,,,,372,IRL,2021/06/08,0,2387348,0
Ireland,6/9/21,265341,4941,,,227,,5373.672788426254,,,,,372,IRL,2021/06/09,0,2387348,0
Ireland,6/10/21,265739,4941,,,398,,5381.733064711462,,,,,372,IRL,2021/06/10,0,2387348,0
Ireland,6/11/21,266058,4941,,,319,,5388.193436909909,,,,,372,IRL,2021/06/11,0,2387348,0
Ireland,6/12/21,266489,4941,,,431,,5396.922027560474,,,,,372,IRL,2021/06/12,0,3100000,712652
Ireland,6/13/21,266804,4941,,,315,,5403.301391957059,,,,,372,IRL,2021/06/13,0,3100000,0
Ireland,6/14/21,267006,4941,,,202,,5407.39228595106,,,,,372,IRL,2021/06/14,0,3100000,0
Ireland,6/15/21,267289,4941,,,283,,5413.123587932754,,,,,372,IRL,2021/06/15,0,3100000,0
Ireland,6/16/21,267576,4941,,,287,,5418.935897716309,,,,,372,IRL,2021/06/16,0,3100000,0
Ireland,6/17/21,267949,4979,,,373,,5426.489875239884,,,,,372,IRL,2021/06/17,38,3218310,118310
Ireland,6/18/21,268251,4979,,,302,,5432.60596428042,,,,,372,IRL,2021/06/18,0,3218310,0
Ireland,6/19/21,268644,4979,,,393,,5440.564980813302,,,,,372,IRL,2021/06/19,0,3218310,0
Ireland,6/20/21,269037,4979,,,393,,5448.523997346185,,,,,372,IRL,2021/06/20,0,3218310,0
Ireland,6/21/21,269321,4979,,,284,,5454.275551278343,,,,,372,IRL,2021/06/21,0,3218310,0
Ireland,6/22/21,269495,4979,,,174,,5457.799390659315,,,,,372,IRL,2021/06/22,0,3218310,0
Ireland,6/23/21,269793,4989,,,298,,5463.834471897989,,,,,372,IRL,2021/06/23,10,3218310,0
Ireland,6/24/21,270097,4989,,,304,,5469.991064839454,,,,,372,IRL,2021/06/24,0,3679531,461221
Ireland,6/25/21,270477,4989,,,380,,5477.686806016288,,,,,372,IRL,2021/06/25,0,3679531,0
Ireland,6/26/21,270920,4989,,,443,,5486.658420072437,,,,,372,IRL,2021/06/26,0,3679531,0
Ireland,6/27/21,271260,4989,,,340,,5493.544083230656,,,,,372,IRL,2021/06/27,0,3679531,0
Ireland,6/28/21,271589,4989,,,329,,5500.206974933756,,,,,372,IRL,2021/06/28,0,3679531,0
Ireland,6/29/21,271931,4989,,,342,,5507.133141992906,,,,,372,IRL,2021/06/29,0,3679531,0
Ireland,6/30/21,271908,4998,,,,,5506.667347132202,,,,,372,IRL,2021/06/30,9,3679531,0
Ireland,7/1/21,272784,5000,,,876,,5524.408055739848,,,,,372,IRL,2021/07/01,2,4005196,325665
Ireland,7/2/21,273296,5000,,,512,,5534.777054378107,,,,,372,IRL,2021/07/02,0,4005196,0
Israel,6/4/21,839539,6417,,,7,,9699.43993102222,,,,,376,ISR,2021/06/04,1,10591833,0
Israel,6/5/21,839566,6418,,,27,,9699.751869929332,,,,,376,ISR,2021/06/05,1,10593126,1293
Israel,6/6/21,839571,6418,,,5,,9699.809636393611,,,,,376,ISR,2021/06/06,0,10598976,5850
Israel,6/7/21,839585,6418,,,14,,9699.971382493595,,,,,376,ISR,2021/06/07,0,10602001,3025
Israel,6/10/21,839630,6428,,,45,,9700.491280672115,,,,,376,ISR,2021/06/10,10,10617551,4410
Israel,6/11/21,839653,6428,,,23,,9700.757006407803,,,,,376,ISR,2021/06/11,0,10618819,1268
Israel,6/12/21,839661,6428,,,8,,9700.84943275065,,,,,376,ISR,2021/06/12,0,10619096,277
Israel,6/13/21,839666,6430,,,5,,9700.907199214931,,,,,376,ISR,2021/06/13,2,10623716,4620
Israel,6/14/21,839690,6428,,,24,,9701.184478243475,,,,,376,ISR,2021/06/14,,10628003,4287
Israel,6/15/21,839701,6428,,,11,,9701.31156446489,,,,,376,ISR,2021/06/15,0,10632264,4261
Israel,6/16/21,839720,6428,,,19,,9701.531077029154,,,,,376,ISR,2021/06/16,0,10635849,3585
Israel,6/17/21,839747,6427,,,27,,9701.843015936265,,,,,376,ISR,2021/06/17,,10639588,3739
Israel,6/18/21,839769,6427,,,22,,9702.097188379097,,,,,376,ISR,2021/06/18,0,10640732,1144
Israel,6/19/21,839830,6427,,,61,,9702.801939243313,,,,,376,ISR,2021/06/19,0,10640916,184
Israel,6/20/21,839867,6427,,,37,,9703.229411078984,,,,,376,ISR,2021/06/20,0,10645542,4626
Israel,6/21/21,839990,6427,,,123,,9704.650466100271,,,,,376,ISR,2021/06/21,0,10651894,6352
Israel,6/22/21,840079,6428,,,89,,9705.678709164453,,,,,376,ISR,2021/06/22,1,10659364,7470
Israel,6/23/21,840225,6428,,,146,,9707.365489921427,,,,,376,ISR,2021/06/23,0,10671175,11811
Israel,6/24/21,840444,6429,,,219,,9709.895661056888,,,,,376,ISR,2021/06/24,1,10684452,13277
Israel,6/25/21,840638,6429,,,194,,9712.13699987095,,,,,376,ISR,2021/06/25,0,10692079,7627
Israel,6/26/21,840823,6429,,,185,,9714.274359049306,,,,,376,ISR,2021/06/26,0,10694397,2318
Israel,6/27/21,840888,6429,,,65,,9715.025323084947,,,,,376,ISR,2021/06/27,0,10711272,16875
Israel,6/28/21,841196,6429,,,308,,9718.58373728459,,,,,376,ISR,2021/06/28,0,10729216,17944
Israel,6/29/21,841486,6429,,,290,,9721.934192212826,,,,,376,ISR,2021/06/29,0,10749096,19880
Israel,6/30/21,841777,6429,,,291,,9725.296200433919,,,,,376,ISR,2021/06/30,0,10768729,19633
Israel,7/1/21,842067,6429,,,290,,9728.646655362154,,,,,376,ISR,2021/07/01,0,10788709,19980
Israel,7/2/21,842371,6429,,,304,,9732.158856390375,,,,,376,ISR,2021/07/02,0,10799605,10896
Italy,6/4/21,4227719,126415,,,2556,,6992.377074672635,,,,,380,ITA,2021/06/04,73,37069235,676474
Italy,6/5/21,4230153,126472,,,2434,,6996.402755139987,,,,,380,ITA,2021/06/05,57,37671984,602749
Italy,6/6/21,4232428,126523,,,2275,,7000.165459767442,,,,,380,ITA,2021/06/06,51,38178684,506700
Italy,6/7/21,4233698,126588,,,1270,,7002.265958614417,,,,,380,ITA,2021/06/07,65,38761223,582539
Italy,6/8/21,4235592,126690,,,1894,,7005.39851358778,,,,,380,ITA,2021/06/08,102,39312253,551030
Italy,6/9/21,4237790,126767,,,2198,,7009.033865135537,,,,,380,ITA,2021/06/09,77,39891977,579724
Italy,6/10/21,4239868,126855,,,2078,,7012.470744351295,,,,,380,ITA,2021/06/10,88,40504155,612178
Italy,6/11/21,4241760,126924,,,1892,,7015.599991452458,,,,,380,ITA,2021/06/11,69,41310662,806507
Italy,6/12/21,4243482,126976,,,1722,,7018.448069416624,,,,,380,ITA,2021/06/12,52,41813087,502425
Italy,6/13/21,4244872,127002,,,1390,,7020.747040595597,,,,,380,ITA,2021/06/13,26,42245192,432105
Italy,6/14/21,4245779,127038,,,907,,7022.247160638279,,,,,380,ITA,2021/06/14,36,42734542,489350
Italy,6/15/21,4247032,127101,,,1253,,7024.319542571555,,,,,380,ITA,2021/06/15,63,43261692,527150
Italy,6/16/21,4248432,127153,,,1400,,7026.635053111527,,,,,380,ITA,2021/06/16,52,43596904,335212
Italy,6/17/21,4249755,127190,,,1323,,7028.823210571801,,,,,380,ITA,2021/06/17,37,44431586,834682
Italy,6/18/21,4250902,127225,,,1147,,7030.720275278478,,,,,380,ITA,2021/06/18,35,45022254,590668
Italy,6/19/21,4252095,127253,,,1193,,7032.693421045755,,,,,380,ITA,2021/06/19,28,45579305,557051
Italy,6/20/21,4252976,127270,,,881,,7034.150538749837,,,,,380,ITA,2021/06/20,17,46016709,437404
Italy,6/21/21,4253460,127291,,,484,,7034.951043822228,,,,,380,ITA,2021/06/21,21,46601425,584716
Italy,6/22/21,4254294,127322,,,834,,7036.330426529611,,,,,380,ITA,2021/06/22,31,47166788,565363
Italy,6/23/21,4255434,127352,,,1140,,7038.215913683589,,,,,380,ITA,2021/06/23,30,47722029,555241
Italy,6/24/21,4255700,127362,,,266,,7038.655860686184,,,,,380,ITA,2021/06/24,10,48316875,594846
Italy,6/25/21,4256451,127418,,,751,,7039.897966697269,,,,,380,ITA,2021/06/25,56,48933081,616206
Italy,6/26/21,4257289,127458,,,838,,7041.283965149052,,,,,380,ITA,2021/06/26,40,49474512,541431
Italy,6/27/21,4258069,127472,,,780,,7042.574035307037,,,,,380,ITA,2021/06/27,14,49890945,416433
Italy,6/28/21,4258456,127500,,,387,,7043.214108577729,,,,,380,ITA,2021/06/28,28,50452251,561306
Italy,6/29/21,4259133,127542,,,677,,7044.333823317416,,,,,380,ITA,2021/06/29,42,51007304,555053
Italy,6/30/21,4259909,127566,,,776,,7045.617277731001,,,,,380,ITA,2021/06/30,24,52792471,1785167
Italy,7/1/21,4260788,127587,,,879,,7047.071087562884,,,,,380,ITA,2021/07/01,21,53341273,548802
Italy,7/2/21,4261582,127615,,,794,,7048.384312826268,,,,,380,ITA,2021/07/02,28,53911268,569995
Jamaica,6/4/21,48821,960,,,88,,1648.7114344677645,,,,,388,JAM,2021/06/04,9,177883,0
Jamaica,6/5/21,48901,964,,,80,,1651.4130775057486,,,,,388,JAM,2021/06/05,4,177883,0
Jamaica,6/6/21,48951,970,,,50,,1653.1016044044886,,,,,388,JAM,2021/06/06,6,177883,0
Jamaica,6/7/21,48983,971,,,32,,1654.1822616196823,,,,,388,JAM,2021/06/07,1,177883,0
Jamaica,6/8/21,49031,974,,,48,,1655.8032474424726,,,,,388,JAM,2021/06/08,3,177889,6
Jamaica,6/9/21,49090,988,,,59,,1657.795709182986,,,,,388,JAM,2021/06/09,14,177889,0
Jamaica,6/10/21,49110,989,,,20,,1658.4711199424821,,,,,388,JAM,2021/06/10,1,177889,0
Jamaica,6/11/21,49179,990,,,69,,1660.8012870627433,,,,,388,JAM,2021/06/11,1,177889,0
Jamaica,6/12/21,49232,996,,,53,,1662.5911255754077,,,,,388,JAM,2021/06/12,6,177889,0
Jamaica,6/13/21,49277,997,,,45,,1664.1107997842737,,,,,388,JAM,2021/06/13,1,177889,0
Jamaica,6/14/21,49356,1011,,,79,,1666.7786722842832,,,,,388,JAM,2021/06/14,14,194315,16426
Jamaica,6/15/21,49379,1012,,,23,,1667.5553946577036,,,,,388,JAM,2021/06/15,1,194315,0
Jamaica,6/16/21,49429,1012,,,50,,1669.2439215564436,,,,,388,JAM,2021/06/16,0,194315,0
Jamaica,6/17/21,49503,1023,,,74,,1671.7429413665789,,,,,388,JAM,2021/06/17,11,194315,0
Jamaica,6/18/21,49564,1028,,,61,,1673.8029441830417,,,,,388,JAM,2021/06/18,5,194315,0
Jamaica,6/19/21,49607,1031,,,43,,1675.2550773159583,,,,,388,JAM,2021/06/19,3,194315,0
Jamaica,6/20/21,49668,1033,,,61,,1677.3150801324211,,,,,388,JAM,2021/06/20,2,194315,0
Jamaica,6/21/21,49712,1034,,,44,,1678.8009838033122,,,,,388,JAM,2021/06/21,1,194315,0
Jamaica,6/22/21,49735,1037,,,23,,1679.5777061767328,,,,,388,JAM,2021/06/22,3,194315,0
Jamaica,6/23/21,49795,1042,,,60,,1681.6039384552207,,,,,388,JAM,2021/06/23,5,194315,0
Jamaica,6/24/21,49841,1049,,,46,,1683.1573832020617,,,,,388,JAM,2021/06/24,7,194315,0
Jamaica,6/25/21,49909,1051,,,68,,1685.4537797843482,,,,,388,JAM,2021/06/25,2,194315,0
Jamaica,6/26/21,49964,1057,,,55,,1687.3111593729623,,,,,388,JAM,2021/06/26,6,194315,0
Jamaica,6/27/21,50005,1061,,,41,,1688.695751429929,,,,,388,JAM,2021/06/27,4,249983,55668
Jamaica,6/28/21,50054,1061,,,49,,1690.3505077906943,,,,,388,JAM,2021/06/28,0,249983,0
Jamaica,6/29/21,50080,1065,,,26,,1691.228541778039,,,,,388,JAM,2021/06/29,4,249983,0
Jamaica,6/30/21,50124,1075,,,44,,1692.7144454489303,,,,,388,JAM,2021/06/30,10,249983,0
Jamaica,7/1/21,50166,1080,,,42,,1694.132808043872,,,,,388,JAM,2021/07/01,5,249983,0
Jamaica,7/2/21,50242,1082,,,76,,1696.6993689299568,,,,,388,JAM,2021/07/02,2,249983,0
Japan,6/4/21,758290,13417,,,2577,,599.5503131499777,,,,,392,JPN,2021/06/04,86,15607525,0
Japan,6/5/21,760953,13481,,,2663,,601.6558433348916,,,,,392,JPN,2021/06/05,64,15607525,0
Japan,6/6/21,762980,13531,,,2027,,603.2585131376782,,,,,392,JPN,2021/06/06,50,17254680,1647155
Japan,6/7/21,764185,13606,,,1205,,604.2112596163944,,,,,392,JPN,2021/06/07,75,18348184,1093504
Japan,6/8/21,766068,13705,,,1883,,605.7000742383219,,,,,392,JPN,2021/06/08,99,19371685,1023501
Japan,6/9/21,768313,13801,,,2245,,607.4751081343534,,,,,392,JPN,2021/06/09,96,20383612,1011927
Japan,6/10/21,770357,13872,,,2044,,609.0912191737691,,,,,392,JPN,2021/06/10,71,20383612,0
Japan,6/11/21,772293,13936,,,1936,,610.6219388275406,,,,,392,JPN,2021/06/11,64,21408125,1024513
Japan,6/12/21,774240,13991,,,1947,,612.161355752072,,,,,392,JPN,2021/06/12,55,21408125,0
Japan,6/13/21,775624,14023,,,1384,,613.2556305458838,,,,,392,JPN,2021/06/13,32,23685319,2277194
Japan,6/14/21,776565,14083,,,941,,613.9996425263586,,,,,392,JPN,2021/06/14,60,25038536,1353217
Japan,6/15/21,777979,14150,,,1414,,615.117637149516,,,,,392,JPN,2021/06/15,67,26376451,1337915
Japan,6/16/21,779696,14230,,,1717,,616.4752020490644,,,,,392,JPN,2021/06/16,80,27656387,1279936
Japan,6/17/21,781241,14277,,,1545,,617.6967732603644,,,,,392,JPN,2021/06/17,47,28887137,1230750
Japan,6/18/21,782877,14325,,,1636,,618.9902946206795,,,,,392,JPN,2021/06/18,48,28887137,0
Japan,6/19/21,784384,14353,,,1507,,620.1818207148084,,,,,392,JPN,2021/06/19,28,28887137,0
Japan,6/20/21,785702,14373,,,1318,,621.2239118840599,,,,,392,JPN,2021/06/20,20,28887137,0
Japan,6/21/21,786566,14408,,,864,,621.9070429692141,,,,,392,JPN,2021/06/21,35,32922292,4035155
Japan,6/22/21,788009,14451,,,1443,,623.047966760739,,,,,392,JPN,2021/06/22,43,34389735,1467443
Japan,6/23/21,789787,14509,,,1778,,624.4537619799568,,,,,392,JPN,2021/06/23,58,35788723,1398988
Japan,6/24/21,791452,14551,,,1665,,625.7702125086394,,,,,392,JPN,2021/06/24,42,37214200,1425477
Japan,6/25/21,793179,14582,,,1727,,627.1356840179695,,,,,392,JPN,2021/06/25,31,37214200,0
Japan,6/26/21,794805,14611,,,1626,,628.4212987685029,,,,,392,JPN,2021/06/26,29,37214200,0
Japan,6/27/21,796077,14621,,,1272,,629.4270195327576,,,,,392,JPN,2021/06/27,10,40177951,2963751
Japan,6/28/21,797084,14659,,,1007,,630.2232151377926,,,,,392,JPN,2021/06/28,38,41836154,1658203
Japan,6/29/21,798485,14689,,,1401,,631.3309311682337,,,,,392,JPN,2021/06/29,30,43504931,1668777
Japan,6/30/21,800305,14730,,,1820,,632.7699341485354,,,,,392,JPN,2021/06/30,41,44910572,1405641
Japan,7/1/21,802038,14754,,,1733,,634.1401496237347,,,,,392,JPN,2021/07/01,24,46248972,1338400
Japan,7/2/21,803812,14779,,,1774,,635.5427821990397,,,,,392,JPN,2021/07/02,25,46248972,0
Jordan,6/4/21,739015,9509,,,494,,7243.01538545977,,,,,400,JOR,2021/06/04,9,1904235,0
Jordan,6/5/21,739319,9516,,,304,,7245.994860405718,,,,,400,JOR,2021/06/05,7,1904235,0
Jordan,6/6/21,739847,9530,,,528,,7251.169737943417,,,,,400,JOR,2021/06/06,14,2307978,403743
Jordan,6/7/21,740502,9541,,,655,,7257.589330343404,,,,,400,JOR,2021/06/07,11,2307978,0
Jordan,6/8/21,741101,9549,,,599,,7263.460072095453,,,,,400,JOR,2021/06/08,8,2307978,0
Jordan,6/9/21,741699,9561,,,598,,7269.3210129430745,,,,,400,JOR,2021/06/09,12,2487617,179639
Jordan,6/10/21,742178,9570,,,479,,7274.015646163828,,,,,400,JOR,2021/06/10,9,2487617,0
Jordan,6/11/21,742521,9577,,,343,,7277.377356382447,,,,,400,JOR,2021/06/11,7,2515652,28035
Jordan,6/12/21,742831,9582,,,310,,7280.415636754959,,,,,400,JOR,2021/06/12,5,2515652,0
Jordan,6/13/21,743331,9592,,,500,,7285.31608896869,,,,,400,JOR,2021/06/13,10,2601824,86172
Jordan,6/14/21,743877,9602,,,546,,7290.667382786083,,,,,400,JOR,2021/06/14,10,2681287,79463
Jordan,6/15/21,744377,9614,,,500,,7295.567834999813,,,,,400,JOR,2021/06/15,12,2751281,69994
Jordan,6/16/21,744844,9622,,,467,,7300.144857367438,,,,,400,JOR,2021/06/16,8,2751281,0
Jordan,6/17/21,745366,9635,,,522,,7305.2609294785725,,,,,400,JOR,2021/06/17,13,2891997,140716
Jordan,6/18/21,745667,9647,,,301,,7308.211001711238,,,,,400,JOR,2021/06/18,12,2891997,0
Jordan,6/19/21,745978,9656,,,311,,7311.259082988178,,,,,400,JOR,2021/06/19,9,2893320,1323
Jordan,6/20/21,746480,9662,,,502,,7316.179137010763,,,,,400,JOR,2021/06/20,6,3002498,109178
Jordan,6/21/21,747000,9671,,,520,,7321.275607313043,,,,,400,JOR,2021/06/21,9,3099657,97159
Jordan,6/22/21,747504,9683,,,504,,7326.215263144483,,,,,400,JOR,2021/06/22,12,3197278,97621
Jordan,6/23/21,748103,9693,,,599,,7332.086004896531,,,,,400,JOR,2021/06/23,10,3197278,0
Jordan,6/24/21,748685,9703,,,582,,7337.790131273314,,,,,400,JOR,2021/06/24,10,3197278,0
Jordan,6/25/21,749046,9710,,,361,,7341.328257771627,,,,,400,JOR,2021/06/25,7,3341638,144360
Jordan,6/26/21,749319,9718,,,273,,7344.003904680324,,,,,400,JOR,2021/06/26,8,3378945,37307
Jordan,6/27/21,749784,9727,,,465,,7348.561325239093,,,,,400,JOR,2021/06/27,9,3522719,143774
Jordan,6/28/21,750389,9737,,,605,,7354.490872417707,,,,,400,JOR,2021/06/28,10,3617998,95279
Jordan,6/29/21,750886,9743,,,497,,7359.361921918155,,,,,400,JOR,2021/06/29,6,3617998,0
Jordan,6/30/21,751404,9750,,,518,,7364.438790411579,,,,,400,JOR,2021/06/30,7,3828037,210039
Jordan,7/1/21,751937,9756,,,533,,7369.662672471416,,,,,400,JOR,2021/07/01,6,3907618,79581
Jordan,7/2/21,752395,9760,,,458,,7374.151486699193,,,,,400,JOR,2021/07/02,4,3916223,8605
Kazakhstan,6/4/21,448578,3468,,,1303,,2389.013153371355,,,,,398,KAZ,2021/06/04,1,3323620,46702
Kazakhstan,6/5/21,449858,3471,,,1280,,2395.8301101465768,,,,,398,KAZ,2021/06/05,3,3323620,0
Kazakhstan,6/6/21,450868,3473,,,1010,,2401.209115102025,,,,,398,KAZ,2021/06/06,2,3409522,85902
Kazakhstan,6/7/21,451641,3479,,,773,,2405.3259179045613,,,,,398,KAZ,2021/06/07,6,3435240,25718
Kazakhstan,6/8/21,452760,3482,,,1119,,2411.2854293353994,,,,,398,KAZ,2021/06/08,3,3498939,63699
Kazakhstan,6/9/21,453975,3484,,,1215,,2417.7562125243794,,,,,398,KAZ,2021/06/09,2,3566878,67939
Kazakhstan,6/10/21,455165,3484,,,1190,,2424.093852026343,,,,,398,KAZ,2021/06/10,0,3566878,0
Kazakhstan,6/11/21,456346,3487,,,1181,,2430.383559800981,,,,,398,KAZ,2021/06/11,3,3714092,147214
Kazakhstan,6/12/21,457404,3487,,,1058,,2436.0182006355003,,,,,398,KAZ,2021/06/12,0,3806686,92594
Kazakhstan,6/13/21,457474,3491,,,70,,2436.391002959145,,,,,398,KAZ,2021/06/13,4,3861948,55262
Kazakhstan,6/14/21,459212,3502,,,1738,,2445.6471520805007,,,,,398,KAZ,2021/06/14,11,3890186,28238
Kazakhstan,6/15/21,460340,3502,,,1128,,2451.6545952386646,,,,,398,KAZ,2021/06/15,0,3982697,92511
Kazakhstan,6/16/21,461485,3502,,,1145,,2457.7525761039997,,,,,398,KAZ,2021/06/16,0,3982697,0
Kazakhstan,6/17/21,462795,3507,,,1310,,2464.72930530364,,,,,398,KAZ,2021/06/17,5,4157358,174661
Kazakhstan,6/19/21,464010,3509,,,1215,,2471.20008849262,,,,,398,KAZ,2021/06/19,2,4255193,97835
Kazakhstan,6/20/21,466125,3510,,,2115,,2482.464044414178,,,,,398,KAZ,2021/06/20,1,4345853,90660
Kazakhstan,6/21/21,467069,3511,,,944,,2487.4915500359034,,,,,398,KAZ,2021/06/21,1,4428255,82402
Kazakhstan,6/22/21,468398,3512,,,1329,,2494.5694684376767,,,,,398,KAZ,2021/06/22,1,4525197,96942
Kazakhstan,6/23/21,469975,3513,,,1577,,2502.968172214649,,,,,398,KAZ,2021/06/23,1,4611224,86027
Kazakhstan,6/24/21,471498,3518,,,1523,,2511.079285627666,,,,,398,KAZ,2021/06/24,5,4611224,0
Kazakhstan,6/25/21,473228,3518,,,1730,,2520.2928287691766,,,,,398,KAZ,2021/06/25,0,4713807,102583
Kazakhstan,6/26/21,473282,3521,,,54,,2520.5804191331313,,,,,398,KAZ,2021/06/26,3,4826715,112908
Kazakhstan,6/27/21,476740,3524,,,3458,,2538.996853921191,,,,,398,KAZ,2021/06/27,3,5021117,194402
Kazakhstan,6/28/21,478063,3527,,,1323,,2546.04281783808,,,,,398,KAZ,2021/06/28,3,5070217,49100
Kazakhstan,6/29/21,480162,3527,,,2099,,2557.2215617999473,,,,,398,KAZ,2021/06/29,0,5201167,130950
Kazakhstan,6/30/21,482686,3530,,,2524,,2570.663748441087,,,,,398,KAZ,2021/06/30,3,5335768,134601
Kazakhstan,7/1/21,485352,3533,,,2666,,2584.8621912244785,,,,,398,KAZ,2021/07/01,3,5453306,117538
Kazakhstan,7/2/21,488204,3539,,,2852,,2600.0512230392687,,,,,398,KAZ,2021/07/02,6,5453306,0
Kenya,6/4/21,171942,3240,,,284,,319.7653766972344,,,,,404,KEN,2021/06/04,17,976541,2554
Kenya,6/5/21,172325,3264,,,383,,320.4776525767463,,,,,404,KEN,2021/06/05,24,976541,0
Kenya,6/6/21,172491,3287,,,166,,320.78636744880635,,,,,404,KEN,2021/06/06,23,983580,7039
Kenya,6/7/21,172639,3308,,,148,,321.06160721425744,,,,,404,KEN,2021/06/07,21,983580,0
Kenya,6/8/21,173072,3326,,,433,,321.86686950101637,,,,,404,KEN,2021/06/08,18,1005509,21929
Kenya,6/9/21,173661,3345,,,589,,322.9622493783859,,,,,404,KEN,2021/06/09,19,1030445,24936
Kenya,6/10/21,174285,3362,,,624,,324.1227197408283,,,,,404,KEN,2021/06/10,17,1030445,0
Kenya,6/11/21,174773,3378,,,488,,325.03026707555887,,,,,404,KEN,2021/06/11,16,1059117,28672
Kenya,6/12/21,175176,3396,,,403,,325.77973751796964,,,,,404,KEN,2021/06/12,18,1059117,0
Kenya,6/13/21,175337,3410,,,161,,326.0791537493049,,,,,404,KEN,2021/06/13,14,1113158,54041
Kenya,6/14/21,175681,3421,,,344,,326.7189002311642,,,,,404,KEN,2021/06/14,11,1116021,2863
Kenya,6/15/21,176137,3428,,,456,,327.56693626525674,,,,,404,KEN,2021/06/15,7,1116021,0
Kenya,6/16/21,176622,3428,,,485,,328.4689044155525,,,,,404,KEN,2021/06/16,0,1116021,0
Kenya,6/17/21,177282,3434,,,660,,329.6963249912128,,,,,404,KEN,2021/06/17,6,1155745,39724
Kenya,6/18/21,178078,3437,,,796,,331.17666859458484,,,,,404,KEN,2021/06/18,3,1155745,0
Kenya,6/19/21,178792,3447,,,714,,332.50451449007187,,,,,404,KEN,2021/06/19,10,1155745,0
Kenya,6/20/21,179075,3456,,,283,,333.0308175550898,,,,,404,KEN,2021/06/20,9,1183376,27631
Kenya,6/21/21,179293,3461,,,218,,333.4362382906867,,,,,404,KEN,2021/06/21,5,1187663,4287
Kenya,6/22/21,179876,3484,,,583,,334.52045979918654,,,,,404,KEN,2021/06/22,23,1190889,3226
Kenya,6/23/21,180498,3514,,,622,,335.6772107053391,,,,,404,KEN,2021/06/23,30,1190889,0
Kenya,6/24/21,181239,3538,,,741,,337.05526926073946,,,,,404,KEN,2021/06/24,24,1201325,10436
Kenya,6/25/21,181885,3556,,,646,,338.25665364237057,,,,,404,KEN,2021/06/25,18,1220151,18826
Kenya,6/26/21,182393,3574,,,508,,339.20139553999996,,,,,404,KEN,2021/06/26,18,1220151,0
Kenya,6/27/21,182597,3595,,,204,,339.5807800815677,,,,,404,KEN,2021/06/27,21,1220151,0
Kenya,6/28/21,182884,3612,,,287,,340.1145220591654,,,,,404,KEN,2021/06/28,17,1293004,72853
Kenya,6/29/21,183603,3621,,,719,,341.4516665953771,,,,,404,KEN,2021/06/29,9,1334749,41745
Kenya,6/30/21,184161,3634,,,558,,342.4893949002535,,,,,404,KEN,2021/06/30,13,1378585,43836
Kenya,7/1/21,184537,3640,,,376,,343.18865268275084,,,,,404,KEN,2021/07/01,6,1417100,38515
Kenya,7/2/21,185060,3651,,,523,,344.1612905025543,,,,,404,KEN,2021/07/02,11,1417100,0
Kiribati,6/4/21,2,0,,,0,,1.7005935071339897,,,,,296,KIR,2021/06/04,0,,
Kiribati,7/2/21,2,0,,,0,,1.7005935071339897,,,,,296,KIR,2021/07/02,0,,
"Korea, South",6/4/21,143596,1971,,,744,,280.08248151721085,,,,,410,KOR,2021/06/04,2,0,0
"Korea, South",6/5/21,144152,1973,,,556,,281.1669536454287,,,,,410,KOR,2021/06/05,2,0,0
"Korea, South",6/6/21,144637,1974,,,485,,282.11294102346045,,,,,410,KOR,2021/06/06,1,0,0
"Korea, South",6/7/21,145091,1975,,,454,,282.9984632288757,,,,,410,KOR,2021/06/07,1,0,0
"Korea, South",6/8/21,145692,1977,,,601,,284.1707073818594,,,,,410,KOR,2021/06/08,2,0,0
"Korea, South",6/9/21,146303,1979,,,611,,285.36245642923546,,,,,410,KOR,2021/06/09,2,0,0
"Korea, South",6/10/21,146859,1981,,,556,,286.4469285574533,,,,,410,KOR,2021/06/10,2,0,0
"Korea, South",6/11/21,147422,1982,,,563,,287.54505411174586,,,,,410,KOR,2021/06/11,1,0,0
"Korea, South",6/12/21,147874,1985,,,452,,288.4266753382826,,,,,410,KOR,2021/06/12,3,0,0
"Korea, South",6/13/21,148273,1988,,,399,,289.2049206245397,,,,,410,KOR,2021/06/13,3,0,0
"Korea, South",6/14/21,148647,1992,,,374,,289.9344036748157,,,,,410,KOR,2021/06/14,4,0,0
"Korea, South",6/15/21,149191,1993,,,544,,290.9954699297627,,,,,410,KOR,2021/06/15,1,0,0
"Korea, South",6/16/21,149731,1994,,,540,,292.04873422695266,,,,,410,KOR,2021/06/16,1,0,0
"Korea, South",6/17/21,150238,1996,,,507,,293.0376323726477,,,,,410,KOR,2021/06/17,2,0,0
"Korea, South",6/18/21,150720,1997,,,482,,293.97776828236175,,,,,410,KOR,2021/06/18,1,0,0
"Korea, South",6/19/21,151149,2002,,,429,,294.814528251796,,,,,410,KOR,2021/06/19,5,0,0
"Korea, South",6/20/21,151506,2004,,,357,,295.51085298160496,,,,,410,KOR,2021/06/20,2,0,0
"Korea, South",6/21/21,151901,2006,,,395,,296.28129631010506,,,,,410,KOR,2021/06/21,2,0,0
"Korea, South",6/22/21,152545,2007,,,644,,297.53741150897605,,,,,410,KOR,2021/06/22,1,0,0
"Korea, South",6/23/21,153155,2008,,,610,,298.7272100669129,,,,,410,KOR,2021/06/23,1,0,0
"Korea, South",6/24/21,153789,2009,,,634,,299.96382037139153,,,,,410,KOR,2021/06/24,1,0,0
"Korea, South",6/25/21,154457,2012,,,668,,301.2667473168043,,,,,410,KOR,2021/06/25,3,0,0
"Korea, South",6/26/21,155071,2013,,,614,,302.4643478324981,,,,,410,KOR,2021/06/26,1,0,0
"Korea, South",6/27/21,155572,2015,,,501,,303.44154304155774,,,,,410,KOR,2021/06/27,2,0,0
"Korea, South",6/28/21,156167,2017,,,595,,304.602084257906,,,,,410,KOR,2021/06/28,2,20062515,0
"Korea, South",6/29/21,156961,2018,,,794,,306.1507728726631,,,,,410,KOR,2021/06/29,1,20226716,0
"Korea, South",6/30/21,157723,2021,,,762,,307.6370458253645,,,,,410,KOR,2021/06/30,3,20377601,0
"Korea, South",7/1/21,158549,2024,,,826,,309.24815010217736,,,,,410,KOR,2021/07/01,3,20497376,0
"Korea, South",7/2/21,159342,2025,,,793,,310.7948882274953,,,,,410,KOR,2021/07/02,1,20617060,0
Kosovo,6/4/21,107058,2249,,,7,,5913.610838913236,,,,,383,XKS,2021/06/04,1,69686,0
Kosovo,6/7/21,107099,2250,,,41,,5915.875574331379,,,,,383,XKS,2021/06/07,1,80126,0
Kosovo,6/9/21,107125,2252,,,26,,5917.311748011176,,,,,383,XKS,2021/06/09,2,80126,0
Kosovo,6/13/21,107170,2255,,,45,,5919.797433226209,,,,,383,XKS,2021/06/13,3,98277,0
Kosovo,6/14/21,107175,2255,,,5,,5920.073620472324,,,,,383,XKS,2021/06/14,0,98277,0
Kosovo,6/16/21,107192,2255,,,17,,5921.012657109115,,,,,383,XKS,2021/06/16,0,98277,0
Kosovo,6/21/21,107247,2256,,,55,,5924.050716816379,,,,,383,XKS,2021/06/21,1,133868,0
Kosovo,6/24/21,107299,2260,,,52,,5926.923064175973,,,,,383,XKS,2021/06/24,4,133868,0
Kosovo,6/28/21,107331,2262,,,32,,5928.690662551108,,,,,383,XKS,2021/06/28,2,133868,0
Kosovo,6/29/21,107335,2262,,,4,,5928.911612348001,,,,,383,XKS,2021/06/29,0,133868,0
Kosovo,6/30/21,107758,2262,,,423,,5952.277053369318,,,,,383,XKS,2021/06/30,0,179029,0
Kosovo,7/1/21,107768,2262,,,10,,5952.8294278615485,,,,,383,XKS,2021/07/01,0,179029,0
Kosovo,7/2/21,107785,2262,,,17,,5953.768464498339,,,,,383,XKS,2021/07/02,0,179029,0
Kuwait,6/4/21,314569,1787,,,1280,,7365.984297620712,,,,,414,KWT,2021/06/04,4,1820000,0
Kuwait,6/5/21,315900,1794,,,1331,,7397.151148455134,,,,,414,KWT,2021/06/05,7,1820000,0
Kuwait,6/6/21,317197,1795,,,1297,,7427.521851334355,,,,,414,KWT,2021/06/06,1,1820000,0
Kuwait,6/7/21,318676,1798,,,1479,,7462.154287385528,,,,,414,KWT,2021/06/07,3,1820000,0
Kuwait,6/8/21,320257,1801,,,1581,,7499.175167302297,,,,,414,KWT,2021/06/08,3,1820000,0
Kuwait,6/9/21,321648,1806,,,1391,,7531.746985116482,,,,,414,KWT,2021/06/09,5,1820000,0
Kuwait,6/10/21,323357,1810,,,1709,,7571.765127923414,,,,,414,KWT,2021/06/10,4,1820000,0
Kuwait,6/11/21,325014,1813,,,1657,,7610.565632681218,,,,,414,KWT,2021/06/11,3,1820000,0
Kuwait,6/12/21,326451,1817,,,1437,,7644.214591846555,,,,,414,KWT,2021/06/12,4,1820000,0
Kuwait,6/13/21,327963,1820,,,1512,,7679.619759736597,,,,,414,KWT,2021/06/13,3,1820000,0
Kuwait,6/14/21,329526,1828,,,1563,,7716.219149559437,,,,,414,KWT,2021/06/14,8,1820000,0
Kuwait,6/15/21,331013,1831,,,1487,,7751.038914541245,,,,,414,KWT,2021/06/15,3,1820000,0
Kuwait,6/16/21,332570,1837,,,1557,,7787.497807666109,,,,,414,KWT,2021/06/16,6,1820000,0
Kuwait,6/17/21,334216,1842,,,1646,,7826.040735144289,,,,,414,KWT,2021/06/17,5,1820000,0
Kuwait,6/18/21,335874,1851,,,1658,,7864.864656018422,,,,,414,KWT,2021/06/18,9,1820000,0
Kuwait,6/19/21,337371,1862,,,1497,,7899.918582163523,,,,,414,KWT,2021/06/19,11,1820000,0
Kuwait,6/20/21,339032,1870,,,1661,,7938.812751386644,,,,,414,KWT,2021/06/20,8,1820000,0
Kuwait,6/21/21,340967,1877,,,1935,,7984.122936484018,,,,,414,KWT,2021/06/21,7,3100000,1280000
Kuwait,6/22/21,342929,1888,,,1962,,8030.065356722287,,,,,414,KWT,2021/06/22,11,3100000,0
Kuwait,6/23/21,344799,1894,,,1870,,8073.853494258251,,,,,414,KWT,2021/06/23,6,3100000,0
Kuwait,6/24/21,346560,1903,,,1761,,8115.089275114312,,,,,414,KWT,2021/06/24,9,3100000,0
Kuwait,6/25/21,348262,1913,,,1702,,8154.943505106938,,,,,414,KWT,2021/06/25,10,3100000,0
Kuwait,6/26/21,349923,1919,,,1661,,8193.83767433006,,,,,414,KWT,2021/06/26,6,3100000,0
Kuwait,6/27/21,351481,1933,,,1558,,8230.319983571253,,,,,414,KWT,2021/06/27,14,3100000,0
Kuwait,6/28/21,353133,1943,,,1652,,8269.00340774741,,,,,414,KWT,2021/06/28,10,3100000,0
Kuwait,6/29/21,354851,1961,,,1718,,8309.232295601307,,,,,414,KWT,2021/06/29,18,3100000,0
Kuwait,6/30/21,356687,1969,,,1836,,8352.22428518207,,,,,414,KWT,2021/06/30,8,3100000,0
Kuwait,7/1/21,358511,1979,,,1824,,8394.935281366883,,,,,414,KWT,2021/07/01,10,3100000,0
Kuwait,7/2/21,360406,1995,,,1895,,8439.308821811082,,,,,414,KWT,2021/07/02,16,3100000,0
Kyrgyzstan,6/4/21,106223,1837,,,383,,1628.1405617953244,,,,,417,KGZ,2021/06/04,7,54101,0
Kyrgyzstan,6/5/21,106636,1842,,,413,,1634.4708485695774,,,,,417,KGZ,2021/06/05,5,54101,0
Kyrgyzstan,6/6/21,106973,1847,,,337,,1639.6362399568009,,,,,417,KGZ,2021/06/06,5,54101,0
Kyrgyzstan,6/7/21,107335,1852,,,362,,1645.1848206160732,,,,,417,KGZ,2021/06/07,5,54101,0
Kyrgyzstan,6/8/21,107714,1859,,,379,,1650.9939699803392,,,,,417,KGZ,2021/06/08,7,54101,0
Kyrgyzstan,6/9/21,108173,1864,,,459,,1658.0293250151628,,,,,417,KGZ,2021/06/09,5,135578,0
Kyrgyzstan,6/10/21,108667,1869,,,494,,1665.6011450308552,,,,,417,KGZ,2021/06/10,5,135578,0
Kyrgyzstan,6/11/21,109193,1876,,,526,,1673.6634473147706,,,,,417,KGZ,2021/06/11,7,135578,0
Kyrgyzstan,6/12/21,109812,1881,,,619,,1683.151213690709,,,,,417,KGZ,2021/06/12,5,135578,0
Kyrgyzstan,6/13/21,110370,1890,,,558,,1691.7039982428473,,,,,417,KGZ,2021/06/13,9,135578,0
Kyrgyzstan,6/14/21,110829,1899,,,459,,1698.7393532776707,,,,,417,KGZ,2021/06/14,9,135578,0
Kyrgyzstan,6/15/21,111343,1905,,,514,,1706.6177247110024,,,,,417,KGZ,2021/06/15,6,135578,0
Kyrgyzstan,6/16/21,111990,1912,,,647,,1716.534663071636,,,,,417,KGZ,2021/06/16,7,135578,0
Kyrgyzstan,6/17/21,112777,1916,,,787,,1728.597461355745,,,,,417,KGZ,2021/06/17,4,135578,0
Kyrgyzstan,6/18/21,113430,1920,,,653,,1738.6063651416705,,,,,417,KGZ,2021/06/18,4,135578,0
Kyrgyzstan,6/19/21,114300,1925,,,870,,1751.941351808983,,,,,417,KGZ,2021/06/19,5,135578,0
Kyrgyzstan,6/20/21,115030,1931,,,730,,1763.1304785528198,,,,,417,KGZ,2021/06/20,6,135578,0
Kyrgyzstan,6/21/21,115615,1937,,,585,,1772.0971075187713,,,,,417,KGZ,2021/06/21,6,135578,0
Kyrgyzstan,6/22/21,116546,1945,,,931,,1786.367076009884,,,,,417,KGZ,2021/06/22,8,135578,0
Kyrgyzstan,6/23/21,117284,1953,,,738,,1797.6788233207765,,,,,417,KGZ,2021/06/23,8,173700,0
Kyrgyzstan,6/24/21,118106,1958,,,822,,1810.2780865857544,,,,,417,KGZ,2021/06/24,5,173700,0
Kyrgyzstan,6/25/21,118981,1964,,,875,,1823.6897111074768,,,,,417,KGZ,2021/06/25,6,173700,0
Kyrgyzstan,6/26/21,119873,1971,,,892,,1837.3619043341926,,,,,417,KGZ,2021/06/26,7,173700,0
Kyrgyzstan,6/27/21,120865,1977,,,992,,1852.5668546491052,,,,,417,KGZ,2021/06/27,6,173700,0
Kyrgyzstan,6/28/21,121946,1982,,,1081,,1869.135958772513,,,,,417,KGZ,2021/06/28,5,173700,0
Kyrgyzstan,6/29/21,123038,1992,,,1092,,1885.8736661756225,,,,,417,KGZ,2021/06/29,10,173700,0
Kyrgyzstan,6/30/21,125003,2000,,,1965,,1915.9923429586902,,,,,417,KGZ,2021/06/30,8,173700,0
Kyrgyzstan,7/1/21,126395,2009,,,1392,,1937.32832162639,,,,,417,KGZ,2021/07/01,9,173700,0
Kyrgyzstan,7/2/21,127880,2019,,,1485,,1960.089764386113,,,,,417,KGZ,2021/07/02,10,173700,0
Laos,6/4/21,1952,3,,,9,,26.82956464083295,,,,,418,LAO,2021/06/04,0,914014,0
Laos,6/5/21,1957,3,,,5,,26.89828791091705,,,,,418,LAO,2021/06/05,0,957785,43771
Laos,6/6/21,1963,3,,,6,,26.98075583501797,,,,,418,LAO,2021/06/06,0,982253,24468
Laos,6/7/21,1968,3,,,5,,27.04947910510207,,,,,418,LAO,2021/06/07,0,982253,0
Laos,6/8/21,1970,3,,,2,,27.07696841313571,,,,,418,LAO,2021/06/08,0,982253,0
Laos,6/9/21,1971,3,,,1,,27.09071306715253,,,,,418,LAO,2021/06/09,0,1034588,52335
Laos,6/10/21,1975,3,,,4,,27.145691683219813,,,,,418,LAO,2021/06/10,0,1034588,0
Laos,6/11/21,1979,3,,,4,,27.200670299287093,,,,,418,LAO,2021/06/11,0,1079903,45315
Laos,6/12/21,1990,3,,,11,,27.351861493472114,,,,,418,LAO,2021/06/12,0,1079903,0
Laos,6/13/21,1996,3,,,6,,27.434329417573036,,,,,418,LAO,2021/06/13,0,1108388,28485
Laos,6/14/21,2010,3,,,14,,27.626754573808515,,,,,418,LAO,2021/06/14,0,1108388,0
Laos,6/15/21,2025,3,,,15,,27.83292438406082,,,,,418,LAO,2021/06/15,0,1122128,13740
Laos,6/16/21,2033,3,,,8,,27.942881616195383,,,,,418,LAO,2021/06/16,0,1122128,0
Laos,6/17/21,2034,3,,,1,,27.9566262702122,,,,,418,LAO,2021/06/17,0,1134347,12219
Laos,6/18/21,2047,3,,,13,,28.135306772430862,,,,,418,LAO,2021/06/18,0,1134347,0
Laos,6/19/21,2050,3,,,3,,28.176540734481325,,,,,418,LAO,2021/06/19,0,1183137,48790
Laos,6/20/21,2053,3,,,3,,28.217774696531784,,,,,418,LAO,2021/06/20,0,1183137,0
Laos,6/21/21,2054,3,,,1,,28.231519350548606,,,,,418,LAO,2021/06/21,0,1208878,25741
Laos,6/22/21,2067,3,,,13,,28.410199852767267,,,,,418,LAO,2021/06/22,0,1208878,0
Laos,6/23/21,2076,3,,,9,,28.533901738918647,,,,,418,LAO,2021/06/23,0,1268627,59749
Laos,6/24/21,2080,3,,,4,,28.58888035498593,,,,,418,LAO,2021/06/24,0,1268627,0
Laos,6/25/21,2094,3,,,14,,28.78130551122141,,,,,418,LAO,2021/06/25,0,1268627,0
Laos,6/26/21,2100,3,,,6,,28.863773435322333,,,,,418,LAO,2021/06/26,0,1268627,0
Laos,6/27/21,2110,3,,,10,,29.00121997549053,,,,,418,LAO,2021/06/27,0,1408531,139904
Laos,6/30/21,2121,3,,,11,,29.152411169675556,,,,,418,LAO,2021/06/30,0,1416267,0
Laos,7/1/21,2144,3,,,23,,29.46853821206242,,,,,418,LAO,2021/07/01,0,1416267,0
Laos,7/2/21,2176,3,,,32,,29.908367140600664,,,,,418,LAO,2021/07/02,0,1416267,0
Latvia,6/4/21,134421,2402,,,259,,7126.543180422882,,,,,428,LVA,2021/06/04,10,833058,20703
Latvia,6/5/21,134677,2407,,,256,,7140.115427721951,,,,,428,LVA,2021/06/05,5,833058,0
Latvia,6/6/21,134812,2413,,,135,,7147.2726675085705,,,,,428,LVA,2021/06/06,6,850848,17790
Latvia,6/7/21,134888,2413,,,76,,7151.3019284254815,,,,,428,LVA,2021/06/07,0,865936,15088
Latvia,6/8/21,135144,2423,,,256,,7164.874175724552,,,,,428,LVA,2021/06/08,10,1767740,901804
Latvia,6/9/21,135388,2428,,,244,,7177.810223931477,,,,,428,LVA,2021/06/09,5,902407,-865333
Latvia,6/10/21,135584,2443,,,196,,7188.201475769827,,,,,428,LVA,2021/06/10,15,902407,0
Latvia,6/11/21,135762,2449,,,178,,7197.638428969962,,,,,428,LVA,2021/06/11,6,935992,33585
Latvia,6/12/21,135940,2451,,,178,,7207.075382170096,,,,,428,LVA,2021/06/12,2,943402,7410
Latvia,6/13/21,136030,2456,,,90,,7211.846875361175,,,,,428,LVA,2021/06/13,5,947038,3636
Latvia,6/14/21,136104,2456,,,74,,7215.7701030960625,,,,,428,LVA,2021/06/14,0,958820,11782
Latvia,6/15/21,136247,2464,,,143,,7223.351475610778,,,,,428,LVA,2021/06/15,8,974401,15581
Latvia,6/16/21,136403,2475,,,156,,7231.622063808648,,,,,428,LVA,2021/06/16,11,974401,0
Latvia,6/17/21,136544,2482,,,141,,7239.097403141339,,,,,428,LVA,2021/06/17,7,1041827,67426
Latvia,6/18/21,136652,2485,,,108,,7244.823194970634,,,,,428,LVA,2021/06/18,3,1041827,0
Latvia,6/19/21,136736,2493,,,84,,7249.276588615641,,,,,428,LVA,2021/06/19,8,1055416,13589
Latvia,6/20/21,136810,2496,,,74,,7253.199816350529,,,,,428,LVA,2021/06/20,3,1066582,11166
Latvia,6/21/21,136850,2496,,,40,,7255.320479991008,,,,,428,LVA,2021/06/21,0,1081386,14804
Latvia,6/22/21,136975,2497,,,125,,7261.947553867507,,,,,428,LVA,2021/06/22,1,1091544,10158
Latvia,6/23/21,137077,2497,,,102,,7267.355246150731,,,,,428,LVA,2021/06/23,0,1092435,891
Latvia,6/24/21,137110,2500,,,33,,7269.104793654126,,,,,428,LVA,2021/06/24,3,1092435,0
Latvia,6/25/21,137130,2501,,,20,,7270.165125474366,,,,,428,LVA,2021/06/25,1,1092948,513
Latvia,6/26/21,137169,2503,,,39,,7272.232772523834,,,,,428,LVA,2021/06/26,2,1095895,2947
Latvia,6/27/21,137210,2503,,,41,,7274.4064527553255,,,,,428,LVA,2021/06/27,0,1101405,5510
Latvia,6/28/21,137240,2503,,,30,,7275.996950485685,,,,,428,LVA,2021/06/28,0,1115215,13810
Latvia,6/29/21,137329,2508,,,89,,7280.715427085752,,,,,428,LVA,2021/06/29,5,1128796,13581
Latvia,6/30/21,137429,2513,,,100,,7286.017086186951,,,,,428,LVA,2021/06/30,5,1144460,15664
Latvia,7/1/21,137500,2520,,,71,,7289.781264148803,,,,,428,LVA,2021/07/01,7,1155261,10801
Latvia,7/2/21,137540,2526,,,40,,7291.901927789282,,,,,428,LVA,2021/07/02,6,1167610,12349
Lebanon,6/4/21,541232,7752,,,223,,7929.625656477632,,,,,422,LBN,2021/06/04,5,849471,8555
Lebanon,6/5/21,541423,7758,,,191,,7932.424010049459,,,,,422,LBN,2021/06/05,6,849471,0
Lebanon,6/6/21,541557,7763,,,134,,7934.387252869485,,,,,422,LBN,2021/06/06,5,863134,13663
Lebanon,6/7/21,541628,7769,,,71,,7935.4274785427815,,,,,422,LBN,2021/06/07,6,886996,23862
Lebanon,6/8/21,541801,7774,,,173,,7937.962112929829,,,,,422,LBN,2021/06/08,5,907418,20422
Lebanon,6/9/21,541940,7780,,,139,,7939.9986110789605,,,,,422,LBN,2021/06/09,6,928148,20730
Lebanon,6/11/21,542375,7790,,,435,,7946.371824711132,,,,,422,LBN,2021/06/11,10,963223,35075
Lebanon,6/14/21,542649,7801,,,274,,7950.386216746109,,,,,422,LBN,2021/06/14,11,1031639,20772
Lebanon,6/15/21,542819,7804,,,170,,7952.876897935694,,,,,422,LBN,2021/06/15,3,1058472,26833
Lebanon,6/16/21,542934,7808,,,115,,7954.561770505119,,,,,422,LBN,2021/06/16,4,1058472,0
Lebanon,6/17/21,543099,7811,,,165,,7956.979196365598,,,,,422,LBN,2021/06/17,3,1111588,53116
Lebanon,6/18/21,543267,7815,,,168,,7959.44057542354,,,,,422,LBN,2021/06/18,4,1111588,0
Lebanon,6/19/21,543371,7819,,,104,,7960.964286268933,,,,,422,LBN,2021/06/19,4,1126981,15393
Lebanon,6/20/21,543505,7822,,,134,,7962.927529088958,,,,,422,LBN,2021/06/20,3,1128719,1738
Lebanon,6/21/21,543551,7825,,,46,,7963.601478116729,,,,,422,LBN,2021/06/21,3,1142266,13547
Lebanon,6/22/21,543698,7829,,,147,,7965.755184792428,,,,,422,LBN,2021/06/22,4,1142266,0
Lebanon,6/23/21,543865,7832,,,167,,7968.20191278455,,,,,422,LBN,2021/06/23,3,1175505,33239
Lebanon,6/24/21,544002,7835,,,137,,7970.209108802038,,,,,422,LBN,2021/06/24,3,1175505,0
Lebanon,6/25/21,544165,7839,,,163,,7972.597232530875,,,,,422,LBN,2021/06/25,4,1195748,20243
Lebanon,6/26/21,544291,7841,,,126,,7974.443266824332,,,,,422,LBN,2021/06/26,2,1243726,47978
Lebanon,6/27/21,544454,7843,,,163,,7976.831390553169,,,,,422,LBN,2021/06/27,2,1253918,10192
Lebanon,6/28/21,544520,7845,,,66,,7977.79836089736,,,,,422,LBN,2021/06/28,2,1279094,25176
Lebanon,6/29/21,544705,7848,,,185,,7980.508808074261,,,,,422,LBN,2021/06/29,3,1312854,33760
Lebanon,6/30/21,544866,7851,,,161,,7982.867629671456,,,,,422,LBN,2021/06/30,3,1328792,15938
Lebanon,7/1/21,545016,7854,,,150,,7985.065289544618,,,,,422,LBN,2021/07/01,3,1359215,30423
Lebanon,7/2/21,545226,7856,,,210,,7988.142013367046,,,,,422,LBN,2021/07/02,2,1359215,0
Lesotho,6/4/21,10837,326,,,1,,505.86952422030646,,,,,426,LSO,2021/06/04,0,,
Lesotho,6/8/21,10839,326,,,2,,505.9628839184186,,,,,426,LSO,2021/06/08,0,,
Lesotho,6/10/21,10846,326,,,7,,506.2896428618108,,,,,426,LSO,2021/06/10,0,,
Lesotho,6/11/21,10853,326,,,7,,506.6164018052031,,,,,426,LSO,2021/06/11,0,,
Lesotho,6/12/21,10859,326,,,6,,506.89648089953937,,,,,426,LSO,2021/06/12,0,,
Lesotho,6/13/21,10921,326,,,62,,509.79063154101385,,,,,426,LSO,2021/06/13,0,,
Lesotho,6/14/21,10923,326,,,2,,509.8839912391259,,,,,426,LSO,2021/06/14,0,,
Lesotho,6/16/21,10950,326,,,27,,511.144347163639,,,,,426,LSO,2021/06/16,0,,
Lesotho,6/18/21,11010,327,,,60,,513.9451381070014,,,,,426,LSO,2021/06/18,1,,
Lesotho,6/19/21,11081,329,,,71,,517.2594073899803,,,,,426,LSO,2021/06/19,2,,
Lesotho,6/21/21,11107,329,,,26,,518.4730834654373,,,,,426,LSO,2021/06/21,0,,
Lesotho,6/22/21,11128,329,,,21,,519.4533602956142,,,,,426,LSO,2021/06/22,0,,
Lesotho,6/23/21,11168,329,,,40,,521.3205542578557,,,,,426,LSO,2021/06/23,0,,
Lesotho,6/26/21,11239,329,,,71,,524.6348235408346,,,,,426,LSO,2021/06/26,0,,
Lesotho,6/29/21,11344,329,,,105,,529.5362076917188,,,,,426,LSO,2021/06/29,0,,
Lesotho,7/1/21,11416,329,,,72,,532.8971568237537,,,,,426,LSO,2021/07/01,0,,
Lesotho,7/2/21,11544,329,,,128,,538.8721775029268,,,,,426,LSO,2021/07/02,0,,
Liberia,6/4/21,2250,86,,,31,,44.48682665974913,,,,,430,LBR,2021/06/04,0,,
Liberia,6/7/21,2290,88,,,40,,45.27770357814467,,,,,430,LBR,2021/06/07,2,,
Liberia,6/9/21,2382,88,,,92,,47.09672049045441,,,,,430,LBR,2021/06/09,0,,
Liberia,6/11/21,2484,93,,,102,,49.11345663236304,,,,,430,LBR,2021/06/11,5,,
Liberia,6/13/21,2535,93,,,51,,50.12182470331735,,,,,430,LBR,2021/06/13,0,,
Liberia,6/14/21,2575,94,,,40,,50.91270162171289,,,,,430,LBR,2021/06/14,1,,
Liberia,6/16/21,2729,95,,,154,,53.957577757535724,,,,,430,LBR,2021/06/16,1,,
Liberia,6/17/21,2796,95,,,67,,55.28229659584825,,,,,430,LBR,2021/06/17,0,,
Liberia,6/18/21,2834,95,,,38,,56.03362966832402,,,,,430,LBR,2021/06/18,0,,
Liberia,6/20/21,2995,95,,,161,,59.21690926486606,,,,,430,LBR,2021/06/20,0,,
Liberia,6/21/21,3109,99,,,114,,61.47090848229335,,,,,430,LBR,2021/06/21,4,,
Liberia,6/23/21,3265,110,,,156,,64.55532846403597,,,,,430,LBR,2021/06/23,11,,
Liberia,6/25/21,3374,112,,,109,,66.71046806666381,,,,,430,LBR,2021/06/25,2,,
Liberia,6/26/21,3529,113,,,155,,69.77511612544653,,,,,430,LBR,2021/06/26,1,,
Liberia,6/27/21,3736,120,,,207,,73.86790417814345,,,,,430,LBR,2021/06/27,7,,
Liberia,6/28/21,3794,123,,,58,,75.01467570981698,,,,,430,LBR,2021/06/28,3,,
Liberia,6/29/21,3900,127,,,106,,77.11049954356515,,,,,430,LBR,2021/06/29,4,,
Liberia,6/30/21,4093,128,,,193,,80.92648067482364,,,,,430,LBR,2021/06/30,1,,
Liberia,7/1/21,4304,129,,,211,,85.09835641936012,,,,,430,LBR,2021/07/01,1,,
Liberia,7/2/21,4520,133,,,216,,89.36909177869603,,,,,430,LBR,2021/07/02,4,,
Libya,6/4/21,186953,3137,,,386,,2720.785785836045,,,,,434,LBY,2021/06/04,5,,
Libya,6/6/21,187281,3143,,,328,,2725.559272957162,,,,,434,LBY,2021/06/06,6,,
Libya,6/7/21,187685,3146,,,404,,2731.4388119721966,,,,,434,LBY,2021/06/07,3,,
Libya,6/8/21,187928,3149,,,243,,2734.9752673698536,,,,,434,LBY,2021/06/08,3,,
Libya,6/9/21,188157,3152,,,229,,2738.3079763659994,,,,,434,LBY,2021/06/09,3,,
Libya,6/10/21,188386,3155,,,229,,2741.640685362145,,,,,434,LBY,2021/06/10,3,,
Libya,6/11/21,188762,3158,,,376,,2747.112731574158,,,,,434,LBY,2021/06/11,3,,
Libya,6/13/21,189059,3161,,,297,,2751.435065949072,,,,,434,LBY,2021/06/13,3,,
Libya,6/14/21,189284,3165,,,225,,2754.709561687643,,,,,434,LBY,2021/06/14,4,,
Libya,6/15/21,189555,3166,,,271,,2758.6535098883223,,,,,434,LBY,2021/06/15,1,,
Libya,6/16/21,189888,3166,,,333,,2763.4997635814075,,,,,434,LBY,2021/06/16,0,,
Libya,6/17/21,190146,3170,,,258,,2767.254518694969,,,,,434,LBY,2021/06/17,4,,
Libya,6/18/21,190426,3173,,,280,,2771.3294467251912,,,,,434,LBY,2021/06/18,3,,
Libya,6/20/21,190748,3174,,,322,,2776.0156139599467,,,,,434,LBY,2021/06/20,1,,
Libya,6/21/21,191038,3178,,,290,,2780.2360751341052,,,,,434,LBY,2021/06/21,4,,
Libya,6/22/21,191253,3181,,,215,,2783.36503772874,,,,,434,LBY,2021/06/22,3,,
Libya,6/23/21,191476,3183,,,223,,2786.610426838524,,,,,434,LBY,2021/06/23,2,,
Libya,6/24/21,191660,3185,,,184,,2789.2882366869553,,,,,434,LBY,2021/06/24,2,,
Libya,6/25/21,192129,3185,,,469,,2796.113741137577,,,,,434,LBY,2021/06/25,0,,
Libya,6/27/21,192470,3187,,,341,,2801.076421345812,,,,,434,LBY,2021/06/27,2,,
Libya,6/28/21,192786,3191,,,316,,2805.6752686942054,,,,,434,LBY,2021/06/28,4,,
Libya,6/29/21,193238,3191,,,452,,2812.253366800135,,,,,434,LBY,2021/06/29,0,,
Libya,6/30/21,193474,3193,,,236,,2815.6879489970365,,,,,434,LBY,2021/06/30,2,,
Libya,7/1/21,193905,3198,,,431,,2821.9604275006996,,,,,434,LBY,2021/07/01,5,,
Libya,7/2/21,194323,3205,,,418,,2828.0437129172456,,,,,434,LBY,2021/07/02,7,,
Liechtenstein,6/4/21,3019,58,,,2,,7916.196869182159,,,,,438,LIE,2021/06/04,0,22944,1663
Liechtenstein,6/5/21,3020,58,,,1,,7918.818994677085,,,,,438,LIE,2021/06/05,0,22944,0
Liechtenstein,6/6/21,3022,58,,,2,,7924.063245666937,,,,,438,LIE,2021/06/06,0,22944,0
Liechtenstein,6/10/21,3023,58,,,1,,7926.685371161864,,,,,438,LIE,2021/06/10,0,24053,0
Liechtenstein,6/11/21,3024,59,,,1,,7929.30749665679,,,,,438,LIE,2021/06/11,1,25780,1727
Liechtenstein,6/12/21,3026,59,,,2,,7934.551747646642,,,,,438,LIE,2021/06/12,0,25780,0
Liechtenstein,6/21/21,3028,59,,,2,,7939.795998636495,,,,,438,LIE,2021/06/21,0,28606,0
Liechtenstein,6/23/21,3030,59,,,2,,7945.040249626347,,,,,438,LIE,2021/06/23,0,29736,0
Liechtenstein,6/24/21,3031,59,,,1,,7947.662375121274,,,,,438,LIE,2021/06/24,0,29736,0
Liechtenstein,6/25/21,3032,59,,,1,,7950.2845006162,,,,,438,LIE,2021/06/25,0,30557,821
Liechtenstein,6/28/21,3034,59,,,2,,7955.528751606052,,,,,438,LIE,2021/06/28,0,30557,0
Liechtenstein,6/30/21,3036,59,,,2,,7960.7730025959045,,,,,438,LIE,2021/06/30,0,31353,0
Liechtenstein,7/1/21,3039,59,,,3,,7968.639379080682,,,,,438,LIE,2021/07/01,0,31353,0
Liechtenstein,7/2/21,3040,59,,,1,,7971.261504575609,,,,,438,LIE,2021/07/02,0,32483,1130
Lithuania,6/4/21,275915,4297,,,370,,10135.396987316934,,,,,440,LTU,2021/06/04,8,1734236,0
Lithuania,6/5/21,276256,4302,,,341,,10147.923201450543,,,,,440,LTU,2021/06/05,5,1734236,0
Lithuania,6/6/21,276453,4307,,,197,,10155.159753310723,,,,,440,LTU,2021/06/06,5,1799353,65117
Lithuania,6/7/21,276543,4309,,,90,,10158.465792231616,,,,,440,LTU,2021/06/07,2,1823475,24122
Lithuania,6/8/21,276759,4317,,,216,,10166.400285641763,,,,,440,LTU,2021/06/08,8,1852132,28657
Lithuania,6/9/21,277002,4320,,,243,,10175.326590728177,,,,,440,LTU,2021/06/09,3,1881748,29616
Lithuania,6/10/21,277222,4327,,,220,,10183.408019201474,,,,,440,LTU,2021/06/10,7,1881748,0
Lithuania,6/11/21,277379,4330,,,157,,10189.175220430145,,,,,440,LTU,2021/06/11,3,1933826,52078
Lithuania,6/12/21,277623,4335,,,244,,10198.138259282347,,,,,440,LTU,2021/06/12,5,1940377,6551
Lithuania,6/13/21,277746,4339,,,123,,10202.656512474236,,,,,440,LTU,2021/06/13,4,1947363,6986
Lithuania,6/14/21,277812,4342,,,66,,10205.080941016226,,,,,440,LTU,2021/06/14,3,1969337,21974
Lithuania,6/15/21,277942,4348,,,130,,10209.856330568628,,,,,440,LTU,2021/06/15,6,1995919,26582
Lithuania,6/16/21,278072,4352,,,130,,10214.63172012103,,,,,440,LTU,2021/06/16,4,1995919,0
Lithuania,6/17/21,278177,4357,,,105,,10218.48876552874,,,,,440,LTU,2021/06/17,5,2055578,59659
Lithuania,6/18/21,278254,4360,,,77,,10221.317265494394,,,,,440,LTU,2021/06/18,3,2055578,0
Lithuania,6/19/21,278328,4364,,,74,,10224.035564162685,,,,,440,LTU,2021/06/19,4,2081577,25999
Lithuania,6/20/21,278379,4366,,,51,,10225.908986217859,,,,,440,LTU,2021/06/20,2,2088447,6870
Lithuania,6/21/21,278407,4367,,,28,,10226.937531659914,,,,,440,LTU,2021/06/21,1,2107448,19001
Lithuania,6/22/21,278466,4371,,,59,,10229.10482384139,,,,,440,LTU,2021/06/22,4,2133006,25558
Lithuania,6/23/21,278526,4371,,,60,,10231.308849788653,,,,,440,LTU,2021/06/23,0,2160457,27451
Lithuania,6/24/21,278590,4375,,,64,,10233.659810799067,,,,,440,LTU,2021/06/24,4,2160457,0
Lithuania,6/25/21,278608,4378,,,18,,10234.321018583245,,,,,440,LTU,2021/06/25,3,2170796,10339
Lithuania,6/26/21,278655,4379,,,47,,10236.047505575267,,,,,440,LTU,2021/06/26,1,2200542,29746
Lithuania,6/27/21,278674,4380,,,19,,10236.745447125233,,,,,440,LTU,2021/06/27,1,2215193,14651
Lithuania,6/28/21,278689,4381,,,15,,10237.296453612049,,,,,440,LTU,2021/06/28,1,2235582,20389
Lithuania,6/29/21,278726,4381,,,37,,10238.655602946195,,,,,440,LTU,2021/06/29,0,2261823,26241
Lithuania,6/30/21,278769,4383,,,43,,10240.235154875067,,,,,440,LTU,2021/06/30,2,2287254,25431
Lithuania,7/1/21,278809,4384,,,40,,10241.704505506576,,,,,440,LTU,2021/07/01,1,2306092,18838
Lithuania,7/2/21,278826,4387,,,17,,10242.328979524966,,,,,440,LTU,2021/07/02,3,2256230,-49862
Luxembourg,6/4/21,70182,818,,,94,,11211.611946783902,,,,,442,LUX,2021/06/04,0,373485,8576
Luxembourg,6/7/21,70256,818,,,74,,11223.433486267844,,,,,442,LUX,2021/06/07,0,389502,16017
Luxembourg,6/8/21,70291,818,,,35,,11229.024754942682,,,,,442,LUX,2021/06/08,0,398074,8572
Luxembourg,6/9/21,70343,818,,,52,,11237.331782688154,,,,,442,LUX,2021/06/09,0,406570,8496
Luxembourg,6/10/21,70383,818,,,40,,11243.721804030825,,,,,442,LUX,2021/06/10,0,414382,7812
Luxembourg,6/11/21,70406,818,,,23,,11247.396066302861,,,,,442,LUX,2021/06/11,0,423029,8647
Luxembourg,6/14/21,70445,818,,,39,,11253.626337111966,,,,,442,LUX,2021/06/14,0,439632,16603
Luxembourg,6/15/21,70466,818,,,21,,11256.981098316868,,,,,442,LUX,2021/06/15,0,446564,6932
Luxembourg,6/16/21,70485,818,,,19,,11260.016358454637,,,,,442,LUX,2021/06/16,0,452571,6007
Luxembourg,6/17/21,70503,818,,,18,,11262.89186805884,,,,,442,LUX,2021/06/17,0,460550,7979
Luxembourg,6/18/21,70516,818,,,13,,11264.968624995208,,,,,442,LUX,2021/06/18,0,468346,7796
Luxembourg,6/21/21,70535,818,,,19,,11268.003885132975,,,,,442,LUX,2021/06/21,0,483523,15177
Luxembourg,6/22/21,70547,818,,,12,,11269.920891535778,,,,,442,LUX,2021/06/22,0,491716,8193
Luxembourg,6/24/21,70586,818,,,39,,11276.151162344882,,,,,442,LUX,2021/06/24,0,505986,14270
Luxembourg,6/25/21,70600,818,,,14,,11278.387669814818,,,,,442,LUX,2021/06/25,0,512584,6598
Luxembourg,6/28/21,70642,818,,,42,,11285.097192224623,,,,,442,LUX,2021/06/28,0,527596,15012
Luxembourg,6/29/21,70695,818,,,53,,11293.563970503661,,,,,442,LUX,2021/06/29,0,534876,7280
Luxembourg,6/30/21,70787,818,,,92,,11308.261019591806,,,,,442,LUX,2021/06/30,0,542793,7917
Luxembourg,7/1/21,70895,818,,,108,,11325.514077217018,,,,,442,LUX,2021/07/01,0,551725,8932
Luxembourg,7/2/21,71031,818,,,136,,11347.240149782101,,,,,442,LUX,2021/07/02,0,560608,8883
MS Zaandam,6/4/21,9,2,,,0,,,,,,,8888,,2021/06/04,0,,
MS Zaandam,7/2/21,9,2,,,0,,,,,,,8888,,2021/07/02,0,,
Madagascar,6/4/21,41540,857,,,52,,150.01253655562476,,,,,450,MDG,2021/06/04,7,,
Madagascar,6/5/21,41631,859,,,91,,150.34116295973072,,,,,450,MDG,2021/06/05,2,,
Madagascar,6/6/21,41690,861,,,59,,150.55422843052472,,,,,450,MDG,2021/06/06,2,,
Madagascar,6/7/21,41742,866,,,52,,150.7420149471567,,,,,450,MDG,2021/06/07,5,,
Madagascar,6/8/21,41758,871,,,16,,150.7997954138127,,,,,450,MDG,2021/06/08,5,,
Madagascar,6/9/21,41786,874,,,28,,150.90091123046068,,,,,450,MDG,2021/06/09,3,,
Madagascar,6/10/21,41840,875,,,54,,151.09592030542467,,,,,450,MDG,2021/06/10,1,,
Madagascar,6/11/21,41869,879,,,29,,151.20064740123865,,,,,450,MDG,2021/06/11,4,,
Madagascar,6/12/21,41894,882,,,25,,151.29092938038863,,,,,450,MDG,2021/06/12,3,,
Madagascar,6/13/21,41933,887,,,39,,151.43176926786262,,,,,450,MDG,2021/06/13,5,,
Madagascar,6/14/21,41948,889,,,15,,151.48593845535262,,,,,450,MDG,2021/06/14,2,,
Madagascar,6/15/21,41966,891,,,18,,151.5509414803406,,,,,450,MDG,2021/06/15,2,,
Madagascar,6/16/21,41998,892,,,32,,151.6665024136526,,,,,450,MDG,2021/06/16,1,,
Madagascar,6/17/21,42034,892,,,36,,151.79650846362858,,,,,450,MDG,2021/06/17,0,,
Madagascar,6/18/21,42076,895,,,42,,151.94818218860058,,,,,450,MDG,2021/06/18,3,,
Madagascar,6/19/21,42087,896,,,11,,151.98790625942658,,,,,450,MDG,2021/06/19,1,,
Madagascar,6/20/21,42123,901,,,36,,152.11791230940256,,,,,450,MDG,2021/06/20,5,,
Madagascar,6/21/21,42137,903,,,14,,152.16847021772654,,,,,450,MDG,2021/06/21,2,,
Madagascar,6/23/21,42161,905,,,24,,152.25514091771055,,,,,450,MDG,2021/06/23,2,,
Madagascar,6/24/21,42166,905,,,5,,152.27319731354055,,,,,450,MDG,2021/06/24,0,,
Madagascar,6/25/21,42194,906,,,28,,152.37431313018854,,,,,450,MDG,2021/06/25,1,,
Madagascar,6/28/21,42194,909,,,0,,152.37431313018854,,,,,450,MDG,2021/06/28,3,,
Madagascar,6/29/21,42207,911,,,13,,152.42125975934653,,,,,450,MDG,2021/06/29,2,,
Madagascar,6/30/21,42216,913,,,9,,152.4537612718405,,,,,450,MDG,2021/06/30,2,,
Madagascar,7/1/21,42247,915,,,31,,152.5657109259865,,,,,450,MDG,2021/07/01,2,,
Madagascar,7/2/21,42264,918,,,17,,152.6271026718085,,,,,450,MDG,2021/07/02,3,,
Malawi,6/4/21,34371,1156,,,6,,179.67109697853445,,,,,454,MWI,2021/06/04,0,357650,635
Malawi,6/5/21,34384,1156,,,13,,179.73905322830086,,,,,454,MWI,2021/06/05,0,357650,0
Malawi,6/6/21,34390,1157,,,6,,179.77041765126995,,,,,454,MWI,2021/06/06,1,357650,0
Malawi,6/7/21,34403,1157,,,13,,179.83837390103636,,,,,454,MWI,2021/06/07,0,357650,0
Malawi,6/8/21,34410,1158,,,7,,179.87496572783365,,,,,454,MWI,2021/06/08,1,363928,6278
Malawi,6/9/21,34432,1158,,,22,,179.9899686120537,,,,,454,MWI,2021/06/09,0,367356,3428
Malawi,6/10/21,34447,1158,,,15,,180.06837966947649,,,,,454,MWI,2021/06/10,0,369674,2318
Malawi,6/11/21,34470,1158,,,23,,180.18860995752473,,,,,454,MWI,2021/06/11,0,369674,0
Malawi,6/12/21,34485,1159,,,15,,180.2670210149475,,,,,454,MWI,2021/06/12,1,369674,0
Malawi,6/14/21,34564,1159,,,79,,180.6799859173741,,,,,454,MWI,2021/06/14,0,381257,3643
Malawi,6/15/21,34588,1162,,,24,,180.80544360925052,,,,,454,MWI,2021/06/15,3,387363,6106
Malawi,6/16/21,34650,1163,,,62,,181.12954264659797,,,,,454,MWI,2021/06/16,1,387363,0
Malawi,6/17/21,34702,1164,,,52,,181.40136764566356,,,,,454,MWI,2021/06/17,1,393313,5950
Malawi,6/18/21,34781,1166,,,79,,181.81433254809016,,,,,454,MWI,2021/06/18,2,393313,0
Malawi,6/19/21,34832,1168,,,51,,182.08093014332758,,,,,454,MWI,2021/06/19,2,393313,0
Malawi,6/20/21,34868,1168,,,36,,182.2691166811422,,,,,454,MWI,2021/06/20,0,489080,95767
Malawi,6/21/21,34914,1171,,,46,,182.5095772572387,,,,,454,MWI,2021/06/21,3,489080,0
Malawi,6/22/21,34996,1173,,,82,,182.93822437114986,,,,,454,MWI,2021/06/22,2,489080,0
Malawi,6/23/21,35115,1177,,,119,,183.5602854267038,,,,,454,MWI,2021/06/23,4,489080,0
Malawi,6/24/21,35219,1178,,,104,,184.10393542483504,,,,,454,MWI,2021/06/24,1,491717,2637
Malawi,6/25/21,35388,1179,,,169,,184.98736667179824,,,,,454,MWI,2021/06/25,1,491717,0
Malawi,6/26/21,35554,1181,,,166,,185.8551157072769,,,,,454,MWI,2021/06/26,2,491717,0
Malawi,6/27/21,35629,1182,,,75,,186.24717099439073,,,,,454,MWI,2021/06/27,1,491717,0
Malawi,6/28/21,35709,1187,,,80,,186.6653633006455,,,,,454,MWI,2021/06/28,5,492390,673
Malawi,6/29/21,35897,1194,,,188,,187.6481152203442,,,,,454,MWI,2021/06/29,7,492390,0
Malawi,6/30/21,36126,1196,,,229,,188.84519069699851,,,,,454,MWI,2021/06/30,2,492390,0
Malawi,7/1/21,36359,1199,,,233,,190.06317578896554,,,,,454,MWI,2021/07/01,3,492390,0
Malawi,7/2/21,36573,1202,,,214,,191.18184020819703,,,,,454,MWI,2021/07/02,3,492390,0
Malaysia,6/4/21,603122,3182,,,7748,,1863.4432344709408,,,,,458,MYS,2021/06/04,86,3420713,59397
Malaysia,6/5/21,610574,3291,,,7452,,1886.4673970504477,,,,,458,MYS,2021/06/05,109,3420713,0
Malaysia,6/6/21,616815,3378,,,6241,,1905.7499787276759,,,,,458,MYS,2021/06/06,87,3493193,72480
Malaysia,6/7/21,622086,3460,,,5271,,1922.0355880884624,,,,,458,MYS,2021/06/07,82,3638812,145619
Malaysia,6/8/21,627652,3536,,,5566,,1939.2326477929091,,,,,458,MYS,2021/06/08,76,3790121,151309
Malaysia,6/9/21,633891,3611,,,6239,,1958.5090501457732,,,,,458,MYS,2021/06/09,75,3944987,154866
Malaysia,6/10/21,639562,3684,,,5671,,1976.0305243793193,,,,,458,MYS,2021/06/10,73,3944987,0
Malaysia,6/11/21,646411,3768,,,6849,,1997.1916206631415,,,,,458,MYS,2021/06/11,84,4102936,157949
Malaysia,6/12/21,652204,3844,,,5793,,2015.0900336828793,,,,,458,MYS,2021/06/12,76,4227554,124618
Malaysia,6/13/21,657508,3908,,,5304,,2031.4776018956684,,,,,458,MYS,2021/06/13,64,4490270,262716
Malaysia,6/14/21,662457,3968,,,4949,,2046.7683400338838,,,,,458,MYS,2021/06/14,60,4688233,197963
Malaysia,6/15/21,667876,4069,,,5419,,2063.511219397591,,,,,458,MYS,2021/06/15,101,4904109,215876
Malaysia,6/16/21,673026,4142,,,5150,,2079.422979634368,,,,,458,MYS,2021/06/16,73,4904109,0
Malaysia,6/17/21,678764,4202,,,5738,,2097.151461234101,,,,,458,MYS,2021/06/17,60,5330654,426545
Malaysia,6/18/21,685204,4276,,,6440,,2117.0488856855272,,,,,458,MYS,2021/06/18,74,5330654,0
Malaysia,6/19/21,691115,4348,,,5911,,2135.3118788427287,,,,,458,MYS,2021/06/19,72,5510720,180066
Malaysia,6/20/21,696408,4408,,,5293,,2151.6654607715172,,,,,458,MYS,2021/06/20,60,5510720,0
Malaysia,6/21/21,701019,4477,,,4611,,2165.911893092251,,,,,458,MYS,2021/06/21,69,6051198,540478
Malaysia,6/22/21,705762,4554,,,4743,,2180.566160820995,,,,,458,MYS,2021/06/22,77,6301727,250529
Malaysia,6/23/21,711006,4637,,,5244,,2196.7683493028703,,,,,458,MYS,2021/06/23,83,6301727,0
Malaysia,6/24/21,716847,4721,,,5841,,2214.815066107339,,,,,458,MYS,2021/06/24,84,6301727,0
Malaysia,6/25/21,722659,4803,,,5812,,2232.7721827085325,,,,,458,MYS,2021/06/25,82,6554500,252773
Malaysia,6/26/21,728462,4884,,,5803,,2250.701492350089,,,,,458,MYS,2021/06/26,81,7039072,484572
Malaysia,6/27/21,734048,4944,,,5586,,2267.9603452981737,,,,,458,MYS,2021/06/27,60,7226949,187877
Malaysia,6/28/21,739266,5001,,,5218,,2284.0822025633197,,,,,458,MYS,2021/06/28,57,7593179,366230
Malaysia,6/29/21,745703,5108,,,6437,,2303.9703580282,,,,,458,MYS,2021/06/29,107,7824912,231733
Malaysia,6/30/21,751979,5170,,,6276,,2323.3610778817942,,,,,458,MYS,2021/06/30,62,8083685,258773
Malaysia,7/1/21,758967,5254,,,6988,,2344.9516372089006,,,,,458,MYS,2021/07/01,84,8346697,263012
Malaysia,7/2/21,765949,5327,,,6982,,2366.5236585629154,,,,,458,MYS,2021/07/02,73,8346697,0
Maldives,6/4/21,66948,177,,,432,,12385.346559564288,,,,,462,MDV,2021/06/04,4,482340,1401
Maldives,6/5/21,67538,182,,,590,,12494.496264860085,,,,,462,MDV,2021/06/05,5,482340,0
Maldives,6/6/21,67950,185,,,412,,12570.71605906664,,,,,462,MDV,2021/06/06,3,482628,288
Maldives,6/7/21,68502,187,,,552,,12672.835783343386,,,,,462,MDV,2021/06/07,2,482628,0
Maldives,6/8/21,68872,189,,,370,,12741.285598528884,,,,,462,MDV,2021/06/08,2,486833,4205
Maldives,6/9/21,69213,191,,,341,,12804.370428199843,,,,,462,MDV,2021/06/09,2,488203,1370
Maldives,6/10/21,69536,191,,,323,,12864.12526686178,,,,,462,MDV,2021/06/10,0,488203,0
Maldives,6/11/21,69831,192,,,295,,12918.700119509678,,,,,462,MDV,2021/06/11,1,489415,1212
Maldives,6/12/21,70077,195,,,246,,12964.20999663301,,,,,462,MDV,2021/06/12,3,489415,0
Maldives,6/13/21,70301,197,,,224,,13005.649884745311,,,,,462,MDV,2021/06/13,2,491834,2419
Maldives,6/14/21,70673,198,,,372,,13074.469698931813,,,,,462,MDV,2021/06/14,1,492718,884
Maldives,6/15/21,70897,198,,,224,,13115.909587044114,,,,,462,MDV,2021/06/15,0,493630,912
Maldives,6/16/21,71138,200,,,241,,13160.49446666494,,,,,462,MDV,2021/06/16,2,493630,0
Maldives,6/17/21,71356,201,,,218,,13200.824357774234,,,,,462,MDV,2021/06/17,1,493630,0
Maldives,6/18/21,71498,203,,,142,,13227.094286845426,,,,,462,MDV,2021/06/18,2,493630,0
Maldives,6/19/21,71709,205,,,211,,13266.12918145121,,,,,462,MDV,2021/06/19,2,493630,0
Maldives,6/20/21,71896,206,,,187,,13300.724088044963,,,,,462,MDV,2021/06/20,1,496662,3032
Maldives,6/21/21,72149,206,,,253,,13347.528961671804,,,,,462,MDV,2021/06/21,0,497871,1209
Maldives,6/22/21,72294,207,,,145,,13374.3538892445,,,,,462,MDV,2021/06/22,1,499609,1738
Maldives,6/23/21,72466,207,,,172,,13406.17380333073,,,,,462,MDV,2021/06/23,0,499609,0
Maldives,6/24/21,72678,207,,,212,,13445.393697437017,,,,,462,MDV,2021/06/24,0,500485,876
Maldives,6/25/21,72944,209,,,266,,13494.603564570376,,,,,462,MDV,2021/06/25,2,500485,0
Maldives,6/26/21,73094,209,,,150,,13522.353489645579,,,,,462,MDV,2021/06/26,0,502546,2061
Maldives,6/27/21,73327,209,,,233,,13565.458373262392,,,,,462,MDV,2021/06/27,0,502546,0
Maldives,6/28/21,73482,209,,,155,,13594.133295840102,,,,,462,MDV,2021/06/28,0,505285,2739
Maldives,6/29/21,73660,210,,,178,,13627.06320692934,,,,,462,MDV,2021/06/29,1,506233,948
Maldives,6/30/21,73798,210,,,138,,13652.593137998527,,,,,462,MDV,2021/06/30,0,507074,841
Maldives,7/1/21,73931,213,,,133,,13677.198071565206,,,,,462,MDV,2021/07/01,3,507741,667
Maldives,7/2/21,74074,213,,,143,,13703.6530001369,,,,,462,MDV,2021/07/02,0,507741,0
Mali,6/4/21,14287,517,,,6,,70.55018079749209,,,,,466,MLI,2021/06/04,0,127042,0
Mali,6/5/21,14296,518,,,9,,70.59462341155924,,,,,466,MLI,2021/06/05,1,127042,0
Mali,6/6/21,14298,519,,,2,,70.60449954801861,,,,,466,MLI,2021/06/06,1,127042,0
Mali,6/7/21,14302,519,,,4,,70.62425182093735,,,,,466,MLI,2021/06/07,0,127042,0
Mali,6/8/21,14324,520,,,22,,70.7328893219904,,,,,466,MLI,2021/06/08,1,152430,0
Mali,6/9/21,14328,521,,,4,,70.75264159490912,,,,,466,MLI,2021/06/09,1,152430,0
Mali,6/10/21,14329,521,,,1,,70.75757966313881,,,,,466,MLI,2021/06/10,0,157129,0
Mali,6/11/21,14336,523,,,7,,70.7921461407466,,,,,466,MLI,2021/06/11,2,157129,0
Mali,6/12/21,14349,523,,,13,,70.85634102773248,,,,,466,MLI,2021/06/12,0,157129,0
Mali,6/13/21,14350,523,,,1,,70.86127909596217,,,,,466,MLI,2021/06/13,0,157129,0
Mali,6/14/21,14352,523,,,2,,70.87115523242154,,,,,466,MLI,2021/06/14,0,163218,0
Mali,6/15/21,14356,523,,,4,,70.89090750534028,,,,,466,MLI,2021/06/15,0,163218,0
Mali,6/16/21,14359,523,,,3,,70.90572171002933,,,,,466,MLI,2021/06/16,0,163218,0
Mali,6/17/21,14364,523,,,5,,70.93041205117774,,,,,466,MLI,2021/06/17,0,163218,0
Mali,6/18/21,14375,524,,,11,,70.98473080170426,,,,,466,MLI,2021/06/18,1,163218,0
Mali,6/19/21,14380,524,,,5,,71.00942114285269,,,,,466,MLI,2021/06/19,0,163218,0
Mali,6/20/21,14381,524,,,1,,71.01435921108236,,,,,466,MLI,2021/06/20,0,176038,0
Mali,6/21/21,14385,524,,,4,,71.0341114840011,,,,,466,MLI,2021/06/21,0,176038,0
Mali,6/23/21,14391,525,,,6,,71.0637398933792,,,,,466,MLI,2021/06/23,1,176038,0
Mali,6/24/21,14396,525,,,5,,71.08843023452762,,,,,466,MLI,2021/06/24,0,179634,0
Mali,6/25/21,14404,525,,,8,,71.1279347803651,,,,,466,MLI,2021/06/25,0,179634,0
Mali,6/26/21,14414,525,,,10,,71.17731546266194,,,,,466,MLI,2021/06/26,0,179634,0
Mali,6/27/21,14417,525,,,3,,71.19212966735098,,,,,466,MLI,2021/06/27,0,179634,0
Mali,6/28/21,14419,525,,,2,,71.20200580381035,,,,,466,MLI,2021/06/28,0,179634,0
Mali,6/29/21,14422,525,,,3,,71.2168200084994,,,,,466,MLI,2021/06/29,0,179634,0
Mali,6/30/21,14426,525,,,4,,71.23657228141813,,,,,466,MLI,2021/06/30,0,179634,0
Mali,7/1/21,14428,525,,,2,,71.2464484178775,,,,,466,MLI,2021/07/01,0,179634,0
Mali,7/2/21,14435,525,,,7,,71.2810148954853,,,,,466,MLI,2021/07/02,0,179634,0
Malta,6/4/21,30559,419,,,2,,6921.019434296857,,,,,470,MLT,2021/06/04,0,546637,5459
Malta,6/5/21,30568,419,,,9,,6923.057759337227,,,,,470,MLT,2021/06/05,0,546637,0
Malta,6/6/21,30571,419,,,3,,6923.73720101735,,,,,470,MLT,2021/06/06,0,551494,4857
Malta,6/8/21,30572,419,,,1,,6923.963681577392,,,,,470,MLT,2021/06/08,0,558320,4506
Malta,6/9/21,30573,419,,,1,,6924.190162137433,,,,,470,MLT,2021/06/09,0,564718,6398
Malta,6/10/21,30577,419,,,4,,6925.096084377597,,,,,470,MLT,2021/06/10,0,564718,0
Malta,6/11/21,30579,419,,,2,,6925.54904549768,,,,,470,MLT,2021/06/11,0,576256,11538
Malta,6/12/21,30581,419,,,2,,6926.002006617762,,,,,470,MLT,2021/06/12,0,587160,10904
Malta,6/14/21,30582,419,,,1,,6926.228487177803,,,,,470,MLT,2021/06/14,0,589507,2347
Malta,6/16/21,30585,419,,,3,,6926.907928857927,,,,,470,MLT,2021/06/16,0,596074,0
Malta,6/18/21,30588,420,,,3,,6927.58737053805,,,,,470,MLT,2021/06/18,1,609867,0
Malta,6/20/21,30589,420,,,1,,6927.813851098091,,,,,470,MLT,2021/06/20,0,621674,5572
Malta,6/21/21,30590,420,,,1,,6928.040331658132,,,,,470,MLT,2021/06/21,0,628735,7061
Malta,6/22/21,30595,420,,,5,,6929.172734458338,,,,,470,MLT,2021/06/22,0,631446,2711
Malta,6/24/21,30598,420,,,3,,6929.852176138461,,,,,470,MLT,2021/06/24,0,636059,0
Malta,6/25/21,30603,420,,,5,,6930.984578938666,,,,,470,MLT,2021/06/25,0,640729,4670
Malta,6/26/21,30606,420,,,3,,6931.66402061879,,,,,470,MLT,2021/06/26,0,650411,9682
Malta,6/28/21,30612,420,,,6,,6933.0229039790365,,,,,470,MLT,2021/06/28,0,653005,0
Malta,6/29/21,30618,420,,,6,,6934.381787339284,,,,,470,MLT,2021/06/29,0,659488,6483
Malta,6/30/21,30623,420,,,5,,6935.514190139489,,,,,470,MLT,2021/06/30,0,664859,5371
Malta,7/1/21,30627,420,,,4,,6936.420112379654,,,,,470,MLT,2021/07/01,0,670759,5900
Malta,7/2/21,30633,420,,,6,,6937.778995739901,,,,,470,MLT,2021/07/02,0,670759,0
Marshall Islands,6/4/21,4,0,,,0,,6.847790731515245,,,,,584,MHL,2021/06/04,0,30257,0
Marshall Islands,7/2/21,4,0,,,0,,6.847790731515245,,,,,584,MHL,2021/07/02,0,33077,0
Mauritania,6/4/21,19752,466,,,57,,424.80525457775406,,,,,478,MRT,2021/06/04,2,37331,0
Mauritania,6/5/21,19785,466,,,33,,425.5149838912953,,,,,478,MRT,2021/06/05,0,37331,0
Mauritania,6/6/21,19817,468,,,32,,426.20320625594127,,,,,478,MRT,2021/06/06,2,37331,0
Mauritania,6/7/21,19853,470,,,36,,426.9774564161681,,,,,478,MRT,2021/06/07,2,37331,0
Mauritania,6/8/21,19895,470,,,42,,427.88074826976595,,,,,478,MRT,2021/06/08,0,43607,0
Mauritania,6/9/21,19923,470,,,28,,428.4829428388312,,,,,478,MRT,2021/06/09,0,43607,0
Mauritania,6/10/21,19959,472,,,36,,429.257192999058,,,,,478,MRT,2021/06/10,2,44628,0
Mauritania,6/11/21,20005,473,,,46,,430.24651264823666,,,,,478,MRT,2021/06/11,1,44628,0
Mauritania,6/12/21,20040,475,,,35,,430.9992558595682,,,,,478,MRT,2021/06/12,2,44628,0
Mauritania,6/13/21,20073,475,,,33,,431.70898517310945,,,,,478,MRT,2021/06/13,0,44628,0
Mauritania,6/14/21,20109,476,,,36,,432.4832353333362,,,,,478,MRT,2021/06/14,1,46703,0
Mauritania,6/15/21,20151,477,,,42,,433.3865271869341,,,,,478,MRT,2021/06/15,1,49235,0
Mauritania,6/16/21,20199,479,,,48,,434.4188607339031,,,,,478,MRT,2021/06/16,2,49235,0
Mauritania,6/17/21,20253,480,,,54,,435.5802359742433,,,,,478,MRT,2021/06/17,1,49235,0
Mauritania,6/18/21,20288,480,,,35,,436.33297918557486,,,,,478,MRT,2021/06/18,0,49235,0
Mauritania,6/19/21,20314,480,,,26,,436.89215985684973,,,,,478,MRT,2021/06/19,0,49235,0
Mauritania,6/20/21,20336,481,,,22,,437.3653127325439,,,,,478,MRT,2021/06/20,1,136003,0
Mauritania,6/21/21,20365,481,,,29,,437.98901425050434,,,,,478,MRT,2021/06/21,0,136003,0
Mauritania,6/22/21,20415,482,,,50,,439.06436169526376,,,,,478,MRT,2021/06/22,1,136003,0
Mauritania,6/23/21,20473,483,,,58,,440.31176473118467,,,,,478,MRT,2021/06/23,1,136003,0
Mauritania,6/24/21,20512,483,,,39,,441.150535738097,,,,,478,MRT,2021/06/24,0,140701,0
Mauritania,6/25/21,20568,486,,,56,,442.3549248762275,,,,,478,MRT,2021/06/25,3,140701,0
Mauritania,6/26/21,20604,486,,,36,,443.1291750364543,,,,,478,MRT,2021/06/26,0,140701,0
Mauritania,6/27/21,20635,486,,,31,,443.79589045220513,,,,,478,MRT,2021/06/27,0,142362,0
Mauritania,6/28/21,20676,487,,,41,,444.6776753569078,,,,,478,MRT,2021/06/28,1,161604,0
Mauritania,6/29/21,20747,487,,,71,,446.2046687284662,,,,,478,MRT,2021/06/29,0,161604,0
Mauritania,6/30/21,20808,489,,,61,,447.5165926110726,,,,,478,MRT,2021/06/30,2,161604,0
Mauritania,7/1/21,20894,489,,,86,,449.3661902160588,,,,,478,MRT,2021/07/01,0,161604,0
Mauritania,7/2/21,20977,489,,,83,,451.15126697435943,,,,,478,MRT,2021/07/02,0,161604,0
Mauritius,6/4/21,1421,18,,,0,,111.7343035320149,,,,,480,MUS,2021/06/04,0,400801,0
Mauritius,6/6/21,1458,18,,,37,,114.64364148464303,,,,,480,MUS,2021/06/06,0,400801,0
Mauritius,6/9/21,1496,18,,,38,,117.63161019274757,,,,,480,MUS,2021/06/09,0,455242,0
Mauritius,6/11/21,1564,18,,,68,,122.9785015651452,,,,,480,MUS,2021/06/11,0,455242,0
Mauritius,6/12/21,1566,18,,,2,,123.13576307609806,,,,,480,MUS,2021/06/12,0,455242,0
Mauritius,6/13/21,1673,18,,,107,,131.54925391207667,,,,,480,MUS,2021/06/13,0,455242,0
Mauritius,6/14/21,1701,18,,,28,,133.75091506541685,,,,,480,MUS,2021/06/14,0,455242,0
Mauritius,6/23/21,1779,18,,,78,,139.88411399257882,,,,,480,MUS,2021/06/23,0,598863,0
Mauritius,6/26/21,1833,18,,,54,,144.13017478830636,,,,,480,MUS,2021/06/26,0,706948,0
Mauritius,7/1/21,1858,18,,,25,,146.09594367521723,,,,,480,MUS,2021/07/01,0,706948,0
Mauritius,7/2/21,1858,18,,,0,,146.09594367521723,,,,,480,MUS,2021/07/02,0,706948,0
Mexico,6/4/21,2429631,228568,,,2809,,1901.2344767038599,,,,,484,MEX,2021/06/04,206,33779982,905125
Mexico,6/5/21,2431702,228758,,,2071,,1902.8550753055627,,,,,484,MEX,2021/06/05,190,33779982,0
Mexico,6/6/21,2433681,228804,,,1979,,1904.4036820814051,,,,,484,MEX,2021/06/06,46,34457602,677620
Mexico,6/7/21,2434562,228838,,,881,,1905.0930820660021,,,,,484,MEX,2021/06/07,34,34600289,142687
Mexico,6/8/21,2438011,229100,,,3449,,1907.7919930159164,,,,,484,MEX,2021/06/08,262,34658545,58256
Mexico,6/9/21,2441866,229353,,,3855,,1910.8086070234317,,,,,484,MEX,2021/06/09,253,35166248,507703
Mexico,6/10/21,2445538,229580,,,3672,,1913.6820198990729,,,,,484,MEX,2021/06/10,227,35166248,0
Mexico,6/11/21,2448820,229823,,,3282,,1916.2502500346538,,,,,484,MEX,2021/06/11,243,36430953,1264705
Mexico,6/12/21,2452469,230097,,,3649,,1919.1056649538298,,,,,484,MEX,2021/06/12,274,36983641,552688
Mexico,6/13/21,2454176,230150,,,1707,,1920.4414263314766,,,,,484,MEX,2021/06/13,53,36983641,0
Mexico,6/14/21,2455351,230187,,,1175,,1921.360887150888,,,,,484,MEX,2021/06/14,37,37521976,538335
Mexico,6/15/21,2459601,230428,,,4250,,1924.6865964976946,,,,,484,MEX,2021/06/15,241,37803462,281486
Mexico,6/16/21,2463390,230624,,,3789,,1927.6515641953538,,,,,484,MEX,2021/06/16,196,37803462,0
Mexico,6/17/21,2467643,230792,,,4253,,1930.9796211016994,,,,,484,MEX,2021/06/17,168,38633462,830000
Mexico,6/18/21,2471741,230959,,,4098,,1934.1863874318674,,,,,484,MEX,2021/06/18,167,38633462,0
Mexico,6/20/21,2477283,231187,,,5542,,1938.5231124201034,,,,,484,MEX,2021/06/20,228,39623088,469752
Mexico,6/21/21,2478551,231244,,,1268,,1939.5153475852212,,,,,484,MEX,2021/06/21,57,40227974,604886
Mexico,6/22/21,2482784,231505,,,4233,,1942.8277540946408,,,,,484,MEX,2021/06/22,261,40700954,472980
Mexico,6/23/21,2487747,231847,,,4963,,1946.7114000918648,,,,,484,MEX,2021/06/23,342,41368066,667112
Mexico,6/24/21,2493087,232068,,,5340,,1950.8900560711465,,,,,484,MEX,2021/06/24,221,41368066,0
Mexico,6/25/21,2498357,232346,,,5270,,1955.013935661187,,,,,484,MEX,2021/06/25,278,42155839,787773
Mexico,6/26/21,2503408,232521,,,5051,,1958.966443404886,,,,,484,MEX,2021/06/26,175,42791467,635628
Mexico,6/27/21,2505792,232564,,,2384,,1960.831970718483,,,,,484,MEX,2021/06/27,43,43753814,962347
Mexico,6/28/21,2507453,232608,,,1661,,1962.1317361831996,,,,,484,MEX,2021/06/28,44,43912990,159176
Mexico,6/29/21,2513164,232803,,,5711,,1966.6007070254616,,,,,484,MEX,2021/06/29,195,44385584,472594
Mexico,6/30/21,2519269,233047,,,6105,,1971.3779906871687,,,,,484,MEX,2021/06/30,244,45113218,727634
Mexico,7/1/21,2525350,233248,,,6081,,1976.1364938725644,,,,,484,MEX,2021/07/01,201,45898210,784992
Mexico,7/2/21,2531192,233428,,,5842,,1980.7079748146928,,,,,484,MEX,2021/07/02,180,45898210,0
Micronesia,6/4/21,1,0,,,0,,0.8786188112287484,,,,,583,FSM,2021/06/04,0,44326,0
Micronesia,7/2/21,1,0,,,0,,0.8786188112287484,,,,,583,FSM,2021/07/02,0,50909,0
Moldova,6/4/21,255402,6129,,,48,,6331.292577547191,,,,,498,MDA,2021/06/04,4,465028,14022
Moldova,6/5/21,255432,6132,,,30,,6332.036263099091,,,,,498,MDA,2021/06/05,3,465028,0
Moldova,6/6/21,255453,6134,,,21,,6332.556842985421,,,,,498,MDA,2021/06/06,2,470718,5690
Moldova,6/7/21,255501,6137,,,48,,6333.746739868462,,,,,498,MDA,2021/06/07,3,480131,9413
Moldova,6/8/21,255541,6141,,,40,,6334.738320604329,,,,,498,MDA,2021/06/08,4,480131,0
Moldova,6/9/21,255601,6145,,,60,,6336.2256917081295,,,,,498,MDA,2021/06/09,4,501896,21765
Moldova,6/10/21,255661,6147,,,60,,6337.713062811929,,,,,498,MDA,2021/06/10,2,501896,0
Moldova,6/11/21,255715,6149,,,54,,6339.05169680535,,,,,498,MDA,2021/06/11,2,522848,20952
Moldova,6/12/21,255758,6152,,,43,,6340.117646096407,,,,,498,MDA,2021/06/12,3,528421,5573
Moldova,6/13/21,255797,6154,,,39,,6341.084437313877,,,,,498,MDA,2021/06/13,2,530364,1943
Moldova,6/14/21,255830,6154,,,33,,6341.902491420968,,,,,498,MDA,2021/06/14,0,538879,8515
Moldova,6/15/21,255878,6156,,,48,,6343.092388304008,,,,,498,MDA,2021/06/15,2,556597,17718
Moldova,6/16/21,255937,6159,,,59,,6344.554969889411,,,,,498,MDA,2021/06/16,3,556597,0
Moldova,6/17/21,255994,6162,,,57,,6345.967972438022,,,,,498,MDA,2021/06/17,3,597494,40897
Moldova,6/18/21,256054,6165,,,60,,6347.455343541822,,,,,498,MDA,2021/06/18,3,597494,0
Moldova,6/19/21,256103,6168,,,49,,6348.67002994326,,,,,498,MDA,2021/06/19,3,613587,16093
Moldova,6/20/21,256140,6170,,,37,,6349.587242123936,,,,,498,MDA,2021/06/20,2,618217,4630
Moldova,6/21/21,256187,6173,,,47,,6350.75234948858,,,,,498,MDA,2021/06/21,3,631346,13129
Moldova,6/22/21,256232,6175,,,45,,6351.86787781643,,,,,498,MDA,2021/06/22,2,642482,11136
Moldova,6/23/21,256324,6178,,,92,,6354.148513508924,,,,,498,MDA,2021/06/23,3,655537,13055
Moldova,6/24/21,256387,6180,,,63,,6355.710253167915,,,,,498,MDA,2021/06/24,2,655537,0
Moldova,6/25/21,256475,6182,,,88,,6357.891730786821,,,,,498,MDA,2021/06/25,2,667835,12298
Moldova,6/26/21,256527,6183,,,52,,6359.180785743449,,,,,498,MDA,2021/06/26,1,680298,12463
Moldova,6/27/21,256559,6184,,,32,,6359.974050332143,,,,,498,MDA,2021/06/27,1,688125,7827
Moldova,6/28/21,256614,6187,,,55,,6361.33747384396,,,,,498,MDA,2021/06/28,3,696911,8786
Moldova,6/29/21,256669,6191,,,55,,6362.700897355777,,,,,498,MDA,2021/06/29,4,706942,10031
Moldova,6/30/21,256734,6194,,,65,,6364.31221605156,,,,,498,MDA,2021/06/30,3,716641,9699
Moldova,7/1/21,256816,6194,,,82,,6366.344956560088,,,,,498,MDA,2021/07/01,0,726970,10329
Moldova,7/2/21,256870,6194,,,54,,6367.683590553508,,,,,498,MDA,2021/07/02,0,726970,0
Monaco,6/4/21,2508,33,,,0,,6390.785852614413,,,,,492,MCO,2021/06/04,0,31774,1745
Monaco,6/8/21,2511,33,,,3,,6398.430333299358,,,,,492,MCO,2021/06/08,0,31774,0
Monaco,6/9/21,2514,33,,,3,,6406.074813984304,,,,,492,MCO,2021/06/09,0,31774,0
Monaco,6/10/21,2516,33,,,2,,6411.171134440933,,,,,492,MCO,2021/06/10,0,31774,0
Monaco,6/11/21,2520,33,,,4,,6421.363775354194,,,,,492,MCO,2021/06/11,0,33965,2191
Monaco,6/12/21,2524,33,,,4,,6431.556416267455,,,,,492,MCO,2021/06/12,0,33965,0
Monaco,6/13/21,2525,33,,,1,,6434.10457649577,,,,,492,MCO,2021/06/13,0,33965,0
Monaco,6/14/21,2526,33,,,1,,6436.652736724085,,,,,492,MCO,2021/06/14,0,33965,0
Monaco,6/15/21,2532,33,,,6,,6451.941698093976,,,,,492,MCO,2021/06/15,0,33965,0
Monaco,6/16/21,2539,33,,,7,,6469.778819692182,,,,,492,MCO,2021/06/16,0,33965,0
Monaco,6/17/21,2545,33,,,6,,6485.067781062073,,,,,492,MCO,2021/06/17,0,33965,0
Monaco,6/18/21,2547,33,,,2,,6490.164101518703,,,,,492,MCO,2021/06/18,0,33965,0
Monaco,6/19/21,2548,33,,,1,,6492.712261747019,,,,,492,MCO,2021/06/19,0,33965,0
Monaco,6/21/21,2549,33,,,1,,6495.260421975334,,,,,492,MCO,2021/06/21,0,33965,0
Monaco,6/22/21,2554,33,,,5,,6508.001223116909,,,,,492,MCO,2021/06/22,0,33965,0
Monaco,6/23/21,2557,33,,,3,,6515.645703801855,,,,,492,MCO,2021/06/23,0,33965,0
Monaco,6/24/21,2562,33,,,5,,6528.386504943431,,,,,492,MCO,2021/06/24,0,33965,0
Monaco,6/25/21,2570,33,,,8,,6548.771786769952,,,,,492,MCO,2021/06/25,0,33965,0
Monaco,6/27/21,2571,33,,,1,,6551.319946998267,,,,,492,MCO,2021/06/27,0,36609,0
Monaco,6/28/21,2575,33,,,4,,6561.512587911528,,,,,492,MCO,2021/06/28,0,36609,0
Monaco,6/29/21,2576,33,,,1,,6564.060748139843,,,,,492,MCO,2021/06/29,0,36609,0
Monaco,6/30/21,2577,33,,,1,,6566.608908368158,,,,,492,MCO,2021/06/30,0,36609,0
Monaco,7/1/21,2580,33,,,3,,6574.253389053104,,,,,492,MCO,2021/07/01,0,36609,0
Monaco,7/2/21,2586,33,,,6,,6589.542350422995,,,,,492,MCO,2021/07/02,0,36609,0
Mongolia,6/4/21,63978,307,,,1393,,1951.5650222737938,,,,,496,MNG,2021/06/04,6,3358051,52482
Mongolia,6/6/21,66443,313,,,2465,,2026.7566159451324,,,,,496,MNG,2021/06/06,6,3397608,39557
Mongolia,6/7/21,67710,318,,,1267,,2065.404790055309,,,,,496,MNG,2021/06/07,5,3436701,39093
Mongolia,6/9/21,69022,324,,,1312,,2105.4256301757136,,,,,496,MNG,2021/06/09,6,3481129,0
Mongolia,6/10/21,70482,334,,,1460,,2149.9610162853096,,,,,496,MNG,2021/06/10,10,3481129,0
Mongolia,6/11/21,72104,342,,,1622,,2199.4380000317237,,,,,496,MNG,2021/06/11,8,3528572,47443
Mongolia,6/12/21,73896,351,,,1792,,2254.1006109278856,,,,,496,MNG,2021/06/12,9,3534495,5923
Mongolia,6/13/21,76084,365,,,2188,,2320.8426827140474,,,,,496,MNG,2021/06/13,14,3538289,3794
Mongolia,6/14/21,78347,369,,,2263,,2389.872531183921,,,,,496,MNG,2021/06/14,4,3552788,14499
Mongolia,6/15/21,83128,389,,,4781,,2535.7106688482904,,,,,496,MNG,2021/06/15,20,3565805,13017
Mongolia,6/16/21,85770,400,,,2642,,2616.30141549319,,,,,496,MNG,2021/06/16,11,3565805,0
Mongolia,6/17/21,88516,411,,,2746,,2700.06454580617,,,,,496,MNG,2021/06/17,11,3588146,22341
Mongolia,6/18/21,91151,425,,,2635,,2780.4417666272557,,,,,496,MNG,2021/06/18,14,3588146,0
Mongolia,6/20/21,93551,436,,,2400,,2853.650620506044,,,,,496,MNG,2021/06/20,11,3599557,11411
Mongolia,6/21/21,98050,459,,,4499,,2990.8867178396554,,,,,496,MNG,2021/06/21,23,3627620,28063
Mongolia,6/23/21,102629,482,,,4579,,3130.56311030256,,,,,496,MNG,2021/06/23,23,3645291,12069
Mongolia,6/24/21,104900,493,,,2271,,3199.836988285363,,,,,496,MNG,2021/06/24,11,3645291,0
Mongolia,6/25/21,107262,505,,,2362,,3271.886701977737,,,,,496,MNG,2021/06/25,12,3645291,0
Mongolia,6/26/21,109694,518,,,2432,,3346.0716739082422,,,,,496,MNG,2021/06/26,13,3672281,26990
Mongolia,6/27/21,111505,533,,,1811,,3401.3138548976112,,,,,496,MNG,2021/06/27,15,3682742,10461
Mongolia,6/29/21,113232,548,,,1727,,3453.9937260012225,,,,,496,MNG,2021/06/29,15,3720002,0
Mongolia,6/30/21,115478,563,,,2246,,3522.505011756122,,,,,496,MNG,2021/06/30,15,3720002,0
Mongolia,7/1/21,120339,592,,,4861,,3670.783444549784,,,,,496,MNG,2021/07/01,29,3788394,68392
Mongolia,7/2/21,120339,592,,,0,,3670.783444549784,,,,,496,MNG,2021/07/02,0,3810163,21769
Montenegro,6/4/21,99758,1591,,,41,,15883.463734472074,,,,,499,MNE,2021/06/04,4,234278,4475
Montenegro,6/5/21,99791,1591,,,33,,15888.717992809627,,,,,499,MNE,2021/06/05,0,234278,0
Montenegro,6/6/21,99812,1592,,,21,,15892.061611751706,,,,,499,MNE,2021/06/06,1,242070,7792
Montenegro,6/7/21,99834,1594,,,22,,15895.564450643407,,,,,499,MNE,2021/06/07,2,244138,2068
Montenegro,6/8/21,99848,1596,,,14,,15897.793529938128,,,,,499,MNE,2021/06/08,2,248522,4384
Montenegro,6/9/21,99867,1596,,,19,,15900.81870898096,,,,,499,MNE,2021/06/09,0,252253,3731
Montenegro,6/10/21,99890,1596,,,23,,15904.480767822284,,,,,499,MNE,2021/06/10,0,252253,0
Montenegro,6/11/21,99914,1597,,,24,,15908.302046613233,,,,,499,MNE,2021/06/11,1,259428,7175
Montenegro,6/12/21,99928,1598,,,14,,15910.531125907952,,,,,499,MNE,2021/06/12,1,261294,1866
Montenegro,6/13/21,99956,1601,,,28,,15914.989284497391,,,,,499,MNE,2021/06/13,3,261294,0
Montenegro,6/14/21,99964,1602,,,8,,15916.263044094372,,,,,499,MNE,2021/06/14,1,263433,2139
Montenegro,6/15/21,99988,1602,,,24,,15920.084322885321,,,,,499,MNE,2021/06/15,0,265964,2531
Montenegro,6/16/21,100001,1603,,,13,,15922.154182230417,,,,,499,MNE,2021/06/16,1,265964,0
Montenegro,6/17/21,100020,1604,,,19,,15925.17936127325,,,,,499,MNE,2021/06/17,1,270237,4273
Montenegro,6/18/21,100036,1605,,,16,,15927.726880467215,,,,,499,MNE,2021/06/18,1,270237,0
Montenegro,6/19/21,100055,1605,,,19,,15930.752059510049,,,,,499,MNE,2021/06/19,0,272636,2399
Montenegro,6/20/21,100075,1605,,,20,,15933.936458502505,,,,,499,MNE,2021/06/20,0,274514,1878
Montenegro,6/21/21,100092,1605,,,17,,15936.643197646092,,,,,499,MNE,2021/06/21,0,276374,1860
Montenegro,6/22/21,100104,1606,,,12,,15938.553837041565,,,,,499,MNE,2021/06/22,1,278146,1772
Montenegro,6/23/21,100117,1608,,,13,,15940.623696386663,,,,,499,MNE,2021/06/23,2,279639,1493
Montenegro,6/24/21,100131,1609,,,14,,15942.852775681382,,,,,499,MNE,2021/06/24,1,279639,0
Montenegro,6/25/21,100145,1609,,,14,,15945.0818549761,,,,,499,MNE,2021/06/25,0,281741,2102
Montenegro,6/26/21,100168,1609,,,23,,15948.743913817425,,,,,499,MNE,2021/06/26,0,281741,0
Montenegro,6/27/21,100190,1609,,,22,,15952.246752709127,,,,,499,MNE,2021/06/27,0,285858,4117
Montenegro,6/28/21,100204,1609,,,14,,15954.475832003847,,,,,499,MNE,2021/06/28,0,286327,469
Montenegro,6/29/21,100230,1610,,,26,,15958.61555069404,,,,,499,MNE,2021/06/29,1,287653,1326
Montenegro,6/30/21,100252,1613,,,22,,15962.118389585741,,,,,499,MNE,2021/06/30,3,288860,1207
Montenegro,7/1/21,100272,1613,,,20,,15965.302788578198,,,,,499,MNE,2021/07/01,0,290246,1386
Montenegro,7/2/21,100292,1613,,,20,,15968.487187570654,,,,,499,MNE,2021/07/02,0,290246,0
Morocco,6/4/21,520769,9169,,,346,,1410.894411295543,,,,,504,MAR,2021/06/04,4,14913162,170370
Morocco,6/5/21,521195,9173,,,426,,1412.0485526119653,,,,,504,MAR,2021/06/05,4,14913162,0
Morocco,6/6/21,521426,9178,,,231,,1412.6743898046732,,,,,504,MAR,2021/06/06,5,15007487,94325
Morocco,6/7/21,521530,9181,,,104,,1412.9561520039877,,,,,504,MAR,2021/06/07,3,15380193,372706
Morocco,6/8/21,522003,9187,,,473,,1414.2376281604845,,,,,504,MAR,2021/06/08,6,15798674,418481
Morocco,6/9/21,522389,9190,,,386,,1415.2833994002474,,,,,504,MAR,2021/06/09,3,16042670,243996
Morocco,6/10/21,522765,9192,,,376,,1416.3020781208456,,,,,504,MAR,2021/06/10,2,16042670,0
Morocco,6/11/21,523165,9202,,,400,,1417.3857788874393,,,,,504,MAR,2021/06/11,10,16409704,367034
Morocco,6/12/21,523620,9207,,,455,,1418.6184885094394,,,,,504,MAR,2021/06/12,5,16457911,48207
Morocco,6/13/21,523890,9211,,,270,,1419.3499865268902,,,,,504,MAR,2021/06/13,4,16457911,0
Morocco,6/14/21,523999,9213,,,109,,1419.645294985787,,,,,504,MAR,2021/06/14,2,16689797,231886
Morocco,6/15/21,524475,9217,,,476,,1420.9348988980335,,,,,504,MAR,2021/06/15,4,16888377,198580
Morocco,6/16/21,524975,9221,,,500,,1422.2895248562756,,,,,504,MAR,2021/06/16,4,16888377,0
Morocco,6/17/21,525443,9225,,,468,,1423.55745475319,,,,,504,MAR,2021/06/17,4,17261906,373529
Morocco,6/18/21,525924,9233,,,481,,1424.860604925019,,,,,504,MAR,2021/06/18,8,17261906,0
Morocco,6/19/21,526363,9237,,,439,,1426.0499665163557,,,,,504,MAR,2021/06/19,4,17431869,169963
Morocco,6/20/21,526651,9238,,,288,,1426.830231068303,,,,,504,MAR,2021/06/20,1,17494081,62212
Morocco,6/21/21,526737,9244,,,86,,1427.0632267331207,,,,,504,MAR,2021/06/21,6,17763775,269694
Morocco,6/22/21,527174,9247,,,437,,1428.2471698206243,,,,,504,MAR,2021/06/22,3,18045561,281786
Morocco,6/23/21,527696,9254,,,522,,1429.661399321029,,,,,504,MAR,2021/06/23,7,18251766,206205
Morocco,6/24/21,528180,9265,,,484,,1430.9726772486074,,,,,504,MAR,2021/06/24,11,18251766,0
Morocco,6/25/21,528731,9268,,,551,,1432.4654750545901,,,,,504,MAR,2021/06/25,3,18432231,180465
Morocco,6/26/21,529224,9273,,,493,,1433.8011362494167,,,,,504,MAR,2021/06/26,5,18605356,173125
Morocco,6/27/21,529676,9277,,,452,,1435.0257181156676,,,,,504,MAR,2021/06/27,4,18645063,39707
Morocco,6/28/21,529895,9283,,,219,,1435.6190442853776,,,,,504,MAR,2021/06/28,6,18862912,217849
Morocco,6/29/21,530585,9292,,,690,,1437.4884281077518,,,,,504,MAR,2021/06/29,9,18862912,0
Morocco,6/30/21,531361,9296,,,776,,1439.5908075949435,,,,,504,MAR,2021/06/30,4,19109805,246893
Morocco,7/1/21,532150,9298,,,789,,1441.7284073570495,,,,,504,MAR,2021/07/01,2,19169576,59771
Morocco,7/2/21,532994,9307,,,844,,1444.0150159745622,,,,,504,MAR,2021/07/02,9,19169576,0
Mozambique,6/4/21,71019,837,,,54,,227.22128167469114,,,,,508,MOZ,2021/06/04,0,394312,0
Mozambique,6/5/21,71082,837,,,63,,227.4228466185161,,,,,508,MOZ,2021/06/05,0,394312,0
Mozambique,6/6/21,71114,837,,,32,,227.52522881220497,,,,,508,MOZ,2021/06/06,0,394312,0
Mozambique,6/7/21,71145,838,,,31,,227.62441156234107,,,,,508,MOZ,2021/06/07,1,394312,0
Mozambique,6/8/21,71165,839,,,20,,227.68840043339662,,,,,508,MOZ,2021/06/08,1,394312,0
Mozambique,6/9/21,71239,840,,,74,,227.92515925630215,,,,,508,MOZ,2021/06/09,1,394312,0
Mozambique,6/10/21,71279,840,,,40,,228.05313699841324,,,,,508,MOZ,2021/06/10,0,394930,618
Mozambique,6/11/21,71355,840,,,76,,228.2962947084243,,,,,508,MOZ,2021/06/11,0,394930,0
Mozambique,6/12/21,71461,840,,,106,,228.6354357250187,,,,,508,MOZ,2021/06/12,0,394930,0
Mozambique,6/13/21,71538,841,,,77,,228.88179287858256,,,,,508,MOZ,2021/06/13,1,394930,0
Mozambique,6/14/21,71568,841,,,30,,228.97777618516588,,,,,508,MOZ,2021/06/14,0,394930,0
Mozambique,6/15/21,71651,842,,,83,,229.2433300000464,,,,,508,MOZ,2021/06/15,1,394930,0
Mozambique,6/16/21,71764,844,,,113,,229.60486712151024,,,,,508,MOZ,2021/06/16,2,394930,0
Mozambique,6/17/21,71929,844,,,165,,230.13277530771848,,,,,508,MOZ,2021/06/17,0,394930,0
Mozambique,6/18/21,72123,844,,,194,,230.7534673569573,,,,,508,MOZ,2021/06/18,0,394930,0
Mozambique,6/19/21,72367,847,,,244,,231.53413158383495,,,,,508,MOZ,2021/06/19,3,394930,0
Mozambique,6/20/21,72507,848,,,140,,231.98205368122376,,,,,508,MOZ,2021/06/20,1,394930,0
Mozambique,6/21/21,72577,848,,,70,,232.20601472991817,,,,,508,MOZ,2021/06/21,0,394930,0
Mozambique,6/22/21,72775,852,,,198,,232.83950455336807,,,,,508,MOZ,2021/06/22,4,394930,0
Mozambique,6/23/21,73211,857,,,436,,234.23446194237897,,,,,508,MOZ,2021/06/23,5,394930,0
Mozambique,6/24/21,73652,863,,,441,,235.64541654915377,,,,,508,MOZ,2021/06/24,6,438382,43452
Mozambique,6/25/21,74186,865,,,534,,237.35391940633684,,,,,508,MOZ,2021/06/25,2,438382,0
Mozambique,6/26/21,74704,867,,,518,,239.0112311666755,,,,,508,MOZ,2021/06/26,2,438382,0
Mozambique,6/27/21,75138,868,,,434,,240.39978966858084,,,,,508,MOZ,2021/06/27,1,438382,0
Mozambique,6/28/21,75422,869,,,284,,241.30843163756958,,,,,508,MOZ,2021/06/28,1,438382,0
Mozambique,6/29/21,75828,872,,,406,,242.6074057199972,,,,,508,MOZ,2021/06/29,3,438382,0
Mozambique,6/30/21,76404,878,,,576,,244.4502852063969,,,,,508,MOZ,2021/06/30,6,438382,0
Mozambique,7/1/21,77205,884,,,801,,247.01303949217152,,,,,508,MOZ,2021/07/01,6,438382,0
Mozambique,7/2/21,78074,885,,,869,,249.793355939535,,,,,508,MOZ,2021/07/02,1,438382,0
Namibia,6/4/21,57577,899,,,596,,2265.9938384425145,,,,,516,NAM,2021/06/04,22,85243,2336
Namibia,6/5/21,58057,905,,,480,,2284.884663640986,,,,,516,NAM,2021/06/05,6,85243,0
Namibia,6/6/21,58707,912,,,650,,2310.4659894305832,,,,,516,NAM,2021/06/06,7,87457,2214
Namibia,6/7/21,59092,920,,,385,,2325.618005475191,,,,,516,NAM,2021/06/07,8,87457,0
Namibia,6/8/21,59814,936,,,722,,2354.0329550445585,,,,,516,NAM,2021/06/08,16,90718,3261
Namibia,6/9/21,60329,950,,,515,,2374.301236247086,,,,,516,NAM,2021/06/09,14,90718,0
Namibia,6/10/21,61374,968,,,1045,,2415.4281369395917,,,,,516,NAM,2021/06/10,18,93061,2343
Namibia,6/11/21,62806,973,,,1432,,2471.785765448366,,,,,516,NAM,2021/06/11,5,96433,3372
Namibia,6/12/21,64205,993,,,1399,,2526.844649724745,,,,,516,NAM,2021/06/12,20,96433,0
Namibia,6/13/21,65089,995,,,884,,2561.635252798597,,,,,516,NAM,2021/06/13,2,96433,0
Namibia,6/14/21,65815,1008,,,726,,2590.2076259112855,,,,,516,NAM,2021/06/14,13,102549,6116
Namibia,6/15/21,67021,1040,,,1206,,2637.670824222446,,,,,516,NAM,2021/06/15,32,103605,1056
Namibia,6/16/21,69096,1073,,,2075,,2719.334287320006,,,,,516,NAM,2021/06/16,33,103605,0
Namibia,6/17/21,70112,1107,,,1016,,2759.319867323438,,,,,516,NAM,2021/06/17,34,116733,13128
Namibia,6/18/21,71761,1134,,,1649,,2824.2177230573543,,,,,516,NAM,2021/06/18,27,116733,0
Namibia,6/20/21,73164,1161,,,1403,,2879.434030877054,,,,,516,NAM,2021/06/20,27,123954,2942
Namibia,6/21/21,75766,1179,,,2602,,2981.838045807103,,,,,516,NAM,2021/06/21,18,124460,506
Namibia,6/23/21,77333,1224,,,1567,,3043.508718902947,,,,,516,NAM,2021/06/23,45,124460,0
Namibia,6/24/21,78723,1279,,,1390,,3098.2134002068547,,,,,516,NAM,2021/06/24,55,124460,0
Namibia,6/25/21,81270,1305,,,2547,,3198.452841416245,,,,,516,NAM,2021/06/25,26,132060,7600
Namibia,6/26/21,83698,1345,,,2428,,3294.008932211848,,,,,516,NAM,2021/06/26,40,135058,2998
Namibia,6/27/21,84705,1400,,,1007,,3333.6403092428086,,,,,516,NAM,2021/06/27,55,141164,6106
Namibia,6/28/21,86649,1445,,,1944,,3410.148151296619,,,,,516,NAM,2021/06/28,45,141164,0
Namibia,6/30/21,89917,1521,,,3268,,3538.7631861895475,,,,,516,NAM,2021/06/30,76,141164,0
Namibia,7/1/21,91208,1556,,,1291,,3589.5716347962702,,,,,516,NAM,2021/07/01,35,145957,4793
Namibia,7/2/21,92869,1586,,,1661,,3654.9417611601484,,,,,516,NAM,2021/07/02,30,145957,0
Nepal,6/4/21,581560,7731,,,4624,,1995.9633189744052,,,,,524,NPL,2021/06/04,101,2827243,0
Nepal,6/5/21,585100,7799,,,3540,,2008.1128996697237,,,,,524,NPL,2021/06/05,68,2827243,0
Nepal,6/6/21,588124,7898,,,3024,,2018.491524534877,,,,,524,NPL,2021/06/06,99,2804574,-22669
Nepal,6/7/21,591494,7990,,,3370,,2030.0576507900248,,,,,524,NPL,2021/06/07,92,2804574,0
Nepal,6/8/21,595364,8098,,,3870,,2043.3398195162627,,,,,524,NPL,2021/06/08,108,2804574,0
Nepal,6/9/21,598813,8179,,,3449,,2055.177080481843,,,,,524,NPL,2021/06/09,81,2861314,56740
Nepal,6/10/21,601687,8238,,,2874,,2065.040892605669,,,,,524,NPL,2021/06/10,59,2861314,0
Nepal,6/11/21,604396,8305,,,2709,,2074.3384107140355,,,,,524,NPL,2021/06/11,67,2936113,74799
Nepal,6/12/21,606778,8366,,,2382,,2082.513637046309,,,,,524,NPL,2021/06/12,61,3074592,138479
Nepal,6/13/21,608472,8412,,,1694,,2088.3275889383626,,,,,524,NPL,2021/06/13,46,3074592,0
Nepal,6/14/21,610521,8465,,,2049,,2095.3599309848905,,,,,524,NPL,2021/06/14,53,3074592,0
Nepal,6/15/21,612202,8506,,,1681,,2101.1292657726954,,,,,524,NPL,2021/06/15,41,3129621,55029
Nepal,6/16/21,614216,8558,,,2014,,2108.041484846247,,,,,524,NPL,2021/06/16,52,3129621,0
Nepal,6/17/21,615984,8597,,,1768,,2114.1094110240215,,,,,524,NPL,2021/06/17,39,3153419,23798
Nepal,6/18/21,617947,8641,,,1963,,2120.8465937655214,,,,,524,NPL,2021/06/18,44,3153419,0
Nepal,6/19/21,619635,8675,,,1688,,2126.639953147922,,,,,524,NPL,2021/06/19,34,3153419,0
Nepal,6/20/21,621056,8726,,,1421,,2131.5169458507603,,,,,524,NPL,2021/06/20,51,3231849,78430
Nepal,6/21/21,622640,8772,,,1584,,2136.953368399174,,,,,524,NPL,2021/06/21,46,3231849,0
Nepal,6/22/21,626343,8813,,,3703,,2149.662378940068,,,,,524,NPL,2021/06/22,41,3231849,0
Nepal,6/23/21,627854,8894,,,1511,,2154.848259287702,,,,,524,NPL,2021/06/23,81,3231849,0
Nepal,6/24/21,629431,8918,,,1577,,2160.2606572415207,,,,,524,NPL,2021/06/24,24,3232604,755
Nepal,6/25/21,631152,8945,,,1721,,2166.167275427013,,,,,524,NPL,2021/06/25,27,3232604,0
Nepal,6/26/21,632326,8975,,,1174,,2170.196543149133,,,,,524,NPL,2021/06/26,30,3232604,0
Nepal,6/27/21,633679,9009,,,1353,,2174.840154075903,,,,,524,NPL,2021/06/27,34,3333921,101317
Nepal,6/28/21,635188,9051,,,1509,,2180.019170253653,,,,,524,NPL,2021/06/28,42,3339983,6062
Nepal,6/29/21,636916,9071,,,1728,,2185.9498130337406,,,,,524,NPL,2021/06/29,20,3354095,14112
Nepal,6/30/21,638805,9112,,,1889,,2192.4330214895194,,,,,524,NPL,2021/06/30,41,3356335,2240
Nepal,7/1/21,640662,9145,,,1857,,2198.806403227148,,,,,524,NPL,2021/07/01,33,3361468,5133
Nepal,7/2/21,642053,9179,,,1391,,2203.5804333817214,,,,,524,NPL,2021/07/02,34,3361468,0
Netherlands,6/4/21,1686778,17940,,,2404,,9844.123151656859,,,,,528,NLD,2021/06/04,8,10109509,175196
Netherlands,6/5/21,1688925,17950,,,2147,,9856.653154067732,,,,,528,NLD,2021/06/05,10,10277859,168350
Netherlands,6/6/21,1690481,17954,,,1556,,9865.734050086045,,,,,528,NLD,2021/06/06,4,10444475,166616
Netherlands,6/7/21,1691866,17957,,,1385,,9873.81698131057,,,,,528,NLD,2021/06/07,3,10444475,0
Netherlands,6/8/21,1693302,17972,,,1436,,9882.197551157806,,,,,528,NLD,2021/06/08,15,10444475,0
Netherlands,6/9/21,1695034,17977,,,1732,,9892.305592227032,,,,,528,NLD,2021/06/09,5,11145074,700599
Netherlands,6/10/21,1696609,17983,,,1575,,9901.497373222433,,,,,528,NLD,2021/06/10,6,11395454,250380
Netherlands,6/11/21,1697999,17986,,,1390,,9909.609484704088,,,,,528,NLD,2021/06/11,3,11395454,0
Netherlands,6/12/21,1699213,17987,,,1214,,9916.694451134828,,,,,528,NLD,2021/06/12,1,11395454,0
Netherlands,6/13/21,1700260,17989,,,1047,,9922.804796977485,,,,,528,NLD,2021/06/13,2,11395454,0
Netherlands,6/14/21,1701124,17993,,,864,,9927.847145409249,,,,,528,NLD,2021/06/14,4,11395454,0
Netherlands,6/15/21,1702174,17994,,,1050,,9933.974999406182,,,,,528,NLD,2021/06/15,1,12651035,1255581
Netherlands,6/16/21,1703218,17998,,,1044,,9940.06783709456,,,,,528,NLD,2021/06/16,4,12862499,211464
Netherlands,6/17/21,1704305,18001,,,1087,,9946.411624994244,,,,,528,NLD,2021/06/17,3,13067373,204874
Netherlands,6/18/21,1705206,18004,,,901,,9951.669907328756,,,,,528,NLD,2021/06/18,3,13269681,202308
Netherlands,6/19/21,1705905,18007,,,699,,9955.749307275286,,,,,528,NLD,2021/06/19,3,13472247,202566
Netherlands,6/20/21,1706611,18007,,,706,,9959.869559581795,,,,,528,NLD,2021/06/20,0,13472247,0
Netherlands,6/21/21,1707181,18008,,,570,,9963.196108894417,,,,,528,NLD,2021/06/21,1,13875172,402925
Netherlands,6/22/21,1707881,18011,,,700,,9967.281344892372,,,,,528,NLD,2021/06/22,3,14075757,200585
Netherlands,6/23/21,1708539,18015,,,658,,9971.12146673045,,,,,528,NLD,2021/06/23,4,14075757,0
Netherlands,6/24/21,1709261,18018,,,722,,9975.335095859771,,,,,528,NLD,2021/06/24,3,14148869,73112
Netherlands,6/25/21,1709911,18023,,,650,,9979.128529286445,,,,,528,NLD,2021/06/25,5,14680637,531768
Netherlands,6/26/21,1710474,18023,,,563,,9982.414226239085,,,,,528,NLD,2021/06/26,0,14896699,216062
Netherlands,6/27/21,1710973,18024,,,499,,9985.326415900485,,,,,528,NLD,2021/06/27,1,14896699,0
Netherlands,6/28/21,1711545,18024,,,572,,9988.664637315958,,,,,528,NLD,2021/06/28,0,15342995,446296
Netherlands,6/29/21,1712100,18028,,,555,,9991.903645857194,,,,,528,NLD,2021/06/29,4,15553035,210040
Netherlands,6/30/21,1712747,18028,,,647,,9995.67957112959,,,,,528,NLD,2021/06/30,0,15764668,211633
Netherlands,7/1/21,1713576,18031,,,829,,10000.517657761455,,,,,528,NLD,2021/07/01,3,15974932,210264
Netherlands,7/2/21,1714524,18038,,,948,,10006.050234512972,,,,,528,NLD,2021/07/02,7,15974932,0
New Zealand,6/4/21,2683,26,,,0,,55.63812449543604,,,,,554,NZL,2021/06/04,0,668115,0
New Zealand,6/7/21,2693,26,,,10,,55.84549730384243,,,,,554,NZL,2021/06/07,0,668115,0
New Zealand,6/8/21,2697,26,,,4,,55.92844642720499,,,,,554,NZL,2021/06/08,0,775444,107329
New Zealand,6/9/21,2698,26,,,1,,55.94918370804563,,,,,554,NZL,2021/06/09,0,775444,0
New Zealand,6/10/21,2703,26,,,5,,56.052870112248826,,,,,554,NZL,2021/06/10,0,775444,0
New Zealand,6/12/21,2709,26,,,6,,56.17729379729266,,,,,554,NZL,2021/06/12,0,775444,0
New Zealand,6/13/21,2710,26,,,1,,56.198031078133305,,,,,554,NZL,2021/06/13,0,775444,0
New Zealand,6/15/21,2712,26,,,2,,56.23950563981458,,,,,554,NZL,2021/06/15,0,891702,116258
New Zealand,6/16/21,2714,26,,,2,,56.280980201495865,,,,,554,NZL,2021/06/16,0,891702,0
New Zealand,6/17/21,2715,26,,,1,,56.3017174823365,,,,,554,NZL,2021/06/17,0,891702,0
New Zealand,6/19/21,2719,26,,,4,,56.38466660569906,,,,,554,NZL,2021/06/19,0,891702,0
New Zealand,6/20/21,2721,26,,,2,,56.426141167380344,,,,,554,NZL,2021/06/20,0,891702,0
New Zealand,6/22/21,2724,26,,,3,,56.48835300990226,,,,,554,NZL,2021/06/22,0,1019364,127662
New Zealand,6/24/21,2726,26,,,2,,56.52982757158354,,,,,554,NZL,2021/06/24,0,1019364,0
New Zealand,6/25/21,2730,26,,,4,,56.6127766949461,,,,,554,NZL,2021/06/25,0,1019364,0
New Zealand,6/27/21,2739,26,,,9,,56.799412222511855,,,,,554,NZL,2021/06/27,0,1019364,0
New Zealand,6/28/21,2742,26,,,3,,56.86162406503377,,,,,554,NZL,2021/06/28,0,1019364,0
New Zealand,6/29/21,2743,26,,,1,,56.882361345874415,,,,,554,NZL,2021/06/29,0,1149608,130244
New Zealand,7/2/21,2743,26,,,0,,56.882361345874415,,,,,554,NZL,2021/07/02,0,1149608,0
Nicaragua,6/4/21,7481,187,,,0,,112.9283571392127,,,,,558,NIC,2021/06/04,0,167500,0
Nicaragua,6/8/21,7662,188,,,181,,115.66061654867633,,,,,558,NIC,2021/06/08,1,167500,0
Nicaragua,6/15/21,7696,188,,,34,,116.1738586476916,,,,,558,NIC,2021/06/15,0,167500,0
Nicaragua,6/22/21,7920,189,,,224,,119.55521835885102,,,,,558,NIC,2021/06/22,1,167500,0
Nicaragua,6/29/21,8178,191,,,258,,123.44982016902571,,,,,558,NIC,2021/06/29,2,167500,0
Nicaragua,7/2/21,8178,191,,,0,,123.44982016902571,,,,,558,NIC,2021/07/02,0,167500,0
Niger,6/4/21,5431,192,,,15,,22.43599647633814,,,,,562,NER,2021/06/04,0,,
Niger,6/5/21,5438,192,,,7,,22.464914166512028,,,,,562,NER,2021/06/05,0,,
Niger,6/6/21,5439,192,,,1,,22.469045265108296,,,,,562,NER,2021/06/06,0,,
Niger,6/8/21,5440,192,,,1,,22.473176363704564,,,,,562,NER,2021/06/08,0,,
Niger,6/10/21,5444,192,,,4,,22.48970075808964,,,,,562,NER,2021/06/10,0,,
Niger,6/11/21,5446,192,,,2,,22.49796295528218,,,,,562,NER,2021/06/11,0,,
Niger,6/14/21,5452,192,,,6,,22.522749546859796,,,,,562,NER,2021/06/14,0,,
Niger,6/16/21,5455,192,,,3,,22.535142842648604,,,,,562,NER,2021/06/16,0,,
Niger,6/17/21,5457,193,,,2,,22.54340503984114,,,,,562,NER,2021/06/17,1,,
Niger,6/18/21,5459,193,,,2,,22.55166723703368,,,,,562,NER,2021/06/18,0,,
Niger,6/19/21,5469,193,,,10,,22.592978222996372,,,,,562,NER,2021/06/19,0,,
Niger,6/23/21,5472,193,,,3,,22.60537151878518,,,,,562,NER,2021/06/23,0,,
Niger,6/24/21,5475,193,,,3,,22.617764814573988,,,,,562,NER,2021/06/24,0,,
Niger,6/25/21,5478,193,,,3,,22.630158110362796,,,,,562,NER,2021/06/25,0,,
Niger,6/27/21,5479,193,,,1,,22.634289208959064,,,,,562,NER,2021/06/27,0,,
Niger,6/28/21,5480,193,,,1,,22.638420307555332,,,,,562,NER,2021/06/28,0,,
Niger,6/29/21,5488,193,,,8,,22.671469096325488,,,,,562,NER,2021/06/29,0,,
Niger,6/30/21,5489,193,,,1,,22.675600194921756,,,,,562,NER,2021/06/30,0,,
Niger,7/1/21,5492,193,,,3,,22.687993490710564,,,,,562,NER,2021/07/01,0,,
Niger,7/2/21,5492,193,,,0,,22.687993490710564,,,,,562,NER,2021/07/02,0,,
Nigeria,6/4/21,166730,2117,,,48,,80.88208695208068,,,,,566,NGA,2021/06/04,0,2110141,0
Nigeria,6/5/21,166756,2117,,,26,,80.89469976477638,,,,,566,NGA,2021/06/05,0,2110141,0
Nigeria,6/6/21,166767,2117,,,11,,80.90003595476303,,,,,566,NGA,2021/06/06,0,2225765,115624
Nigeria,6/7/21,166816,2117,,,49,,80.9238062556126,,,,,566,NGA,2021/06/07,0,2225765,0
Nigeria,6/8/21,166918,2117,,,102,,80.97328729003421,,,,,566,NGA,2021/06/08,0,2225765,0
Nigeria,6/9/21,166982,2117,,,64,,81.00433421359286,,,,,566,NGA,2021/06/09,0,2225765,0
Nigeria,6/11/21,167051,2117,,,69,,81.03780667805452,,,,,566,NGA,2021/06/11,0,2225765,0
Nigeria,6/12/21,167059,2117,,,8,,81.04168754349935,,,,,566,NGA,2021/06/12,0,2225765,0
Nigeria,6/13/21,167066,2117,,,7,,81.04508330076358,,,,,566,NGA,2021/06/13,0,2225765,0
Nigeria,6/14/21,167078,2117,,,12,,81.05090459893083,,,,,566,NGA,2021/06/14,0,2300488,74723
Nigeria,6/15/21,167095,2117,,,17,,81.05915143800108,,,,,566,NGA,2021/06/15,0,2326963,26475
Nigeria,6/16/21,167103,2117,,,8,,81.06303230344592,,,,,566,NGA,2021/06/16,0,2326963,0
Nigeria,6/17/21,167142,2117,,,39,,81.08195152248946,,,,,566,NGA,2021/06/17,0,2326963,0
Nigeria,6/18/21,167155,2117,,,13,,81.08825792883732,,,,,566,NGA,2021/06/18,0,2617551,290588
Nigeria,6/19/21,167206,2117,,,51,,81.11299844604811,,,,,566,NGA,2021/06/19,0,2617551,0
Nigeria,6/21/21,167292,2118,,,86,,81.15471774958004,,,,,566,NGA,2021/06/21,1,2909674,0
Nigeria,6/22/21,167331,2118,,,39,,81.1736369686236,,,,,566,NGA,2021/06/22,0,2909674,0
Nigeria,6/23/21,167375,2118,,,44,,81.19498172857017,,,,,566,NGA,2021/06/23,0,2909674,0
Nigeria,6/24/21,167401,2118,,,26,,81.20759454126586,,,,,566,NGA,2021/06/24,0,3104802,195128
Nigeria,6/25/21,167430,2119,,,29,,81.22166267850338,,,,,566,NGA,2021/06/25,1,3104802,0
Nigeria,6/26/21,167465,2119,,,35,,81.23864146482451,,,,,566,NGA,2021/06/26,0,3104802,0
Nigeria,6/27/21,167467,2119,,,2,,81.23961168118572,,,,,566,NGA,2021/06/27,0,3104802,0
Nigeria,6/28/21,167532,2119,,,65,,81.27114371292497,,,,,566,NGA,2021/06/28,0,3397472,292670
Nigeria,6/29/21,167543,2120,,,11,,81.27647990291162,,,,,566,NGA,2021/06/29,1,3397472,0
Nigeria,6/30/21,167618,2120,,,75,,81.3128630164569,,,,,566,NGA,2021/06/30,0,3397472,0
Nigeria,7/1/21,167692,2121,,,74,,81.34876102182159,,,,,566,NGA,2021/07/01,1,3397472,0
Nigeria,7/2/21,167732,2121,,,40,,81.36816534904574,,,,,566,NGA,2021/07/02,0,3397472,0
North Macedonia,6/4/21,155379,5442,,,15,,7458.024940241338,,,,,807,MKD,2021/06/04,7,331034,0
North Macedonia,6/5/21,155407,5448,,,28,,7459.3689101364125,,,,,807,MKD,2021/06/05,6,369661,38627
North Macedonia,6/6/21,155417,5455,,,10,,7459.848899384654,,,,,807,MKD,2021/06/06,7,384466,14805
North Macedonia,6/7/21,155418,5458,,,1,,7459.896898309478,,,,,807,MKD,2021/06/07,3,399962,15496
North Macedonia,6/8/21,155441,5462,,,23,,7461.000873580432,,,,,807,MKD,2021/06/08,4,399962,0
North Macedonia,6/9/21,155469,5467,,,28,,7462.344843475506,,,,,807,MKD,2021/06/09,5,399962,0
North Macedonia,6/10/21,155487,5468,,,18,,7463.20882412234,,,,,807,MKD,2021/06/10,1,399962,0
North Macedonia,6/11/21,155507,5470,,,20,,7464.168802618821,,,,,807,MKD,2021/06/11,2,431174,31212
North Macedonia,6/12/21,155528,5471,,,21,,7465.176780040127,,,,,807,MKD,2021/06/12,1,431174,0
North Macedonia,6/13/21,155536,5471,,,8,,7465.56077143872,,,,,807,MKD,2021/06/13,0,431174,0
North Macedonia,6/14/21,155540,5472,,,4,,7465.752767138016,,,,,807,MKD,2021/06/14,1,442928,11754
North Macedonia,6/15/21,155568,5472,,,28,,7467.096737033091,,,,,807,MKD,2021/06/15,0,452424,9496
North Macedonia,6/16/21,155583,5472,,,15,,7467.816720905452,,,,,807,MKD,2021/06/16,0,452424,0
North Macedonia,6/17/21,155593,5472,,,10,,7468.296710153692,,,,,807,MKD,2021/06/17,0,462415,9991
North Macedonia,6/18/21,155612,5474,,,19,,7469.20868972535,,,,,807,MKD,2021/06/18,2,462415,0
North Macedonia,6/19/21,155616,5475,,,4,,7469.400685424646,,,,,807,MKD,2021/06/19,1,462415,0
North Macedonia,6/20/21,155624,5475,,,8,,7469.784676823239,,,,,807,MKD,2021/06/20,0,473853,11438
North Macedonia,6/21/21,155627,5477,,,3,,7469.928673597711,,,,,807,MKD,2021/06/21,2,473853,0
North Macedonia,6/22/21,155640,5477,,,13,,7470.5526596204245,,,,,807,MKD,2021/06/22,0,482058,8205
North Macedonia,6/23/21,155645,5478,,,5,,7470.792654244545,,,,,807,MKD,2021/06/23,1,488010,5952
North Macedonia,6/24/21,155655,5481,,,10,,7471.272643492785,,,,,807,MKD,2021/06/24,3,494909,6899
North Macedonia,6/25/21,155663,5484,,,8,,7471.656634891378,,,,,807,MKD,2021/06/25,3,494909,0
North Macedonia,6/26/21,155669,5484,,,6,,7471.944628440323,,,,,807,MKD,2021/06/26,0,501506,6597
North Macedonia,6/27/21,155673,5484,,,4,,7472.136624139619,,,,,807,MKD,2021/06/27,0,510351,8845
North Macedonia,6/28/21,155676,5484,,,3,,7472.280620914092,,,,,807,MKD,2021/06/28,0,510351,0
North Macedonia,6/29/21,155682,5484,,,6,,7472.568614463036,,,,,807,MKD,2021/06/29,0,542699,32348
North Macedonia,6/30/21,155684,5484,,,2,,7472.664612312684,,,,,807,MKD,2021/06/30,0,542699,0
North Macedonia,7/1/21,155689,5485,,,5,,7472.904606936805,,,,,807,MKD,2021/07/01,1,557400,14701
North Macedonia,7/2/21,155700,5486,,,11,,7473.43259510987,,,,,807,MKD,2021/07/02,1,557400,0
Norway,6/4/21,126521,785,,,303,,2333.800999844685,,,,,578,NOR,2021/06/04,0,2915249,128541
Norway,6/5/21,126689,785,,,168,,2336.899920719274,,,,,578,NOR,2021/06/05,0,2915249,0
Norway,6/6/21,126817,785,,,128,,2339.26100329039,,,,,578,NOR,2021/06/06,0,2915249,0
Norway,6/7/21,127066,784,,,249,,2343.8540467295134,,,,,578,NOR,2021/06/07,,2969238,53989
Norway,6/8/21,127254,784,,,188,,2347.3218867558394,,,,,578,NOR,2021/06/08,0,3012227,42989
Norway,6/9/21,127466,789,,,212,,2351.2324297642494,,,,,578,NOR,2021/06/09,5,3059225,46998
Norway,6/10/21,127676,789,,,210,,2355.106080857486,,,,,578,NOR,2021/06/10,0,3059225,0
Norway,6/11/21,127874,789,,,198,,2358.7583804596807,,,,,578,NOR,2021/06/11,0,3254605,195380
Norway,6/12/21,127986,789,,,112,,2360.8243277094066,,,,,578,NOR,2021/06/12,0,3254605,0
Norway,6/13/21,128046,789,,,60,,2361.9310851646173,,,,,578,NOR,2021/06/13,0,3308578,53973
Norway,6/14/21,128277,789,,,231,,2366.1921013671777,,,,,578,NOR,2021/06/14,0,3329402,20824
Norway,6/15/21,128499,789,,,222,,2370.287103951456,,,,,578,NOR,2021/06/15,0,3371095,41693
Norway,6/16/21,128679,790,,,180,,2373.6073763170875,,,,,578,NOR,2021/06/16,1,3371095,0
Norway,6/17/21,128898,790,,,219,,2377.6470410286056,,,,,578,NOR,2021/06/17,0,3476369,105274
Norway,6/18/21,129095,790,,,197,,2381.2808946732134,,,,,578,NOR,2021/06/18,0,3560819,84450
Norway,6/19/21,129225,790,,,130,,2383.6788691595025,,,,,578,NOR,2021/06/19,0,3560819,0
Norway,6/20/21,129333,790,,,108,,2385.6710325788813,,,,,578,NOR,2021/06/20,0,3634363,73544
Norway,6/21/21,129545,790,,,212,,2389.581575587292,,,,,578,NOR,2021/06/21,0,3634363,0
Norway,6/22/21,129766,790,,,221,,2393.6581322139837,,,,,578,NOR,2021/06/22,0,3706751,72388
Norway,6/23/21,129944,792,,,178,,2396.9415126644412,,,,,578,NOR,2021/06/23,2,3706751,0
Norway,6/24/21,130270,792,,,326,,2402.954894837751,,,,,578,NOR,2021/06/24,0,3908274,201523
Norway,6/25/21,130342,792,,,72,,2404.2830037840035,,,,,578,NOR,2021/06/25,0,3908274,0
Norway,6/26/21,130491,792,,,149,,2407.031451464443,,,,,578,NOR,2021/06/26,0,3908274,0
Norway,6/27/21,130588,792,,,97,,2408.8207093503665,,,,,578,NOR,2021/06/27,0,3908274,0
Norway,6/28/21,130744,792,,,156,,2411.698278733914,,,,,578,NOR,2021/06/28,0,4039501,131227
Norway,6/29/21,131037,792,,,293,,2417.1029443068583,,,,,578,NOR,2021/06/29,0,4090423,50922
Norway,6/30/21,131316,794,,,279,,2422.2493664735866,,,,,578,NOR,2021/06/30,2,4090423,0
Norway,7/1/21,131509,794,,,193,,2425.809436287847,,,,,578,NOR,2021/07/01,0,4183204,92781
Norway,7/2/21,131749,794,,,240,,2430.2364661086885,,,,,578,NOR,2021/07/02,0,4292737,109533
Oman,6/4/21,220702,2385,,,0,,4321.878533402316,,,,,512,OMN,2021/06/04,0,296894,0
Oman,6/6/21,223879,2413,,,3177,,4384.091871299657,,,,,512,OMN,2021/06/06,28,296894,0
Oman,6/7/21,225095,2424,,,1216,,4407.904090022719,,,,,512,OMN,2021/06/07,11,296894,0
Oman,6/8/21,226648,2434,,,1553,,4438.315583178078,,,,,512,OMN,2021/06/08,10,296894,0
Oman,6/9/21,228579,2448,,,1931,,4476.129229850966,,,,,512,OMN,2021/06/09,14,296894,0
Oman,6/10/21,230219,2467,,,1640,,4508.244393260359,,,,,512,OMN,2021/06/10,19,296894,0
Oman,6/13/21,234634,2513,,,4415,,4594.7007630484495,,,,,512,OMN,2021/06/13,46,713262,416368
Oman,6/14/21,236440,2532,,,1806,,4630.066607632208,,,,,512,OMN,2021/06/14,19,605845,-107417
Oman,6/15/21,238566,2565,,,2126,,4671.69882556414,,,,,512,OMN,2021/06/15,33,605845,0
Oman,6/16/21,240708,2591,,,2142,,4713.644362163481,,,,,512,OMN,2021/06/16,26,605845,0
Oman,6/17/21,242723,2626,,,2015,,4753.102931840265,,,,,512,OMN,2021/06/17,35,605845,0
Oman,6/20/21,248043,2710,,,5320,,4857.281388753661,,,,,512,OMN,2021/06/20,84,720199,0
Oman,6/21/21,250572,2741,,,2529,,4906.805320620951,,,,,512,OMN,2021/06/21,31,720199,0
Oman,6/22/21,252609,2782,,,2037,,4946.694703465422,,,,,512,OMN,2021/06/22,41,859000,138801
Oman,6/23/21,254656,2816,,,2047,,4986.779910477024,,,,,512,OMN,2021/06/23,34,859000,0
Oman,6/24/21,256542,2848,,,1886,,5023.712348397826,,,,,512,OMN,2021/06/24,32,859000,0
Oman,6/27/21,262059,2967,,,5517,,5131.748541403691,,,,,512,OMN,2021/06/27,119,859000,0
Oman,6/28/21,264302,3013,,,2243,,5175.67190209105,,,,,512,OMN,2021/06/28,46,1515130,656130
Oman,6/29/21,266536,3056,,,2234,,5219.41902102799,,,,,512,OMN,2021/06/29,43,1064804,-450326
Oman,6/30/21,268545,3100,,,2009,,5258.760096204497,,,,,512,OMN,2021/06/30,44,1064804,0
Oman,7/1/21,270504,3140,,,1959,,5297.122050545351,,,,,512,OMN,2021/07/01,40,1064804,0
Oman,7/2/21,270504,3140,,,0,,5297.122050545351,,,,,512,OMN,2021/07/02,0,1064804,0
Pakistan,6/4/21,930511,21189,,,1923,,421.25093061741467,,,,,586,PAK,2021/06/04,84,7953574,0
Pakistan,6/5/21,932140,21265,,,1629,,421.98839397461927,,,,,586,PAK,2021/06/05,76,7953574,0
Pakistan,6/6/21,933630,21323,,,1490,,422.6629307470163,,,,,586,PAK,2021/06/06,58,8263763,310189
Pakistan,6/7/21,935013,21376,,,1383,,423.28902763038883,,,,,586,PAK,2021/06/07,53,8263763,0
Pakistan,6/8/21,936131,21453,,,1118,,423.79515656430823,,,,,586,PAK,2021/06/08,77,8850889,587126
Pakistan,6/9/21,937434,21529,,,1303,,424.38503670822325,,,,,586,PAK,2021/06/09,76,9559910,709021
Pakistan,6/10/21,938737,21576,,,1303,,424.9749168521382,,,,,586,PAK,2021/06/10,47,9559910,0
Pakistan,6/11/21,939931,21633,,,1194,,425.5154516885423,,,,,586,PAK,2021/06/11,57,9559910,0
Pakistan,6/12/21,941170,21689,,,1239,,426.0763584408913,,,,,586,PAK,2021/06/12,56,10496228,936318
Pakistan,6/13/21,942189,21723,,,1019,,426.53766915973193,,,,,586,PAK,2021/06/13,34,10696402,200174
Pakistan,6/14/21,943027,21782,,,838,,426.9170395055499,,,,,586,PAK,2021/06/14,59,10696402,0
Pakistan,6/15/21,944065,21828,,,1038,,427.3869517000117,,,,,586,PAK,2021/06/15,46,11085787,389385
Pakistan,6/16/21,945184,21874,,,1119,,427.89353334317434,,,,,586,PAK,2021/06/16,46,11085787,0
Pakistan,6/17/21,946227,21913,,,1043,,428.36570908385227,,,,,586,PAK,2021/06/17,39,12483801,1398014
Pakistan,6/18/21,947218,21940,,,991,,428.81434394388276,,,,,586,PAK,2021/06/18,27,12750760,266959
Pakistan,6/20/21,949175,22007,,,1957,,429.70029593286336,,,,,586,PAK,2021/06/20,67,12977740,0
Pakistan,6/21/21,949838,22034,,,663,,430.00044216111786,,,,,586,PAK,2021/06/21,27,12977746,6
Pakistan,6/22/21,950768,22073,,,930,,430.421461757312,,,,,586,PAK,2021/06/22,39,13484364,506618
Pakistan,6/23/21,951865,22108,,,1097,,430.91808379712376,,,,,586,PAK,2021/06/23,35,13484364,0
Pakistan,6/24/21,952907,22152,,,1042,,431.3898068285585,,,,,586,PAK,2021/06/24,44,14165288,680924
Pakistan,6/25/21,953842,22188,,,935,,431.8130899709687,,,,,586,PAK,2021/06/25,36,14165288,0
Pakistan,6/26/21,954743,22211,,,901,,432.2209809991095,,,,,586,PAK,2021/06/26,23,14793793,628505
Pakistan,6/27/21,955657,22231,,,914,,432.6347572474121,,,,,586,PAK,2021/06/27,20,14793793,0
Pakistan,6/28/21,956392,22254,,,735,,432.96749854117843,,,,,586,PAK,2021/06/28,23,14793793,0
Pakistan,6/29/21,957371,22281,,,979,,433.4107008902903,,,,,586,PAK,2021/06/29,27,15581402,787609
Pakistan,6/30/21,958408,22321,,,1037,,433.8801603755089,,,,,586,PAK,2021/06/30,40,159716411,144135009
Pakistan,7/1/21,959685,22345,,,1277,,434.4582700791002,,,,,586,PAK,2021/07/01,24,16356499,-143359912
Pakistan,7/2/21,961085,22379,,,1400,,435.0920630196075,,,,,586,PAK,2021/07/02,34,16714717,358218
Palau,6/4/21,0,0,,,0,,0.0,,,,,585,PLW,2021/06/04,0,24555,0
Palau,7/2/21,0,0,,,0,,0.0,,,,,585,PLW,2021/07/02,0,25358,0
Panama,6/4/21,381122,6389,,,915,,8832.966222054118,,,,,591,PAN,2021/06/04,1,1100689,16833
Panama,6/5/21,381949,6395,,,827,,8852.132953614191,,,,,591,PAN,2021/06/05,6,1100689,0
Panama,6/6/21,382475,6402,,,526,,8864.323643820479,,,,,591,PAN,2021/06/06,7,1100689,0
Panama,6/7/21,382851,6404,,,376,,8873.037901458432,,,,,591,PAN,2021/06/07,2,1100689,0
Panama,6/8/21,383733,6408,,,882,,8893.47932496023,,,,,591,PAN,2021/06/08,4,1143067,42378
Panama,6/9/21,384512,6413,,,779,,8911.533598098438,,,,,591,PAN,2021/06/09,5,1164396,21329
Panama,6/10/21,385353,6419,,,841,,8931.024796698224,,,,,591,PAN,2021/06/10,6,1164396,0
Panama,6/11/21,386269,6427,,,916,,8952.254211582176,,,,,591,PAN,2021/06/11,8,1164396,0
Panama,6/12/21,387127,6439,,,858,,8972.139405873038,,,,,591,PAN,2021/06/12,12,1164396,0
Panama,6/13/21,387842,6444,,,715,,8988.710401115424,,,,,591,PAN,2021/06/13,5,1281550,117154
Panama,6/14/21,388325,6451,,,483,,8999.904513985457,,,,,591,PAN,2021/06/14,7,1281550,0
Panama,6/15/21,389173,6452,,,848,,9019.557946105098,,,,,591,PAN,2021/06/15,1,1327999,46449
Panama,6/16/21,390221,6457,,,1048,,9043.846621649183,,,,,591,PAN,2021/06/16,5,1327999,0
Panama,6/17/21,391190,6458,,,969,,9066.304376040613,,,,,591,PAN,2021/06/17,1,1327999,0
Panama,6/18/21,392166,6465,,,976,,9088.924363951897,,,,,591,PAN,2021/06/18,7,1327999,0
Panama,6/19/21,393144,6468,,,978,,9111.590704297427,,,,,591,PAN,2021/06/19,3,1396100,68101
Panama,6/20/21,393727,6475,,,583,,9125.10243887968,,,,,591,PAN,2021/06/20,7,1412477,16377
Panama,6/21/21,394241,6477,,,514,,9137.015014480501,,,,,591,PAN,2021/06/21,2,1441439,28962
Panama,6/22/21,395449,6483,,,1208,,9165.01188476414,,,,,591,PAN,2021/06/22,6,1441439,0
Panama,6/23/21,396526,6491,,,1077,,9189.97267060477,,,,,591,PAN,2021/06/23,8,1441439,0
Panama,6/24/21,397727,6500,,,1201,,9217.807307368554,,,,,591,PAN,2021/06/24,9,1444047,2608
Panama,6/25/21,398820,6505,,,1093,,9243.138912683138,,,,,591,PAN,2021/06/25,5,1469057,25010
Panama,6/26/21,399877,6514,,,1057,,9267.636174181323,,,,,591,PAN,2021/06/26,9,1469057,0
Panama,6/27/21,400666,6524,,,789,,9285.922209490753,,,,,591,PAN,2021/06/27,10,1469057,0
Panama,6/28/21,401332,6529,,,666,,9301.357570094151,,,,,591,PAN,2021/06/28,5,1518049,48992
Panama,6/29/21,402581,6536,,,1249,,9330.304665279802,,,,,591,PAN,2021/06/29,7,1534248,16199
Panama,6/30/21,403778,6545,,,1197,,9358.046597175096,,,,,591,PAN,2021/06/30,9,1534248,0
Panama,7/1/21,404983,6552,,,1205,,9385.97393880737,,,,,591,PAN,2021/07/01,7,1534248,0
Panama,7/2/21,406013,6560,,,1030,,9409.845442443255,,,,,591,PAN,2021/07/02,8,1534248,0
Papua New Guinea,6/4/21,16185,162,,,0,,180.89807932847415,,,,,598,PNG,2021/06/04,0,11537,0
Papua New Guinea,6/5/21,16258,164,,,73,,181.71399281571408,,,,,598,PNG,2021/06/05,2,11537,0
Papua New Guinea,6/6/21,16327,164,,,69,,182.48519871461212,,,,,598,PNG,2021/06/06,0,21404,0
Papua New Guinea,6/7/21,16374,164,,,47,,183.01051287762962,,,,,598,PNG,2021/06/07,0,21404,0
Papua New Guinea,6/8/21,16398,164,,,24,,183.27875840768112,,,,,598,PNG,2021/06/08,0,38176,0
Papua New Guinea,6/9/21,16580,164,,,182,,185.31295367723826,,,,,598,PNG,2021/06/09,0,38176,0
Papua New Guinea,6/10/21,16621,164,,,41,,185.7712064577429,,,,,598,PNG,2021/06/10,0,38176,0
Papua New Guinea,6/12/21,16661,164,,,40,,186.21828234116205,,,,,598,PNG,2021/06/12,0,38176,0
Papua New Guinea,6/13/21,16682,165,,,21,,186.4529971799571,,,,,598,PNG,2021/06/13,1,38176,0
Papua New Guinea,6/16/21,16791,165,,,109,,187.67127896227427,,,,,598,PNG,2021/06/16,0,38176,0
Papua New Guinea,6/17/21,16799,167,,,8,,187.76069413895812,,,,,598,PNG,2021/06/17,2,38176,0
Papua New Guinea,6/19/21,16933,173,,,134,,189.25839834841227,,,,,598,PNG,2021/06/19,6,38176,0
Papua New Guinea,6/21/21,17013,173,,,80,,190.15255011525056,,,,,598,PNG,2021/06/21,0,38176,0
Papua New Guinea,6/23/21,17079,173,,,66,,190.89022532289218,,,,,598,PNG,2021/06/23,0,38176,0
Papua New Guinea,6/26/21,17098,173,,,19,,191.10258636751627,,,,,598,PNG,2021/06/26,0,38176,0
Papua New Guinea,7/2/21,17098,173,,,0,,191.10258636751627,,,,,598,PNG,2021/07/02,0,51170,0
Paraguay,6/4/21,368183,9609,,,3481,,5162.025256115291,,,,,600,PRY,2021/06/04,111,407644,0
Paraguay,6/5/21,371021,9739,,,2838,,5201.814783814439,,,,,600,PRY,2021/06/05,130,407644,0
Paraguay,6/6/21,373165,9874,,,2144,,5231.87424378166,,,,,600,PRY,2021/06/06,135,407644,0
Paraguay,6/7/21,375996,10005,,,2831,,5271.565629587257,,,,,600,PRY,2021/06/07,131,407644,0
Paraguay,6/8/21,379131,10145,,,3135,,5315.519177627013,,,,,600,PRY,2021/06/08,140,448421,40777
Paraguay,6/9/21,382231,10278,,,3100,,5358.98201619902,,,,,600,PRY,2021/06/09,133,448421,0
Paraguay,6/10/21,384989,10412,,,2758,,5397.6499222576,,,,,600,PRY,2021/06/10,134,448421,0
Paraguay,6/11/21,387687,10561,,,2698,,5435.476612085754,,,,,600,PRY,2021/06/11,149,448421,0
Paraguay,6/12/21,389650,10699,,,1963,,5462.998403091189,,,,,600,PRY,2021/06/12,138,448421,0
Paraguay,6/13/21,391436,10834,,,1786,,5488.038606216868,,,,,600,PRY,2021/06/13,135,465569,17148
Paraguay,6/14/21,393482,10954,,,2046,,5516.724079674394,,,,,600,PRY,2021/06/14,120,527527,61958
Paraguay,6/15/21,396149,11069,,,2667,,5554.116141116827,,,,,600,PRY,2021/06/15,115,527527,0
Paraguay,6/16/21,398761,11181,,,2612,,5590.737087681369,,,,,600,PRY,2021/06/16,112,527527,0
Paraguay,6/17/21,401243,11294,,,2482,,5625.5353990799895,,,,,600,PRY,2021/06/17,113,662804,135277
Paraguay,6/18/21,403392,11411,,,2149,,5655.664960399746,,,,,600,PRY,2021/06/18,117,662804,0
Paraguay,6/19/21,405075,11521,,,1683,,5679.261075663194,,,,,600,PRY,2021/06/19,110,662804,0
Paraguay,6/20/21,406220,11633,,,1145,,5695.3142853938225,,,,,600,PRY,2021/06/20,112,662804,0
Paraguay,6/21/21,407721,11743,,,1501,,5716.3587114249785,,,,,600,PRY,2021/06/21,110,662804,0
Paraguay,6/22/21,409467,11849,,,1746,,5740.838103730373,,,,,600,PRY,2021/06/22,106,662804,0
Paraguay,6/23/21,411615,11973,,,2148,,5770.953644779623,,,,,600,PRY,2021/06/23,124,662804,0
Paraguay,6/24/21,413457,12086,,,1842,,5796.778983053699,,,,,600,PRY,2021/06/24,113,662804,0
Paraguay,6/25/21,415320,12211,,,1863,,5822.898747008425,,,,,600,PRY,2021/06/25,125,662804,0
Paraguay,6/26/21,416843,12365,,,1523,,5844.2516189907365,,,,,600,PRY,2021/06/26,154,662769,-35
Paraguay,6/27/21,418330,12517,,,1487,,5865.099761234793,,,,,600,PRY,2021/06/27,152,665718,2949
Paraguay,6/28/21,419764,12641,,,1434,,5885.204829141973,,,,,600,PRY,2021/06/28,124,783265,117547
Paraguay,6/29/21,421589,12763,,,1825,,5910.791822817429,,,,,600,PRY,2021/06/29,122,783265,0
Paraguay,6/30/21,423282,12895,,,1693,,5934.528140785948,,,,,600,PRY,2021/06/30,132,783265,0
Paraguay,7/1/21,424998,13017,,,1716,,5958.586924976131,,,,,600,PRY,2021/07/01,122,783265,0
Paraguay,7/2/21,426318,13127,,,1320,,5977.093682045502,,,,,600,PRY,2021/07/02,110,783265,0
Peru,6/4/21,1976166,185813,,,10734,,5993.495177673703,,,,,604,PER,2021/06/04,871,4289311,81768
Peru,6/5/21,1980391,186073,,,4225,,6006.309140228303,,,,,604,PER,2021/06/05,260,4332176,42865
Peru,6/7/21,1983570,186511,,,3179,,6015.950699272343,,,,,604,PER,2021/06/07,438,4395070,52346
Peru,6/8/21,1984999,186757,,,1429,,6020.284699861815,,,,,604,PER,2021/06/08,246,4552828,157758
Peru,6/9/21,1987933,187157,,,2934,,6029.1832007222165,,,,,604,PER,2021/06/09,400,4710131,157303
Peru,6/10/21,1995257,187847,,,7324,,6051.3960910772175,,,,,604,PER,2021/06/10,690,4905795,195664
Peru,6/11/21,1998056,188100,,,2799,,6059.88515171398,,,,,604,PER,2021/06/11,253,5128278,222483
Peru,6/13/21,2003625,188708,,,5569,,6076.775319161688,,,,,604,PER,2021/06/13,608,5371672,89184
Peru,6/15/21,2007477,189261,,,3852,,6088.458013542827,,,,,604,PER,2021/06/15,553,5645364,143391
Peru,6/17/21,2019716,189757,,,12239,,6125.577560928799,,,,,604,PER,2021/06/17,496,5915906,141532
Peru,6/18/21,2023179,189933,,,3463,,6136.080460887752,,,,,604,PER,2021/06/18,176,6111520,195614
Peru,6/20/21,2026729,190202,,,3550,,6146.847222324161,,,,,604,PER,2021/06/20,269,6286005,46574
Peru,6/21/21,2030611,190645,,,3882,,6158.6209034216645,,,,,604,PER,2021/06/21,443,6406162,120157
Peru,6/23/21,2033606,190906,,,2995,,6167.704410605339,,,,,604,PER,2021/06/23,261,6732727,165007
Peru,6/24/21,2036449,191073,,,2843,,6176.326918426102,,,,,604,PER,2021/06/24,167,6853848,121121
Peru,6/25/21,2043262,191447,,,6813,,6196.99000171237,,,,,604,PER,2021/06/25,374,6983514,129666
Peru,6/27/21,2046057,191584,,,2795,,6205.466930786951,,,,,604,PER,2021/06/27,137,7142227,60935
Peru,6/28/21,2048115,191899,,,2058,,6211.708619529522,,,,,604,PER,2021/06/28,315,7220895,78668
Peru,6/30/21,2052065,192331,,,3950,,6223.688537184117,,,,,604,PER,2021/06/30,432,7419292,121795
Peru,7/1/21,2057554,192687,,,5489,,6240.336073388187,,,,,604,PER,2021/07/01,356,7569763,150471
Peru,7/2/21,2057554,192687,,,0,,6240.336073388187,,,,,604,PER,2021/07/02,0,7733457,163694
Philippines,6/4/21,1255337,21537,,,7438,,1145.578180759937,,,,,608,PHL,2021/06/04,180,5180721,0
Philippines,6/5/21,1262273,21732,,,6936,,1151.9077402820021,,,,,608,PHL,2021/06/05,195,5180721,0
Philippines,6/6/21,1269478,21898,,,7205,,1158.4827801257854,,,,,608,PHL,2021/06/06,166,5965651,784930
Philippines,6/7/21,1276004,21969,,,6526,,1164.4381874846374,,,,,608,PHL,2021/06/07,71,5965651,0
Philippines,6/8/21,1280773,22064,,,4769,,1168.7902159391833,,,,,608,PHL,2021/06/08,95,6096208,130557
Philippines,6/9/21,1286217,22190,,,5444,,1173.7582266136533,,,,,608,PHL,2021/06/09,126,6096208,0
Philippines,6/10/21,1293687,22312,,,7470,,1180.5750965141474,,,,,608,PHL,2021/06/10,122,6096208,0
Philippines,6/11/21,1300349,22507,,,6662,,1186.6546128832363,,,,,608,PHL,2021/06/11,195,6314548,218340
Philippines,6/12/21,1308352,22652,,,8003,,1193.9578805959077,,,,,608,PHL,2021/06/12,145,6314548,0
Philippines,6/13/21,1315639,22788,,,7287,,1200.6077508723336,,,,,608,PHL,2021/06/13,136,6314548,0
Philippines,6/14/21,1322053,22845,,,6414,,1206.4609508109909,,,,,608,PHL,2021/06/14,57,6948549,634001
Philippines,6/15/21,1327431,22963,,,5378,,1211.368732112846,,,,,608,PHL,2021/06/15,118,6948549,0
Philippines,6/16/21,1332832,23121,,,5401,,1216.2975024384912,,,,,608,PHL,2021/06/16,158,7045380,96831
Philippines,6/17/21,1339457,23276,,,6625,,1222.3432538562654,,,,,608,PHL,2021/06/17,155,7563241,517861
Philippines,6/18/21,1346276,23385,,,6819,,1228.5660431268773,,,,,608,PHL,2021/06/18,109,7563241,0
Philippines,6/19/21,1353220,23538,,,6944,,1234.9029031789564,,,,,608,PHL,2021/06/19,153,7563241,0
Philippines,6/20/21,1359015,23621,,,5795,,1240.191224607787,,,,,608,PHL,2021/06/20,83,8050711,487470
Philippines,6/21/21,1364239,23749,,,5224,,1244.9584707068743,,,,,608,PHL,2021/06/21,128,8407342,356631
Philippines,6/22/21,1367894,23809,,,3655,,1248.2939003569822,,,,,608,PHL,2021/06/22,60,8407342,0
Philippines,6/23/21,1372232,23928,,,4338,,1252.2526127570284,,,,,608,PHL,2021/06/23,119,8407342,0
Philippines,6/24/21,1378260,24036,,,6028,,1257.753562122514,,,,,608,PHL,2021/06/24,108,8928249,520907
Philippines,6/25/21,1385053,24152,,,6793,,1263.9526246705807,,,,,608,PHL,2021/06/25,116,8928249,0
Philippines,6/26/21,1391911,24244,,,6858,,1270.2110040250104,,,,,608,PHL,2021/06/26,92,9542612,614363
Philippines,6/27/21,1397992,24372,,,6081,,1275.7603194018384,,,,,608,PHL,2021/06/27,128,10065414,522802
Philippines,6/28/21,1403588,24456,,,5596,,1280.8670401465727,,,,,608,PHL,2021/06/28,84,10065414,0
Philippines,6/29/21,1408058,24557,,,4470,,1284.9462112918484,,,,,608,PHL,2021/06/29,101,10236354,170940
Philippines,6/30/21,1412559,24662,,,4501,,1289.053671990928,,,,,608,PHL,2021/06/30,105,10443407,207053
Philippines,7/1/21,1418337,24797,,,5778,,1294.326479793479,,,,,608,PHL,2021/07/01,135,10703704,260297
Philippines,7/2/21,1424518,24973,,,6181,,1299.967051795481,,,,,608,PHL,2021/07/02,176,10703704,0
Poland,6/4/21,2874411,74101,,,319,,7594.897877894199,,,,,616,POL,2021/06/04,26,21753938,426942
Poland,6/5/21,2874824,74139,,,413,,7595.989125048337,,,,,616,POL,2021/06/05,38,22025871,271933
Poland,6/6/21,2875136,74152,,,312,,7596.813505465021,,,,,616,POL,2021/06/06,13,22134362,108491
Poland,6/7/21,2875328,74160,,,192,,7597.320816490674,,,,,616,POL,2021/06/07,8,22340624,206262
Poland,6/8/21,2875729,74255,,,401,,7598.3803567057075,,,,,616,POL,2021/06/08,95,22737088,396464
Poland,6/9/21,2876289,74363,,,560,,7599.860013863859,,,,,616,POL,2021/06/09,108,23240142,503054
Poland,6/10/21,2876667,74447,,,378,,7600.858782445612,,,,,616,POL,2021/06/10,84,23628450,388308
Poland,6/11/21,2877007,74515,,,340,,7601.757145720204,,,,,616,POL,2021/06/11,68,24045826,417376
Poland,6/12/21,2877243,74562,,,236,,7602.380715522568,,,,,616,POL,2021/06/12,47,24360781,314955
Poland,6/13/21,2877469,74573,,,226,,7602.977862875679,,,,,616,POL,2021/06/13,11,24470301,109520
Poland,6/14/21,2877608,74574,,,139,,7603.345134920292,,,,,616,POL,2021/06/14,1,24687629,217328
Poland,6/15/21,2877819,74626,,,211,,7603.902648599525,,,,,616,POL,2021/06/15,52,25058534,370905
Poland,6/16/21,2878061,74688,,,242,,7604.54207187144,,,,,616,POL,2021/06/16,62,25482985,424451
Poland,6/17/21,2878276,74734,,,215,,7605.110154530374,,,,,616,POL,2021/06/17,46,25884468,401483
Poland,6/18/21,2878466,74782,,,190,,7605.612181066175,,,,,616,POL,2021/06/18,48,26206854,322386
Poland,6/19/21,2878634,74823,,,168,,7606.056078213621,,,,,616,POL,2021/06/19,41,26422469,215615
Poland,6/20/21,2878767,74828,,,133,,7606.407496788682,,,,,616,POL,2021/06/20,5,26494562,72093
Poland,6/21/21,2878840,74829,,,73,,7606.6003806682265,,,,,616,POL,2021/06/21,1,26665528,170966
Poland,6/22/21,2879030,74858,,,190,,7607.102407204028,,,,,616,POL,2021/06/22,29,27078372,412844
Poland,6/23/21,2879192,74893,,,162,,7607.530450881922,,,,,616,POL,2021/06/23,35,27467853,389481
Poland,6/24/21,2879336,74917,,,144,,7607.910934151161,,,,,616,POL,2021/06/24,24,27621910,154057
Poland,6/25/21,2879470,74953,,,134,,7608.264994971148,,,,,616,POL,2021/06/25,36,27621910,0
Poland,6/26/21,2879569,74974,,,99,,7608.5265772187495,,,,,616,POL,2021/06/26,21,28354710,732800
Poland,6/27/21,2879638,74979,,,69,,7608.708892118593,,,,,616,POL,2021/06/27,5,28447379,92669
Poland,6/28/21,2879689,74979,,,51,,7608.843646609782,,,,,616,POL,2021/06/28,0,28601320,153941
Poland,6/29/21,2879811,75005,,,122,,7609.166000490665,,,,,616,POL,2021/06/29,26,28888753,287433
Poland,6/30/21,2879912,75021,,,101,,7609.432867228117,,,,,616,POL,2021/06/30,16,29242214,353461
Poland,7/1/21,2880010,75044,,,98,,7609.6918072307935,,,,,616,POL,2021/07/01,23,29544033,301819
Poland,7/2/21,2880107,75065,,,97,,7609.948104988545,,,,,616,POL,2021/07/02,21,29544033,0
Portugal,6/4/21,851461,17029,,,430,,8350.352716813379,,,,,620,PRT,2021/06/04,0,6056669,71644
Portugal,6/5/21,852034,17032,,,573,,8355.972178076707,,,,,620,PRT,2021/06/05,3,6056669,0
Portugal,6/6/21,852646,17034,,,612,,8361.974115761099,,,,,620,PRT,2021/06/06,2,6228272,171603
Portugal,6/7/21,853034,17036,,,388,,8365.7792657963,,,,,620,PRT,2021/06/07,2,6270324,42052
Portugal,6/8/21,853632,17037,,,598,,8371.643904252618,,,,,620,PRT,2021/06/08,1,6374539,104215
Portugal,6/9/21,854522,17037,,,890,,8380.372212323056,,,,,620,PRT,2021/06/09,0,6470042,95503
Portugal,6/10/21,855432,17043,,,910,,8389.296662147888,,,,,620,PRT,2021/06/10,6,6470042,0
Portugal,6/11/21,855951,17044,,,519,,8394.386540674357,,,,,620,PRT,2021/06/11,1,6713043,243001
Portugal,6/12/21,856740,17045,,,789,,8402.124332885116,,,,,620,PRT,2021/06/12,1,6769487,56444
Portugal,6/13/21,857447,17047,,,707,,8409.05794390287,,,,,620,PRT,2021/06/13,2,6840510,71023
Portugal,6/14/21,858072,17047,,,625,,8415.187373727616,,,,,620,PRT,2021/06/14,0,6868280,27770
Portugal,6/15/21,859045,17049,,,973,,8424.729670078781,,,,,620,PRT,2021/06/15,2,6961449,93169
Portugal,6/16/21,860395,17055,,,1350,,8437.969238500233,,,,,620,PRT,2021/06/16,6,6961449,0
Portugal,6/17/21,861628,17057,,,1233,,8450.061377658492,,,,,620,PRT,2021/06/17,2,7218006,256557
Portugal,6/18/21,862926,17061,,,1298,,8462.790977518527,,,,,620,PRT,2021/06/18,4,7218006,0
Portugal,6/19/21,864109,17062,,,1183,,8474.392762290807,,,,,620,PRT,2021/06/19,1,7386326,168320
Portugal,6/20/21,865050,17065,,,941,,8483.621231834944,,,,,620,PRT,2021/06/20,3,7437171,50845
Portugal,6/21/21,865806,17068,,,756,,8491.035390150957,,,,,620,PRT,2021/06/21,3,7680120,242949
Portugal,6/22/21,866826,17074,,,1020,,8501.038619624944,,,,,620,PRT,2021/06/22,6,7711231,31111
Portugal,6/23/21,868323,17077,,,1497,,8515.719829941176,,,,,620,PRT,2021/06/23,3,7774300,63069
Portugal,6/24/21,869879,17079,,,1556,,8530.979658432865,,,,,620,PRT,2021/06/24,2,7856097,81797
Portugal,6/25/21,871483,17081,,,1604,,8546.710227135094,,,,,620,PRT,2021/06/25,2,7884808,28711
Portugal,6/26/21,873051,17083,,,1568,,8562.087740679417,,,,,620,PRT,2021/06/26,2,7996194,111386
Portugal,6/27/21,874547,17084,,,1496,,8576.75914390793,,,,,620,PRT,2021/06/27,1,8203905,207711
Portugal,6/28/21,875449,17086,,,902,,8585.605137031003,,,,,620,PRT,2021/06/28,2,8257211,53306
Portugal,6/29/21,877195,17092,,,1746,,8602.728312189416,,,,,620,PRT,2021/06/29,6,8480339,223128
Portugal,6/30/21,879557,17096,,,2362,,8625.892653383096,,,,,620,PRT,2021/06/30,4,8699066,218727
Portugal,7/1/21,882006,17101,,,2449,,8649.910211208384,,,,,620,PRT,2021/07/01,5,8980494,281428
Portugal,7/2/21,884442,17108,,,2436,,8673.800276893315,,,,,620,PRT,2021/07/02,7,8980494,0
Qatar,6/4/21,218263,565,,,183,,7575.78807799907,,,,,634,QAT,2021/06/04,2,2643573,21288
Qatar,6/5/21,218455,566,,,192,,7582.4522918648,,,,,634,QAT,2021/06/05,1,2643573,0
Qatar,6/6/21,218627,569,,,172,,7588.422316786183,,,,,634,QAT,2021/06/06,3,2676239,32666
Qatar,6/7/21,218798,569,,,171,,7594.3576322603485,,,,,634,QAT,2021/06/07,0,2700942,24703
Qatar,6/8/21,218980,570,,,182,,7600.674751653905,,,,,634,QAT,2021/06/08,1,2716670,15728
Qatar,6/9/21,219138,573,,,158,,7606.1588443142455,,,,,634,QAT,2021/06/09,3,2729437,12767
Qatar,6/10/21,219281,574,,,143,,7611.122295266326,,,,,634,QAT,2021/06/10,1,2729437,0
Qatar,6/11/21,219466,574,,,185,,7617.543543001534,,,,,634,QAT,2021/06/11,0,2768028,38591
Qatar,6/12/21,219613,576,,,147,,7622.645831742484,,,,,634,QAT,2021/06/12,2,2780916,12888
Qatar,6/13/21,219730,577,,,117,,7626.706837066913,,,,,634,QAT,2021/06/13,1,2795091,14175
Qatar,6/14/21,219887,579,,,157,,7632.156220280036,,,,,634,QAT,2021/06/14,2,2813022,17931
Qatar,6/15/21,220033,579,,,146,,7637.223799573768,,,,,634,QAT,2021/06/15,0,2833984,20962
Qatar,6/16/21,220198,579,,,165,,7642.950858364629,,,,,634,QAT,2021/06/16,0,2833984,0
Qatar,6/17/21,220325,581,,,127,,7647.358958161232,,,,,634,QAT,2021/06/17,2,2856149,22165
Qatar,6/18/21,220509,582,,,184,,7653.7454964492235,,,,,634,QAT,2021/06/18,1,2856149,0
Qatar,6/19/21,220693,582,,,184,,7660.132034737215,,,,,634,QAT,2021/06/19,0,2868162,12013
Qatar,6/20/21,220800,583,,,107,,7663.845945589471,,,,,634,QAT,2021/06/20,1,2886323,18161
Qatar,6/21/21,220930,583,,,130,,7668.358173727725,,,,,634,QAT,2021/06/21,0,2898814,12491
Qatar,6/22/21,221119,584,,,189,,7674.918259251803,,,,,634,QAT,2021/06/22,1,2908963,10149
Qatar,6/23/21,221273,586,,,154,,7680.263514123274,,,,,634,QAT,2021/06/23,2,2926066,17103
Qatar,6/24/21,221378,587,,,105,,7683.908006081095,,,,,634,QAT,2021/06/24,1,2926066,0
Qatar,6/25/21,221465,588,,,87,,7686.927727989004,,,,,634,QAT,2021/06/25,1,2956057,29991
Qatar,6/26/21,221590,588,,,125,,7691.266408891172,,,,,634,QAT,2021/06/26,0,2989246,33189
Qatar,6/27/21,221692,588,,,102,,7694.806772507341,,,,,634,QAT,2021/06/27,0,3041661,52415
Qatar,6/28/21,221810,588,,,118,,7698.902487278988,,,,,634,QAT,2021/06/28,0,3075375,33714
Qatar,6/29/21,221953,588,,,143,,7703.865938231068,,,,,634,QAT,2021/06/29,0,3109044,33669
Qatar,6/30/21,222071,590,,,118,,7707.961653002714,,,,,634,QAT,2021/06/30,2,3145062,36018
Qatar,7/1/21,222217,591,,,146,,7713.029232296446,,,,,634,QAT,2021/07/01,1,3177744,32682
Qatar,7/2/21,222350,591,,,133,,7717.645588776353,,,,,634,QAT,2021/07/02,0,3177744,0
Romania,6/4/21,1078563,30612,,,225,,5606.512260676728,,,,,642,ROU,2021/06/04,113,8042576,60613
Romania,6/5/21,1078742,30725,,,179,,5607.442726207866,,,,,642,ROU,2021/06/05,113,8042576,0
Romania,6/6/21,1078863,30815,,,121,,5608.07170011439,,,,,642,ROU,2021/06/06,90,8180838,138262
Romania,6/7/21,1078952,30878,,,89,,5608.53433381423,,,,,642,ROU,2021/06/07,63,8238940,58102
Romania,6/8/21,1079154,31155,,,202,,5609.584356368922,,,,,642,ROU,2021/06/08,277,8288345,49405
Romania,6/9/21,1079294,31383,,,140,,5610.312094773164,,,,,642,ROU,2021/06/09,228,8337812,49467
Romania,6/10/21,1079427,31531,,,133,,5611.003446257195,,,,,642,ROU,2021/06/10,148,8407762,69950
Romania,6/11/21,1079530,31681,,,103,,5611.538853797459,,,,,642,ROU,2021/06/11,150,8425239,17477
Romania,6/12/21,1079657,31804,,,127,,5612.199016492736,,,,,642,ROU,2021/06/12,123,8466467,41228
Romania,6/13/21,1079726,31834,,,69,,5612.557687563398,,,,,642,ROU,2021/06/13,30,8505715,39248
Romania,6/14/21,1079776,31861,,,50,,5612.8175941363415,,,,,642,ROU,2021/06/14,27,8537162,31447
Romania,6/15/21,1079879,31957,,,103,,5613.353001676605,,,,,642,ROU,2021/06/15,96,8568228,31066
Romania,6/16/21,1079983,32028,,,104,,5613.893607348328,,,,,642,ROU,2021/06/16,71,8568228,0
Romania,6/17/21,1080070,32115,,,87,,5614.34584478525,,,,,642,ROU,2021/06/17,87,8753264,185036
Romania,6/18/21,1080140,32212,,,70,,5614.709713987371,,,,,642,ROU,2021/06/18,97,8753264,0
Romania,6/19/21,1080203,32308,,,63,,5615.037196269281,,,,,642,ROU,2021/06/19,96,8753264,0
Romania,6/20/21,1080256,32326,,,53,,5615.312697236601,,,,,642,ROU,2021/06/20,18,8753264,0
Romania,6/21/21,1080282,32391,,,26,,5615.447848654531,,,,,642,ROU,2021/06/21,65,8753264,0
Romania,6/22/21,1080323,32465,,,41,,5615.660972044345,,,,,642,ROU,2021/06/22,74,8756809,3545
Romania,6/23/21,1080389,32626,,,66,,5616.004048720631,,,,,642,ROU,2021/06/23,161,8780559,23750
Romania,6/24/21,1080457,32771,,,68,,5616.357521659834,,,,,642,ROU,2021/06/24,145,8991259,210700
Romania,6/25/21,1080522,32911,,,65,,5616.6954002046605,,,,,642,ROU,2021/06/25,140,8991259,0
Romania,6/26/21,1080584,33177,,,62,,5617.017684355111,,,,,642,ROU,2021/06/26,266,8991259,0
Romania,6/27/21,1080630,33253,,,46,,5617.256798402219,,,,,642,ROU,2021/06/27,76,8991259,0
Romania,6/28/21,1080667,33311,,,37,,5617.449129266198,,,,,642,ROU,2021/06/28,58,8991259,0
Romania,6/29/21,1080740,33605,,,73,,5617.828592862696,,,,,642,ROU,2021/06/29,294,8991259,0
Romania,6/30/21,1080792,33786,,,52,,5618.098895698557,,,,,642,ROU,2021/06/30,181,8991259,0
Romania,7/1/21,1080823,33861,,,31,,5618.260037773782,,,,,642,ROU,2021/07/01,75,8958089,-33170
Romania,7/2/21,1080860,33898,,,37,,5618.45236863776,,,,,642,ROU,2021/07/02,37,8997613,39524
Russia,6/4/21,5049210,120974,,,8820,,3459.916184292593,,,,,643,RUS,2021/06/04,370,30623693,310295
Russia,6/5/21,5058221,121365,,,9011,,3466.090873944372,,,,,643,RUS,2021/06/05,391,30708050,84357
Russia,6/6/21,5067246,121711,,,9025,,3472.2751569437405,,,,,643,RUS,2021/06/06,346,31063143,355093
Russia,6/7/21,5076543,122037,,,9297,,3478.6458249819816,,,,,643,RUS,2021/06/07,326,31355996,292853
Russia,6/8/21,5086386,122409,,,9843,,3485.390633576196,,,,,643,RUS,2021/06/08,372,31605719,249723
Russia,6/9/21,5096657,122802,,,10271,,3492.4287245109895,,,,,643,RUS,2021/06/09,393,31953145,347426
Russia,6/10/21,5108217,123178,,,11560,,3500.350088663089,,,,,643,RUS,2021/06/10,376,32267143,313998
Russia,6/11/21,5120578,123568,,,12361,,3508.8203293451047,,,,,643,RUS,2021/06/11,390,32749073,481930
Russia,6/12/21,5133938,123961,,,13360,,3517.9751239015104,,,,,643,RUS,2021/06/12,393,32831196,82123
Russia,6/13/21,5148499,124314,,,14561,,3527.9528906332334,,,,,643,RUS,2021/06/13,353,32865706,34510
Russia,6/14/21,5162049,124681,,,13550,,3537.237880621205,,,,,643,RUS,2021/06/14,367,32942630,76924
Russia,6/15/21,5176051,125055,,,14002,,3546.8325986884797,,,,,643,RUS,2021/06/15,374,33596677,654047
Russia,6/16/21,5189260,125443,,,13209,,3555.8839221387466,,,,,643,RUS,2021/06/16,388,33927514,330837
Russia,6/17/21,5203117,125853,,,13857,,3565.3792805345633,,,,,643,RUS,2021/06/17,410,34409133,481619
Russia,6/18/21,5220168,126300,,,17051,,3577.06329265891,,,,,643,RUS,2021/06/18,447,34768902,359769
Russia,6/19/21,5237847,126761,,,17679,,3589.177634946537,,,,,643,RUS,2021/06/19,461,34901304,132402
Russia,6/20/21,5255214,127206,,,17367,,3601.0781826307507,,,,,643,RUS,2021/06/20,445,35050370,149066
Russia,6/21/21,5272328,127641,,,17114,,3612.805364819248,,,,,643,RUS,2021/06/21,435,35433632,383262
Russia,6/22/21,5288766,128180,,,16438,,3624.0693253670174,,,,,643,RUS,2021/06/22,539,36719788,1286156
Russia,6/23/21,5306069,128719,,,17303,,3635.9260177479673,,,,,643,RUS,2021/06/23,539,36970273,250485
Russia,6/24/21,5325940,129278,,,19871,,3649.5424041723936,,,,,643,RUS,2021/06/24,559,37603085,632812
Russia,6/25/21,5346005,129869,,,20065,,3663.2917269848394,,,,,643,RUS,2021/06/25,591,38098213,495128
Russia,6/26/21,5367317,130479,,,21312,,3677.8955429718244,,,,,643,RUS,2021/06/26,610,38440164,341951
Russia,6/27/21,5387486,131070,,,20169,,3691.7161306520748,,,,,643,RUS,2021/06/27,591,38816808,376644
Russia,6/28/21,5408744,131671,,,21258,,3706.2829437269306,,,,,643,RUS,2021/06/28,601,39328425,511617
Russia,6/29/21,5428961,132314,,,20217,,3720.136422884629,,,,,643,RUS,2021/06/29,643,40027944,699519
Russia,6/30/21,5449594,132973,,,20633,,3734.2749615135453,,,,,643,RUS,2021/06/30,659,40518739,490795
Russia,7/1/21,5472722,133633,,,23128,,3750.1231717306523,,,,,643,RUS,2021/07/01,660,41821794,1303055
Russia,7/2/21,5495513,134302,,,22791,,3765.7404563665086,,,,,643,RUS,2021/07/02,669,42383673,561879
Rwanda,6/4/21,27162,359,,,43,,209.7094016935644,,,,,646,RWA,2021/06/04,1,400096,0
Rwanda,6/5/21,27211,359,,,49,,210.08771553948827,,,,,646,RWA,2021/06/05,0,400096,0
Rwanda,6/6/21,27245,360,,,34,,210.35021902441505,,,,,646,RWA,2021/06/06,1,400096,0
Rwanda,6/7/21,27307,360,,,62,,210.82890184986977,,,,,646,RWA,2021/06/07,0,400096,0
Rwanda,6/8/21,27434,364,,,127,,211.80942957297864,,,,,646,RWA,2021/06/08,4,400096,0
Rwanda,6/9/21,27548,365,,,114,,212.68958831655667,,,,,646,RWA,2021/06/09,1,400096,0
Rwanda,6/10/21,27660,366,,,112,,213.5543056786684,,,,,646,RWA,2021/06/10,1,400096,0
Rwanda,6/11/21,27862,368,,,202,,215.1138852067628,,,,,646,RWA,2021/06/11,2,400096,0
Rwanda,6/12/21,28146,370,,,284,,217.30656137497473,,,,,646,RWA,2021/06/12,2,400096,0
Rwanda,6/13/21,28373,370,,,227,,219.05915817139763,,,,,646,RWA,2021/06/13,0,400096,0
Rwanda,6/14/21,28614,372,,,241,,220.91984463808453,,,,,646,RWA,2021/06/14,2,400096,0
Rwanda,6/15/21,28912,372,,,298,,223.2206104765604,,,,,646,RWA,2021/06/15,0,400096,0
Rwanda,6/16/21,29175,376,,,263,,225.2511521393764,,,,,646,RWA,2021/06/16,4,400096,0
Rwanda,6/17/21,29597,377,,,422,,228.5092836287617,,,,,646,RWA,2021/06/17,1,578569,178473
Rwanda,6/18/21,30048,378,,,451,,231.9913151494081,,,,,646,RWA,2021/06/18,1,578569,0
Rwanda,6/19/21,30517,379,,,469,,235.61231910325102,,,,,646,RWA,2021/06/19,1,578569,0
Rwanda,6/20/21,30813,382,,,296,,237.89764356026066,,,,,646,RWA,2021/06/20,3,578569,0
Rwanda,6/21/21,31435,388,,,622,,242.69991319627408,,,,,646,RWA,2021/06/21,6,578569,0
Rwanda,6/22/21,32296,392,,,861,,249.34742791750813,,,,,646,RWA,2021/06/22,4,578569,0
Rwanda,6/23/21,33260,397,,,964,,256.79017378425567,,,,,646,RWA,2021/06/23,5,578569,0
Rwanda,6/24/21,34143,402,,,883,,263.6075437016188,,,,,646,RWA,2021/06/24,5,578569,0
Rwanda,6/25/21,35018,404,,,875,,270.36314809311676,,,,,646,RWA,2021/06/25,2,578569,0
Rwanda,6/26/21,35886,411,,,868,,277.0647076494828,,,,,646,RWA,2021/06/26,7,578569,0
Rwanda,6/27/21,36627,420,,,741,,282.78573948274,,,,,646,RWA,2021/06/27,9,578569,0
Rwanda,6/28/21,37384,427,,,757,,288.6303023677274,,,,,646,RWA,2021/06/28,7,578569,0
Rwanda,6/29/21,38198,431,,,814,,294.91494462450385,,,,,646,RWA,2021/06/29,4,578569,0
Rwanda,6/30/21,39047,438,,,849,,301.46981105694016,,,,,646,RWA,2021/06/30,7,578569,0
Rwanda,7/1/21,39914,448,,,867,,308.16364992257303,,,,,646,RWA,2021/07/01,10,578569,0
Rwanda,7/2/21,40798,453,,,884,,314.9887405306693,,,,,646,RWA,2021/07/02,5,578569,0
Saint Kitts and Nevis,6/4/21,78,0,,,3,,146.63859226951422,,,,,659,KNA,2021/06/04,0,35408,0
Saint Kitts and Nevis,6/5/21,83,0,,,5,,156.0385020303805,,,,,659,KNA,2021/06/05,0,35408,0
Saint Kitts and Nevis,6/12/21,155,0,,,72,,291.39720258685514,,,,,659,KNA,2021/06/12,0,31054,0
Saint Kitts and Nevis,6/15/21,209,0,,,54,,392.9162280042112,,,,,659,KNA,2021/06/15,0,31054,0
Saint Kitts and Nevis,6/16/21,244,0,,,35,,458.7155963302752,,,,,659,KNA,2021/06/16,0,31054,0
Saint Kitts and Nevis,6/17/21,279,1,,,35,,524.5149646563393,,,,,659,KNA,2021/06/17,1,32415,1361
Saint Kitts and Nevis,6/18/21,304,1,,,25,,571.5145134606707,,,,,659,KNA,2021/06/18,0,32415,0
Saint Kitts and Nevis,6/19/21,330,1,,,26,,620.3940442171755,,,,,659,KNA,2021/06/19,0,32415,0
Saint Kitts and Nevis,6/20/21,341,1,,,11,,641.0738456910814,,,,,659,KNA,2021/06/20,0,32804,389
Saint Kitts and Nevis,6/21/21,350,2,,,9,,657.9936832606408,,,,,659,KNA,2021/06/21,1,32804,0
Saint Kitts and Nevis,6/22/21,377,3,,,27,,708.7531959693187,,,,,659,KNA,2021/06/22,1,32804,0
Saint Kitts and Nevis,6/23/21,396,3,,,19,,744.4728530606106,,,,,659,KNA,2021/06/23,0,33982,1178
Saint Kitts and Nevis,6/24/21,425,3,,,29,,798.9923296736351,,,,,659,KNA,2021/06/24,0,33982,0
Saint Kitts and Nevis,6/26/21,428,3,,,3,,804.6322755301549,,,,,659,KNA,2021/06/26,0,33982,0
Saint Kitts and Nevis,6/27/21,429,3,,,1,,806.5122574823282,,,,,659,KNA,2021/06/27,0,38006,4024
Saint Kitts and Nevis,6/28/21,439,3,,,10,,825.3120770040607,,,,,659,KNA,2021/06/28,0,38006,0
Saint Kitts and Nevis,6/29/21,443,3,,,4,,832.8320048127538,,,,,659,KNA,2021/06/29,0,38006,0
Saint Kitts and Nevis,6/30/21,446,3,,,3,,838.4719506692736,,,,,659,KNA,2021/06/30,0,40615,2609
Saint Kitts and Nevis,7/1/21,457,3,,,11,,859.1517521431795,,,,,659,KNA,2021/07/01,0,40615,0
Saint Kitts and Nevis,7/2/21,476,3,,,19,,894.8714092344713,,,,,659,KNA,2021/07/02,0,40615,0
Saint Lucia,6/4/21,5108,80,,,6,,2781.695701659324,,,,,662,LCA,2021/06/04,0,47828,0
Saint Lucia,6/6/21,5133,80,,,25,,2795.310108969716,,,,,662,LCA,2021/06/06,0,47828,0
Saint Lucia,6/7/21,5138,80,,,5,,2798.0329904317946,,,,,662,LCA,2021/06/07,0,48257,429
Saint Lucia,6/8/21,5148,80,,,10,,2803.4787533559515,,,,,662,LCA,2021/06/08,0,48666,409
Saint Lucia,6/9/21,5156,80,,,8,,2807.835363695277,,,,,662,LCA,2021/06/09,0,49065,399
Saint Lucia,6/10/21,5160,80,,,4,,2810.0136688649395,,,,,662,LCA,2021/06/10,0,49065,0
Saint Lucia,6/11/21,5168,80,,,8,,2814.370279204265,,,,,662,LCA,2021/06/11,0,49735,670
Saint Lucia,6/12/21,5179,80,,,11,,2820.3606184208375,,,,,662,LCA,2021/06/12,0,50132,397
Saint Lucia,6/14/21,5180,80,,,1,,2820.9051947132534,,,,,662,LCA,2021/06/14,0,50244,112
Saint Lucia,6/15/21,5186,80,,,6,,2824.1726524677474,,,,,662,LCA,2021/06/15,0,50244,0
Saint Lucia,6/16/21,5188,80,,,2,,2825.261805052579,,,,,662,LCA,2021/06/16,0,50244,0
Saint Lucia,6/18/21,5206,80,,,18,,2835.0641783160613,,,,,662,LCA,2021/06/18,0,50869,0
Saint Lucia,6/19/21,5211,80,,,5,,2837.78705977814,,,,,662,LCA,2021/06/19,0,51061,192
Saint Lucia,6/20/21,5216,80,,,5,,2840.5099412402183,,,,,662,LCA,2021/06/20,0,51178,117
Saint Lucia,6/21/21,5218,80,,,2,,2841.5990938250493,,,,,662,LCA,2021/06/21,0,51178,0
Saint Lucia,6/22/21,5227,84,,,9,,2846.5002804567907,,,,,662,LCA,2021/06/22,4,51337,159
Saint Lucia,6/23/21,5238,84,,,11,,2852.490619673363,,,,,662,LCA,2021/06/23,0,51563,226
Saint Lucia,6/25/21,5262,84,,,24,,2865.5604506913396,,,,,662,LCA,2021/06/25,0,51563,0
Saint Lucia,6/26/21,5269,84,,,7,,2869.3724847382496,,,,,662,LCA,2021/06/26,0,52030,467
Saint Lucia,6/27/21,5278,84,,,9,,2874.2736713699906,,,,,662,LCA,2021/06/27,0,52355,325
Saint Lucia,6/28/21,5284,84,,,6,,2877.5411291244845,,,,,662,LCA,2021/06/28,0,52355,0
Saint Lucia,6/29/21,5292,84,,,8,,2881.89773946381,,,,,662,LCA,2021/06/29,0,52596,241
Saint Lucia,6/30/21,5296,84,,,4,,2884.076044633473,,,,,662,LCA,2021/06/30,0,52771,175
Saint Lucia,7/1/21,5302,84,,,6,,2887.343502387967,,,,,662,LCA,2021/07/01,0,52921,150
Saint Lucia,7/2/21,5302,84,,,0,,2887.343502387967,,,,,662,LCA,2021/07/02,0,52921,0
Saint Vincent and the Grenadines,6/4/21,2065,12,,,21,,1861.2490648688113,,,,,670,VCT,2021/06/04,0,20768,0
Saint Vincent and the Grenadines,6/5/21,2068,12,,,3,,1863.9530586676522,,,,,670,VCT,2021/06/05,0,20768,0
Saint Vincent and the Grenadines,6/6/21,2076,12,,,8,,1871.1637087978945,,,,,670,VCT,2021/06/06,0,21422,654
Saint Vincent and the Grenadines,6/8/21,2092,12,,,16,,1885.5850090583792,,,,,670,VCT,2021/06/08,0,21422,0
Saint Vincent and the Grenadines,6/10/21,2132,12,,,40,,1921.638259709591,,,,,670,VCT,2021/06/10,0,21422,0
Saint Vincent and the Grenadines,6/12/21,2147,12,,,15,,1935.1582287037954,,,,,670,VCT,2021/06/12,0,22746,0
Saint Vincent and the Grenadines,6/13/21,2156,12,,,9,,1943.270210100318,,,,,670,VCT,2021/06/13,0,22746,0
Saint Vincent and the Grenadines,6/15/21,2158,12,,,2,,1945.0728726328787,,,,,670,VCT,2021/06/15,0,22746,0
Saint Vincent and the Grenadines,6/16/21,2172,12,,,14,,1957.6915103608028,,,,,670,VCT,2021/06/16,0,22746,0
Saint Vincent and the Grenadines,6/17/21,2178,12,,,6,,1963.0994979584848,,,,,670,VCT,2021/06/17,0,23087,341
Saint Vincent and the Grenadines,6/18/21,2183,12,,,5,,1967.6061542898863,,,,,670,VCT,2021/06/18,0,23087,0
Saint Vincent and the Grenadines,6/19/21,2192,12,,,9,,1975.718135686409,,,,,670,VCT,2021/06/19,0,23087,0
Saint Vincent and the Grenadines,6/20/21,2195,12,,,3,,1978.4221294852498,,,,,670,VCT,2021/06/20,0,23087,0
Saint Vincent and the Grenadines,6/21/21,2196,12,,,1,,1979.32346075153,,,,,670,VCT,2021/06/21,0,23087,0
Saint Vincent and the Grenadines,6/22/21,2207,12,,,11,,1989.2381046806133,,,,,670,VCT,2021/06/22,0,23087,0
Saint Vincent and the Grenadines,6/24/21,2216,12,,,9,,1997.350086077136,,,,,670,VCT,2021/06/24,0,23640,0
Saint Vincent and the Grenadines,6/26/21,2218,12,,,2,,1999.1527486096966,,,,,670,VCT,2021/06/26,0,23640,0
Saint Vincent and the Grenadines,6/27/21,2219,12,,,1,,2000.0540798759769,,,,,670,VCT,2021/06/27,0,24667,1027
Saint Vincent and the Grenadines,6/29/21,2225,12,,,6,,2005.4620674736586,,,,,670,VCT,2021/06/29,0,24667,0
Saint Vincent and the Grenadines,7/1/21,2227,12,,,2,,2007.2647300062192,,,,,670,VCT,2021/07/01,0,24737,0
Saint Vincent and the Grenadines,7/2/21,2229,12,,,2,,2009.0673925387798,,,,,670,VCT,2021/07/02,0,24737,0
Samoa,6/4/21,3,0,,,0,,1.5295977158007443,,,,,882,WSM,2021/06/04,0,,
Samoa,7/2/21,3,0,,,0,,1.5295977158007443,,,,,882,WSM,2021/07/02,0,,
San Marino,6/4/21,5090,90,,,0,,14997.937415286699,,,,,674,SMR,2021/06/04,0,42936,1
San Marino,6/28/21,5091,90,,,1,,15000.883964877128,,,,,674,SMR,2021/06/28,0,44430,0
San Marino,7/2/21,5091,90,,,0,,15000.883964877128,,,,,674,SMR,2021/07/02,0,44515,0
Sao Tome and Principe,6/4/21,2353,37,,,4,,1073.639926811796,,,,,678,STP,2021/06/04,0,18888,0
Sao Tome and Principe,6/9/21,2354,37,,,1,,1074.096212373552,,,,,678,STP,2021/06/09,0,23027,0
Sao Tome and Principe,6/10/21,2355,37,,,1,,1074.5524979353079,,,,,678,STP,2021/06/10,0,23644,0
Sao Tome and Principe,6/11/21,2356,37,,,1,,1075.0087834970639,,,,,678,STP,2021/06/11,0,23644,0
Sao Tome and Principe,6/12/21,2357,37,,,1,,1075.4650690588198,,,,,678,STP,2021/06/12,0,23644,0
Sao Tome and Principe,6/13/21,2358,37,,,1,,1075.9213546205758,,,,,678,STP,2021/06/13,0,23644,0
Sao Tome and Principe,6/18/21,2360,37,,,2,,1076.8339257440878,,,,,678,STP,2021/06/18,0,23918,0
Sao Tome and Principe,6/19/21,2362,37,,,2,,1077.7464968675997,,,,,678,STP,2021/06/19,0,23918,0
Sao Tome and Principe,6/22/21,2363,37,,,1,,1078.2027824293557,,,,,678,STP,2021/06/22,0,23918,0
Sao Tome and Principe,6/24/21,2364,37,,,1,,1078.6590679911117,,,,,678,STP,2021/06/24,0,24908,0
Sao Tome and Principe,6/25/21,2365,37,,,1,,1079.1153535528674,,,,,678,STP,2021/06/25,0,24908,0
Sao Tome and Principe,6/29/21,2366,37,,,1,,1079.5716391146234,,,,,678,STP,2021/06/29,0,27986,0
Sao Tome and Principe,7/1/21,2369,37,,,3,,1080.9404957998913,,,,,678,STP,2021/07/01,0,27986,0
Sao Tome and Principe,7/2/21,2369,37,,,0,,1080.9404957998913,,,,,678,STP,2021/07/02,0,27986,0
Saudi Arabia,6/4/21,455418,7424,,,1201,,1308.1511456340083,,,,,682,SAU,2021/06/04,16,14764005,82614
Saudi Arabia,6/5/21,456562,7440,,,1144,,1311.437192541696,,,,,682,SAU,2021/06/05,16,14868688,104683
Saudi Arabia,6/6/21,457546,7456,,,984,,1314.2636524692875,,,,,682,SAU,2021/06/06,16,14999380,130692
Saudi Arabia,6/7/21,458707,7471,,,1161,,1317.5985304936105,,,,,682,SAU,2021/06/07,15,15120142,120762
Saudi Arabia,6/8/21,459968,7488,,,1261,,1321.2206503804935,,,,,682,SAU,2021/06/08,17,15250037,129895
Saudi Arabia,6/9/21,461242,7503,,,1274,,1324.8801117095093,,,,,682,SAU,2021/06/09,15,15396310,146273
Saudi Arabia,6/11/21,463703,7537,,,2461,,1331.9491339471138,,,,,682,SAU,2021/06/11,34,15627080,131975
Saudi Arabia,6/12/21,464780,7553,,,1077,,1335.042728806886,,,,,682,SAU,2021/06/12,16,15732449,105369
Saudi Arabia,6/13/21,465797,7572,,,1017,,1337.9639785491224,,,,,682,SAU,2021/06/13,19,15854164,121715
Saudi Arabia,6/14/21,466906,7590,,,1109,,1341.149490804914,,,,,682,SAU,2021/06/14,18,16004173,150009
Saudi Arabia,6/15/21,468175,7606,,,1269,,1344.794590040802,,,,,682,SAU,2021/06/15,16,16132827,128654
Saudi Arabia,6/16/21,469414,7621,,,1239,,1348.3535167179216,,,,,682,SAU,2021/06/16,15,16254435,121608
Saudi Arabia,6/17/21,470723,7635,,,1309,,1352.1135126988336,,,,,682,SAU,2021/06/17,14,16369724,115289
Saudi Arabia,6/18/21,471959,7650,,,1236,,1355.6638221200765,,,,,682,SAU,2021/06/18,15,16476190,106466
Saudi Arabia,6/19/21,473112,7663,,,1153,,1358.9757207953946,,,,,682,SAU,2021/06/19,13,16573114,96924
Saudi Arabia,6/20/21,474191,7677,,,1079,,1362.075060492418,,,,,682,SAU,2021/06/20,14,16661560,88446
Saudi Arabia,6/21/21,475403,7691,,,1212,,1365.5564318666468,,,,,682,SAU,2021/06/21,14,16751205,89645
Saudi Arabia,6/22/21,476882,7703,,,1479,,1369.8047390139106,,,,,682,SAU,2021/06/22,12,16864705,113500
Saudi Arabia,6/23/21,478135,7716,,,1253,,1373.403879551789,,,,,682,SAU,2021/06/23,13,16948302,83597
Saudi Arabia,6/24/21,479390,7730,,,1255,,1377.0087649269183,,,,,682,SAU,2021/06/24,14,17038622,90320
Saudi Arabia,6/25/21,480702,7743,,,1312,,1380.777378163707,,,,,682,SAU,2021/06/25,13,17127389,88767
Saudi Arabia,6/26/21,482003,7760,,,1301,,1384.514394795614,,,,,682,SAU,2021/06/26,17,17240760,113371
Saudi Arabia,6/27/21,483221,7775,,,1218,,1388.0130006815962,,,,,682,SAU,2021/06/27,15,17341125,100365
Saudi Arabia,6/28/21,484539,7789,,,1318,,1391.7988484301384,,,,,682,SAU,2021/06/28,14,17564688,223563
Saudi Arabia,6/29/21,486106,7804,,,1567,,1396.2999284164555,,,,,682,SAU,2021/06/29,15,17744944,180256
Saudi Arabia,7/2/21,490464,7848,,,4358,,1408.8179287868252,,,,,682,SAU,2021/07/02,44,18207250,111462
Senegal,6/4/21,41581,1144,,,42,,248.33476967474184,,,,,686,SEN,2021/06/04,0,522575,0
Senegal,6/5/21,41631,1145,,,50,,248.63338535218435,,,,,686,SEN,2021/06/05,1,522575,0
Senegal,6/6/21,41680,1146,,,49,,248.926028716078,,,,,686,SEN,2021/06/06,1,522575,0
Senegal,6/7/21,41713,1148,,,33,,249.12311506319006,,,,,686,SEN,2021/06/07,2,522575,0
Senegal,6/8/21,41725,1150,,,12,,249.19478282577626,,,,,686,SEN,2021/06/08,2,537467,14892
Senegal,6/9/21,41796,1150,,,71,,249.61881708774465,,,,,686,SEN,2021/06/09,0,537467,0
Senegal,6/10/21,41850,1150,,,54,,249.94132201938254,,,,,686,SEN,2021/06/10,0,545915,8448
Senegal,6/11/21,41900,1150,,,50,,250.23993769682505,,,,,686,SEN,2021/06/11,0,545915,0
Senegal,6/12/21,41952,1150,,,52,,250.55049800136527,,,,,686,SEN,2021/06/12,0,545915,0
Senegal,6/13/21,41998,1154,,,46,,250.82522442461237,,,,,686,SEN,2021/06/13,4,545915,0
Senegal,6/14/21,42023,1155,,,25,,250.97453226333363,,,,,686,SEN,2021/06/14,1,625448,79533
Senegal,6/15/21,42050,1156,,,27,,251.1357847291526,,,,,686,SEN,2021/06/15,1,632648,7200
Senegal,6/16/21,42118,1156,,,68,,251.54190205047442,,,,,686,SEN,2021/06/16,0,632648,0
Senegal,6/17/21,42206,1158,,,88,,252.06746564277324,,,,,686,SEN,2021/06/17,2,632648,0
Senegal,6/18/21,42259,1158,,,53,,252.38399826086228,,,,,686,SEN,2021/06/18,0,632648,0
Senegal,6/19/21,42333,1158,,,74,,252.8259494634772,,,,,686,SEN,2021/06/19,0,632648,0
Senegal,6/20/21,42404,1158,,,71,,253.2499837254456,,,,,686,SEN,2021/06/20,0,632648,0
Senegal,6/21/21,42437,1158,,,33,,253.44707007255764,,,,,686,SEN,2021/06/21,0,632648,0
Senegal,6/22/21,42472,1159,,,35,,253.6561010467674,,,,,686,SEN,2021/06/22,1,632648,0
Senegal,6/23/21,42590,1159,,,118,,254.36083404553173,,,,,686,SEN,2021/06/23,0,632648,0
Senegal,6/24/21,42677,1159,,,87,,254.8804253242817,,,,,686,SEN,2021/06/24,0,632648,0
Senegal,6/25/21,42747,1161,,,70,,255.2984872727012,,,,,686,SEN,2021/06/25,2,632648,0
Senegal,6/26/21,42851,1163,,,104,,255.91960788178164,,,,,686,SEN,2021/06/26,2,632648,0
Senegal,6/27/21,42904,1164,,,53,,256.2361404998707,,,,,686,SEN,2021/06/27,1,632648,0
Senegal,6/28/21,42929,1164,,,25,,256.38544833859197,,,,,686,SEN,2021/06/28,0,664826,32178
Senegal,6/29/21,42957,1166,,,28,,256.5526731179598,,,,,686,SEN,2021/06/29,2,664826,0
Senegal,6/30/21,43128,1166,,,171,,257.57393873481317,,,,,686,SEN,2021/06/30,0,664826,0
Senegal,7/1/21,43268,1168,,,140,,258.4100626316522,,,,,686,SEN,2021/07/01,2,664826,0
Senegal,7/2/21,43427,1170,,,159,,259.3596604859194,,,,,686,SEN,2021/07/02,2,664826,0
Serbia,6/4/21,713417,6900,,,210,,8165.122914561247,,,,,688,SRB,2021/06/04,10,4720552,0
Serbia,6/5/21,713562,6909,,,145,,8166.782452843361,,,,,688,SRB,2021/06/05,9,4720552,0
Serbia,6/6/21,713678,6917,,,116,,8168.110083469053,,,,,688,SRB,2021/06/06,8,4770589,50037
Serbia,6/7/21,713840,6924,,,162,,8169.964188308381,,,,,688,SRB,2021/06/07,7,4770589,0
Serbia,6/8/21,714054,6930,,,214,,8172.41343791095,,,,,688,SRB,2021/06/08,6,4770589,0
Serbia,6/9/21,714252,6938,,,198,,8174.6795660479065,,,,,688,SRB,2021/06/09,8,4770589,0
Serbia,6/10/21,714462,6945,,,210,,8177.083035284073,,,,,688,SRB,2021/06/10,7,4770589,0
Serbia,6/11/21,714634,6951,,,172,,8179.051591039409,,,,,688,SRB,2021/06/11,6,4882120,111531
Serbia,6/12/21,714753,6958,,,119,,8180.413556939903,,,,,688,SRB,2021/06/12,7,4955746,73626
Serbia,6/13/21,714891,6962,,,138,,8181.992979580812,,,,,688,SRB,2021/06/13,4,4955746,0
Serbia,6/14/21,715015,6970,,,124,,8183.41217093931,,,,,688,SRB,2021/06/14,8,4955746,0
Serbia,6/15/21,715147,6976,,,132,,8184.922923030615,,,,,688,SRB,2021/06/15,6,4955746,0
Serbia,6/16/21,715307,6980,,,160,,8186.754137686741,,,,,688,SRB,2021/06/16,4,4955746,0
Serbia,6/17/21,715442,6985,,,135,,8188.299225052848,,,,,688,SRB,2021/06/17,5,4955746,0
Serbia,6/18/21,715604,6990,,,162,,8190.153329892176,,,,,688,SRB,2021/06/18,5,4955746,0
Serbia,6/19/21,715693,6997,,,89,,8191.1719430446465,,,,,688,SRB,2021/06/19,7,5070754,115008
Serbia,6/20/21,715753,7001,,,60,,8191.858648540694,,,,,688,SRB,2021/06/20,4,5070754,0
Serbia,6/21/21,715841,7004,,,88,,8192.865816601563,,,,,688,SRB,2021/06/21,3,5146241,75487
Serbia,6/22/21,715913,7010,,,72,,8193.68986319682,,,,,688,SRB,2021/06/22,6,5146241,0
Serbia,6/23/21,716016,7013,,,103,,8194.868707631702,,,,,688,SRB,2021/06/23,3,5146241,0
Serbia,6/24/21,716096,7019,,,80,,8195.784314959765,,,,,688,SRB,2021/06/24,6,5146241,0
Serbia,6/25/21,716172,7024,,,76,,8196.654141921425,,,,,688,SRB,2021/06/25,5,5146241,0
Serbia,6/26/21,716238,7029,,,66,,8197.409517967077,,,,,688,SRB,2021/06/26,5,5146241,0
Serbia,6/27/21,716301,7031,,,63,,8198.130558737927,,,,,688,SRB,2021/06/27,2,5146241,0
Serbia,6/28/21,716385,7039,,,84,,8199.091946432392,,,,,688,SRB,2021/06/28,8,5146241,0
Serbia,6/29/21,716458,7043,,,73,,8199.927438119252,,,,,688,SRB,2021/06/29,4,5146241,0
Serbia,6/30/21,716562,7047,,,104,,8201.117727645733,,,,,688,SRB,2021/06/30,4,5146241,0
Serbia,7/1/21,716643,7047,,,81,,8202.044780065396,,,,,688,SRB,2021/07/01,0,5146241,0
Serbia,7/2/21,716717,7051,,,74,,8202.891716843857,,,,,688,SRB,2021/07/02,4,5146241,0
Seychelles,6/4/21,12158,42,,,537,,12363.229611551758,,,,,690,SYC,2021/06/04,0,134475,0
Seychelles,6/7/21,12466,46,,,308,,12676.428716697174,,,,,690,SYC,2021/06/07,4,136526,0
Seychelles,6/11/21,12973,46,,,507,,13191.986983933293,,,,,690,SYC,2021/06/11,0,137196,0
Seychelles,6/14/21,13630,50,,,657,,13860.077282896074,,,,,690,SYC,2021/06/14,4,137196,0
Seychelles,6/17/21,14123,55,,,493,,14361.39922717104,,,,,690,SYC,2021/06/17,5,137196,0
Seychelles,6/22/21,14620,59,,,497,,14866.788692292048,,,,,690,SYC,2021/06/22,4,137676,0
Seychelles,6/25/21,15116,63,,,496,,15371.161277201545,,,,,690,SYC,2021/06/25,4,137976,300
Seychelles,6/28/21,15579,68,,,463,,15841.976815131178,,,,,690,SYC,2021/06/28,5,137976,0
Seychelles,7/2/21,15857,71,,,278,,16124.66951393126,,,,,690,SYC,2021/07/02,3,138581,0
Sierra Leone,6/4/21,4168,79,,,6,,52.25031763253911,,,,,694,SLE,2021/06/04,0,79762,0
Sierra Leone,6/5/21,4188,79,,,20,,52.501038926361275,,,,,694,SLE,2021/06/05,0,79762,0
Sierra Leone,6/6/21,4201,79,,,13,,52.66400776734568,,,,,694,SLE,2021/06/06,0,79762,0
Sierra Leone,6/7/21,4208,79,,,7,,52.75176022018344,,,,,694,SLE,2021/06/07,0,79762,0
Sierra Leone,6/8/21,4219,82,,,11,,52.88965693178563,,,,,694,SLE,2021/06/08,3,83474,3712
Sierra Leone,6/9/21,4251,82,,,32,,53.2908110019011,,,,,694,SLE,2021/06/09,0,83474,0
Sierra Leone,6/10/21,4289,82,,,38,,53.76718146016321,,,,,694,SLE,2021/06/10,0,88523,5049
Sierra Leone,6/11/21,4312,82,,,23,,54.055510948058696,,,,,694,SLE,2021/06/11,0,88523,0
Sierra Leone,6/12/21,4349,82,,,37,,54.5193453416297,,,,,694,SLE,2021/06/12,0,88523,0
Sierra Leone,6/13/21,4388,82,,,39,,55.008251864582924,,,,,694,SLE,2021/06/13,0,88523,0
Sierra Leone,6/14/21,4433,82,,,45,,55.57237477568279,,,,,694,SLE,2021/06/14,0,91789,3266
Sierra Leone,6/15/21,4449,82,,,16,,55.77295181074052,,,,,694,SLE,2021/06/15,0,91789,0
Sierra Leone,6/16/21,4505,82,,,56,,56.47497143344258,,,,,694,SLE,2021/06/16,0,91789,0
Sierra Leone,6/17/21,4553,82,,,48,,57.07670253861578,,,,,694,SLE,2021/06/17,0,91789,0
Sierra Leone,6/18/21,4631,82,,,78,,58.05451558452222,,,,,694,SLE,2021/06/18,0,91789,0
Sierra Leone,6/19/21,4702,82,,,71,,58.9445761775909,,,,,694,SLE,2021/06/19,0,91789,0
Sierra Leone,6/20/21,4816,82,,,114,,60.37368755237725,,,,,694,SLE,2021/06/20,0,97315,5526
Sierra Leone,6/21/21,4879,82,,,63,,61.163459627917064,,,,,694,SLE,2021/06/21,0,97315,0
Sierra Leone,6/22/21,4963,84,,,84,,62.21648906197016,,,,,694,SLE,2021/06/22,2,97315,0
Sierra Leone,6/24/21,5155,87,,,192,,64.62341348266294,,,,,694,SLE,2021/06/24,3,97315,0
Sierra Leone,6/25/21,5253,87,,,98,,65.85194782239154,,,,,694,SLE,2021/06/25,0,97315,0
Sierra Leone,6/26/21,5306,93,,,53,,66.51635925102028,,,,,694,SLE,2021/06/26,6,97315,0
Sierra Leone,6/27/21,5381,94,,,75,,67.45656410285339,,,,,694,SLE,2021/06/27,1,97315,0
Sierra Leone,6/28/21,5443,97,,,62,,68.2338001137021,,,,,694,SLE,2021/06/28,3,97315,0
Sierra Leone,6/29/21,5495,98,,,52,,68.88567547763974,,,,,694,SLE,2021/06/29,1,97315,0
Sierra Leone,6/30/21,5575,100,,,80,,69.88856065292839,,,,,694,SLE,2021/06/30,2,97315,0
Sierra Leone,7/1/21,5652,102,,,77,,70.85383763414373,,,,,694,SLE,2021/07/01,2,97315,0
Sierra Leone,7/2/21,5702,104,,,50,,71.48064086869914,,,,,694,SLE,2021/07/02,2,97315,0
Singapore,6/4/21,62158,33,,,13,,1062.4676194199212,,,,,702,SGP,2021/06/04,0,4047651,0
Singapore,6/5/21,62176,33,,,18,,1062.7752936879085,,,,,702,SGP,2021/06/05,0,4047651,0
Singapore,6/6/21,62196,33,,,20,,1063.1171539856723,,,,,702,SGP,2021/06/06,0,4047651,0
Singapore,6/7/21,62210,33,,,14,,1063.3564561941068,,,,,702,SGP,2021/06/07,0,4047651,0
Singapore,6/8/21,62219,34,,,9,,1063.5102933281005,,,,,702,SGP,2021/06/08,1,4392067,344416
Singapore,6/9/21,62223,34,,,4,,1063.5786653876532,,,,,702,SGP,2021/06/09,0,4392067,0
Singapore,6/10/21,62236,34,,,13,,1063.8008745811999,,,,,702,SGP,2021/06/10,0,4392067,0
Singapore,6/11/21,62245,34,,,9,,1063.9547117151935,,,,,702,SGP,2021/06/11,0,4392067,0
Singapore,6/12/21,62263,34,,,18,,1064.2623859831808,,,,,702,SGP,2021/06/12,0,4392067,0
Singapore,6/13/21,62276,34,,,13,,1064.4845951767272,,,,,702,SGP,2021/06/13,0,4392067,0
Singapore,6/14/21,62301,34,,,25,,1064.911920548932,,,,,702,SGP,2021/06/14,0,4392067,0
Singapore,6/15/21,62315,34,,,14,,1065.1512227573664,,,,,702,SGP,2021/06/15,0,4691386,299319
Singapore,6/16/21,62339,34,,,24,,1065.561455114683,,,,,702,SGP,2021/06/16,0,4691386,0
Singapore,6/17/21,62366,34,,,27,,1066.0229665166642,,,,,702,SGP,2021/06/17,0,4691386,0
Singapore,6/18/21,62382,34,,,16,,1066.296454754875,,,,,702,SGP,2021/06/18,0,4691386,0
Singapore,6/19/21,62403,34,,,21,,1066.6554080675269,,,,,702,SGP,2021/06/19,0,4691386,0
Singapore,6/20/21,62414,34,,,11,,1066.843431231297,,,,,702,SGP,2021/06/20,0,4691386,0
Singapore,6/21/21,62430,35,,,16,,1067.116919469508,,,,,702,SGP,2021/06/21,1,4691386,0
Singapore,6/22/21,62448,35,,,18,,1067.4245937374953,,,,,702,SGP,2021/06/22,0,5029006,337620
Singapore,6/23/21,62470,35,,,22,,1067.8006400650354,,,,,702,SGP,2021/06/23,0,5029006,0
Singapore,6/24/21,62493,35,,,23,,1068.1937794074638,,,,,702,SGP,2021/06/24,0,5029006,0
Singapore,6/25/21,62513,35,,,20,,1068.5356397052276,,,,,702,SGP,2021/06/25,0,5029006,0
Singapore,6/26/21,62530,36,,,17,,1068.8262209583268,,,,,702,SGP,2021/06/26,1,5029006,0
Singapore,6/27/21,62544,36,,,14,,1069.0655231667613,,,,,702,SGP,2021/06/27,0,5029006,0
Singapore,6/28/21,62553,36,,,9,,1069.219360300755,,,,,702,SGP,2021/06/28,0,5029006,0
Singapore,6/29/21,62907,36,,,354,,1075.2702875711732,,,,,702,SGP,2021/06/29,0,5365803,336797
Singapore,6/30/21,62579,36,,,,,1069.663778687848,,,,,702,SGP,2021/06/30,0,5365803,0
Singapore,7/1/21,62589,36,,,10,,1069.8347088367298,,,,,702,SGP,2021/07/01,0,5365803,0
Singapore,7/2/21,62599,36,,,10,,1070.0056389856115,,,,,702,SGP,2021/07/02,0,5365803,0
Slovakia,6/4/21,390223,12382,,,94,,7147.40872251171,,,,,703,SVK,2021/06/04,7,2723334,31627
Slovakia,6/5/21,390340,12395,,,117,,7149.551719773619,,,,,703,SVK,2021/06/05,13,2747360,24026
Slovakia,6/6/21,390436,12404,,,96,,7151.310076501339,,,,,703,SVK,2021/06/06,9,2773294,25934
Slovakia,6/7/21,390451,12414,,,15,,7151.5848197400455,,,,,703,SVK,2021/06/07,10,2834450,61156
Slovakia,6/8/21,390546,12423,,,95,,7153.3248602518515,,,,,703,SVK,2021/06/08,9,2864963,30513
Slovakia,6/9/21,390693,12430,,,147,,7156.017343991173,,,,,703,SVK,2021/06/09,7,2898985,34022
Slovakia,6/10/21,390809,12433,,,116,,7158.142025037168,,,,,703,SVK,2021/06/10,3,2934355,35370
Slovakia,6/11/21,390893,12433,,,84,,7159.680587173923,,,,,703,SVK,2021/06/11,0,2943214,8859
Slovakia,6/12/21,390984,12436,,,91,,7161.3473628220745,,,,,703,SVK,2021/06/12,3,2972806,29592
Slovakia,6/13/21,391026,12439,,,42,,7162.116643890452,,,,,703,SVK,2021/06/13,3,3009146,36340
Slovakia,6/14/21,391038,12441,,,12,,7162.336438481418,,,,,703,SVK,2021/06/14,2,3061215,52069
Slovakia,6/15/21,391087,12446,,,49,,7163.233933061191,,,,,703,SVK,2021/06/15,5,3107684,46469
Slovakia,6/16/21,391149,12456,,,62,,7164.369538447843,,,,,703,SVK,2021/06/16,10,3137533,29849
Slovakia,6/17/21,391210,12464,,,61,,7165.4868276185825,,,,,703,SVK,2021/06/17,8,3165825,28292
Slovakia,6/18/21,391248,12478,,,38,,7166.182843823305,,,,,703,SVK,2021/06/18,14,3187809,21984
Slovakia,6/21/21,391326,12496,,,78,,7167.611508664578,,,,,703,SVK,2021/06/21,18,3320553,78384
Slovakia,6/22/21,391385,12502,,,59,,7168.692165403489,,,,,703,SVK,2021/06/22,6,3367820,47267
Slovakia,6/23/21,391420,12502,,,35,,7169.33323296047,,,,,703,SVK,2021/06/23,0,3399122,31302
Slovakia,6/24/21,391456,12502,,,36,,7169.992616733365,,,,,703,SVK,2021/06/24,0,3433029,33907
Slovakia,6/25/21,391490,12505,,,34,,7170.615368074433,,,,,703,SVK,2021/06/25,3,3459754,26725
Slovakia,6/26/21,391531,12505,,,41,,7171.366332926897,,,,,703,SVK,2021/06/26,0,3484489,24735
Slovakia,6/27/21,391551,12505,,,20,,7171.732657245171,,,,,703,SVK,2021/06/27,0,3516015,31526
Slovakia,6/28/21,391566,12509,,,15,,7172.007400483878,,,,,703,SVK,2021/06/28,4,3536420,20405
Slovakia,6/29/21,391609,12510,,,43,,7172.794997768169,,,,,703,SVK,2021/06/29,1,3590631,54211
Slovakia,6/30/21,391642,12510,,,33,,7173.399432893323,,,,,703,SVK,2021/06/30,0,3618614,27983
Slovakia,7/1/21,391659,12511,,,17,,7173.7108085638565,,,,,703,SVK,2021/07/01,1,3649434,30820
Slovakia,7/2/21,391676,12511,,,17,,7174.022184234391,,,,,703,SVK,2021/07/02,0,3649434,0
Slovenia,6/4/21,254973,4385,,,281,,12264.614715632835,,,,,705,SVN,2021/06/04,2,1179407,32262
Slovenia,6/5/21,255218,4387,,,245,,12276.399612878151,,,,,705,SVN,2021/06/05,2,1179407,0
Slovenia,6/6/21,255375,4388,,,157,,12283.951567439435,,,,,705,SVN,2021/06/06,1,1198098,18691
Slovenia,6/7/21,255432,4390,,,57,,12286.693359859773,,,,,705,SVN,2021/06/07,2,1210517,12419
Slovenia,6/8/21,255652,4391,,,220,,12297.275716569855,,,,,705,SVN,2021/06/08,1,1223205,12688
Slovenia,6/9/21,255907,4392,,,255,,12309.541630029265,,,,,705,SVN,2021/06/09,1,1245885,22680
Slovenia,6/10/21,256103,4393,,,196,,12318.969547825518,,,,,705,SVN,2021/06/10,1,1245885,0
Slovenia,6/11/21,256224,4398,,,121,,12324.789844016062,,,,,705,SVN,2021/06/11,5,1294610,48725
Slovenia,6/12/21,256352,4401,,,128,,12330.946851556473,,,,,705,SVN,2021/06/12,3,1312407,17797
Slovenia,6/13/21,256443,4404,,,91,,12335.324099104733,,,,,705,SVN,2021/06/13,3,1315575,3168
Slovenia,6/14/21,256467,4406,,,24,,12336.47853801856,,,,,705,SVN,2021/06/14,2,1324824,9249
Slovenia,6/15/21,256581,4408,,,114,,12341.962122859237,,,,,705,SVN,2021/06/15,2,1335810,10986
Slovenia,6/16/21,256701,4409,,,120,,12347.734317428372,,,,,705,SVN,2021/06/16,1,1335810,0
Slovenia,6/17/21,256784,4409,,,83,,12351.726752005357,,,,,705,SVN,2021/06/17,0,1373721,37911
Slovenia,6/18/21,256871,4411,,,87,,12355.91159306798,,,,,705,SVN,2021/06/18,2,1373721,0
Slovenia,6/19/21,256956,4412,,,85,,12360.000230887783,,,,,705,SVN,2021/06/19,1,1390017,16296
Slovenia,6/20/21,256982,4412,,,26,,12361.250873044428,,,,,705,SVN,2021/06/20,0,1392599,2582
Slovenia,6/21/21,257001,4415,,,19,,12362.164803851208,,,,,705,SVN,2021/06/21,3,1400384,7785
Slovenia,6/22/21,257066,4416,,,65,,12365.291409242824,,,,,705,SVN,2021/06/22,1,1409664,9280
Slovenia,6/23/21,257116,4417,,,50,,12367.696490313296,,,,,705,SVN,2021/06/23,1,1413358,3694
Slovenia,6/24/21,257164,4417,,,48,,12370.00536814095,,,,,705,SVN,2021/06/24,0,1413358,0
Slovenia,6/25/21,257210,4417,,,46,,12372.218042725784,,,,,705,SVN,2021/06/25,0,1453561,40203
Slovenia,6/26/21,257221,4419,,,11,,12372.747160561288,,,,,705,SVN,2021/06/26,2,1453839,278
Slovenia,6/27/21,257240,4419,,,19,,12373.661091368067,,,,,705,SVN,2021/06/27,0,1458834,4995
Slovenia,6/28/21,257252,4419,,,12,,12374.238310824981,,,,,705,SVN,2021/06/28,0,1466816,7982
Slovenia,6/29/21,257287,4419,,,35,,12375.921867574312,,,,,705,SVN,2021/06/29,0,1478156,11340
Slovenia,6/30/21,257335,4419,,,48,,12378.230745401966,,,,,705,SVN,2021/06/30,0,1492126,13970
Slovenia,7/1/21,257358,4419,,,23,,12379.337082694383,,,,,705,SVN,2021/07/01,0,1510720,18594
Slovenia,7/2/21,257383,4419,,,25,,12380.53962322962,,,,,705,SVN,2021/07/02,0,1510720,0
Solomon Islands,6/4/21,20,0,,,0,,3.0634533083764004,,,,,90,SLB,2021/06/04,0,16581,0
Solomon Islands,7/2/21,20,0,,,0,,3.0634533083764004,,,,,90,SLB,2021/07/02,0,23634,0
Somalia,6/4/21,14699,771,,,0,,92.485984116874,,,,,706,SOM,2021/06/04,0,,
Somalia,6/5/21,14729,773,,,30,,92.67474386403408,,,,,706,SOM,2021/06/05,2,,
Somalia,6/6/21,14748,773,,,19,,92.79429170390215,,,,,706,SOM,2021/06/06,0,,
Somalia,6/7/21,14768,773,,,20,,92.92013153534221,,,,,706,SOM,2021/06/07,0,,
Somalia,6/8/21,14776,773,,,8,,92.97046746791824,,,,,706,SOM,2021/06/08,0,,
Somalia,6/9/21,14779,774,,,3,,92.98934344263425,,,,,706,SOM,2021/06/09,1,,
Somalia,6/13/21,14817,774,,,38,,93.22843912237036,,,,,706,SOM,2021/06/13,0,,
Somalia,6/15/21,14823,775,,,6,,93.26619107180238,,,,,706,SOM,2021/06/15,1,,
Somalia,6/16/21,14827,775,,,4,,93.29135903809039,,,,,706,SOM,2021/06/16,0,,
Somalia,6/17/21,14841,775,,,14,,93.37944692009845,,,,,706,SOM,2021/06/17,0,,
Somalia,6/19/21,14852,775,,,11,,93.44865882739047,,,,,706,SOM,2021/06/19,0,,
Somalia,6/21/21,14867,775,,,15,,93.54303870097053,,,,,706,SOM,2021/06/21,0,,
Somalia,6/22/21,14868,775,,,1,,93.54933069254253,,,,,706,SOM,2021/06/22,0,,
Somalia,6/24/21,14875,775,,,7,,93.59337463354655,,,,,706,SOM,2021/06/24,0,,
Somalia,6/26/21,14892,775,,,17,,93.7003384902706,,,,,706,SOM,2021/06/26,0,,
Somalia,6/28/21,14933,775,,,41,,93.95831014472273,,,,,706,SOM,2021/06/28,0,,
Somalia,6/30/21,14946,775,,,13,,94.04010603515877,,,,,706,SOM,2021/06/30,0,,
Somalia,7/2/21,14946,775,,,0,,94.04010603515877,,,,,706,SOM,2021/07/02,0,,
South Africa,6/4/21,1686041,56832,,,5668,,2842.8228645751574,,,,,710,ZAF,2021/06/04,67,1266893,73541
South Africa,6/5/21,1691491,56929,,,5450,,2852.0120744531705,,,,,710,ZAF,2021/06/05,97,1336547,69654
South Africa,6/6/21,1696564,56974,,,5073,,2860.5656270607224,,,,,710,ZAF,2021/06/06,45,1343433,6886
South Africa,6/7/21,1699849,57063,,,3285,,2866.104444390864,,,,,710,ZAF,2021/06/07,89,1350245,6812
South Africa,6/8/21,1704058,57183,,,4209,,2873.201212166379,,,,,710,ZAF,2021/06/08,120,1433730,83485
South Africa,6/9/21,1712939,57310,,,8881,,2888.175409033651,,,,,710,ZAF,2021/06/09,127,1525271,91541
South Africa,6/10/21,1722086,57410,,,9147,,2903.598106786712,,,,,710,ZAF,2021/06/10,100,1619011,93740
South Africa,6/11/21,1730106,57592,,,8020,,2917.1205771026134,,,,,710,ZAF,2021/06/11,182,1690026,71015
South Africa,6/12/21,1739425,57706,,,9319,,2932.8332829472374,,,,,710,ZAF,2021/06/12,114,1767415,77389
South Africa,6/13/21,1747082,57765,,,7657,,2945.743701302457,,,,,710,ZAF,2021/06/13,59,1773417,6002
South Africa,6/14/21,1752630,57879,,,5548,,2955.098148348918,,,,,710,ZAF,2021/06/14,114,1777288,3871
South Africa,6/15/21,1761066,58087,,,8436,,2969.3220335839487,,,,,710,ZAF,2021/06/15,208,1871987,94699
South Africa,6/16/21,1774312,58223,,,13246,,2991.6560288214087,,,,,710,ZAF,2021/06/16,136,1965812,93825
South Africa,6/17/21,1786079,58323,,,11767,,3011.4962916901386,,,,,710,ZAF,2021/06/17,100,1974099,8287
South Africa,6/18/21,1796589,58441,,,10510,,3029.2171349594805,,,,,710,ZAF,2021/06/18,118,2069346,95247
South Africa,6/19/21,1810164,58590,,,13575,,3052.1058549767326,,,,,710,ZAF,2021/06/19,149,2137071,67725
South Africa,6/20/21,1823319,58702,,,13155,,3074.2864157006334,,,,,710,ZAF,2021/06/20,112,2141624,4553
South Africa,6/21/21,1832479,58795,,,9160,,3089.7310326699176,,,,,710,ZAF,2021/06/21,93,2144204,2580
South Africa,6/22/21,1843572,59092,,,11093,,3108.4348684821734,,,,,710,ZAF,2021/06/22,297,2229242,85038
South Africa,6/23/21,1861065,59258,,,17493,,3137.929703050261,,,,,710,ZAF,2021/06/23,166,2312873,83631
South Africa,6/24/21,1877143,59406,,,16078,,3165.038715237177,,,,,710,ZAF,2021/06/24,148,2550248,237375
South Africa,6/25/21,1895905,59621,,,18762,,3196.6732025273195,,,,,710,ZAF,2021/06/25,215,2661378,111130
South Africa,6/26/21,1913861,59778,,,17956,,3226.9486984116493,,,,,710,ZAF,2021/06/26,157,2682710,21332
South Africa,6/27/21,1928897,59900,,,15036,,3252.300801113631,,,,,710,ZAF,2021/06/27,122,2684999,2289
South Africa,6/28/21,1941119,60038,,,12222,,3272.908236550158,,,,,710,ZAF,2021/06/28,138,2787996,102997
South Africa,6/29/21,1954466,60264,,,13347,,3295.4125272367337,,,,,710,ZAF,2021/06/29,226,2900666,112670
South Africa,6/30/21,1973972,60647,,,19506,,3328.3014681322416,,,,,710,ZAF,2021/06/30,383,3026636,125970
South Africa,7/1/21,1995556,61029,,,21584,,3364.6941114362835,,,,,710,ZAF,2021/07/01,382,3155717,129081
South Africa,7/2/21,2019826,61332,,,24270,,3405.6156020306635,,,,,710,ZAF,2021/07/02,303,3292671,136954
South Sudan,6/4/21,10688,115,,,0,,95.48203284178132,,,,,728,SSD,2021/06/04,0,9744,0
South Sudan,6/16/21,10759,115,,,71,,96.11631655545708,,,,,728,SSD,2021/06/16,0,18863,0
South Sudan,6/17/21,10764,115,,,5,,96.16098442261735,,,,,728,SSD,2021/06/17,0,18863,0
South Sudan,6/18/21,10770,115,,,6,,96.21458586320966,,,,,728,SSD,2021/06/18,0,18863,0
South Sudan,6/21/21,10786,115,,,16,,96.35752303812251,,,,,728,SSD,2021/06/21,0,29410,0
South Sudan,6/24/21,10812,115,,,26,,96.58979594735588,,,,,728,SSD,2021/06/24,0,32959,0
South Sudan,6/28/21,10824,116,,,12,,96.69699882854052,,,,,728,SSD,2021/06/28,1,44920,0
South Sudan,6/29/21,10834,117,,,10,,96.78633456286104,,,,,728,SSD,2021/06/29,1,44920,0
South Sudan,7/1/21,10846,117,,,12,,96.89353744404568,,,,,728,SSD,2021/07/01,0,44920,0
South Sudan,7/2/21,10866,117,,,20,,97.07220891268673,,,,,728,SSD,2021/07/02,0,44920,0
Spain,6/4/21,3697981,80195,,,4969,,7909.31058326161,,,,,724,ESP,2021/06/04,146,28752570,570225
Spain,6/5/21,3697981,80196,,,0,,7909.31058326161,,,,,724,ESP,2021/06/05,1,28752570,0
Spain,6/7/21,3707523,80236,,,9542,,7929.719190440901,,,,,724,ESP,2021/06/07,40,30007806,1255236
Spain,6/8/21,3711027,80309,,,3504,,7937.213610851322,,,,,724,ESP,2021/06/08,73,30472862,465056
Spain,6/9/21,3715454,80332,,,4427,,7946.682160839031,,,,,724,ESP,2021/06/09,23,31004060,531198
Spain,6/10/21,3729458,80465,,,14004,,7976.634176657391,,,,,724,ESP,2021/06/10,133,31628321,624261
Spain,6/11/21,3733600,80501,,,4142,,7985.493163341171,,,,,724,ESP,2021/06/11,36,32282553,654232
Spain,6/14/21,3741767,80517,,,8167,,8002.960894931327,,,,,724,ESP,2021/06/14,16,33242768,960215
Spain,6/15/21,3745199,80579,,,3432,,8010.301320401808,,,,,724,ESP,2021/06/15,62,33632590,389822
Spain,6/16/21,3749031,80615,,,3832,,8018.4972733164,,,,,724,ESP,2021/06/16,36,34224523,591933
Spain,6/17/21,3753228,80634,,,4197,,8027.473895023745,,,,,724,ESP,2021/06/17,19,34845346,620823
Spain,6/18/21,3757442,80652,,,4214,,8036.486876647466,,,,,724,ESP,2021/06/18,18,35412140,566794
Spain,6/21/21,3764651,80689,,,7209,,8051.9056200089735,,,,,724,ESP,2021/06/21,37,36357745,945605
Spain,6/22/21,3768691,80719,,,4040,,8060.546447194504,,,,,724,ESP,2021/06/22,30,36880086,522341
Spain,6/23/21,3773032,80748,,,4341,,8069.83105878173,,,,,724,ESP,2021/06/23,29,37560626,680540
Spain,6/24/21,3777539,80766,,,4507,,8079.470714258261,,,,,724,ESP,2021/06/24,18,38293871,733245
Spain,6/25/21,3782463,80779,,,4924,,8090.00225709528,,,,,724,ESP,2021/06/25,13,38808490,514619
Spain,6/28/21,3792642,80789,,,10179,,8111.773291729319,,,,,724,ESP,2021/06/28,10,39914204,1105714
Spain,6/29/21,3799733,80829,,,7091,,8126.939654494814,,,,,724,ESP,2021/06/29,40,40565038,650834
Spain,6/30/21,3808960,80875,,,9227,,8146.674533811867,,,,,724,ESP,2021/06/30,46,41279995,714957
Spain,7/1/21,3821305,80883,,,12345,,8173.078249555772,,,,,724,ESP,2021/07/01,8,42027584,747589
Spain,7/2/21,3833868,80911,,,12563,,8199.94822775672,,,,,724,ESP,2021/07/02,28,42792983,765399
Sri Lanka,6/4/21,199254,1656,,,3410,,930.5173198837168,,,,,144,LKA,2021/06/04,48,2117653,0
Sri Lanka,6/5/21,202357,1656,,,3103,,945.0083476352258,,,,,144,LKA,2021/06/05,0,2117653,0
Sri Lanka,6/6/21,205333,1696,,,2976,,958.9062846601987,,,,,144,LKA,2021/06/06,40,2296864,179211
Sri Lanka,6/7/21,207979,1789,,,2646,,971.2631197973218,,,,,144,LKA,2021/06/07,93,2301489,4625
Sri Lanka,6/8/21,210661,1844,,,2682,,983.788075140392,,,,,144,LKA,2021/06/08,55,2333591,32102
Sri Lanka,6/9/21,213396,1910,,,2735,,996.5605407866625,,,,,144,LKA,2021/06/09,66,2377211,43620
Sri Lanka,6/10/21,216134,1910,,,2738,,1009.3470164500951,,,,,144,LKA,2021/06/10,0,2377211,0
Sri Lanka,6/11/21,218366,2011,,,2232,,1019.7704692188248,,,,,144,LKA,2021/06/11,101,2544373,167162
Sri Lanka,6/12/21,221277,2073,,,2911,,1033.3648558719485,,,,,144,LKA,2021/06/12,62,2632706,88333
Sri Lanka,6/13/21,223638,2136,,,2361,,1044.3907393786558,,,,,144,LKA,2021/06/13,63,2769383,136677
Sri Lanka,6/14/21,225922,2260,,,2284,,1055.0570324448647,,,,,144,LKA,2021/06/14,124,2830470,61087
Sri Lanka,6/15/21,228256,2315,,,2334,,1065.9568257971116,,,,,144,LKA,2021/06/15,55,2930212,99742
Sri Lanka,6/16/21,230692,2374,,,2436,,1077.3329597328757,,,,,144,LKA,2021/06/16,59,3027917,97705
Sri Lanka,6/17/21,233064,2425,,,2372,,1088.4102133025112,,,,,144,LKA,2021/06/17,51,3082905,54988
Sri Lanka,6/18/21,235413,2480,,,2349,,1099.3800567405694,,,,,144,LKA,2021/06/18,55,3140256,57351
Sri Lanka,6/19/21,237661,2534,,,2248,,1109.8782296008312,,,,,144,LKA,2021/06/19,54,3217818,77562
Sri Lanka,6/20/21,239689,2581,,,2028,,1119.3490012025266,,,,,144,LKA,2021/06/20,47,3261432,43614
Sri Lanka,6/21/21,241820,2633,,,2131,,1129.3007833934596,,,,,144,LKA,2021/06/21,52,3301923,40491
Sri Lanka,6/22/21,243913,2704,,,2093,,1139.075105367004,,,,,144,LKA,2021/06/22,71,3324349,22426
Sri Lanka,6/23/21,246109,2769,,,2196,,1149.3304379297865,,,,,144,LKA,2021/06/23,65,3324349,0
Sri Lanka,6/24/21,248050,2814,,,1941,,1158.3949190337757,,,,,144,LKA,2021/06/24,45,3367220,42871
Sri Lanka,6/25/21,249926,2862,,,1876,,1167.155849765916,,,,,144,LKA,2021/06/25,48,3384646,17426
Sri Lanka,6/26/21,251751,2905,,,1825,,1175.6786102062974,,,,,144,LKA,2021/06/26,43,3417997,33351
Sri Lanka,6/27/21,253618,2944,,,1867,,1184.3975108869508,,,,,144,LKA,2021/06/27,39,3453960,35963
Sri Lanka,6/28/21,255508,2985,,,1890,,1193.2238216991816,,,,,144,LKA,2021/06/28,41,3506077,52117
Sri Lanka,6/29/21,257225,3030,,,1717,,1201.2422215217214,,,,,144,LKA,2021/06/29,45,3575996,69919
Sri Lanka,6/30/21,259089,3077,,,1864,,1209.9471121852125,,,,,144,LKA,2021/06/30,47,3693289,117293
Sri Lanka,7/1/21,260972,3120,,,1883,,1218.7407329573978,,,,,144,LKA,2021/07/01,43,3866623,173334
Sri Lanka,7/2/21,262795,3157,,,1823,,1227.254153386338,,,,,144,LKA,2021/07/02,37,4036580,169957
Sudan,6/4/21,35656,2662,,,0,,81.31492454298383,,,,,729,SDN,2021/06/04,0,402114,0
Sudan,6/6/21,35656,2697,,,0,,81.31492454298383,,,,,729,SDN,2021/06/06,35,402114,0
Sudan,6/7/21,36004,2697,,,348,,82.10855236834165,,,,,729,SDN,2021/06/07,0,402114,0
Sudan,6/8/21,36004,2711,,,0,,82.10855236834165,,,,,729,SDN,2021/06/08,14,465197,0
Sudan,6/9/21,36122,2719,,,118,,82.37765605625033,,,,,729,SDN,2021/06/09,8,465197,0
Sudan,6/10/21,36203,2719,,,81,,82.56237977422155,,,,,729,SDN,2021/06/10,0,483520,0
Sudan,6/13/21,36203,2732,,,0,,82.56237977422155,,,,,729,SDN,2021/06/13,13,483520,0
Sudan,6/14/21,36304,2732,,,101,,82.79271428675357,,,,,729,SDN,2021/06/14,0,539843,0
Sudan,6/16/21,36304,2737,,,0,,82.79271428675357,,,,,729,SDN,2021/06/16,5,539843,0
Sudan,6/17/21,36347,2737,,,43,,82.89077749505927,,,,,729,SDN,2021/06/17,0,539843,0
Sudan,6/22/21,36347,2748,,,0,,82.89077749505927,,,,,729,SDN,2021/06/22,11,610924,0
Sudan,6/23/21,36522,2750,,,175,,83.28987194746621,,,,,729,SDN,2021/06/23,2,610924,0
Sudan,6/24/21,36558,2750,,,36,,83.37197137767565,,,,,729,SDN,2021/06/24,0,629692,0
Sudan,6/25/21,36574,2750,,,16,,83.40846001332429,,,,,729,SDN,2021/06/25,0,629692,0
Sudan,6/27/21,36574,2754,,,0,,83.40846001332429,,,,,729,SDN,2021/06/27,4,629692,0
Sudan,6/28/21,36620,2754,,,46,,83.5133648408141,,,,,729,SDN,2021/06/28,0,671423,0
Sudan,6/30/21,36658,2754,,,38,,83.60002535047961,,,,,729,SDN,2021/06/30,0,677957,0
Sudan,7/1/21,36658,2760,,,0,,83.60002535047961,,,,,729,SDN,2021/07/01,6,677957,0
Sudan,7/2/21,36658,2760,,,0,,83.60002535047961,,,,,729,SDN,2021/07/02,0,677957,0
Summer Olympics 2020,6/4/21,0,0,,,0,,,,,,,2020,,2021/06/04,0,,
Summer Olympics 2020,6/19/21,1,0,,,1,,,,,,,2020,,2021/06/19,0,,
Summer Olympics 2020,6/24/21,6,0,,,5,,,,,,,2020,,2021/06/24,0,,
Summer Olympics 2020,6/28/21,1,0,,,,,,,,,,2020,,2021/06/28,0,,
Summer Olympics 2020,7/2/21,1,0,,,0,,,,,,,2020,,2021/07/02,0,,
Suriname,6/4/21,16009,332,,,333,,2728.9587715679622,,,,,740,SUR,2021/06/04,7,90052,0
Suriname,6/5/21,16292,339,,,283,,2777.2000940961484,,,,,740,SUR,2021/06/05,7,90052,0
Suriname,6/6/21,16541,350,,,249,,2819.6456393594644,,,,,740,SUR,2021/06/06,11,102612,12560
Suriname,6/7/21,16786,355,,,245,,2861.409328473972,,,,,740,SUR,2021/06/07,5,108076,5464
Suriname,6/8/21,17041,363,,,255,,2904.8776579605,,,,,740,SUR,2021/06/08,8,110393,2317
Suriname,6/9/21,17313,373,,,272,,2951.2438760794635,,,,,740,SUR,2021/06/09,10,112200,1807
Suriname,6/10/21,17546,384,,,233,,2990.961996747546,,,,,740,SUR,2021/06/10,11,112200,0
Suriname,6/11/21,17799,390,,,253,,3034.08939815967,,,,,740,SUR,2021/06/11,6,112200,0
Suriname,6/12/21,18110,393,,,311,,3087.1037137295143,,,,,740,SUR,2021/06/12,3,127078,14878
Suriname,6/13/21,18372,404,,,262,,3131.765291476457,,,,,740,SUR,2021/06/13,11,136853,9775
Suriname,6/14/21,18599,412,,,227,,3170.4606279213276,,,,,740,SUR,2021/06/14,8,146567,9714
Suriname,6/15/21,18825,418,,,226,,3208.9855003289954,,,,,740,SUR,2021/06/15,6,152546,5979
Suriname,6/16/21,19108,427,,,283,,3257.226822857182,,,,,740,SUR,2021/06/16,9,155669,3123
Suriname,6/17/21,19361,436,,,253,,3300.354224269306,,,,,740,SUR,2021/06/17,9,161829,6160
Suriname,6/18/21,19576,443,,,215,,3337.003992267751,,,,,740,SUR,2021/06/18,7,165785,3956
Suriname,6/19/21,19748,454,,,172,,3366.3238066665076,,,,,740,SUR,2021/06/19,11,165785,0
Suriname,6/20/21,20025,460,,,277,,3413.5423449714813,,,,,740,SUR,2021/06/20,6,175694,9909
Suriname,6/21/21,20141,467,,,116,,3433.3161732869216,,,,,740,SUR,2021/06/21,7,177228,1534
Suriname,6/22/21,20298,477,,,157,,3460.079027127647,,,,,740,SUR,2021/06/22,10,180150,2922
Suriname,6/23/21,20549,482,,,251,,3502.865500465367,,,,,740,SUR,2021/06/23,5,182331,2181
Suriname,6/24/21,20723,490,,,174,,3532.526242938527,,,,,740,SUR,2021/06/24,8,184446,2115
Suriname,6/25/21,20911,494,,,188,,3564.5734819325166,,,,,740,SUR,2021/06/25,4,187306,2860
Suriname,6/26/21,21060,499,,,149,,3589.9726234756254,,,,,740,SUR,2021/06/26,5,187306,0
Suriname,6/27/21,21249,507,,,189,,3622.1903265068167,,,,,740,SUR,2021/06/27,8,191963,4657
Suriname,6/28/21,21360,512,,,111,,3641.111834636247,,,,,740,SUR,2021/06/28,5,192975,1012
Suriname,6/29/21,21519,516,,,159,,3668.215616551376,,,,,740,SUR,2021/06/29,4,192975,0
Suriname,6/30/21,21732,522,,,213,,3704.5244564754175,,,,,740,SUR,2021/06/30,6,196194,3219
Suriname,7/1/21,21936,531,,,204,,3739.2991200646397,,,,,740,SUR,2021/07/01,9,197723,1529
Suriname,7/2/21,22063,539,,,127,,3760.948052789303,,,,,740,SUR,2021/07/02,8,197723,0
Sweden,6/4/21,1078062,14523,,,1069,,10674.652722424493,,,,,752,SWE,2021/06/04,11,5552320,151884
Sweden,6/8/21,1080733,14546,,,2671,,10701.100178527755,,,,,752,SWE,2021/06/08,23,5838969,286649
Sweden,6/9/21,1081898,14562,,,1165,,10712.635665746138,,,,,752,SWE,2021/06/09,16,5888247,49278
Sweden,6/10/21,1082729,14565,,,831,,10720.863983238392,,,,,752,SWE,2021/06/10,3,5888247,0
Sweden,6/11/21,1083456,14574,,,727,,10728.062523330895,,,,,752,SWE,2021/06/11,9,6151465,263218
Sweden,6/15/21,1084636,14574,,,1180,,10739.74653613578,,,,,752,SWE,2021/06/15,0,6452390,300925
Sweden,6/22/21,1088014,14608,,,3378,,10773.194498216208,,,,,752,SWE,2021/06/22,34,7023453,292101
Sweden,6/23/21,1088518,14616,,,504,,10778.184957922702,,,,,752,SWE,2021/06/23,8,7099237,75784
Sweden,6/24/21,1088896,14619,,,378,,10781.927802702572,,,,,752,SWE,2021/06/24,3,7099237,0
Sweden,6/29/21,1089743,14626,,,847,,10790.314547487096,,,,,752,SWE,2021/06/29,7,7731190,502188
Sweden,6/30/21,1089990,14629,,,247,,10792.760268811508,,,,,752,SWE,2021/06/30,3,7789784,58594
Sweden,7/1/21,1090553,14630,,,563,,10798.334929158245,,,,,752,SWE,2021/07/01,1,7789784,0
Sweden,7/2/21,1090880,14631,,,327,,10801.572786944007,,,,,752,SWE,2021/07/02,1,8168667,378883
Switzerland,6/4/21,697292,10831,,,491,,8056.87784255758,,,,,756,CHE,2021/06/04,3,5128983,326331
Switzerland,6/5/21,697292,10832,,,0,,8056.87784255758,,,,,756,CHE,2021/06/05,1,5128983,0
Switzerland,6/7/21,698369,10841,,,1077,,8069.3220659768,,,,,756,CHE,2021/06/07,9,5128983,0
Switzerland,6/8/21,698798,10844,,,429,,8074.278957199497,,,,,756,CHE,2021/06/08,3,5467187,338204
Switzerland,6/9/21,698798,10851,,,0,,8074.278957199497,,,,,756,CHE,2021/06/09,7,5467187,0
Switzerland,6/10/21,699697,10853,,,899,,8084.666475169673,,,,,756,CHE,2021/06/10,2,5467187,0
Switzerland,6/11/21,700051,10859,,,354,,8088.756777017772,,,,,756,CHE,2021/06/11,6,5785134,317947
Switzerland,6/14/21,700735,10861,,,684,,8096.660072114101,,,,,756,CHE,2021/06/14,2,5785134,0
Switzerland,6/15/21,700978,10866,,,243,,8099.467821687797,,,,,756,CHE,2021/06/15,5,6093274,308140
Switzerland,6/16/21,701260,10868,,,282,,8102.726197736284,,,,,756,CHE,2021/06/16,2,6120202,26928
Switzerland,6/17/21,701454,10867,,,194,,8104.967775585243,,,,,756,CHE,2021/06/17,,6231400,111198
Switzerland,6/18/21,701627,10868,,,173,,8106.966708409314,,,,,756,CHE,2021/06/18,1,6231400,0
Switzerland,6/21/21,701994,10875,,,367,,8111.207219082345,,,,,756,CHE,2021/06/21,7,6231400,0
Switzerland,6/22/21,702124,10875,,,130,,8112.709307331646,,,,,756,CHE,2021/06/22,0,6231400,0
Switzerland,6/23/21,702278,10876,,,154,,8114.48870418082,,,,,756,CHE,2021/06/23,1,6093274,-138126
Switzerland,6/24/21,702398,10880,,,120,,8115.875247180176,,,,,756,CHE,2021/06/24,4,0,-6093274
Switzerland,6/25/21,702507,10882,,,109,,8117.134690404591,,,,,756,CHE,2021/06/25,2,0,0
Switzerland,6/28/21,702746,10885,,,239,,8119.896221878308,,,,,756,CHE,2021/06/28,3,6093274,6093274
Switzerland,6/29/21,702875,10887,,,129,,8121.386755602616,,,,,756,CHE,2021/06/29,2,6093274,0
Switzerland,6/30/21,703004,10891,,,129,,8122.877289326923,,,,,756,CHE,2021/06/30,4,6093274,0
Switzerland,7/1/21,703176,10894,,,172,,8124.8646676260005,,,,,756,CHE,2021/07/01,3,6093274,0
Switzerland,7/2/21,703334,10894,,,158,,8126.690282575152,,,,,756,CHE,2021/07/02,0,7489716,1396442
Syria,6/4/21,24619,1787,,,28,,140.6747186691334,,,,,760,SYR,2021/06/04,5,24781,0
Syria,6/5/21,24639,1790,,,20,,140.78900009296794,,,,,760,SYR,2021/06/05,3,24781,0
Syria,6/6/21,24659,1793,,,20,,140.90328151680248,,,,,760,SYR,2021/06/06,3,24781,0
Syria,6/7/21,24680,1796,,,21,,141.02327701182875,,,,,760,SYR,2021/06/07,3,24781,0
Syria,6/8/21,24700,1799,,,20,,141.1375584356633,,,,,760,SYR,2021/06/08,3,71519,0
Syria,6/9/21,24723,1801,,,23,,141.26898207307303,,,,,760,SYR,2021/06/09,2,71519,0
Syria,6/10/21,24743,1804,,,20,,141.38326349690757,,,,,760,SYR,2021/06/10,3,71519,0
Syria,6/11/21,24767,1806,,,24,,141.52040120550902,,,,,760,SYR,2021/06/11,2,71519,0
Syria,6/12/21,24789,1808,,,22,,141.64611077172702,,,,,760,SYR,2021/06/12,2,71519,0
Syria,6/13/21,24814,1810,,,25,,141.7889625515202,,,,,760,SYR,2021/06/13,2,71519,0
Syria,6/14/21,24860,1815,,,46,,142.05180982633965,,,,,760,SYR,2021/06/14,5,71519,0
Syria,6/15/21,24904,1821,,,44,,142.30322895877566,,,,,760,SYR,2021/06/15,6,71519,0
Syria,6/16/21,24946,1826,,,42,,142.5432199488282,,,,,760,SYR,2021/06/16,5,71519,0
Syria,6/17/21,24991,1832,,,45,,142.80035315245593,,,,,760,SYR,2021/06/17,6,71519,0
Syria,6/18/21,25035,1837,,,44,,143.05177228489194,,,,,760,SYR,2021/06/18,5,71519,0
Syria,6/19/21,25076,1841,,,41,,143.28604920375275,,,,,760,SYR,2021/06/19,4,71519,0
Syria,6/20/21,25118,1845,,,42,,143.5260401938053,,,,,760,SYR,2021/06/20,4,71519,0
Syria,6/21/21,25158,1848,,,40,,143.75460304147438,,,,,760,SYR,2021/06/21,3,71519,0
Syria,6/22/21,25205,1851,,,47,,144.02316438748556,,,,,760,SYR,2021/06/22,3,108276,0
Syria,6/23/21,25248,1855,,,43,,144.26886944872984,,,,,760,SYR,2021/06/23,4,108276,0
Syria,6/24/21,25287,1859,,,39,,144.4917182252072,,,,,760,SYR,2021/06/24,4,108276,0
Syria,6/25/21,25328,1862,,,41,,144.725995144068,,,,,760,SYR,2021/06/25,3,108276,0
Syria,6/26/21,25365,1864,,,37,,144.93741577816192,,,,,760,SYR,2021/06/26,2,108276,0
Syria,6/27/21,25404,1867,,,39,,145.1602645546393,,,,,760,SYR,2021/06/27,3,108276,0
Syria,6/28/21,25442,1870,,,38,,145.3773992599249,,,,,760,SYR,2021/06/28,3,108276,0
Syria,6/29/21,25479,1873,,,37,,145.58881989401883,,,,,760,SYR,2021/06/29,3,108276,0
Syria,6/30/21,25515,1876,,,36,,145.794526456921,,,,,760,SYR,2021/06/30,3,108276,0
Syria,7/1/21,25551,1879,,,36,,146.00023301982318,,,,,760,SYR,2021/07/01,3,108276,0
Syria,7/2/21,25586,1882,,,35,,146.20022551153366,,,,,760,SYR,2021/07/02,3,108276,0
Taiwan*,6/4/21,10446,187,,,472,,43.8598424849712,,,,,158,TWN,2021/06/04,21,724900,103578
Taiwan*,6/5/21,10956,224,,,510,,46.00119033748272,,,,,158,TWN,2021/06/05,37,678418,-46482
Taiwan*,6/6/21,11298,260,,,342,,47.43715301504927,,,,,158,TWN,2021/06/06,36,699187,20769
Taiwan*,6/7/21,11491,286,,,193,,48.247506221980096,,,,,158,TWN,2021/06/07,26,724819,25632
Taiwan*,6/8/21,11694,308,,,203,,49.09984664170527,,,,,158,TWN,2021/06/08,22,743578,18759
Taiwan*,6/9/21,11968,333,,,274,,50.25029627227028,,,,,158,TWN,2021/06/09,25,759746,16168
Taiwan*,6/10/21,12222,361,,,254,,51.316771477246604,,,,,158,TWN,2021/06/10,28,759746,0
Taiwan*,6/11/21,12500,385,,,278,,52.48401599292935,,,,,158,TWN,2021/06/11,24,799129,39383
Taiwan*,6/12/21,12746,411,,,246,,53.516901427670206,,,,,158,TWN,2021/06/12,26,799129,0
Taiwan*,6/13/21,12921,437,,,175,,54.251677651571214,,,,,158,TWN,2021/06/13,26,799129,0
Taiwan*,6/14/21,13106,452,,,185,,55.02844108826657,,,,,158,TWN,2021/06/14,15,855125,55996
Taiwan*,6/15/21,13241,460,,,135,,55.595268460990205,,,,,158,TWN,2021/06/15,8,1009160,154035
Taiwan*,6/16/21,13409,478,,,168,,56.30065363593518,,,,,158,TWN,2021/06/16,18,1009160,0
Taiwan*,6/17/21,13584,497,,,175,,57.035429859836185,,,,,158,TWN,2021/06/17,19,1321839,312679
Taiwan*,6/18/21,13771,518,,,187,,57.82059073909041,,,,,158,TWN,2021/06/18,21,1321839,0
Taiwan*,6/19/21,13896,538,,,125,,58.3454308990197,,,,,158,TWN,2021/06/19,20,1429514,107675
Taiwan*,6/20/21,14005,549,,,109,,58.80309151847805,,,,,158,TWN,2021/06/20,11,1429514,0
Taiwan*,6/21/21,14080,569,,,75,,59.11799561443562,,,,,158,TWN,2021/06/21,20,1616384,186870
Taiwan*,6/22/21,14157,575,,,77,,59.44129715295207,,,,,158,TWN,2021/06/22,6,1616384,0
Taiwan*,6/23/21,14260,599,,,103,,59.873765444733806,,,,,158,TWN,2021/06/23,24,1746130,129746
Taiwan*,6/24/21,14389,605,,,129,,60.415400489780836,,,,,158,TWN,2021/06/24,6,1746130,0
Taiwan*,6/25/21,14465,610,,,76,,60.734503307017846,,,,,158,TWN,2021/06/25,5,1835225,89095
Taiwan*,6/26/21,14545,623,,,80,,61.070401009372596,,,,,158,TWN,2021/06/26,13,1905474,70249
Taiwan*,6/27/21,14634,632,,,89,,61.444087203242255,,,,,158,TWN,2021/06/27,9,1926973,21499
Taiwan*,6/28/21,14694,635,,,60,,61.69601048000831,,,,,158,TWN,2021/06/28,3,1964592,37619
Taiwan*,6/29/21,14748,643,,,54,,61.92274142909777,,,,,158,TWN,2021/06/29,8,2002677,38085
Taiwan*,6/30/21,14804,648,,,56,,62.15786982074609,,,,,158,TWN,2021/06/30,5,2043218,40541
Taiwan*,7/1/21,14853,661,,,49,,62.363607163438374,,,,,158,TWN,2021/07/01,13,2043218,0
Taiwan*,7/2/21,14911,676,,,58,,62.607132997645564,,,,,158,TWN,2021/07/02,15,2043218,0
Tajikistan,6/4/21,13308,90,,,0,,139.5313432817042,,,,,762,TJK,2021/06/04,0,,
Tajikistan,6/23/21,13358,90,,,50,,140.0555818723328,,,,,762,TJK,2021/06/23,0,,
Tajikistan,6/25/21,13392,90,,,34,,140.41206411396024,,,,,762,TJK,2021/06/25,0,,
Tajikistan,6/26/21,13415,90,,,23,,140.6532138656494,,,,,762,TJK,2021/06/26,0,,
Tajikistan,6/27/21,13439,90,,,24,,140.9048483891511,,,,,762,TJK,2021/06/27,0,,
Tajikistan,6/28/21,13460,90,,,21,,141.1250285972151,,,,,762,TJK,2021/06/28,0,,
Tajikistan,6/29/21,13478,90,,,18,,141.31375448984141,,,,,762,TJK,2021/06/29,0,,
Tajikistan,6/30/21,13499,90,,,21,,141.5339346979054,,,,,762,TJK,2021/06/30,0,,
Tajikistan,7/1/21,13523,90,,,24,,141.78556922140714,,,,,762,TJK,2021/07/01,0,,
Tajikistan,7/2/21,13523,90,,,0,,141.78556922140714,,,,,762,TJK,2021/07/02,0,,
Tanzania,6/4/21,509,21,,,0,,0.852107987092757,,,,,834,TZA,2021/06/04,0,,
Tanzania,7/2/21,509,21,,,0,,0.852107987092757,,,,,834,TZA,2021/07/02,0,,
Thailand,6/4/21,171978,1177,,,2630,,246.38689714200197,,,,,764,THA,2021/06/04,31,3609882,0
Thailand,6/5/21,174796,1213,,,2818,,250.42414769815542,,,,,764,THA,2021/06/05,36,3609882,0
Thailand,6/6/21,177467,1236,,,2671,,254.2507964687324,,,,,764,THA,2021/06/06,23,4190503,580621
Thailand,6/7/21,179886,1269,,,2419,,257.71641360689256,,,,,764,THA,2021/06/07,33,4634941,444438
Thailand,6/8/21,182548,1297,,,2662,,261.5301683905975,,,,,764,THA,2021/06/08,28,5107069,472128
Thailand,6/9/21,185228,1332,,,2680,,265.3697111480465,,,,,764,THA,2021/06/09,35,5107069,0
Thailand,6/10/21,187538,1375,,,2310,,268.67916777853424,,,,,764,THA,2021/06/10,43,5107069,0
Thailand,6/11/21,189828,1402,,,2290,,271.95997110486195,,,,,764,THA,2021/06/11,27,5667058,559989
Thailand,6/12/21,193105,1431,,,3277,,276.654814991489,,,,,764,THA,2021/06/12,29,5975070,308012
Thailand,6/13/21,195909,1449,,,2804,,280.6720082347304,,,,,764,THA,2021/06/13,18,6188124,213054
Thailand,6/14/21,199264,1466,,,3355,,285.4786000075817,,,,,764,THA,2021/06/14,17,6188124,0
Thailand,6/15/21,202264,1485,,,3000,,289.77659563159176,,,,,764,THA,2021/06/15,19,6780816,592692
Thailand,6/16/21,204595,1525,,,2331,,293.11613823144756,,,,,764,THA,2021/06/16,40,6780816,0
Thailand,6/17/21,207724,1555,,,3129,,297.5989476672901,,,,,764,THA,2021/06/17,30,7219668,438852
Thailand,6/18/21,210782,1577,,,3058,,301.9800378733644,,,,,764,THA,2021/06/18,22,7219668,0
Thailand,6/19/21,214449,1609,,,3667,,307.2336211911127,,,,,764,THA,2021/06/19,32,7219668,0
Thailand,6/20/21,218131,1629,,,3682,,312.5086944869811,,,,,764,THA,2021/06/20,20,7483083,263415
Thailand,6/21/21,221306,1658,,,3175,,317.0574065223917,,,,,764,THA,2021/06/21,29,7587178,104095
Thailand,6/22/21,225365,1693,,,4059,,322.8725946016774,,,,,764,THA,2021/06/22,35,7906696,319518
Thailand,6/23/21,228539,1744,,,3174,,327.41987397188007,,,,,764,THA,2021/06/23,51,8148335,241639
Thailand,6/24/21,232647,1775,,,4108,,333.30526264635785,,,,,764,THA,2021/06/24,31,8148335,0
Thailand,6/25/21,236291,1819,,,3644,,338.5258946643221,,,,,764,THA,2021/06/25,44,8657423,509088
Thailand,6/26/21,240452,1870,,,4161,,344.4872145948241,,,,,764,THA,2021/06/26,51,8981478,324055
Thailand,6/27/21,244447,1912,,,3995,,350.21071210079754,,,,,764,THA,2021/06/27,42,8981478,0
Thailand,6/28/21,249853,1934,,,5406,,357.9557002152637,,,,,764,THA,2021/06/28,22,9147513,166035
Thailand,6/29/21,254515,1970,,,4662,,364.63478541497534,,,,,764,THA,2021/06/29,36,9416972,269459
Thailand,6/30/21,259301,2023,,,4786,,371.4915211004794,,,,,764,THA,2021/06/30,53,9672706,255734
Thailand,7/1/21,264834,2080,,,5533,,379.418457696362,,,,,764,THA,2021/07/01,57,10227183,554477
Thailand,7/2/21,270921,2141,,,6087,,388.13909081747846,,,,,764,THA,2021/07/02,61,10227183,0
Timor-Leste,6/4/21,7511,17,,,89,,569.6875554631906,,,,,626,TLS,2021/06/04,1,,
Timor-Leste,6/5/21,7659,17,,,148,,580.9129260141895,,,,,626,TLS,2021/06/05,0,,
Timor-Leste,6/6/21,7740,17,,,81,,587.0565409779118,,,,,626,TLS,2021/06/06,0,,
Timor-Leste,6/7/21,7764,17,,,24,,588.8768713375332,,,,,626,TLS,2021/06/07,0,,
Timor-Leste,6/9/21,7941,18,,,177,,602.3018077397413,,,,,626,TLS,2021/06/09,1,,
Timor-Leste,6/10/21,8113,18,,,172,,615.3475086503615,,,,,626,TLS,2021/06/10,0,,
Timor-Leste,6/11/21,8145,18,,,32,,617.7746157965234,,,,,626,TLS,2021/06/11,0,,
Timor-Leste,6/12/21,8228,18,,,83,,624.0699249568809,,,,,626,TLS,2021/06/12,0,,
Timor-Leste,6/13/21,8285,18,,,57,,628.3932095609819,,,,,626,TLS,2021/06/13,0,,
Timor-Leste,6/14/21,8341,19,,,56,,632.6406470667652,,,,,626,TLS,2021/06/14,1,,
Timor-Leste,6/15/21,8412,19,,,71,,638.0257910473119,,,,,626,TLS,2021/06/15,0,,
Timor-Leste,6/16/21,8478,19,,,66,,643.0316995362708,,,,,626,TLS,2021/06/16,0,,
Timor-Leste,6/17/21,8504,19,,,26,,645.0037240925274,,,,,626,TLS,2021/06/17,0,,
Timor-Leste,6/18/21,8602,19,,,98,,652.4367397276483,,,,,626,TLS,2021/06/18,0,,
Timor-Leste,6/19/21,8678,19,,,76,,658.2011191997827,,,,,626,TLS,2021/06/19,0,,
Timor-Leste,6/20/21,8707,19,,,29,,660.400685050992,,,,,626,TLS,2021/06/20,0,,
Timor-Leste,6/21/21,8728,19,,,21,,661.9934741156608,,,,,626,TLS,2021/06/21,0,,
Timor-Leste,6/22/21,8781,19,,,53,,666.0133703264914,,,,,626,TLS,2021/06/22,0,,
Timor-Leste,6/23/21,8843,19,,,62,,670.7158904221801,,,,,626,TLS,2021/06/23,0,,
Timor-Leste,6/24/21,8889,20,,,46,,674.2048569447878,,,,,626,TLS,2021/06/24,1,,
Timor-Leste,6/25/21,8912,20,,,23,,675.9493402060917,,,,,626,TLS,2021/06/25,0,,
Timor-Leste,6/26/21,8979,21,,,67,,681.0310957933682,,,,,626,TLS,2021/06/26,1,,
Timor-Leste,6/27/21,9035,21,,,56,,685.2785332991516,,,,,626,TLS,2021/06/27,0,,
Timor-Leste,6/28/21,9055,21,,,20,,686.7954752655028,,,,,626,TLS,2021/06/28,0,,
Timor-Leste,6/29/21,9118,22,,,63,,691.573842459509,,,,,626,TLS,2021/06/29,1,,
Timor-Leste,6/30/21,9222,23,,,104,,699.4619406845352,,,,,626,TLS,2021/06/30,1,,
Timor-Leste,7/1/21,9278,24,,,56,,703.7093781903186,,,,,626,TLS,2021/07/01,1,,
Timor-Leste,7/2/21,9361,24,,,83,,710.004687350676,,,,,626,TLS,2021/07/02,0,,
Togo,6/4/21,13522,125,,,9,,163.3340931110627,,,,,768,TGO,2021/06/04,0,311938,0
Togo,6/5/21,13533,125,,,11,,163.4669636201754,,,,,768,TGO,2021/06/05,0,311938,0
Togo,6/6/21,13539,125,,,6,,163.53943844332778,,,,,768,TGO,2021/06/06,0,311938,0
Togo,6/7/21,13542,125,,,3,,163.57567585490395,,,,,768,TGO,2021/06/07,0,311938,0
Togo,6/8/21,13551,125,,,9,,163.6843880896325,,,,,768,TGO,2021/06/08,0,318666,6728
Togo,6/9/21,13563,126,,,12,,163.82933773593726,,,,,768,TGO,2021/06/09,1,318666,0
Togo,6/10/21,13576,126,,,13,,163.98636651943406,,,,,768,TGO,2021/06/10,0,347246,28580
Togo,6/11/21,13597,126,,,21,,164.24002840046737,,,,,768,TGO,2021/06/11,0,347246,0
Togo,6/13/21,13627,126,,,30,,164.60240251622923,,,,,768,TGO,2021/06/13,0,347246,0
Togo,6/14/21,13631,126,,,4,,164.65071906499747,,,,,768,TGO,2021/06/14,0,347246,0
Togo,6/15/21,13651,126,,,20,,164.8923018088387,,,,,768,TGO,2021/06/15,0,347246,0
Togo,6/16/21,13669,127,,,18,,165.10972627829582,,,,,768,TGO,2021/06/16,1,347246,0
Togo,6/17/21,13682,127,,,13,,165.26675506179265,,,,,768,TGO,2021/06/17,0,347246,0
Togo,6/18/21,13701,127,,,19,,165.4962586684418,,,,,768,TGO,2021/06/18,0,347246,0
Togo,6/19/21,13715,127,,,14,,165.66536658913068,,,,,768,TGO,2021/06/19,0,347246,0
Togo,6/20/21,13721,128,,,6,,165.73784141228305,,,,,768,TGO,2021/06/20,1,347246,0
Togo,6/21/21,13731,128,,,10,,165.85863278420368,,,,,768,TGO,2021/06/21,0,347246,0
Togo,6/22/21,13735,128,,,4,,165.90694933297192,,,,,768,TGO,2021/06/22,0,347246,0
Togo,6/23/21,13749,128,,,14,,166.0760572536608,,,,,768,TGO,2021/06/23,0,347246,0
Togo,6/25/21,13788,128,,,39,,166.54714360415122,,,,,768,TGO,2021/06/25,0,347246,0
Togo,6/27/21,13816,128,,,28,,166.88535944552896,,,,,768,TGO,2021/06/27,0,347246,0
Togo,6/28/21,13846,128,,,30,,167.2477335612908,,,,,768,TGO,2021/06/28,0,347246,0
Togo,6/29/21,13881,129,,,35,,167.67050336301298,,,,,768,TGO,2021/06/29,1,347246,0
Togo,6/30/21,13917,129,,,36,,168.1053523019272,,,,,768,TGO,2021/06/30,0,347246,0
Togo,7/1/21,13962,130,,,45,,168.64891347557,,,,,768,TGO,2021/07/01,1,347246,0
Togo,7/2/21,13999,130,,,37,,169.0958415516763,,,,,768,TGO,2021/07/02,0,347246,0
Trinidad and Tobago,6/4/21,25801,556,,,529,,1843.59885129665,,,,,780,TTO,2021/06/04,19,111289,3523
Trinidad and Tobago,6/5/21,26192,564,,,391,,1871.5375804488917,,,,,780,TTO,2021/06/05,8,111289,0
Trinidad and Tobago,6/6/21,26410,577,,,218,,1887.114672405896,,,,,780,TTO,2021/06/06,13,119756,8467
Trinidad and Tobago,6/7/21,26799,589,,,389,,1914.910492457615,,,,,780,TTO,2021/06/07,12,125344,5588
Trinidad and Tobago,6/8/21,27079,599,,,280,,1934.9177665308316,,,,,780,TTO,2021/06/08,10,132926,7582
Trinidad and Tobago,6/9/21,27533,616,,,454,,1967.358132349547,,,,,780,TTO,2021/06/09,17,142493,9567
Trinidad and Tobago,6/10/21,27806,630,,,273,,1986.8652245709334,,,,,780,TTO,2021/06/10,14,142493,0
Trinidad and Tobago,6/11/21,28106,644,,,300,,2008.3015896493796,,,,,780,TTO,2021/06/11,14,159709,17216
Trinidad and Tobago,6/12/21,28422,656,,,316,,2030.88122753201,,,,,780,TTO,2021/06/12,12,164033,4324
Trinidad and Tobago,6/13/21,28723,670,,,301,,2052.389047160718,,,,,780,TTO,2021/06/13,14,170164,6131
Trinidad and Tobago,6/14/21,28982,677,,,259,,2070.895775678443,,,,,780,TTO,2021/06/14,7,180063,9899
Trinidad and Tobago,6/15/21,29309,686,,,327,,2094.2614136139496,,,,,780,TTO,2021/06/15,9,185533,5470
Trinidad and Tobago,6/16/21,29606,695,,,297,,2115.4834150416114,,,,,780,TTO,2021/06/16,9,185533,0
Trinidad and Tobago,6/17/21,29956,699,,,350,,2140.4925076331324,,,,,780,TTO,2021/06/17,4,201313,15780
Trinidad and Tobago,6/18/21,30183,713,,,227,,2156.7126905424902,,,,,780,TTO,2021/06/18,14,201313,0
Trinidad and Tobago,6/19/21,30513,732,,,330,,2180.2926921287813,,,,,780,TTO,2021/06/19,19,215635,14322
Trinidad and Tobago,6/20/21,30619,737,,,106,,2187.866874456499,,,,,780,TTO,2021/06/20,5,215991,356
Trinidad and Tobago,6/21/21,30767,747,,,148,,2198.442147895199,,,,,780,TTO,2021/06/21,10,222473,6482
Trinidad and Tobago,6/22/21,30982,761,,,215,,2213.804876201419,,,,,780,TTO,2021/06/22,14,225198,2725
Trinidad and Tobago,6/23/21,31207,768,,,225,,2229.8821500102536,,,,,780,TTO,2021/06/23,7,235400,10202
Trinidad and Tobago,6/24/21,31429,775,,,222,,2245.745060168304,,,,,780,TTO,2021/06/24,7,235400,0
Trinidad and Tobago,6/25/21,31775,791,,,346,,2270.4683345587787,,,,,780,TTO,2021/06/25,16,245013,9613
Trinidad and Tobago,6/26/21,32069,800,,,294,,2291.4759723356565,,,,,780,TTO,2021/06/26,9,266649,21636
Trinidad and Tobago,6/27/21,32198,817,,,129,,2300.693609319388,,,,,780,TTO,2021/06/27,17,275675,9026
Trinidad and Tobago,6/28/21,32343,822,,,145,,2311.054519107304,,,,,780,TTO,2021/06/28,5,284016,8341
Trinidad and Tobago,6/29/21,32528,833,,,185,,2324.273610905679,,,,,780,TTO,2021/06/29,11,292803,8787
Trinidad and Tobago,6/30/21,32793,847,,,265,,2343.2090667249736,,,,,780,TTO,2021/06/30,14,302548,9745
Trinidad and Tobago,7/1/21,33029,857,,,236,,2360.0723405866847,,,,,780,TTO,2021/07/01,10,311812,9264
Trinidad and Tobago,7/2/21,33153,866,,,124,,2368.9327048191094,,,,,780,TTO,2021/07/02,9,311812,0
Tunisia,6/4/21,352303,12902,,,1816,,2980.9153659082644,,,,,788,TUN,2021/06/04,63,1051796,34936
Tunisia,6/5/21,353782,12948,,,1479,,2993.4295194243523,,,,,788,TUN,2021/06/05,46,1051796,0
Tunisia,6/6/21,355732,12980,,,1950,,3009.928910469904,,,,,788,TUN,2021/06/06,32,1126036,74240
Tunisia,6/7/21,356750,13027,,,1018,,3018.5424387183,,,,,788,TUN,2021/06/07,47,1126036,0
Tunisia,6/8/21,358183,13126,,,1433,,3030.667375830237,,,,,788,TUN,2021/06/08,99,1192895,66859
Tunisia,6/9/21,360285,13229,,,2102,,3048.452873254724,,,,,788,TUN,2021/06/09,103,1223563,30668
Tunisia,6/10/21,362658,13305,,,2373,,3068.531362973234,,,,,788,TUN,2021/06/10,76,1223563,0
Tunisia,6/11/21,364819,13365,,,2161,,3086.816072742177,,,,,788,TUN,2021/06/11,60,1252125,28562
Tunisia,6/12/21,367047,13436,,,2228,,3105.667684664992,,,,,788,TUN,2021/06/12,71,1252125,0
Tunisia,6/13/21,368908,13515,,,1861,,3121.4140265807728,,,,,788,TUN,2021/06/13,79,1347889,95764
Tunisia,6/14/21,370224,13567,,,1316,,3132.549000229976,,,,,788,TUN,2021/06/14,52,1381614,33725
Tunisia,6/15/21,372221,13656,,,1997,,3149.446068905857,,,,,788,TUN,2021/06/15,89,1405955,24341
Tunisia,6/16/21,374312,13721,,,2091,,3167.138492842395,,,,,788,TUN,2021/06/16,65,1405955,0
Tunisia,6/17/21,376691,13792,,,2379,,3187.2677499179686,,,,,788,TUN,2021/06/17,71,1459780,53825
Tunisia,6/18/21,378982,13874,,,2291,,3206.6524190899477,,,,,788,TUN,2021/06/18,82,1459780,0
Tunisia,6/19/21,381175,13960,,,2193,,3225.207888096561,,,,,788,TUN,2021/06/19,86,1459780,0
Tunisia,6/20/21,382950,14038,,,1775,,3240.226564561102,,,,,788,TUN,2021/06/20,78,1554145,94365
Tunisia,6/21/21,385428,14118,,,2478,,3261.193483028219,,,,,788,TUN,2021/06/21,80,1583153,29008
Tunisia,6/22/21,387773,14223,,,2345,,3281.0350584137673,,,,,788,TUN,2021/06/22,105,1609651,26498
Tunisia,6/23/21,391411,14318,,,3638,,3311.816999246443,,,,,788,TUN,2021/06/23,95,1609651,0
Tunisia,6/24/21,395362,14406,,,3951,,3345.247303872585,,,,,788,TUN,2021/06/24,88,1661855,52204
Tunisia,6/25/21,398829,14489,,,3467,,3374.5823750289587,,,,,788,TUN,2021/06/25,83,1661855,0
Tunisia,6/26/21,403493,14579,,,4664,,3414.045533919448,,,,,788,TUN,2021/06/26,90,1685739,23884
Tunisia,6/27/21,407017,14654,,,3524,,3443.862894967923,,,,,788,TUN,2021/06/27,75,1685739,0
Tunisia,6/28/21,408931,14737,,,1914,,3460.057681871095,,,,,788,TUN,2021/06/28,83,1765231,79492
Tunisia,6/29/21,414182,14843,,,5251,,3504.4875805276047,,,,,788,TUN,2021/06/29,106,1793424,28193
Tunisia,6/30/21,420103,14959,,,5921,,3554.5865007228426,,,,,788,TUN,2021/06/30,116,1821431,28007
Tunisia,7/1/21,426879,15065,,,6776,,3611.9197692995917,,,,,788,TUN,2021/07/01,106,1844651,23220
Tunisia,7/2/21,432761,15179,,,5882,,3661.6887016739183,,,,,788,TUN,2021/07/02,114,1844651,0
Turkey,6/4/21,5276468,47976,,,6169,,6256.25607169688,,,,,792,TUR,2021/06/04,94,30349196,342764
Turkey,6/5/21,5282594,48068,,,6126,,6263.5196094829935,,,,,792,TUR,2021/06/05,92,30612099,262903
Turkey,6/6/21,5287980,48164,,,5386,,6269.905736566899,,,,,792,TUR,2021/06/06,96,30922706,310607
Turkey,6/7/21,5293627,48255,,,5647,,6276.601328776853,,,,,792,TUR,2021/06/07,91,31295280,372574
Turkey,6/8/21,5300236,48341,,,6609,,6284.437554899677,,,,,792,TUR,2021/06/08,86,31648941,353661
Turkey,6/9/21,5306690,48428,,,6454,,6292.0899990510925,,,,,792,TUR,2021/06/09,87,32006166,357225
Turkey,6/10/21,5313098,48524,,,6408,,6299.687901456155,,,,,792,TUR,2021/06/10,96,32527059,520893
Turkey,6/11/21,5319359,48593,,,6261,,6307.111507410913,,,,,792,TUR,2021/06/11,69,33052969,525910
Turkey,6/12/21,5325435,48668,,,6076,,6314.31576069012,,,,,792,TUR,2021/06/12,75,33499660,446691
Turkey,6/13/21,5330447,48721,,,5012,,6320.258439662369,,,,,792,TUR,2021/06/13,53,34120085,620425
Turkey,6/14/21,5336073,48795,,,5626,,6326.929132379422,,,,,792,TUR,2021/06/14,74,35046400,926315
Turkey,6/15/21,5342028,48879,,,5955,,6333.989917151917,,,,,792,TUR,2021/06/15,84,36403013,1356613
Turkey,6/16/21,5348249,48950,,,6221,,6341.366095501151,,,,,792,TUR,2021/06/16,71,37862579,1459566
Turkey,6/17/21,5354153,49012,,,5904,,6348.366410076602,,,,,792,TUR,2021/06/17,62,39527346,1664767
Turkey,6/18/21,5359728,49071,,,5575,,6354.976632596611,,,,,792,TUR,2021/06/18,59,40620919,1093573
Turkey,6/19/21,5365208,49122,,,5480,,6361.4742145535,,,,,792,TUR,2021/06/19,51,41202462,581543
Turkey,6/20/21,5370299,49185,,,5091,,6367.5105630466605,,,,,792,TUR,2021/06/20,63,42090408,887946
Turkey,6/21/21,5375593,49236,,,5294,,6373.7876066378585,,,,,792,TUR,2021/06/21,51,43208363,1117955
Turkey,6/22/21,5381736,49293,,,6143,,6381.071301156319,,,,,792,TUR,2021/06/22,57,44142217,933854
Turkey,6/23/21,5387545,49358,,,5809,,6387.958975168649,,,,,792,TUR,2021/06/23,65,45005205,862988
Turkey,6/24/21,5393248,49417,,,5703,,6394.720966026338,,,,,792,TUR,2021/06/24,59,45904934,899729
Turkey,6/25/21,5398878,49473,,,5630,,6401.396401503944,,,,,792,TUR,2021/06/25,56,46631511,726577
Turkey,6/26/21,5404144,49524,,,5266,,6407.640245771275,,,,,792,TUR,2021/06/26,51,47071245,439734
Turkey,6/27/21,5409027,49576,,,4883,,6413.429970715706,,,,,792,TUR,2021/06/27,52,47840260,769015
Turkey,6/28/21,5414310,49634,,,5283,,6419.6939717153855,,,,,792,TUR,2021/06/28,58,48726022,885762
Turkey,6/29/21,5420156,49687,,,5846,,6426.625516262825,,,,,792,TUR,2021/06/29,53,49430624,704602
Turkey,6/30/21,5425652,49732,,,5496,,6433.142069261923,,,,,792,TUR,2021/06/30,45,50047345,616721
Turkey,7/1/21,5430940,49774,,,5288,,6439.411998712293,,,,,792,TUR,2021/07/01,42,51302021,1254676
Turkey,7/2/21,5435831,49829,,,4891,,6445.21120917783,,,,,792,TUR,2021/07/02,55,51924960,622939
US,6/4/21,33343379,596845,,,16850,,10120.422246667347,,,,,840,USA,2021/06/04,534,298746840,1423217
US,6/5/21,33357285,597223,,,13906,,10124.64301240804,,,,,840,USA,2021/06/05,378,299826100,1079260
US,6/6/21,33362680,597392,,,5395,,10126.28050925624,,,,,840,USA,2021/06/06,169,300920521,1094421
US,6/7/21,33378176,597709,,,15496,,10130.983873697327,,,,,840,USA,2021/06/07,317,302444973,1524452
US,6/8/21,33391189,598048,,,13013,,10134.933595010692,,,,,840,USA,2021/06/08,339,303534160,1089187
US,6/9/21,33409836,598495,,,18647,,10140.593354737912,,,,,840,USA,2021/06/09,447,304443324,909164
US,6/10/21,33424381,598923,,,14545,,10145.008070522348,,,,,840,USA,2021/06/10,428,305424561,981237
US,6/11/21,33449080,599574,,,24699,,10152.504740523023,,,,,840,USA,2021/06/11,651,306367015,942454
US,6/12/21,33457308,599860,,,8228,,10155.002112917273,,,,,840,USA,2021/06/12,286,307887921,1520906
US,6/13/21,33462085,599971,,,4777,,10156.452033666827,,,,,840,USA,2021/06/13,111,308987797,1099876
US,6/14/21,33474815,600145,,,12730,,10160.315858481943,,,,,840,USA,2021/06/14,174,310205341,1217544
US,6/15/21,33486120,600457,,,11305,,10163.747165593877,,,,,840,USA,2021/06/15,312,311474931,1269590
US,6/16/21,33498545,600828,,,12425,,10167.518416444453,,,,,840,USA,2021/06/16,371,312640143,1165212
US,6/17/21,33508938,601112,,,10393,,10170.672912226348,,,,,840,USA,2021/06/17,284,314605148,1965005
US,6/18/21,33529529,601706,,,20591,,10176.92271715707,,,,,840,USA,2021/06/18,594,315677697,1072549
US,6/19/21,33538049,601879,,,8520,,10179.508717740322,,,,,840,USA,2021/06/19,173,316653275,975578
US,6/20/21,33541941,601967,,,3892,,10180.690022232107,,,,,840,USA,2021/06/20,88,317464619,811344
US,6/21/21,33554275,602235,,,12334,,10184.43365265392,,,,,840,USA,2021/06/21,268,318126824,662205
US,6/22/21,33565215,602558,,,10940,,10187.754174529598,,,,,840,USA,2021/06/22,323,318803568,676744
US,6/23/21,33577651,602933,,,12436,,10191.528764113322,,,,,840,USA,2021/06/23,375,319505293,701725
US,6/24/21,33590481,603274,,,12830,,10195.422941047962,,,,,840,USA,2021/06/24,341,320309367,804074
US,6/25/21,33614196,603772,,,23715,,10202.620946192543,,,,,840,USA,2021/06/25,498,320792262,482895
US,6/26/21,33621499,603919,,,7303,,10204.837561481216,,,,,840,USA,2021/06/26,147,321704342,912080
US,6/27/21,33625419,603993,,,3920,,10206.027364566467,,,,,840,USA,2021/06/27,74,322875796,1171454
US,6/28/21,33640502,604143,,,15083,,10210.605374753932,,,,,840,USA,2021/06/28,150,323985562,1109766
US,6/29/21,33652098,604474,,,11596,,10214.125006533674,,,,,840,USA,2021/06/29,331,324698633,713071
US,6/30/21,33664970,604714,,,12872,,10218.031931358511,,,,,840,USA,2021/06/30,240,325854289,1155656
US,7/1/21,33679433,605019,,,14463,,10222.421758404942,,,,,840,USA,2021/07/01,305,327151971,1297682
US,7/2/21,33709131,605524,,,29698,,10231.435730860509,,,,,840,USA,2021/07/02,505,327854747,702776
Uganda,6/4/21,51006,374,,,1247,,111.5104610743097,,,,,800,UGA,2021/06/04,9,706626,29542
Uganda,6/5/21,51676,374,,,670,,112.97523009991036,,,,,800,UGA,2021/06/05,0,706626,0
Uganda,6/6/21,52935,383,,,1259,,115.72768413458385,,,,,800,UGA,2021/06/06,9,706626,0
Uganda,6/7/21,53961,383,,,1026,,117.9707483439365,,,,,800,UGA,2021/06/07,0,706626,0
Uganda,6/8/21,54669,388,,,708,,119.51859382173542,,,,,800,UGA,2021/06/08,5,768434,61808
Uganda,6/9/21,55511,392,,,842,,121.35939310465447,,,,,800,UGA,2021/06/09,4,768434,0
Uganda,6/10/21,56949,402,,,1438,,124.50318095363022,,,,,800,UGA,2021/06/10,10,788190,19756
Uganda,6/11/21,58515,408,,,1566,,127.9268052731685,,,,,800,UGA,2021/06/11,6,788190,0
Uganda,6/12/21,60250,423,,,1735,,131.71990118274633,,,,,800,UGA,2021/06/12,15,788190,0
Uganda,6/13/21,61977,428,,,1727,,135.49550731291401,,,,,800,UGA,2021/06/13,5,788190,0
Uganda,6/14/21,63099,434,,,1122,,137.94844887518857,,,,,800,UGA,2021/06/14,6,831213,43023
Uganda,6/15/21,64521,459,,,1422,,141.057257165344,,,,,800,UGA,2021/06/15,25,831213,0
Uganda,6/16/21,65631,508,,,1110,,143.48396405850332,,,,,800,UGA,2021/06/16,49,831213,0
Uganda,6/17/21,67215,542,,,1584,,146.94694038171443,,,,,800,UGA,2021/06/17,34,831213,0
Uganda,6/18/21,68779,584,,,1564,,150.36619225640015,,,,,800,UGA,2021/06/18,42,831213,0
Uganda,6/19/21,70176,626,,,1397,,153.42034498589888,,,,,800,UGA,2021/06/19,42,831213,0
Uganda,6/20/21,71543,660,,,1367,,156.40891104260947,,,,,800,UGA,2021/06/20,34,831213,0
Uganda,6/21/21,72679,680,,,1136,,158.8924597188518,,,,,800,UGA,2021/06/21,20,831213,0
Uganda,6/22/21,73401,714,,,722,,160.47091231061847,,,,,800,UGA,2021/06/22,34,834271,3058
Uganda,6/23/21,74260,752,,,859,,162.3488773747841,,,,,800,UGA,2021/06/23,38,834271,0
Uganda,6/24/21,75537,781,,,1277,,165.14068341313046,,,,,800,UGA,2021/06/24,29,935184,100913
Uganda,6/25/21,76562,830,,,1025,,167.38156140005685,,,,,800,UGA,2021/06/25,49,935184,0
Uganda,6/26/21,77505,868,,,943,,169.4431691480291,,,,,800,UGA,2021/06/26,38,935184,0
Uganda,6/27/21,78394,903,,,889,,171.38672088498285,,,,,800,UGA,2021/06/27,35,935184,0
Uganda,6/28/21,79089,956,,,695,,172.90614547124025,,,,,800,UGA,2021/06/28,53,937417,2233
Uganda,6/29/21,79434,989,,,345,,173.66039220830328,,,,,800,UGA,2021/06/29,33,937417,0
Uganda,6/30/21,79977,1023,,,543,,174.84751098576768,,,,,800,UGA,2021/06/30,34,937417,0
Uganda,7/1/21,81034,1061,,,1057,,177.1583480903347,,,,,800,UGA,2021/07/01,38,937417,0
Uganda,7/2/21,82082,1111,,,1048,,179.4495091930653,,,,,800,UGA,2021/07/02,50,937417,0
Ukraine,6/4/21,2270602,53117,,,2393,,5191.874771157905,,,,,804,UKR,2021/06/04,102,1323163,-201871
Ukraine,6/5/21,2272633,53211,,,2031,,5196.518780834732,,,,,804,UKR,2021/06/05,94,1363264,40101
Ukraine,6/6/21,2273708,53258,,,1075,,5198.976836178203,,,,,804,UKR,2021/06/06,47,1388124,24860
Ukraine,6/7/21,2274375,53295,,,667,,5200.50197377271,,,,,804,UKR,2021/06/07,37,1436285,48161
Ukraine,6/8/21,2276111,53420,,,1736,,5204.4714473320255,,,,,804,UKR,2021/06/08,125,1489446,53161
Ukraine,6/9/21,2277632,53503,,,1521,,5207.949309822648,,,,,804,UKR,2021/06/09,83,1545019,55573
Ukraine,6/10/21,2279556,53607,,,1924,,5212.348657246682,,,,,804,UKR,2021/06/10,104,1599348,54329
Ukraine,6/11/21,2281303,53683,,,1747,,5216.34328300021,,,,,804,UKR,2021/06/11,76,1661410,62062
Ukraine,6/12/21,2282727,53758,,,1424,,5219.599348869143,,,,,804,UKR,2021/06/12,75,1696280,34870
Ukraine,6/13/21,2283746,53795,,,1019,,5221.929356678442,,,,,804,UKR,2021/06/13,37,1718499,22219
Ukraine,6/14/21,2284337,53812,,,591,,5223.280715476572,,,,,804,UKR,2021/06/14,17,1768556,50057
Ukraine,6/15/21,2285534,53894,,,1197,,5226.017731519488,,,,,804,UKR,2021/06/15,82,1831147,62591
Ukraine,6/16/21,2286767,53980,,,1233,,5228.837063834371,,,,,804,UKR,2021/06/16,86,1907695,76548
Ukraine,6/17/21,2288155,54041,,,1388,,5232.010813431336,,,,,804,UKR,2021/06/17,61,1989008,81313
Ukraine,6/18/21,2289333,54097,,,1178,,5234.704384775157,,,,,804,UKR,2021/06/18,56,2056109,67101
Ukraine,6/19/21,2290412,54142,,,1079,,5237.171586371069,,,,,804,UKR,2021/06/19,45,2081712,25603
Ukraine,6/20/21,2291135,54171,,,723,,5238.824771499747,,,,,804,UKR,2021/06/20,29,2086102,4390
Ukraine,6/21/21,2291722,54192,,,587,,5240.166984045437,,,,,804,UKR,2021/06/21,21,2095068,8966
Ukraine,6/22/21,2292295,54220,,,573,,5241.4771847075845,,,,,804,UKR,2021/06/22,28,2148854,53786
Ukraine,6/23/21,2293421,54299,,,1126,,5244.051854769676,,,,,804,UKR,2021/06/23,79,2228775,79921
Ukraine,6/24/21,2294669,54366,,,1248,,5246.9054855312115,,,,,804,UKR,2021/06/24,67,2324955,96180
Ukraine,6/25/21,2295873,54429,,,1204,,5249.658507515898,,,,,804,UKR,2021/06/25,63,2422085,97130
Ukraine,6/26/21,2296982,54473,,,1109,,5252.194306005116,,,,,804,UKR,2021/06/26,44,2465745,43660
Ukraine,6/27/21,2297801,54498,,,819,,5254.067001192374,,,,,804,UKR,2021/06/27,25,2484376,18631
Ukraine,6/28/21,2298478,54517,,,677,,5255.615004417983,,,,,804,UKR,2021/06/28,19,2501441,17065
Ukraine,6/29/21,2299059,54531,,,581,,5256.943497585012,,,,,804,UKR,2021/06/29,14,2583078,81637
Ukraine,6/30/21,2300101,54581,,,1042,,5259.326096345846,,,,,804,UKR,2021/06/30,50,2676264,93186
Ukraine,7/1/21,2301221,54644,,,1120,,5261.887047029276,,,,,804,UKR,2021/07/01,63,2767223,90959
Ukraine,7/2/21,2302344,54687,,,1123,,5264.4548574020355,,,,,804,UKR,2021/07/02,43,2861770,94547
United Arab Emirates,6/4/21,579009,1691,,,2062,,5854.252608590148,,,,,784,ARE,2021/06/04,2,13227344,72879
United Arab Emirates,6/5/21,581197,1696,,,2188,,5876.375070775702,,,,,784,ARE,2021/06/05,5,13294010,66666
United Arab Emirates,6/6/21,583071,1699,,,1874,,5895.322737199709,,,,,784,ARE,2021/06/06,3,13315751,21741
United Arab Emirates,6/7/21,585039,1702,,,1968,,5915.2208201892745,,,,,784,ARE,2021/06/07,3,13347300,31549
United Arab Emirates,6/8/21,587244,1704,,,2205,,5937.51516622179,,,,,784,ARE,2021/06/08,2,13411284,63984
United Arab Emirates,6/9/21,589423,1710,,,2179,,5959.5466310766,,,,,784,ARE,2021/06/09,6,13507943,96659
United Arab Emirates,6/11/21,593894,1720,,,4471,,6004.752082827793,,,,,784,ARE,2021/06/11,10,13684429,94223
United Arab Emirates,6/12/21,596017,1724,,,2123,,6026.217342069077,,,,,784,ARE,2021/06/12,4,13785663,101234
United Arab Emirates,6/13/21,597986,1726,,,1969,,6046.12553587317,,,,,784,ARE,2021/06/13,2,13808426,22763
United Arab Emirates,6/14/21,599823,1730,,,1837,,6064.69910215967,,,,,784,ARE,2021/06/14,4,13848062,39636
United Arab Emirates,6/15/21,601950,1734,,,2127,,6086.2048046590635,,,,,784,ARE,2021/06/15,4,13964439,116377
United Arab Emirates,6/16/21,603961,1738,,,2011,,6106.537652673299,,,,,784,ARE,2021/06/16,4,14068507,104068
United Arab Emirates,6/17/21,606128,1741,,,2167,,6128.447787753781,,,,,784,ARE,2021/06/17,3,14182020,113513
United Arab Emirates,6/18/21,608070,1747,,,1942,,6148.08298956564,,,,,784,ARE,2021/06/18,6,14298438,116418
United Arab Emirates,6/19/21,610179,1752,,,2109,,6169.406697403543,,,,,784,ARE,2021/06/19,5,14428916,130478
United Arab Emirates,6/20/21,612029,1757,,,1850,,6188.1117042788965,,,,,784,ARE,2021/06/20,5,14460522,31606
United Arab Emirates,6/21/21,613993,1763,,,1964,,6207.969344010354,,,,,784,ARE,2021/06/21,6,14512626,52104
United Arab Emirates,6/22/21,616160,1767,,,2167,,6229.879479090836,,,,,784,ARE,2021/06/22,4,14631482,118856
United Arab Emirates,6/23/21,618148,1773,,,1988,,6249.9797783709455,,,,,784,ARE,2021/06/23,6,14735666,104184
United Arab Emirates,6/24/21,620309,1775,,,2161,,6271.829248564264,,,,,784,ARE,2021/06/24,2,14834355,98689
United Arab Emirates,6/25/21,622532,1782,,,2223,,6294.305589258271,,,,,784,ARE,2021/06/25,7,14940031,105676
United Arab Emirates,6/26/21,624814,1792,,,2282,,6317.378468009383,,,,,784,ARE,2021/06/26,10,15043227,103196
United Arab Emirates,6/27/21,626936,1796,,,2122,,6338.83361643614,,,,,784,ARE,2021/06/27,4,15073743,30516
United Arab Emirates,6/28/21,628976,1802,,,2040,,6359.459678071666,,,,,784,ARE,2021/06/28,6,15111234,37491
United Arab Emirates,6/29/21,631160,1807,,,2184,,6381.54169699911,,,,,784,ARE,2021/06/29,5,15198661,87427
United Arab Emirates,6/30/21,632907,1811,,,1747,,6399.205289978161,,,,,784,ARE,2021/06/30,4,15281200,82539
United Arab Emirates,7/1/21,634582,1819,,,1675,,6416.140904311252,,,,,784,ARE,2021/07/01,8,15362342,81142
United Arab Emirates,7/2/21,636245,1825,,,1663,,6432.955188870015,,,,,784,ARE,2021/07/02,6,15428281,65939
United Kingdom,6/4/21,4521922,128086,,,6144,,6661.051959988689,,,,,826,GBR,2021/06/04,11,67326869,597331
United Kingdom,6/5/21,4527577,128099,,,5655,,6669.382101206016,,,,,826,GBR,2021/06/05,13,67862095,535226
United Kingdom,6/6/21,4532802,128103,,,5225,,6677.078827618135,,,,,826,GBR,2021/06/06,4,68576903,714808
United Kingdom,6/7/21,4538399,128104,,,5597,,6685.323531489643,,,,,826,GBR,2021/06/07,1,68964189,387286
United Kingdom,6/8/21,4544372,128118,,,5973,,6694.122105051286,,,,,826,GBR,2021/06/08,14,69385203,421014
United Kingdom,6/9/21,4551694,128124,,,7322,,6704.9078334320575,,,,,826,GBR,2021/06/09,6,69839282,454079
United Kingdom,6/10/21,4558933,128131,,,7239,,6715.571298024847,,,,,826,GBR,2021/06/10,7,70336446,497164
United Kingdom,6/11/21,4566893,128148,,,7960,,6727.296837209626,,,,,826,GBR,2021/06/11,17,70846711,510265
United Kingdom,6/12/21,4574445,128160,,,7552,,6738.4213688582995,,,,,826,GBR,2021/06/12,12,71335070,488359
United Kingdom,6/13/21,4581779,128168,,,7334,,6749.22477393131,,,,,826,GBR,2021/06/13,8,71936945,601875
United Kingdom,6/14/21,4589400,128171,,,7621,,6760.450946560354,,,,,826,GBR,2021/06/14,3,72274162,337217
United Kingdom,6/15/21,4596994,128181,,,7594,,6771.637346631863,,,,,826,GBR,2021/06/15,10,72645039,370877
United Kingdom,6/16/21,4605805,128190,,,8811,,6784.616457907878,,,,,826,GBR,2021/06/16,9,73065738,420699
United Kingdom,6/17/21,4616628,128209,,,10823,,6800.55936124919,,,,,826,GBR,2021/06/17,19,73501616,435878
United Kingdom,6/18/21,4626915,128220,,,10287,,6815.712705670524,,,,,826,GBR,2021/06/18,11,73968854,467238
United Kingdom,6/19/21,4636991,128234,,,10076,,6830.555234919999,,,,,826,GBR,2021/06/19,14,74377154,408300
United Kingdom,6/20/21,4646068,128240,,,9077,,6843.926179540631,,,,,826,GBR,2021/06/20,6,74922851,545697
United Kingdom,6/21/21,4656536,128245,,,10468,,6859.3461474032265,,,,,826,GBR,2021/06/21,5,75197738,274887
United Kingdom,6/22/21,4668043,128272,,,11507,,6876.296622202126,,,,,826,GBR,2021/06/22,27,75261403,63665
United Kingdom,6/23/21,4683986,128291,,,15943,,6899.781580898472,,,,,826,GBR,2021/06/23,19,75813282,551879
United Kingdom,6/24/21,4700691,128312,,,16705,,6924.389009551955,,,,,826,GBR,2021/06/24,21,76192006,378724
United Kingdom,6/25/21,4716065,128330,,,15374,,6947.035798424665,,,,,826,GBR,2021/06/25,18,76593431,401425
United Kingdom,6/26/21,4734011,128353,,,17946,,6973.471291667131,,,,,826,GBR,2021/06/26,23,76954923,361492
United Kingdom,6/27/21,4748644,128364,,,14633,,6995.026544794123,,,,,826,GBR,2021/06/27,11,77407851,452928
United Kingdom,6/28/21,4771367,128367,,,22723,,7028.498834605142,,,,,826,GBR,2021/06/28,3,77680881,273030
United Kingdom,6/29/21,4791628,128390,,,20261,,7058.344456391925,,,,,826,GBR,2021/06/29,23,77949685,268804
United Kingdom,6/30/21,4817298,128404,,,25670,,7096.157847205147,,,,,826,GBR,2021/06/30,14,78241097,291412
United Kingdom,7/1/21,4844944,128426,,,27646,,7136.882000006953,,,,,826,GBR,2021/07/01,22,78561175,320078
United Kingdom,7/2/21,4871807,128453,,,26863,,7176.452748640206,,,,,826,GBR,2021/07/02,27,78906766,345591
Uruguay,6/4/21,308490,4516,,,4079,,8880.663333647117,,,,,858,URY,2021/06/04,56,2997034,43178
Uruguay,6/5/21,312703,4583,,,4213,,9001.945173008702,,,,,858,URY,2021/06/05,67,3011446,14412
Uruguay,6/6/21,316535,4640,,,3832,,9112.258965658499,,,,,858,URY,2021/06/06,57,3012539,1093
Uruguay,6/7/21,318783,4692,,,2248,,9176.973320010467,,,,,858,URY,2021/06/07,52,3053554,41015
Uruguay,6/8/21,322978,4749,,,4195,,9297.73698393685,,,,,858,URY,2021/06/08,57,3091703,38149
Uruguay,6/9/21,326405,4816,,,3427,,9396.391829294587,,,,,858,URY,2021/06/09,67,3140408,48705
Uruguay,6/10/21,330027,4862,,,3622,,9500.66024186702,,,,,858,URY,2021/06/10,46,3140408,0
Uruguay,6/11/21,333484,4906,,,3457,,9600.178712950097,,,,,858,URY,2021/06/11,44,3224002,83594
Uruguay,6/12/21,336470,4956,,,2986,,9686.138260145372,,,,,858,URY,2021/06/12,50,3247064,23062
Uruguay,6/13/21,338513,4995,,,2043,,9744.951172040866,,,,,858,URY,2021/06/13,39,3248537,1473
Uruguay,6/14/21,340818,5036,,,2305,,9811.306415270976,,,,,858,URY,2021/06/14,41,3304343,55806
Uruguay,6/15/21,343615,5089,,,2797,,9891.825120396623,,,,,858,URY,2021/06/15,53,3358149,53806
Uruguay,6/16/21,346515,5120,,,2900,,9975.308940512596,,,,,858,URY,2021/06/16,31,3411439,53290
Uruguay,6/17/21,348662,5152,,,2147,,10037.115754922595,,,,,858,URY,2021/06/17,32,3456296,44857
Uruguay,6/18/21,351378,5207,,,2716,,10115.30267058983,,,,,858,URY,2021/06/18,55,3503681,47385
Uruguay,6/19/21,353377,5241,,,1999,,10172.848931421497,,,,,858,URY,2021/06/19,34,3518054,14373
Uruguay,6/20/21,354865,5271,,,1488,,10215.684767398245,,,,,858,URY,2021/06/20,30,3519021,967
Uruguay,6/21/21,356382,5316,,,1517,,10259.355441576152,,,,,858,URY,2021/06/21,45,3571529,52508
Uruguay,6/22/21,358461,5350,,,2079,,10319.204704342052,,,,,858,URY,2021/06/22,34,3617566,46037
Uruguay,6/23/21,360247,5374,,,1786,,10370.61922252382,,,,,858,URY,2021/06/23,24,3660592,43026
Uruguay,6/24/21,361994,5413,,,1747,,10420.91102726265,,,,,858,URY,2021/06/24,39,3702923,42331
Uruguay,6/25/21,363580,5447,,,1586,,10466.568040608832,,,,,858,URY,2021/06/25,34,3759264,56341
Uruguay,6/26/21,364859,5474,,,1279,,10503.387284032395,,,,,858,URY,2021/06/26,27,3772295,13031
Uruguay,6/27/21,365866,5494,,,1007,,10532.376320879563,,,,,858,URY,2021/06/27,20,3773475,1180
Uruguay,6/28/21,366915,5524,,,1049,,10562.574433742202,,,,,858,URY,2021/06/28,30,3827315,53840
Uruguay,6/29/21,368178,5558,,,1263,,10598.933076778918,,,,,858,URY,2021/06/29,34,3882980,55665
Uruguay,6/30/21,369350,5593,,,1172,,10632.672055115443,,,,,858,URY,2021/06/30,35,3935592,52612
Uruguay,7/1/21,370600,5619,,,1250,,10668.656460337845,,,,,858,URY,2021/07/01,26,3988723,53131
Uruguay,7/2/21,371417,5642,,,817,,10692.175867591206,,,,,858,URY,2021/07/02,23,4041916,53193
Uzbekistan,6/4/21,101198,695,,,201,,302.36158325749,,,,,860,UZB,2021/06/04,2,2136423,0
Uzbekistan,6/5/21,101436,696,,,238,,303.0726848288183,,,,,860,UZB,2021/06/05,1,2136423,0
Uzbekistan,6/6/21,101722,696,,,286,,303.92720184310355,,,,,860,UZB,2021/06/06,0,2136423,0
Uzbekistan,6/7/21,101964,696,,,242,,304.650254701345,,,,,860,UZB,2021/06/07,0,2136423,0
Uzbekistan,6/8/21,102163,699,,,199,,305.24483122527073,,,,,860,UZB,2021/06/08,3,2136423,0
Uzbekistan,6/9/21,102362,701,,,199,,305.8394077491965,,,,,860,UZB,2021/06/09,2,2136423,0
Uzbekistan,6/10/21,102605,702,,,243,,306.56544842916617,,,,,860,UZB,2021/06/10,1,2136423,0
Uzbekistan,6/11/21,102892,704,,,287,,307.42295326517973,,,,,860,UZB,2021/06/11,2,2136423,0
Uzbekistan,6/12/21,103206,705,,,314,,308.36112928785656,,,,,860,UZB,2021/06/12,1,2136423,0
Uzbekistan,6/13/21,103510,708,,,304,,309.2694270932507,,,,,860,UZB,2021/06/13,3,2136423,0
Uzbekistan,6/14/21,103813,708,,,303,,310.1747370769166,,,,,860,UZB,2021/06/14,0,2136423,0
Uzbekistan,6/15/21,104113,709,,,300,,311.0710835953977,,,,,860,UZB,2021/06/15,1,2136423,0
Uzbekistan,6/16/21,104463,711,,,350,,312.11682120029224,,,,,860,UZB,2021/06/16,2,2136423,0
Uzbekistan,6/17/21,104834,713,,,371,,313.2253030614805,,,,,860,UZB,2021/06/17,2,2695058,0
Uzbekistan,6/18/21,105219,717,,,385,,314.37561442686456,,,,,860,UZB,2021/06/18,4,2695058,0
Uzbekistan,6/19/21,105610,718,,,391,,315.54385272261817,,,,,860,UZB,2021/06/19,1,2695058,0
Uzbekistan,6/20/21,106025,718,,,415,,316.78379873985034,,,,,860,UZB,2021/06/20,0,2695058,0
Uzbekistan,6/21/21,106452,718,,,427,,318.05959861782173,,,,,860,UZB,2021/06/21,0,2695058,0
Uzbekistan,6/22/21,106847,720,,,395,,319.2397882004885,,,,,860,UZB,2021/06/22,2,2695058,0
Uzbekistan,6/23/21,107266,722,,,419,,320.49168550463367,,,,,860,UZB,2021/06/23,2,2695058,0
Uzbekistan,6/24/21,107708,723,,,442,,321.8123027085291,,,,,860,UZB,2021/06/24,1,2695058,0
Uzbekistan,6/25/21,108184,725,,,476,,323.23450585118576,,,,,860,UZB,2021/06/25,2,2695058,0
Uzbekistan,6/26/21,108730,727,,,546,,324.8658565148213,,,,,860,UZB,2021/06/26,2,2695058,0
Uzbekistan,6/27/21,109223,729,,,493,,326.3388526268585,,,,,860,UZB,2021/06/27,2,2695058,0
Uzbekistan,6/28/21,109692,731,,,469,,327.7401410174172,,,,,860,UZB,2021/06/28,2,2695058,0
Uzbekistan,6/29/21,110190,733,,,498,,329.2280762380958,,,,,860,UZB,2021/06/29,2,2695058,0
Uzbekistan,6/30/21,110677,736,,,487,,330.68314541976343,,,,,860,UZB,2021/06/30,3,3541442,0
Uzbekistan,7/1/21,111153,740,,,476,,332.10534856242003,,,,,860,UZB,2021/07/01,4,3541442,0
Uzbekistan,7/2/21,111648,742,,,495,,333.5843203179138,,,,,860,UZB,2021/07/02,2,3541442,0
Vanuatu,6/4/21,4,1,,,0,,1.3666803334700013,,,,,548,VUT,2021/06/04,0,,
Vanuatu,7/2/21,4,1,,,0,,1.3666803334700013,,,,,548,VUT,2021/07/02,0,,
Venezuela,6/4/21,239252,2698,,,1239,,841.3717807775885,,,,,862,VEN,2021/06/04,9,316000,0
Venezuela,6/5/21,240714,2708,,,1462,,846.513161177739,,,,,862,VEN,2021/06/05,10,316000,0
Venezuela,6/6/21,242138,2719,,,1424,,851.5209078875985,,,,,862,VEN,2021/06/06,11,3300000,2984000
Venezuela,6/7/21,243621,2734,,,1483,,856.7361384850152,,,,,862,VEN,2021/06/07,15,3300000,0
Venezuela,6/8/21,245300,2750,,,1679,,862.6406375902498,,,,,862,VEN,2021/06/08,16,3300000,0
Venezuela,6/9/21,246764,2764,,,1464,,867.789051342521,,,,,862,VEN,2021/06/09,14,3300000,0
Venezuela,6/10/21,247847,2781,,,1083,,871.59761151582,,,,,862,VEN,2021/06/10,17,3300000,0
Venezuela,6/11/21,248820,2797,,,973,,875.0193373224865,,,,,862,VEN,2021/06/11,16,739962,-2560038
Venezuela,6/12/21,250309,2814,,,1489,,880.2556679762652,,,,,862,VEN,2021/06/12,17,739962,0
Venezuela,6/13/21,251686,2829,,,1377,,885.0981309112907,,,,,862,VEN,2021/06/13,15,739962,0
Venezuela,6/14/21,252883,2845,,,1197,,889.3075921554632,,,,,862,VEN,2021/06/14,16,739962,0
Venezuela,6/15/21,254116,2865,,,1233,,893.6436537378064,,,,,862,VEN,2021/06/15,20,739962,0
Venezuela,6/16/21,255457,2886,,,1341,,898.3595163346614,,,,,862,VEN,2021/06/16,21,739962,0
Venezuela,6/17/21,256862,2906,,,1405,,903.3004461993752,,,,,862,VEN,2021/06/17,20,739962,0
Venezuela,6/18/21,258140,2925,,,1278,,907.7947582044317,,,,,862,VEN,2021/06/18,19,739962,0
Venezuela,6/19/21,259413,2943,,,1273,,912.2714868291865,,,,,862,VEN,2021/06/19,18,1302992,563030
Venezuela,6/20/21,260740,2958,,,1327,,916.9381159611975,,,,,862,VEN,2021/06/20,15,1302992,0
Venezuela,6/21/21,262038,2973,,,1298,,921.5027614874597,,,,,862,VEN,2021/06/21,15,1302992,0
Venezuela,6/22/21,263372,2989,,,1334,,926.1940073518927,,,,,862,VEN,2021/06/22,16,1302992,0
Venezuela,6/24/21,265642,3023,,,2270,,934.1768620087612,,,,,862,VEN,2021/06/24,34,1302992,0
Venezuela,6/25/21,266952,3038,,,1310,,938.7837076477471,,,,,862,VEN,2021/06/25,15,1302992,0
Venezuela,6/26/21,268349,3055,,,1397,,943.6965041039786,,,,,862,VEN,2021/06/26,17,1466988,163996
Venezuela,6/27/21,269635,3068,,,1286,,948.2189495175173,,,,,862,VEN,2021/06/27,13,1466988,0
Venezuela,6/29/21,270654,3084,,,1019,,951.8024424229575,,,,,862,VEN,2021/06/29,16,1466988,0
Venezuela,6/30/21,272712,3119,,,2058,,959.0397617550436,,,,,862,VEN,2021/06/30,35,1466988,0
Venezuela,7/1/21,274024,3136,,,1312,,963.65364074615,,,,,862,VEN,2021/07/01,17,1466988,0
Venezuela,7/2/21,275205,3154,,,1181,,967.8068351733579,,,,,862,VEN,2021/07/02,18,1466988,0
Vietnam,6/4/21,8364,51,,,301,,8.592687238933815,,,,,704,VNM,2021/06/04,2,1217607,61551
Vietnam,6/5/21,8580,53,,,216,,8.814593078676726,,,,,704,VNM,2021/06/05,2,1217607,0
Vietnam,6/6/21,8791,53,,,211,,9.031362209166328,,,,,704,VNM,2021/06/06,0,1248559,30952
Vietnam,6/7/21,9027,53,,,236,,9.273814885922471,,,,,704,VNM,2021/06/07,0,1340098,91539
Vietnam,6/8/21,9222,55,,,195,,9.474146546801487,,,,,704,VNM,2021/06/08,2,1354856,14758
Vietnam,6/9/21,9635,55,,,413,,9.898438731124738,,,,,704,VNM,2021/06/09,0,1354856,0
Vietnam,6/10/21,9835,55,,,200,,10.103907101257063,,,,,704,VNM,2021/06/10,0,1354856,0
Vietnam,6/11/21,10048,57,,,213,,10.322730915447988,,,,,704,VNM,2021/06/11,2,1411548,56692
Vietnam,6/12/21,10337,58,,,289,,10.619632710289197,,,,,704,VNM,2021/06/12,1,1454221,42673
Vietnam,6/13/21,10630,59,,,293,,10.920643872533052,,,,,704,VNM,2021/06/13,1,1498323,44102
Vietnam,6/14/21,10881,59,,,251,,11.178506677049121,,,,,704,VNM,2021/06/14,0,1552651,54328
Vietnam,6/15/21,11304,61,,,423,,11.613072279878986,,,,,704,VNM,2021/06/15,2,1648072,95421
Vietnam,6/16/21,11794,61,,,490,,12.116469786703183,,,,,704,VNM,2021/06/16,0,1648072,0
Vietnam,6/17/21,12150,61,,,356,,12.48220348553872,,,,,704,VNM,2021/06/17,0,1991059,342987
Vietnam,6/18/21,12508,62,,,358,,12.84999186807558,,,,,704,VNM,2021/06/18,1,1991059,0
Vietnam,6/19/21,12978,64,,,470,,13.332842537886544,,,,,704,VNM,2021/06/19,2,1991059,0
Vietnam,6/20/21,13258,66,,,280,,13.620498256071798,,,,,704,VNM,2021/06/20,2,2359376,368317
Vietnam,6/21/21,13530,69,,,272,,13.899935239451759,,,,,704,VNM,2021/06/21,3,2422643,63267
Vietnam,6/22/21,13782,69,,,252,,14.158825385818488,,,,,704,VNM,2021/06/22,0,2422643,0
Vietnam,6/23/21,13989,70,,,207,,14.371485148905444,,,,,704,VNM,2021/06/23,1,2626337,203694
Vietnam,6/24/21,14323,72,,,334,,14.714617327026428,,,,,704,VNM,2021/06/24,2,2626337,0
Vietnam,6/25/21,14537,74,,,214,,14.934468483068015,,,,,704,VNM,2021/06/25,2,2920248,293911
Vietnam,6/26/21,15325,74,,,788,,15.744013861389373,,,,,704,VNM,2021/06/26,0,3087580,167332
Vietnam,6/27/21,15740,76,,,415,,16.170360729413947,,,,,704,VNM,2021/06/27,2,3386607,299027
Vietnam,6/28/21,16136,78,,,396,,16.57718810227595,,,,,704,VNM,2021/06/28,2,3497104,110497
Vietnam,6/29/21,16507,80,,,371,,16.958331928871413,,,,,704,VNM,2021/06/29,2,3593970,96866
Vietnam,6/30/21,17052,81,,,545,,17.518233237481997,,,,,704,VNM,2021/06/30,1,3776980,183010
Vietnam,7/1/21,17727,81,,,675,,18.211688986678592,,,,,704,VNM,2021/07/01,0,3776980,0
Vietnam,7/2/21,18121,84,,,394,,18.616461675839272,,,,,704,VNM,2021/07/02,3,3776980,0
West Bank and Gaza,6/4/21,309644,3511,,,311,,6069.765727790088,,,,,275,PSE,2021/06/04,2,,
West Bank and Gaza,6/5/21,309853,3516,,,209,,6073.862629513061,,,,,275,PSE,2021/06/05,5,,
West Bank and Gaza,6/6/21,310026,3517,,,173,,6077.253844814852,,,,,275,PSE,2021/06/06,1,,
West Bank and Gaza,6/8/21,310544,3520,,,518,,6087.407888319635,,,,,275,PSE,2021/06/08,3,,
West Bank and Gaza,6/10/21,311018,3524,,,474,,6096.69942619853,,,,,275,PSE,2021/06/10,4,,
West Bank and Gaza,6/13/21,311534,3533,,,516,,6106.8142649021365,,,,,275,PSE,2021/06/13,9,,
West Bank and Gaza,6/14/21,311690,3539,,,156,,6109.872239393925,,,,,275,PSE,2021/06/14,6,,
West Bank and Gaza,6/15/21,311948,3542,,,258,,6114.929658745728,,,,,275,PSE,2021/06/15,3,,
West Bank and Gaza,6/16/21,312164,3544,,,216,,6119.16377727282,,,,,275,PSE,2021/06/16,2,,
West Bank and Gaza,6/17/21,312334,3545,,,170,,6122.4961853728455,,,,,275,PSE,2021/06/17,1,,
West Bank and Gaza,6/18/21,312499,3548,,,165,,6125.730581469929,,,,,275,PSE,2021/06/18,3,,
West Bank and Gaza,6/19/21,312605,3550,,,106,,6127.808435932298,,,,,275,PSE,2021/06/19,2,,
West Bank and Gaza,6/20/21,312673,3551,,,68,,6129.141399172308,,,,,275,PSE,2021/06/20,1,,
West Bank and Gaza,6/21/21,312811,3554,,,138,,6131.846530453506,,,,,275,PSE,2021/06/21,3,,
West Bank and Gaza,6/22/21,313015,3555,,,204,,6135.845420173536,,,,,275,PSE,2021/06/22,1,,
West Bank and Gaza,6/25/21,313520,3556,,,505,,6145.744632470671,,,,,275,PSE,2021/06/25,1,,
West Bank and Gaza,6/27/21,313721,3559,,,201,,6149.684714988936,,,,,275,PSE,2021/06/27,3,,
West Bank and Gaza,6/28/21,313851,3561,,,130,,6152.2330270654265,,,,,275,PSE,2021/06/28,2,,
West Bank and Gaza,6/30/21,314167,3563,,,316,,6158.427385651356,,,,,275,PSE,2021/06/30,2,,
West Bank and Gaza,7/1/21,314288,3565,,,121,,6160.799276122551,,,,,275,PSE,2021/07/01,2,,
West Bank and Gaza,7/2/21,314409,3570,,,121,,6163.1711665937455,,,,,275,PSE,2021/07/02,5,,
Yemen,6/4/21,6773,1325,,,6,,22.708399606678313,,,,,887,YEM,2021/06/04,0,,
Yemen,6/5/21,6780,1325,,,7,,22.731869088037644,,,,,887,YEM,2021/06/05,0,,
Yemen,6/6/21,6787,1329,,,7,,22.755338569396976,,,,,887,YEM,2021/06/06,4,,
Yemen,6/7/21,6812,1336,,,25,,22.8391581456803,,,,,887,YEM,2021/06/07,7,,
Yemen,6/8/21,6823,1336,,,11,,22.876038759244963,,,,,887,YEM,2021/06/08,0,,
Yemen,6/9/21,6832,1337,,,9,,22.906213806706962,,,,,887,YEM,2021/06/09,1,,
Yemen,6/10/21,6836,1338,,,4,,22.919624938912293,,,,,887,YEM,2021/06/10,1,,
Yemen,6/11/21,6856,1342,,,20,,22.986680599938953,,,,,887,YEM,2021/06/11,4,,
Yemen,6/12/21,6857,1347,,,1,,22.990033382990287,,,,,887,YEM,2021/06/12,5,,
Yemen,6/13/21,6862,1349,,,5,,23.00679729824695,,,,,887,YEM,2021/06/13,2,,
Yemen,6/14/21,6863,1350,,,1,,23.010150081298285,,,,,887,YEM,2021/06/14,1,,
Yemen,6/15/21,6864,1350,,,1,,23.013502864349615,,,,,887,YEM,2021/06/15,0,,
Yemen,6/16/21,6867,1351,,,3,,23.023561213503616,,,,,887,YEM,2021/06/16,1,,
Yemen,6/17/21,6869,1351,,,2,,23.030266779606283,,,,,887,YEM,2021/06/17,0,,
Yemen,6/18/21,6875,1352,,,6,,23.05038347791428,,,,,887,YEM,2021/06/18,1,,
Yemen,6/19/21,6877,1353,,,2,,23.057089044016944,,,,,887,YEM,2021/06/19,1,,
Yemen,6/20/21,6885,1355,,,8,,23.08391130842761,,,,,887,YEM,2021/06/20,2,,
Yemen,6/21/21,6889,1355,,,4,,23.09732244063294,,,,,887,YEM,2021/06/21,0,,
Yemen,6/22/21,6892,1355,,,3,,23.10738078978694,,,,,887,YEM,2021/06/22,0,,
Yemen,6/23/21,6898,1355,,,6,,23.12749748809494,,,,,887,YEM,2021/06/23,0,,
Yemen,6/24/21,6905,1356,,,7,,23.15096696945427,,,,,887,YEM,2021/06/24,1,,
Yemen,6/25/21,6905,1357,,,0,,23.15096696945427,,,,,887,YEM,2021/06/25,1,,
Yemen,6/26/21,6906,1358,,,1,,23.1543197525056,,,,,887,YEM,2021/06/26,1,,
Yemen,6/27/21,6908,1360,,,2,,23.161025318608267,,,,,887,YEM,2021/06/27,2,,
Yemen,6/28/21,6909,1361,,,1,,23.1643781016596,,,,,887,YEM,2021/06/28,1,,
Yemen,6/29/21,6918,1361,,,9,,23.194553149121596,,,,,887,YEM,2021/06/29,0,,
Yemen,6/30/21,6920,1361,,,2,,23.201258715224263,,,,,887,YEM,2021/06/30,0,,
Yemen,7/1/21,6923,1361,,,3,,23.211317064378264,,,,,887,YEM,2021/07/01,0,,
Yemen,7/2/21,6924,1361,,,1,,23.214669847429594,,,,,887,YEM,2021/07/02,0,,
Zambia,6/4/21,98376,1297,,,988,,535.118774218128,,,,,894,ZMB,2021/06/04,9,147115,0
Zambia,6/5/21,99540,1303,,,1164,,541.4503820614018,,,,,894,ZMB,2021/06/05,6,147115,0
Zambia,6/6/21,100278,1308,,,738,,545.4647519826527,,,,,894,ZMB,2021/06/06,5,147115,0
Zambia,6/7/21,100765,1315,,,487,,548.1138009686272,,,,,894,ZMB,2021/06/07,7,147115,0
Zambia,6/8/21,101996,1321,,,1231,,554.8098570296839,,,,,894,ZMB,2021/06/08,6,147220,0
Zambia,6/9/21,103763,1324,,,1767,,564.4214988330042,,,,,894,ZMB,2021/06/09,3,147220,0
Zambia,6/10/21,105909,1332,,,2146,,576.0947208533354,,,,,894,ZMB,2021/06/10,8,147220,0
Zambia,6/11/21,107974,1348,,,2065,,587.3273412969439,,,,,894,ZMB,2021/06/11,16,147220,0
Zambia,6/12/21,110332,1365,,,2358,,600.153742752648,,,,,894,ZMB,2021/06/12,17,147220,0
Zambia,6/13/21,111746,1389,,,1414,,607.8452320055596,,,,,894,ZMB,2021/06/13,24,147220,0
Zambia,6/14/21,113134,1416,,,1388,,615.395293591869,,,,,894,ZMB,2021/06/14,27,147220,0
Zambia,6/15/21,115824,1444,,,2690,,630.027617559572,,,,,894,ZMB,2021/06/15,28,147220,0
Zambia,6/16/21,118850,1492,,,3026,,646.4876221418284,,,,,894,ZMB,2021/06/16,48,147220,0
Zambia,6/17/21,122244,1525,,,3394,,664.9493721590718,,,,,894,ZMB,2021/06/17,33,148304,0
Zambia,6/18/21,125157,1554,,,2913,,680.7947103441718,,,,,894,ZMB,2021/06/18,29,148304,0
Zambia,6/19/21,126973,1595,,,1816,,690.6728889037811,,,,,894,ZMB,2021/06/19,41,148304,0
Zambia,6/20/21,129033,1644,,,2060,,701.8783117191969,,,,,894,ZMB,2021/06/20,49,148304,0
Zambia,6/21/21,130631,1691,,,1598,,710.5706736896019,,,,,894,ZMB,2021/06/21,47,148304,0
Zambia,6/22/21,133659,1744,,,3028,,727.0415573231354,,,,,894,ZMB,2021/06/22,53,148304,0
Zambia,6/23/21,137026,1794,,,3367,,745.3564401481378,,,,,894,ZMB,2021/06/23,50,148304,0
Zambia,6/24/21,140620,1855,,,3594,,764.9060952930914,,,,,894,ZMB,2021/06/24,61,148304,0
Zambia,6/25/21,143215,1915,,,2595,,779.0216643251322,,,,,894,ZMB,2021/06/25,60,149002,0
Zambia,6/26/21,146031,1967,,,2816,,794.3393685232928,,,,,894,ZMB,2021/06/26,52,149002,0
Zambia,6/27/21,148568,2022,,,2537,,808.1394450682976,,,,,894,ZMB,2021/06/27,55,151205,0
Zambia,6/28/21,149661,2091,,,1093,,814.0848465912343,,,,,894,ZMB,2021/06/28,69,151205,0
Zambia,6/29/21,152056,2138,,,2395,,827.1125104955647,,,,,894,ZMB,2021/06/29,47,151205,0
Zambia,6/30/21,154948,2199,,,2892,,842.8436186422553,,,,,894,ZMB,2021/06/30,61,153106,0
Zambia,7/1/21,157832,2271,,,2884,,858.5312105838374,,,,,894,ZMB,2021/07/01,72,156584,0
Zambia,7/2/21,160613,2341,,,2781,,873.6585313846487,,,,,894,ZMB,2021/07/02,70,156584,0
Zimbabwe,6/4/21,39144,1605,,,52,,263.3666975556026,,,,,716,ZWE,2021/06/04,1,1048504,0
Zimbabwe,6/5/21,39168,1605,,,24,,263.5281731518967,,,,,716,ZWE,2021/06/05,0,1048504,0
Zimbabwe,6/6/21,39189,1606,,,21,,263.66946429865396,,,,,716,ZWE,2021/06/06,1,1061951,13447
Zimbabwe,6/7/21,39238,1611,,,49,,263.99914364108764,,,,,716,ZWE,2021/06/07,5,1061951,0
Zimbabwe,6/8/21,39321,1617,,,83,,264.55758007827126,,,,,716,ZWE,2021/06/08,6,1073971,12020
Zimbabwe,6/9/21,39432,1622,,,111,,265.30440471113127,,,,,716,ZWE,2021/06/09,5,1083983,10012
Zimbabwe,6/10/21,39496,1626,,,64,,265.73500630124875,,,,,716,ZWE,2021/06/10,4,1083983,0
Zimbabwe,6/11/21,39688,1629,,,192,,267.0268110716012,,,,,716,ZWE,2021/06/11,3,1089506,5523
Zimbabwe,6/12/21,39852,1632,,,164,,268.1302276462772,,,,,716,ZWE,2021/06/12,3,1089506,0
Zimbabwe,6/13/21,39959,1632,,,107,,268.8501396797549,,,,,716,ZWE,2021/06/13,0,1107058,17552
Zimbabwe,6/14/21,40077,1635,,,118,,269.64406136153394,,,,,716,ZWE,2021/06/14,3,1108203,1145
Zimbabwe,6/15/21,40318,1637,,,241,,271.2655454743201,,,,,716,ZWE,2021/06/15,2,1108203,0
Zimbabwe,6/16/21,40556,1640,,,238,,272.8668451375695,,,,,716,ZWE,2021/06/16,3,1108203,0
Zimbabwe,6/17/21,40927,1647,,,371,,275.3629887302817,,,,,716,ZWE,2021/06/17,7,1108203,0
Zimbabwe,6/18/21,41335,1656,,,408,,278.10807386728067,,,,,716,ZWE,2021/06/18,9,1109365,1162
Zimbabwe,6/19/21,41628,1666,,,293,,280.0794217720372,,,,,716,ZWE,2021/06/19,10,1109365,0
Zimbabwe,6/20/21,41779,1672,,,151,,281.09537239872066,,,,,716,ZWE,2021/06/20,6,1126087,16722
Zimbabwe,6/21/21,42195,1685,,,416,,283.89428273448425,,,,,716,ZWE,2021/06/21,13,1138733,12646
Zimbabwe,6/22/21,42714,1691,,,519,,287.38619250434317,,,,,716,ZWE,2021/06/22,6,1146378,7645
Zimbabwe,6/23/21,43480,1692,,,766,,292.53995528606174,,,,,716,ZWE,2021/06/23,1,1146378,0
Zimbabwe,6/24/21,44306,1709,,,826,,298.09740705851544,,,,,716,ZWE,2021/06/24,17,1166849,20471
Zimbabwe,6/25/21,45217,1721,,,911,,304.22675156784396,,,,,716,ZWE,2021/06/25,12,1166849,0
Zimbabwe,6/26/21,46018,1725,,,801,,309.615999594158,,,,,716,ZWE,2021/06/26,4,1193315,26466
Zimbabwe,6/27/21,46442,1736,,,424,,312.4687351286863,,,,,716,ZWE,2021/06/27,11,1193315,0
Zimbabwe,6/28/21,47284,1749,,,842,,318.1338372986694,,,,,716,ZWE,2021/06/28,13,1275259,81944
Zimbabwe,6/29/21,48533,1761,,,1249,,326.5372964558058,,,,,716,ZWE,2021/06/29,12,1299154,23895
Zimbabwe,6/30/21,49864,1789,,,1331,,335.4924639002802,,,,,716,ZWE,2021/06/30,28,1332438,33284
Zimbabwe,7/1/21,51221,1808,,,1357,,344.62256324073985,,,,,716,ZWE,2021/07/01,19,1332438,0
Zimbabwe,7/2/21,52663,1841,,,1442,,354.3245553180743,,,,,716,ZWE,2021/07/02,33,1332438,0
US,6/4/21,545585,11198,,,557,,2308963.561724999,,,Alabama,1,84000001,USA,2021/06/04,10,3032765,7070
US,6/7/21,546324,11217,,,739,,2312091.0745270643,,,Alabama,1,84000001,USA,2021/06/07,19,3036419,1361
US,6/8/21,546540,11220,,,216,,2313005.2054678574,,,Alabama,1,84000001,USA,2021/06/08,3,3036833,414
US,6/9/21,546845,11249,,,305,,2314295.9922129586,,,Alabama,1,84000001,USA,2021/06/09,29,3040485,3652
US,6/10/21,547135,11252,,,290,,2315523.2976427274,,,Alabama,1,84000001,USA,2021/06/10,3,3064250,23765
US,6/11/21,547323,11266,,,188,,2316318.930128232,,,Alabama,1,84000001,USA,2021/06/11,14,3078445,14195
US,6/14/21,547873,11274,,,550,,2318646.5783571037,,,Alabama,1,84000001,USA,2021/06/14,8,3128112,13463
US,6/15/21,548163,11281,,,290,,2319873.883786872,,,Alabama,1,84000001,USA,2021/06/15,7,3129657,1545
US,6/16/21,548323,11288,,,160,,2320551.0178170893,,,Alabama,1,84000001,USA,2021/06/16,7,3141802,12145
US,6/18/21,548657,11306,,,334,,2321964.5351051674,,,Alabama,1,84000001,USA,2021/06/18,18,3254330,1047
US,6/21/21,549013,11311,,,356,,2323471.1583224004,,,Alabama,1,84000001,USA,2021/06/21,5,3285448,3255
US,6/23/21,549394,11328,,,381,,2325083.583731855,,,Alabama,1,84000001,USA,2021/06/23,17,3298895,7544
US,6/25/21,549934,11336,,,540,,2327368.9110838375,,,Alabama,1,84000001,USA,2021/06/25,8,3308961,248
US,6/28/21,550451,11338,,,517,,2329556.900418977,,,Alabama,1,84000001,USA,2021/06/28,2,3341617,11489
US,6/30/21,550983,11352,,,532,,2331808.3710694485,,,Alabama,1,84000001,USA,2021/06/30,14,3350607,703
US,7/2/21,551298,11358,,,315,,2333141.4786914387,,,Alabama,1,84000001,USA,2021/07/02,6,3365623,227
US,6/4/21,70469,369,,,61,,1347399.6175908223,,,Alaska,2,84000002,USA,2021/06/04,0,615746,0
US,6/7/21,70520,369,,,51,,1348374.760994264,,,Alaska,2,84000002,USA,2021/06/07,0,615746,0
US,6/9/21,70588,369,,,68,,1349674.9521988528,,,Alaska,2,84000002,USA,2021/06/09,0,615746,0
US,6/11/21,70652,373,,,64,,1350898.6615678777,,,Alaska,2,84000002,USA,2021/06/11,4,615746,0
US,6/14/21,70717,373,,,65,,1352141.4913957934,,,Alaska,2,84000002,USA,2021/06/14,0,615746,0
US,6/16/21,70770,373,,,53,,1353154.875717017,,,Alaska,2,84000002,USA,2021/06/16,0,642482,9015
US,6/18/21,70875,373,,,105,,1355162.5239005736,,,Alaska,2,84000002,USA,2021/06/18,0,644984,1218
US,6/21/21,70963,373,,,88,,1356845.124282983,,,Alaska,2,84000002,USA,2021/06/21,0,645998,1014
US,6/23/21,71035,374,,,72,,1358221.7973231357,,,Alaska,2,84000002,USA,2021/06/23,1,649260,1788
US,6/28/21,71181,374,,,146,,1361013.3843212237,,,Alaska,2,84000002,USA,2021/06/28,0,656747,2441
US,6/29/21,71187,374,,,6,,1361128.1070745697,,,Alaska,2,84000002,USA,2021/06/29,0,657766,1019
US,6/30/21,71275,377,,,88,,1362810.707456979,,,Alaska,2,84000002,USA,2021/06/30,3,659070,1304
US,7/2/21,71384,377,,,109,,1364894.8374760994,,,Alaska,2,84000002,USA,2021/07/02,0,667278,6461
US,6/4/21,0,0,,,0,,0.0,,,American Samoa,60,16,ASM,2021/06/04,0,43052,0
US,7/2/21,0,0,,,0,,0.0,,,American Samoa,60,16,ASM,2021/07/02,0,47031,251
US,6/4/21,883037,17673,,,346,,413045.2272589072,,,Arizona,4,84000004,USA,2021/06/04,20,6015930,18864
US,6/5/21,883314,17698,,,277,,413174.7954739998,,,Arizona,4,84000004,USA,2021/06/05,25,6043146,27216
US,6/6/21,883821,17700,,,507,,413411.9474055953,,,Arizona,4,84000004,USA,2021/06/06,2,6067368,24222
US,6/7/21,884195,17700,,,374,,413586.8878837348,,,Arizona,4,84000004,USA,2021/06/07,0,6090510,23142
US,6/8/21,884609,17713,,,414,,413780.53857343993,,,Arizona,4,84000004,USA,2021/06/08,13,6104303,13793
US,6/9/21,885042,17715,,,433,,413983.0766136388,,,Arizona,4,84000004,USA,2021/06/09,2,6121904,17601
US,6/10/21,885412,17742,,,370,,414156.1460706217,,,Arizona,4,84000004,USA,2021/06/10,27,6122967,1063
US,6/11/21,885834,17740,,,422,,414353.53880264,,,Arizona,4,84000004,USA,2021/06/11,,6150227,27260
US,6/12/21,886404,17761,,,570,,414620.1593174515,,,Arizona,4,84000004,USA,2021/06/12,21,6183095,32868
US,6/13/21,886752,17768,,,348,,414782.93815807323,,,Arizona,4,84000004,USA,2021/06/13,7,6202357,19262
US,6/14/21,887146,17768,,,394,,414967.23374199553,,,Arizona,4,84000004,USA,2021/06/14,0,6221202,18845
US,6/15/21,887569,17779,,,423,,415165.094229303,,,Arizona,4,84000004,USA,2021/06/15,11,6236785,15583
US,6/16/21,888005,17791,,,436,,415369.0355353693,,,Arizona,4,84000004,USA,2021/06/16,12,6237009,224
US,6/17/21,888337,17809,,,332,,415524.33029136475,,,Arizona,4,84000004,USA,2021/06/17,18,6292764,55755
US,6/18/21,888701,17822,,,364,,415694.5932166128,,,Arizona,4,84000004,USA,2021/06/18,13,6311129,18365
US,6/19/21,889342,17838,,,641,,415994.4243569534,,,Arizona,4,84000004,USA,2021/06/19,16,6331444,20315
US,6/20/21,889727,17843,,,385,,416174.51014327345,,,Arizona,4,84000004,USA,2021/06/20,5,6347146,15702
US,6/21/21,890111,17843,,,384,,416354.1281743043,,,Arizona,4,84000004,USA,2021/06/21,0,6347847,701
US,6/22/21,890533,17858,,,422,,416551.52090632264,,,Arizona,4,84000004,USA,2021/06/22,15,6370509,22662
US,6/23/21,891023,17868,,,490,,416780.7209980027,,,Arizona,4,84000004,USA,2021/06/23,10,6381113,10604
US,6/24/21,891649,17875,,,626,,417073.53580900613,,,Arizona,4,84000004,USA,2021/06/24,7,6394880,13767
US,6/25/21,892236,17903,,,587,,417348.10816373304,,,Arizona,4,84000004,USA,2021/06/25,28,6410375,15495
US,6/26/21,892711,17914,,,475,,417570.29192607594,,,Arizona,4,84000004,USA,2021/06/26,11,6427731,17356
US,6/27/21,893147,17913,,,436,,417774.2332321423,,,Arizona,4,84000004,USA,2021/06/27,,6449374,21643
US,6/28/21,893560,17913,,,413,,417967.4161665583,,,Arizona,4,84000004,USA,2021/06/28,0,6478654,29280
US,6/29/21,894106,17930,,,546,,418222.81055443035,,,Arizona,4,84000004,USA,2021/06/29,17,6485370,6716
US,6/30/21,894875,17936,,,769,,418582.51437178126,,,Arizona,4,84000004,USA,2021/06/30,6,6496635,11265
US,7/1/21,895347,17939,,,472,,418803.2948682567,,,Arizona,4,84000004,USA,2021/07/01,3,6768593,271958
US,7/2/21,895873,17961,,,526,,419049.3341503459,,,Arizona,4,84000004,USA,2021/07/02,22,6781580,12987
US,6/4/21,342142,5845,,,253,,1603214.4697999156,,,Arkansas,5,84000005,USA,2021/06/04,3,2095644,6498
US,6/5/21,342345,5846,,,203,,1604165.6904549927,,,Arkansas,5,84000005,USA,2021/06/05,1,2103704,8060
US,6/6/21,342433,5846,,,88,,1604578.0422660606,,,Arkansas,5,84000005,USA,2021/06/06,0,2111201,7497
US,6/7/21,342495,5849,,,62,,1604868.562860222,,,Arkansas,5,84000005,USA,2021/06/07,3,2111327,126
US,6/8/21,342726,5852,,,231,,1605950.9863642754,,,Arkansas,5,84000005,USA,2021/06/08,3,2117118,5791
US,6/9/21,342927,5854,,,201,,1606892.8353872828,,,Arkansas,5,84000005,USA,2021/06/09,2,2123438,6320
US,6/10/21,343216,5856,,,289,,1608247.036221358,,,Arkansas,5,84000005,USA,2021/06/10,2,2130617,7179
US,6/11/21,343609,5859,,,393,,1610088.561923059,,,Arkansas,5,84000005,USA,2021/06/11,3,2130617,0
US,6/12/21,343873,5860,,,264,,1611325.6173562626,,,Arkansas,5,84000005,USA,2021/06/12,1,2137109,6492
US,6/13/21,343964,5861,,,91,,1611752.026615435,,,Arkansas,5,84000005,USA,2021/06/13,1,2143908,6799
US,6/14/21,344067,5863,,,103,,1612234.6656670258,,,Arkansas,5,84000005,USA,2021/06/14,2,2151600,7692
US,6/15/21,344369,5869,,,302,,1613649.7821095544,,,Arkansas,5,84000005,USA,2021/06/15,6,2155399,3799
US,6/16/21,344657,5867,,,288,,1614999.2971275947,,,Arkansas,5,84000005,USA,2021/06/16,,2161876,6477
US,6/17/21,344945,5869,,,288,,1616348.8121456353,,,Arkansas,5,84000005,USA,2021/06/17,2,2168127,6251
US,6/18/21,345221,5874,,,276,,1617642.0973712571,,,Arkansas,5,84000005,USA,2021/06/18,5,2173705,5578
US,6/19/21,345472,5874,,,251,,1618818.2371960077,,,Arkansas,5,84000005,USA,2021/06/19,0,2180298,6593
US,6/20/21,345605,5874,,,133,,1619441.4507286444,,,Arkansas,5,84000005,USA,2021/06/20,0,2185888,5590
US,6/21/21,345695,5876,,,90,,1619863.174171782,,,Arkansas,5,84000005,USA,2021/06/21,2,2190235,4347
US,6/22/21,346180,5884,,,485,,1622135.7949486903,,,Arkansas,5,84000005,USA,2021/06/22,8,2191813,1578
US,6/23/21,346569,5887,,,389,,1623958.5773862519,,,Arkansas,5,84000005,USA,2021/06/23,3,2195931,4118
US,6/24/21,346952,5890,,,383,,1625753.2449276042,,,Arkansas,5,84000005,USA,2021/06/24,3,2200842,4911
US,6/25/21,347254,5893,,,302,,1627168.3613701325,,,Arkansas,5,84000005,USA,2021/06/25,3,2206228,5386
US,6/28/21,348220,5897,,,966,,1631694.8596598099,,,Arkansas,5,84000005,USA,2021/06/28,4,2224069,5199
US,6/29/21,348699,5905,,,479,,1633939.3655405089,,,Arkansas,5,84000005,USA,2021/06/29,8,2225518,1449
US,6/30/21,349385,5909,,,686,,1637153.8353404244,,,Arkansas,5,84000005,USA,2021/06/30,4,2229874,4356
US,7/1/21,350085,5909,,,700,,1640433.9065648282,,,Arkansas,5,84000005,USA,2021/07/01,0,2240617,10743
US,7/2/21,350579,5913,,,494,,1642748.6996860504,,,Arkansas,5,84000005,USA,2021/07/02,4,2247070,6453
US,6/4/21,3794129,62973,,,1167,,4822963.5938373925,,,California,6,84000006,USA,2021/06/04,58,38825789,188543
US,6/5/21,3794927,63007,,,798,,4823977.98342401,,,California,6,84000006,USA,2021/06/05,34,39130665,304876
US,6/6/21,3795580,63038,,,653,,4824808.054100778,,,California,6,84000006,USA,2021/06/06,31,39350625,219960
US,6/7/21,3796776,63047,,,1196,,4826328.367315808,,,California,6,84000006,USA,2021/06/07,9,39541180,190555
US,6/8/21,3797937,63068,,,1161,,4827804.189759496,,,California,6,84000006,USA,2021/06/08,21,39633257,92077
US,6/9/21,3798631,63083,,,694,,4828686.37819698,,,California,6,84000006,USA,2021/06/09,15,39764396,131139
US,6/10/21,3799978,63129,,,1347,,4830398.637311232,,,California,6,84000006,USA,2021/06/10,46,39765872,1476
US,6/11/21,3801029,63169,,,1051,,4831734.631616414,,,California,6,84000006,USA,2021/06/11,40,39959106,193234
US,6/12/21,3801538,63187,,,509,,4832381.654548228,,,California,6,84000006,USA,2021/06/12,18,40236460,277354
US,6/13/21,3801728,63193,,,190,,4832623.175878375,,,California,6,84000006,USA,2021/06/13,6,40402142,165682
US,6/14/21,3803094,63204,,,1366,,4834359.587125642,,,California,6,84000006,USA,2021/06/14,11,40539772,137630
US,6/15/21,3804355,63208,,,1261,,4835962.526058881,,,California,6,84000006,USA,2021/06/15,4,40669793,130021
US,6/16/21,3805098,63227,,,743,,4836907.001576245,,,California,6,84000006,USA,2021/06/16,19,40901003,231210
US,6/17/21,3806154,63256,,,1056,,4838249.351705903,,,California,6,84000006,USA,2021/06/17,29,41042422,141419
US,6/18/21,3806465,63274,,,311,,4838644.683988407,,,California,6,84000006,USA,2021/06/18,18,41189877,147455
US,6/19/21,3807726,63308,,,1261,,4840247.622921646,,,California,6,84000006,USA,2021/06/19,34,41346145,156268
US,6/20/21,3808258,63335,,,532,,4840923.882646057,,,California,6,84000006,USA,2021/06/20,27,41478634,132489
US,6/21/21,3809710,63356,,,1452,,4842769.614074337,,,California,6,84000006,USA,2021/06/21,21,41584951,106317
US,6/22/21,3810808,63373,,,1098,,4844165.353129608,,,California,6,84000006,USA,2021/06/22,17,41639567,54616
US,6/23/21,3811723,63424,,,915,,4845328.469009,,,California,6,84000006,USA,2021/06/23,51,41735332,95765
US,6/24/21,3812825,63501,,,1102,,4846729.292723852,,,California,6,84000006,USA,2021/06/24,77,41839888,104556
US,6/25/21,3814010,63536,,,1185,,4848235.623125032,,,California,6,84000006,USA,2021/06/25,35,41985070,145182
US,6/26/21,3814890,63569,,,880,,4849354.248233081,,,California,6,84000006,USA,2021/06/26,33,42103167,118097
US,6/27/21,3815751,63589,,,861,,4850448.721208115,,,California,6,84000006,USA,2021/06/27,20,42312077,208910
US,6/28/21,3817372,63598,,,1621,,4852509.279503738,,,California,6,84000006,USA,2021/06/28,9,42436028,123951
US,6/29/21,3818303,63621,,,931,,4853692.734021457,,,California,6,84000006,USA,2021/06/29,23,42513548,77520
US,6/30/21,3816659,63647,,,,,4851602.938933238,,,California,6,84000006,USA,2021/06/30,26,42644084,130536
US,7/1/21,3818326,63712,,,1667,,4853721.970814054,,,California,6,84000006,USA,2021/07/01,65,42771685,127601
US,7/2/21,3819662,63762,,,1336,,4855420.247114455,,,California,6,84000006,USA,2021/07/02,50,42878843,107158
US,6/4/21,545769,6611,,,767,,5447340.053897595,,,Colorado,8,84000008,USA,2021/06/04,8,5784130,0
US,6/5/21,546500,6613,,,731,,5454636.191236651,,,Colorado,8,84000008,USA,2021/06/05,2,5784130,0
US,6/6/21,546874,6613,,,374,,5458369.098712446,,,Colorado,8,84000008,USA,2021/06/06,0,5784130,0
US,6/7/21,547191,6625,,,317,,5461533.087134444,,,Colorado,8,84000008,USA,2021/06/07,12,5896546,112416
US,6/8/21,547791,6639,,,600,,5467521.708753369,,,Colorado,8,84000008,USA,2021/06/08,14,5914366,17820
US,6/9/21,548488,6651,,,697,,5474478.490867352,,,Colorado,8,84000008,USA,2021/06/09,12,5940840,26474
US,6/10/21,549084,6666,,,596,,5480427.18834215,,,Colorado,8,84000008,USA,2021/06/10,15,5968883,28043
US,6/11/21,550014,6677,,,930,,5489709.551851482,,,Colorado,8,84000008,USA,2021/06/11,11,5990401,21518
US,6/12/21,550618,6688,,,604,,5495738.097614532,,,Colorado,8,84000008,USA,2021/06/12,11,6013303,22902
US,6/13/21,551091,6689,,,473,,5500459.127657451,,,Colorado,8,84000008,USA,2021/06/13,1,6024967,11664
US,6/14/21,551328,6690,,,237,,5502824.633196926,,,Colorado,8,84000008,USA,2021/06/14,1,6034958,9991
US,6/15/21,551719,6700,,,391,,5506727.218285258,,,Colorado,8,84000008,USA,2021/06/15,10,6070459,35501
US,6/16/21,552183,6709,,,464,,5511358.419003893,,,Colorado,8,84000008,USA,2021/06/16,9,6088340,17881
US,6/17/21,552726,6713,,,543,,5516778.121569019,,,Colorado,8,84000008,USA,2021/06/17,4,6105965,17625
US,6/18/21,553200,6723,,,474,,5521509.132647969,,,Colorado,8,84000008,USA,2021/06/18,10,6129120,23155
US,6/19/21,553596,6732,,,396,,5525461.622916459,,,Colorado,8,84000008,USA,2021/06/19,9,6129120,0
US,6/20/21,553868,6731,,,272,,5528176.464717038,,,Colorado,8,84000008,USA,2021/06/20,,6162569,33449
US,6/21/21,554090,6736,,,222,,5530392.25471604,,,Colorado,8,84000008,USA,2021/06/21,5,6170158,7589
US,6/22/21,554473,6740,,,383,,5534214.99151612,,,Colorado,8,84000008,USA,2021/06/22,4,6205787,35629
US,6/23/21,554977,6754,,,504,,5539245.433676016,,,Colorado,8,84000008,USA,2021/06/23,14,6220241,14454
US,6/24/21,555569,6765,,,592,,5545154.207006687,,,Colorado,8,84000008,USA,2021/06/24,11,6237171,16930
US,6/25/21,555971,6771,,,402,,5549166.583491366,,,Colorado,8,84000008,USA,2021/06/25,6,6255801,18630
US,6/26/21,556542,6770,,,571,,5554865.755065376,,,Colorado,8,84000008,USA,2021/06/26,,6281847,26046
US,6/27/21,556775,6777,,,233,,5557191.3364607245,,,Colorado,8,84000008,USA,2021/06/27,7,6299962,18115
US,6/28/21,557004,6776,,,229,,5559476.993711947,,,Colorado,8,84000008,USA,2021/06/28,,6310408,10446
US,6/29/21,557347,6788,,,343,,5562900.489070766,,,Colorado,8,84000008,USA,2021/06/29,12,6322866,12458
US,6/30/21,557791,6794,,,444,,5567332.069068769,,,Colorado,8,84000008,USA,2021/06/30,6,6333829,10963
US,7/1/21,558321,6798,,,530,,5572622.018165486,,,Colorado,8,84000008,USA,2021/07/01,4,6347422,13593
US,7/2/21,558820,6802,,,499,,5577602.555145224,,,Colorado,8,84000008,USA,2021/07/02,4,6355752,8330
US,6/4/21,347891,8246,,,143,,297897.7924680173,,,Connecticut,9,84000009,USA,2021/06/04,1,4071439,12096
US,6/7/21,348088,8253,,,197,,298066.4828483842,,,Connecticut,9,84000009,USA,2021/06/07,7,4129334,21198
US,6/8/21,348154,8255,,,66,,298122.9984072888,,,Connecticut,9,84000009,USA,2021/06/08,2,4140584,11250
US,6/9/21,348262,8257,,,108,,298215.4784127691,,,Connecticut,9,84000009,USA,2021/06/09,2,4153505,12921
US,6/10/21,348319,8260,,,57,,298264.28730455035,,,Connecticut,9,84000009,USA,2021/06/10,3,4171732,18227
US,6/11/21,348350,8261,,,31,,298290.83249130857,,,Connecticut,9,84000009,USA,2021/06/11,1,4171739,7
US,6/14/21,348465,8263,,,115,,298389.3065712182,,,Connecticut,9,84000009,USA,2021/06/14,2,4225094,13749
US,6/15/21,348521,8263,,,56,,298437.2591666524,,,Connecticut,9,84000009,USA,2021/06/15,0,4243320,18226
US,6/16/21,348560,8265,,,39,,298470.6547241869,,,Connecticut,9,84000009,USA,2021/06/16,2,4261077,17757
US,6/17/21,348595,8266,,,35,,298500.62509633333,,,Connecticut,9,84000009,USA,2021/06/17,1,4276700,15623
US,6/18/21,348665,8270,,,70,,298560.56584062614,,,Connecticut,9,84000009,USA,2021/06/18,4,4288566,11866
US,6/21/21,348757,8269,,,92,,298639.3451045538,,,Connecticut,9,84000009,USA,2021/06/21,,4320717,10639
US,6/22/21,348802,8271,,,45,,298677.87844017055,,,Connecticut,9,84000009,USA,2021/06/22,2,4325425,4708
US,6/23/21,348840,8271,,,38,,298710.4177013581,,,Connecticut,9,84000009,USA,2021/06/23,0,4331322,5897
US,6/24/21,348993,8274,,,153,,298841.4310424552,,,Connecticut,9,84000009,USA,2021/06/24,3,4339850,8528
US,6/25/21,349120,8275,,,127,,298950.1806785292,,,Connecticut,9,84000009,USA,2021/06/25,1,4349056,9206
US,6/28/21,349261,8276,,,141,,299070.91846346186,,,Connecticut,9,84000009,USA,2021/06/28,1,4395232,19639
US,6/29/21,349301,8276,,,40,,299105.17031734344,,,Connecticut,9,84000009,USA,2021/06/29,0,4399354,4122
US,6/30/21,349352,8278,,,51,,299148.84143104247,,,Connecticut,9,84000009,USA,2021/06/30,2,4405405,6051
US,7/1/21,349387,8279,,,35,,299178.8118031889,,,Connecticut,9,84000009,USA,2021/07/01,1,4414112,8707
US,7/2/21,349476,8279,,,89,,299255.0221780754,,,Connecticut,9,84000009,USA,2021/07/02,0,4422190,8078
US,6/4/21,109005,1674,,,48,,46538.58469420429,,,Delaware,10,84000010,USA,2021/06/04,6,951447,4426
US,6/5/21,109070,1677,,,65,,46566.335788237804,,,Delaware,10,84000010,USA,2021/06/05,3,951496,49
US,6/6/21,109126,1677,,,56,,46590.24442309745,,,Delaware,10,84000010,USA,2021/06/06,0,960980,9484
US,6/7/21,109167,1677,,,41,,46607.74895933397,,,Delaware,10,84000010,USA,2021/06/07,0,964489,3509
US,6/8/21,109188,1677,,,21,,46616.71469740634,,,Delaware,10,84000010,USA,2021/06/08,0,966633,2144
US,6/9/21,109225,1677,,,37,,46632.51147401003,,,Delaware,10,84000010,USA,2021/06/09,0,967452,819
US,6/10/21,109258,1679,,,33,,46646.6004909809,,,Delaware,10,84000010,USA,2021/06/10,2,969254,1802
US,6/11/21,109296,1679,,,38,,46662.8242074928,,,Delaware,10,84000010,USA,2021/06/11,0,973462,4208
US,6/12/21,109322,1679,,,26,,46673.9246451062,,,Delaware,10,84000010,USA,2021/06/12,0,978247,4785
US,6/13/21,109358,1679,,,36,,46689.294481801684,,,Delaware,10,84000010,USA,2021/06/13,0,982415,4168
US,6/14/21,109379,1679,,,21,,46698.26021987405,,,Delaware,10,84000010,USA,2021/06/14,0,986548,4133
US,6/15/21,109421,1679,,,42,,46716.19169601879,,,Delaware,10,84000010,USA,2021/06/15,0,990471,3923
US,6/16/21,109418,1679,,,,,46714.91087629416,,,Delaware,10,84000010,USA,2021/06/16,0,990487,16
US,6/17/21,109470,1679,,,52,,46737.11175152097,,,Delaware,10,84000010,USA,2021/06/17,0,997058,6571
US,6/18/21,109501,1679,,,31,,46750.34688867542,,,Delaware,10,84000010,USA,2021/06/18,0,1001204,4146
US,6/19/21,109528,1682,,,27,,46761.87426619703,,,Delaware,10,84000010,USA,2021/06/19,3,1005805,4601
US,6/20/21,109548,1683,,,20,,46770.41306436119,,,Delaware,10,84000010,USA,2021/06/20,1,1005846,41
US,6/21/21,109564,1683,,,16,,46777.24410289252,,,Delaware,10,84000010,USA,2021/06/21,0,1010503,4657
US,6/22/21,109577,1691,,,13,,46782.79432169922,,,Delaware,10,84000010,USA,2021/06/22,8,1011994,1491
US,6/23/21,109599,1693,,,22,,46792.1869996798,,,Delaware,10,84000010,USA,2021/06/23,2,1013485,1491
US,6/24/21,109620,1693,,,21,,46801.15273775216,,,Delaware,10,84000010,USA,2021/06/24,0,1015607,2122
US,6/25/21,109636,1693,,,16,,46807.98377628349,,,Delaware,10,84000010,USA,2021/06/25,0,1018252,2645
US,6/26/21,109657,1694,,,21,,46816.94951435585,,,Delaware,10,84000010,USA,2021/06/26,1,1021702,3450
US,6/27/21,109682,1694,,,25,,46827.62301206105,,,Delaware,10,84000010,USA,2021/06/27,0,1028860,7158
US,6/28/21,109700,1694,,,18,,46835.307930408795,,,Delaware,10,84000010,USA,2021/06/28,0,1036548,7688
US,6/29/21,109712,1694,,,12,,46840.43120930729,,,Delaware,10,84000010,USA,2021/06/29,0,1037558,1010
US,6/30/21,109744,1694,,,32,,46854.09328636994,,,Delaware,10,84000010,USA,2021/06/30,0,1039175,1617
US,7/1/21,109770,1694,,,26,,46865.19372398335,,,Delaware,10,84000010,USA,2021/07/01,0,1041382,2207
US,7/2/21,109820,1695,,,50,,46886.54071939374,,,Delaware,10,84000010,USA,2021/07/02,1,1043744,2362
US,6/4/21,49,0,,,0,,,,,Diamond Princess,88888,84088888,USA,2021/06/04,0,,
US,7/2/21,49,0,,,0,,,,,Diamond Princess,88888,84088888,USA,2021/07/02,0,,
US,6/4/21,49068,1136,,,27,,6952.613464560346,,,District of Columbia,11,84000011,USA,2021/06/04,0,795113,2379
US,6/7/21,49110,1136,,,42,,6958.5645888269055,,,District of Columbia,11,84000011,USA,2021/06/07,0,803500,5704
US,6/8/21,49119,1137,,,9,,6959.839829741169,,,District of Columbia,11,84000011,USA,2021/06/08,1,805360,1860
US,6/9/21,49127,1137,,,8,,6960.973377220514,,,District of Columbia,11,84000011,USA,2021/06/09,0,807521,2161
US,6/10/21,49151,1137,,,24,,6964.374019658547,,,District of Columbia,11,84000011,USA,2021/06/10,0,809582,2061
US,6/11/21,49158,1137,,,7,,6965.365873702974,,,District of Columbia,11,84000011,USA,2021/06/11,0,809582,0
US,6/12/21,49179,1138,,,21,,6968.341435836253,,,District of Columbia,11,84000011,USA,2021/06/12,1,812053,2471
US,6/14/21,49200,1138,,,21,,6971.316997969533,,,District of Columbia,11,84000011,USA,2021/06/14,0,821887,7294
US,6/15/21,49213,1138,,,13,,6973.159012623468,,,District of Columbia,11,84000011,USA,2021/06/15,0,824047,2160
US,6/16/21,49223,1139,,,10,,6974.575946972649,,,District of Columbia,11,84000011,USA,2021/06/16,1,935958,111911
US,6/17/21,49232,1140,,,9,,6975.851187886911,,,District of Columbia,11,84000011,USA,2021/06/17,1,935958,0
US,6/18/21,49243,1141,,,11,,6977.409815671011,,,District of Columbia,11,84000011,USA,2021/06/18,1,935958,0
US,6/21/21,49262,1141,,,19,,6980.101990934454,,,District of Columbia,11,84000011,USA,2021/06/21,0,935958,0
US,6/22/21,49275,1141,,,13,,6981.944005588389,,,District of Columbia,11,84000011,USA,2021/06/22,0,935958,0
US,6/23/21,49284,1141,,,9,,6983.219246502652,,,District of Columbia,11,84000011,USA,2021/06/23,0,961730,25772
US,6/24/21,49297,1141,,,13,,6985.061261156587,,,District of Columbia,11,84000011,USA,2021/06/24,0,961730,0
US,6/25/21,49305,1141,,,8,,6986.194808635932,,,District of Columbia,11,84000011,USA,2021/06/25,0,961730,0
US,6/28/21,49333,1141,,,28,,6990.162224813637,,,District of Columbia,11,84000011,USA,2021/06/28,0,961730,0
US,6/29/21,49347,1141,,,14,,6992.145932902491,,,District of Columbia,11,84000011,USA,2021/06/29,0,961730,0
US,6/30/21,49355,1141,,,8,,6993.279480381835,,,District of Columbia,11,84000011,USA,2021/06/30,0,978948,17218
US,7/1/21,49362,1141,,,7,,6994.271334426262,,,District of Columbia,11,84000011,USA,2021/07/01,0,978948,0
US,7/2/21,49378,1141,,,16,,6996.538429384951,,,District of Columbia,11,84000011,USA,2021/07/02,0,978948,0
US,6/4/21,2329867,36985,,,0,,9146417.775684057,,,Florida,12,84000012,USA,2021/06/04,12,18982387,69823
US,6/5/21,2332867,36985,,,3000,,9158194.951517293,,,Florida,12,84000012,USA,2021/06/05,0,19078401,96014
US,6/11/21,2344321,37265,,,11454,,9203160.208848584,,,Florida,12,84000012,USA,2021/06/11,280,19490344,3
US,6/18/21,2354416,37555,,,10095,,9242790.40552742,,,Florida,12,84000012,USA,2021/06/18,290,20276370,73770
US,6/25/21,2365464,37772,,,11048,,9286161.818395948,,,Florida,12,84000012,USA,2021/06/25,217,20697309,85011
US,7/2/21,2381148,37985,,,15684,,9347732.893652102,,,Florida,12,84000012,USA,2021/07/02,213,21167740,54650
US,6/4/21,1125512,20942,,,495,,5558907.49246802,,,Georgia,13,84000013,USA,2021/06/04,42,7783684,171034
US,6/5/21,1125854,20986,,,342,,5560596.631599743,,,Georgia,13,84000013,USA,2021/06/05,44,7785073,1389
US,6/6/21,1126134,20986,,,280,,5561979.5525263,,,Georgia,13,84000013,USA,2021/06/06,0,7859494,74421
US,6/7/21,1126397,20986,,,263,,5563278.510396602,,,Georgia,13,84000013,USA,2021/06/07,0,7860212,718
US,6/8/21,1126789,21024,,,392,,5565214.599693782,,,Georgia,13,84000013,USA,2021/06/08,38,7931960,71748
US,6/9/21,1127200,21049,,,411,,5567244.530053835,,,Georgia,13,84000013,USA,2021/06/09,25,7933928,1968
US,6/10/21,1127658,21094,,,458,,5569506.5935694175,,,Georgia,13,84000013,USA,2021/06/10,45,7935079,1151
US,6/11/21,1128092,21128,,,434,,5571650.121005581,,,Georgia,13,84000013,USA,2021/06/11,34,7935079,0
US,6/12/21,1128467,21158,,,375,,5573502.247246506,,,Georgia,13,84000013,USA,2021/06/12,30,7936088,1009
US,6/13/21,1128690,21158,,,223,,5574603.644984442,,,Georgia,13,84000013,USA,2021/06/13,0,7937356,1268
US,6/14/21,1128870,21158,,,180,,5575492.6655800855,,,Georgia,13,84000013,USA,2021/06/14,0,7938727,1371
US,6/15/21,1129177,21171,,,307,,5577008.93959599,,,Georgia,13,84000013,USA,2021/06/15,13,7939097,370
US,6/16/21,1129675,21228,,,498,,5579468.563243938,,,Georgia,13,84000013,USA,2021/06/16,57,7939269,172
US,6/17/21,1130083,21258,,,408,,5581483.676594064,,,Georgia,13,84000013,USA,2021/06/17,30,8097319,158050
US,6/18/21,1130468,21292,,,385,,5583385.192868079,,,Georgia,13,84000013,USA,2021/06/18,34,8098203,884
US,6/19/21,1130845,21319,,,377,,5585247.197115622,,,Georgia,13,84000013,USA,2021/06/19,27,8099160,957
US,6/20/21,1131048,21318,,,203,,5586249.814787376,,,Georgia,13,84000013,USA,2021/06/20,,8100191,1031
US,6/21/21,1131232,21318,,,184,,5587158.591396256,,,Georgia,13,84000013,USA,2021/06/21,0,8100255,64
US,6/22/21,1131583,21329,,,351,,5588892.1815577615,,,Georgia,13,84000013,USA,2021/06/22,11,8220179,119924
US,6/23/21,1131972,21350,,,389,,5590813.453845014,,,Georgia,13,84000013,USA,2021/06/23,21,8220593,414
US,6/24/21,1132329,21367,,,357,,5592576.678026374,,,Georgia,13,84000013,USA,2021/06/24,17,8221814,1221
US,6/25/21,1132661,21369,,,332,,5594216.427125006,,,Georgia,13,84000013,USA,2021/06/25,2,8222264,450
US,6/26/21,1133063,21393,,,402,,5596201.906455277,,,Georgia,13,84000013,USA,2021/06/26,24,8222816,552
US,6/27/21,1133291,21393,,,228,,5597327.99920976,,,Georgia,13,84000013,USA,2021/06/27,0,8222968,152
US,6/28/21,1133481,21393,,,190,,5598266.409838495,,,Georgia,13,84000013,USA,2021/06/28,0,8223532,564
US,6/29/21,1133983,21412,,,502,,5600745.789499679,,,Georgia,13,84000013,USA,2021/06/29,19,8406166,182634
US,6/30/21,1134573,21423,,,590,,5603659.801452067,,,Georgia,13,84000013,USA,2021/06/30,11,8422803,16637
US,7/1/21,1135093,21428,,,520,,5606228.083172816,,,Georgia,13,84000013,USA,2021/07/01,5,8445684,22881
US,7/2/21,1135526,21443,,,433,,5608366.67160567,,,Georgia,13,84000013,USA,2021/07/02,15,8446608,924
US,6/4/21,103,3,,,0,,,,,Grand Princess,99999,84099999,USA,2021/06/04,0,,
US,7/2/21,103,3,,,0,,,,,Grand Princess,99999,84099999,USA,2021/07/02,0,,
US,6/4/21,8204,139,,,11,,4995.463651364863,,,Guam,66,316,GUM,2021/06/04,0,361609,0
US,6/7/21,8210,139,,,6,,4999.117086507255,,,Guam,66,316,GUM,2021/06/07,0,167437,-194172
US,6/8/21,8215,139,,,5,,5002.161615792582,,,Guam,66,316,GUM,2021/06/08,0,167469,32
US,6/9/21,8224,139,,,9,,5007.6417685061715,,,Guam,66,316,GUM,2021/06/09,0,169246,1777
US,6/10/21,8230,139,,,6,,5011.295203648564,,,Guam,66,316,GUM,2021/06/10,0,169333,87
US,6/11/21,8236,139,,,6,,5014.9486387909565,,,Guam,66,316,GUM,2021/06/11,0,169333,0
US,6/14/21,8244,139,,,8,,5019.81988564748,,,Guam,66,316,GUM,2021/06/14,0,173904,1667
US,6/15/21,8251,139,,,7,,5024.082226646938,,,Guam,66,316,GUM,2021/06/15,0,173930,26
US,6/16/21,8261,139,,,10,,5030.171285217592,,,Guam,66,316,GUM,2021/06/16,0,173930,0
US,6/17/21,8266,139,,,5,,5033.21581450292,,,Guam,66,316,GUM,2021/06/17,0,177032,3102
US,6/18/21,8267,139,,,1,,5033.824720359985,,,Guam,66,316,GUM,2021/06/18,0,177118,86
US,6/21/21,8284,139,,,17,,5044.176119930097,,,Guam,66,316,GUM,2021/06/21,0,180943,3
US,6/22/21,8304,139,,,20,,5056.354237071407,,,Guam,66,316,GUM,2021/06/22,0,180969,26
US,6/23/21,8310,139,,,6,,5060.007672213799,,,Guam,66,316,GUM,2021/06/23,0,181012,43
US,6/24/21,8316,139,,,6,,5063.661107356192,,,Guam,66,316,GUM,2021/06/24,0,181112,100
US,6/25/21,8328,139,,,12,,5070.967977640977,,,Guam,66,316,GUM,2021/06/25,0,186276,5164
US,6/28/21,8344,140,,,16,,5080.710471354024,,,Guam,66,316,GUM,2021/06/28,1,187497,15
US,6/29/21,8348,140,,,4,,5083.146094782286,,,Guam,66,316,GUM,2021/06/29,0,187710,213
US,6/30/21,8357,140,,,9,,5088.626247495875,,,Guam,66,316,GUM,2021/06/30,0,187840,130
US,7/1/21,8366,140,,,9,,5094.106400209464,,,Guam,66,316,GUM,2021/07/01,0,189680,1840
US,7/2/21,8373,140,,,7,,5098.368741208922,,,Guam,66,316,GUM,2021/07/02,0,189744,64
US,6/4/21,36471,501,,,69,,21784.526063661397,,,Hawaii,15,84000015,USA,2021/06/04,0,1595765,482
US,6/5/21,36535,502,,,64,,21822.753961664584,,,Hawaii,15,84000015,USA,2021/06/05,1,1604235,8470
US,6/6/21,36616,505,,,81,,21871.136145074874,,,Hawaii,15,84000015,USA,2021/06/06,3,1609251,5016
US,6/7/21,36649,505,,,33,,21890.847404982767,,,Hawaii,15,84000015,USA,2021/06/07,0,1610294,1043
US,6/8/21,36685,505,,,36,,21912.350597609562,,,Hawaii,15,84000015,USA,2021/06/08,0,1612895,2601
US,6/9/21,36731,505,,,46,,21939.826899299354,,,Hawaii,15,84000015,USA,2021/06/09,0,1615918,3023
US,6/10/21,36793,505,,,62,,21976.860175489943,,,Hawaii,15,84000015,USA,2021/06/10,0,1620631,4713
US,6/11/21,36871,506,,,78,,22023.45042618133,,,Hawaii,15,84000015,USA,2021/06/11,1,1625091,4460
US,6/12/21,36975,506,,,104,,22085.570760436516,,,Hawaii,15,84000015,USA,2021/06/12,0,1625546,455
US,6/13/21,37011,506,,,36,,22107.073953063307,,,Hawaii,15,84000015,USA,2021/06/13,0,1625767,221
US,6/14/21,37067,506,,,56,,22140.5233638161,,,Hawaii,15,84000015,USA,2021/06/14,0,1634223,8456
US,6/15/21,37104,506,,,37,,22162.623867349193,,,Hawaii,15,84000015,USA,2021/06/15,0,1639464,5241
US,6/16/21,37134,507,,,30,,22180.54319453819,,,Hawaii,15,84000015,USA,2021/06/16,1,1645413,5949
US,6/17/21,37170,507,,,36,,22202.046387164984,,,Hawaii,15,84000015,USA,2021/06/17,0,1649657,4244
US,6/18/21,37214,510,,,44,,22228.328067042177,,,Hawaii,15,84000015,USA,2021/06/18,3,1653891,4234
US,6/19/21,37284,511,,,70,,22270.139830483164,,,Hawaii,15,84000015,USA,2021/06/19,1,1657518,3627
US,6/20/21,37353,513,,,69,,22311.354283017852,,,Hawaii,15,84000015,USA,2021/06/20,2,1661228,3710
US,6/21/21,37367,513,,,14,,22319.716635706052,,,Hawaii,15,84000015,USA,2021/06/21,0,1661877,649
US,6/22/21,37387,513,,,20,,22331.662853832047,,,Hawaii,15,84000015,USA,2021/06/22,0,1662911,1034
US,6/23/21,37429,513,,,42,,22356.74991189664,,,Hawaii,15,84000015,USA,2021/06/23,0,1665644,2733
US,6/24/21,37484,513,,,55,,22389.602011743133,,,Hawaii,15,84000015,USA,2021/06/24,0,1668004,2360
US,6/25/21,37532,514,,,48,,22418.272935245524,,,Hawaii,15,84000015,USA,2021/06/25,1,1671068,3064
US,6/26/21,37596,516,,,64,,22456.500833248716,,,Hawaii,15,84000015,USA,2021/06/26,2,1673899,2831
US,6/27/21,37647,516,,,51,,22486.963689470005,,,Hawaii,15,84000015,USA,2021/06/27,0,1675961,2062
US,6/28/21,37669,516,,,22,,22500.104529408603,,,Hawaii,15,84000015,USA,2021/06/28,0,1676727,766
US,6/29/21,37702,516,,,33,,22519.815789316497,,,Hawaii,15,84000015,USA,2021/06/29,0,1679300,2573
US,6/30/21,37758,517,,,56,,22553.265200069287,,,Hawaii,15,84000015,USA,2021/06/30,1,1682432,3132
US,7/1/21,37807,518,,,49,,22582.53343447798,,,Hawaii,15,84000015,USA,2021/07/01,1,1684398,1966
US,7/2/21,37886,518,,,79,,22629.720996075666,,,Hawaii,15,84000015,USA,2021/07/02,0,1690038,5640
US,6/4/21,192795,2101,,,165,,1891259.5644496763,,,Idaho,16,84000016,USA,2021/06/04,0,1246785,3430
US,6/7/21,193030,2106,,,235,,1893564.8420639592,,,Idaho,16,84000016,USA,2021/06/07,5,1256270,5495
US,6/8/21,193157,2105,,,127,,1894810.6729448696,,,Idaho,16,84000016,USA,2021/06/08,,1257553,1283
US,6/9/21,193295,2116,,,138,,1896164.4104375122,,,Idaho,16,84000016,USA,2021/06/09,11,1260970,3417
US,6/10/21,193397,2116,,,102,,1897164.9990190307,,,Idaho,16,84000016,USA,2021/06/10,0,1265340,4370
US,6/11/21,193515,2116,,,118,,1898322.54267216,,,Idaho,16,84000016,USA,2021/06/11,0,1265368,28
US,6/14/21,193743,2116,,,228,,1900559.1524426134,,,Idaho,16,84000016,USA,2021/06/14,0,1282884,10744
US,6/15/21,193832,2116,,,89,,1901432.215028448,,,Idaho,16,84000016,USA,2021/06/15,0,1284844,1960
US,6/16/21,193919,2122,,,87,,1902285.6582303315,,,Idaho,16,84000016,USA,2021/06/16,6,1284938,94
US,6/17/21,194006,2122,,,87,,1903139.101432215,,,Idaho,16,84000016,USA,2021/06/17,0,1292554,7616
US,6/21/21,194249,2136,,,243,,1905522.8565823033,,,Idaho,16,84000016,USA,2021/06/21,14,1302916,2142
US,6/22/21,194367,2140,,,118,,1906680.4002354327,,,Idaho,16,84000016,USA,2021/06/22,4,1303710,794
US,6/23/21,194520,2140,,,153,,1908181.2831077103,,,Idaho,16,84000016,USA,2021/06/23,0,1305952,2242
US,6/24/21,194609,2143,,,89,,1909054.3456935452,,,Idaho,16,84000016,USA,2021/06/24,3,1306006,54
US,6/25/21,194690,2145,,,81,,1909848.9307435746,,,Idaho,16,84000016,USA,2021/06/25,2,1308467,2461
US,6/28/21,194824,2145,,,134,,1911163.4294683146,,,Idaho,16,84000016,USA,2021/06/28,0,1319633,3274
US,6/29/21,194901,2149,,,77,,1911918.7757504415,,,Idaho,16,84000016,USA,2021/06/29,4,1321099,1466
US,6/30/21,194998,2152,,,97,,1912870.3158720816,,,Idaho,16,84000016,USA,2021/06/30,3,1323573,2474
US,7/1/21,195089,2154,,,91,,1913762.9978418679,,,Idaho,16,84000016,USA,2021/07/01,2,1325701,2128
US,7/2/21,195172,2158,,,83,,1914577.2022758485,,,Idaho,16,84000016,USA,2021/07/02,4,1327473,1772
US,6/4/21,1384365,25282,,,626,,3599586.5727137993,,,Illinois,17,84000017,USA,2021/06/04,17,11786638,37703
US,6/5/21,1384903,25314,,,538,,3600985.4650406926,,,Illinois,17,84000017,USA,2021/06/05,32,11841109,54471
US,6/6/21,1385245,25352,,,342,,3601874.7237317665,,,Illinois,17,84000017,USA,2021/06/06,38,11841617,508
US,6/7/21,1385489,25372,,,244,,3602509.16560493,,,Illinois,17,84000017,USA,2021/06/07,20,11947497,105880
US,6/8/21,1385854,25386,,,365,,3603458.228243064,,,Illinois,17,84000017,USA,2021/06/08,14,11981117,33620
US,6/9/21,1386262,25413,,,408,,3604519.098260485,,,Illinois,17,84000017,USA,2021/06/09,27,12026308,45191
US,6/10/21,1386628,25430,,,366,,3605470.7610702305,,,Illinois,17,84000017,USA,2021/06/10,17,12077496,51188
US,6/11/21,1387029,25452,,,401,,3606513.4298863723,,,Illinois,17,84000017,USA,2021/06/11,22,12077756,260
US,6/12/21,1387297,25469,,,268,,3607210.2758782078,,,Illinois,17,84000017,USA,2021/06/12,17,12141586,63830
US,6/13/21,1387595,25481,,,298,,3607985.1270183832,,,Illinois,17,84000017,USA,2021/06/13,12,12184785,43199
US,6/14/21,1387760,25490,,,165,,3608414.155334252,,,Illinois,17,84000017,USA,2021/06/14,9,12286836,102051
US,6/15/21,1387986,25505,,,226,,3609001.794118412,,,Illinois,17,84000017,USA,2021/06/15,15,12332391,45555
US,6/16/21,1388338,25531,,,352,,3609917.054525599,,,Illinois,17,84000017,USA,2021/06/16,26,12332481,90
US,6/17/21,1388586,25552,,,248,,3610561.8970852075,,,Illinois,17,84000017,USA,2021/06/17,21,12457407,124926
US,6/18/21,1388688,25566,,,102,,3610827.114589563,,,Illinois,17,84000017,USA,2021/06/18,14,12496568,39161
US,6/21/21,1389443,25592,,,755,,3612790.2441561143,,,Illinois,17,84000017,USA,2021/06/21,26,12612678,39167
US,6/22/21,1389634,25598,,,191,,3613286.876933878,,,Illinois,17,84000017,USA,2021/06/22,6,12629554,16876
US,6/23/21,1389892,25606,,,258,,3613957.7212095996,,,Illinois,17,84000017,USA,2021/06/23,8,12652123,22569
US,6/24/21,1390140,25624,,,248,,3614602.5637692087,,,Illinois,17,84000017,USA,2021/06/24,18,12680771,28648
US,6/25/21,1390432,25632,,,292,,3615361.813879716,,,Illinois,17,84000017,USA,2021/06/25,8,12713403,32632
US,6/28/21,1391179,25652,,,747,,3617304.142073377,,,Illinois,17,84000017,USA,2021/06/28,20,12938839,96670
US,6/29/21,1391480,25656,,,301,,3618086.793728386,,,Illinois,17,84000017,USA,2021/06/29,4,12947452,8613
US,6/30/21,1391739,25660,,,259,,3618760.2381757195,,,Illinois,17,84000017,USA,2021/06/30,4,12971273,23821
US,7/1/21,1392196,25670,,,457,,3619948.5166020957,,,Illinois,17,84000017,USA,2021/07/01,10,13002032,30759
US,7/2/21,1392552,25678,,,356,,3620874.177695728,,,Illinois,17,84000017,USA,2021/07/02,8,13031684,29652
US,6/4/21,746135,13661,,,445,,2196840.7725827345,,,Indiana,18,84000018,USA,2021/06/04,4,5232996,22724
US,6/5/21,746554,13685,,,419,,2198074.431751266,,,Indiana,18,84000018,USA,2021/06/05,24,5255695,22699
US,6/7/21,747083,13687,,,529,,2199631.9632552112,,,Indiana,18,84000018,USA,2021/06/07,2,5279899,24204
US,6/8/21,747447,13696,,,364,,2200703.6862560357,,,Indiana,18,84000018,USA,2021/06/08,9,5297222,17323
US,6/9/21,747799,13708,,,352,,2201740.0777293607,,,Indiana,18,84000018,USA,2021/06/09,12,5329586,32364
US,6/10/21,748259,13710,,,460,,2203094.4529501824,,,Indiana,18,84000018,USA,2021/06/10,2,5351177,21591
US,6/11/21,748654,13714,,,395,,2204257.4490637146,,,Indiana,18,84000018,USA,2021/06/11,4,5367723,16546
US,6/12/21,749097,13745,,,443,,2205561.771287245,,,Indiana,18,84000018,USA,2021/06/12,31,5384791,17068
US,6/14/21,749532,13746,,,435,,2206842.53915911,,,Indiana,18,84000018,USA,2021/06/14,1,5398740,13949
US,6/15/21,749835,13752,,,303,,2207734.6602284773,,,Indiana,18,84000018,USA,2021/06/15,6,5425240,26500
US,6/16/21,750170,13763,,,335,,2208720.9987045107,,,Indiana,18,84000018,USA,2021/06/16,11,5443967,18727
US,6/17/21,750432,13764,,,262,,2209492.4037215877,,,Indiana,18,84000018,USA,2021/06/17,1,5460433,16466
US,6/18/21,750702,13766,,,270,,2210287.3630903307,,,Indiana,18,84000018,USA,2021/06/18,2,5476598,16165
US,6/19/21,751242,13795,,,540,,2211877.2818278177,,,Indiana,18,84000018,USA,2021/06/19,29,5488972,12374
US,6/21/21,751526,13799,,,284,,2212713.4613119774,,,Indiana,18,84000018,USA,2021/06/21,4,5506004,17032
US,6/22/21,751826,13811,,,300,,2213596.74949947,,,Indiana,18,84000018,USA,2021/06/22,12,5516415,10411
US,6/23/21,752108,13816,,,282,,2214427.040395713,,,Indiana,18,84000018,USA,2021/06/23,5,5528827,12412
US,6/24/21,752395,13819,,,287,,2215272.0527617475,,,Indiana,18,84000018,USA,2021/06/24,3,5542188,13361
US,6/25/21,752699,13822,,,304,,2216167.1181250736,,,Indiana,18,84000018,USA,2021/06/25,3,5555947,13759
US,6/28/21,753260,13836,,,561,,2217818.8670356846,,,Indiana,18,84000018,USA,2021/06/28,14,5592460,35462
US,6/29/21,753528,13844,,,268,,2218607.9378165114,,,Indiana,18,84000018,USA,2021/06/29,8,5604586,12126
US,6/30/21,753927,13850,,,399,,2219782.7111058766,,,Indiana,18,84000018,USA,2021/06/30,6,5616205,11619
US,7/1/21,754317,13855,,,390,,2220930.985749617,,,Indiana,18,84000018,USA,2021/07/01,5,5629362,13157
US,7/2/21,754724,13863,,,407,,2222129.313390649,,,Indiana,18,84000018,USA,2021/07/02,8,5638812,9450
US,6/4/21,371862,6067,,,97,,2960213.34182455,,,Iowa,19,84000019,USA,2021/06/04,2,2867134,8658
US,6/5/21,371956,6068,,,94,,2960961.630313644,,,Iowa,19,84000019,USA,2021/06/05,1,2875472,8338
US,6/6/21,372024,6072,,,68,,2961502.9453908615,,,Iowa,19,84000019,USA,2021/06/06,4,2886248,10776
US,6/7/21,372064,6073,,,40,,2961821.3660245184,,,Iowa,19,84000019,USA,2021/06/07,1,2893771,7523
US,6/8/21,372156,6078,,,92,,2962553.7334819296,,,Iowa,19,84000019,USA,2021/06/08,5,2898995,5224
US,6/9/21,372248,6084,,,92,,2963286.100939341,,,Iowa,19,84000019,USA,2021/06/09,6,2906088,7093
US,6/10/21,372331,6095,,,83,,2963946.8237541793,,,Iowa,19,84000019,USA,2021/06/10,11,2914925,8837
US,6/11/21,372438,6097,,,107,,2964798.598949212,,,Iowa,19,84000019,USA,2021/06/11,2,2915077,152
US,6/12/21,372523,6099,,,85,,2965475.2427957333,,,Iowa,19,84000019,USA,2021/06/12,2,2925617,10540
US,6/13/21,372580,6102,,,57,,2965928.9921986945,,,Iowa,19,84000019,USA,2021/06/13,3,2933689,8072
US,6/14/21,372650,6102,,,70,,2966486.2283075945,,,Iowa,19,84000019,USA,2021/06/14,0,2943754,10065
US,6/15/21,372751,6103,,,101,,2967290.240407578,,,Iowa,19,84000019,USA,2021/06/15,1,2952639,8885
US,6/16/21,372836,6109,,,85,,2967966.8842541,,,Iowa,19,84000019,USA,2021/06/16,6,2952798,159
US,6/17/21,372910,6109,,,74,,2968555.9624263654,,,Iowa,19,84000019,USA,2021/06/17,0,2963998,11200
US,6/18/21,372985,6109,,,75,,2969153.0011144723,,,Iowa,19,84000019,USA,2021/06/18,0,2972204,8206
US,6/19/21,373047,6112,,,62,,2969646.553096641,,,Iowa,19,84000019,USA,2021/06/19,3,2982657,10453
US,6/20/21,373098,6114,,,51,,2970052.5394045534,,,Iowa,19,84000019,USA,2021/06/20,2,2988914,6257
US,6/21/21,373142,6114,,,44,,2970402.8021015762,,,Iowa,19,84000019,USA,2021/06/21,0,2993465,4551
US,6/22/21,373223,6117,,,81,,2971047.603884732,,,Iowa,19,84000019,USA,2021/06/22,3,2995797,2332
US,6/23/21,373315,6120,,,92,,2971779.971342143,,,Iowa,19,84000019,USA,2021/06/23,3,2999203,3406
US,6/24/21,373371,6124,,,56,,2972225.760229263,,,Iowa,19,84000019,USA,2021/06/24,4,3004010,4807
US,6/25/21,373450,6125,,,79,,2972854.6409807354,,,Iowa,19,84000019,USA,2021/06/25,1,3009183,5173
US,6/26/21,373532,6131,,,82,,2973507.4032797324,,,Iowa,19,84000019,USA,2021/06/26,6,3014810,5627
US,6/27/21,373583,6133,,,51,,2973913.3895876454,,,Iowa,19,84000019,USA,2021/06/27,2,3021875,7065
US,6/28/21,373636,6133,,,53,,2974335.2969272407,,,Iowa,19,84000019,USA,2021/06/28,0,3029624,7749
US,6/29/21,373739,6134,,,103,,2975155.230058908,,,Iowa,19,84000019,USA,2021/06/29,1,3031716,2092
US,6/30/21,373861,6138,,,122,,2976126.412991562,,,Iowa,19,84000019,USA,2021/06/30,4,3035131,3415
US,7/1/21,373960,6140,,,99,,2976914.5040598633,,,Iowa,19,84000019,USA,2021/07/01,2,3039341,4210
US,7/2/21,374054,6142,,,94,,2977662.7925489573,,,Iowa,19,84000019,USA,2021/07/02,2,3041009,1668
US,6/4/21,316059,5085,,,292,,191054.16825345013,,,Kansas,20,84000020,USA,2021/06/04,4,2343100,11829
US,6/7/21,316268,5101,,,209,,191180.5064408296,,,Kansas,20,84000020,USA,2021/06/07,16,2353459,4064
US,6/8/21,316272,5101,,,4,,191182.9243965689,,,Kansas,20,84000020,USA,2021/06/08,0,2368293,14834
US,6/9/21,316657,5104,,,385,,191415.65263647848,,,Kansas,20,84000020,USA,2021/06/09,3,2368557,264
US,6/11/21,316886,5107,,,229,,191554.08060255458,,,Kansas,20,84000020,USA,2021/06/11,3,2382271,6829
US,6/14/21,317119,5125,,,233,,191694.92652436998,,,Kansas,20,84000020,USA,2021/06/14,18,2398046,60
US,6/16/21,317438,5128,,,319,,191887.75849458075,,,Kansas,20,84000020,USA,2021/06/16,3,2413573,5311
US,6/17/21,317440,5128,,,2,,191888.96747245043,,,Kansas,20,84000020,USA,2021/06/17,0,2422300,8727
US,6/18/21,317610,5129,,,170,,191991.73059137154,,,Kansas,20,84000020,USA,2021/06/18,1,2427645,5345
US,6/21/21,317756,5129,,,146,,192079.98597585672,,,Kansas,20,84000020,USA,2021/06/21,0,2442071,3743
US,6/23/21,318097,5139,,,341,,192286.11670263376,,,Kansas,20,84000020,USA,2021/06/23,10,2447569,3546
US,6/25/21,318352,5147,,,255,,192440.2613810154,,,Kansas,20,84000020,USA,2021/06/25,8,2456518,4712
US,6/28/21,318689,5150,,,337,,192643.97415205315,,,Kansas,20,84000020,USA,2021/06/28,3,2478165,6972
US,6/29/21,318690,5150,,,1,,192644.57864098798,,,Kansas,20,84000020,USA,2021/06/29,0,2480288,2123
US,6/30/21,319125,5156,,,435,,192907.53132763904,,,Kansas,20,84000020,USA,2021/06/30,6,2484177,3889
US,7/1/21,319149,5156,,,24,,192922.03906207497,,,Kansas,20,84000020,USA,2021/07/01,0,2491712,7535
US,7/2/21,319541,5158,,,392,,193158.99872452836,,,Kansas,20,84000020,USA,2021/07/02,2,2496331,4619
US,6/4/21,460049,7086,,,509,,1720838.632453056,,,Kentucky,21,84000021,USA,2021/06/04,9,3680332,10224
US,6/5/21,460412,7091,,,363,,1722196.4539537667,,,Kentucky,21,84000021,USA,2021/06/05,5,3680579,247
US,6/7/21,460520,7103,,,108,,1722600.4339043915,,,Kentucky,21,84000021,USA,2021/06/07,12,3717370,9327
US,6/8/21,461119,7109,,,599,,1724841.026408319,,,Kentucky,21,84000021,USA,2021/06/08,6,3724124,6754
US,6/9/21,461446,7121,,,327,,1726064.1879254882,,,Kentucky,21,84000021,USA,2021/06/09,12,3732493,8369
US,6/10/21,461717,7138,,,271,,1727077.8783571483,,,Kentucky,21,84000021,USA,2021/06/10,17,3751031,18538
US,6/11/21,461947,7147,,,230,,1727938.2060297749,,,Kentucky,21,84000021,USA,2021/06/11,9,3752153,1122
US,6/12/21,462220,7155,,,273,,1728959.3775716317,,,Kentucky,21,84000021,USA,2021/06/12,8,3772665,20512
US,6/13/21,462303,7158,,,83,,1729269.8436447969,,,Kentucky,21,84000021,USA,2021/06/13,3,3789471,16806
US,6/14/21,462432,7163,,,129,,1729752.3752524874,,,Kentucky,21,84000021,USA,2021/06/14,5,3820474,31003
US,6/15/21,462700,7171,,,268,,1730754.8440188523,,,Kentucky,21,84000021,USA,2021/06/15,8,3830662,10188
US,6/16/21,462922,7175,,,222,,1731585.247250692,,,Kentucky,21,84000021,USA,2021/06/16,4,3830698,36
US,6/17/21,463154,7178,,,232,,1732453.0560335154,,,Kentucky,21,84000021,USA,2021/06/17,3,3866548,35850
US,6/18/21,463337,7180,,,183,,1733137.5776165184,,,Kentucky,21,84000021,USA,2021/06/18,2,3880738,14190
US,6/21/21,463692,7190,,,355,,1734465.474676442,,,Kentucky,21,84000021,USA,2021/06/21,10,3910764,8269
US,6/22/21,463873,7194,,,181,,1735142.515149248,,,Kentucky,21,84000021,USA,2021/06/22,4,3916111,5347
US,6/23/21,464033,7196,,,160,,1735741.0039649885,,,Kentucky,21,84000021,USA,2021/06/23,2,3922135,6024
US,6/24/21,464199,7200,,,166,,1736361.9361113189,,,Kentucky,21,84000021,USA,2021/06/24,4,3932696,10561
US,6/25/21,464388,7204,,,189,,1737068.901024912,,,Kentucky,21,84000021,USA,2021/06/25,4,3941892,9196
US,6/28/21,464686,7212,,,298,,1738183.5864442284,,,Kentucky,21,84000021,USA,2021/06/28,8,3984546,17646
US,6/29/21,464893,7217,,,207,,1738957.8813495922,,,Kentucky,21,84000021,USA,2021/06/29,5,3987757,3211
US,6/30/21,465167,7220,,,274,,1739982.7934465474,,,Kentucky,21,84000021,USA,2021/06/30,3,3994259,6502
US,7/1/21,465330,7223,,,163,,1740592.5039275829,,,Kentucky,21,84000021,USA,2021/07/01,3,4002943,8684
US,7/2/21,465490,7229,,,160,,1741190.992743323,,,Kentucky,21,84000021,USA,2021/07/02,6,4010751,7808
US,6/4/21,472981,10615,,,364,,3401762.082853855,,,Louisiana,22,84000022,USA,2021/06/04,10,3112365,9290
US,6/7/21,473777,10619,,,796,,3407487.0540851555,,,Louisiana,22,84000022,USA,2021/06/07,4,3143283,18694
US,6/8/21,473879,10622,,,102,,3408220.655926352,,,Louisiana,22,84000022,USA,2021/06/08,3,3147407,4124
US,6/9/21,474653,10631,,,774,,3413787.3993095513,,,Louisiana,22,84000022,USA,2021/06/09,9,3157002,9595
US,6/10/21,475126,10638,,,473,,3417189.2980437283,,,Louisiana,22,84000022,USA,2021/06/10,7,3168577,11575
US,6/11/21,475354,10648,,,228,,3418829.1139240507,,,Louisiana,22,84000022,USA,2021/06/11,10,3168604,27
US,6/14/21,475908,10655,,,554,,3422813.578826237,,,Louisiana,22,84000022,USA,2021/06/14,7,3220731,27511
US,6/15/21,476467,10660,,,559,,3426834.004602992,,,Louisiana,22,84000022,USA,2021/06/15,5,3225937,5206
US,6/16/21,476792,10670,,,325,,3429171.4614499426,,,Louisiana,22,84000022,USA,2021/06/16,10,3237207,11270
US,6/17/21,477127,10677,,,335,,3431580.84004603,,,Louisiana,22,84000022,USA,2021/06/17,7,3247015,9808
US,6/18/21,477453,10688,,,326,,3433925.489067894,,,Louisiana,22,84000022,USA,2021/06/18,11,3255498,8483
US,6/21/21,478139,10693,,,686,,3438859.321058688,,,Louisiana,22,84000022,USA,2021/06/21,5,3278754,5927
US,6/22/21,478464,10699,,,325,,3441196.777905639,,,Louisiana,22,84000022,USA,2021/06/22,6,3281534,2780
US,6/23/21,478946,10709,,,482,,3444663.4062140393,,,Louisiana,22,84000022,USA,2021/06/23,10,3287166,5632
US,6/24/21,479311,10717,,,365,,3447288.5500575374,,,Louisiana,22,84000022,USA,2021/06/24,8,3295157,7991
US,6/25/21,479521,10723,,,210,,3448798.906789413,,,Louisiana,22,84000022,USA,2021/06/25,6,3308560,13403
US,6/28/21,480463,10728,,,942,,3455573.935558113,,,Louisiana,22,84000022,USA,2021/06/28,5,3330603,10414
US,6/29/21,480876,10732,,,413,,3458544.3037974685,,,Louisiana,22,84000022,USA,2021/06/29,4,3333095,2492
US,6/30/21,481467,10738,,,591,,3462794.8791714613,,,Louisiana,22,84000022,USA,2021/06/30,6,3339493,6398
US,7/1/21,482035,10748,,,568,,3466880.0345224394,,,Louisiana,22,84000022,USA,2021/07/01,10,3380221,40728
US,7/2/21,482560,10757,,,525,,3470655.926352129,,,Louisiana,22,84000022,USA,2021/07/02,9,3388166,7945
US,6/4/21,68058,838,,,72,,32776.76374126497,,,Maine,23,84000023,USA,2021/06/04,1,1503653,5737
US,6/5/21,68155,839,,,97,,32823.47898536416,,,Maine,23,84000023,USA,2021/06/05,1,1509897,6244
US,6/6/21,68233,839,,,78,,32861.04382082537,,,Maine,23,84000023,USA,2021/06/06,0,1509928,31
US,6/7/21,68262,839,,,29,,32875.010234009664,,,Maine,23,84000023,USA,2021/06/07,0,1510257,329
US,6/8/21,68333,840,,,71,,32909.20386628845,,,Maine,23,84000023,USA,2021/06/08,1,1523482,13225
US,6/9/21,68386,843,,,53,,32934.72869038388,,,Maine,23,84000023,USA,2021/06/09,3,1527953,4471
US,6/10/21,68449,843,,,63,,32965.06951902562,,,Maine,23,84000023,USA,2021/06/10,0,1535266,7313
US,6/11/21,68488,844,,,39,,32983.851936756226,,,Maine,23,84000023,USA,2021/06/11,1,1535266,0
US,6/12/21,68541,845,,,53,,33009.376760851665,,,Maine,23,84000023,USA,2021/06/12,1,1543742,8476
US,6/13/21,68590,845,,,49,,33032.975183128576,,,Maine,23,84000023,USA,2021/06/13,0,1550876,7134
US,6/14/21,68606,845,,,16,,33040.680790402665,,,Maine,23,84000023,USA,2021/06/14,0,1550956,80
US,6/15/21,68635,848,,,29,,33054.64720358696,,,Maine,23,84000023,USA,2021/06/15,3,1562459,11503
US,6/16/21,68686,853,,,51,,33079.20882677313,,,Maine,23,84000023,USA,2021/06/16,5,1562730,271
US,6/17/21,68720,854,,,34,,33095.58324223058,,,Maine,23,84000023,USA,2021/06/17,1,1572628,9898
US,6/18/21,68756,854,,,36,,33112.92085859729,,,Maine,23,84000023,USA,2021/06/18,0,1577123,4495
US,6/19/21,68794,854,,,38,,33131.22167587326,,,Maine,23,84000023,USA,2021/06/19,0,1582343,5220
US,6/20/21,68826,854,,,32,,33146.632890421446,,,Maine,23,84000023,USA,2021/06/20,0,1582708,365
US,6/21/21,68846,854,,,20,,33156.26489951406,,,Maine,23,84000023,USA,2021/06/21,0,1583075,367
US,6/22/21,68866,854,,,20,,33165.89690860668,,,Maine,23,84000023,USA,2021/06/22,0,1590298,7223
US,6/23/21,68879,856,,,13,,33172.157714516885,,,Maine,23,84000023,USA,2021/06/23,2,1592049,1751
US,6/24/21,68889,856,,,10,,33176.97371906319,,,Maine,23,84000023,USA,2021/06/24,0,1594846,2797
US,6/25/21,68925,858,,,36,,33194.3113354299,,,Maine,23,84000023,USA,2021/06/25,2,1596920,2074
US,6/26/21,68964,858,,,39,,33213.0937531605,,,Maine,23,84000023,USA,2021/06/26,0,1598972,2052
US,6/27/21,68977,858,,,13,,33219.35455907071,,,Maine,23,84000023,USA,2021/06/27,0,1599343,371
US,6/28/21,68990,858,,,13,,33225.615364980906,,,Maine,23,84000023,USA,2021/06/28,0,1599682,339
US,6/29/21,69022,858,,,32,,33241.02657952909,,,Maine,23,84000023,USA,2021/06/29,0,1603483,3801
US,6/30/21,69034,858,,,12,,33246.80578498466,,,Maine,23,84000023,USA,2021/06/30,0,1604932,1449
US,7/1/21,69055,859,,,21,,33256.919394531906,,,Maine,23,84000023,USA,2021/07/01,1,1615250,10318
US,7/2/21,69070,860,,,15,,33264.14340135137,,,Maine,23,84000023,USA,2021/07/02,1,1620244,4994
US,6/4/21,460339,9630,,,145,,77564.7441405921,,,Maryland,24,84000024,USA,2021/06/04,4,6221987,30572
US,6/5/21,460471,9639,,,132,,77586.98545889568,,,Maryland,24,84000024,USA,2021/06/05,9,6257204,35217
US,6/6/21,460575,9645,,,104,,77604.50892180155,,,Maryland,24,84000024,USA,2021/06/06,6,6285876,28672
US,6/7/21,460659,9649,,,84,,77618.66248799475,,,Maryland,24,84000024,USA,2021/06/07,4,6309368,23492
US,6/8/21,460737,9653,,,78,,77631.80508517414,,,Maryland,24,84000024,USA,2021/06/08,4,6324288,14920
US,6/9/21,460863,9658,,,126,,77653.03543446393,,,Maryland,24,84000024,USA,2021/06/09,5,6351273,26985
US,6/10/21,460984,9667,,,121,,77673.42330957556,,,Maryland,24,84000024,USA,2021/06/10,9,6396215,44942
US,6/11/21,461097,9677,,,113,,77692.46322600212,,,Maryland,24,84000024,USA,2021/06/11,10,6440343,44128
US,6/12/21,461183,9683,,,86,,77706.95378186658,,,Maryland,24,84000024,USA,2021/06/12,6,6469627,29284
US,6/13/21,461265,9686,,,82,,77720.77035838852,,,Maryland,24,84000024,USA,2021/06/13,3,6484185,14558
US,6/14/21,461325,9688,,,60,,77730.88004852651,,,Maryland,24,84000024,USA,2021/06/14,2,6499157,14972
US,6/15/21,461392,9689,,,67,,77742.16920251395,,,Maryland,24,84000024,USA,2021/06/15,1,6528935,29778
US,6/16/21,461470,9695,,,78,,77755.31179969334,,,Maryland,24,84000024,USA,2021/06/16,6,6587564,58629
US,6/17/21,461549,9698,,,79,,77768.62289170836,,,Maryland,24,84000024,USA,2021/06/17,3,6612831,25267
US,6/18/21,461635,9702,,,86,,77783.11344757283,,,Maryland,24,84000024,USA,2021/06/18,4,6640011,27180
US,6/19/21,461697,9707,,,62,,77793.5601273821,,,Maryland,24,84000024,USA,2021/06/19,5,6659569,19558
US,6/20/21,461739,9707,,,42,,77800.6369104787,,,Maryland,24,84000024,USA,2021/06/20,0,6659746,177
US,6/21/21,461779,9707,,,40,,77807.37670390402,,,Maryland,24,84000024,USA,2021/06/21,0,6659768,22
US,6/22/21,461828,9715,,,49,,77815.63295085005,,,Maryland,24,84000024,USA,2021/06/22,8,6682055,22287
US,6/23/21,461887,9722,,,59,,77825.57414615242,,,Maryland,24,84000024,USA,2021/06/23,7,6699439,17384
US,6/24/21,461953,9729,,,66,,77836.69480530421,,,Maryland,24,84000024,USA,2021/06/24,7,6719727,20288
US,6/25/21,462017,9730,,,64,,77847.47847478474,,,Maryland,24,84000024,USA,2021/06/25,1,6738086,18359
US,6/26/21,462078,9734,,,61,,77857.75665975838,,,Maryland,24,84000024,USA,2021/06/26,4,6755363,17277
US,6/27/21,462144,9737,,,66,,77868.87731891018,,,Maryland,24,84000024,USA,2021/06/27,3,6840372,85009
US,6/28/21,462181,9739,,,37,,77875.1116278286,,,Maryland,24,84000024,USA,2021/06/28,2,6851304,10932
US,6/29/21,462217,9740,,,36,,77881.17744191141,,,Maryland,24,84000024,USA,2021/06/29,1,6861505,10201
US,6/30/21,462279,9741,,,62,,77891.62412172067,,,Maryland,24,84000024,USA,2021/06/30,1,6876449,14944
US,7/1/21,462354,9744,,,75,,77904.26123439317,,,Maryland,24,84000024,USA,2021/07/01,3,6891344,14895
US,7/2/21,462439,9746,,,85,,77918.583295422,,,Maryland,24,84000024,USA,2021/07/02,2,6908913,17569
US,6/4/21,707723,17903,,,200,,85203.97966824862,,,Massachusetts,25,84000025,USA,2021/06/04,10,8146584,35546
US,6/5/21,707940,17907,,,217,,85230.1046685496,,,Massachusetts,25,84000025,USA,2021/06/05,4,8185775,39191
US,6/6/21,708083,17911,,,143,,85247.32068257281,,,Massachusetts,25,84000025,USA,2021/06/06,4,8282496,96721
US,6/7/21,708195,17915,,,112,,85260.80455369591,,,Massachusetts,25,84000025,USA,2021/06/07,4,8317896,35400
US,6/8/21,708316,17917,,,121,,85275.3719501771,,,Massachusetts,25,84000025,USA,2021/06/08,2,8338103,20207
US,6/9/21,708459,17917,,,143,,85292.58796420033,,,Massachusetts,25,84000025,USA,2021/06/09,0,8367584,29481
US,6/10/21,708579,17929,,,120,,85307.03496897506,,,Massachusetts,25,84000025,USA,2021/06/10,12,8398807,31223
US,6/11/21,708710,17937,,,131,,85322.8062825208,,,Massachusetts,25,84000025,USA,2021/06/11,8,8398807,0
US,6/12/21,708836,17939,,,126,,85337.97563753428,,,Massachusetts,25,84000025,USA,2021/06/12,2,8430750,31943
US,6/13/21,708875,17939,,,39,,85342.67091408608,,,Massachusetts,25,84000025,USA,2021/06/13,0,8459523,28773
US,6/14/21,708933,17947,,,58,,85349.65363306053,,,Massachusetts,25,84000025,USA,2021/06/14,8,8483060,23537
US,6/15/21,709012,17949,,,79,,85359.16457787056,,,Massachusetts,25,84000025,USA,2021/06/15,2,8509338,26278
US,6/16/21,709080,17953,,,68,,85367.35121390957,,,Massachusetts,25,84000025,USA,2021/06/16,4,8509530,192
US,6/17/21,709187,17957,,,107,,85380.23312650039,,,Massachusetts,25,84000025,USA,2021/06/17,4,8588503,78973
US,6/18/21,709263,17960,,,76,,85389.38289619105,,,Massachusetts,25,84000025,USA,2021/06/18,3,8612018,23515
US,6/19/21,709354,17963,,,91,,85400.33854147856,,,Massachusetts,25,84000025,USA,2021/06/19,3,8638077,26059
US,6/20/21,709395,17968,,,41,,85405.27460144325,,,Massachusetts,25,84000025,USA,2021/06/20,5,8656159,18082
US,6/21/21,709443,17974,,,48,,85411.05340335314,,,Massachusetts,25,84000025,USA,2021/06/21,6,8680160,24001
US,6/22/21,709476,17975,,,33,,85415.0263296662,,,Massachusetts,25,84000025,USA,2021/06/22,1,8690573,10413
US,6/23/21,709544,17980,,,68,,85423.21296570521,,,Massachusetts,25,84000025,USA,2021/06/23,5,8703696,13123
US,6/24/21,709622,17984,,,78,,85432.6035188088,,,Massachusetts,25,84000025,USA,2021/06/24,4,8721461,17765
US,6/25/21,709682,17985,,,60,,85439.82702119616,,,Massachusetts,25,84000025,USA,2021/06/25,1,8738448,16987
US,6/26/21,709738,17987,,,56,,85446.5689567577,,,Massachusetts,25,84000025,USA,2021/06/26,2,8757305,18857
US,6/27/21,709769,17988,,,31,,85450.30109965785,,,Massachusetts,25,84000025,USA,2021/06/27,1,8781036,23731
US,6/28/21,709810,17990,,,41,,85455.23715962254,,,Massachusetts,25,84000025,USA,2021/06/28,2,8817823,36787
US,6/29/21,709873,17991,,,63,,85462.82183712929,,,Massachusetts,25,84000025,USA,2021/06/29,1,8825910,8087
US,6/30/21,709966,17992,,,93,,85474.0182658297,,,Massachusetts,25,84000025,USA,2021/06/30,1,8836836,10926
US,7/1/21,710049,17995,,,83,,85484.01077746556,,,Massachusetts,25,84000025,USA,2021/07/01,3,8858362,21526
US,7/2/21,710138,17997,,,89,,85494.72563934016,,,Massachusetts,25,84000025,USA,2021/07/02,2,8872678,14316
US,6/4/21,994506,20511,,,554,,2957110.9987808866,,,Michigan,26,84000026,USA,2021/06/04,26,8773775,30796
US,6/5/21,994935,20588,,,429,,2958386.607594184,,,Michigan,26,84000026,USA,2021/06/05,77,8774074,299
US,6/7/21,995397,20600,,,462,,2959760.3401623503,,,Michigan,26,84000026,USA,2021/06/07,12,8848018,36160
US,6/8/21,995759,20658,,,362,,2960836.7280187923,,,Michigan,26,84000026,USA,2021/06/08,58,8886592,38574
US,6/9/21,996065,20667,,,306,,2961746.6028366685,,,Michigan,26,84000026,USA,2021/06/09,9,8915473,28881
US,6/10/21,996427,20712,,,362,,2962822.9906931105,,,Michigan,26,84000026,USA,2021/06/10,45,8952922,37449
US,6/11/21,996756,20720,,,329,,2963801.2547946833,,,Michigan,26,84000026,USA,2021/06/11,8,8953195,273
US,6/12/21,996986,20778,,,230,,2964485.1476316494,,,Michigan,26,84000026,USA,2021/06/12,58,8994933,41738
US,6/14/21,997375,20787,,,389,,2965641.818560257,,,Michigan,26,84000026,USA,2021/06/14,9,9078611,39436
US,6/15/21,997595,20817,,,220,,2966295.97692605,,,Michigan,26,84000026,USA,2021/06/15,30,9109439,30828
US,6/16/21,997816,20822,,,221,,2966953.108738961,,,Michigan,26,84000026,USA,2021/06/16,5,9109576,137
US,6/17/21,997993,20848,,,177,,2967479.408878713,,,Michigan,26,84000026,USA,2021/06/17,26,9185561,75985
US,6/18/21,998149,20862,,,156,,2967943.266629003,,,Michigan,26,84000026,USA,2021/06/18,14,9185778,217
US,6/21/21,998507,20898,,,358,,2969007.760696976,,,Michigan,26,84000026,USA,2021/06/21,36,9277147,37728
US,6/22/21,998641,20912,,,134,,2969406.2026106864,,,Michigan,26,84000026,USA,2021/06/22,14,9285546,8399
US,6/23/21,998877,20914,,,236,,2970107.936130356,,,Michigan,26,84000026,USA,2021/06/23,2,9297932,12386
US,6/24/21,999052,20945,,,175,,2970628.2893758733,,,Michigan,26,84000026,USA,2021/06/24,31,9313318,15386
US,6/25/21,999119,20959,,,67,,2970827.5103327287,,,Michigan,26,84000026,USA,2021/06/25,14,9332321,19003
US,6/28/21,999471,20964,,,352,,2971874.163717998,,,Michigan,26,84000026,USA,2021/06/28,5,9353283,10
US,6/29/21,999711,20996,,,240,,2972587.7910261364,,,Michigan,26,84000026,USA,2021/06/29,32,9411471,58188
US,6/30/21,1000019,20999,,,308,,2973503.6127382475,,,Michigan,26,84000026,USA,2021/06/30,3,9424037,12566
US,7/1/21,1000241,21013,,,222,,2974163.7179982755,,,Michigan,26,84000026,USA,2021/07/01,14,9438647,14610
US,7/2/21,1000375,21009,,,134,,2974562.159911986,,,Michigan,26,84000026,USA,2021/07/02,,9453792,15145
US,6/4/21,602134,7538,,,253,,6201812.751055721,,,Minnesota,27,84000027,USA,2021/06/04,8,5461633,18305
US,6/5/21,602428,7554,,,294,,6204840.869296529,,,Minnesota,27,84000027,USA,2021/06/05,16,5483175,21542
US,6/6/21,602686,7558,,,258,,6207498.197548666,,,Minnesota,27,84000027,USA,2021/06/06,4,5504994,21819
US,6/7/21,602880,7560,,,194,,6209496.3435987225,,,Minnesota,27,84000027,USA,2021/06/07,2,5524077,19083
US,6/8/21,603005,7562,,,125,,6210783.808837161,,,Minnesota,27,84000027,USA,2021/06/08,2,5532229,8152
US,6/9/21,603144,7570,,,139,,6212215.470182305,,,Minnesota,27,84000027,USA,2021/06/09,8,5549044,16815
US,6/10/21,603305,7577,,,161,,6213873.725409414,,,Minnesota,27,84000027,USA,2021/06/10,7,5571881,22837
US,6/11/21,603466,7589,,,161,,6215531.980636523,,,Minnesota,27,84000027,USA,2021/06/11,12,5571921,40
US,6/12/21,603614,7596,,,148,,6217056.3394788345,,,Minnesota,27,84000027,USA,2021/06/12,7,5597912,25991
US,6/13/21,603760,7605,,,146,,6218560.09887733,,,Minnesota,27,84000027,USA,2021/06/13,9,5620799,22887
US,6/14/21,603876,7610,,,116,,6219754.866618602,,,Minnesota,27,84000027,USA,2021/06/14,5,5642194,21395
US,6/15/21,603966,7611,,,90,,6220681.841590277,,,Minnesota,27,84000027,USA,2021/06/15,1,5655689,13495
US,6/16/21,604052,7616,,,86,,6221567.617674323,,,Minnesota,27,84000027,USA,2021/06/16,5,5674739,19050
US,6/17/21,604184,7620,,,132,,6222927.180966114,,,Minnesota,27,84000027,USA,2021/06/17,4,5695478,20739
US,6/18/21,604291,7624,,,107,,6224029.251210217,,,Minnesota,27,84000027,USA,2021/06/18,4,5712582,17104
US,6/19/21,604406,7629,,,115,,6225213.719229581,,,Minnesota,27,84000027,USA,2021/06/19,5,5732364,19782
US,6/20/21,604509,7638,,,103,,6226274.590586054,,,Minnesota,27,84000027,USA,2021/06/20,9,5745097,12733
US,6/21/21,604608,7642,,,99,,6227294.263054897,,,Minnesota,27,84000027,USA,2021/06/21,4,5754966,9869
US,6/22/21,604687,7643,,,79,,6228107.941085591,,,Minnesota,27,84000027,USA,2021/06/22,1,5758295,3329
US,6/23/21,604758,7648,,,71,,6228839.221341024,,,Minnesota,27,84000027,USA,2021/06/23,5,5765654,7359
US,6/24/21,604879,7654,,,121,,6230085.487691833,,,Minnesota,27,84000027,USA,2021/06/24,6,5775732,10078
US,6/25/21,604971,7665,,,92,,6231033.062107323,,,Minnesota,27,84000027,USA,2021/06/25,11,5787557,11825
US,6/26/21,605040,7671,,,69,,6231743.742918941,,,Minnesota,27,84000027,USA,2021/06/26,6,5801910,14353
US,6/27/21,605137,7675,,,97,,6232742.815943969,,,Minnesota,27,84000027,USA,2021/06/27,4,5816731,14821
US,6/28/21,605218,7680,,,81,,6233577.093418478,,,Minnesota,27,84000027,USA,2021/06/28,5,5833184,16453
US,6/29/21,605297,7680,,,79,,6234390.771449171,,,Minnesota,27,84000027,USA,2021/06/29,0,5835259,2075
US,6/30/21,605365,7687,,,68,,6235091.152538882,,,Minnesota,27,84000027,USA,2021/06/30,7,5867176,31917
US,7/1/21,605448,7692,,,83,,6235946.029457205,,,Minnesota,27,84000027,USA,2021/07/01,5,5884070,16894
US,7/2/21,605549,7698,,,101,,6236986.301369863,,,Minnesota,27,84000027,USA,2021/07/02,6,5893800,9730
US,6/4/21,318189,7325,,,141,,1071704.2775345235,,,Mississippi,28,84000028,USA,2021/06/04,1,1904253,6016
US,6/7/21,318521,7333,,,332,,1072822.4991579656,,,Mississippi,28,84000028,USA,2021/06/07,8,1904253,0
US,6/8/21,318578,7343,,,57,,1073014.482990906,,,Mississippi,28,84000028,USA,2021/06/08,10,1920573,16320
US,6/9/21,318685,7347,,,107,,1073374.8736948466,,,Mississippi,28,84000028,USA,2021/06/09,4,1925967,5394
US,6/10/21,318879,7348,,,194,,1074028.292354328,,,Mississippi,28,84000028,USA,2021/06/10,1,1931409,5442
US,6/11/21,319115,7353,,,236,,1074823.1727854495,,,Mississippi,28,84000028,USA,2021/06/11,5,1936984,5575
US,6/14/21,319381,7354,,,266,,1075719.0973391715,,,Mississippi,28,84000028,USA,2021/06/14,1,1946303,9319
US,6/15/21,319428,7361,,,47,,1075877.3997979118,,,Mississippi,28,84000028,USA,2021/06/15,7,1953532,7229
US,6/16/21,319511,7368,,,83,,1076156.9552037723,,,Mississippi,28,84000028,USA,2021/06/16,7,1960928,7396
US,6/17/21,319704,7369,,,193,,1076807.0057258336,,,Mississippi,28,84000028,USA,2021/06/17,1,1966041,5113
US,6/18/21,319948,7371,,,244,,1077628.8312563153,,,Mississippi,28,84000028,USA,2021/06/18,2,1971910,5869
US,6/21/21,320107,7378,,,159,,1078164.3651060963,,,Mississippi,28,84000028,USA,2021/06/21,7,1981761,9851
US,6/22/21,320174,7390,,,67,,1078390.0303132369,,,Mississippi,28,84000028,USA,2021/06/22,12,1981761,0
US,6/23/21,320292,7390,,,118,,1078787.4705287975,,,Mississippi,28,84000028,USA,2021/06/23,0,1988994,7233
US,6/24/21,320594,7391,,,302,,1079804.6480296396,,,Mississippi,28,84000028,USA,2021/06/24,1,1993349,4355
US,6/25/21,320837,7395,,,243,,1080623.1054227012,,,Mississippi,28,84000028,USA,2021/06/25,4,1999085,5736
US,6/28/21,321138,7401,,,301,,1081636.9147861232,,,Mississippi,28,84000028,USA,2021/06/28,6,2018227,19142
US,6/29/21,321408,7412,,,270,,1082546.311889525,,,Mississippi,28,84000028,USA,2021/06/29,11,2022135,3908
US,6/30/21,321764,7412,,,356,,1083745.3688110474,,,Mississippi,28,84000028,USA,2021/06/30,0,2026006,3871
US,7/1/21,321944,7415,,,180,,1084351.6335466488,,,Mississippi,28,84000028,USA,2021/07/01,3,2029910,3904
US,7/2/21,322186,7419,,,242,,1085166.7228022902,,,Mississippi,28,84000028,USA,2021/07/02,4,2032232,2322
US,6/4/21,608463,9554,,,689,,202432.32992654105,,,Missouri,29,84000029,USA,2021/06/04,10,4713270,12459
US,6/5/21,608970,9558,,,507,,202601.00606834877,,,Missouri,29,84000029,USA,2021/06/05,4,4713467,197
US,6/6/21,608578,9557,,,,,202470.58980091556,,,Missouri,29,84000029,USA,2021/06/06,,4742062,28595
US,6/7/21,609329,9560,,,751,,202720.44341530927,,,Missouri,29,84000029,USA,2021/06/07,3,4755797,13735
US,6/8/21,610053,9593,,,724,,202961.31427658894,,,Missouri,29,84000029,USA,2021/06/08,33,4763929,8132
US,6/9/21,610677,9608,,,624,,203168.91568189076,,,Missouri,29,84000029,USA,2021/06/09,15,4780515,16586
US,6/10/21,611352,9611,,,675,,203393.4845097413,,,Missouri,29,84000029,USA,2021/06/10,3,4797636,17121
US,6/11/21,611997,9614,,,645,,203608.07250079847,,,Missouri,29,84000029,USA,2021/06/11,3,4797644,8
US,6/12/21,612552,9615,,,555,,203792.71798147558,,,Missouri,29,84000029,USA,2021/06/12,1,4822265,24621
US,6/13/21,612956,9615,,,404,,203927.12658362612,,,Missouri,29,84000029,USA,2021/06/13,0,4837782,15517
US,6/14/21,613266,9618,,,310,,204030.26189715747,,,Missouri,29,84000029,USA,2021/06/14,3,4874609,36827
US,6/15/21,613848,9638,,,582,,204223.89013094857,,,Missouri,29,84000029,USA,2021/06/15,20,4886745,12136
US,6/16/21,614710,9640,,,862,,204510.6728414777,,,Missouri,29,84000029,USA,2021/06/16,2,4886829,84
US,6/17/21,615471,9645,,,761,,204763.85340146918,,,Missouri,29,84000029,USA,2021/06/17,5,4920661,33832
US,6/18/21,616390,9646,,,919,,205069.59970190568,,,Missouri,29,84000029,USA,2021/06/18,1,4990217,69556
US,6/19/21,617006,9648,,,616,,205274.53955072927,,,Missouri,29,84000029,USA,2021/06/19,2,4998531,8314
US,6/20/21,617498,9648,,,492,,205438.2252741403,,,Missouri,29,84000029,USA,2021/06/20,0,5009230,10699
US,6/21/21,617928,9649,,,430,,205581.2839348451,,,Missouri,29,84000029,USA,2021/06/21,1,5009706,476
US,6/22/21,618713,9664,,,785,,205842.44916427127,,,Missouri,29,84000029,USA,2021/06/22,15,5013654,3948
US,6/23/21,619554,9668,,,841,,206122.24528904504,,,Missouri,29,84000029,USA,2021/06/23,4,5021947,8293
US,6/24/21,620792,9669,,,1238,,206534.1211540509,,,Missouri,29,84000029,USA,2021/06/24,1,5033569,11622
US,6/25/21,621683,9673,,,891,,206830.55200681358,,,Missouri,29,84000029,USA,2021/06/25,4,5044416,10847
US,6/26/21,622472,9676,,,789,,207093.04801447887,,,Missouri,29,84000029,USA,2021/06/26,3,5058855,14439
US,6/27/21,623096,9676,,,624,,207300.64941978068,,,Missouri,29,84000029,USA,2021/06/27,0,5075290,16435
US,6/28/21,623538,9676,,,442,,207447.70041520282,,,Missouri,29,84000029,USA,2021/06/28,0,5076414,1124
US,6/29/21,624471,9717,,,933,,207758.1044394762,,,Missouri,29,84000029,USA,2021/06/29,41,5081942,5528
US,6/30/21,625796,9726,,,1325,,208198.9247311828,,,Missouri,29,84000029,USA,2021/06/30,9,5111580,29638
US,7/1/21,627082,9731,,,1286,,208626.76993505802,,,Missouri,29,84000029,USA,2021/07/01,5,5122970,11390
US,7/2/21,628255,9748,,,1173,,209017.02065367828,,,Missouri,29,84000029,USA,2021/07/02,17,5132864,9894
US,6/4/21,112260,1632,,,131,,69597.02417854928,,,Montana,30,84000030,USA,2021/06/04,5,869261,255
US,6/7/21,112381,1633,,,121,,69672.03967761934,,,Montana,30,84000030,USA,2021/06/07,1,879383,148
US,6/8/21,112518,1634,,,137,,69756.97458152511,,,Montana,30,84000030,USA,2021/06/08,1,893704,14321
US,6/9/21,112591,1636,,,73,,69802.23186608804,,,Montana,30,84000030,USA,2021/06/09,2,895603,1899
US,6/10/21,112690,1638,,,99,,69863.60818350899,,,Montana,30,84000030,USA,2021/06/10,2,898779,3176
US,6/11/21,112761,1641,,,71,,69907.62554246745,,,Montana,30,84000030,USA,2021/06/11,3,898796,17
US,6/14/21,112850,1643,,,89,,69962.8022318661,,,Montana,30,84000030,USA,2021/06/14,2,904328,176
US,6/15/21,112949,1647,,,99,,70024.17854928704,,,Montana,30,84000030,USA,2021/06/15,4,907825,3497
US,6/16/21,113021,1649,,,72,,70068.81587104774,,,Montana,30,84000030,USA,2021/06/16,2,907825,0
US,6/17/21,113092,1651,,,71,,70112.8332300062,,,Montana,30,84000030,USA,2021/06/17,2,915033,7208
US,6/18/21,113167,1651,,,75,,70159.3304401736,,,Montana,30,84000030,USA,2021/06/18,0,917101,2068
US,6/21/21,113225,1652,,,58,,70195.28828270304,,,Montana,30,84000030,USA,2021/06/21,1,921549,911
US,6/22/21,113341,1655,,,116,,70267.20396776193,,,Montana,30,84000030,USA,2021/06/22,3,921925,376
US,6/23/21,113403,1657,,,62,,70305.64166150031,,,Montana,30,84000030,USA,2021/06/23,2,922847,922
US,6/24/21,113471,1661,,,68,,70347.79913205208,,,Montana,30,84000030,USA,2021/06/24,4,924481,1634
US,6/25/21,113529,1662,,,58,,70383.75697458153,,,Montana,30,84000030,USA,2021/06/25,1,926031,1550
US,6/28/21,113577,1662,,,48,,70413.51518908865,,,Montana,30,84000030,USA,2021/06/28,0,932584,1256
US,6/29/21,113690,1665,,,113,,70483.57098574085,,,Montana,30,84000030,USA,2021/06/29,3,932825,241
US,6/30/21,113755,1665,,,65,,70523.86856788593,,,Montana,30,84000030,USA,2021/06/30,0,940056,7231
US,7/1/21,113821,1666,,,66,,70564.78611283323,,,Montana,30,84000030,USA,2021/07/01,1,941469,1413
US,7/2/21,113873,1666,,,52,,70597.02417854928,,,Montana,30,84000030,USA,2021/07/02,0,943623,2154
US,6/4/21,223558,2249,,,41,,1634315.3739308428,,,Nebraska,31,84000031,USA,2021/06/04,0,1715953,9552
US,6/7/21,223648,2251,,,90,,1634973.3167629212,,,Nebraska,31,84000031,USA,2021/06/07,2,1722679,40
US,6/8/21,223685,2254,,,37,,1635243.8043716645,,,Nebraska,31,84000031,USA,2021/06/08,3,1736034,13355
US,6/9/21,223714,2256,,,29,,1635455.808173112,,,Nebraska,31,84000031,USA,2021/06/09,2,1740272,4238
US,6/10/21,223749,2256,,,35,,1635711.6748300313,,,Nebraska,31,84000031,USA,2021/06/10,0,1746606,6334
US,6/11/21,223792,2256,,,43,,1636026.0252942466,,,Nebraska,31,84000031,USA,2021/06/11,0,1746610,4
US,6/14/21,223847,2258,,,55,,1636428.1014694057,,,Nebraska,31,84000031,USA,2021/06/14,2,1759916,53
US,6/15/21,223888,2258,,,41,,1636727.8309817968,,,Nebraska,31,84000031,USA,2021/06/15,0,1770014,10098
US,6/16/21,223931,2258,,,43,,1637042.181446012,,,Nebraska,31,84000031,USA,2021/06/16,0,1770036,22
US,6/17/21,223960,2258,,,29,,1637254.1852474597,,,Nebraska,31,84000031,USA,2021/06/17,0,1780069,10033
US,6/18/21,223986,2259,,,26,,1637444.2576211712,,,Nebraska,31,84000031,USA,2021/06/18,1,1785078,5009
US,6/21/21,224065,2259,,,79,,1638021.7852182176,,,Nebraska,31,84000031,USA,2021/06/21,0,1785309,46
US,6/22/21,224103,2257,,,38,,1638299.583302873,,,Nebraska,31,84000031,USA,2021/06/22,,1801883,16574
US,6/23/21,224156,2259,,,53,,1638687.0385262081,,,Nebraska,31,84000031,USA,2021/06/23,2,1808570,6687
US,6/24/21,224206,2259,,,50,,1639052.5623218073,,,Nebraska,31,84000031,USA,2021/06/24,0,1844039,35469
US,6/25/21,224226,2259,,,20,,1639198.7718400469,,,Nebraska,31,84000031,USA,2021/06/25,0,1847972,3933
US,6/28/21,224330,2259,,,104,,1639959.0613348929,,,Nebraska,31,84000031,USA,2021/06/28,0,1857467,9391
US,6/29/21,224404,2261,,,74,,1640500.0365523796,,,Nebraska,31,84000031,USA,2021/06/29,2,1860022,2555
US,6/30/21,224488,2261,,,84,,1641114.116528986,,,Nebraska,31,84000031,USA,2021/06/30,0,1865625,5603
US,7/2/21,224488,2261,,,0,,1641114.116528986,,,Nebraska,31,84000031,USA,2021/07/02,0,1868841,53
US,6/4/21,325392,5600,,,361,,581930.0379140138,,,Nevada,32,84000032,USA,2021/06/04,1,2535207,9597
US,6/7/21,326019,5607,,,627,,583051.3627584233,,,Nevada,32,84000032,USA,2021/06/07,7,2566097,20400
US,6/8/21,326366,5610,,,347,,583671.9364761427,,,Nevada,32,84000032,USA,2021/06/08,3,2571731,5634
US,6/9/21,326583,5617,,,217,,584060.0185993275,,,Nevada,32,84000032,USA,2021/06/09,7,2571894,163
US,6/10/21,326878,5621,,,295,,584587.5956792331,,,Nevada,32,84000032,USA,2021/06/10,4,2578580,6686
US,6/11/21,327140,5622,,,262,,585056.1556620646,,,Nevada,32,84000032,USA,2021/06/11,1,2590262,11682
US,6/14/21,327579,5626,,,439,,585841.2618928392,,,Nevada,32,84000032,USA,2021/06/14,4,2625235,8391
US,6/15/21,327831,5631,,,252,,586291.9379068603,,,Nevada,32,84000032,USA,2021/06/15,5,2631465,6230
US,6/16/21,328194,5635,,,363,,586941.1259746763,,,Nevada,32,84000032,USA,2021/06/16,4,2649807,18342
US,6/17/21,328490,5642,,,296,,587470.491451463,,,Nevada,32,84000032,USA,2021/06/17,7,2657281,7474
US,6/18/21,328875,5649,,,385,,588159.0242506617,,,Nevada,32,84000032,USA,2021/06/18,7,2667757,10476
US,6/21/21,329515,5646,,,640,,589303.5982545246,,,Nevada,32,84000032,USA,2021/06/21,,2692825,9851
US,6/22/21,329915,5653,,,400,,590018.957006939,,,Nevada,32,84000032,USA,2021/06/22,7,2696755,3930
US,6/23/21,330362,5654,,,447,,590818.370412762,,,Nevada,32,84000032,USA,2021/06/23,1,2701087,4332
US,6/24/21,330810,5664,,,448,,591619.5722154661,,,Nevada,32,84000032,USA,2021/06/24,10,2707121,6034
US,6/25/21,331614,5667,,,804,,593057.4433078188,,,Nevada,32,84000032,USA,2021/06/25,3,2707225,104
US,6/28/21,332529,5670,,,915,,594693.8264539667,,,Nevada,32,84000032,USA,2021/06/28,3,2761997,18672
US,6/29/21,333154,5678,,,625,,595811.5745046141,,,Nevada,32,84000032,USA,2021/06/29,8,2768190,6193
US,6/30/21,333712,5681,,,558,,596809.4999642321,,,Nevada,32,84000032,USA,2021/06/30,3,2776098,7908
US,7/1/21,334255,5692,,,543,,597780.5994706345,,,Nevada,32,84000032,USA,2021/07/01,11,2783847,7749
US,7/2/21,334763,5697,,,508,,598689.1050862008,,,Nevada,32,84000032,USA,2021/07/02,5,2790009,6162
US,6/4/21,98877,1355,,,37,,229168.40495063274,,,New Hampshire,33,84000033,USA,2021/06/04,1,1413342,6039
US,6/7/21,98941,1357,,,64,,229316.73851573726,,,New Hampshire,33,84000033,USA,2021/06/07,2,1429285,9288
US,6/8/21,98944,1357,,,3,,229323.69165160155,,,New Hampshire,33,84000033,USA,2021/06/08,0,1451012,21727
US,6/9/21,98996,1357,,,52,,229444.21267324896,,,New Hampshire,33,84000033,USA,2021/06/09,0,1451393,381
US,6/10/21,99040,1360,,,44,,229546.19199925833,,,New Hampshire,33,84000033,USA,2021/06/10,3,1457239,5846
US,6/11/21,99068,1360,,,28,,229611.08793399157,,,New Hampshire,33,84000033,USA,2021/06/11,0,1465086,7847
US,6/14/21,99143,1363,,,75,,229784.91633059844,,,New Hampshire,33,84000033,USA,2021/06/14,3,1470698,674
US,6/15/21,99178,1364,,,35,,229866.036249015,,,New Hampshire,33,84000033,USA,2021/06/15,1,1479763,9065
US,6/16/21,99196,1364,,,18,,229907.7550642006,,,New Hampshire,33,84000033,USA,2021/06/16,0,1486923,7160
US,6/17/21,99225,1366,,,29,,229974.9687108886,,,New Hampshire,33,84000033,USA,2021/06/17,2,1490887,3964
US,6/18/21,99254,1367,,,29,,230042.1823575766,,,New Hampshire,33,84000033,USA,2021/06/18,1,1491368,481
US,6/21/21,99329,1367,,,75,,230216.01075418346,,,New Hampshire,33,84000033,USA,2021/06/21,0,1500484,2887
US,6/22/21,99348,1368,,,19,,230260.04728132387,,,New Hampshire,33,84000033,USA,2021/06/22,1,1500723,239
US,6/23/21,99366,1369,,,18,,230301.76609650953,,,New Hampshire,33,84000033,USA,2021/06/23,1,1501120,397
US,6/24/21,99392,1369,,,26,,230362.02660733325,,,New Hampshire,33,84000033,USA,2021/06/24,0,1501636,516
US,6/25/21,99403,1371,,,11,,230387.52143883557,,,New Hampshire,33,84000033,USA,2021/06/25,2,1508085,6449
US,6/28/21,99455,1371,,,52,,230508.042460483,,,New Hampshire,33,84000033,USA,2021/06/28,0,1514552,5763
US,6/29/21,99481,1371,,,26,,230568.30297130672,,,New Hampshire,33,84000033,USA,2021/06/29,0,1514977,425
US,6/30/21,99504,1372,,,23,,230621.61034626616,,,New Hampshire,33,84000033,USA,2021/06/30,1,1515365,388
US,7/1/21,99527,1372,,,23,,230674.91772122562,,,New Hampshire,33,84000033,USA,2021/07/01,0,1532741,17376
US,7/2/21,99555,1372,,,28,,230739.81365595883,,,New Hampshire,33,84000033,USA,2021/07/02,0,1534269,1528
US,6/4/21,1017118,26265,,,74,,966226.8327206057,,,New Jersey,34,84000034,USA,2021/06/04,12,9237904,42281
US,6/5/21,1017695,26273,,,577,,966774.9627138609,,,New Jersey,34,84000034,USA,2021/06/05,8,9238253,349
US,6/6/21,1017904,26279,,,209,,966973.5054670505,,,New Jersey,34,84000034,USA,2021/06/06,6,9286153,47900
US,6/7/21,1018112,26285,,,208,,967171.0982549137,,,New Jersey,34,84000034,USA,2021/06/07,6,9335740,49587
US,6/8/21,1018307,26285,,,195,,967356.3414935354,,,New Jersey,34,84000034,USA,2021/06/08,0,9389685,53945
US,6/9/21,1018491,26316,,,184,,967531.1351135684,,,New Jersey,34,84000034,USA,2021/06/09,31,9390172,487
US,6/10/21,1018833,26322,,,342,,967856.0232551512,,,New Jersey,34,84000034,USA,2021/06/10,6,9438282,48110
US,6/11/21,1019107,26324,,,274,,968116.313754548,,,New Jersey,34,84000034,USA,2021/06/11,2,9497563,59281
US,6/13/21,1019563,26330,,,456,,968549.4979433251,,,New Jersey,34,84000034,USA,2021/06/13,6,9621430,62115
US,6/14/21,1019794,26334,,,231,,968768.9399336925,,,New Jersey,34,84000034,USA,2021/06/14,4,9603713,-17717
US,6/15/21,1020043,26345,,,249,,969005.4812999326,,,New Jersey,34,84000034,USA,2021/06/15,11,9678432,74719
US,6/16/21,1020326,26357,,,283,,969274.3214872658,,,New Jersey,34,84000034,USA,2021/06/16,12,9728973,50541
US,6/17/21,1020564,26364,,,238,,969500.413234917,,,New Jersey,34,84000034,USA,2021/06/17,7,9769651,40678
US,6/18/21,1020830,26368,,,266,,969753.1040117035,,,New Jersey,34,84000034,USA,2021/06/18,4,9799660,30009
US,6/19/21,1021038,26372,,,208,,969950.6967995669,,,New Jersey,34,84000034,USA,2021/06/19,4,9837200,37540
US,6/20/21,1021182,26374,,,144,,970087.491806549,,,New Jersey,34,84000034,USA,2021/06/20,2,9875233,38033
US,6/21/21,1021308,26377,,,126,,970207.1874376585,,,New Jersey,34,84000034,USA,2021/06/21,3,9893949,18716
US,6/22/21,1021554,26392,,,246,,970440.8789079199,,,New Jersey,34,84000034,USA,2021/06/22,15,9949593,55644
US,6/23/21,1021822,26410,,,268,,970695.4696153591,,,New Jersey,34,84000034,USA,2021/06/23,18,9969179,19586
US,6/24/21,1022094,26416,,,272,,970953.8601841033,,,New Jersey,34,84000034,USA,2021/06/24,6,9999545,30366
US,6/25/21,1022443,26428,,,349,,971285.39808297,,,New Jersey,34,84000034,USA,2021/06/25,12,9667905,-331640
US,6/26/21,1022680,26434,,,237,,971510.5398652949,,,New Jersey,34,84000034,USA,2021/06/26,6,9724314,56409
US,6/27/21,1022830,26437,,,150,,971653.0346642347,,,New Jersey,34,84000034,USA,2021/06/27,3,9786757,62443
US,6/28/21,1022977,26438,,,147,,971792.6795671958,,,New Jersey,34,84000034,USA,2021/06/28,1,9803748,16991
US,6/29/21,1023200,26444,,,223,,972004.521834953,,,New Jersey,34,84000034,USA,2021/06/29,6,9819195,15447
US,6/30/21,1023395,26457,,,195,,972189.7650735748,,,New Jersey,34,84000034,USA,2021/06/30,13,9842295,23100
US,7/1/21,1023613,26462,,,218,,972396.8575147007,,,New Jersey,34,84000034,USA,2021/07/01,5,9899849,57554
US,7/2/21,1023923,26467,,,310,,972691.3467658431,,,New Jersey,34,84000034,USA,2021/07/02,5,9981160,81311
US,6/4/21,203472,4280,,,142,,265324.43146254955,,,New Mexico,35,84000035,USA,2021/06/04,7,2167318,7092
US,6/7/21,203686,4286,,,214,,265603.4842478615,,,New Mexico,35,84000035,USA,2021/06/07,6,2183505,193201
US,6/8/21,203747,4287,,,61,,265683.02733152517,,,New Mexico,35,84000035,USA,2021/06/08,1,2189470,5965
US,6/9/21,203823,4292,,,76,,265782.13018986024,,,New Mexico,35,84000035,USA,2021/06/09,5,2190127,657
US,6/10/21,203919,4295,,,96,,265907.3127477571,,,New Mexico,35,84000035,USA,2021/06/10,3,2196837,6710
US,6/11/21,204044,4297,,,125,,266070.3108700188,,,New Mexico,35,84000035,USA,2021/06/11,2,2203536,6699
US,6/14/21,204271,4302,,,227,,266366.3154600459,,,New Mexico,35,84000035,USA,2021/06/14,5,2227784,4613
US,6/15/21,204392,4302,,,121,,266524.0976423952,,,New Mexico,35,84000035,USA,2021/06/15,0,2237744,9960
US,6/16/21,204472,4305,,,80,,266628.4164406426,,,New Mexico,35,84000035,USA,2021/06/16,3,2252892,15148
US,6/17/21,204577,4310,,,105,,266765.3348633424,,,New Mexico,35,84000035,USA,2021/06/17,5,2262337,9445
US,6/18/21,204698,4316,,,121,,266923.11704569164,,,New Mexico,35,84000035,USA,2021/06/18,6,2272676,10339
US,6/21/21,204961,4326,,,263,,267266.0650949301,,,New Mexico,35,84000035,USA,2021/06/21,10,2296027,3851
US,6/22/21,205058,4330,,,97,,267392.5516378051,,,New Mexico,35,84000035,USA,2021/06/22,4,2297419,1392
US,6/23/21,205134,4332,,,76,,267491.6544961402,,,New Mexico,35,84000035,USA,2021/06/23,2,2300113,2694
US,6/24/21,205215,4334,,,81,,267597.27727936575,,,New Mexico,35,84000035,USA,2021/06/24,2,2310853,10740
US,6/25/21,205290,4335,,,75,,267695.0761527227,,,New Mexico,35,84000035,USA,2021/06/25,1,2325467,14614
US,6/28/21,205438,4336,,,148,,267888.0659294805,,,New Mexico,35,84000035,USA,2021/06/28,1,2339714,2345
US,6/29/21,205484,4338,,,46,,267948.04923847277,,,New Mexico,35,84000035,USA,2021/06/29,2,2340653,939
US,6/30/21,205542,4340,,,58,,268023.68036720215,,,New Mexico,35,84000035,USA,2021/06/30,2,2380294,39641
US,7/1/21,205629,4343,,,87,,268137.12706029625,,,New Mexico,35,84000035,USA,2021/07/01,3,2384423,4129
US,7/2/21,205715,4344,,,86,,268249.2697684123,,,New Mexico,35,84000035,USA,2021/07/02,1,2391357,6934
US,6/4/21,2104539,53416,,,771,,8447553.486131739,,,New York,36,84000036,USA,2021/06/04,59,19876849,76152
US,6/5/21,2105375,53429,,,836,,8450909.163890338,,,New York,36,84000036,USA,2021/06/05,13,19968418,91569
US,6/6/21,2105882,53462,,,507,,8452944.245975997,,,New York,36,84000036,USA,2021/06/06,33,20014885,46467
US,6/7/21,2106399,53472,,,517,,8455019.467747763,,,New York,36,84000036,USA,2021/06/07,10,20148417,133532
US,6/8/21,2106852,53483,,,453,,8456837.79552844,,,New York,36,84000036,USA,2021/06/08,11,20230340,81923
US,6/9/21,2107289,53492,,,437,,8458591.899811344,,,New York,36,84000036,USA,2021/06/09,9,20311072,80732
US,6/10/21,2107831,53505,,,542,,8460767.470798379,,,New York,36,84000036,USA,2021/06/10,13,20312650,1578
US,6/11/21,2108510,53522,,,679,,8463492.955485089,,,New York,36,84000036,USA,2021/06/11,17,20433667,121017
US,6/12/21,2108950,53539,,,440,,8465259.101673825,,,New York,36,84000036,USA,2021/06/12,17,20523679,90012
US,6/13/21,2109313,53549,,,363,,8466716.172279533,,,New York,36,84000036,USA,2021/06/13,10,20622493,98814
US,6/14/21,2109677,53558,,,364,,8468177.25685385,,,New York,36,84000036,USA,2021/06/14,9,20713525,91032
US,6/15/21,2110004,53574,,,327,,8469489.824589571,,,New York,36,84000036,USA,2021/06/15,16,20784559,71034
US,6/16/21,2110310,53576,,,306,,8470718.098984467,,,New York,36,84000036,USA,2021/06/16,2,20912179,127620
US,6/17/21,2110756,53589,,,446,,8472508.328984868,,,New York,36,84000036,USA,2021/06/17,13,21009772,97593
US,6/18/21,2111162,53597,,,406,,8474138.000240838,,,New York,36,84000036,USA,2021/06/18,8,21067193,57421
US,6/19/21,2111556,53604,,,394,,8475719.50387348,,,New York,36,84000036,USA,2021/06/19,7,21151658,84465
US,6/20/21,2111845,53606,,,289,,8476879.54080199,,,New York,36,84000036,USA,2021/06/20,2,21211927,60269
US,6/21/21,2112129,53614,,,284,,8478019.50788745,,,New York,36,84000036,USA,2021/06/21,8,21268599,56672
US,6/22/21,2112388,53632,,,259,,8479059.125757637,,,New York,36,84000036,USA,2021/06/22,18,21301120,32521
US,6/23/21,2112649,53639,,,261,,8480106.771565046,,,New York,36,84000036,USA,2021/06/23,7,21347133,46013
US,6/24/21,2113046,53635,,,397,,8481700.31710352,,,New York,36,84000036,USA,2021/06/24,,21412026,64893
US,6/25/21,2113398,53644,,,352,,8483113.23405451,,,New York,36,84000036,USA,2021/06/25,9,21463780,51754
US,6/26/21,2113742,53649,,,344,,8484494.039256614,,,New York,36,84000036,USA,2021/06/26,5,21537500,73720
US,6/27/21,2114123,53664,,,381,,8486023.361297315,,,New York,36,84000036,USA,2021/06/27,15,21684298,146798
US,6/28/21,2114434,53672,,,311,,8487271.705535263,,,New York,36,84000036,USA,2021/06/28,8,21697307,13009
US,6/29/21,2114686,53676,,,252,,8488283.225625176,,,New York,36,84000036,USA,2021/06/29,4,21748390,51083
US,6/30/21,2114986,53679,,,300,,8489487.416208405,,,New York,36,84000036,USA,2021/06/30,3,21790497,42107
US,7/1/21,2115377,53690,,,391,,8491056.877935214,,,New York,36,84000036,USA,2021/07/01,11,21851024,60527
US,7/2/21,2115880,53692,,,503,,8493075.90414643,,,New York,36,84000036,USA,2021/07/02,2,21874939,23915
US,6/4/21,1004669,13151,,,680,,5560180.419503016,,,North Carolina,37,84000037,USA,2021/06/04,21,8365719,19955
US,6/7/21,1005966,13199,,,1297,,5567358.459239582,,,North Carolina,37,84000037,USA,2021/06/07,48,8435733,70014
US,6/8/21,1006265,13212,,,299,,5569013.227073994,,,North Carolina,37,84000037,USA,2021/06/08,13,8457163,21430
US,6/9/21,1006809,13230,,,544,,5572023.90835132,,,North Carolina,37,84000037,USA,2021/06/09,18,8481743,24580
US,6/10/21,1007273,13246,,,464,,5574591.84238198,,,North Carolina,37,84000037,USA,2021/06/10,16,8510205,28462
US,6/11/21,1007698,13265,,,425,,5576943.937129891,,,North Carolina,37,84000037,USA,2021/06/11,19,8510205,0
US,6/14/21,1008926,13292,,,1228,,5583740.107366207,,,North Carolina,37,84000037,USA,2021/06/14,27,8584859,49600
US,6/15/21,1009198,13296,,,272,,5585245.448004871,,,North Carolina,37,84000037,USA,2021/06/15,4,8612334,27475
US,6/16/21,1009531,13314,,,333,,5587088.383419116,,,North Carolina,37,84000037,USA,2021/06/16,18,8630245,17911
US,6/17/21,1009893,13320,,,362,,5589091.814710277,,,North Carolina,37,84000037,USA,2021/06/17,6,8647235,16990
US,6/18/21,1010113,13340,,,220,,5590309.369638608,,,North Carolina,37,84000037,USA,2021/06/18,20,8666212,18977
US,6/21/21,1010889,13368,,,776,,5594604.017931264,,,North Carolina,37,84000037,USA,2021/06/21,28,8739949,73737
US,6/22/21,1011100,13382,,,211,,5595771.763794344,,,North Carolina,37,84000037,USA,2021/06/22,14,8750374,10425
US,6/23/21,1011561,13393,,,461,,5598323.094803254,,,North Carolina,37,84000037,USA,2021/06/23,11,8769445,19071
US,6/24/21,1011955,13408,,,394,,5600503.624993082,,,North Carolina,37,84000037,USA,2021/06/24,15,8794757,25312
US,6/25/21,1012343,13412,,,388,,5602650.94913941,,,North Carolina,37,84000037,USA,2021/06/25,4,8812027,17270
US,6/28/21,1013207,13420,,,864,,5607432.619403398,,,North Carolina,37,84000037,USA,2021/06/28,8,8852641,40614
US,6/29/21,1013481,13424,,,274,,5608949.028723228,,,North Carolina,37,84000037,USA,2021/06/29,4,8866923,14282
US,6/30/21,1013689,13437,,,208,,5610100.1715645585,,,North Carolina,37,84000037,USA,2021/06/30,13,9264654,397731
US,7/1/21,1013985,13434,,,296,,5611738.33637722,,,North Carolina,37,84000037,USA,2021/07/01,,9285070,20416
US,7/2/21,1014359,13434,,,374,,5613808.179755382,,,North Carolina,37,84000037,USA,2021/07/02,0,9310262,25192
US,6/4/21,110151,1546,,,53,,293040.5171725771,,,North Dakota,38,84000038,USA,2021/06/04,0,617621,1421
US,6/5/21,110178,1547,,,27,,293112.34669717203,,,North Dakota,38,84000038,USA,2021/06/05,1,617712,91
US,6/6/21,110199,1547,,,21,,293168.21410519036,,,North Dakota,38,84000038,USA,2021/06/06,0,619359,1647
US,6/7/21,110215,1547,,,16,,293210.77974939474,,,North Dakota,38,84000038,USA,2021/06/07,0,621050,1691
US,6/8/21,110254,1547,,,39,,293314.53350714303,,,North Dakota,38,84000038,USA,2021/06/08,0,621080,30
US,6/9/21,110298,1548,,,44,,293431.5890287052,,,North Dakota,38,84000038,USA,2021/06/09,1,621954,874
US,6/10/21,110351,1548,,,53,,293572.58772513235,,,North Dakota,38,84000038,USA,2021/06/10,0,621981,27
US,6/11/21,110386,1551,,,35,,293665.70007182955,,,North Dakota,38,84000038,USA,2021/06/11,3,623884,1903
US,6/12/21,110426,1551,,,40,,293772.11418234056,,,North Dakota,38,84000038,USA,2021/06/12,0,625615,1731
US,6/13/21,110432,1551,,,6,,293788.07629891724,,,North Dakota,38,84000038,USA,2021/06/13,0,627177,1562
US,6/14/21,110440,1551,,,8,,293809.3591210194,,,North Dakota,38,84000038,USA,2021/06/14,0,628655,1478
US,6/15/21,110473,1552,,,33,,293897.15076219104,,,North Dakota,38,84000038,USA,2021/06/15,1,629001,346
US,6/16/21,110492,1553,,,19,,293947.6974646838,,,North Dakota,38,84000038,USA,2021/06/16,1,629653,652
US,6/17/21,110520,1554,,,28,,294022.1873420416,,,North Dakota,38,84000038,USA,2021/06/17,1,631234,1581
US,6/18/21,110544,1554,,,24,,294086.0358083482,,,North Dakota,38,84000038,USA,2021/06/18,0,632342,1108
US,6/19/21,110559,1554,,,15,,294125.9410997898,,,North Dakota,38,84000038,USA,2021/06/19,0,633888,1546
US,6/20/21,110567,1554,,,8,,294147.22392189206,,,North Dakota,38,84000038,USA,2021/06/20,0,634945,1057
US,6/21/21,110571,1554,,,4,,294157.86533294315,,,North Dakota,38,84000038,USA,2021/06/21,0,635388,443
US,6/22/21,110598,1557,,,27,,294229.6948575381,,,North Dakota,38,84000038,USA,2021/06/22,3,635417,29
US,6/23/21,110614,1557,,,16,,294272.26050174254,,,North Dakota,38,84000038,USA,2021/06/23,0,636040,623
US,6/24/21,110627,1558,,,13,,294306.8450876586,,,North Dakota,38,84000038,USA,2021/06/24,1,637216,1176
US,6/25/21,110644,1558,,,17,,294352.07108462584,,,North Dakota,38,84000038,USA,2021/06/25,0,638426,1210
US,6/26/21,110657,1559,,,13,,294386.6556705419,,,North Dakota,38,84000038,USA,2021/06/26,1,639763,1337
US,6/27/21,110663,1559,,,6,,294402.6177871186,,,North Dakota,38,84000038,USA,2021/06/27,0,640781,1018
US,6/28/21,110666,1559,,,3,,294410.5988454069,,,North Dakota,38,84000038,USA,2021/06/28,0,641078,297
US,6/29/21,110680,1559,,,14,,294447.84378408577,,,North Dakota,38,84000038,USA,2021/06/29,0,641125,47
US,6/30/21,110707,1559,,,27,,294519.6733086807,,,North Dakota,38,84000038,USA,2021/06/30,0,641906,781
US,7/1/21,110718,1559,,,11,,294548.93718907126,,,North Dakota,38,84000038,USA,2021/07/01,0,643108,1202
US,7/2/21,110729,1559,,,11,,294578.2010694618,,,North Dakota,38,84000038,USA,2021/07/02,0,644215,1107
US,6/4/21,183,2,,,0,,331.85840707964604,,,Northern Mariana Islands,69,580,MNP,2021/06/04,0,49258,210
US,7/2/21,183,2,,,0,,331.85840707964604,,,Northern Mariana Islands,69,580,MNP,2021/07/02,0,55616,0
US,6/4/21,1104001,20240,,,621,,5070737.644681242,,,Ohio,39,84000039,USA,2021/06/04,10,10069484,39040
US,6/5/21,1104380,20248,,,379,,5072478.412640088,,,Ohio,39,84000039,USA,2021/06/05,8,10113095,43611
US,6/6/21,1104648,20251,,,268,,5073709.351460592,,,Ohio,39,84000039,USA,2021/06/06,3,10143879,30784
US,6/7/21,1104903,20258,,,255,,5074880.58056219,,,Ohio,39,84000039,USA,2021/06/07,7,10164235,20356
US,6/8/21,1105329,20262,,,426,,5076837.222120155,,,Ohio,39,84000039,USA,2021/06/08,4,10197789,33554
US,6/9/21,1105720,20272,,,391,,5078633.106742606,,,Ohio,39,84000039,USA,2021/06/09,10,10231762,33973
US,6/10/21,1106064,20275,,,344,,5080213.117765938,,,Ohio,39,84000039,USA,2021/06/10,3,10272557,40795
US,6/11/21,1106411,20280,,,347,,5081806.907955172,,,Ohio,39,84000039,USA,2021/06/11,5,10304696,32139
US,6/12/21,1106796,20286,,,385,,5083575.23424582,,,Ohio,39,84000039,USA,2021/06/12,6,10341408,36712
US,6/13/21,1107047,20286,,,251,,5084728.0911262175,,,Ohio,39,84000039,USA,2021/06/13,0,10364109,22701
US,6/14/21,1107225,20290,,,178,,5085545.654969686,,,Ohio,39,84000039,USA,2021/06/14,4,10375485,11376
US,6/15/21,1107521,20294,,,296,,5086905.1993386,,,Ohio,39,84000039,USA,2021/06/15,4,10407993,32508
US,6/16/21,1107902,20297,,,381,,5088655.153408047,,,Ohio,39,84000039,USA,2021/06/16,3,10454852,46859
US,6/17/21,1108146,20300,,,244,,5089775.858901341,,,Ohio,39,84000039,USA,2021/06/17,3,10503605,48753
US,6/18/21,1108528,20301,,,382,,5091530.406026089,,,Ohio,39,84000039,USA,2021/06/18,1,10518374,14769
US,6/19/21,1108736,20304,,,208,,5092485.761528568,,,Ohio,39,84000039,USA,2021/06/19,3,10541567,23193
US,6/20/21,1108902,20309,,,166,,5093248.2087084325,,,Ohio,39,84000039,USA,2021/06/20,5,10561413,19846
US,6/21/21,1109025,20309,,,123,,5093813.154510381,,,Ohio,39,84000039,USA,2021/06/21,0,10572312,10899
US,6/22/21,1109374,20309,,,349,,5095416.130810215,,,Ohio,39,84000039,USA,2021/06/22,0,10588577,16265
US,6/23/21,1109697,20309,,,323,,5096899.68767224,,,Ohio,39,84000039,USA,2021/06/23,0,10609177,20600
US,6/24/21,1110000,20309,,,303,,5098291.383428256,,,Ohio,39,84000039,USA,2021/06/24,0,10632313,23136
US,6/25/21,1110292,20309,,,292,,5099632.555575969,,,Ohio,39,84000039,USA,2021/06/25,0,10651023,18710
US,6/26/21,1110546,20309,,,254,,5100799.1916222675,,,Ohio,39,84000039,USA,2021/06/26,0,10676930,25907
US,6/27/21,1110700,20309,,,154,,5101506.522138527,,,Ohio,39,84000039,USA,2021/06/27,0,10716432,39502
US,6/28/21,1110847,20309,,,147,,5102181.701267683,,,Ohio,39,84000039,USA,2021/06/28,0,10724061,7629
US,6/29/21,1111124,20309,,,277,,5103453.97758589,,,Ohio,39,84000039,USA,2021/06/29,0,10736254,12193
US,6/30/21,1111324,20309,,,200,,5104372.588645968,,,Ohio,39,84000039,USA,2021/06/30,0,10754043,17789
US,7/1/21,1111903,20309,,,579,,5107031.967664891,,,Ohio,39,84000039,USA,2021/07/01,0,10774986,20943
US,7/2/21,1112088,20344,,,185,,5107881.682895462,,,Ohio,39,84000039,USA,2021/07/02,35,10790591,15605
US,6/4/21,453552,7316,,,152,,2244084.9042600566,,,Oklahoma,40,84000040,USA,2021/06/04,0,2975700,7001
US,6/7/21,453890,7316,,,338,,2245757.260897531,,,Oklahoma,40,84000040,USA,2021/06/07,0,2995538,9192
US,6/8/21,453970,7316,,,80,,2246153.084953738,,,Oklahoma,40,84000040,USA,2021/06/08,0,2998090,2552
US,6/9/21,454094,7325,,,124,,2246766.612240859,,,Oklahoma,40,84000040,USA,2021/06/09,9,3004221,6131
US,6/10/21,454216,7325,,,122,,2247370.2439265745,,,Oklahoma,40,84000040,USA,2021/06/10,0,3011989,7768
US,6/11/21,454394,7325,,,178,,2248250.952451635,,,Oklahoma,40,84000040,USA,2021/06/11,0,3012261,272
US,6/14/21,454884,7325,,,490,,2250675.3747959035,,,Oklahoma,40,84000040,USA,2021/06/14,0,3052042,21691
US,6/15/21,454929,7325,,,45,,2250898.0258275196,,,Oklahoma,40,84000040,USA,2021/06/15,0,3126894,74852
US,6/16/21,455145,7354,,,216,,2251966.7507792786,,,Oklahoma,40,84000040,USA,2021/06/16,29,3126963,69
US,6/17/21,455354,7354,,,209,,2253000.8411261193,,,Oklahoma,40,84000040,USA,2021/06/17,0,3152269,25306
US,6/18/21,455535,7354,,,181,,2253896.3930532876,,,Oklahoma,40,84000040,USA,2021/06/18,0,3177292,25023
US,6/21/21,455986,7354,,,451,,2256127.8511701548,,,Oklahoma,40,84000040,USA,2021/06/21,0,3197986,5084
US,6/22/21,456148,7354,,,162,,2256929.394883974,,,Oklahoma,40,84000040,USA,2021/06/22,0,3200525,2539
US,6/23/21,456413,7384,,,265,,2258240.5620701597,,,Oklahoma,40,84000040,USA,2021/06/23,30,3200525,0
US,6/24/21,456686,7384,,,273,,2259591.311661966,,,Oklahoma,40,84000040,USA,2021/06/24,0,3200525,0
US,6/25/21,456910,7384,,,224,,2260699.619019346,,,Oklahoma,40,84000040,USA,2021/06/25,0,3230556,30031
US,6/28/21,457490,7384,,,580,,2263569.343426847,,,Oklahoma,40,84000040,USA,2021/06/28,0,3258992,10137
US,6/29/21,457575,7384,,,85,,2263989.9064865666,,,Oklahoma,40,84000040,USA,2021/06/29,0,3261550,2558
US,6/30/21,457851,7388,,,276,,2265355.499480481,,,Oklahoma,40,84000040,USA,2021/06/30,4,3267350,5800
US,7/1/21,458180,7388,,,329,,2266983.3259116323,,,Oklahoma,40,84000040,USA,2021/07/01,0,3274030,6680
US,7/2/21,458483,7388,,,303,,2268482.5095245163,,,Oklahoma,40,84000040,USA,2021/07/02,0,3280969,6939
US,6/4/21,202680,2686,,,433,,189243.69747899158,,,Oregon,41,84000041,USA,2021/06/04,3,4123145,20562
US,6/5/21,202995,2691,,,315,,189537.8151260504,,,Oregon,41,84000041,USA,2021/06/05,5,4148510,25365
US,6/6/21,203252,2694,,,257,,189777.77777777778,,,Oregon,41,84000041,USA,2021/06/06,3,4176332,27822
US,6/7/21,203374,2694,,,122,,189891.69000933706,,,Oregon,41,84000041,USA,2021/06/07,0,4176432,100
US,6/8/21,203671,2700,,,297,,190169.00093370682,,,Oregon,41,84000041,USA,2021/06/08,6,4214370,37938
US,6/9/21,203933,2716,,,262,,190413.63211951448,,,Oregon,41,84000041,USA,2021/06/09,16,4231860,17490
US,6/10/21,204291,2726,,,358,,190747.89915966385,,,Oregon,41,84000041,USA,2021/06/10,10,4232089,229
US,6/11/21,204587,2726,,,296,,191024.27637721755,,,Oregon,41,84000041,USA,2021/06/11,0,4254045,21956
US,6/12/21,204866,2729,,,279,,191284.78057889824,,,Oregon,41,84000041,USA,2021/06/12,3,4281314,27269
US,6/13/21,205030,2730,,,164,,191437.90849673204,,,Oregon,41,84000041,USA,2021/06/13,1,4305626,24312
US,6/14/21,205154,2730,,,124,,191553.68814192343,,,Oregon,41,84000041,USA,2021/06/14,0,4322927,17301
US,6/15/21,205459,2737,,,305,,191838.46872082166,,,Oregon,41,84000041,USA,2021/06/15,7,4349829,26902
US,6/16/21,205698,2744,,,239,,192061.62464985994,,,Oregon,41,84000041,USA,2021/06/16,7,4371768,21939
US,6/17/21,205988,2745,,,290,,192332.39962651726,,,Oregon,41,84000041,USA,2021/06/17,1,4389478,17710
US,6/18/21,206299,2750,,,311,,192622.78244631184,,,Oregon,41,84000041,USA,2021/06/18,5,4405722,16244
US,6/19/21,206581,2753,,,282,,192886.08776844072,,,Oregon,41,84000041,USA,2021/06/19,3,4418885,13163
US,6/20/21,206777,2754,,,196,,193069.09430438842,,,Oregon,41,84000041,USA,2021/06/20,1,4432588,13703
US,6/21/21,206851,2756,,,74,,193138.18860877684,,,Oregon,41,84000041,USA,2021/06/21,2,4442610,10022
US,6/22/21,207106,2757,,,255,,193376.28384687207,,,Oregon,41,84000041,USA,2021/06/22,1,4445687,3077
US,6/23/21,207333,2759,,,227,,193588.23529411765,,,Oregon,41,84000041,USA,2021/06/23,2,4455064,9377
US,6/24/21,207558,2760,,,225,,193798.3193277311,,,Oregon,41,84000041,USA,2021/06/24,1,4463557,8493
US,6/25/21,207787,2761,,,229,,194012.13818860878,,,Oregon,41,84000041,USA,2021/06/25,1,4474809,11252
US,6/26/21,207999,2763,,,212,,194210.08403361344,,,Oregon,41,84000041,USA,2021/06/26,2,4491080,16271
US,6/27/21,208137,2763,,,138,,194338.9355742297,,,Oregon,41,84000041,USA,2021/06/27,0,4503861,12781
US,6/28/21,208222,2763,,,85,,194418.30065359478,,,Oregon,41,84000041,USA,2021/06/28,0,4509377,5516
US,6/29/21,208446,2770,,,224,,194627.45098039217,,,Oregon,41,84000041,USA,2021/06/29,7,4509379,2
US,6/30/21,208640,2774,,,194,,194808.59010270776,,,Oregon,41,84000041,USA,2021/06/30,4,4517691,8312
US,7/1/21,208836,2778,,,196,,194991.59663865546,,,Oregon,41,84000041,USA,2021/07/01,4,4576887,59196
US,7/2/21,209037,2781,,,201,,195179.27170868346,,,Oregon,41,84000041,USA,2021/07/02,3,4585492,8605
US,6/4/21,1209492,27325,,,613,,269339.8180190532,,,Pennsylvania,42,84000042,USA,2021/06/04,30,12805618,128175
US,6/5/21,1209894,27343,,,402,,269429.33874911483,,,Pennsylvania,42,84000042,USA,2021/06/05,18,12874233,68615
US,6/6/21,1210224,27348,,,330,,269502.8259155833,,,Pennsylvania,42,84000042,USA,2021/06/06,5,12875076,843
US,6/7/21,1210691,27360,,,467,,269606.82139055536,,,Pennsylvania,42,84000042,USA,2021/06/07,12,12922194,47118
US,6/8/21,1211114,27395,,,423,,269701.0185766649,,,Pennsylvania,42,84000042,USA,2021/06/08,35,13007203,85009
US,6/9/21,1211487,27417,,,373,,269784.08134361263,,,Pennsylvania,42,84000042,USA,2021/06/09,22,13034223,27020
US,6/10/21,1212155,27438,,,668,,269932.8371836155,,,Pennsylvania,42,84000042,USA,2021/06/10,21,13084043,49820
US,6/11/21,1212529,27457,,,374,,270016.1226389464,,,Pennsylvania,42,84000042,USA,2021/06/11,19,13135306,51263
US,6/12/21,1212831,27465,,,302,,270083.37453068426,,,Pennsylvania,42,84000042,USA,2021/06/12,8,13212289,76983
US,6/13/21,1212999,27479,,,168,,270120.7861790682,,,Pennsylvania,42,84000042,USA,2021/06/13,14,13267983,55694
US,6/14/21,1213350,27490,,,351,,270198.94980158465,,,Pennsylvania,42,84000042,USA,2021/06/14,11,13318101,50118
US,6/15/21,1213772,27514,,,422,,270292.924299311,,,Pennsylvania,42,84000042,USA,2021/06/15,24,13365625,47524
US,6/16/21,1214051,27531,,,279,,270355.05435823434,,,Pennsylvania,42,84000042,USA,2021/06/16,17,13366581,956
US,6/17/21,1214395,27546,,,344,,270431.65916206816,,,Pennsylvania,42,84000042,USA,2021/06/17,15,13479483,112902
US,6/18/21,1214625,27559,,,230,,270482.87749021285,,,Pennsylvania,42,84000042,USA,2021/06/18,13,13535439,55956
US,6/19/21,1214795,27559,,,170,,270520.7345153633,,,Pennsylvania,42,84000042,USA,2021/06/19,0,13571908,36469
US,6/20/21,1214895,27566,,,100,,270543.00335368706,,,Pennsylvania,42,84000042,USA,2021/06/20,7,13609746,37838
US,6/21/21,1215116,27568,,,221,,270592.2174863826,,,Pennsylvania,42,84000042,USA,2021/06/21,2,13631788,22042
US,6/22/21,1215239,27604,,,123,,270619.6081575209,,,Pennsylvania,42,84000042,USA,2021/06/22,36,13651077,19289
US,6/23/21,1215374,27612,,,135,,270649.671089258,,,Pennsylvania,42,84000042,USA,2021/06/23,8,13679110,28033
US,6/24/21,1215735,27627,,,361,,270730.0615956068,,,Pennsylvania,42,84000042,USA,2021/06/24,15,13715484,36374
US,6/25/21,1215889,27636,,,154,,270764.35560662544,,,Pennsylvania,42,84000042,USA,2021/06/25,9,13759384,43900
US,6/26/21,1216037,27642,,,148,,270797.3134873446,,,Pennsylvania,42,84000042,USA,2021/06/26,6,13794966,35582
US,6/27/21,1216133,27651,,,96,,270818.69157213543,,,Pennsylvania,42,84000042,USA,2021/06/27,9,13815858,20892
