Country_Region,Last_Update,Confirmed,Deaths,Recovered,Active,Delta_Confirmed,Delta_Recovered,Incident_Rate,People_Tested,People_Hospitalized,Province_State,FIPS,UID,iso3,Report_Date_String
Afghanistan,1/22/20,0,0,,,0,,0.0,,,,,4,AFG,2020/01/22
Afghanistan,1/23/20,0,0,,,0,,0.0,,,,,4,AFG,2020/01/23
Afghanistan,1/24/20,0,0,,,0,,0.0,,,,,4,AFG,2020/01/24
Afghanistan,1/25/20,0,0,,,0,,0.0,,,,,4,AFG,2020/01/25
Afghanistan,1/26/20,0,0,,,0,,0.0,,,,,4,AFG,2020/01/26
Afghanistan,1/27/20,0,0,,,0,,0.0,,,,,4,AFG,2020/01/27
Afghanistan,1/28/20,0,0,,,0,,0.0,,,,,4,AFG,2020/01/28
Afghanistan,1/29/20,0,0,,,0,,0.0,,,,,4,AFG,2020/01/29
Afghanistan,1/30/20,0,0,,,0,,0.0,,,,,4,AFG,2020/01/30
Afghanistan,1/31/20,0,0,,,0,,0.0,,,,,4,AFG,2020/01/31
Afghanistan,2/1/20,0,0,,,0,,0.0,,,,,4,AFG,2020/02/01
Afghanistan,2/2/20,0,0,,,0,,0.0,,,,,4,AFG,2020/02/02
Afghanistan,2/3/20,0,0,,,0,,0.0,,,,,4,AFG,2020/02/03
Afghanistan,2/4/20,0,0,,,0,,0.0,,,,,4,AFG,2020/02/04
Afghanistan,2/5/20,0,0,,,0,,0.0,,,,,4,AFG,2020/02/05
Afghanistan,2/6/20,0,0,,,0,,0.0,,,,,4,AFG,2020/02/06
Afghanistan,2/7/20,0,0,,,0,,0.0,,,,,4,AFG,2020/02/07
Afghanistan,2/8/20,0,0,,,0,,0.0,,,,,4,AFG,2020/02/08
Afghanistan,2/9/20,0,0,,,0,,0.0,,,,,4,AFG,2020/02/09
Afghanistan,2/10/20,0,0,,,0,,0.0,,,,,4,AFG,2020/02/10
Afghanistan,2/11/20,0,0,,,0,,0.0,,,,,4,AFG,2020/02/11
Afghanistan,2/12/20,0,0,,,0,,0.0,,,,,4,AFG,2020/02/12
Afghanistan,2/13/20,0,0,,,0,,0.0,,,,,4,AFG,2020/02/13
Afghanistan,2/14/20,0,0,,,0,,0.0,,,,,4,AFG,2020/02/14
Afghanistan,2/15/20,0,0,,,0,,0.0,,,,,4,AFG,2020/02/15
Afghanistan,2/16/20,0,0,,,0,,0.0,,,,,4,AFG,2020/02/16
Afghanistan,2/17/20,0,0,,,0,,0.0,,,,,4,AFG,2020/02/17
Afghanistan,2/18/20,0,0,,,0,,0.0,,,,,4,AFG,2020/02/18
Afghanistan,2/19/20,0,0,,,0,,0.0,,,,,4,AFG,2020/02/19
Afghanistan,2/20/20,0,0,,,0,,0.0,,,,,4,AFG,2020/02/20
Afghanistan,2/21/20,0,0,,,0,,0.0,,,,,4,AFG,2020/02/21
Afghanistan,2/22/20,0,0,,,0,,0.0,,,,,4,AFG,2020/02/22
Afghanistan,2/23/20,0,0,,,0,,0.0,,,,,4,AFG,2020/02/23
Afghanistan,2/24/20,1,0,,,1,,0.0025688225449936332,,,,,4,AFG,2020/02/24
Afghanistan,2/25/20,1,0,,,0,,0.0025688225449936332,,,,,4,AFG,2020/02/25
Afghanistan,2/26/20,1,0,,,0,,0.0025688225449936332,,,,,4,AFG,2020/02/26
Afghanistan,2/27/20,1,0,,,0,,0.0025688225449936332,,,,,4,AFG,2020/02/27
Afghanistan,2/28/20,1,0,,,0,,0.0025688225449936332,,,,,4,AFG,2020/02/28
Afghanistan,2/29/20,1,0,,,0,,0.0025688225449936332,,,,,4,AFG,2020/02/29
Afghanistan,3/1/20,1,0,,,0,,0.0025688225449936332,,,,,4,AFG,2020/03/01
Afghanistan,3/2/20,1,0,,,0,,0.0025688225449936332,,,,,4,AFG,2020/03/02
Afghanistan,3/3/20,1,0,,,0,,0.0025688225449936332,,,,,4,AFG,2020/03/03
Afghanistan,3/4/20,1,0,,,0,,0.0025688225449936332,,,,,4,AFG,2020/03/04
Afghanistan,3/5/20,1,0,,,0,,0.0025688225449936332,,,,,4,AFG,2020/03/05
Afghanistan,3/6/20,1,0,,,0,,0.0025688225449936332,,,,,4,AFG,2020/03/06
Afghanistan,3/7/20,1,0,,,0,,0.0025688225449936332,,,,,4,AFG,2020/03/07
Afghanistan,3/8/20,4,0,,,3,,0.010275290179974533,,,,,4,AFG,2020/03/08
Afghanistan,3/9/20,4,0,,,0,,0.010275290179974533,,,,,4,AFG,2020/03/09
Afghanistan,3/10/20,5,0,,,1,,0.012844112724968167,,,,,4,AFG,2020/03/10
Afghanistan,3/11/20,7,0,,,2,,0.017981757814955434,,,,,4,AFG,2020/03/11
Afghanistan,3/12/20,7,0,,,0,,0.017981757814955434,,,,,4,AFG,2020/03/12
Afghanistan,3/13/20,7,0,,,0,,0.017981757814955434,,,,,4,AFG,2020/03/13
Afghanistan,3/14/20,11,0,,,4,,0.028257047994929965,,,,,4,AFG,2020/03/14
Afghanistan,3/15/20,16,0,,,5,,0.04110116071989813,,,,,4,AFG,2020/03/15
Afghanistan,3/16/20,21,0,,,5,,0.0539452734448663,,,,,4,AFG,2020/03/16
Afghanistan,3/17/20,22,0,,,1,,0.05651409598985993,,,,,4,AFG,2020/03/17
Afghanistan,3/18/20,22,0,,,0,,0.05651409598985993,,,,,4,AFG,2020/03/18
Afghanistan,3/19/20,22,0,,,0,,0.05651409598985993,,,,,4,AFG,2020/03/19
Afghanistan,3/20/20,24,0,,,2,,0.0616517410798472,,,,,4,AFG,2020/03/20
Afghanistan,3/21/20,24,0,,,0,,0.0616517410798472,,,,,4,AFG,2020/03/21
Afghanistan,3/22/20,40,1,,,16,,0.10275290179974533,,,,,4,AFG,2020/03/22
Afghanistan,3/23/20,40,1,,,0,,0.10275290179974533,,,,,4,AFG,2020/03/23
Afghanistan,3/24/20,74,1,,,34,,0.19009286832952887,,,,,4,AFG,2020/03/24
Afghanistan,3/25/20,84,2,,,10,,0.2157810937794652,,,,,4,AFG,2020/03/25
Afghanistan,3/26/20,94,4,,,10,,0.24146931922940154,,,,,4,AFG,2020/03/26
Afghanistan,3/27/20,110,4,,,16,,0.2825704799492997,,,,,4,AFG,2020/03/27
Afghanistan,3/28/20,110,4,,,0,,0.2825704799492997,,,,,4,AFG,2020/03/28
Afghanistan,3/29/20,120,4,,,10,,0.308258705399236,,,,,4,AFG,2020/03/29
Afghanistan,3/30/20,170,4,,,50,,0.43669983264891765,,,,,4,AFG,2020/03/30
Afghanistan,3/31/20,174,4,,,4,,0.4469751228288922,,,,,4,AFG,2020/03/31
Afghanistan,4/1/20,237,4,,,63,,0.608810943163491,,,,,4,AFG,2020/04/01
Afghanistan,4/2/20,273,6,,,36,,0.7012885547832619,,,,,4,AFG,2020/04/02
Afghanistan,4/3/20,281,6,,,8,,0.721839135143211,,,,,4,AFG,2020/04/03
Afghanistan,4/4/20,299,7,,,18,,0.7680779409530963,,,,,4,AFG,2020/04/04
Afghanistan,4/5/20,349,7,,,50,,0.896519068202778,,,,,4,AFG,2020/04/05
Afghanistan,4/6/20,367,11,,,18,,0.9427578740126634,,,,,4,AFG,2020/04/06
Afghanistan,4/7/20,423,14,,,56,,1.0866119365323068,,,,,4,AFG,2020/04/07
Afghanistan,4/8/20,444,14,,,21,,1.1405572099771732,,,,,4,AFG,2020/04/08
Afghanistan,4/9/20,484,15,,,40,,1.2433101117769185,,,,,4,AFG,2020/04/09
Afghanistan,4/10/20,521,15,,,37,,1.3383565459416829,,,,,4,AFG,2020/04/10
Afghanistan,4/11/20,555,18,,,34,,1.4256965124714664,,,,,4,AFG,2020/04/11
Afghanistan,4/12/20,607,18,,,52,,1.5592752848111353,,,,,4,AFG,2020/04/12
Afghanistan,4/13/20,665,21,,,58,,1.708266992420766,,,,,4,AFG,2020/04/13
Afghanistan,4/14/20,714,23,,,49,,1.8341392971254542,,,,,4,AFG,2020/04/14
Afghanistan,4/15/20,784,25,,,70,,2.0139568752750083,,,,,4,AFG,2020/04/15
Afghanistan,4/16/20,840,30,,,56,,2.157810937794652,,,,,4,AFG,2020/04/16
Afghanistan,4/17/20,906,30,,,66,,2.3273532257642318,,,,,4,AFG,2020/04/17
Afghanistan,4/18/20,933,30,,,27,,2.3967114344790597,,,,,4,AFG,2020/04/18
Afghanistan,4/19/20,996,33,,,63,,2.558547254813659,,,,,4,AFG,2020/04/19
Afghanistan,4/20/20,1026,36,,,30,,2.6356119311634676,,,,,4,AFG,2020/04/20
Afghanistan,4/21/20,1092,36,,,66,,2.8051542191330476,,,,,4,AFG,2020/04/21
Afghanistan,4/22/20,1176,40,,,84,,3.020935312912513,,,,,4,AFG,2020/04/22
Afghanistan,4/23/20,1279,42,,,103,,3.285524035046857,,,,,4,AFG,2020/04/23
Afghanistan,4/24/20,1351,43,,,72,,3.4704792582863986,,,,,4,AFG,2020/04/24
Afghanistan,4/25/20,1463,47,,,112,,3.7581873833256854,,,,,4,AFG,2020/04/25
Afghanistan,4/26/20,1531,50,,,68,,3.9328673163852526,,,,,4,AFG,2020/04/26
Afghanistan,4/27/20,1703,57,,,172,,4.374704794124158,,,,,4,AFG,2020/04/27
Afghanistan,4/28/20,1828,58,,,125,,4.695807612248362,,,,,4,AFG,2020/04/28
Afghanistan,4/29/20,1939,60,,,111,,4.980946914742655,,,,,4,AFG,2020/04/29
Afghanistan,4/30/20,2171,64,,,232,,5.576913745181178,,,,,4,AFG,2020/04/30
Afghanistan,5/1/20,2335,68,,,164,,5.998200642560134,,,,,4,AFG,2020/05/01
Afghanistan,5/2/20,2469,72,,,134,,6.342422863589281,,,,,4,AFG,2020/05/02
Afghanistan,5/3/20,2704,85,,,235,,6.946096161662784,,,,,4,AFG,2020/05/03
Afghanistan,5/4/20,2894,90,,,190,,7.4341724452115745,,,,,4,AFG,2020/05/04
Afghanistan,5/5/20,3224,95,,,330,,8.281883885059473,,,,,4,AFG,2020/05/05
Afghanistan,5/6/20,3392,104,,,168,,8.713446072618405,,,,,4,AFG,2020/05/06
Afghanistan,5/7/20,3563,106,,,171,,9.152714727812315,,,,,4,AFG,2020/05/07
Afghanistan,5/8/20,3778,109,,,215,,9.705011574985946,,,,,4,AFG,2020/05/08
Afghanistan,5/9/20,4033,115,,,255,,10.360061323959323,,,,,4,AFG,2020/05/09
Afghanistan,5/10/20,4402,120,,,369,,11.307956843061973,,,,,4,AFG,2020/05/10
Afghanistan,5/11/20,4687,122,,,285,,12.040071268385159,,,,,4,AFG,2020/05/11
Afghanistan,5/12/20,4963,127,,,276,,12.749066290803402,,,,,4,AFG,2020/05/12
Afghanistan,5/13/20,5226,132,,,263,,13.424666620136728,,,,,4,AFG,2020/05/13
Afghanistan,5/14/20,5639,136,,,413,,14.485590331219099,,,,,4,AFG,2020/05/14
Afghanistan,5/15/20,6053,153,,,414,,15.549082864846463,,,,,4,AFG,2020/05/15
Afghanistan,5/16/20,6402,168,,,349,,16.44560193304924,,,,,4,AFG,2020/05/16
Afghanistan,5/17/20,6664,169,,,262,,17.118633439837573,,,,,4,AFG,2020/05/17
Afghanistan,5/18/20,7072,173,,,408,,18.166713038194974,,,,,4,AFG,2020/05/18
Afghanistan,5/19/20,7653,178,,,581,,19.659198936836276,,,,,4,AFG,2020/05/19
Afghanistan,5/20/20,8145,187,,,492,,20.923059628973142,,,,,4,AFG,2020/05/20
Afghanistan,5/21/20,8676,193,,,531,,22.28710440036476,,,,,4,AFG,2020/05/21
Afghanistan,5/22/20,9216,205,,,540,,23.674268574661326,,,,,4,AFG,2020/05/22
Afghanistan,5/23/20,9998,216,,,782,,25.683087804846345,,,,,4,AFG,2020/05/23
Afghanistan,5/24/20,10582,218,,,584,,27.18328017112263,,,,,4,AFG,2020/05/24
Afghanistan,5/25/20,11173,219,,,591,,28.701454295213864,,,,,4,AFG,2020/05/25
Afghanistan,5/26/20,11831,220,,,658,,30.391739529819677,,,,,4,AFG,2020/05/26
Afghanistan,5/27/20,12456,227,,,625,,31.997253620440695,,,,,4,AFG,2020/05/27
Afghanistan,5/28/20,13036,235,,,580,,33.48717069653701,,,,,4,AFG,2020/05/28
Afghanistan,5/29/20,13659,246,,,623,,35.08754714206804,,,,,4,AFG,2020/05/29
Afghanistan,5/30/20,14525,249,,,866,,37.31214746603252,,,,,4,AFG,2020/05/30
Afghanistan,5/31/20,15205,257,,,680,,39.05894679662819,,,,,4,AFG,2020/05/31
Afghanistan,6/1/20,15750,265,,,545,,40.45895508364973,,,,,4,AFG,2020/06/01
Afghanistan,6/2/20,16509,270,,,759,,42.40869139529989,,,,,4,AFG,2020/06/02
Afghanistan,6/3/20,17267,294,,,758,,44.355858884405066,,,,,4,AFG,2020/06/03
Afghanistan,6/4/20,18054,300,,,787,,46.377522227315055,,,,,4,AFG,2020/06/04
Afghanistan,6/5/20,18969,309,,,915,,48.72799485598423,,,,,4,AFG,2020/06/05
Afghanistan,6/6/20,19551,327,,,582,,50.22304957717053,,,,,4,AFG,2020/06/06
Afghanistan,6/7/20,20342,357,,,791,,52.254988210260485,,,,,4,AFG,2020/06/07
Afghanistan,6/8/20,20917,369,,,575,,53.73206117363183,,,,,4,AFG,2020/06/08
Afghanistan,6/9/20,21459,384,,,542,,55.12436299301838,,,,,4,AFG,2020/06/09
Afghanistan,6/10/20,22142,405,,,683,,56.878868791249026,,,,,4,AFG,2020/06/10
Afghanistan,6/11/20,22890,426,,,748,,58.80034805490427,,,,,4,AFG,2020/06/11
Afghanistan,6/12/20,23546,446,,,656,,60.48549564442009,,,,,4,AFG,2020/06/12
Afghanistan,6/13/20,24102,0,,,556,,61.91376097943655,,,,,4,AFG,2020/06/13
Albania,1/22/20,0,0,,,0,,0.0,,,,,8,ALB,2020/01/22
Albania,1/23/20,0,0,,,0,,0.0,,,,,8,ALB,2020/01/23
Albania,1/24/20,0,0,,,0,,0.0,,,,,8,ALB,2020/01/24
Albania,1/25/20,0,0,,,0,,0.0,,,,,8,ALB,2020/01/25
Albania,1/26/20,0,0,,,0,,0.0,,,,,8,ALB,2020/01/26
Albania,1/27/20,0,0,,,0,,0.0,,,,,8,ALB,2020/01/27
Albania,1/28/20,0,0,,,0,,0.0,,,,,8,ALB,2020/01/28
Albania,1/29/20,0,0,,,0,,0.0,,,,,8,ALB,2020/01/29
Albania,1/30/20,0,0,,,0,,0.0,,,,,8,ALB,2020/01/30
Albania,1/31/20,0,0,,,0,,0.0,,,,,8,ALB,2020/01/31
Albania,2/1/20,0,0,,,0,,0.0,,,,,8,ALB,2020/02/01
Albania,2/2/20,0,0,,,0,,0.0,,,,,8,ALB,2020/02/02
Albania,2/3/20,0,0,,,0,,0.0,,,,,8,ALB,2020/02/03
Albania,2/4/20,0,0,,,0,,0.0,,,,,8,ALB,2020/02/04
Albania,2/5/20,0,0,,,0,,0.0,,,,,8,ALB,2020/02/05
Albania,2/6/20,0,0,,,0,,0.0,,,,,8,ALB,2020/02/06
Albania,2/7/20,0,0,,,0,,0.0,,,,,8,ALB,2020/02/07
Albania,2/8/20,0,0,,,0,,0.0,,,,,8,ALB,2020/02/08
Albania,2/9/20,0,0,,,0,,0.0,,,,,8,ALB,2020/02/09
Albania,2/10/20,0,0,,,0,,0.0,,,,,8,ALB,2020/02/10
Albania,2/11/20,0,0,,,0,,0.0,,,,,8,ALB,2020/02/11
Albania,2/12/20,0,0,,,0,,0.0,,,,,8,ALB,2020/02/12
Albania,2/13/20,0,0,,,0,,0.0,,,,,8,ALB,2020/02/13
Albania,2/14/20,0,0,,,0,,0.0,,,,,8,ALB,2020/02/14
Albania,2/15/20,0,0,,,0,,0.0,,,,,8,ALB,2020/02/15
Albania,2/16/20,0,0,,,0,,0.0,,,,,8,ALB,2020/02/16
Albania,2/17/20,0,0,,,0,,0.0,,,,,8,ALB,2020/02/17
Albania,2/18/20,0,0,,,0,,0.0,,,,,8,ALB,2020/02/18
Albania,2/19/20,0,0,,,0,,0.0,,,,,8,ALB,2020/02/19
Albania,2/20/20,0,0,,,0,,0.0,,,,,8,ALB,2020/02/20
Albania,2/21/20,0,0,,,0,,0.0,,,,,8,ALB,2020/02/21
Albania,2/22/20,0,0,,,0,,0.0,,,,,8,ALB,2020/02/22
Albania,2/23/20,0,0,,,0,,0.0,,,,,8,ALB,2020/02/23
Albania,2/24/20,0,0,,,0,,0.0,,,,,8,ALB,2020/02/24
Albania,2/25/20,0,0,,,0,,0.0,,,,,8,ALB,2020/02/25
Albania,2/26/20,0,0,,,0,,0.0,,,,,8,ALB,2020/02/26
Albania,2/27/20,0,0,,,0,,0.0,,,,,8,ALB,2020/02/27
Albania,2/28/20,0,0,,,0,,0.0,,,,,8,ALB,2020/02/28
Albania,2/29/20,0,0,,,0,,0.0,,,,,8,ALB,2020/02/29
Albania,3/1/20,0,0,,,0,,0.0,,,,,8,ALB,2020/03/01
Albania,3/2/20,0,0,,,0,,0.0,,,,,8,ALB,2020/03/02
Albania,3/3/20,0,0,,,0,,0.0,,,,,8,ALB,2020/03/03
Albania,3/4/20,0,0,,,0,,0.0,,,,,8,ALB,2020/03/04
Albania,3/5/20,0,0,,,0,,0.0,,,,,8,ALB,2020/03/05
Albania,3/6/20,0,0,,,0,,0.0,,,,,8,ALB,2020/03/06
Albania,3/7/20,0,0,,,0,,0.0,,,,,8,ALB,2020/03/07
Albania,3/8/20,0,0,,,0,,0.0,,,,,8,ALB,2020/03/08
Albania,3/9/20,2,0,,,2,,0.06949753283758427,,,,,8,ALB,2020/03/09
Albania,3/10/20,10,1,,,8,,0.3474876641879213,,,,,8,ALB,2020/03/10
Albania,3/11/20,12,1,,,2,,0.41698519702550557,,,,,8,ALB,2020/03/11
Albania,3/12/20,23,1,,,11,,0.799221627632219,,,,,8,ALB,2020/03/12
Albania,3/13/20,33,1,,,10,,1.1467092918201405,,,,,8,ALB,2020/03/13
Albania,3/14/20,38,1,,,5,,1.320453123914101,,,,,8,ALB,2020/03/14
Albania,3/15/20,42,1,,,4,,1.4594481895892695,,,,,8,ALB,2020/03/15
Albania,3/16/20,51,1,,,9,,1.7721870873583987,,,,,8,ALB,2020/03/16
Albania,3/17/20,55,2,,,4,,1.9111821530335673,,,,,8,ALB,2020/03/17
Albania,3/18/20,59,2,,,4,,2.0501772187087357,,,,,8,ALB,2020/03/18
Albania,3/19/20,64,2,,,5,,2.2239210508026965,,,,,8,ALB,2020/03/19
Albania,3/20/20,70,2,,,6,,2.4324136493154493,,,,,8,ALB,2020/03/20
Albania,3/21/20,76,2,,,6,,2.640906247828202,,,,,8,ALB,2020/03/21
Albania,3/22/20,89,4,,,13,,3.0926402112724998,,,,,8,ALB,2020/03/22
Albania,3/23/20,104,5,,,15,,3.613871707554382,,,,,8,ALB,2020/03/23
Albania,3/24/20,123,5,,,19,,4.274098269511432,,,,,8,ALB,2020/03/24
Albania,3/25/20,146,6,,,23,,5.0733198971436515,,,,,8,ALB,2020/03/25
Albania,3/26/20,174,8,,,28,,6.046285356869831,,,,,8,ALB,2020/03/26
Albania,3/27/20,186,10,,,12,,6.463270553895336,,,,,8,ALB,2020/03/27
Albania,3/28/20,197,10,,,11,,6.84550698450205,,,,,8,ALB,2020/03/28
Albania,3/29/20,212,11,,,15,,7.3667384807839325,,,,,8,ALB,2020/03/29
Albania,3/30/20,223,15,,,11,,7.748974911390645,,,,,8,ALB,2020/03/30
Albania,3/31/20,243,15,,,20,,8.443950239766489,,,,,8,ALB,2020/03/31
Albania,4/1/20,259,16,,,16,,8.999930502467162,,,,,8,ALB,2020/04/01
Albania,4/2/20,277,17,,,18,,9.625408298005421,,,,,8,ALB,2020/04/02
Albania,4/3/20,304,20,,,27,,10.563624991312809,,,,,8,ALB,2020/04/03
Albania,4/4/20,333,20,,,29,,11.57133921745778,,,,,8,ALB,2020/04/04
Albania,4/5/20,361,21,,,28,,12.54430467718396,,,,,8,ALB,2020/04/05
Albania,4/6/20,377,22,,,16,,13.100284939884634,,,,,8,ALB,2020/04/06
Albania,4/7/20,383,22,,,6,,13.308777538397386,,,,,8,ALB,2020/04/07
Albania,4/8/20,400,23,,,17,,13.899506567516854,,,,,8,ALB,2020/04/08
Albania,4/9/20,409,23,,,9,,14.212245465285982,,,,,8,ALB,2020/04/09
Albania,4/10/20,416,23,,,7,,14.455486830217527,,,,,8,ALB,2020/04/10
Albania,4/11/20,433,23,,,17,,15.046215859336993,,,,,8,ALB,2020/04/11
Albania,4/12/20,446,23,,,13,,15.49794982278129,,,,,8,ALB,2020/04/12
Albania,4/13/20,467,24,,,21,,16.227673917575927,,,,,8,ALB,2020/04/13
Albania,4/14/20,475,25,,,8,,16.505664048926263,,,,,8,ALB,2020/04/14
Albania,4/15/20,494,26,,,19,,17.165890610883313,,,,,8,ALB,2020/04/15
Albania,4/16/20,518,26,,,24,,17.999861004934324,,,,,8,ALB,2020/04/16
Albania,4/17/20,539,26,,,21,,18.72958509972896,,,,,8,ALB,2020/04/17
Albania,4/18/20,548,26,,,9,,19.042323997498087,,,,,8,ALB,2020/04/18
Albania,4/19/20,562,26,,,14,,19.52880672736118,,,,,8,ALB,2020/04/19
Albania,4/20/20,584,26,,,22,,20.293279588574606,,,,,8,ALB,2020/04/20
Albania,4/21/20,609,27,,,25,,21.161998749044407,,,,,8,ALB,2020/04/21
Albania,4/22/20,634,27,,,25,,22.030717909514212,,,,,8,ALB,2020/04/22
Albania,4/23/20,663,27,,,29,,23.038432135659185,,,,,8,ALB,2020/04/23
Albania,4/24/20,678,27,,,15,,23.559663631941067,,,,,8,ALB,2020/04/24
Albania,4/25/20,712,28,,,34,,24.741121690179998,,,,,8,ALB,2020/04/25
Albania,4/26/20,726,28,,,14,,25.22760442004309,,,,,8,ALB,2020/04/26
Albania,4/27/20,736,30,,,10,,25.57509208423101,,,,,8,ALB,2020/04/27
Albania,4/28/20,750,30,,,14,,26.0615748140941,,,,,8,ALB,2020/04/28
Albania,4/29/20,766,31,,,16,,26.617555076794773,,,,,8,ALB,2020/04/29
Albania,4/30/20,773,31,,,7,,26.86079644172632,,,,,8,ALB,2020/04/30
Albania,5/1/20,782,31,,,9,,27.173535339495448,,,,,8,ALB,2020/05/01
Albania,5/2/20,789,31,,,7,,27.416776704426994,,,,,8,ALB,2020/05/02
Albania,5/3/20,795,31,,,6,,27.625269302939746,,,,,8,ALB,2020/05/03
Albania,5/4/20,803,31,,,8,,27.90325943429008,,,,,8,ALB,2020/05/04
Albania,5/5/20,820,31,,,17,,28.49398846340955,,,,,8,ALB,2020/05/05
Albania,5/6/20,832,31,,,12,,28.910973660435054,,,,,8,ALB,2020/05/06
Albania,5/7/20,842,31,,,10,,29.258461324622974,,,,,8,ALB,2020/05/07
Albania,5/8/20,850,31,,,8,,29.536451455973314,,,,,8,ALB,2020/05/08
Albania,5/9/20,856,31,,,6,,29.744944054486066,,,,,8,ALB,2020/05/09
Albania,5/10/20,868,31,,,12,,30.161929251511573,,,,,8,ALB,2020/05/10
Albania,5/11/20,872,31,,,4,,30.30092431718674,,,,,8,ALB,2020/05/11
Albania,5/12/20,876,31,,,4,,30.43991938286191,,,,,8,ALB,2020/05/12
Albania,5/13/20,880,31,,,4,,30.578914448537077,,,,,8,ALB,2020/05/13
Albania,5/14/20,898,31,,,18,,31.204392244075336,,,,,8,ALB,2020/05/14
Albania,5/15/20,916,31,,,18,,31.829870039613592,,,,,8,ALB,2020/05/15
Albania,5/16/20,933,31,,,17,,32.42059906873306,,,,,8,ALB,2020/05/16
Albania,5/17/20,946,31,,,13,,32.87233303217736,,,,,8,ALB,2020/05/17
Albania,5/18/20,948,31,,,2,,32.94183056501494,,,,,8,ALB,2020/05/18
Albania,5/19/20,949,31,,,1,,32.97657933143373,,,,,8,ALB,2020/05/19
Albania,5/20/20,964,31,,,15,,33.49781082771562,,,,,8,ALB,2020/05/20
Albania,5/21/20,969,31,,,5,,33.67155465980958,,,,,8,ALB,2020/05/21
Albania,5/22/20,981,31,,,12,,34.088539856835084,,,,,8,ALB,2020/05/22
Albania,5/23/20,989,32,,,8,,34.36652998818542,,,,,8,ALB,2020/05/23
Albania,5/24/20,998,32,,,9,,34.67926888595455,,,,,8,ALB,2020/05/24
Albania,5/25/20,1004,33,,,6,,34.887761484467305,,,,,8,ALB,2020/05/25
Albania,5/26/20,1029,33,,,25,,35.756480644937106,,,,,8,ALB,2020/05/26
Albania,5/27/20,1050,33,,,21,,36.48620473973174,,,,,8,ALB,2020/05/27
Albania,5/28/20,1076,33,,,26,,37.389672666620335,,,,,8,ALB,2020/05/28
Albania,5/29/20,1099,33,,,23,,38.188894294252556,,,,,8,ALB,2020/05/29
Albania,5/30/20,1122,33,,,23,,38.98811592188477,,,,,8,ALB,2020/05/30
Albania,5/31/20,1137,33,,,15,,39.509347418166655,,,,,8,ALB,2020/05/31
Albania,6/1/20,1143,33,,,6,,39.71784001667941,,,,,8,ALB,2020/06/01
Albania,6/2/20,1164,33,,,21,,40.447564111474044,,,,,8,ALB,2020/06/02
Albania,6/3/20,1184,33,,,20,,41.142539439849884,,,,,8,ALB,2020/06/03
Albania,6/4/20,1197,33,,,13,,41.59427340329418,,,,,8,ALB,2020/06/04
Albania,6/5/20,1212,34,,,15,,42.11550489957607,,,,,8,ALB,2020/06/05
Albania,6/6/20,1232,34,,,20,,42.810480227951906,,,,,8,ALB,2020/06/06
Albania,6/7/20,1246,34,,,14,,43.296962957815,,,,,8,ALB,2020/06/07
Albania,6/8/20,1263,34,,,17,,43.88769198693446,,,,,8,ALB,2020/06/08
Albania,6/9/20,1299,34,,,36,,45.13864757801098,,,,,8,ALB,2020/06/09
Albania,6/10/20,1341,35,,,42,,46.59809576760025,,,,,8,ALB,2020/06/10
Albania,6/11/20,1385,36,,,44,,48.1270414900271,,,,,8,ALB,2020/06/11
Albania,6/12/20,1416,0,,,31,,49.20425324900966,,,,,8,ALB,2020/06/12
Albania,6/13/20,1464,0,,,48,,50.87219403711168,,,,,8,ALB,2020/06/13
Algeria,1/22/20,0,0,,,0,,0.0,,,,,12,DZA,2020/01/22
Algeria,1/23/20,0,0,,,0,,0.0,,,,,12,DZA,2020/01/23
Algeria,1/24/20,0,0,,,0,,0.0,,,,,12,DZA,2020/01/24
Algeria,1/25/20,0,0,,,0,,0.0,,,,,12,DZA,2020/01/25
Algeria,1/26/20,0,0,,,0,,0.0,,,,,12,DZA,2020/01/26
Algeria,1/27/20,0,0,,,0,,0.0,,,,,12,DZA,2020/01/27
Algeria,1/28/20,0,0,,,0,,0.0,,,,,12,DZA,2020/01/28
Algeria,1/29/20,0,0,,,0,,0.0,,,,,12,DZA,2020/01/29
Algeria,1/30/20,0,0,,,0,,0.0,,,,,12,DZA,2020/01/30
Algeria,1/31/20,0,0,,,0,,0.0,,,,,12,DZA,2020/01/31
Algeria,2/1/20,0,0,,,0,,0.0,,,,,12,DZA,2020/02/01
Algeria,2/2/20,0,0,,,0,,0.0,,,,,12,DZA,2020/02/02
Algeria,2/3/20,0,0,,,0,,0.0,,,,,12,DZA,2020/02/03
Algeria,2/4/20,0,0,,,0,,0.0,,,,,12,DZA,2020/02/04
Algeria,2/5/20,0,0,,,0,,0.0,,,,,12,DZA,2020/02/05
Algeria,2/6/20,0,0,,,0,,0.0,,,,,12,DZA,2020/02/06
Algeria,2/7/20,0,0,,,0,,0.0,,,,,12,DZA,2020/02/07
Algeria,2/8/20,0,0,,,0,,0.0,,,,,12,DZA,2020/02/08
Algeria,2/9/20,0,0,,,0,,0.0,,,,,12,DZA,2020/02/09
Algeria,2/10/20,0,0,,,0,,0.0,,,,,12,DZA,2020/02/10
Algeria,2/11/20,0,0,,,0,,0.0,,,,,12,DZA,2020/02/11
Algeria,2/12/20,0,0,,,0,,0.0,,,,,12,DZA,2020/02/12
Algeria,2/13/20,0,0,,,0,,0.0,,,,,12,DZA,2020/02/13
Algeria,2/14/20,0,0,,,0,,0.0,,,,,12,DZA,2020/02/14
Algeria,2/15/20,0,0,,,0,,0.0,,,,,12,DZA,2020/02/15
Algeria,2/16/20,0,0,,,0,,0.0,,,,,12,DZA,2020/02/16
Algeria,2/17/20,0,0,,,0,,0.0,,,,,12,DZA,2020/02/17
Algeria,2/18/20,0,0,,,0,,0.0,,,,,12,DZA,2020/02/18
Algeria,2/19/20,0,0,,,0,,0.0,,,,,12,DZA,2020/02/19
Algeria,2/20/20,0,0,,,0,,0.0,,,,,12,DZA,2020/02/20
Algeria,2/21/20,0,0,,,0,,0.0,,,,,12,DZA,2020/02/21
Algeria,2/22/20,0,0,,,0,,0.0,,,,,12,DZA,2020/02/22
Algeria,2/23/20,0,0,,,0,,0.0,,,,,12,DZA,2020/02/23
Algeria,2/24/20,0,0,,,0,,0.0,,,,,12,DZA,2020/02/24
Algeria,2/25/20,1,0,,,1,,0.002280447468490088,,,,,12,DZA,2020/02/25
Algeria,2/26/20,1,0,,,0,,0.002280447468490088,,,,,12,DZA,2020/02/26
Algeria,2/27/20,1,0,,,0,,0.002280447468490088,,,,,12,DZA,2020/02/27
Algeria,2/28/20,1,0,,,0,,0.002280447468490088,,,,,12,DZA,2020/02/28
Algeria,2/29/20,1,0,,,0,,0.002280447468490088,,,,,12,DZA,2020/02/29
Algeria,3/1/20,1,0,,,0,,0.002280447468490088,,,,,12,DZA,2020/03/01
Algeria,3/2/20,3,0,,,2,,0.006841342405470264,,,,,12,DZA,2020/03/02
Algeria,3/3/20,5,0,,,2,,0.01140223734245044,,,,,12,DZA,2020/03/03
Algeria,3/4/20,12,0,,,7,,0.027365369621881058,,,,,12,DZA,2020/03/04
Algeria,3/5/20,12,0,,,0,,0.027365369621881058,,,,,12,DZA,2020/03/05
Algeria,3/6/20,17,0,,,5,,0.0387676069643315,,,,,12,DZA,2020/03/06
Algeria,3/7/20,17,0,,,0,,0.0387676069643315,,,,,12,DZA,2020/03/07
Algeria,3/8/20,19,0,,,2,,0.043328501901311677,,,,,12,DZA,2020/03/08
Algeria,3/9/20,20,0,,,1,,0.04560894936980176,,,,,12,DZA,2020/03/09
Algeria,3/10/20,20,1,,,0,,0.04560894936980176,,,,,12,DZA,2020/03/10
Algeria,3/11/20,20,2,,,0,,0.04560894936980176,,,,,12,DZA,2020/03/11
Algeria,3/12/20,24,3,,,4,,0.054730739243762115,,,,,12,DZA,2020/03/12
Algeria,3/13/20,26,4,,,2,,0.05929163418074229,,,,,12,DZA,2020/03/13
Algeria,3/14/20,37,4,,,11,,0.08437655633413325,,,,,12,DZA,2020/03/14
Algeria,3/15/20,48,4,,,11,,0.10946147848752423,,,,,12,DZA,2020/03/15
Algeria,3/16/20,54,7,,,6,,0.12314416329846475,,,,,12,DZA,2020/03/16
Algeria,3/17/20,60,9,,,6,,0.1368268481094053,,,,,12,DZA,2020/03/17
Algeria,3/18/20,74,11,,,14,,0.1687531126682665,,,,,12,DZA,2020/03/18
Algeria,3/19/20,87,15,,,13,,0.19839892975863765,,,,,12,DZA,2020/03/19
Algeria,3/20/20,90,17,,,3,,0.20524027216410792,,,,,12,DZA,2020/03/20
Algeria,3/21/20,139,17,,,49,,0.31698219812012224,,,,,12,DZA,2020/03/21
Algeria,3/22/20,201,19,,,62,,0.4583699411665077,,,,,12,DZA,2020/03/22
Algeria,3/23/20,230,21,,,29,,0.5245029177527203,,,,,12,DZA,2020/03/23
Algeria,3/24/20,264,25,,,34,,0.6020381316813833,,,,,12,DZA,2020/03/24
Algeria,3/25/20,302,26,,,38,,0.6886951354840066,,,,,12,DZA,2020/03/25
Algeria,3/26/20,367,29,,,65,,0.8369242209358624,,,,,12,DZA,2020/03/26
Algeria,3/27/20,409,31,,,42,,0.9327030146124461,,,,,12,DZA,2020/03/27
Algeria,3/28/20,454,35,,,45,,1.0353231506945,,,,,12,DZA,2020/03/28
Algeria,3/29/20,511,44,,,57,,1.165308656398435,,,,,12,DZA,2020/03/29
Algeria,3/30/20,584,58,,,73,,1.3317813215982115,,,,,12,DZA,2020/03/30
Algeria,3/31/20,716,86,,,132,,1.6328003874389032,,,,,12,DZA,2020/03/31
Algeria,4/1/20,847,105,,,131,,1.9315390058111046,,,,,12,DZA,2020/04/01
Algeria,4/2/20,986,130,,,139,,2.248521203931227,,,,,12,DZA,2020/04/02
Algeria,4/3/20,1171,152,,,185,,2.6704039856018933,,,,,12,DZA,2020/04/03
Algeria,4/4/20,1251,173,,,80,,2.8528397830811003,,,,,12,DZA,2020/04/04
Algeria,4/5/20,1320,193,,,69,,3.0101906584069162,,,,,12,DZA,2020/04/05
Algeria,4/6/20,1423,205,,,103,,3.2450767476613955,,,,,12,DZA,2020/04/06
Algeria,4/7/20,1468,235,,,45,,3.3476968837434495,,,,,12,DZA,2020/04/07
Algeria,4/8/20,1572,256,,,104,,3.5848634204664185,,,,,12,DZA,2020/04/08
Algeria,4/9/20,1666,275,,,94,,3.799225482504487,,,,,12,DZA,2020/04/09
Algeria,4/10/20,1761,293,,,95,,4.015867992011045,,,,,12,DZA,2020/04/10
Algeria,4/11/20,1825,313,,,64,,4.161816629994411,,,,,12,DZA,2020/04/11
Algeria,4/12/20,1914,326,,,89,,4.364776454690029,,,,,12,DZA,2020/04/12
Algeria,4/13/20,1983,336,,,69,,4.522127330015845,,,,,12,DZA,2020/04/13
Algeria,4/14/20,2070,348,,,87,,4.720526259774482,,,,,12,DZA,2020/04/14
Algeria,4/15/20,2160,364,,,90,,4.92576653193859,,,,,12,DZA,2020/04/15
Algeria,4/16/20,2268,367,,,108,,5.17205485853552,,,,,12,DZA,2020/04/16
Algeria,4/17/20,2418,375,,,150,,5.514121978809033,,,,,12,DZA,2020/04/17
Algeria,4/18/20,2534,384,,,116,,5.778653885153884,,,,,12,DZA,2020/04/18
Algeria,4/19/20,2629,392,,,95,,5.995296394660442,,,,,12,DZA,2020/04/19
Algeria,4/20/20,2718,402,,,89,,6.198256219356059,,,,,12,DZA,2020/04/20
Algeria,4/21/20,2811,407,,,93,,6.410337833925638,,,,,12,DZA,2020/04/21
Algeria,4/22/20,2910,415,,,99,,6.6361021333061565,,,,,12,DZA,2020/04/22
Algeria,4/23/20,3007,419,,,97,,6.857305537749695,,,,,12,DZA,2020/04/23
Algeria,4/24/20,3127,425,,,120,,7.130959233968506,,,,,12,DZA,2020/04/24
Algeria,4/25/20,3256,432,,,129,,7.425136957403727,,,,,12,DZA,2020/04/25
Algeria,4/26/20,3382,437,,,126,,7.712473338433478,,,,,12,DZA,2020/04/26
Algeria,4/27/20,3517,444,,,135,,8.02033374667964,,,,,12,DZA,2020/04/27
Algeria,4/28/20,3649,450,,,132,,8.321352812520331,,,,,12,DZA,2020/04/28
Algeria,4/29/20,3848,453,,,199,,8.77516185874986,,,,,12,DZA,2020/04/29
Algeria,4/30/20,4006,459,,,158,,9.135472558771292,,,,,12,DZA,2020/04/30
Algeria,5/1/20,4154,463,,,148,,9.472978784107827,,,,,12,DZA,2020/05/01
Algeria,5/2/20,4295,465,,,141,,9.794521877164929,,,,,12,DZA,2020/05/02
Algeria,5/3/20,4474,470,,,179,,10.202721974024655,,,,,12,DZA,2020/05/03
Algeria,5/4/20,4648,476,,,174,,10.59951983354193,,,,,12,DZA,2020/05/04
Algeria,5/5/20,4838,483,,,190,,11.032804852555046,,,,,12,DZA,2020/05/05
Algeria,5/6/20,4997,488,,,159,,11.39539600004497,,,,,12,DZA,2020/05/06
Algeria,5/7/20,5182,494,,,185,,11.817278781715636,,,,,12,DZA,2020/05/07
Algeria,5/8/20,5369,502,,,187,,12.243722458323283,,,,,12,DZA,2020/05/08
Algeria,5/9/20,5558,507,,,189,,12.67472702986791,,,,,12,DZA,2020/05/09
Algeria,5/10/20,5723,515,,,165,,13.051000862168774,,,,,12,DZA,2020/05/10
Algeria,5/11/20,5891,522,,,168,,13.434116036875109,,,,,12,DZA,2020/05/11
Algeria,5/12/20,6067,529,,,176,,13.835474791329364,,,,,12,DZA,2020/05/12
Algeria,5/13/20,6253,536,,,186,,14.259638020468522,,,,,12,DZA,2020/05/13
Algeria,5/14/20,6442,542,,,189,,14.690642592013148,,,,,12,DZA,2020/05/14
Algeria,5/15/20,6629,548,,,187,,15.117086268620794,,,,,12,DZA,2020/05/15
Algeria,5/16/20,6821,555,,,192,,15.55493218257089,,,,,12,DZA,2020/05/16
Algeria,5/17/20,7019,561,,,198,,16.006460781331928,,,,,12,DZA,2020/05/17
Algeria,5/18/20,7201,568,,,182,,16.421502220597123,,,,,12,DZA,2020/05/18
Algeria,5/19/20,7377,575,,,176,,16.82286097505138,,,,,12,DZA,2020/05/19
Algeria,5/20/20,7542,582,,,165,,17.199134807352245,,,,,12,DZA,2020/05/20
Algeria,5/21/20,7728,592,,,186,,17.623298036491402,,,,,12,DZA,2020/05/21
Algeria,5/22/20,7918,600,,,190,,18.056583055504518,,,,,12,DZA,2020/05/22
Algeria,5/23/20,8113,609,,,195,,18.501270311860086,,,,,12,DZA,2020/05/23
Algeria,5/24/20,8306,617,,,193,,18.94139667327867,,,,,12,DZA,2020/05/24
Algeria,5/25/20,8503,623,,,197,,19.39064482457122,,,,,12,DZA,2020/05/25
Algeria,5/26/20,8697,630,,,194,,19.833051633458297,,,,,12,DZA,2020/05/26
Algeria,5/27/20,8857,638,,,160,,20.19792322841671,,,,,12,DZA,2020/05/27
Algeria,5/28/20,8997,646,,,140,,20.517185874005325,,,,,12,DZA,2020/05/28
Algeria,5/29/20,9134,653,,,137,,20.829607177188464,,,,,12,DZA,2020/05/29
Algeria,5/30/20,9267,661,,,133,,21.132906690497645,,,,,12,DZA,2020/05/30
Algeria,5/31/20,9394,667,,,127,,21.422523518995888,,,,,12,DZA,2020/05/31
Algeria,6/1/20,9513,673,,,119,,21.69389676774621,,,,,12,DZA,2020/06/01
Algeria,6/2/20,9626,681,,,113,,21.951587331685587,,,,,12,DZA,2020/06/02
Algeria,6/3/20,9733,690,,,107,,22.195595210814027,,,,,12,DZA,2020/06/03
Algeria,6/4/20,9831,698,,,98,,22.419079062726055,,,,,12,DZA,2020/06/04
Algeria,6/5/20,9935,707,,,104,,22.656245599449026,,,,,12,DZA,2020/06/05
Algeria,6/6/20,10050,715,,,115,,22.918497058325386,,,,,12,DZA,2020/06/06
Algeria,6/7/20,10154,724,,,104,,23.155663595048356,,,,,12,DZA,2020/06/07
Algeria,6/8/20,10265,732,,,111,,23.408793264050754,,,,,12,DZA,2020/06/08
Algeria,6/9/20,10382,741,,,117,,23.675605617864097,,,,,12,DZA,2020/06/09
Algeria,6/10/20,10484,751,,,102,,23.908211259650084,,,,,12,DZA,2020/06/10
Algeria,6/11/20,10589,0,,,105,,24.147658243841544,,,,,12,DZA,2020/06/11
Algeria,6/12/20,10698,0,,,109,,24.396227017906963,,,,,12,DZA,2020/06/12
Algeria,6/13/20,10810,0,,,112,,24.651637134377854,,,,,12,DZA,2020/06/13
Andorra,1/22/20,0,0,,,0,,0.0,,,,,20,AND,2020/01/22
Andorra,1/23/20,0,0,,,0,,0.0,,,,,20,AND,2020/01/23
Andorra,1/24/20,0,0,,,0,,0.0,,,,,20,AND,2020/01/24
Andorra,1/25/20,0,0,,,0,,0.0,,,,,20,AND,2020/01/25
Andorra,1/26/20,0,0,,,0,,0.0,,,,,20,AND,2020/01/26
Andorra,1/27/20,0,0,,,0,,0.0,,,,,20,AND,2020/01/27
Andorra,1/28/20,0,0,,,0,,0.0,,,,,20,AND,2020/01/28
Andorra,1/29/20,0,0,,,0,,0.0,,,,,20,AND,2020/01/29
Andorra,1/30/20,0,0,,,0,,0.0,,,,,20,AND,2020/01/30
Andorra,1/31/20,0,0,,,0,,0.0,,,,,20,AND,2020/01/31
Andorra,2/1/20,0,0,,,0,,0.0,,,,,20,AND,2020/02/01
Andorra,2/2/20,0,0,,,0,,0.0,,,,,20,AND,2020/02/02
Andorra,2/3/20,0,0,,,0,,0.0,,,,,20,AND,2020/02/03
Andorra,2/4/20,0,0,,,0,,0.0,,,,,20,AND,2020/02/04
Andorra,2/5/20,0,0,,,0,,0.0,,,,,20,AND,2020/02/05
Andorra,2/6/20,0,0,,,0,,0.0,,,,,20,AND,2020/02/06
Andorra,2/7/20,0,0,,,0,,0.0,,,,,20,AND,2020/02/07
Andorra,2/8/20,0,0,,,0,,0.0,,,,,20,AND,2020/02/08
Andorra,2/9/20,0,0,,,0,,0.0,,,,,20,AND,2020/02/09
Andorra,2/10/20,0,0,,,0,,0.0,,,,,20,AND,2020/02/10
Andorra,2/11/20,0,0,,,0,,0.0,,,,,20,AND,2020/02/11
Andorra,2/12/20,0,0,,,0,,0.0,,,,,20,AND,2020/02/12
Andorra,2/13/20,0,0,,,0,,0.0,,,,,20,AND,2020/02/13
Andorra,2/14/20,0,0,,,0,,0.0,,,,,20,AND,2020/02/14
Andorra,2/15/20,0,0,,,0,,0.0,,,,,20,AND,2020/02/15
Andorra,2/16/20,0,0,,,0,,0.0,,,,,20,AND,2020/02/16
Andorra,2/17/20,0,0,,,0,,0.0,,,,,20,AND,2020/02/17
Andorra,2/18/20,0,0,,,0,,0.0,,,,,20,AND,2020/02/18
Andorra,2/19/20,0,0,,,0,,0.0,,,,,20,AND,2020/02/19
Andorra,2/20/20,0,0,,,0,,0.0,,,,,20,AND,2020/02/20
Andorra,2/21/20,0,0,,,0,,0.0,,,,,20,AND,2020/02/21
Andorra,2/22/20,0,0,,,0,,0.0,,,,,20,AND,2020/02/22
Andorra,2/23/20,0,0,,,0,,0.0,,,,,20,AND,2020/02/23
Andorra,2/24/20,0,0,,,0,,0.0,,,,,20,AND,2020/02/24
Andorra,2/25/20,0,0,,,0,,0.0,,,,,20,AND,2020/02/25
Andorra,2/26/20,0,0,,,0,,0.0,,,,,20,AND,2020/02/26
Andorra,2/27/20,0,0,,,0,,0.0,,,,,20,AND,2020/02/27
Andorra,2/28/20,0,0,,,0,,0.0,,,,,20,AND,2020/02/28
Andorra,2/29/20,0,0,,,0,,0.0,,,,,20,AND,2020/02/29
Andorra,3/1/20,0,0,,,0,,0.0,,,,,20,AND,2020/03/01
Andorra,3/2/20,1,0,,,1,,1.2942470717660002,,,,,20,AND,2020/03/02
Andorra,3/3/20,1,0,,,0,,1.2942470717660002,,,,,20,AND,2020/03/03
Andorra,3/4/20,1,0,,,0,,1.2942470717660002,,,,,20,AND,2020/03/04
Andorra,3/5/20,1,0,,,0,,1.2942470717660002,,,,,20,AND,2020/03/05
Andorra,3/6/20,1,0,,,0,,1.2942470717660002,,,,,20,AND,2020/03/06
Andorra,3/7/20,1,0,,,0,,1.2942470717660002,,,,,20,AND,2020/03/07
Andorra,3/8/20,1,0,,,0,,1.2942470717660002,,,,,20,AND,2020/03/08
Andorra,3/9/20,1,0,,,0,,1.2942470717660002,,,,,20,AND,2020/03/09
Andorra,3/10/20,1,0,,,0,,1.2942470717660002,,,,,20,AND,2020/03/10
Andorra,3/11/20,1,0,,,0,,1.2942470717660002,,,,,20,AND,2020/03/11
Andorra,3/12/20,1,0,,,0,,1.2942470717660002,,,,,20,AND,2020/03/12
Andorra,3/13/20,1,0,,,0,,1.2942470717660002,,,,,20,AND,2020/03/13
Andorra,3/14/20,1,0,,,0,,1.2942470717660002,,,,,20,AND,2020/03/14
Andorra,3/15/20,1,0,,,0,,1.2942470717660002,,,,,20,AND,2020/03/15
Andorra,3/16/20,2,0,,,1,,2.5884941435320004,,,,,20,AND,2020/03/16
Andorra,3/17/20,39,0,,,37,,50.475635798874,,,,,20,AND,2020/03/17
Andorra,3/18/20,39,0,,,0,,50.475635798874,,,,,20,AND,2020/03/18
Andorra,3/19/20,53,1,,,14,,68.595094803598,,,,,20,AND,2020/03/19
Andorra,3/20/20,75,1,,,22,,97.06853038245,,,,,20,AND,2020/03/20
Andorra,3/21/20,88,1,,,13,,113.893742315408,,,,,20,AND,2020/03/21
Andorra,3/22/20,113,1,,,25,,146.24991910955802,,,,,20,AND,2020/03/22
Andorra,3/23/20,133,3,,,20,,172.13486054487802,,,,,20,AND,2020/03/23
Andorra,3/24/20,164,3,,,31,,212.25651976962402,,,,,20,AND,2020/03/24
Andorra,3/25/20,188,3,,,24,,243.31844949200803,,,,,20,AND,2020/03/25
Andorra,3/26/20,224,6,,,36,,289.91134407558405,,,,,20,AND,2020/03/26
Andorra,3/27/20,267,8,,,43,,345.56396816152204,,,,,20,AND,2020/03/27
Andorra,3/28/20,308,12,,,41,,398.62809810392804,,,,,20,AND,2020/03/28
Andorra,3/29/20,334,14,,,26,,432.27852196984406,,,,,20,AND,2020/03/29
Andorra,3/30/20,370,15,,,36,,478.87141655342003,,,,,20,AND,2020/03/30
Andorra,3/31/20,376,16,,,6,,486.63689898401606,,,,,20,AND,2020/03/31
Andorra,4/1/20,390,17,,,14,,504.75635798874004,,,,,20,AND,2020/04/01
Andorra,4/2/20,428,18,,,38,,553.9377467158481,,,,,20,AND,2020/04/02
Andorra,4/3/20,439,21,,,11,,568.174464505274,,,,,20,AND,2020/04/03
Andorra,4/4/20,466,22,,,27,,603.119135442956,,,,,20,AND,2020/04/04
Andorra,4/5/20,501,23,,,35,,648.417782954766,,,,,20,AND,2020/04/05
Andorra,4/6/20,525,25,,,24,,679.47971267715,,,,,20,AND,2020/04/06
Andorra,4/7/20,545,26,,,20,,705.36465411247,,,,,20,AND,2020/04/07
Andorra,4/8/20,564,26,,,19,,729.955348476024,,,,,20,AND,2020/04/08
Andorra,4/9/20,583,29,,,19,,754.546042839578,,,,,20,AND,2020/04/09
Andorra,4/10/20,601,29,,,18,,777.842490131366,,,,,20,AND,2020/04/10
Andorra,4/11/20,601,31,,,0,,777.842490131366,,,,,20,AND,2020/04/11
Andorra,4/12/20,638,33,,,37,,825.7296317867081,,,,,20,AND,2020/04/12
Andorra,4/13/20,646,33,,,8,,836.0836083608361,,,,,20,AND,2020/04/13
Andorra,4/14/20,659,35,,,13,,852.9088202937941,,,,,20,AND,2020/04/14
Andorra,4/15/20,673,35,,,14,,871.0282792985181,,,,,20,AND,2020/04/15
Andorra,4/16/20,673,36,,,0,,871.0282792985181,,,,,20,AND,2020/04/16
Andorra,4/17/20,696,37,,,23,,900.7959619491361,,,,,20,AND,2020/04/17
Andorra,4/18/20,704,37,,,8,,911.149938523264,,,,,20,AND,2020/04/18
Andorra,4/19/20,713,37,,,9,,922.7981621691581,,,,,20,AND,2020/04/19
Andorra,4/20/20,717,37,,,4,,927.9751504562221,,,,,20,AND,2020/04/20
Andorra,4/21/20,717,40,,,0,,927.9751504562221,,,,,20,AND,2020/04/21
Andorra,4/22/20,723,40,,,6,,935.740632886818,,,,,20,AND,2020/04/22
Andorra,4/23/20,723,40,,,0,,935.740632886818,,,,,20,AND,2020/04/23
Andorra,4/24/20,731,40,,,8,,946.0946094609461,,,,,20,AND,2020/04/24
Andorra,4/25/20,738,41,,,7,,955.1543389633081,,,,,20,AND,2020/04/25
Andorra,4/26/20,738,42,,,0,,955.1543389633081,,,,,20,AND,2020/04/26
Andorra,4/27/20,743,42,,,5,,961.625574322138,,,,,20,AND,2020/04/27
Andorra,4/28/20,743,43,,,0,,961.625574322138,,,,,20,AND,2020/04/28
Andorra,4/29/20,743,44,,,0,,961.625574322138,,,,,20,AND,2020/04/29
Andorra,4/30/20,745,45,,,2,,964.2140684656702,,,,,20,AND,2020/04/30
Andorra,5/1/20,745,45,,,0,,964.2140684656702,,,,,20,AND,2020/05/01
Andorra,5/2/20,747,46,,,2,,966.8025626092021,,,,,20,AND,2020/05/02
Andorra,5/3/20,748,46,,,1,,968.0968096809681,,,,,20,AND,2020/05/03
Andorra,5/4/20,750,47,,,2,,970.6853038245001,,,,,20,AND,2020/05/04
Andorra,5/5/20,751,47,,,1,,971.9795508962661,,,,,20,AND,2020/05/05
Andorra,5/6/20,751,48,,,0,,971.9795508962661,,,,,20,AND,2020/05/06
Andorra,5/7/20,752,48,,,1,,973.2737979680321,,,,,20,AND,2020/05/07
Andorra,5/8/20,752,48,,,0,,973.2737979680321,,,,,20,AND,2020/05/08
Andorra,5/9/20,754,48,,,2,,975.8622921115641,,,,,20,AND,2020/05/09
Andorra,5/10/20,755,49,,,1,,977.1565391833301,,,,,20,AND,2020/05/10
Andorra,5/11/20,755,49,,,0,,977.1565391833301,,,,,20,AND,2020/05/11
Andorra,5/12/20,758,49,,,3,,981.0392803986281,,,,,20,AND,2020/05/12
Andorra,5/13/20,760,51,,,2,,983.6277745421601,,,,,20,AND,2020/05/13
Andorra,5/14/20,761,51,,,1,,984.9220216139261,,,,,20,AND,2020/05/14
Andorra,5/15/20,761,51,,,0,,984.9220216139261,,,,,20,AND,2020/05/15
Andorra,5/16/20,761,51,,,0,,984.9220216139261,,,,,20,AND,2020/05/16
Andorra,5/17/20,761,51,,,0,,984.9220216139261,,,,,20,AND,2020/05/17
Andorra,5/18/20,761,51,,,0,,984.9220216139261,,,,,20,AND,2020/05/18
Andorra,5/19/20,761,51,,,0,,984.9220216139261,,,,,20,AND,2020/05/19
Andorra,5/20/20,762,51,,,1,,986.2162686856921,,,,,20,AND,2020/05/20
Andorra,5/21/20,762,51,,,0,,986.2162686856921,,,,,20,AND,2020/05/21
Andorra,5/22/20,762,51,,,0,,986.2162686856921,,,,,20,AND,2020/05/22
Andorra,5/23/20,762,51,,,0,,986.2162686856921,,,,,20,AND,2020/05/23
Andorra,5/24/20,762,51,,,0,,986.2162686856921,,,,,20,AND,2020/05/24
Andorra,5/25/20,763,51,,,1,,987.510515757458,,,,,20,AND,2020/05/25
Andorra,5/26/20,763,51,,,0,,987.510515757458,,,,,20,AND,2020/05/26
Andorra,5/27/20,763,51,,,0,,987.510515757458,,,,,20,AND,2020/05/27
Andorra,5/28/20,763,51,,,0,,987.510515757458,,,,,20,AND,2020/05/28
Andorra,5/29/20,764,51,,,1,,988.804762829224,,,,,20,AND,2020/05/29
Andorra,5/30/20,764,51,,,0,,988.804762829224,,,,,20,AND,2020/05/30
Andorra,5/31/20,764,51,,,0,,988.804762829224,,,,,20,AND,2020/05/31
Andorra,6/1/20,765,51,,,1,,990.0990099009902,,,,,20,AND,2020/06/01
Andorra,6/2/20,844,51,,,79,,1092.344528570504,,,,,20,AND,2020/06/02
Andorra,6/3/20,851,51,,,7,,1101.404258072866,,,,,20,AND,2020/06/03
Andorra,6/4/20,852,51,,,1,,1102.698505144632,,,,,20,AND,2020/06/04
Andorra,6/5/20,852,51,,,0,,1102.698505144632,,,,,20,AND,2020/06/05
Andorra,6/6/20,852,51,,,0,,1102.698505144632,,,,,20,AND,2020/06/06
Andorra,6/7/20,852,51,,,0,,1102.698505144632,,,,,20,AND,2020/06/07
Andorra,6/8/20,852,51,,,0,,1102.698505144632,,,,,20,AND,2020/06/08
Andorra,6/9/20,852,51,,,0,,1102.698505144632,,,,,20,AND,2020/06/09
Andorra,6/10/20,852,0,,,0,,1102.698505144632,,,,,20,AND,2020/06/10
Andorra,6/11/20,852,0,,,0,,1102.698505144632,,,,,20,AND,2020/06/11
Andorra,6/12/20,853,0,,,1,,1103.992752216398,,,,,20,AND,2020/06/12
Andorra,6/13/20,853,0,,,0,,1103.992752216398,,,,,20,AND,2020/06/13
Angola,1/22/20,0,0,,,0,,0.0,,,,,24,AGO,2020/01/22
Angola,1/23/20,0,0,,,0,,0.0,,,,,24,AGO,2020/01/23
Angola,1/24/20,0,0,,,0,,0.0,,,,,24,AGO,2020/01/24
Angola,1/25/20,0,0,,,0,,0.0,,,,,24,AGO,2020/01/25
Angola,1/26/20,0,0,,,0,,0.0,,,,,24,AGO,2020/01/26
Angola,1/27/20,0,0,,,0,,0.0,,,,,24,AGO,2020/01/27
Angola,1/28/20,0,0,,,0,,0.0,,,,,24,AGO,2020/01/28
Angola,1/29/20,0,0,,,0,,0.0,,,,,24,AGO,2020/01/29
Angola,1/30/20,0,0,,,0,,0.0,,,,,24,AGO,2020/01/30
Angola,1/31/20,0,0,,,0,,0.0,,,,,24,AGO,2020/01/31
Angola,2/1/20,0,0,,,0,,0.0,,,,,24,AGO,2020/02/01
Angola,2/2/20,0,0,,,0,,0.0,,,,,24,AGO,2020/02/02
Angola,2/3/20,0,0,,,0,,0.0,,,,,24,AGO,2020/02/03
Angola,2/4/20,0,0,,,0,,0.0,,,,,24,AGO,2020/02/04
Angola,2/5/20,0,0,,,0,,0.0,,,,,24,AGO,2020/02/05
Angola,2/6/20,0,0,,,0,,0.0,,,,,24,AGO,2020/02/06
Angola,2/7/20,0,0,,,0,,0.0,,,,,24,AGO,2020/02/07
Angola,2/8/20,0,0,,,0,,0.0,,,,,24,AGO,2020/02/08
Angola,2/9/20,0,0,,,0,,0.0,,,,,24,AGO,2020/02/09
Angola,2/10/20,0,0,,,0,,0.0,,,,,24,AGO,2020/02/10
Angola,2/11/20,0,0,,,0,,0.0,,,,,24,AGO,2020/02/11
Angola,2/12/20,0,0,,,0,,0.0,,,,,24,AGO,2020/02/12
Angola,2/13/20,0,0,,,0,,0.0,,,,,24,AGO,2020/02/13
Angola,2/14/20,0,0,,,0,,0.0,,,,,24,AGO,2020/02/14
Angola,2/15/20,0,0,,,0,,0.0,,,,,24,AGO,2020/02/15
Angola,2/16/20,0,0,,,0,,0.0,,,,,24,AGO,2020/02/16
Angola,2/17/20,0,0,,,0,,0.0,,,,,24,AGO,2020/02/17
Angola,2/18/20,0,0,,,0,,0.0,,,,,24,AGO,2020/02/18
Angola,2/19/20,0,0,,,0,,0.0,,,,,24,AGO,2020/02/19
Angola,2/20/20,0,0,,,0,,0.0,,,,,24,AGO,2020/02/20
Angola,2/21/20,0,0,,,0,,0.0,,,,,24,AGO,2020/02/21
Angola,2/22/20,0,0,,,0,,0.0,,,,,24,AGO,2020/02/22
Angola,2/23/20,0,0,,,0,,0.0,,,,,24,AGO,2020/02/23
Angola,2/24/20,0,0,,,0,,0.0,,,,,24,AGO,2020/02/24
Angola,2/25/20,0,0,,,0,,0.0,,,,,24,AGO,2020/02/25
Angola,2/26/20,0,0,,,0,,0.0,,,,,24,AGO,2020/02/26
Angola,2/27/20,0,0,,,0,,0.0,,,,,24,AGO,2020/02/27
Angola,2/28/20,0,0,,,0,,0.0,,,,,24,AGO,2020/02/28
Angola,2/29/20,0,0,,,0,,0.0,,,,,24,AGO,2020/02/29
Angola,3/1/20,0,0,,,0,,0.0,,,,,24,AGO,2020/03/01
Angola,3/2/20,0,0,,,0,,0.0,,,,,24,AGO,2020/03/02
Angola,3/3/20,0,0,,,0,,0.0,,,,,24,AGO,2020/03/03
Angola,3/4/20,0,0,,,0,,0.0,,,,,24,AGO,2020/03/04
Angola,3/5/20,0,0,,,0,,0.0,,,,,24,AGO,2020/03/05
Angola,3/6/20,0,0,,,0,,0.0,,,,,24,AGO,2020/03/06
Angola,3/7/20,0,0,,,0,,0.0,,,,,24,AGO,2020/03/07
Angola,3/8/20,0,0,,,0,,0.0,,,,,24,AGO,2020/03/08
Angola,3/9/20,0,0,,,0,,0.0,,,,,24,AGO,2020/03/09
Angola,3/10/20,0,0,,,0,,0.0,,,,,24,AGO,2020/03/10
Angola,3/11/20,0,0,,,0,,0.0,,,,,24,AGO,2020/03/11
Angola,3/12/20,0,0,,,0,,0.0,,,,,24,AGO,2020/03/12
Angola,3/13/20,0,0,,,0,,0.0,,,,,24,AGO,2020/03/13
Angola,3/14/20,0,0,,,0,,0.0,,,,,24,AGO,2020/03/14
Angola,3/15/20,0,0,,,0,,0.0,,,,,24,AGO,2020/03/15
Angola,3/16/20,0,0,,,0,,0.0,,,,,24,AGO,2020/03/16
Angola,3/17/20,0,0,,,0,,0.0,,,,,24,AGO,2020/03/17
Angola,3/18/20,0,0,,,0,,0.0,,,,,24,AGO,2020/03/18
Angola,3/19/20,0,0,,,0,,0.0,,,,,24,AGO,2020/03/19
Angola,3/20/20,1,0,,,1,,0.0030426332554703197,,,,,24,AGO,2020/03/20
Angola,3/21/20,2,0,,,1,,0.006085266510940639,,,,,24,AGO,2020/03/21
Angola,3/22/20,2,0,,,0,,0.006085266510940639,,,,,24,AGO,2020/03/22
Angola,3/23/20,3,0,,,1,,0.009127899766410959,,,,,24,AGO,2020/03/23
Angola,3/24/20,3,0,,,0,,0.009127899766410959,,,,,24,AGO,2020/03/24
Angola,3/25/20,3,2,,,0,,0.009127899766410959,,,,,24,AGO,2020/03/25
Angola,3/26/20,4,2,,,1,,0.012170533021881279,,,,,24,AGO,2020/03/26
Angola,3/27/20,4,2,,,0,,0.012170533021881279,,,,,24,AGO,2020/03/27
Angola,3/28/20,5,2,,,1,,0.0152131662773516,,,,,24,AGO,2020/03/28
Angola,3/29/20,7,2,,,2,,0.02129843278829224,,,,,24,AGO,2020/03/29
Angola,3/30/20,7,2,,,0,,0.02129843278829224,,,,,24,AGO,2020/03/30
Angola,3/31/20,7,2,,,0,,0.02129843278829224,,,,,24,AGO,2020/03/31
Angola,4/1/20,8,2,,,1,,0.024341066043762558,,,,,24,AGO,2020/04/01
Angola,4/2/20,8,2,,,0,,0.024341066043762558,,,,,24,AGO,2020/04/02
Angola,4/3/20,8,2,,,0,,0.024341066043762558,,,,,24,AGO,2020/04/03
Angola,4/4/20,10,2,,,2,,0.0304263325547032,,,,,24,AGO,2020/04/04
Angola,4/5/20,14,2,,,4,,0.04259686557658448,,,,,24,AGO,2020/04/05
Angola,4/6/20,16,2,,,2,,0.048682132087525115,,,,,24,AGO,2020/04/06
Angola,4/7/20,17,2,,,1,,0.05172476534299544,,,,,24,AGO,2020/04/07
Angola,4/8/20,19,2,,,2,,0.05781003185393608,,,,,24,AGO,2020/04/08
Angola,4/9/20,19,2,,,0,,0.05781003185393608,,,,,24,AGO,2020/04/09
Angola,4/10/20,19,2,,,0,,0.05781003185393608,,,,,24,AGO,2020/04/10
Angola,4/11/20,19,2,,,0,,0.05781003185393608,,,,,24,AGO,2020/04/11
Angola,4/12/20,19,2,,,0,,0.05781003185393608,,,,,24,AGO,2020/04/12
Angola,4/13/20,19,2,,,0,,0.05781003185393608,,,,,24,AGO,2020/04/13
Angola,4/14/20,19,2,,,0,,0.05781003185393608,,,,,24,AGO,2020/04/14
Angola,4/15/20,19,2,,,0,,0.05781003185393608,,,,,24,AGO,2020/04/15
Angola,4/16/20,19,2,,,0,,0.05781003185393608,,,,,24,AGO,2020/04/16
Angola,4/17/20,19,2,,,0,,0.05781003185393608,,,,,24,AGO,2020/04/17
Angola,4/18/20,24,2,,,5,,0.07302319813128767,,,,,24,AGO,2020/04/18
Angola,4/19/20,24,2,,,0,,0.07302319813128767,,,,,24,AGO,2020/04/19
Angola,4/20/20,24,2,,,0,,0.07302319813128767,,,,,24,AGO,2020/04/20
Angola,4/21/20,24,2,,,0,,0.07302319813128767,,,,,24,AGO,2020/04/21
Angola,4/22/20,25,2,,,1,,0.076065831386758,,,,,24,AGO,2020/04/22
Angola,4/23/20,25,2,,,0,,0.076065831386758,,,,,24,AGO,2020/04/23
Angola,4/24/20,25,2,,,0,,0.076065831386758,,,,,24,AGO,2020/04/24
Angola,4/25/20,25,2,,,0,,0.076065831386758,,,,,24,AGO,2020/04/25
Angola,4/26/20,26,2,,,1,,0.07910846464222832,,,,,24,AGO,2020/04/26
Angola,4/27/20,27,2,,,1,,0.08215109789769864,,,,,24,AGO,2020/04/27
Angola,4/28/20,27,2,,,0,,0.08215109789769864,,,,,24,AGO,2020/04/28
Angola,4/29/20,27,2,,,0,,0.08215109789769864,,,,,24,AGO,2020/04/29
Angola,4/30/20,27,2,,,0,,0.08215109789769864,,,,,24,AGO,2020/04/30
Angola,5/1/20,30,2,,,3,,0.0912789976641096,,,,,24,AGO,2020/05/01
Angola,5/2/20,35,2,,,5,,0.1064921639414612,,,,,24,AGO,2020/05/02
Angola,5/3/20,35,2,,,0,,0.1064921639414612,,,,,24,AGO,2020/05/03
Angola,5/4/20,35,2,,,0,,0.1064921639414612,,,,,24,AGO,2020/05/04
Angola,5/5/20,36,2,,,1,,0.10953479719693152,,,,,24,AGO,2020/05/05
Angola,5/6/20,36,2,,,0,,0.10953479719693152,,,,,24,AGO,2020/05/06
Angola,5/7/20,36,2,,,0,,0.10953479719693152,,,,,24,AGO,2020/05/07
Angola,5/8/20,43,2,,,7,,0.13083322998522376,,,,,24,AGO,2020/05/08
Angola,5/9/20,43,2,,,0,,0.13083322998522376,,,,,24,AGO,2020/05/09
Angola,5/10/20,45,2,,,2,,0.1369184964961644,,,,,24,AGO,2020/05/10
Angola,5/11/20,45,2,,,0,,0.1369184964961644,,,,,24,AGO,2020/05/11
Angola,5/12/20,45,2,,,0,,0.1369184964961644,,,,,24,AGO,2020/05/12
Angola,5/13/20,45,2,,,0,,0.1369184964961644,,,,,24,AGO,2020/05/13
Angola,5/14/20,48,3,,,3,,0.14604639626257535,,,,,24,AGO,2020/05/14
Angola,5/15/20,48,3,,,0,,0.14604639626257535,,,,,24,AGO,2020/05/15
Angola,5/16/20,48,3,,,0,,0.14604639626257535,,,,,24,AGO,2020/05/16
Angola,5/17/20,48,3,,,0,,0.14604639626257535,,,,,24,AGO,2020/05/17
Angola,5/18/20,50,3,,,2,,0.152131662773516,,,,,24,AGO,2020/05/18
Angola,5/19/20,52,4,,,2,,0.15821692928445663,,,,,24,AGO,2020/05/19
Angola,5/20/20,52,4,,,0,,0.15821692928445663,,,,,24,AGO,2020/05/20
Angola,5/21/20,58,4,,,6,,0.17647272881727855,,,,,24,AGO,2020/05/21
Angola,5/22/20,60,4,,,2,,0.1825579953282192,,,,,24,AGO,2020/05/22
Angola,5/23/20,61,4,,,1,,0.1856006285836895,,,,,24,AGO,2020/05/23
Angola,5/24/20,69,4,,,8,,0.20994169462745207,,,,,24,AGO,2020/05/24
Angola,5/25/20,70,4,,,1,,0.2129843278829224,,,,,24,AGO,2020/05/25
Angola,5/26/20,70,4,,,0,,0.2129843278829224,,,,,24,AGO,2020/05/26
Angola,5/27/20,71,4,,,1,,0.2160269611383927,,,,,24,AGO,2020/05/27
Angola,5/28/20,74,4,,,3,,0.22515486090480366,,,,,24,AGO,2020/05/28
Angola,5/29/20,81,4,,,7,,0.2464532936930959,,,,,24,AGO,2020/05/29
Angola,5/30/20,84,4,,,3,,0.25558119345950686,,,,,24,AGO,2020/05/30
Angola,5/31/20,86,4,,,2,,0.2616664599704475,,,,,24,AGO,2020/05/31
Angola,6/1/20,86,4,,,0,,0.2616664599704475,,,,,24,AGO,2020/06/01
Angola,6/2/20,86,4,,,0,,0.2616664599704475,,,,,24,AGO,2020/06/02
Angola,6/3/20,86,4,,,0,,0.2616664599704475,,,,,24,AGO,2020/06/03
Angola,6/4/20,86,4,,,0,,0.2616664599704475,,,,,24,AGO,2020/06/04
Angola,6/5/20,86,4,,,0,,0.2616664599704475,,,,,24,AGO,2020/06/05
Angola,6/6/20,88,4,,,2,,0.2677517264813882,,,,,24,AGO,2020/06/06
Angola,6/7/20,91,5,,,3,,0.2768796262477991,,,,,24,AGO,2020/06/07
Angola,6/8/20,92,5,,,1,,0.27992225950326943,,,,,24,AGO,2020/06/08
Angola,6/9/20,96,0,,,4,,0.2920927925251507,,,,,24,AGO,2020/06/09
Angola,6/10/20,113,0,,,17,,0.34381755786814616,,,,,24,AGO,2020/06/10
Angola,6/11/20,118,0,,,5,,0.35903072414549775,,,,,24,AGO,2020/06/11
Angola,6/12/20,130,0,,,12,,0.3955423232111416,,,,,24,AGO,2020/06/12
Angola,6/13/20,138,0,,,8,,0.41988338925490415,,,,,24,AGO,2020/06/13
Antigua and Barbuda,1/22/20,0,0,,,0,,0.0,,,,,28,ATG,2020/01/22
Antigua and Barbuda,1/23/20,0,0,,,0,,0.0,,,,,28,ATG,2020/01/23
Antigua and Barbuda,1/24/20,0,0,,,0,,0.0,,,,,28,ATG,2020/01/24
Antigua and Barbuda,1/25/20,0,0,,,0,,0.0,,,,,28,ATG,2020/01/25
Antigua and Barbuda,1/26/20,0,0,,,0,,0.0,,,,,28,ATG,2020/01/26
Antigua and Barbuda,1/27/20,0,0,,,0,,0.0,,,,,28,ATG,2020/01/27
Antigua and Barbuda,1/28/20,0,0,,,0,,0.0,,,,,28,ATG,2020/01/28
Antigua and Barbuda,1/29/20,0,0,,,0,,0.0,,,,,28,ATG,2020/01/29
Antigua and Barbuda,1/30/20,0,0,,,0,,0.0,,,,,28,ATG,2020/01/30
Antigua and Barbuda,1/31/20,0,0,,,0,,0.0,,,,,28,ATG,2020/01/31
Antigua and Barbuda,2/1/20,0,0,,,0,,0.0,,,,,28,ATG,2020/02/01
Antigua and Barbuda,2/2/20,0,0,,,0,,0.0,,,,,28,ATG,2020/02/02
Antigua and Barbuda,2/3/20,0,0,,,0,,0.0,,,,,28,ATG,2020/02/03
Antigua and Barbuda,2/4/20,0,0,,,0,,0.0,,,,,28,ATG,2020/02/04
Antigua and Barbuda,2/5/20,0,0,,,0,,0.0,,,,,28,ATG,2020/02/05
Antigua and Barbuda,2/6/20,0,0,,,0,,0.0,,,,,28,ATG,2020/02/06
Antigua and Barbuda,2/7/20,0,0,,,0,,0.0,,,,,28,ATG,2020/02/07
Antigua and Barbuda,2/8/20,0,0,,,0,,0.0,,,,,28,ATG,2020/02/08
Antigua and Barbuda,2/9/20,0,0,,,0,,0.0,,,,,28,ATG,2020/02/09
Antigua and Barbuda,2/10/20,0,0,,,0,,0.0,,,,,28,ATG,2020/02/10
Antigua and Barbuda,2/11/20,0,0,,,0,,0.0,,,,,28,ATG,2020/02/11
Antigua and Barbuda,2/12/20,0,0,,,0,,0.0,,,,,28,ATG,2020/02/12
Antigua and Barbuda,2/13/20,0,0,,,0,,0.0,,,,,28,ATG,2020/02/13
Antigua and Barbuda,2/14/20,0,0,,,0,,0.0,,,,,28,ATG,2020/02/14
Antigua and Barbuda,2/15/20,0,0,,,0,,0.0,,,,,28,ATG,2020/02/15
Antigua and Barbuda,2/16/20,0,0,,,0,,0.0,,,,,28,ATG,2020/02/16
Antigua and Barbuda,2/17/20,0,0,,,0,,0.0,,,,,28,ATG,2020/02/17
Antigua and Barbuda,2/18/20,0,0,,,0,,0.0,,,,,28,ATG,2020/02/18
Antigua and Barbuda,2/19/20,0,0,,,0,,0.0,,,,,28,ATG,2020/02/19
Antigua and Barbuda,2/20/20,0,0,,,0,,0.0,,,,,28,ATG,2020/02/20
Antigua and Barbuda,2/21/20,0,0,,,0,,0.0,,,,,28,ATG,2020/02/21
Antigua and Barbuda,2/22/20,0,0,,,0,,0.0,,,,,28,ATG,2020/02/22
Antigua and Barbuda,2/23/20,0,0,,,0,,0.0,,,,,28,ATG,2020/02/23
Antigua and Barbuda,2/24/20,0,0,,,0,,0.0,,,,,28,ATG,2020/02/24
Antigua and Barbuda,2/25/20,0,0,,,0,,0.0,,,,,28,ATG,2020/02/25
Antigua and Barbuda,2/26/20,0,0,,,0,,0.0,,,,,28,ATG,2020/02/26
Antigua and Barbuda,2/27/20,0,0,,,0,,0.0,,,,,28,ATG,2020/02/27
Antigua and Barbuda,2/28/20,0,0,,,0,,0.0,,,,,28,ATG,2020/02/28
Antigua and Barbuda,2/29/20,0,0,,,0,,0.0,,,,,28,ATG,2020/02/29
Antigua and Barbuda,3/1/20,0,0,,,0,,0.0,,,,,28,ATG,2020/03/01
Antigua and Barbuda,3/2/20,0,0,,,0,,0.0,,,,,28,ATG,2020/03/02
Antigua and Barbuda,3/3/20,0,0,,,0,,0.0,,,,,28,ATG,2020/03/03
Antigua and Barbuda,3/4/20,0,0,,,0,,0.0,,,,,28,ATG,2020/03/04
Antigua and Barbuda,3/5/20,0,0,,,0,,0.0,,,,,28,ATG,2020/03/05
Antigua and Barbuda,3/6/20,0,0,,,0,,0.0,,,,,28,ATG,2020/03/06
Antigua and Barbuda,3/7/20,0,0,,,0,,0.0,,,,,28,ATG,2020/03/07
Antigua and Barbuda,3/8/20,0,0,,,0,,0.0,,,,,28,ATG,2020/03/08
Antigua and Barbuda,3/9/20,0,0,,,0,,0.0,,,,,28,ATG,2020/03/09
Antigua and Barbuda,3/10/20,0,0,,,0,,0.0,,,,,28,ATG,2020/03/10
Antigua and Barbuda,3/11/20,0,0,,,0,,0.0,,,,,28,ATG,2020/03/11
Antigua and Barbuda,3/12/20,0,0,,,0,,0.0,,,,,28,ATG,2020/03/12
Antigua and Barbuda,3/13/20,1,0,,,1,,1.0211584020913325,,,,,28,ATG,2020/03/13
Antigua and Barbuda,3/14/20,1,0,,,0,,1.0211584020913325,,,,,28,ATG,2020/03/14
Antigua and Barbuda,3/15/20,1,0,,,0,,1.0211584020913325,,,,,28,ATG,2020/03/15
Antigua and Barbuda,3/16/20,1,0,,,0,,1.0211584020913325,,,,,28,ATG,2020/03/16
Antigua and Barbuda,3/17/20,1,0,,,0,,1.0211584020913325,,,,,28,ATG,2020/03/17
Antigua and Barbuda,3/18/20,1,0,,,0,,1.0211584020913325,,,,,28,ATG,2020/03/18
Antigua and Barbuda,3/19/20,1,0,,,0,,1.0211584020913325,,,,,28,ATG,2020/03/19
Antigua and Barbuda,3/20/20,1,0,,,0,,1.0211584020913325,,,,,28,ATG,2020/03/20
Antigua and Barbuda,3/21/20,1,0,,,0,,1.0211584020913325,,,,,28,ATG,2020/03/21
Antigua and Barbuda,3/22/20,1,0,,,0,,1.0211584020913325,,,,,28,ATG,2020/03/22
Antigua and Barbuda,3/23/20,3,0,,,2,,3.0634752062739974,,,,,28,ATG,2020/03/23
Antigua and Barbuda,3/24/20,3,0,,,0,,3.0634752062739974,,,,,28,ATG,2020/03/24
Antigua and Barbuda,3/25/20,3,0,,,0,,3.0634752062739974,,,,,28,ATG,2020/03/25
Antigua and Barbuda,3/26/20,7,0,,,4,,7.148108814639327,,,,,28,ATG,2020/03/26
Antigua and Barbuda,3/27/20,7,0,,,0,,7.148108814639327,,,,,28,ATG,2020/03/27
Antigua and Barbuda,3/28/20,7,0,,,0,,7.148108814639327,,,,,28,ATG,2020/03/28
Antigua and Barbuda,3/29/20,7,0,,,0,,7.148108814639327,,,,,28,ATG,2020/03/29
Antigua and Barbuda,3/30/20,7,0,,,0,,7.148108814639327,,,,,28,ATG,2020/03/30
Antigua and Barbuda,3/31/20,7,0,,,0,,7.148108814639327,,,,,28,ATG,2020/03/31
Antigua and Barbuda,4/1/20,7,0,,,0,,7.148108814639327,,,,,28,ATG,2020/04/01
Antigua and Barbuda,4/2/20,9,1,,,2,,9.190425618821992,,,,,28,ATG,2020/04/02
Antigua and Barbuda,4/3/20,15,2,,,6,,15.317376031369987,,,,,28,ATG,2020/04/03
Antigua and Barbuda,4/4/20,15,2,,,0,,15.317376031369987,,,,,28,ATG,2020/04/04
Antigua and Barbuda,4/5/20,15,2,,,0,,15.317376031369987,,,,,28,ATG,2020/04/05
Antigua and Barbuda,4/6/20,15,2,,,0,,15.317376031369987,,,,,28,ATG,2020/04/06
Antigua and Barbuda,4/7/20,19,2,,,4,,19.402009639735315,,,,,28,ATG,2020/04/07
Antigua and Barbuda,4/8/20,19,2,,,0,,19.402009639735315,,,,,28,ATG,2020/04/08
Antigua and Barbuda,4/9/20,19,2,,,0,,19.402009639735315,,,,,28,ATG,2020/04/09
Antigua and Barbuda,4/10/20,19,2,,,0,,19.402009639735315,,,,,28,ATG,2020/04/10
Antigua and Barbuda,4/11/20,21,3,,,2,,21.44432644391798,,,,,28,ATG,2020/04/11
Antigua and Barbuda,4/12/20,21,3,,,0,,21.44432644391798,,,,,28,ATG,2020/04/12
Antigua and Barbuda,4/13/20,23,3,,,2,,23.486643248100645,,,,,28,ATG,2020/04/13
Antigua and Barbuda,4/14/20,23,3,,,0,,23.486643248100645,,,,,28,ATG,2020/04/14
Antigua and Barbuda,4/15/20,23,3,,,0,,23.486643248100645,,,,,28,ATG,2020/04/15
Antigua and Barbuda,4/16/20,23,3,,,0,,23.486643248100645,,,,,28,ATG,2020/04/16
Antigua and Barbuda,4/17/20,23,3,,,0,,23.486643248100645,,,,,28,ATG,2020/04/17
Antigua and Barbuda,4/18/20,23,3,,,0,,23.486643248100645,,,,,28,ATG,2020/04/18
Antigua and Barbuda,4/19/20,23,3,,,0,,23.486643248100645,,,,,28,ATG,2020/04/19
Antigua and Barbuda,4/20/20,23,3,,,0,,23.486643248100645,,,,,28,ATG,2020/04/20
Antigua and Barbuda,4/21/20,23,3,,,0,,23.486643248100645,,,,,28,ATG,2020/04/21
Antigua and Barbuda,4/22/20,24,3,,,1,,24.50780165019198,,,,,28,ATG,2020/04/22
Antigua and Barbuda,4/23/20,24,3,,,0,,24.50780165019198,,,,,28,ATG,2020/04/23
Antigua and Barbuda,4/24/20,24,3,,,0,,24.50780165019198,,,,,28,ATG,2020/04/24
Antigua and Barbuda,4/25/20,24,3,,,0,,24.50780165019198,,,,,28,ATG,2020/04/25
Antigua and Barbuda,4/26/20,24,3,,,0,,24.50780165019198,,,,,28,ATG,2020/04/26
Antigua and Barbuda,4/27/20,24,3,,,0,,24.50780165019198,,,,,28,ATG,2020/04/27
Antigua and Barbuda,4/28/20,24,3,,,0,,24.50780165019198,,,,,28,ATG,2020/04/28
Antigua and Barbuda,4/29/20,24,3,,,0,,24.50780165019198,,,,,28,ATG,2020/04/29
Antigua and Barbuda,4/30/20,24,3,,,0,,24.50780165019198,,,,,28,ATG,2020/04/30
Antigua and Barbuda,5/1/20,25,3,,,1,,25.52896005228331,,,,,28,ATG,2020/05/01
Antigua and Barbuda,5/2/20,25,3,,,0,,25.52896005228331,,,,,28,ATG,2020/05/02
Antigua and Barbuda,5/3/20,25,3,,,0,,25.52896005228331,,,,,28,ATG,2020/05/03
Antigua and Barbuda,5/4/20,25,3,,,0,,25.52896005228331,,,,,28,ATG,2020/05/04
Antigua and Barbuda,5/5/20,25,3,,,0,,25.52896005228331,,,,,28,ATG,2020/05/05
Antigua and Barbuda,5/6/20,25,3,,,0,,25.52896005228331,,,,,28,ATG,2020/05/06
Antigua and Barbuda,5/7/20,25,3,,,0,,25.52896005228331,,,,,28,ATG,2020/05/07
Antigua and Barbuda,5/8/20,25,3,,,0,,25.52896005228331,,,,,28,ATG,2020/05/08
Antigua and Barbuda,5/9/20,25,3,,,0,,25.52896005228331,,,,,28,ATG,2020/05/09
Antigua and Barbuda,5/10/20,25,3,,,0,,25.52896005228331,,,,,28,ATG,2020/05/10
Antigua and Barbuda,5/11/20,25,3,,,0,,25.52896005228331,,,,,28,ATG,2020/05/11
Antigua and Barbuda,5/12/20,25,3,,,0,,25.52896005228331,,,,,28,ATG,2020/05/12
Antigua and Barbuda,5/13/20,25,3,,,0,,25.52896005228331,,,,,28,ATG,2020/05/13
Antigua and Barbuda,5/14/20,25,3,,,0,,25.52896005228331,,,,,28,ATG,2020/05/14
Antigua and Barbuda,5/15/20,25,3,,,0,,25.52896005228331,,,,,28,ATG,2020/05/15
Antigua and Barbuda,5/16/20,25,3,,,0,,25.52896005228331,,,,,28,ATG,2020/05/16
Antigua and Barbuda,5/17/20,25,3,,,0,,25.52896005228331,,,,,28,ATG,2020/05/17
Antigua and Barbuda,5/18/20,25,3,,,0,,25.52896005228331,,,,,28,ATG,2020/05/18
Antigua and Barbuda,5/19/20,25,3,,,0,,25.52896005228331,,,,,28,ATG,2020/05/19
Antigua and Barbuda,5/20/20,25,3,,,0,,25.52896005228331,,,,,28,ATG,2020/05/20
Antigua and Barbuda,5/21/20,25,3,,,0,,25.52896005228331,,,,,28,ATG,2020/05/21
Antigua and Barbuda,5/22/20,25,3,,,0,,25.52896005228331,,,,,28,ATG,2020/05/22
Antigua and Barbuda,5/23/20,25,3,,,0,,25.52896005228331,,,,,28,ATG,2020/05/23
Antigua and Barbuda,5/24/20,25,3,,,0,,25.52896005228331,,,,,28,ATG,2020/05/24
Antigua and Barbuda,5/25/20,25,3,,,0,,25.52896005228331,,,,,28,ATG,2020/05/25
Antigua and Barbuda,5/26/20,25,3,,,0,,25.52896005228331,,,,,28,ATG,2020/05/26
Antigua and Barbuda,5/27/20,25,3,,,0,,25.52896005228331,,,,,28,ATG,2020/05/27
Antigua and Barbuda,5/28/20,25,3,,,0,,25.52896005228331,,,,,28,ATG,2020/05/28
Antigua and Barbuda,5/29/20,25,3,,,0,,25.52896005228331,,,,,28,ATG,2020/05/29
Antigua and Barbuda,5/30/20,25,3,,,0,,25.52896005228331,,,,,28,ATG,2020/05/30
Antigua and Barbuda,5/31/20,26,3,,,1,,26.550118454374644,,,,,28,ATG,2020/05/31
Antigua and Barbuda,6/1/20,26,3,,,0,,26.550118454374644,,,,,28,ATG,2020/06/01
Antigua and Barbuda,6/2/20,26,3,,,0,,26.550118454374644,,,,,28,ATG,2020/06/02
Antigua and Barbuda,6/3/20,26,3,,,0,,26.550118454374644,,,,,28,ATG,2020/06/03
Antigua and Barbuda,6/4/20,26,3,,,0,,26.550118454374644,,,,,28,ATG,2020/06/04
Antigua and Barbuda,6/5/20,26,3,,,0,,26.550118454374644,,,,,28,ATG,2020/06/05
Antigua and Barbuda,6/6/20,26,3,,,0,,26.550118454374644,,,,,28,ATG,2020/06/06
Antigua and Barbuda,6/7/20,26,3,,,0,,26.550118454374644,,,,,28,ATG,2020/06/07
Antigua and Barbuda,6/8/20,26,0,,,0,,26.550118454374644,,,,,28,ATG,2020/06/08
Antigua and Barbuda,6/9/20,26,0,,,0,,26.550118454374644,,,,,28,ATG,2020/06/09
Antigua and Barbuda,6/10/20,26,0,,,0,,26.550118454374644,,,,,28,ATG,2020/06/10
Antigua and Barbuda,6/11/20,26,0,,,0,,26.550118454374644,,,,,28,ATG,2020/06/11
Antigua and Barbuda,6/12/20,26,0,,,0,,26.550118454374644,,,,,28,ATG,2020/06/12
Antigua and Barbuda,6/13/20,26,0,,,0,,26.550118454374644,,,,,28,ATG,2020/06/13
Argentina,1/22/20,0,0,,,0,,0.0,,,,,32,ARG,2020/01/22
Argentina,1/23/20,0,0,,,0,,0.0,,,,,32,ARG,2020/01/23
Argentina,1/24/20,0,0,,,0,,0.0,,,,,32,ARG,2020/01/24
Argentina,1/25/20,0,0,,,0,,0.0,,,,,32,ARG,2020/01/25
Argentina,1/26/20,0,0,,,0,,0.0,,,,,32,ARG,2020/01/26
Argentina,1/27/20,0,0,,,0,,0.0,,,,,32,ARG,2020/01/27
Argentina,1/28/20,0,0,,,0,,0.0,,,,,32,ARG,2020/01/28
Argentina,1/29/20,0,0,,,0,,0.0,,,,,32,ARG,2020/01/29
Argentina,1/30/20,0,0,,,0,,0.0,,,,,32,ARG,2020/01/30
Argentina,1/31/20,0,0,,,0,,0.0,,,,,32,ARG,2020/01/31
Argentina,2/1/20,0,0,,,0,,0.0,,,,,32,ARG,2020/02/01
Argentina,2/2/20,0,0,,,0,,0.0,,,,,32,ARG,2020/02/02
Argentina,2/3/20,0,0,,,0,,0.0,,,,,32,ARG,2020/02/03
Argentina,2/4/20,0,0,,,0,,0.0,,,,,32,ARG,2020/02/04
Argentina,2/5/20,0,0,,,0,,0.0,,,,,32,ARG,2020/02/05
Argentina,2/6/20,0,0,,,0,,0.0,,,,,32,ARG,2020/02/06
Argentina,2/7/20,0,0,,,0,,0.0,,,,,32,ARG,2020/02/07
Argentina,2/8/20,0,0,,,0,,0.0,,,,,32,ARG,2020/02/08
Argentina,2/9/20,0,0,,,0,,0.0,,,,,32,ARG,2020/02/09
Argentina,2/10/20,0,0,,,0,,0.0,,,,,32,ARG,2020/02/10
Argentina,2/11/20,0,0,,,0,,0.0,,,,,32,ARG,2020/02/11
Argentina,2/12/20,0,0,,,0,,0.0,,,,,32,ARG,2020/02/12
Argentina,2/13/20,0,0,,,0,,0.0,,,,,32,ARG,2020/02/13
Argentina,2/14/20,0,0,,,0,,0.0,,,,,32,ARG,2020/02/14
Argentina,2/15/20,0,0,,,0,,0.0,,,,,32,ARG,2020/02/15
Argentina,2/16/20,0,0,,,0,,0.0,,,,,32,ARG,2020/02/16
Argentina,2/17/20,0,0,,,0,,0.0,,,,,32,ARG,2020/02/17
Argentina,2/18/20,0,0,,,0,,0.0,,,,,32,ARG,2020/02/18
Argentina,2/19/20,0,0,,,0,,0.0,,,,,32,ARG,2020/02/19
Argentina,2/20/20,0,0,,,0,,0.0,,,,,32,ARG,2020/02/20
Argentina,2/21/20,0,0,,,0,,0.0,,,,,32,ARG,2020/02/21
Argentina,2/22/20,0,0,,,0,,0.0,,,,,32,ARG,2020/02/22
Argentina,2/23/20,0,0,,,0,,0.0,,,,,32,ARG,2020/02/23
Argentina,2/24/20,0,0,,,0,,0.0,,,,,32,ARG,2020/02/24
Argentina,2/25/20,0,0,,,0,,0.0,,,,,32,ARG,2020/02/25
Argentina,2/26/20,0,0,,,0,,0.0,,,,,32,ARG,2020/02/26
Argentina,2/27/20,0,0,,,0,,0.0,,,,,32,ARG,2020/02/27
Argentina,2/28/20,0,0,,,0,,0.0,,,,,32,ARG,2020/02/28
Argentina,2/29/20,0,0,,,0,,0.0,,,,,32,ARG,2020/02/29
Argentina,3/1/20,0,0,,,0,,0.0,,,,,32,ARG,2020/03/01
Argentina,3/2/20,0,1,,,0,,0.0,,,,,32,ARG,2020/03/02
Argentina,3/3/20,1,1,,,1,,0.002212596101622503,,,,,32,ARG,2020/03/03
Argentina,3/4/20,1,1,,,0,,0.002212596101622503,,,,,32,ARG,2020/03/04
Argentina,3/5/20,1,1,,,0,,0.002212596101622503,,,,,32,ARG,2020/03/05
Argentina,3/6/20,2,1,,,1,,0.004425192203245006,,,,,32,ARG,2020/03/06
Argentina,3/7/20,8,2,,,6,,0.017700768812980026,,,,,32,ARG,2020/03/07
Argentina,3/8/20,12,2,,,4,,0.02655115321947004,,,,,32,ARG,2020/03/08
Argentina,3/9/20,12,2,,,0,,0.02655115321947004,,,,,32,ARG,2020/03/09
Argentina,3/10/20,17,2,,,5,,0.03761413372758256,,,,,32,ARG,2020/03/10
Argentina,3/11/20,19,2,,,2,,0.04203932593082756,,,,,32,ARG,2020/03/11
Argentina,3/12/20,19,2,,,0,,0.04203932593082756,,,,,32,ARG,2020/03/12
Argentina,3/13/20,31,3,,,12,,0.0685904791502976,,,,,32,ARG,2020/03/13
Argentina,3/14/20,34,3,,,3,,0.07522826745516512,,,,,32,ARG,2020/03/14
Argentina,3/15/20,45,4,,,11,,0.09956682457301265,,,,,32,ARG,2020/03/15
Argentina,3/16/20,56,4,,,11,,0.12390538169086018,,,,,32,ARG,2020/03/16
Argentina,3/17/20,68,4,,,12,,0.15045653491033023,,,,,32,ARG,2020/03/17
Argentina,3/18/20,79,6,,,11,,0.17479509202817778,,,,,32,ARG,2020/03/18
Argentina,3/19/20,97,8,,,18,,0.21462182185738282,,,,,32,ARG,2020/03/19
Argentina,3/20/20,128,9,,,31,,0.2832123010076804,,,,,32,ARG,2020/03/20
Argentina,3/21/20,158,13,,,30,,0.34959018405635556,,,,,32,ARG,2020/03/21
Argentina,3/22/20,266,18,,,108,,0.5885505630315859,,,,,32,ARG,2020/03/22
Argentina,3/23/20,301,19,,,35,,0.6659914265883735,,,,,32,ARG,2020/03/23
Argentina,3/24/20,387,23,,,86,,0.8562746913279088,,,,,32,ARG,2020/03/24
Argentina,3/25/20,387,27,,,0,,0.8562746913279088,,,,,32,ARG,2020/03/25
Argentina,3/26/20,502,28,,,115,,1.1107232430144967,,,,,32,ARG,2020/03/26
Argentina,3/27/20,589,36,,,87,,1.3032191038556544,,,,,32,ARG,2020/03/27
Argentina,3/28/20,690,39,,,101,,1.5266913101195274,,,,,32,ARG,2020/03/28
Argentina,3/29/20,745,43,,,55,,1.648384095708765,,,,,32,ARG,2020/03/29
Argentina,3/30/20,820,44,,,75,,1.8143288033304528,,,,,32,ARG,2020/03/30
Argentina,3/31/20,1054,48,,,234,,2.3320762911101185,,,,,32,ARG,2020/03/31
Argentina,4/1/20,1054,56,,,0,,2.3320762911101185,,,,,32,ARG,2020/04/01
Argentina,4/2/20,1133,63,,,79,,2.5068713831382965,,,,,32,ARG,2020/04/02
Argentina,4/3/20,1265,72,,,132,,2.798934068552467,,,,,32,ARG,2020/04/03
Argentina,4/4/20,1451,82,,,186,,3.2104769434542524,,,,,32,ARG,2020/04/04
Argentina,4/5/20,1451,83,,,0,,3.2104769434542524,,,,,32,ARG,2020/04/05
Argentina,4/6/20,1554,90,,,103,,3.4383743419213704,,,,,32,ARG,2020/04/06
Argentina,4/7/20,1628,97,,,74,,3.6021064534414355,,,,,32,ARG,2020/04/07
Argentina,4/8/20,1715,102,,,87,,3.794602314282593,,,,,32,ARG,2020/04/08
Argentina,4/9/20,1795,111,,,80,,3.9716100024123935,,,,,32,ARG,2020/04/09
Argentina,4/10/20,1975,115,,,180,,4.369877300704444,,,,,32,ARG,2020/04/10
Argentina,4/11/20,1975,123,,,0,,4.369877300704444,,,,,32,ARG,2020/04/11
Argentina,4/12/20,2142,129,,,167,,4.739380849675403,,,,,32,ARG,2020/04/12
Argentina,4/13/20,2208,132,,,66,,4.885412192382487,,,,,32,ARG,2020/04/13
Argentina,4/14/20,2277,136,,,69,,5.03808132339444,,,,,32,ARG,2020/04/14
Argentina,4/15/20,2443,147,,,166,,5.405372276263776,,,,,32,ARG,2020/04/15
Argentina,4/16/20,2571,152,,,128,,5.688584577271456,,,,,32,ARG,2020/04/16
Argentina,4/17/20,2669,165,,,98,,5.905418995230462,,,,,32,ARG,2020/04/17
Argentina,4/18/20,2758,176,,,89,,6.102340048274864,,,,,32,ARG,2020/04/18
Argentina,4/19/20,2839,185,,,81,,6.281560332506287,,,,,32,ARG,2020/04/19
Argentina,4/20/20,2941,192,,,102,,6.507245134871782,,,,,32,ARG,2020/04/20
Argentina,4/21/20,3031,197,,,90,,6.706378784017808,,,,,32,ARG,2020/04/21
Argentina,4/22/20,3144,207,,,113,,6.95640214350115,,,,,32,ARG,2020/04/22
Argentina,4/23/20,3435,214,,,291,,7.600267609073299,,,,,32,ARG,2020/04/23
Argentina,4/24/20,3607,218,,,172,,7.980834138552369,,,,,32,ARG,2020/04/24
Argentina,4/25/20,3780,225,,,173,,8.363613264133063,,,,,32,ARG,2020/04/25
Argentina,4/26/20,3892,237,,,112,,8.611424027514783,,,,,32,ARG,2020/04/26
Argentina,4/27/20,4003,246,,,111,,8.857022194794881,,,,,32,ARG,2020/04/27
Argentina,4/28/20,4127,260,,,124,,9.131384111396072,,,,,32,ARG,2020/04/28
Argentina,4/29/20,4285,264,,,158,,9.480974295452427,,,,,32,ARG,2020/04/29
Argentina,4/30/20,4428,273,,,143,,9.797375537984445,,,,,32,ARG,2020/04/30
Argentina,5/1/20,4532,282,,,104,,10.027485532553186,,,,,32,ARG,2020/05/01
Argentina,5/2/20,4681,293,,,149,,10.357162351694939,,,,,32,ARG,2020/05/02
Argentina,5/3/20,4783,300,,,102,,10.582847154060433,,,,,32,ARG,2020/05/03
Argentina,5/4/20,4887,305,,,104,,10.812957148629174,,,,,32,ARG,2020/05/04
Argentina,5/5/20,5020,314,,,133,,11.107232430144967,,,,,32,ARG,2020/05/05
Argentina,5/6/20,5208,319,,,188,,11.523200497249997,,,,,32,ARG,2020/05/06
Argentina,5/7/20,5371,329,,,163,,11.883853661814465,,,,,32,ARG,2020/05/07
Argentina,5/8/20,5611,353,,,240,,12.414876726203866,,,,,32,ARG,2020/05/08
Argentina,5/9/20,5776,356,,,165,,12.77995508297158,,,,,32,ARG,2020/05/09
Argentina,5/10/20,6034,363,,,258,,13.350804877190185,,,,,32,ARG,2020/05/10
Argentina,5/11/20,6278,373,,,244,,13.890678325986077,,,,,32,ARG,2020/05/11
Argentina,5/12/20,6563,382,,,285,,14.52126821494849,,,,,32,ARG,2020/05/12
Argentina,5/13/20,6879,393,,,316,,15.2204485830612,,,,,32,ARG,2020/05/13
Argentina,5/14/20,7134,403,,,255,,15.784660588974939,,,,,32,ARG,2020/05/14
Argentina,5/15/20,7479,416,,,345,,16.548006244034703,,,,,32,ARG,2020/05/15
Argentina,5/16/20,7805,433,,,326,,17.26931257316364,,,,,32,ARG,2020/05/16
Argentina,5/17/20,8068,445,,,263,,17.851225347890356,,,,,32,ARG,2020/05/17
Argentina,5/18/20,8371,452,,,303,,18.521641966681976,,,,,32,ARG,2020/05/18
Argentina,5/19/20,8809,467,,,438,,19.490759059192634,,,,,32,ARG,2020/05/19
Argentina,5/20/20,9283,484,,,474,,20.539529611361697,,,,,32,ARG,2020/05/20
Argentina,5/21/20,9931,500,,,648,,21.97329188521308,,,,,32,ARG,2020/05/21
Argentina,5/22/20,10649,508,,,718,,23.561935886178038,,,,,32,ARG,2020/05/22
Argentina,5/23/20,11353,520,,,704,,25.11960354172028,,,,,32,ARG,2020/05/23
Argentina,5/24/20,12076,528,,,723,,26.71931052319335,,,,,32,ARG,2020/05/24
Argentina,5/25/20,12628,539,,,552,,27.940663571288972,,,,,32,ARG,2020/05/25
Argentina,5/26/20,13228,556,,,600,,29.268221232262473,,,,,32,ARG,2020/05/26
Argentina,5/27/20,13933,569,,,705,,30.82810148390634,,,,,32,ARG,2020/05/27
Argentina,5/28/20,14702,583,,,769,,32.529587886054045,,,,,32,ARG,2020/05/28
Argentina,5/29/20,15419,608,,,717,,34.11601929091738,,,,,32,ARG,2020/05/29
Argentina,5/30/20,16214,632,,,795,,35.87503319170727,,,,,32,ARG,2020/05/30
Argentina,5/31/20,16851,648,,,637,,37.2844569084408,,,,,32,ARG,2020/05/31
Argentina,6/1/20,17415,664,,,564,,38.5323611097559,,,,,32,ARG,2020/06/01
Argentina,6/2/20,18319,693,,,904,,40.53254798562264,,,,,32,ARG,2020/06/02
Argentina,6/3/20,19268,717,,,949,,42.6323016860624,,,,,32,ARG,2020/06/03
Argentina,6/4/20,20197,735,,,929,,44.6878034644697,,,,,32,ARG,2020/06/04
Argentina,6/5/20,21037,765,,,840,,46.5463841898326,,,,,32,ARG,2020/06/05
Argentina,6/6/20,22020,785,,,983,,48.72136615772752,,,,,32,ARG,2020/06/06
Argentina,6/7/20,22794,0,,,774,,50.43391554038334,,,,,32,ARG,2020/06/07
Argentina,6/8/20,23620,0,,,826,,52.26151992032353,,,,,32,ARG,2020/06/08
Argentina,6/9/20,24761,0,,,1141,,54.786092072274805,,,,,32,ARG,2020/06/09
Argentina,6/10/20,25987,0,,,1226,,57.49873489286399,,,,,32,ARG,2020/06/10
Argentina,6/11/20,27373,0,,,1386,,60.565393089712785,,,,,32,ARG,2020/06/11
Argentina,6/12/20,28764,0,,,1391,,63.643114267069684,,,,,32,ARG,2020/06/12
Argentina,6/13/20,30295,0,,,1531,,67.03059889865374,,,,,32,ARG,2020/06/13
Armenia,1/22/20,0,0,,,0,,0.0,,,,,51,ARM,2020/01/22
Armenia,1/23/20,0,0,,,0,,0.0,,,,,51,ARM,2020/01/23
Armenia,1/24/20,0,0,,,0,,0.0,,,,,51,ARM,2020/01/24
Armenia,1/25/20,0,0,,,0,,0.0,,,,,51,ARM,2020/01/25
Armenia,1/26/20,0,0,,,0,,0.0,,,,,51,ARM,2020/01/26
Armenia,1/27/20,0,0,,,0,,0.0,,,,,51,ARM,2020/01/27
Armenia,1/28/20,0,0,,,0,,0.0,,,,,51,ARM,2020/01/28
Armenia,1/29/20,0,0,,,0,,0.0,,,,,51,ARM,2020/01/29
Armenia,1/30/20,0,0,,,0,,0.0,,,,,51,ARM,2020/01/30
Armenia,1/31/20,0,0,,,0,,0.0,,,,,51,ARM,2020/01/31
Armenia,2/1/20,0,0,,,0,,0.0,,,,,51,ARM,2020/02/01
Armenia,2/2/20,0,0,,,0,,0.0,,,,,51,ARM,2020/02/02
Armenia,2/3/20,0,0,,,0,,0.0,,,,,51,ARM,2020/02/03
Armenia,2/4/20,0,0,,,0,,0.0,,,,,51,ARM,2020/02/04
Armenia,2/5/20,0,0,,,0,,0.0,,,,,51,ARM,2020/02/05
Armenia,2/6/20,0,0,,,0,,0.0,,,,,51,ARM,2020/02/06
Armenia,2/7/20,0,0,,,0,,0.0,,,,,51,ARM,2020/02/07
Armenia,2/8/20,0,0,,,0,,0.0,,,,,51,ARM,2020/02/08
Armenia,2/9/20,0,0,,,0,,0.0,,,,,51,ARM,2020/02/09
Armenia,2/10/20,0,0,,,0,,0.0,,,,,51,ARM,2020/02/10
Armenia,2/11/20,0,0,,,0,,0.0,,,,,51,ARM,2020/02/11
Armenia,2/12/20,0,0,,,0,,0.0,,,,,51,ARM,2020/02/12
Armenia,2/13/20,0,0,,,0,,0.0,,,,,51,ARM,2020/02/13
Armenia,2/14/20,0,0,,,0,,0.0,,,,,51,ARM,2020/02/14
Armenia,2/15/20,0,0,,,0,,0.0,,,,,51,ARM,2020/02/15
Armenia,2/16/20,0,0,,,0,,0.0,,,,,51,ARM,2020/02/16
Armenia,2/17/20,0,0,,,0,,0.0,,,,,51,ARM,2020/02/17
Armenia,2/18/20,0,0,,,0,,0.0,,,,,51,ARM,2020/02/18
Armenia,2/19/20,0,0,,,0,,0.0,,,,,51,ARM,2020/02/19
Armenia,2/20/20,0,0,,,0,,0.0,,,,,51,ARM,2020/02/20
Armenia,2/21/20,0,0,,,0,,0.0,,,,,51,ARM,2020/02/21
Armenia,2/22/20,0,0,,,0,,0.0,,,,,51,ARM,2020/02/22
Armenia,2/23/20,0,0,,,0,,0.0,,,,,51,ARM,2020/02/23
Armenia,2/24/20,0,0,,,0,,0.0,,,,,51,ARM,2020/02/24
Armenia,2/25/20,0,0,,,0,,0.0,,,,,51,ARM,2020/02/25
Armenia,2/26/20,0,0,,,0,,0.0,,,,,51,ARM,2020/02/26
Armenia,2/27/20,0,0,,,0,,0.0,,,,,51,ARM,2020/02/27
Armenia,2/28/20,0,0,,,0,,0.0,,,,,51,ARM,2020/02/28
Armenia,2/29/20,0,0,,,0,,0.0,,,,,51,ARM,2020/02/29
Armenia,3/1/20,1,0,,,1,,0.03374691300113322,,,,,51,ARM,2020/03/01
Armenia,3/2/20,1,0,,,0,,0.03374691300113322,,,,,51,ARM,2020/03/02
Armenia,3/3/20,1,0,,,0,,0.03374691300113322,,,,,51,ARM,2020/03/03
Armenia,3/4/20,1,0,,,0,,0.03374691300113322,,,,,51,ARM,2020/03/04
Armenia,3/5/20,1,0,,,0,,0.03374691300113322,,,,,51,ARM,2020/03/05
Armenia,3/6/20,1,0,,,0,,0.03374691300113322,,,,,51,ARM,2020/03/06
Armenia,3/7/20,1,0,,,0,,0.03374691300113322,,,,,51,ARM,2020/03/07
Armenia,3/8/20,1,0,,,0,,0.03374691300113322,,,,,51,ARM,2020/03/08
Armenia,3/9/20,1,0,,,0,,0.03374691300113322,,,,,51,ARM,2020/03/09
Armenia,3/10/20,1,0,,,0,,0.03374691300113322,,,,,51,ARM,2020/03/10
Armenia,3/11/20,1,0,,,0,,0.03374691300113322,,,,,51,ARM,2020/03/11
Armenia,3/12/20,4,0,,,3,,0.1349876520045329,,,,,51,ARM,2020/03/12
Armenia,3/13/20,8,0,,,4,,0.2699753040090658,,,,,51,ARM,2020/03/13
Armenia,3/14/20,18,0,,,10,,0.6074444340203979,,,,,51,ARM,2020/03/14
Armenia,3/15/20,26,0,,,8,,0.8774197380294637,,,,,51,ARM,2020/03/15
Armenia,3/16/20,52,0,,,26,,1.7548394760589274,,,,,51,ARM,2020/03/16
Armenia,3/17/20,78,0,,,26,,2.6322592140883914,,,,,51,ARM,2020/03/17
Armenia,3/18/20,84,0,,,6,,2.8347406920951905,,,,,51,ARM,2020/03/18
Armenia,3/19/20,115,1,,,31,,3.8808949951303204,,,,,51,ARM,2020/03/19
Armenia,3/20/20,136,1,,,21,,4.589580168154118,,,,,51,ARM,2020/03/20
Armenia,3/21/20,160,1,,,24,,5.3995060801813155,,,,,51,ARM,2020/03/21
Armenia,3/22/20,194,3,,,34,,6.546901122219845,,,,,51,ARM,2020/03/22
Armenia,3/23/20,235,3,,,41,,7.930524555266307,,,,,51,ARM,2020/03/23
Armenia,3/24/20,249,3,,,14,,8.402981337282172,,,,,51,ARM,2020/03/24
Armenia,3/25/20,265,4,,,16,,8.942931945300304,,,,,51,ARM,2020/03/25
Armenia,3/26/20,290,7,,,25,,9.786604770328633,,,,,51,ARM,2020/03/26
Armenia,3/27/20,329,7,,,39,,11.10273437737283,,,,,51,ARM,2020/03/27
Armenia,3/28/20,407,7,,,78,,13.73499359146122,,,,,51,ARM,2020/03/28
Armenia,3/29/20,424,7,,,17,,14.308691112480485,,,,,51,ARM,2020/03/29
Armenia,3/30/20,482,8,,,58,,16.266012066546214,,,,,51,ARM,2020/03/30
Armenia,3/31/20,532,8,,,50,,17.953357716602873,,,,,51,ARM,2020/03/31
Armenia,4/1/20,571,9,,,39,,19.26948732364707,,,,,51,ARM,2020/04/01
Armenia,4/2/20,663,10,,,92,,22.374203319751327,,,,,51,ARM,2020/04/02
Armenia,4/3/20,736,12,,,73,,24.837727968834052,,,,,51,ARM,2020/04/03
Armenia,4/4/20,770,13,,,34,,25.98512301087258,,,,,51,ARM,2020/04/04
Armenia,4/5/20,822,13,,,52,,27.739962486931507,,,,,51,ARM,2020/04/05
Armenia,4/6/20,833,14,,,11,,28.111178529943974,,,,,51,ARM,2020/04/06
Armenia,4/7/20,853,16,,,20,,28.786116789966638,,,,,51,ARM,2020/04/07
Armenia,4/8/20,881,17,,,28,,29.731030353998367,,,,,51,ARM,2020/04/08
Armenia,4/9/20,921,18,,,40,,31.0809068740437,,,,,51,ARM,2020/04/09
Armenia,4/10/20,937,19,,,16,,31.62085748206183,,,,,51,ARM,2020/04/10
Armenia,4/11/20,967,20,,,30,,32.63326487209582,,,,,51,ARM,2020/04/11
Armenia,4/12/20,1013,20,,,46,,34.18562287014795,,,,,51,ARM,2020/04/12
Armenia,4/13/20,1039,22,,,26,,35.06304260817742,,,,,51,ARM,2020/04/13
Armenia,4/14/20,1067,24,,,28,,36.00795617220915,,,,,51,ARM,2020/04/14
Armenia,4/15/20,1111,24,,,44,,37.49282034425901,,,,,51,ARM,2020/04/15
Armenia,4/16/20,1159,24,,,48,,39.1126721683134,,,,,51,ARM,2020/04/16
Armenia,4/17/20,1201,27,,,42,,40.530042514361,,,,,51,ARM,2020/04/17
Armenia,4/18/20,1248,28,,,47,,42.11614742541426,,,,,51,ARM,2020/04/18
Armenia,4/19/20,1291,28,,,43,,43.56726468446299,,,,,51,ARM,2020/04/19
Armenia,4/20/20,1339,29,,,48,,45.187116508517384,,,,,51,ARM,2020/04/20
Armenia,4/21/20,1401,30,,,62,,47.279425114587646,,,,,51,ARM,2020/04/21
Armenia,4/22/20,1473,30,,,72,,49.709202850669236,,,,,51,ARM,2020/04/22
Armenia,4/23/20,1523,32,,,50,,51.3965485007259,,,,,51,ARM,2020/04/23
Armenia,4/24/20,1596,33,,,73,,53.86007314980862,,,,,51,ARM,2020/04/24
Armenia,4/25/20,1677,33,,,81,,56.593573102900415,,,,,51,ARM,2020/04/25
Armenia,4/26/20,1746,35,,,69,,58.9221100999786,,,,,51,ARM,2020/04/26
Armenia,4/27/20,1808,39,,,62,,61.014418706048865,,,,,51,ARM,2020/04/27
Armenia,4/28/20,1867,40,,,59,,63.005486573115725,,,,,51,ARM,2020/04/28
Armenia,4/29/20,1932,40,,,65,,65.19903591818938,,,,,51,ARM,2020/04/29
Armenia,4/30/20,2066,42,,,134,,69.72112226034123,,,,,51,ARM,2020/04/30
Armenia,5/1/20,2148,43,,,82,,72.48836912643416,,,,,51,ARM,2020/05/01
Armenia,5/2/20,2273,44,,,125,,76.70673325157581,,,,,51,ARM,2020/05/02
Armenia,5/3/20,2386,45,,,113,,80.52013442070387,,,,,51,ARM,2020/05/03
Armenia,5/4/20,2507,46,,,121,,84.60351089384099,,,,,51,ARM,2020/05/04
Armenia,5/5/20,2619,47,,,112,,88.38316514996791,,,,,51,ARM,2020/05/05
Armenia,5/6/20,2782,48,,,163,,93.88391196915262,,,,,51,ARM,2020/05/06
Armenia,5/7/20,2884,49,,,102,,97.32609709526821,,,,,51,ARM,2020/05/07
Armenia,5/8/20,3029,52,,,145,,102.21939948043253,,,,,51,ARM,2020/05/08
Armenia,5/9/20,3175,55,,,146,,107.14644877859797,,,,,51,ARM,2020/05/09
Armenia,5/10/20,3313,60,,,138,,111.80352277275436,,,,,51,ARM,2020/05/10
Armenia,5/11/20,3392,61,,,79,,114.46952889984388,,,,,51,ARM,2020/05/11
Armenia,5/12/20,3538,64,,,146,,119.39657819800934,,,,,51,ARM,2020/05/12
Armenia,5/13/20,3718,67,,,180,,125.47102253821332,,,,,51,ARM,2020/05/13
Armenia,5/14/20,3860,70,,,142,,130.26308418437424,,,,,51,ARM,2020/05/14
Armenia,5/15/20,4044,74,,,184,,136.47251617658276,,,,,51,ARM,2020/05/15
Armenia,5/16/20,4283,77,,,239,,144.5380283838536,,,,,51,ARM,2020/05/16
Armenia,5/17/20,4472,81,,,189,,150.91619494106777,,,,,51,ARM,2020/05/17
Armenia,5/18/20,4823,87,,,351,,162.76136140446553,,,,,51,ARM,2020/05/18
Armenia,5/19/20,5041,91,,,218,,170.11818843871256,,,,,51,ARM,2020/05/19
Armenia,5/20/20,5271,98,,,230,,177.8799784289732,,,,,51,ARM,2020/05/20
Armenia,5/21/20,5606,113,,,335,,189.18519428435283,,,,,51,ARM,2020/05/21
Armenia,5/22/20,5928,120,,,322,,200.05170027071773,,,,,51,ARM,2020/05/22
Armenia,5/23/20,6302,127,,,374,,212.67304573314155,,,,,51,ARM,2020/05/23
Armenia,5/24/20,6661,131,,,359,,224.7881875005484,,,,,51,ARM,2020/05/24
Armenia,5/25/20,7113,139,,,452,,240.04179217706061,,,,,51,ARM,2020/05/25
Armenia,5/26/20,7402,158,,,289,,249.7946500343881,,,,,51,ARM,2020/05/26
Armenia,5/27/20,7774,170,,,372,,262.34850167080964,,,,,51,ARM,2020/05/27
Armenia,5/28/20,8216,176,,,442,,277.26463721731056,,,,,51,ARM,2020/05/28
Armenia,5/29/20,8676,183,,,460,,292.78821719783184,,,,,51,ARM,2020/05/29
Armenia,5/30/20,8927,190,,,251,,301.2586923611163,,,,,51,ARM,2020/05/30
Armenia,5/31/20,9282,200,,,355,,313.2388464765186,,,,,51,ARM,2020/05/31
Armenia,6/1/20,9492,211,,,210,,320.32569820675656,,,,,51,ARM,2020/06/01
Armenia,6/2/20,10009,217,,,517,,337.7728522283424,,,,,51,ARM,2020/06/02
Armenia,6/3/20,10524,227,,,515,,355.152512423926,,,,,51,ARM,2020/06/03
Armenia,6/4/20,11221,245,,,697,,378.67411078571587,,,,,51,ARM,2020/06/04
Armenia,6/5/20,11817,258,,,596,,398.7872709343913,,,,,51,ARM,2020/06/05
Armenia,6/6/20,12364,0,,,547,,417.24683234601116,,,,,51,ARM,2020/06/06
Armenia,6/7/20,13130,0,,,766,,443.0969677048792,,,,,51,ARM,2020/06/07
Armenia,6/8/20,13325,0,,,195,,449.6776157401002,,,,,51,ARM,2020/06/08
Armenia,6/9/20,13675,0,,,350,,461.4890352904968,,,,,51,ARM,2020/06/09
Armenia,6/10/20,14103,0,,,428,,475.93271405498183,,,,,51,ARM,2020/06/10
Armenia,6/11/20,14669,0,,,566,,495.03346681362325,,,,,51,ARM,2020/06/11
Armenia,6/12/20,15281,0,,,612,,515.6865775703168,,,,,51,ARM,2020/06/12
Armenia,6/13/20,16004,0,,,723,,540.0855956701361,,,,,51,ARM,2020/06/13
Australia,1/22/20,0,0,,,0,,0.0,,,,,36,AUS,2020/01/22
Australia,1/23/20,0,0,,,0,,0.0,,,,,36,AUS,2020/01/23
Australia,1/24/20,0,0,,,0,,0.0,,,,,36,AUS,2020/01/24
Australia,1/25/20,0,0,,,0,,0.0,,,,,36,AUS,2020/01/25
Australia,1/26/20,4,0,,,4,,0.015711104215682038,,,,,36,AUS,2020/01/26
Australia,1/27/20,5,0,,,1,,0.01963888026960255,,,,,36,AUS,2020/01/27
Australia,1/28/20,5,0,,,0,,0.01963888026960255,,,,,36,AUS,2020/01/28
Australia,1/29/20,6,0,,,1,,0.023566656323523057,,,,,36,AUS,2020/01/29
Australia,1/30/20,9,0,,,3,,0.035349984485284584,,,,,36,AUS,2020/01/30
Australia,1/31/20,9,0,,,0,,0.035349984485284584,,,,,36,AUS,2020/01/31
Australia,2/1/20,12,0,,,3,,0.047133312647046115,,,,,36,AUS,2020/02/01
Australia,2/2/20,12,0,,,0,,0.047133312647046115,,,,,36,AUS,2020/02/02
Australia,2/3/20,12,0,,,0,,0.047133312647046115,,,,,36,AUS,2020/02/03
Australia,2/4/20,13,0,,,1,,0.05106108870096662,,,,,36,AUS,2020/02/04
Australia,2/5/20,13,0,,,0,,0.05106108870096662,,,,,36,AUS,2020/02/05
Australia,2/6/20,14,0,,,1,,0.05498886475488714,,,,,36,AUS,2020/02/06
Australia,2/7/20,15,0,,,1,,0.058916640808807645,,,,,36,AUS,2020/02/07
Australia,2/8/20,15,0,,,0,,0.058916640808807645,,,,,36,AUS,2020/02/08
Australia,2/9/20,15,0,,,0,,0.058916640808807645,,,,,36,AUS,2020/02/09
Australia,2/10/20,15,0,,,0,,0.058916640808807645,,,,,36,AUS,2020/02/10
Australia,2/11/20,15,0,,,0,,0.058916640808807645,,,,,36,AUS,2020/02/11
Australia,2/12/20,15,0,,,0,,0.058916640808807645,,,,,36,AUS,2020/02/12
Australia,2/13/20,15,0,,,0,,0.058916640808807645,,,,,36,AUS,2020/02/13
Australia,2/14/20,15,0,,,0,,0.058916640808807645,,,,,36,AUS,2020/02/14
Australia,2/15/20,15,0,,,0,,0.058916640808807645,,,,,36,AUS,2020/02/15
Australia,2/16/20,15,0,,,0,,0.058916640808807645,,,,,36,AUS,2020/02/16
Australia,2/17/20,15,0,,,0,,0.058916640808807645,,,,,36,AUS,2020/02/17
Australia,2/18/20,15,0,,,0,,0.058916640808807645,,,,,36,AUS,2020/02/18
Australia,2/19/20,15,0,,,0,,0.058916640808807645,,,,,36,AUS,2020/02/19
Australia,2/20/20,15,0,,,0,,0.058916640808807645,,,,,36,AUS,2020/02/20
Australia,2/21/20,15,0,,,0,,0.058916640808807645,,,,,36,AUS,2020/02/21
Australia,2/22/20,15,1,,,0,,0.058916640808807645,,,,,36,AUS,2020/02/22
Australia,2/23/20,15,1,,,0,,0.058916640808807645,,,,,36,AUS,2020/02/23
Australia,2/24/20,15,1,,,0,,0.058916640808807645,,,,,36,AUS,2020/02/24
Australia,2/25/20,15,2,,,0,,0.058916640808807645,,,,,36,AUS,2020/02/25
Australia,2/26/20,15,2,,,0,,0.058916640808807645,,,,,36,AUS,2020/02/26
Australia,2/27/20,15,2,,,0,,0.058916640808807645,,,,,36,AUS,2020/02/27
Australia,2/28/20,15,2,,,0,,0.058916640808807645,,,,,36,AUS,2020/02/28
Australia,2/29/20,25,3,,,10,,0.09819440134801274,,,,,36,AUS,2020/02/29
Australia,3/1/20,27,3,,,2,,0.10604995345585376,,,,,36,AUS,2020/03/01
Australia,3/2/20,30,3,,,3,,0.11783328161761529,,,,,36,AUS,2020/03/02
Australia,3/3/20,39,3,,,9,,0.15318326610289987,,,,,36,AUS,2020/03/03
Australia,3/4/20,52,3,,,13,,0.2042443548038665,,,,,36,AUS,2020/03/04
Australia,3/5/20,55,3,,,3,,0.21602768296562802,,,,,36,AUS,2020/03/05
Australia,3/6/20,60,3,,,5,,0.23566656323523058,,,,,36,AUS,2020/03/06
Australia,3/7/20,63,3,,,3,,0.2474498913969921,,,,,36,AUS,2020/03/07
Australia,3/8/20,76,3,,,13,,0.29851098009795873,,,,,36,AUS,2020/03/08
Australia,3/9/20,91,5,,,15,,0.3574276209067664,,,,,36,AUS,2020/03/09
Australia,3/10/20,107,6,,,16,,0.4202720377694945,,,,,36,AUS,2020/03/10
Australia,3/11/20,128,6,,,21,,0.5027553349018252,,,,,36,AUS,2020/03/11
Australia,3/12/20,128,7,,,0,,0.5027553349018252,,,,,36,AUS,2020/03/12
Australia,3/13/20,200,7,,,72,,0.785555210784102,,,,,36,AUS,2020/03/13
Australia,3/14/20,250,7,,,50,,0.9819440134801274,,,,,36,AUS,2020/03/14
Australia,3/15/20,297,7,,,47,,1.1665494880143914,,,,,36,AUS,2020/03/15
Australia,3/16/20,377,8,,,80,,1.4807715723280321,,,,,36,AUS,2020/03/16
Australia,3/17/20,452,8,,,75,,1.7753547763720703,,,,,36,AUS,2020/03/17
Australia,3/18/20,568,13,,,116,,2.2309767986268496,,,,,36,AUS,2020/03/18
Australia,3/19/20,681,13,,,113,,2.6748154927198673,,,,,36,AUS,2020/03/19
Australia,3/20/20,791,14,,,110,,3.1068708586511233,,,,,36,AUS,2020/03/20
Australia,3/21/20,1071,16,,,280,,4.206648153748866,,,,,36,AUS,2020/03/21
Australia,3/22/20,1549,17,,,478,,6.084125107522869,,,,,36,AUS,2020/03/22
Australia,3/23/20,1682,18,,,133,,6.6065193226942975,,,,,36,AUS,2020/03/23
Australia,3/24/20,2044,20,,,362,,8.028374254213523,,,,,36,AUS,2020/03/24
Australia,3/25/20,2364,24,,,320,,9.285262591468085,,,,,36,AUS,2020/03/25
Australia,3/26/20,2810,28,,,446,,11.037050711516633,,,,,36,AUS,2020/03/26
Australia,3/27/20,3143,30,,,333,,12.345000137472162,,,,,36,AUS,2020/03/27
Australia,3/28/20,3640,35,,,497,,14.297104836270655,,,,,36,AUS,2020/03/28
Australia,3/29/20,3984,40,,,344,,15.64825979881931,,,,,36,AUS,2020/03/29
Australia,3/30/20,4361,45,,,377,,17.12903137114734,,,,,36,AUS,2020/03/30
Australia,3/31/20,4559,50,,,198,,17.906731029823604,,,,,36,AUS,2020/03/31
Australia,4/1/20,4862,51,,,303,,19.096847174161518,,,,,36,AUS,2020/04/01
Australia,4/2/20,5116,54,,,254,,20.094502291857328,,,,,36,AUS,2020/04/02
Australia,4/3/20,5330,57,,,214,,20.935046367396318,,,,,36,AUS,2020/04/03
Australia,4/4/20,5550,60,,,220,,21.799157099258828,,,,,36,AUS,2020/04/04
Australia,4/5/20,5687,61,,,137,,22.33726241864594,,,,,36,AUS,2020/04/05
Australia,4/6/20,5797,62,,,110,,22.769317784577193,,,,,36,AUS,2020/04/06
Australia,4/7/20,5895,63,,,98,,23.154239837861404,,,,,36,AUS,2020/04/07
Australia,4/8/20,6010,63,,,115,,23.605934084062262,,,,,36,AUS,2020/04/08
Australia,4/9/20,6108,66,,,98,,23.990856137346473,,,,,36,AUS,2020/04/09
Australia,4/10/20,6215,67,,,107,,24.411128175115966,,,,,36,AUS,2020/04/10
Australia,4/11/20,6303,67,,,88,,24.756772467860973,,,,,36,AUS,2020/04/11
Australia,4/12/20,6315,67,,,12,,24.803905780508018,,,,,36,AUS,2020/04/12
Australia,4/13/20,6351,67,,,36,,24.945305718449156,,,,,36,AUS,2020/04/13
Australia,4/14/20,6415,67,,,64,,25.19668338590007,,,,,36,AUS,2020/04/14
Australia,4/15/20,6440,75,,,25,,25.294877787248083,,,,,36,AUS,2020/04/15
Australia,4/16/20,6462,79,,,22,,25.381288860434335,,,,,36,AUS,2020/04/16
Australia,4/17/20,6522,80,,,60,,25.616955423669562,,,,,36,AUS,2020/04/17
Australia,4/18/20,6568,83,,,46,,25.797633122149907,,,,,36,AUS,2020/04/18
Australia,4/19/20,6610,83,,,42,,25.96259971641457,,,,,36,AUS,2020/04/19
Australia,4/20/20,6623,89,,,13,,26.013660805115535,,,,,36,AUS,2020/04/20
Australia,4/21/20,6645,91,,,22,,26.100071878301787,,,,,36,AUS,2020/04/21
Australia,4/22/20,6652,93,,,7,,26.12756631067923,,,,,36,AUS,2020/04/22
Australia,4/23/20,6662,93,,,10,,26.166844071218435,,,,,36,AUS,2020/04/23
Australia,4/24/20,6677,94,,,15,,26.225760712027242,,,,,36,AUS,2020/04/24
Australia,4/25/20,6694,95,,,17,,26.29253290494389,,,,,36,AUS,2020/04/25
Australia,4/26/20,6714,96,,,20,,26.3710884260223,,,,,36,AUS,2020/04/26
Australia,4/27/20,6721,97,,,7,,26.398582858399745,,,,,36,AUS,2020/04/27
Australia,4/28/20,6744,97,,,23,,26.488921707639918,,,,,36,AUS,2020/04/28
Australia,4/29/20,6752,97,,,8,,26.52034391607128,,,,,36,AUS,2020/04/29
Australia,4/30/20,6766,97,,,14,,26.57533278082617,,,,,36,AUS,2020/04/30
Australia,5/1/20,6778,97,,,12,,26.622466093473214,,,,,36,AUS,2020/05/01
Australia,5/2/20,6799,97,,,21,,26.704949390605545,,,,,36,AUS,2020/05/02
Australia,5/3/20,6822,97,,,23,,26.795288239845718,,,,,36,AUS,2020/05/03
Australia,5/4/20,6847,98,,,25,,26.893482641193728,,,,,36,AUS,2020/05/04
Australia,5/5/20,6875,98,,,28,,27.003460370703504,,,,,36,AUS,2020/05/05
Australia,5/6/20,6894,98,,,19,,27.078088115727994,,,,,36,AUS,2020/05/06
Australia,5/7/20,6913,98,,,19,,27.152715860752483,,,,,36,AUS,2020/05/07
Australia,5/8/20,6918,98,,,5,,27.172354741022087,,,,,36,AUS,2020/05/08
Australia,5/9/20,6939,99,,,21,,27.254838038154418,,,,,36,AUS,2020/05/09
Australia,5/10/20,6948,99,,,9,,27.2901880226397,,,,,36,AUS,2020/05/10
Australia,5/11/20,6970,100,,,22,,27.376599095825952,,,,,36,AUS,2020/05/11
Australia,5/12/20,6980,100,,,10,,27.41587685636516,,,,,36,AUS,2020/05/12
Australia,5/13/20,6989,101,,,9,,27.451226840850442,,,,,36,AUS,2020/05/13
Australia,5/14/20,7019,101,,,30,,27.569060122468056,,,,,36,AUS,2020/05/14
Australia,5/15/20,7035,102,,,16,,27.631904539330787,,,,,36,AUS,2020/05/15
Australia,5/16/20,7044,102,,,9,,27.66725452381607,,,,,36,AUS,2020/05/16
Australia,5/17/20,7054,102,,,10,,27.706532284355276,,,,,36,AUS,2020/05/17
Australia,5/18/20,7068,103,,,14,,27.761521149110163,,,,,36,AUS,2020/05/18
Australia,5/19/20,7072,103,,,4,,27.777232253325845,,,,,36,AUS,2020/05/19
Australia,5/20/20,7081,103,,,9,,27.812582237811128,,,,,36,AUS,2020/05/20
Australia,5/21/20,7095,103,,,14,,27.867571102566018,,,,,36,AUS,2020/05/21
Australia,5/22/20,7099,103,,,4,,27.883282206781697,,,,,36,AUS,2020/05/22
Australia,5/23/20,7114,103,,,15,,27.942198847590507,,,,,36,AUS,2020/05/23
Australia,5/24/20,7114,102,,,0,,27.942198847590507,,,,,36,AUS,2020/05/24
Australia,5/25/20,7126,102,,,12,,27.989332160237552,,,,,36,AUS,2020/05/25
Australia,5/26/20,7139,102,,,13,,28.040393248938518,,,,,36,AUS,2020/05/26
Australia,5/27/20,7150,102,,,11,,28.083598785531645,,,,,36,AUS,2020/05/27
Australia,5/28/20,7165,102,,,15,,28.142515426340452,,,,,36,AUS,2020/05/28
Australia,5/29/20,7184,102,,,19,,28.217143171364942,,,,,36,AUS,2020/05/29
Australia,5/30/20,7192,102,,,8,,28.248565379796304,,,,,36,AUS,2020/05/30
Australia,5/31/20,7202,102,,,10,,28.28784314033551,,,,,36,AUS,2020/05/31
Australia,6/1/20,7221,102,,,19,,28.36247088536,,,,,36,AUS,2020/06/01
Australia,6/2/20,7229,102,,,8,,28.393893093791366,,,,,36,AUS,2020/06/02
Australia,6/3/20,7240,102,,,11,,28.43709863038449,,,,,36,AUS,2020/06/03
Australia,6/4/20,7247,102,,,7,,28.464593062761935,,,,,36,AUS,2020/06/04
Australia,6/5/20,7252,0,,,5,,28.484231943031535,,,,,36,AUS,2020/06/05
Australia,6/6/20,7259,0,,,7,,28.51172637540898,,,,,36,AUS,2020/06/06
Australia,6/7/20,7265,0,,,6,,28.535293031732504,,,,,36,AUS,2020/06/07
Australia,6/8/20,7267,0,,,2,,28.543148583840345,,,,,36,AUS,2020/06/08
Australia,6/9/20,7274,0,,,7,,28.570643016217787,,,,,36,AUS,2020/06/09
Australia,6/10/20,7285,0,,,11,,28.613848552810914,,,,,36,AUS,2020/06/10
Australia,6/11/20,7289,0,,,4,,28.629559657026594,,,,,36,AUS,2020/06/11
Australia,6/12/20,7294,0,,,5,,28.649198537296197,,,,,36,AUS,2020/06/12
Australia,6/13/20,7320,0,,,26,,28.75132071469813,,,,,36,AUS,2020/06/13
Austria,1/22/20,0,0,,,0,,0.0,,,,,40,AUT,2020/01/22
Austria,1/23/20,0,0,,,0,,0.0,,,,,40,AUT,2020/01/23
Austria,1/24/20,0,0,,,0,,0.0,,,,,40,AUT,2020/01/24
Austria,1/25/20,0,0,,,0,,0.0,,,,,40,AUT,2020/01/25
Austria,1/26/20,0,0,,,0,,0.0,,,,,40,AUT,2020/01/26
Austria,1/27/20,0,0,,,0,,0.0,,,,,40,AUT,2020/01/27
Austria,1/28/20,0,0,,,0,,0.0,,,,,40,AUT,2020/01/28
Austria,1/29/20,0,0,,,0,,0.0,,,,,40,AUT,2020/01/29
Austria,1/30/20,0,0,,,0,,0.0,,,,,40,AUT,2020/01/30
Austria,1/31/20,0,0,,,0,,0.0,,,,,40,AUT,2020/01/31
Austria,2/1/20,0,0,,,0,,0.0,,,,,40,AUT,2020/02/01
Austria,2/2/20,0,0,,,0,,0.0,,,,,40,AUT,2020/02/02
Austria,2/3/20,0,0,,,0,,0.0,,,,,40,AUT,2020/02/03
Austria,2/4/20,0,0,,,0,,0.0,,,,,40,AUT,2020/02/04
Austria,2/5/20,0,0,,,0,,0.0,,,,,40,AUT,2020/02/05
Austria,2/6/20,0,0,,,0,,0.0,,,,,40,AUT,2020/02/06
Austria,2/7/20,0,0,,,0,,0.0,,,,,40,AUT,2020/02/07
Austria,2/8/20,0,0,,,0,,0.0,,,,,40,AUT,2020/02/08
Austria,2/9/20,0,0,,,0,,0.0,,,,,40,AUT,2020/02/09
Austria,2/10/20,0,0,,,0,,0.0,,,,,40,AUT,2020/02/10
Austria,2/11/20,0,0,,,0,,0.0,,,,,40,AUT,2020/02/11
Austria,2/12/20,0,0,,,0,,0.0,,,,,40,AUT,2020/02/12
Austria,2/13/20,0,0,,,0,,0.0,,,,,40,AUT,2020/02/13
Austria,2/14/20,0,0,,,0,,0.0,,,,,40,AUT,2020/02/14
Austria,2/15/20,0,0,,,0,,0.0,,,,,40,AUT,2020/02/15
Austria,2/16/20,0,0,,,0,,0.0,,,,,40,AUT,2020/02/16
Austria,2/17/20,0,0,,,0,,0.0,,,,,40,AUT,2020/02/17
Austria,2/18/20,0,0,,,0,,0.0,,,,,40,AUT,2020/02/18
Austria,2/19/20,0,0,,,0,,0.0,,,,,40,AUT,2020/02/19
Austria,2/20/20,0,0,,,0,,0.0,,,,,40,AUT,2020/02/20
Austria,2/21/20,0,0,,,0,,0.0,,,,,40,AUT,2020/02/21
Austria,2/22/20,0,0,,,0,,0.0,,,,,40,AUT,2020/02/22
Austria,2/23/20,0,0,,,0,,0.0,,,,,40,AUT,2020/02/23
Austria,2/24/20,0,0,,,0,,0.0,,,,,40,AUT,2020/02/24
Austria,2/25/20,2,0,,,2,,0.022206430982412508,,,,,40,AUT,2020/02/25
Austria,2/26/20,2,0,,,0,,0.022206430982412508,,,,,40,AUT,2020/02/26
Austria,2/27/20,3,0,,,1,,0.03330964647361876,,,,,40,AUT,2020/02/27
Austria,2/28/20,3,0,,,0,,0.03330964647361876,,,,,40,AUT,2020/02/28
Austria,2/29/20,9,0,,,6,,0.09992893942085627,,,,,40,AUT,2020/02/29
Austria,3/1/20,14,0,,,5,,0.15544501687688755,,,,,40,AUT,2020/03/01
Austria,3/2/20,18,0,,,4,,0.19985787884171255,,,,,40,AUT,2020/03/02
Austria,3/3/20,21,1,,,3,,0.23316752531533133,,,,,40,AUT,2020/03/03
Austria,3/4/20,29,1,,,8,,0.32199324924498135,,,,,40,AUT,2020/03/04
Austria,3/5/20,41,1,,,12,,0.45523183513945636,,,,,40,AUT,2020/03/05
Austria,3/6/20,55,1,,,14,,0.6106768520163439,,,,,40,AUT,2020/03/06
Austria,3/7/20,79,3,,,24,,0.8771540238052941,,,,,40,AUT,2020/03/07
Austria,3/8/20,104,3,,,25,,1.1547344110854503,,,,,40,AUT,2020/03/08
Austria,3/9/20,131,4,,,27,,1.4545212293480192,,,,,40,AUT,2020/03/09
Austria,3/10/20,182,6,,,51,,2.020785219399538,,,,,40,AUT,2020/03/10
Austria,3/11/20,246,6,,,64,,2.7313910108367385,,,,,40,AUT,2020/03/11
Austria,3/12/20,302,8,,,56,,3.3531710783442885,,,,,40,AUT,2020/03/12
Austria,3/13/20,504,16,,,202,,5.596020607567952,,,,,40,AUT,2020/03/13
Austria,3/14/20,655,21,,,151,,7.272606146740096,,,,,40,AUT,2020/03/14
Austria,3/15/20,860,28,,,205,,9.548765322437378,,,,,40,AUT,2020/03/15
Austria,3/16/20,1018,30,,,158,,11.303073370047965,,,,,40,AUT,2020/03/16
Austria,3/17/20,1332,49,,,314,,14.789483034286729,,,,,40,AUT,2020/03/17
Austria,3/18/20,1646,58,,,314,,18.275892698525492,,,,,40,AUT,2020/03/18
Austria,3/19/20,2013,68,,,367,,22.350772783798188,,,,,40,AUT,2020/03/19
Austria,3/20/20,2388,86,,,375,,26.514478593000533,,,,,40,AUT,2020/03/20
Austria,3/21/20,2814,108,,,426,,31.244448392254398,,,,,40,AUT,2020/03/21
Austria,3/22/20,3582,128,,,768,,39.7717178895008,,,,,40,AUT,2020/03/22
Austria,3/23/20,4474,146,,,892,,49.675786107656776,,,,,40,AUT,2020/03/23
Austria,3/24/20,5283,158,,,809,,58.658287440042635,,,,,40,AUT,2020/03/24
Austria,3/25/20,5588,168,,,305,,62.04476816486054,,,,,40,AUT,2020/03/25
Austria,3/26/20,6909,186,,,1321,,76.712115828744,,,,,40,AUT,2020/03/26
Austria,3/27/20,7657,204,,,748,,85.01732101616628,,,,,40,AUT,2020/03/27
Austria,3/28/20,8271,220,,,614,,91.83469532776692,,,,,40,AUT,2020/03/28
Austria,3/29/20,8788,243,,,517,,97.57505773672055,,,,,40,AUT,2020/03/29
Austria,3/30/20,9618,273,,,830,,106.79072659442174,,,,,40,AUT,2020/03/30
Austria,3/31/20,10180,295,,,562,,113.03073370047966,,,,,40,AUT,2020/03/31
Austria,4/1/20,10711,319,,,531,,118.92654112631018,,,,,40,AUT,2020/04/01
Austria,4/2/20,11129,337,,,418,,123.56768520163439,,,,,40,AUT,2020/04/02
Austria,4/3/20,11524,350,,,395,,127.95345532066086,,,,,40,AUT,2020/04/03
Austria,4/4/20,11781,368,,,257,,130.80698170190087,,,,,40,AUT,2020/04/04
Austria,4/5/20,12051,384,,,270,,133.80484988452656,,,,,40,AUT,2020/04/05
Austria,4/6/20,12297,393,,,246,,136.5362408953633,,,,,40,AUT,2020/04/06
Austria,4/7/20,12639,410,,,342,,140.33354059335585,,,,,40,AUT,2020/04/07
Austria,4/8/20,12942,431,,,303,,143.69781488719133,,,,,40,AUT,2020/04/08
Austria,4/9/20,13244,443,,,302,,147.05098596553563,,,,,40,AUT,2020/04/09
Austria,4/10/20,13555,452,,,311,,150.50408598330077,,,,,40,AUT,2020/04/10
Austria,4/11/20,13806,470,,,251,,153.29099307159353,,,,,40,AUT,2020/04/11
Austria,4/12/20,13945,491,,,139,,154.8343400248712,,,,,40,AUT,2020/04/12
Austria,4/13/20,14041,510,,,96,,155.900248712027,,,,,40,AUT,2020/04/13
Austria,4/14/20,14226,522,,,185,,157.95434357790015,,,,,40,AUT,2020/04/14
Austria,4/15/20,14336,530,,,110,,159.17569728193286,,,,,40,AUT,2020/04/15
Austria,4/16/20,14476,536,,,140,,160.73014745070174,,,,,40,AUT,2020/04/16
Austria,4/17/20,14595,542,,,119,,162.05143009415528,,,,,40,AUT,2020/04/17
Austria,4/18/20,14671,549,,,76,,162.89527447148694,,,,,40,AUT,2020/04/18
Austria,4/19/20,14749,569,,,78,,163.76132527980104,,,,,40,AUT,2020/04/19
Austria,4/20/20,14795,580,,,46,,164.2720731923965,,,,,40,AUT,2020/04/20
Austria,4/21/20,14873,584,,,78,,165.1381240007106,,,,,40,AUT,2020/04/21
Austria,4/22/20,14925,589,,,52,,165.71549120625332,,,,,40,AUT,2020/04/22
Austria,4/23/20,15002,596,,,77,,166.57043879907621,,,,,40,AUT,2020/04/23
Austria,4/24/20,15071,598,,,69,,167.33656066796945,,,,,40,AUT,2020/04/24
Austria,4/25/20,15148,600,,,77,,168.19150826079232,,,,,40,AUT,2020/04/25
Austria,4/26/20,15225,606,,,77,,169.0464558536152,,,,,40,AUT,2020/04/26
Austria,4/27/20,15274,608,,,49,,169.59051341268432,,,,,40,AUT,2020/04/27
Austria,4/28/20,15357,609,,,83,,170.51208029845444,,,,,40,AUT,2020/04/28
Austria,4/29/20,15402,614,,,45,,171.01172499555872,,,,,40,AUT,2020/04/29
Austria,4/30/20,15452,615,,,50,,171.56688577011903,,,,,40,AUT,2020/04/30
Austria,5/1/20,15531,618,,,79,,172.44403979392433,,,,,40,AUT,2020/05/01
Austria,5/2/20,15558,620,,,27,,172.7438266121869,,,,,40,AUT,2020/05/02
Austria,5/3/20,15597,623,,,39,,173.17685201634393,,,,,40,AUT,2020/05/03
Austria,5/4/20,15621,624,,,24,,173.44332918813288,,,,,40,AUT,2020/05/04
Austria,5/5/20,15650,626,,,29,,173.76532243737788,,,,,40,AUT,2020/05/05
Austria,5/6/20,15684,628,,,34,,174.14283176407886,,,,,40,AUT,2020/05/06
Austria,5/7/20,15752,629,,,68,,174.8978504174809,,,,,40,AUT,2020/05/07
Austria,5/8/20,15774,629,,,22,,175.14212115828744,,,,,40,AUT,2020/05/08
Austria,5/9/20,15833,629,,,59,,175.7972108722686,,,,,40,AUT,2020/05/09
Austria,5/10/20,15871,632,,,38,,176.21913306093444,,,,,40,AUT,2020/05/10
Austria,5/11/20,15882,633,,,11,,176.3412684313377,,,,,40,AUT,2020/05/11
Austria,5/12/20,15961,633,,,79,,177.218422455143,,,,,40,AUT,2020/05/12
Austria,5/13/20,15997,635,,,36,,177.61813821282644,,,,,40,AUT,2020/05/13
Austria,5/14/20,16058,639,,,61,,178.29543435779001,,,,,40,AUT,2020/05/14
Austria,5/15/20,16109,640,,,51,,178.86169834784152,,,,,40,AUT,2020/05/15
Austria,5/16/20,16201,641,,,92,,179.8831941730325,,,,,40,AUT,2020/05/16
Austria,5/17/20,16242,643,,,41,,180.33842600817198,,,,,40,AUT,2020/05/17
Austria,5/18/20,16269,645,,,27,,180.63821282643454,,,,,40,AUT,2020/05/18
Austria,5/19/20,16321,668,,,52,,181.21558003197725,,,,,40,AUT,2020/05/19
Austria,5/20/20,16353,668,,,32,,181.57088292769586,,,,,40,AUT,2020/05/20
Austria,5/21/20,16404,668,,,51,,182.13714691774737,,,,,40,AUT,2020/05/21
Austria,5/22/20,16436,668,,,32,,182.49244981346598,,,,,40,AUT,2020/05/22
Austria,5/23/20,16486,668,,,50,,183.0476105880263,,,,,40,AUT,2020/05/23
Austria,5/24/20,16503,669,,,17,,183.2363652513768,,,,,40,AUT,2020/05/24
Austria,5/25/20,16539,670,,,36,,183.63608100906023,,,,,40,AUT,2020/05/25
Austria,5/26/20,16557,670,,,18,,183.83593888790193,,,,,40,AUT,2020/05/26
Austria,5/27/20,16591,672,,,34,,184.21344821460295,,,,,40,AUT,2020/05/27
Austria,5/28/20,16628,672,,,37,,184.62426718777758,,,,,40,AUT,2020/05/28
Austria,5/29/20,16655,672,,,27,,184.92405400604014,,,,,40,AUT,2020/05/29
Austria,5/30/20,16685,672,,,30,,185.25715047077634,,,,,40,AUT,2020/05/30
Austria,5/31/20,16731,672,,,46,,185.76789838337183,,,,,40,AUT,2020/05/31
Austria,6/1/20,16733,673,,,2,,185.79010481435424,,,,,40,AUT,2020/06/01
Austria,6/2/20,16759,674,,,26,,186.0787884171256,,,,,40,AUT,2020/06/02
Austria,6/3/20,16771,675,,,12,,186.21202700302007,,,,,40,AUT,2020/06/03
Austria,6/4/20,16805,0,,,34,,186.58953632972108,,,,,40,AUT,2020/06/04
Austria,6/5/20,16843,0,,,38,,187.01145851838692,,,,,40,AUT,2020/06/05
Austria,6/6/20,16898,0,,,55,,187.62213537040327,,,,,40,AUT,2020/06/06
Austria,6/7/20,16902,0,,,4,,187.6665482323681,,,,,40,AUT,2020/06/07
Austria,6/8/20,16968,0,,,66,,188.3993604547877,,,,,40,AUT,2020/06/08
Austria,6/9/20,16979,0,,,11,,188.52149582519098,,,,,40,AUT,2020/06/09
Austria,6/10/20,17005,0,,,26,,188.81017942796234,,,,,40,AUT,2020/06/10
Austria,6/11/20,17034,0,,,29,,189.1321726772073,,,,,40,AUT,2020/06/11
Austria,6/12/20,17064,0,,,30,,189.4652691419435,,,,,40,AUT,2020/06/12
Austria,6/13/20,17078,0,,,14,,189.6207141588204,,,,,40,AUT,2020/06/13
Azerbaijan,1/22/20,0,0,,,0,,0.0,,,,,31,AZE,2020/01/22
Azerbaijan,1/23/20,0,0,,,0,,0.0,,,,,31,AZE,2020/01/23
Azerbaijan,1/24/20,0,0,,,0,,0.0,,,,,31,AZE,2020/01/24
Azerbaijan,1/25/20,0,0,,,0,,0.0,,,,,31,AZE,2020/01/25
Azerbaijan,1/26/20,0,0,,,0,,0.0,,,,,31,AZE,2020/01/26
Azerbaijan,1/27/20,0,0,,,0,,0.0,,,,,31,AZE,2020/01/27
Azerbaijan,1/28/20,0,0,,,0,,0.0,,,,,31,AZE,2020/01/28
Azerbaijan,1/29/20,0,0,,,0,,0.0,,,,,31,AZE,2020/01/29
Azerbaijan,1/30/20,0,0,,,0,,0.0,,,,,31,AZE,2020/01/30
Azerbaijan,1/31/20,0,0,,,0,,0.0,,,,,31,AZE,2020/01/31
Azerbaijan,2/1/20,0,0,,,0,,0.0,,,,,31,AZE,2020/02/01
Azerbaijan,2/2/20,0,0,,,0,,0.0,,,,,31,AZE,2020/02/02
Azerbaijan,2/3/20,0,0,,,0,,0.0,,,,,31,AZE,2020/02/03
Azerbaijan,2/4/20,0,0,,,0,,0.0,,,,,31,AZE,2020/02/04
Azerbaijan,2/5/20,0,0,,,0,,0.0,,,,,31,AZE,2020/02/05
Azerbaijan,2/6/20,0,0,,,0,,0.0,,,,,31,AZE,2020/02/06
Azerbaijan,2/7/20,0,0,,,0,,0.0,,,,,31,AZE,2020/02/07
Azerbaijan,2/8/20,0,0,,,0,,0.0,,,,,31,AZE,2020/02/08
Azerbaijan,2/9/20,0,0,,,0,,0.0,,,,,31,AZE,2020/02/09
Azerbaijan,2/10/20,0,0,,,0,,0.0,,,,,31,AZE,2020/02/10
Azerbaijan,2/11/20,0,0,,,0,,0.0,,,,,31,AZE,2020/02/11
Azerbaijan,2/12/20,0,0,,,0,,0.0,,,,,31,AZE,2020/02/12
Azerbaijan,2/13/20,0,0,,,0,,0.0,,,,,31,AZE,2020/02/13
Azerbaijan,2/14/20,0,0,,,0,,0.0,,,,,31,AZE,2020/02/14
Azerbaijan,2/15/20,0,0,,,0,,0.0,,,,,31,AZE,2020/02/15
Azerbaijan,2/16/20,0,0,,,0,,0.0,,,,,31,AZE,2020/02/16
Azerbaijan,2/17/20,0,0,,,0,,0.0,,,,,31,AZE,2020/02/17
Azerbaijan,2/18/20,0,0,,,0,,0.0,,,,,31,AZE,2020/02/18
Azerbaijan,2/19/20,0,0,,,0,,0.0,,,,,31,AZE,2020/02/19
Azerbaijan,2/20/20,0,0,,,0,,0.0,,,,,31,AZE,2020/02/20
Azerbaijan,2/21/20,0,0,,,0,,0.0,,,,,31,AZE,2020/02/21
Azerbaijan,2/22/20,0,0,,,0,,0.0,,,,,31,AZE,2020/02/22
Azerbaijan,2/23/20,0,0,,,0,,0.0,,,,,31,AZE,2020/02/23
Azerbaijan,2/24/20,0,0,,,0,,0.0,,,,,31,AZE,2020/02/24
Azerbaijan,2/25/20,0,0,,,0,,0.0,,,,,31,AZE,2020/02/25
Azerbaijan,2/26/20,0,0,,,0,,0.0,,,,,31,AZE,2020/02/26
Azerbaijan,2/27/20,0,0,,,0,,0.0,,,,,31,AZE,2020/02/27
Azerbaijan,2/28/20,0,0,,,0,,0.0,,,,,31,AZE,2020/02/28
Azerbaijan,2/29/20,0,0,,,0,,0.0,,,,,31,AZE,2020/02/29
Azerbaijan,3/1/20,3,0,,,3,,0.029588206141032185,,,,,31,AZE,2020/03/01
Azerbaijan,3/2/20,3,0,,,0,,0.029588206141032185,,,,,31,AZE,2020/03/02
Azerbaijan,3/3/20,3,1,,,0,,0.029588206141032185,,,,,31,AZE,2020/03/03
Azerbaijan,3/4/20,3,1,,,0,,0.029588206141032185,,,,,31,AZE,2020/03/04
Azerbaijan,3/5/20,6,1,,,3,,0.05917641228206437,,,,,31,AZE,2020/03/05
Azerbaijan,3/6/20,6,1,,,0,,0.05917641228206437,,,,,31,AZE,2020/03/06
Azerbaijan,3/7/20,9,1,,,3,,0.08876461842309655,,,,,31,AZE,2020/03/07
Azerbaijan,3/8/20,9,1,,,0,,0.08876461842309655,,,,,31,AZE,2020/03/08
Azerbaijan,3/9/20,9,1,,,0,,0.08876461842309655,,,,,31,AZE,2020/03/09
Azerbaijan,3/10/20,11,1,,,2,,0.10849008918378468,,,,,31,AZE,2020/03/10
Azerbaijan,3/11/20,11,1,,,0,,0.10849008918378468,,,,,31,AZE,2020/03/11
Azerbaijan,3/12/20,11,1,,,0,,0.10849008918378468,,,,,31,AZE,2020/03/12
Azerbaijan,3/13/20,15,1,,,4,,0.14794103070516093,,,,,31,AZE,2020/03/13
Azerbaijan,3/14/20,15,1,,,0,,0.14794103070516093,,,,,31,AZE,2020/03/14
Azerbaijan,3/15/20,23,2,,,8,,0.2268429137479134,,,,,31,AZE,2020/03/15
Azerbaijan,3/16/20,28,3,,,5,,0.2761565906496337,,,,,31,AZE,2020/03/16
Azerbaijan,3/17/20,28,3,,,0,,0.2761565906496337,,,,,31,AZE,2020/03/17
Azerbaijan,3/18/20,28,4,,,0,,0.2761565906496337,,,,,31,AZE,2020/03/18
Azerbaijan,3/19/20,44,4,,,16,,0.4339603567351387,,,,,31,AZE,2020/03/19
Azerbaijan,3/20/20,44,4,,,0,,0.4339603567351387,,,,,31,AZE,2020/03/20
Azerbaijan,3/21/20,53,5,,,9,,0.5227249751582352,,,,,31,AZE,2020/03/21
Azerbaijan,3/22/20,65,5,,,12,,0.641077799722364,,,,,31,AZE,2020/03/22
Azerbaijan,3/23/20,72,5,,,7,,0.7101169473847724,,,,,31,AZE,2020/03/23
Azerbaijan,3/24/20,87,5,,,15,,0.8580579780899333,,,,,31,AZE,2020/03/24
Azerbaijan,3/25/20,93,5,,,6,,0.9172343903719977,,,,,31,AZE,2020/03/25
Azerbaijan,3/26/20,122,7,,,29,,1.2032537164019754,,,,,31,AZE,2020/03/26
Azerbaijan,3/27/20,165,7,,,43,,1.62735133775677,,,,,31,AZE,2020/03/27
Azerbaijan,3/28/20,182,8,,,17,,1.7950178392226193,,,,,31,AZE,2020/03/28
Azerbaijan,3/29/20,209,8,,,27,,2.0613116944919088,,,,,31,AZE,2020/03/29
Azerbaijan,3/30/20,273,9,,,64,,2.692526758833929,,,,,31,AZE,2020/03/30
Azerbaijan,3/31/20,298,10,,,25,,2.9390951433425303,,,,,31,AZE,2020/03/31
Azerbaijan,4/1/20,359,11,,,61,,3.540722001543518,,,,,31,AZE,2020/04/01
Azerbaijan,4/2/20,400,11,,,41,,3.945094152137625,,,,,31,AZE,2020/04/02
Azerbaijan,4/3/20,443,12,,,43,,4.369191773492419,,,,,31,AZE,2020/04/03
Azerbaijan,4/4/20,521,13,,,78,,5.138485133159256,,,,,31,AZE,2020/04/04
